"";"id";"userName";"userUrl";"version";"score";"title";"text";"updated";"url";"app";"wordCount";"language";"sentiment"
352;7212096532;"Mister mirZda";"https://itunes.apple.com/us/reviews/id107349719";"5.4";5;"Works Great!";"The app is very easy to use for controlling the robot, setting schedules & seeing your cleaning map (i3). Occasionally the status will show as “not connected” but if you simply wait a few seconds it always reconnects, so I don’t really see that as an issue. It is constantly moving around the house, so spotty WiFi is to be expected. It doesn’t affect the functionality of the robot. I’ve been very happy with the app and upgrading from my old Roomba to the i3.";"2021-04-11T17:10:03-07:00";"https://itunes.apple.com/us/review?id=1012014442&type=Purple%20Software";"1012014442";85;"en";"POSITIVE"
353;7166923751;"roomba lover!!!";"https://itunes.apple.com/us/reviews/id13366415";"5.4";5;"Love, love, love";"We had to vacuum our house at least two times per day due to the amount ofDirt and hair are children and animals seem to bring into the house. Since we purchased this iRobot, I have not vacuumed once! We have had it for over two months now and it is doing a fabulous job. It is so wonderful that if for some reason it broke tomorrow I would purchase another one immediately. I cannot say enough wonderful things about this product.";"2021-03-31T08:01:36-07:00";"https://itunes.apple.com/us/review?id=1012014442&type=Purple%20Software";"1012014442";82;"en";"POSITIVE"
354;7823770568;"Chloethecat100";"https://itunes.apple.com/us/reviews/id124836807";"6.0";5;"Great product";"I’ve been running roomba 960 for about 5 years once a week, picking up cat hair and litter for three cats.  Hardly ever gets stuck and the maintenance costs are low.  But my house is a mix of hardwood and tile floors.  Can’t  do carpet with the cats.

Over the years I’ve replaced the battery, extractors, brush assembly and front wheel.  Very easy to do.  Just need a few screwdrivers.  

Pair it were it’s a cordless vacuum and it makes life a lot easier than dragging the heavy canister around.";"2021-09-19T12:45:44-07:00";"https://itunes.apple.com/us/review?id=1012014442&type=Purple%20Software";"1012014442";90;"en";"POSITIVE"
355;6985155624;"livee5";"https://itunes.apple.com/us/reviews/id669097455";"5.3";3;"Love the vacuum but struggles to run scheduled programs";"The vacuum and app are both great....When they work that is. I run a scheduled program 4 mornings a week, in different rooms each day. 2 out of 4 days at minimum, the vacuum cancels itself before completing the program leaving half the programmed rooms not vacuumed.  It also will not empty its bin about half of the time, requiring manual emptying. Programmable schedules and self emptying were the features that I thought made this upgraded model worth the extra money, now I’m not so sure.  These problems  started about a year after owning the unit. Disappointing.";"2021-02-12T04:51:13-07:00";"https://itunes.apple.com/us/review?id=1012014442&type=Purple%20Software";"1012014442";97;"en";"NEGATIVE"
356;6687999930;"Dave804";"https://itunes.apple.com/us/reviews/id36333389";"5.2";4;"Nicely improving";"The app functions very well for most people. It’s clean simple and intuitive. With the recent additions of cleaning zones and no go zones the app has greatly improved. Just goes to show that Roomba is committed to improving their products. It looks like some people are having small issues that may turn out to be more user error than app error. I myself had a problem with the app being completely wiped from floorplans to schedules but the next day all of it was back. Strange but I’m happy it’s back.";"2020-11-26T07:00:53-07:00";"https://itunes.apple.com/us/review?id=1012014442&type=Purple%20Software";"1012014442";92;"en";"POSITIVE"
357;7569117722;"Deedee875";"https://itunes.apple.com/us/reviews/id206842250";"5.6";5;"My little helper";"I’m very pleased with Brava Jet. I use it to spot check/clean in between my deep cleaning Jobs which I do because I have grout. I can only imagine how easy my life would be if I didn’t have grout or thin grout lines like my daughter has (she loves it too!). The mapping Technology Is the best. I can name the rooms schedule certain rooms for different days love it.

I have Brava Jet and 2 Roombas one upstairs and one downstairs this app really helps because I can name them I make different schedules.";"2021-07-12T12:43:25-07:00";"https://itunes.apple.com/us/review?id=1012014442&type=Purple%20Software";"1012014442";96;"en";"POSITIVE"
358;7437853088;"Rumba's #1 Fan";"https://itunes.apple.com/us/reviews/id1280718477";"5.5";5;"Love my Robo";"I have my robo on a daily schedule.  We have a German Shepard and he can easily shed a new dog daily!!!  The shedding is out of control so my Rumba  is used for that main purpose and what a fantastic job it does!!!  If I didn’t have it I would definitely be vacuuming every day myself.
What wonderful technology....I’ve reordered the bags...brushes and side brushes and have been very satisfied with everything.  Customer Service has been very helpful the one time I needed a question answered.";"2021-06-07T09:29:35-07:00";"https://itunes.apple.com/us/review?id=1012014442&type=Purple%20Software";"1012014442";87;"en";"POSITIVE"
359;2693977669;"Ces999";"https://itunes.apple.com/us/reviews/id120412373";"2.7.0";5;"Why didn’t I know sooner?";"Firstly, I was the most skeptical person of this little machine.  After “James” has worked for me now for a while, I’m not sure how I ever lived without his services!
He does a better job than I do.
I still feel like someone comes in at night and dirties my floors intentionally because the thought of living with all that he picks up on a daily basis, considering I only vacuumed twice weekly is appalling!
Do yourself a favor and invest.  You won’t be sorry!! This is the best appliance in my now clean home!!";"2018-06-14T08:59:51-07:00";"https://itunes.apple.com/us/review?id=1012014442&type=Purple%20Software";"1012014442";96;"en";"POSITIVE"
360;7294914361;"Meg.Oh";"https://itunes.apple.com/us/reviews/id1285694437";"5.4";4;"Mostly love it";"I mostly love my roomba and the app. There’s been a few oopsies on our part as owners such as a dog “going” on the floor and the roomba was running before we realized it and well we had a mess on our hands. When it comes to the iRobot app, the only thing I wish was better is it seems to be “unable to connect” quite often which can be frustrating but overall I recommend both the product and the app to others. It’s certainly saved my sanity with two German shepherds and two cats.";"2021-05-03T16:38:17-07:00";"https://itunes.apple.com/us/review?id=1012014442&type=Purple%20Software";"1012014442";96;"en";"POSITIVE"
361;7082086116;"CG......";"https://itunes.apple.com/us/reviews/id552085755";"5.3";1;"Worked Great for 12 Months - Now Very Erratic Performance...Do not buy!";"I don’t know if it is the app or the machine, but after 18 months my Roomba I-7 is barely functional. I am diligent about maintenance however it constantly is telling me to clean the contacts and the Home Base window. It also fails to clean its bin, saying bin sensors are dirty. They are not dirty. The app used to have an “Empty Bin” button for manually activating the Clean Base. This button no longer appears on the app dashboard. 
It is very frustrating that for $1,200 this machine, which worked very well for about 12 months, has so miserably failed to function. 
Definitely recommend against buying until these longevity issues can be fixed.";"2021-03-08T22:01:20-07:00";"https://itunes.apple.com/us/review?id=1012014442&type=Purple%20Software";"1012014442";115;"en";"NEGATIVE"
362;6729220944;"slowsnowbird";"https://itunes.apple.com/us/reviews/id43859204";"5.2";2;"Can not switch accounts in app or allow more than one user to control the robot.";"Although the app improved with the new braava jet m6 but it now only allows only one user account to control a robot. This is a failed assumption, normally there are more than one person in a household. There’s no way to switch accounts except when trying to add a robot that is first paired by another phone.
A suggestion is to have a link to allow switch accounts.
Another way is allow setting up sharing with authorized users.
Please update the app as soon as possible. Or, I would suggest to take out one more star.";"2020-12-07T19:36:15-07:00";"https://itunes.apple.com/us/review?id=1012014442&type=Purple%20Software";"1012014442";97;"en";"POSITIVE"
363;6442877671;"cns1008";"https://itunes.apple.com/us/reviews/id34981479";"5.0.1";3;"Editing issues";"We have had the iRobot 8 for several weeks and the app seems a bit flakey. We have the app installed on our iPad and iPhone and have the same issues on both. If you want to edit or delete a schedule, clicking on the pencil in the upper left of the schedule box simply closes the app all together. 
The only way I have found around this is to turn off the event and make a new one. 
The app also shows the iRobot as “not connected” all the time when it really is. The iRobot’s is super close to the router so I’m not sure what to make of that.";"2020-09-18T12:42:18-07:00";"https://itunes.apple.com/us/review?id=1012014442&type=Purple%20Software";"1012014442";112;"en";"POSITIVE"
364;6160530766;"ncamarda";"https://itunes.apple.com/us/reviews/id399312585";"4.8";1;"App crashes when trying to change room borders";"Please fix the bug which occurs when trying to edit room borders. My app completely freezes and then crashes, and I end up having to 1) delete the smartmap and 2) redo multiple training runs which takes forever. Please contact me so that I may help you submit a bug report if you need. I will change to five stars once this is fixed because this is literally the only thing I am unhappy about with this app. Everything else works flawlessly (scheduling, notifications about roomba cleaning progress or bin status, etc)

The robot itself works great - this review is concerning the flawed room border adjustment in the app";"2020-07-05T07:22:42-07:00";"https://itunes.apple.com/us/review?id=1012014442&type=Purple%20Software";"1012014442";110;"en";"POSITIVE"
365;8002652541;"busywerkinmom";"https://itunes.apple.com/us/reviews/id116043313";"6.1.1";5;"Where has this been my whole life???";"I was super skeptical of this machine. I thought there was no way it would have the sucking power as my Dyson V11 animal vacuum. This has saved me so much time. It leaves zero dirt behind. It runs beautifully and the battery has a pretty good life. I love how it empties itself. It is very self sufficient. I wish I had gotten it years ago. Our house is about 4,200 sq ft and it usually takes 8 hours to vacuum/charge the entire thing.";"2021-11-08T08:43:03-07:00";"https://itunes.apple.com/us/review?id=1012014442&type=Purple%20Software";"1012014442";85;"en";"POSITIVE"
366;8016147065;"GM Hopkins";"https://itunes.apple.com/us/reviews/id192061205";"6.1.1";2;"Plagued with problems";"The Roomba constantly loses Internet connection, frequently needs to be rebooted, and often simply won’t reboot. We have had to start from scratch numerous times and customer service has not solved the problems.

The actual cleaning is mediocre. The rumba is in capable of vacuuming hair or crumbs on rugs. It will vacuum repeatedly over the same area while missing others. There is nothing systematic about its routing. If there is a way to instruct it to vacuum a particular room only without physically bringing it there, we have not found it

Overall, it falls far short of the manufacturers promises and our expectations.";"2021-11-12T07:00:34-07:00";"https://itunes.apple.com/us/review?id=1012014442&type=Purple%20Software";"1012014442";104;"en";"POSITIVE"
367;7928849300;"MeasurementsMatter";"https://itunes.apple.com/us/reviews/id34354397";"6.1";5;"Well designed app with sensible options";"The hardware is great, and has been for five years. The app also has sensible options. I enjoy the ability to choose either deep clean or single pass. We now have a dog, and with all of the hair, I’d rather do the whole house once, but multiple times a week rather than a super clean on one day which would then take too long to make it to the all of the rooms. 800 square feet of cleaning in one floor.";"2021-10-18T11:51:10-07:00";"https://itunes.apple.com/us/review?id=1012014442&type=Purple%20Software";"1012014442";82;"en";"POSITIVE"
368;7889401432;"El Guapo ✔";"https://itunes.apple.com/us/reviews/id29342628";"6.0";5;"Works great, no issues, seamless configuration!";"I own a Roomba 960 and a 980. I had absolutely no problems setting up these two units. The app works perfectly. I do not understand how anybody could've had any problems with this configuration. I found it very easy and seamless. When I spoke with customer service to inquire about the scope of the warranty, they were extremely professional and courteous, truly among the very best customer support operations that I've ever encountered.";"2021-10-07T15:10:00-07:00";"https://itunes.apple.com/us/review?id=1012014442&type=Purple%20Software";"1012014442";74;"en";"POSITIVE"
369;7343677209;"twiggtam";"https://itunes.apple.com/us/reviews/id1043671017";"5.5";5;"I was skeptical";"I really wanted the iRobot to work for us. We have plenty of pet hair, I left the box sit on the fireplace hearth for two weeks. Once we got our “cookie” on a regular schedule it has been amazing. The bin emptying is such a great feature. Needless to say, the box is gone and cookie is a part of our family, the dog and cats have adjusted well. What a wonderful feeling it is to come home and it feels like the cleaning crew that Covid interrupted was back. So glad we took our sons advice.";"2021-05-15T16:40:26-07:00";"https://itunes.apple.com/us/review?id=1012014442&type=Purple%20Software";"1012014442";98;"en";"POSITIVE"
370;7335466728;"bradskiddy";"https://itunes.apple.com/us/reviews/id121334753";"5.5";5;"Awesome little helper";"6 months and no problems, it’s a really great sweeper, set it to run every other day and use your dyson or broom once a week. It’s does a good job but corners and some other areas it just can’t get to. It really does save you from having to sweep several times a week. We Let it take care of the floors during the week and on Saturday we will usually give it a good vacuum with our Dyson and then gave the floors and mopping. Have no regrets for buying it.";"2021-05-13T16:46:54-07:00";"https://itunes.apple.com/us/review?id=1012014442&type=Purple%20Software";"1012014442";93;"en";"POSITIVE"
371;6720531947;"housewifw667";"https://itunes.apple.com/us/reviews/id686443659";"5.2";5;"Roomba";"So disappointed with this updated app. It does not recognize my WiFi. No matter how many times I redo the app. So I went to factory reset.  And I can get nowhere. I have deleted and reopened app to no avail. Now all I get is “robot not found “ very very disappointed. Please find and fix the problem or at least more than one option on app available for iRobot

After several days of taking off app and re applying. Today the app connected to my roomba. 🙂";"2020-12-05T08:22:47-07:00";"https://itunes.apple.com/us/review?id=1012014442&type=Purple%20Software";"1012014442";89;"en";"NEGATIVE"
372;6746204682;"NedGrimley";"https://itunes.apple.com/us/reviews/id18815451";"5.2.2";2;"What’s up with Wifi connectivity?";"Just unboxed a brand new i3+. Went through the setup process multiple times. The robot told me it was connected but the app said it wasn’t and would not allow me to proceed. Sat on hold on the phone waiting for tech support for 40 minutes while I tried everything. Eventually, I tried accessing my 2.4g network rather than the 5g. Connected right up. At this price, why does it not function with 5g?? And why not at least put that little tidbit in the initial instructions to save a lot of headache. I’ll try it far a while and see if I come back for a change of stars or not..,";"2020-12-12T11:49:58-07:00";"https://itunes.apple.com/us/review?id=1012014442&type=Purple%20Software";"1012014442";112;"en";"POSITIVE"
373;7252118234;"Short-Hair Pointer (dog) owner";"https://itunes.apple.com/us/reviews/id1013230396";"5.4";5;"Does a great job";"The instruction manual left a lot to be desired; just be patient and do a mapping run a couple of times.  After 2 weeks I have my floor plan mapped, my rooms labeled and my oriental carpet marked as a clean area.  The Robot has not damaged this expensive carpet and it finally looks as clean as when it was new (all dog hair has been removed).  “Hilda” has cut my cleaning time in half: I de-clutter and dust while it sweeps.  It does a great job of keeping my floors looking like the cleaning lady just left.";"2021-04-22T12:53:58-07:00";"https://itunes.apple.com/us/review?id=1012014442&type=Purple%20Software";"1012014442";98;"en";"POSITIVE"
374;4869820369;"Vblnm";"https://itunes.apple.com/us/reviews/id103000439";"4.2";4;"Apple Watch app please!!";"I love my roomba. I just let it run while I’m home and it helps with the cat hair and dust so much! My only qualm with the app is that it doesn’t have an Apple Watch version. I would love to see one because when I’m home I don’t keep my phone on me. This means that if the roomba is in distress I have to physically hear it beep so I can unstick it. With an app for the Watch I could receive notifications on my wrist, and start and stop it from my wrist, including giving it the dock command. It seems silly, but it would make a great experience even better!";"2019-10-01T09:18:59-07:00";"https://itunes.apple.com/us/review?id=1012014442&type=Purple%20Software";"1012014442";115;"en";"POSITIVE"
375;7821279778;"IFSRAJ";"https://itunes.apple.com/us/reviews/id476966138";"6.0";1;"Underdeveloped App";"I have been using Roomba I-7 and Braavo Mop for more than 18 months. However, the app has been giving me so much trouble logging in. Every time the app is updated, it will log me out and neither allow back log in nor allow reset password. For last 3 days I am unable to use these machines. 

Last time called customer care, they took 3 days and could not figure out what’s wrong with account. However, I myself figured out the issue. This time that too not working. Wasted so much of time. Don’t feel like talking to customer care because I know they will take he’ll lot of time to figure out what has been the issue. Feel so helpless and pathetic 😞";"2021-09-18T21:44:20-07:00";"https://itunes.apple.com/us/review?id=1012014442&type=Purple%20Software";"1012014442";125;"en";"NEGATIVE"
376;7816401587;"4grandslams";"https://itunes.apple.com/us/reviews/id149068924";"6.0";3;"NOT THAT SMART Ai";"The user interface is in need of improvement. Also the application needs to be able to re-discover rooms because it has forgotten half of a room that it already mapped. It will not return to that area and will not re-discover it. The app is also very cryptic on its communications when there are issues or when it gets trapped under furniture and can’t figure out how to get out. The battery dies and then you have to figure out where it is. The bottom line, the software needs to be a lot smarter and a lot more user-friendly";"2021-09-17T11:43:32-07:00";"https://itunes.apple.com/us/review?id=1012014442&type=Purple%20Software";"1012014442";99;"en";"POSITIVE"
377;7799237147;"norcalsal";"https://itunes.apple.com/us/reviews/id32939891";"6.0";4;"Good machine to help out";"Had it for around a year, use it regularly and it does quite well! I prep the room like tucking cords in, moving clothes or objects off the floor so it can do it’s thing without issues. The downsides are that the filters need replaced pretty frequently. I’d love a filter I could wash instead of generate trash. The small bin size is ok for me since I’m around to dump it as needed. I will still vacuum the tough spots- between a rug, wood floor and kitchen tiles since a piece of moulding prevents good suction there. I’ve found it helpful overall.";"2021-09-12T10:24:44-07:00";"https://itunes.apple.com/us/review?id=1012014442&type=Purple%20Software";"1012014442";103;"en";"POSITIVE"
378;7551713030;"Lazy Lady 1";"https://itunes.apple.com/us/reviews/id128174790";"5.6";3;"IRoomba Vacuum";"My vacuum no longer recharges fully between heading out to the various parts of the home. Sometimes instead of returning to recharge it just runs out of juice and I have to carry it back to home base to recharge! Then, it thinks it’s done, and gives me the end of job signal. Then once it recharges, I have to carry it down to the far end of house and close the door so it will stay vacuuming the last two rooms. I think it only worked right a couple of times in a year and a half. It was a gift so I continue to use it weekly. Needs improvement.";"2021-07-07T20:42:23-07:00";"https://itunes.apple.com/us/review?id=1012014442&type=Purple%20Software";"1012014442";111;"en";"POSITIVE"
379;2599421083;"Stamper J";"https://itunes.apple.com/us/reviews/id622806891";"2.7.0";5;"$900?! Yes, and worth it.";"Bought the 980 because of positive feedback about Roamba from friends and online and the 980s power in particular. Was doubting myself when checking out because of how expensive it is but after 2 weeks I can’t deny it works like a charm. Hits the edges and corners and goes under, over and around intuitively. If you have extra time to spare don’t bother but if you have limited spare time due to family, other activities pull the trigger you won’t be disappointed.";"2018-05-26T08:40:37-07:00";"https://itunes.apple.com/us/review?id=1012014442&type=Purple%20Software";"1012014442";83;"en";"NEGATIVE"
380;6765384318;"Becky2259";"https://itunes.apple.com/us/reviews/id203302750";"5.2.3";1;"App says I’m not online yet I clearly am";"On my S-9 I set it to clean at high power in settings but next time it goes out it reverts to the medium setting. I bought this thing so I could have the high level cleaning....also I used to be able to set it to do a light cleaning of certain rooms on certain days and a detailed clean on other days and now I can not do that plus it keeps reverting to the middle custom setting. 

iRobot sent another one and it's doing the same thing. I'm not going through anymore with irobot but this thing worked perfectly till summer when you screwed up the app and made it so I could not use the robot the way it was advertised to work. I was assured a work around would be rolled out for this but it's been this way since I think July. 

I've had iRobot products for at least 15 years, probably a dozen or more in all. This is the first time I feel like Irobot has taken a great product and made it worse. What is the point of having the high power vac if I can't use it on that setting. 

FIX IT";"2020-12-17T20:58:07-07:00";"https://itunes.apple.com/us/review?id=1012014442&type=Purple%20Software";"1012014442";201;"en";"POSITIVE"
381;2320298690;"Antonator1";"https://itunes.apple.com/us/reviews/id36476500";"2.6.1";5;"Dust bunny extinction";"Our Roomba 960 is perfect. We named him Floyd.  He goes from hard woods, to area rugs, to wall-to-wall carpet and to tile with ease.  No kamikaze dives off the stairs or ledges.  Dust bunnies are extinct, especially under our beds.  Only trace of our chocolate lab is the actual lab and not her fur.  Floyd is a great addition to our family.  His clean-up maps of rooms are great too.  WiFi lets him start when we are gone and he tells us when he is done.  Don’t go for substitutes.  Get your own Floyd, who will bravely go to the dark sides of your rooms.";"2018-03-18T10:29:03-07:00";"https://itunes.apple.com/us/review?id=1012014442&type=Purple%20Software";"1012014442";106;"en";"POSITIVE"
382;7884425572;"happy at hime";"https://itunes.apple.com/us/reviews/id929129157";"6.0";5;"My home";"I received my IRibot for Christmas 2020. I use it in my open floor plan 2450 square ft apartment with both carpet and hard floors, I have no children left at home but do have a cat and a husband ( not sure which is messier)I have it programmed to vacuum three days a week and WOW what a difference in how clean my floors stay!!!!! I love it and would be heartbroken if I needed to ouch a vacuum around again! My Christmas list for this year only has on thing on it , an IRobot mopping system !!!!";"2021-10-06T06:05:54-07:00";"https://itunes.apple.com/us/review?id=1012014442&type=Purple%20Software";"1012014442";100;"en";"POSITIVE"
383;4786984410;"MiklaDfar";"https://itunes.apple.com/us/reviews/id130831087";"4.2";5;"Amazing technology";"Given my degree and 40 years of experience working with advanced technology, including autonomous flight systems, this software and associated hardware (robot) system are some of the most impressive technology I have seen. Extremely easy to use and gets the job done. There are a few features I would like to see, like allowing remapping a room without having to create a new total map, but the features it does have work extremely well.";"2019-09-15T14:06:17-07:00";"https://itunes.apple.com/us/review?id=1012014442&type=Purple%20Software";"1012014442";74;"en";"POSITIVE"
