"";"id";"userName";"userUrl";"version";"score";"title";"text";"updated";"url";"app";"wordCount";"language";"sentiment"
78;1957845864;"forwaters";"https://itunes.apple.com/us/reviews/id230319309";"2.5.0";4;"Great product";"I have a Roomba 960, and use the iRobot Home app.  The 960 works wonderfully, and the app is a good feature.  Having said that though, I do wish the app was able to do more.  With the older Roomba’s one could just pick the robot up and place it in a specific area if you wanted that area cleaned a bit better.  The newer models “know” where they are though, and you aren’t supposed to pick them up and place them someplace new.  I like that the robot knows where it is, and is cleaning based on that knowledge, but if I want the little guy to go back over an area, the only choice I have is to tell it to clean (everything) again.  Here are two suggestions a) allow the owner to drive the robot to a specific area via the app, or b) even better, allow the owner to pinpoint a specific spot, or area on the map created by the robot.";"2017-11-29T09:21:47-07:00";"https://itunes.apple.com/us/review?id=1012014442&type=Purple%20Software";"1012014442";166;"en";"POSITIVE"
79;7812233204;"SLP52";"https://itunes.apple.com/us/reviews/id668390053";"6.0";5;"Roomba i7";"We have no small children anymore, no pets anymore, and the 2 of us are not prone to creating messes. Our Roomba has been a wonderful help to us. We both have back issues. Once a week we send our robot on a mission to clean the floors. So far, so good. 
I think the best help advice we received was to take the time to send the robot on mapping missions. After 3 mapping runs, the robot established a whole house map. I easily labeled the rooms. Now, I am able to specify the rooms I want vacuumed, in the order I’d like the rooms vacuumed. 
We have thoroughly enjoyed the Roomba i7. We do not have a cluttered house so room prep is not an issue. 
I would recommend this vacuuming robot. 
(Now, if the inventors could figure out how to teach it to dust…!)";"2021-09-16T07:13:58-07:00";"https://itunes.apple.com/us/review?id=1012014442&type=Purple%20Software";"1012014442";147;"en";"POSITIVE"
80;7319732885;"fanningd";"https://itunes.apple.com/us/reviews/id35889439";"5.5";4;"I love my Roomba!";"As a new mom I absolutely love my Roomba! It cleans amazingly! I have wall to wall polished concrete floors with area rugs scattered throughout. It makes them feel so clean. I can schedule it and go on about my day. It makes life so much easier. Only thing I don’t like is that it can never clean without having to stop and recharge. It will say the job is estimated to take 55 mins for three of my rooms (not even close to the whole house) and it will still have to dock and recharge to finish. I typically do a quick walk around before scheduling any jobs just to make sure it doesn’t get caught up on anything (dog toys, baby clothing/toys, socks, ect.) ultimately I love it so much I would hate to go without I just wish it would be able to get in and finish and not have to dock every time to charge.";"2021-05-09T18:27:59-07:00";"https://itunes.apple.com/us/review?id=1012014442&type=Purple%20Software";"1012014442";159;"en";"POSITIVE"
81;7584203095;"Janravg";"https://itunes.apple.com/us/reviews/id335569838";"5.6";4;"Cleaning personalized.";"This app has given me the piece of mind in making sure that my house is cleaned properly. It also allows me to customize cleaning zones, times, schedules and create favorites. I have connected my Roomba i6 to my google home and it helps me control the Roomba with voice command. 
I would love for this app is to show me where my roomba is cleaning presently. There is no way of finding that out unless in person or until after the job is completed. Also, at the beginning there is no indication that in order to show a map of the house, it needs to complete 2 runs. I thought my roomba wasn’t doing it’s job and was about to give up on it. It would have been nice if there was a way for the app to allow a step by step mapping of the house. 
Altogether an amazing app.";"2021-07-16T12:47:25-07:00";"https://itunes.apple.com/us/review?id=1012014442&type=Purple%20Software";"1012014442";152;"en";"POSITIVE"
82;7285259989;"Reclusegraal";"https://itunes.apple.com/us/reviews/id364393389";"5.4";4;"Suggestion";"I really love my s9 mop and vacuum but I wish there was an option/upgrade to the system that would allow the user to override the robots mapping. 

My mop is placed in the living room which has a wood transition that’s apparently more than 3mm high. Because of this it will go halfway up it then stop because it thinks it’s a carpet or something. I wish there was a way to tell it to continue over it. Also, it for some reason won’t go to a corner of the living room, it always stops and turns around before making it to that area. 

I think I’m the mapping system my vacuum has gotten almost all the areas so I feel like there should be a way to take that map and edit it to work for the mop as well so it’s programmed to know where it can basically “follow” the vacuum";"2021-05-01T07:33:08-07:00";"https://itunes.apple.com/us/review?id=1012014442&type=Purple%20Software";"1012014442";154;"en";"POSITIVE"
83;7736881128;"Signings";"https://itunes.apple.com/us/reviews/id122370774";"5.7";5;"Great product for blind people";"I have had the robot vacuum cleaner since they first came out. The first ones were totally abysmal because it was no way I could find it once it was gone. Once its battery was dead. The second one was better I was able to find that one because it would go back to its charging dock that I got the third one is great because I can actually with the help of a sighted person doing the map target certain rooms in certain places in my home. The one thing that you did to help me is that you actually made the battery status available for me to see or actually here. It now says if it’s medium low full charge whatever this is great. Please keep accessibility";"2021-08-26T06:30:49-07:00";"https://itunes.apple.com/us/review?id=1012014442&type=Purple%20Software";"1012014442";129;"en";"POSITIVE"
84;7654190641;"thompsons beach house";"https://itunes.apple.com/us/reviews/id402388369";"5.7";4;"Rough start but now love it";"We started off for a little rocky. Our first vacuum couldn’t keep a connection to our Internet for more than a few minutes. And because of some difficult software, reconnecting it was always a pain. After a few weeks it stopped connecting at all and we returned it to Costco and got a new one. While customer service was being helpful with our issues, getting them to admit we just had more then a internet problem was difficult.  We’ve now had the new one for six months it’s never lost connection it has been working so well we upgraded to the irobot 6.  We now have one on each floor of our house and they do a great job. We have a dog that sheds so upgrading to a basket that empties was a game changer for us.";"2021-08-04T06:35:01-07:00";"https://itunes.apple.com/us/review?id=1012014442&type=Purple%20Software";"1012014442";138;"en";"NEGATIVE"
85;8106801139;"Regi's Mom";"https://itunes.apple.com/us/reviews/id498817813";"6.2";3;"Not consistent";"When my robot, Reginald, is working well, everything is great. However, when he’s not, anything can happen. Examples:

     1. Says he’s charging, but isn’t. 
     2. Does not connect to Wifi, so I 
          can’t talk to him. 
     3. Has trouble docking. 

To get him to charge, I have to wiggle him around on the connectors until it works. Sometimes that takes awhile. Not only is that making more work for me, but it also means if I’m not home when he stops to recharge during cleaning, he can’t finish the job because he times out. 

When not connected to Wifi, it can be several hours to several days before suddenly connecting again. We have checked the Wifi and nothing else in the house is having problems. 

Docking is just a mystery. When working 
right, he’s perfect. But he can sometimes end up in the strangest places, and just stops. Moving the dock to a different place has not helped, and neither has providing more light. 

I sent him in to be fixed once. He might be a little better, but it’s hard to tell, since it is all  sporadic. 

Well, you asked. Sorry to write a book, but any help we can get would be appreciated. I LOVE my robot, when he’s being cooperative! Thanks for listening.";"2021-12-07T20:32:11-07:00";"https://itunes.apple.com/us/review?id=1012014442&type=Purple%20Software";"1012014442";216;"en";"POSITIVE"
86;7591313435;"32Chad";"https://itunes.apple.com/us/reviews/id473340389";"5.6";5;"Roomba with base";"We live on some land in the country with 3 large dogs that constantly shed.  Our home has stained concrete floors with a few rugs.  We’ve had our i7 Roomba with base for almost 2 years and it’s setup to clean daily.  It does get stuck here and there. We have to routinely clean the main rollers, brushes and dust bin.  The regular maintenance and upkeep is 100% absolutely worth it.  Our floors are always clean especially the dirt and sand tracked in by our dogs. I love being able to use the app to sweep specific areas.  I love being able to setup “keep out zones” during Christmas to keep the Roomba away from the Christmas tree.  We will never go without our Roomba ever again.  I tell every person I know how well it works!";"2021-07-18T10:26:46-07:00";"https://itunes.apple.com/us/review?id=1012014442&type=Purple%20Software";"1012014442";137;"en";"POSITIVE"
87;7120688781;"1toughcowgirl";"https://itunes.apple.com/us/reviews/id216192421";"5.4";5;"Love. IRobot!";"I have had an iRobot for at least 10 years.  I have the 500 pet series. It was my first. I just got the 900 with the emptying bin and I love it!  The 500 did a good job for many years and I still use it in my office.  I’ve replaced pretty much everything on it. So easy!!  If I could replace the motherboard I would!  The 900 is definitely a superior machine.  It maps out the rooms and stays on schedules.  I can block off areas for my Christmas tree and all that through the app.  I love it.  My only complaint would be the bag.... I wish it was reusable.  I also just got the brava jet and it is ok for a mop.  I use it 3 times a week and it does a decent job cleaning little messes and spots on the floor which is all I expect it to do.";"2021-03-19T08:58:24-07:00";"https://itunes.apple.com/us/review?id=1012014442&type=Purple%20Software";"1012014442";156;"en";"POSITIVE"
88;7593999188;"KimberbeeTX";"https://itunes.apple.com/us/reviews/id183382123";"5.6";3;"Like braava and roomba. Not automatic empty";"I’ve had a roomba for about 8 years, the 880 model. It was great but not the most powerful motor for carpet.  I got the i3+ and braava.  We do have a dog, that accounts for a great deal of the vacuuming.  The dirt reservoir on the i3 is smaller than that of the 880 but the suction is better.  The automatic self emptying function is likely great for those without pets. This function has clogged every time but one in the several weeks we’ve had it (almost daily cleaning).  I would rather not have the self emptying feature and have a larger dirt reservoir.  I find the rollers harder to remove than on the 880.   I was shocked by how much I like braava. It does a good job.  I was worried it would spray the base of the cabinets, but it doesn’t.    Overall pleased but some new “features” are frustrating.  I with I got the i7 instead of the i3+.";"2021-07-19T05:05:26-07:00";"https://itunes.apple.com/us/review?id=1012014442&type=Purple%20Software";"1012014442";162;"en";"POSITIVE"
89;7170516482;"Lovegirl05431";"https://itunes.apple.com/us/reviews/id143452340";"5.4";3;"Needs constant attention";"It helps keep the dog hair from accumulating on the hardwood floors. You can definitely tell the days it does not run vs when it completes its rounds. The big problem is it’s always needing some kind of attention. I gets stuck, runs something over, gets jammed, the sensor gets dirty, or it needs its bin changed. It is not capable of running autonomously every day. I find that if I factory reset it every 3 months it does better. The map feature is good but once it’s done “mapping” it will sometimes choose to not go to places. It’s not the end of the world that it needs attention constantly since we have teenagers to help do it but if it was just me I would have thrown it in the garbage by now. It’s also of note that it is now named “Karen” by my kids because it’s always complaining about something. Haha";"2021-04-01T04:56:33-07:00";"https://itunes.apple.com/us/review?id=1012014442&type=Purple%20Software";"1012014442";155;"en";"POSITIVE"
90;7030632607;"RobTony715";"https://itunes.apple.com/us/reviews/id226910900";"5.3";5;"Great App. Great Product.";"The App works great!! Enough said. It has, almost everything. My only complaint / desire is it needs a toggle feature that allows you to adjust the suction power to a lower setting for times when you are home. The vacuum can be a bit louder then anticipated and compared to my last robot vacuum. I used to have a shark and I know they had an Eco mode (quieter and longer lasting), normal mode and some sort of extra power feature. We could usually switch to eco if the volume bothered. Hope to see a feature like this in the future. I do like the automation though but I still have trust issues running the vacuum to often with out anyone nearby. You know, fires and all that stuff.";"2021-02-23T14:49:52-07:00";"https://itunes.apple.com/us/review?id=1012014442&type=Purple%20Software";"1012014442";130;"en";"POSITIVE"
91;2950908735;"Chatterbox815";"https://itunes.apple.com/us/reviews/id180080527";"2.7.1";5;"I robot";"Love it, it has made my life a ton easier. I have mostly hardwood floors and 1 room with carpet.. it nice because this does both kinds of floors.. it helps control all the foot traffic in the house along with the dog hair from my 2 dogs...  I’ve named it Cookie Monster because my grand kids love cookies and this machine picks up the crumbs... the phone app is great because I’m outside a lot and I can check to see if it got stuck anywhere or if it’s charging etc without having to go hunt it down. I can also start it when I’m away from home.. I’m not big on computer etc, but this app is easy to figure out and set up cleaning schedules without finding where I put the manual every time it has a problem.. can’t say enough about this product love love it!!!";"2018-07-22T15:15:48-07:00";"https://itunes.apple.com/us/review?id=1012014442&type=Purple%20Software";"1012014442";150;"en";"POSITIVE"
92;6937752897;"Bkat12345293";"https://itunes.apple.com/us/reviews/id27729220";"5.2.3";4;"Like it. Love it. Could continue to get better.";"I would really like to see an app update that shows time to full charge on the Roomba and also an actual battery % rather than a generic battery charge icon. 

Also some kind of tolerance level for the Roomba to give up when it faces an obstacle would be cool. I’ve watched mine occasionally struggle moving from wood to carpet to brick or getting stuck on a stray article of clothing on the floor. Would be nice if I had a setting to say ‘power through it’ or ‘back off if it’s particularly annoying obstacle’ etc. 

I’m new to the Roomba family. So far so good. It’s act better than good I love it. I have three kids under 8 years old and two cats. Between the cat hair and crumbs from the kids the Roomba dames me from vacuuming everyday myself.";"2021-01-31T13:14:07-07:00";"https://itunes.apple.com/us/review?id=1012014442&type=Purple%20Software";"1012014442";143;"en";"POSITIVE"
93;6477819427;"Fuzzy-Wazzy";"https://itunes.apple.com/us/reviews/id103855050";"5.0.1";3;"Rating the New App";"My intent is to give feedback on the new iRobot app and can find no other place to do it except here. I love the product and for the most part the app is fine. The deficiency in the app that I see is on the scheduling side. The creators of the app will not allow the user to turn off a schedule time without it being erased from the app. Because of my dynamic household (as in living), my preferred times for running the cleaner varies from week to week. This requires me the annoying task of having to start with a pre-programmed schedule of three days and begin the process of eliminating their pre-program settings. Ideally, the App would allow the user to turn off a scheduled cleaning without it being erased. This would allow me the ability the next week simply to press one button and be done with it.";"2020-09-28T07:58:30-07:00";"https://itunes.apple.com/us/review?id=1012014442&type=Purple%20Software";"1012014442";153;"en";"POSITIVE"
94;7280505886;"HoughtonCanal";"https://itunes.apple.com/us/reviews/id163657628";"5.4";5;"Why did I wait so long";"A better cleaner than I expected.  Be patient in the beginning, run the mapping runs and just let her do her thing.   With regular runs, I find I don’t need to supplement vacuuming hardly at all.  
I use on hard floor, carpet and floor rugs.  She handles everything well except for bathroom throw rugs so I just pick those up. 
Getting the model with mapping is so worth it.  I love just sending her to clean a room. 

My original vacuum had a computer problem so iRobot replaced it.  Unfortunately it was back ordered so I gad to wait a month.  They were very generous about what they offered me for my trouble.  Thus time without the robot really made me realize how much I missed her and her daily cleaning.";"2021-04-30T04:10:26-07:00";"https://itunes.apple.com/us/review?id=1012014442&type=Purple%20Software";"1012014442";131;"en";"POSITIVE"
95;2076497796;"HappyHalligan";"https://itunes.apple.com/us/reviews/id30306834";"2.5.0";3;"Good Could Be Better";"The overall design and layout of the app as to the GUI is perfect don’t change a thing. However I think there are some easy customizable things that could be done easily and make the app even better.

Ex) The schedule:
            Right now you only have the option of telling it to work on an exact day Sun-Sat. That works great for some people but not everyone. I work for the fire department and my schedule while routine and regular does not follow a normal week. This is true of many people in similar fields; Police , EMS, hospitals.
             It would be GREAT! If we could set it to clean every X number of day starting on Y calendar date. And another way in addition would have it pull up an actual calendar and let you check mark the days you want it to clean in a month not just week. Basically would like to have more scheduling options.";"2018-01-10T13:49:54-07:00";"https://itunes.apple.com/us/review?id=1012014442&type=Purple%20Software";"1012014442";159;"en";"POSITIVE"
96;6815453859;"mluck94";"https://itunes.apple.com/us/reviews/id533432506";"5.2.3";3;"Good vacuum, crappy app";"Every time I want to use the app it tells me to physically go to the Roomba and hold down the home button (on the Roomba, not the iPhone) for 2 seconds, then it connects. Every. Single. Time. I have to do this process. That defeats the entire point of the app. I should be able to just open the app and tell it to start cleaning. If I have to hit buttons on the robot first I may as well never use the app. I can’t believe this is how it’s supposed to function so maybe I have a defective unit?

Edit: I managed to get the Roomba to connect by configuring it with static IP information and using Google DNS. Don’t know why it can’t work with DHCP when everything else in my house does...but there ya go. I’ll up my review to 3 stars but that definitely needs to be rectified because most people don’t even know what IP address means.";"2020-12-31T12:31:49-07:00";"https://itunes.apple.com/us/review?id=1012014442&type=Purple%20Software";"1012014442";164;"en";"POSITIVE"
97;6030517661;"Dru1424";"https://itunes.apple.com/us/reviews/id350209621";"4.7.1";2;"Robot is great the app needs work";"I love the robot. The app needs quite a bit of work. When looking at my cleaning history it gives the options to update the smart map. However, if the app feels like the map is out of date it will not let you update the existing map. I don’t care what the app/robot think. That is the map I’d like to use so please allow the option to update a map if I so choose. As for the smart map features, there needs to be an option to draw in/delete actual portions of the home that the robot won’t acknowledge.  Example: my map shows a walkway from my dining room to the bathroom that does not exist. No amount of training runs will fix this. Also, training runs should still be an option once a map reaches “100%.”  

Tl;dr: the app needs lots of new features to give complete control. The robot’s actual ability to clean is very good.";"2020-06-03T08:43:26-07:00";"https://itunes.apple.com/us/review?id=1012014442&type=Purple%20Software";"1012014442";160;"en";"POSITIVE"
98;7412534564;"Squishy464";"https://itunes.apple.com/us/reviews/id120907986";"5.5";2;"It’s a good toddler, or worse....";"After 3 weeks with it we already had to replace the rollers because the bearings quit. That was real cool. Now it’s just loud every time we run it. It’s seriously like another child. I have to follow it to make sure it does what it’s supposed to do. All that said....I do love it, but more like a family member you’re supposed to love. I have a name for it and it’s like one of my kids. It’s like Pac-Man eating the crap my kids leave behind. I wish it would have better rollers. The fact that it gets everything stuck in it really isn’t easy on the normal consumer. I do not want to continually replace the rollers after I spent X amount on a robot vacuum. I find that to be the big money maker for this company....let’s make cleaning easy, but not care about the parts that will not make life easy for the owners of these! I have the i3, I wish I just had an anteater!!";"2021-05-31T22:45:11-07:00";"https://itunes.apple.com/us/review?id=1012014442&type=Purple%20Software";"1012014442";172;"en";"POSITIVE"
99;7899947725;"M. Alpha";"https://itunes.apple.com/us/reviews/id164853740";"6.0";5;"As disgusted as I am pleased";"We knew we had to make a change based on the regular air filter changed and weekly home cleanup. Our efforts seemed ineffective. Having four dogs will do that. We made the purchase in high hopes and in the first few days we were disgusted to learn just how much filth we were blindly comfortably living in. As the adage goes; ignorance is bliss. Glad we are better educated now and have made our regular cleanings much more effortless, thanks to introducing this one seemingly superficial member to our family. She’s more integral to our wellness and well-being than I could have imagined. We would happily make the purchase again but she’s covered under warranty. 😜 Thank you iRobot.";"2021-10-10T11:05:44-07:00";"https://itunes.apple.com/us/review?id=1012014442&type=Purple%20Software";"1012014442";119;"en";"POSITIVE"
100;7054197073;"Planebabe";"https://itunes.apple.com/us/reviews/id181139966";"5.3";5;"Wonderful!";"I’ll begin by saying the bin makes all the difference in the world.  Using the app on my phone makes it so easy to operate and give commands.  I have set it up to automatically run three days a week, but if I need it sooner I just open the app and get started.  The self-emptying bin is just an incredible feature, and holds a lot more than one would think.  If you need to vacuum a specific space, just go to the app and point it in that direction.  It works incredibly well on tile and wood, as well as carpet.  It rarely gets “stuck”, but if it does, just go to the app’s location function, and it will start to sing until you find it.  This really is a wonderful vacuum.";"2021-03-01T13:18:33-07:00";"https://itunes.apple.com/us/review?id=1012014442&type=Purple%20Software";"1012014442";133;"en";"POSITIVE"
101;2586596045;"Aj31890";"https://itunes.apple.com/us/reviews/id299022796";"2.6.3";4;"Would prefer more scheduling";"It’s a handy app but it’s slow to connect to the robot and also I’d prefer more scheduling options. As I’m not always at home it would be nice to be able to set her off twice a day as my dogs move through the house and are continuously shedding (one is a beagle). 
It’d be pretty cool if there was a function to set areas and direct her (I’ve dictated gender and named her Ruby. No I do not have a life.) we have a robot lawn mower and it has a secondary and primary area and mows them accordingly. I’d like a function to tell Ruby to clean one room first at 9am and then around 2pm move onto the next section. Maybe mark perimeter with the towers? Realistically the function would be awesome but I move ruby around different floors so either way it would just be a cool function and not life changing.";"2018-05-23T12:40:34-07:00";"https://itunes.apple.com/us/review?id=1012014442&type=Purple%20Software";"1012014442";157;"en";"POSITIVE"
