"";"id";"userName";"userUrl";"version";"score";"title";"text";"updated";"url";"app";"wordCount";"language";"sentiment"
206;8140127600;"Santa Fr Bob";"https://itunes.apple.com/us/reviews/id235131099";"6.2";5;"I6 exceeded our expectations";"We’ve had a 500 series Roomba for many years.  Because of reviews saying the new robot vacuums were much improved and because the i6 was on sale for a short time, we decided to give it a try. We’ve had it for about a month now and we’re very happy with it.  We’ve got it set up on a schedule so there’s virtually nothing we have to do to have our house vacuumed. So far it seems to do an excellent job of cleaning our floors.  This is one of the first smart home upgrades that we thought was a giant leap forward.";"2021-12-17T08:46:32-07:00";"https://itunes.apple.com/us/review?id=1012014442&type=Purple%20Software";"1012014442";103;"en";"POSITIVE"
207;8045178041;"Loughman";"https://itunes.apple.com/us/reviews/id7477879";"6.1.1";5;"Absolutely love this thing!";"We have two Samoyeds and this thing is a life saver. The spinners in the bottom of this machine are rubber. So you don’t have to constantly take it apart and clean (cut out) the dog hair like we do with our Eufy machine AND it empties its own bin so we don’t have to constantly check and make sure it’s not full. 
Only down side is that it’s too tall to fit under our furniture.
The Eufy does fit under all our couches, coffee tables and entertainment/tv stand. Which is super nice. 
I will keep my eye out for ab updated version of this machine that has a slimmer profile.";"2021-11-20T12:24:07-07:00";"https://itunes.apple.com/us/review?id=1012014442&type=Purple%20Software";"1012014442";111;"en";"POSITIVE"
208;7866593644;"Hairy's Mom";"https://itunes.apple.com/us/reviews/id284613366";"6.0";5;"I robot Romba I-8";"We are beyond impressed with “Hairy Bluehair” My house has never looked better. The wood floors shine and the rugs and carpets are fluffy. We are on our 2nd week with 3 cleaning schedules per week covering approx. 2000 square feet. It takes him 9 hours and 12 dumps if we let him complete his task. This sounds like a lot but he has to maneuver around a lot of furniture and the fact that we have 2 hairy Pugs. He’s definitely the right man for the job. I can’t believe I waited so long to bite the bullet. Bought at Costco last month with a $100 off deal. Don’t wait, run to get one.";"2021-10-01T12:53:56-07:00";"https://itunes.apple.com/us/review?id=1012014442&type=Purple%20Software";"1012014442";115;"en";"POSITIVE"
209;6537492962;"Pilgrimnow";"https://itunes.apple.com/us/reviews/id223649415";"5.1";5;"Works great after help from the iRobot team";"Like many others I too had many of the problems indicated in the customer reviews. I sent an email detailing what my problems were. They connected to my iRobot and they determined my battery was not charging so they provided detail instructions on how to fix this. Then with the problem of connecting still happening, followed their instructions but I decided to delete my WiFi connection and reinstall and making sure I connected to 2g instead of 5g. I have had no problems since.";"2020-10-15T05:24:04-07:00";"https://itunes.apple.com/us/review?id=1012014442&type=Purple%20Software";"1012014442";84;"en";"POSITIVE"
210;7859778293;"SASH3rs";"https://itunes.apple.com/us/reviews/id201494112";"6.0";3;"Love my roomba but there are some FLAWS!";"I have owned an eye series roomba since December 2020 and it has definitely changed the way I do cleaning around the house. It saves time, and I haven’t manually vacuumed in forever. 

However, there is a huge problem with this particular model. After the first couple of months it worked perfectly, but it keeps dropping Wi-Fi and I always get an error saying not connected. It’s so irritating. There is not a really simple fix either. You end up having to either reboot, or restore to factory settings or change Wi-Fi. It’s a pain when you have to do this once a week or more than once a week. Needs to be fixed.";"2021-09-29T17:53:15-07:00";"https://itunes.apple.com/us/review?id=1012014442&type=Purple%20Software";"1012014442";114;"en";"NEGATIVE"
211;7751326703;"Kenneth M, PA";"https://itunes.apple.com/us/reviews/id102095106";"5.7";3;"Maps do not update";"I don’t want to rate this app too low over one issue, but I think it’s the primary function of this app.  The map of my house does not update despite running “clean everything” runs.  This is an issue with both my roomba and braava jet.  I’ve seen it hit sections on a complete run and then skip them on individual room runs because the map won’t update.  There’s an option where you can have it replace your saved map with a map made on a complete run you just finished, but that run seems to only claim it hit whatever the saved map already had, not acknowledging other areas that it did hit.  It’s very frustrating.";"2021-08-30T04:37:24-07:00";"https://itunes.apple.com/us/review?id=1012014442&type=Purple%20Software";"1012014442";117;"en";"POSITIVE"
212;7640127541;"RayMaltby";"https://itunes.apple.com/us/reviews/id122178443";"5.7";4;"Needs to complete one task at a time.";"The AI software needs to have added a rule to complete a area at a time.  For instance, when it is cleaning around the kitchen table and runs into objects (chair legs), it proceeds to clean the rest of the kitchen area.  I pull the chairs out from under the table into the cleaned area.  It appears programming it to re-attempt cleaning in the missed areas (original chair leg areas) and the edges.  
  Now of course no matter where one moves the chair it is in the as iRobot appears to jump back and forth between missed area cleaning and edge cleaning.
  It is out “smarting” me on where to move the chair to give it a clear path.  Lol, sort of.";"2021-07-31T12:35:20-07:00";"https://itunes.apple.com/us/review?id=1012014442&type=Purple%20Software";"1012014442";122;"en";"POSITIVE"
213;7179951714;"old NE man";"https://itunes.apple.com/us/reviews/id417410286";"5.4";4;"Good stuff, but needs a lot improvement";"1, algorithm needs improvement. Even set for one path, it still repeatedly run over places multiple times. And often not swipe through efficiently by going to the adjacent path. Rather move to the other end of room, swipes a few places then come back.
2, learning function is weak. Thought with fixed layout, it could learn after a few swiping through, therefore could do a better job. Looks like it could only “remember” the bumps. 
3, wish I can see the cleaning stage on a live map. Now I can only see the map after the cleaning is done.";"2021-04-03T12:17:52-07:00";"https://itunes.apple.com/us/review?id=1012014442&type=Purple%20Software";"1012014442";99;"en";"POSITIVE"
214;7805492710;"Parnedude";"https://itunes.apple.com/us/reviews/id43874498";"6.0";5;"Welcome addition to my home";"Purchased the top ‘o the line combo vacuum and mop devices and very impressed. The mapping technology has improved immensely since the days of the robots that seemed to wander randomly until they thought the job was done (yes, I realize it was a lot more complex but it sure looked random). So nice to be able to send the devices in sequence to specific room/rooms whenever needed. And the vacuum emptying itself into the base is what makes the biggest difference to me— no more emptying a dusty bin into the garbage only to get the floor dirty again as you’re doing it. Thanks Roomba.";"2021-09-14T07:20:09-07:00";"https://itunes.apple.com/us/review?id=1012014442&type=Purple%20Software";"1012014442";106;"en";"POSITIVE"
215;7792007864;"lil_nuggles";"https://itunes.apple.com/us/reviews/id17748535";"6.0";5;"I purchased “Rosie” to save time…";"But I find myself watching “Rosie” save me time!  Ha ha!  If you take the plunge and make the purchase, you’ll see!!! 

I am amazed at the technology integrated into this device and have an appreciation for the apps ease of use.  In all honesty, this purchase has encouraged my son and me to keep items off of the floor and be more organized.   “Rosie” has definitely given this single mom a little more time to do the fun things in life.  

p.s.  I purchased this as a bundle which includes the s9+vacuum, the Clean Base bin and “Elroy” the m6 Robot Mop.  We are just as happy with the bin and “Elroy”!";"2021-09-10T11:23:24-07:00";"https://itunes.apple.com/us/review?id=1012014442&type=Purple%20Software";"1012014442";113;"en";"POSITIVE"
216;7498176052;"TL go";"https://itunes.apple.com/us/reviews/id76018201";"5.6";5;"Roomba I-Robot does the job";"Enjoying our Roomba. Does a very good job vacuuming, even sand that gets tracked in. Love the automatic trash collector so we don’t have to empty the bin ourselves. Trash bags hold a number of vacuumings. Follows the individualized schedule. The app is easy to use. 

Roomba does get stuck under cabinet doors and on the side of a slanted surface so we often have to rescue it to complete the job. When this happens we will manually empty the bin and check on the rollers to keep it functioning. Of course it can’t get into all spaces and corners so a supplemental vacuuming is occasionally necessary. 

Recommend";"2021-06-23T12:47:39-07:00";"https://itunes.apple.com/us/review?id=1012014442&type=Purple%20Software";"1012014442";108;"en";"POSITIVE"
217;7748078465;"yasonrad";"https://itunes.apple.com/us/reviews/id148235110";"5.7";2;"Big disappointment";"Buyer beware. These iRobots and Roombas look great on paper but get one in your home and you’ll be disappointed. I live in a 3,000 square-foot home. Each level is 1000 square-feet. It takes 3 to 4 hours to vacuum 1000 square-feet. More times than not I can spot an entire room that hardly got vacuumed when this iRobot tells me it is done with the job. I can vacuum the whole house, all three levels manually in 30-45 minutes. Also, the waste bin needs to be emptied 3 times in those 5 hours. For more money, iRobot has added a vacuum that can empty it’s waste bin so it can keep vacuuming without being emptied but will still take a silly amount of time to clean the floors in your home. Consider all of this when buying one.";"2021-08-29T06:55:13-07:00";"https://itunes.apple.com/us/review?id=1012014442&type=Purple%20Software";"1012014442";139;"en";"NEGATIVE"
218;7457281463;"Allsome!";"https://itunes.apple.com/us/reviews/id278445280";"5.6";5;"Love Oscar!";"We named our Roomba Oscar. Our i7 with self emptying feature is wonderful, well worth the extra cost as and so easy to use. It mapped out the whole house and now I can just choose which room I want vacuumed. I go around and pick up objects to make sure there is nothing as far as obstructions to prevent Oscar from vacuuming or getting stuck.  It only takes me a few minutes then Oscar does the rest. I can leave, or schedule it while I’m away. Remember, it is a vacuum so there is some noise, but it’s nothing like an upright. So glad we have this little guy!";"2021-06-12T12:01:54-07:00";"https://itunes.apple.com/us/review?id=1012014442&type=Purple%20Software";"1012014442";110;"en";"POSITIVE"
219;7830421723;"Terri from Florida";"https://itunes.apple.com/us/reviews/id1053150163";"6.0";5;"I call her Brat";"I call her BRAT, because when she is vacuuming, she finds everything that I did not pick up out of her way. This vacuum keeps my house cleaner than it’s been in years. I have 2 dogs that shed constantly and before I just couldn’t vacuum daily. With having artificial hips and rods down my spine, it makes vacuuming so painful. Now Brat does the work for me and my husband fills in when he feels like it. Also, dog hair is not a problem. No clogging, and absolutely no dumping the dirt daily. I love that I only change out the tower bag monthly or sometimes longer.";"2021-09-21T10:10:02-07:00";"https://itunes.apple.com/us/review?id=1012014442&type=Purple%20Software";"1012014442";108;"en";"POSITIVE"
220;7251568849;"CindyS17";"https://itunes.apple.com/us/reviews/id698342177";"5.4";2;"Not good for pet hair and not easy to map";"Our Roomba is great on tile floors, but we have 2 dogs and all it does is push around the pet hair on the carpet. This is very disappointing.  We had another brand, much cheaper, that sucked up all the pet hair and was thinking this would be the same. After using it on carpet we then have to go around and either pick up the piles of pet hair it leaves or vacuum.  As for the app, we had problems getting the Roomba to stay in certain parts of the house.  There is still one bedroom that is not mapped because if we put it in the room it goes back out. If we close the door, it ends the job stuck. Very frustrating to try to create a schedule when it doesn’t recognize the entire house.";"2021-04-22T09:37:12-07:00";"https://itunes.apple.com/us/review?id=1012014442&type=Purple%20Software";"1012014442";138;"en";"NEGATIVE"
221;6722376224;"SgtStank";"https://itunes.apple.com/us/reviews/id244171326";"5.2";4;"(BUSTED APP) no longer";"Had the issue below for a few days but seems to be resolved now.

At some point very recently, I go into the app and it shows the i7 is connected and a current status, but seconds later it changes to a status of “Not Connected” and from that point nothing in the app works. No maps, no favorites, MAYBE a history. Can’t create or start a job. The only way to get the thing to do it’s job is to push the button on it, but that’s not what I paid for. Pretty surprised this is the current product offering as I’ve always spoken highly of this thing prior to this.";"2020-12-05T20:59:28-07:00";"https://itunes.apple.com/us/review?id=1012014442&type=Purple%20Software";"1012014442";112;"en";"POSITIVE"
222;2072462701;"Foygroup";"https://itunes.apple.com/us/reviews/id185519559";"2.5.0";4;"App works great... but...";"The App works great, but I’d like to suggest a couple improvements.  Specifically, when the roomba is charging or paused because of a jam, you have only two options, continue to clean, or cancel.  If you’d like to make changes to the schedule, or show off the features to a friend, you must cancel the cleaning job first to be able to get to the rest of the app.  It would be great to have full access to the app at all times.

Also, for whatever reason, there is not always a map.  Being able to see where it’s cleaned has been awesome as well.

Beyond that, the app is great, seeing what’s happening and where the roomba has cleaned is great.";"2018-01-09T07:19:10-07:00";"https://itunes.apple.com/us/review?id=1012014442&type=Purple%20Software";"1012014442";122;"en";"POSITIVE"
223;8116160862;"Saul - S";"https://itunes.apple.com/us/reviews/id423849801";"6.2";4;"iRobot Select is worth it!";"The idea of paying a subscription fee for a vacuum seems really stupid. But when you have five kids under the age of 12 in one household, it suddenly makes more sense. We run “Wilma“ several hours every day and it has helped keep our home much nicer. 

Even our two year old does a better job of picking things off of the floor so Wilma “doesn’t get a bellyache“. A subscription service for a vacuum is certainly not for everyone, but for us it is well worth the money and while we don’t have enough money to hire someone to do our cleaning, we can afford this “luxury“.";"2021-12-10T12:50:03-07:00";"https://itunes.apple.com/us/review?id=1012014442&type=Purple%20Software";"1012014442";109;"en";"POSITIVE"
224;7799666565;"Joy2bme03";"https://itunes.apple.com/us/reviews/id617369475";"6.0";5;"From Sebastian to Hazel";"We purchased the first one and loved it until it got stuck under things. We readjusted furniture, and moved it’s home spot. Worked like a charm occasionally a dogs toy got stuck. Recommended it to many friends. Then we got a new 960 and Hazel and the app have been great. Got new and better wi-fi which helped. My only suggestion is maybe the app could tell you where it is stuck. Vs having to search for it. But still we love. Had a lab and it got his hair up everyday. He shed a lot too. Had to empty the bin everyday. Now it’s weekly";"2021-09-12T13:19:18-07:00";"https://itunes.apple.com/us/review?id=1012014442&type=Purple%20Software";"1012014442";106;"en";"POSITIVE"
225;6576358418;"BlankPlanet";"https://itunes.apple.com/us/reviews/id24072817";"5.1.1";1;"Absolute Worst";"UPDATE: Well, I’m back to using my regular vacuum. My once fantastic, reliable i7 is now a very expensive doorstop. This latest update made already very bad things even worse. I simply don’t have the time to mess with the thing anymore. Consider me a very upset, disappointed former customer. 

I have no idea what they’ve done to the Roomba software, but now my Roomba doesn’t work right and hasn’t since the latest version of the software was released. Perhaps it was a firmware update that’s the problem, I don’t know. What I do know is my once 100% reliable Roomba i7 is now barely usable. And the latest Roomba app is an unmitigated disaster. Extremely non-intuitive, commands and options that only show up occasionally, etc., etc. I’d give the app less than 1 star if I could, it’s that bad.";"2020-10-26T08:49:17-07:00";"https://itunes.apple.com/us/review?id=1012014442&type=Purple%20Software";"1012014442";141;"en";"NEGATIVE"
226;8027189268;"NB47";"https://itunes.apple.com/us/reviews/id7868304";"6.1.1";3;"Not super efficient";"Our i7 iRobit vacuum, Howard, has been somewhat unreliable and he’s kind of all over the place in terms of efficiency. 
Sometimes he gets back to his station to recharge by himself, and others he just stops in the middle of the room out of energy, or it gets back to his face but is unable to connect to the charging marks. 
When he’s vacuuming, sometimes he goes back and forth in a nice neat rows, and other times he turns in circles, vacuum only part of a room and then leaves to vacuum part of another room, or misses big swaths of floor altogether. 
It’s better than nothing to have him doing what he does, but not even close to the same as me vacuuming by hand.";"2021-11-15T08:26:42-07:00";"https://itunes.apple.com/us/review?id=1012014442&type=Purple%20Software";"1012014442";128;"en";"POSITIVE"
227;7482825760;"espressogenie9";"https://itunes.apple.com/us/reviews/id937672380";"5.6";5;"Best robovac ever!";"After going through three other brands (all fairly decent), we bought an iRobot 7+ last year and man, the self cleaning and dustbin are second to none! We returned two other brands bought for comparison and to use at our rental property, but there is no other self cleaning robovac out there now that comes even close to the powerful suction, consistent and equally powerful self clean bin and the ability to remotely control the vac through the app or smarthome configurations through Google Home and Alexa. Lifesaver for busy family of 6 & 2 dogs.";"2021-06-19T09:23:47-07:00";"https://itunes.apple.com/us/review?id=1012014442&type=Purple%20Software";"1012014442";96;"en";"POSITIVE"
228;7778347664;"Traveler 282";"https://itunes.apple.com/us/reviews/id372232002";"6.0";3;"App does Not allow multiple users in a household";"In general the app works.  However, every so often the iRobot app logs me out and asks for a username/email and password.  My complaint is that we cannot have two emails and passwords for the same account for our household. If my husband is on a business trip or unavailable when the app asks for a password, I can’t use my iRobot because I don’t have access to his email to validate my user access. Additionally, when I try to set up my own account, the app doesn’t allow it. Even the bank allows us to have multiple usernames/emails associated with a household. Please consider changing this restriction.";"2021-09-06T11:29:48-07:00";"https://itunes.apple.com/us/review?id=1012014442&type=Purple%20Software";"1012014442";108;"en";"POSITIVE"
229;7237941201;"Cyndicund";"https://itunes.apple.com/us/reviews/id192935584";"5.4";2;"Yolanda (iRobot)";"Yolanda (iRobot) is not working very well. The charger or base quit working a  while back and Yolanda started acting strange not to long ago. She stopped emptying her bin so we are having to do that two or three times while she vacuums the floors in our house.  I am handicapped so that is an inconvenience but I guess t hat is part of it. She stopped emptying her bin into the base herself so we started putting using the application buttons ourselves but one day the “Empty Bin”  Now the “Empty Bin” button has disappeared so I can’t do that. Yolanda has been having problems deciding what to do and where to go.  She starts out from base and goes in circles. She spends around in circles not knowing which way to go.  She finally stops spinning and will start going someplace.";"2021-04-18T16:19:48-07:00";"https://itunes.apple.com/us/review?id=1012014442&type=Purple%20Software";"1012014442";144;"en";"NEGATIVE"
230;7102073373;"Dealdash fan";"https://itunes.apple.com/us/reviews/id104088748";"5.3";3;"IRobot 981 was better";"I replaced my 981 with i7 thinking it is the latest model ..but I am really disappointed with its performance..981 use to take its own time and did a thorough job..i7 I feel it is in a hurry to finish the work and get back home. I always had it cleaning not more than 25 mins..whereas the 981 was more powerful and its cleaning time would vary based on how unclean the room is. ..I have seen it clean for 45 mins and then charge again and restart With i7 I always see lot of areas left unclean ..I don’t know whether I made a right decision to replace my 981 . I would appreciate if some experts from the company calls and let me know how to get this working as expected";"2021-03-14T06:44:21-07:00";"https://itunes.apple.com/us/review?id=1012014442&type=Purple%20Software";"1012014442";133;"en";"POSITIVE"
231;6685104772;"#Dissapointing";"https://itunes.apple.com/us/reviews/id15389484";"5.2";1;"Version 5.2 Is unusable";"I have had no issues with the previous version. However, version 5.2 was updated on my mini iPad and iPhone 6 days ago. Now when I open the app it goes to the iRobot graphic, shows the indication that it is trying to do something, and within a couple of seconds an error pops up indicating my mobile device is not connected to the internet. At this point I try the retry button with the same error. The only thing you can do at this point is close the app. I immediately run Speedtest on my device and find no issues with my device connection to the internet. Sorry to say but this iRobot home app version is completely and utterly useless. I have no control of my iRobot 900 making it no more than a paper weight on wheels.";"2020-11-25T10:36:41-07:00";"https://itunes.apple.com/us/review?id=1012014442&type=Purple%20Software";"1012014442";140;"en";"NEGATIVE"
232;7460772599;"CaraBrookins";"https://itunes.apple.com/us/reviews/id166876677";"5.6";5;"Why didn’t I get one sooner?!";"I can’t believe how well my Roomba cleans under everything and right up to the baseboards. Really a clean house game changer. I had low expectations thinking that at least if it picked up a little bit that was less for me to do. But WOW, this doesn’t leave a speck of dirt. It does make a little noise as it works, so if you’re sensitive to that just schedule when you’re out. Highly recommend the vacuum. The brava jet mop is also useful but just for touch ups. Not as revolutionary as the vacuum yet. But I bet they are improving.";"2021-06-13T09:58:20-07:00";"https://itunes.apple.com/us/review?id=1012014442&type=Purple%20Software";"1012014442";102;"en";"POSITIVE"
233;3589749842;"jakejenks3";"https://itunes.apple.com/us/reviews/id917227577";"3.2.1";5;"Works well except";"Everything has been a breeze to set up and it works very well, but on my app it never loads the “schedule tab”. I click on it and it is just blank with no options to toggle on and off days. I have tried departing and reinstalling with no luck. Can anyone help......update, the roomba began to start at strange times without any command, like at 1 and 7 in the morning while everyone is sleeping. Ended up doing a factory reset on the roomba through the app and when I repaired it the schedule tab started working and havnt had any more issues. Hope this helps someone";"2018-12-29T18:29:59-07:00";"https://itunes.apple.com/us/review?id=1012014442&type=Purple%20Software";"1012014442";108;"en";"NEUTRAL"
234;6577078410;"Mivoz";"https://itunes.apple.com/us/reviews/id42079501";"5.1.1";1;"Recent update- i7 Not good.";"Update: 26Oct2020..... my device is no longer communicating to the cloud. It makes it seem like it’s paused in cleaning but it’s on the base fully charged. If you keep hiring, pause/resume it finally lets you know of the communication issue. My internet is working fine. But the device hasn’t worked per schedule in a week. I even reset it AND my internet... nope nothing happens. Please fix it. 

Previous: Roomba doesn’t clean fully and now gets lost. It’s no longer going over my area rug. It’s not going to other places it used to clean. It’s going into areas beyond the selected rooms I specified. Would be nice for the map to auto update or for you to be able to re-map your home. This needs another update but test it first before you push it out.";"2020-10-26T13:15:21-07:00";"https://itunes.apple.com/us/review?id=1012014442&type=Purple%20Software";"1012014442";138;"en";"POSITIVE"
