"";"id";"userName";"userUrl";"version";"score";"title";"text";"updated";"url";"app";"wordCount";"language";"sentiment"
333;1708514065;"Abcdefghijkl67801739";"https://itunes.apple.com/us/reviews/id11080911";"3.3.9";1;"App and Product are Terrible don't waste your time or money";"If you have not bought a SkyBell yet then don't, this thing is terrible not only is it hard to set up but it also does not work reliably at all. The streaming feature almost never connects, so you can never see a live video stream. Then the motion sensor does not work great and it misses people walking up and knocking on the door all the time. And on the times it does catch it, it will notify you that someone came to your door but then when you go to the video history the video will never show up. Overall this product and app is substandard and needs a lot of work. So if you just bought your skybell and can return it then do it or if you are thinking about buying one don't go with some other product because this one is garbage.";"2017-08-01T16:01:18-07:00";"https://itunes.apple.com/us/review?id=1035457926&type=Purple%20Software";"1035457926";147;"en";"NEGATIVE"
334;1611302694;"Alikat_rn";"https://itunes.apple.com/us/reviews/id107631947";"3.3.7";3;"When it works, it's great.";"About 80 percent of the time I try to open the app I get this message. ""There was an error loading activity history for this skybell. Please try again later"". This error keeps me from using any features of the app & device. I've already called customer support and the representative didn't know why this problem is happening or how to fix it. My wifi is not the problem. My service is fast enough and the router is about 12 feet away from the device (through a stucco wall & window). I've deleted the app and reinstalled it multiple times, updated the app and reinstalled the device. Is there anything that can be done or fixed?!?";"2017-05-11T14:30:16-07:00";"https://itunes.apple.com/us/review?id=1035457926&type=Purple%20Software";"1035457926";116;"en";"NEGATIVE"
335;1377769653;"Fn4julz";"https://itunes.apple.com/us/reviews/id118229760";"3.0.12";5;"Great Product!";"I absolutely love this product! It was really easy to install and set up. It alerts me every time someone comes to my door or walks past the general area. My husband and I have both had our cars broken into in the last couple of months so I ended up buying another SkyBell and installing it above my garage. It works great and feel confident if they break in again we will know who it is. The camera is really clear even at night and you can zoom in on the picture which helps! I would definitely recommend this product!";"2016-05-12T22:08:18-07:00";"https://itunes.apple.com/us/review?id=1035457926&type=Purple%20Software";"1035457926";101;"en";"POSITIVE"
336;1462840014;"Angmariec";"https://itunes.apple.com/us/reviews/id22184587";"3.3.2";5;"Amazing product and app!";"This works great, video & sound quality is amazing and I already feel more secure being able to see who is at my door without opening it. Installation and setup was super easy. One minor suggestion...I wish the notification tone for motion detection only was different and not a doorbell sound. The doorbell sound is great when someone actually presses it but I'd like to be able to tell by the sound if it is motion only or an actual doorbell press...otherwise great product! I will be recommending it.";"2016-10-07T15:05:55-07:00";"https://itunes.apple.com/us/review?id=1035457926&type=Purple%20Software";"1035457926";89;"en";"POSITIVE"
337;1368205060;"rbecwar";"https://itunes.apple.com/us/reviews/id43975321";"3.0.12";5;"Very satisfied customer";"I've had the Skybell Classic and absolutely love it! It was super simple to hook up and a breeze to set up. My in laws just recently purchased their first Skybell because my wife and  I love our so much!  I've recently 
coincided upgraded to the HD version so I contacted Skybell technical support with some question. Needless to say they were extremely helpful in answering all my questions regarding the HD version. Defiantly recommend Skybell over the competitors because you don't have the added cost the competitors charge you!";"2016-04-24T09:03:18-07:00";"https://itunes.apple.com/us/review?id=1035457926&type=Purple%20Software";"1035457926";90;"en";"POSITIVE"
338;1350807815;"melvenz";"https://itunes.apple.com/us/reviews/id42032908";"3.0.11";3;"Motion detections is not that good and log in to much";"I use the ring bell before and I return it just for one reason there was not on demand video now they have it the motion sensor is more accurate better than the sky bell, the sky bell is ok but need to be more accurate the notification are few seconds off by time you see them is too late. Also I am been asked to log in too many time already there no Touch ID or no credentials saving is getting annoying so now I am stuck with the sky bell that is way behind the ring bell 😩😩😩😩 if this get take off it will be OK";"2016-03-20T09:25:26-07:00";"https://itunes.apple.com/us/review?id=1035457926&type=Purple%20Software";"1035457926";109;"en";"NEGATIVE"
339;1467513230;"Group456";"https://itunes.apple.com/us/reviews/id11534336";"3.3.2";5;"Best Smart Doorbell on the market";"My original connection was laggy because my router is dual band, but that was fixed once I separated the the two bands in my router settings and linked my skybell hd wifi settings to ONLY my 2.4ghz network, then things began to work smoothly. 

Overall I like my skybell HD and rate the device itself 4stars (it would be nice if it wasn't made of plastic). Video and audio quality is great! Installation and set up was easy! Customer support is helpful! Price off $200 is fair.";"2016-10-15T20:07:14-07:00";"https://itunes.apple.com/us/review?id=1035457926&type=Purple%20Software";"1035457926";87;"en";"POSITIVE"
340;1679874509;"JMarkSC";"https://itunes.apple.com/us/reviews/id245300269";"3.3.9";5;"Clear, Simple, Easy Setup";"I'm not a tech or handy guy but my wife bought this product and I was a little nervous to set it up but the app and the video setup was short, easy to understand and to the point. The setup for the product was super easy even for a guy like me that is not handy. Loving the product and the notifications I get with the packages that come to my door. I'm definitely getting this product for friends and family for the holidays.";"2017-07-12T17:29:41-07:00";"https://itunes.apple.com/us/review?id=1035457926&type=Purple%20Software";"1035457926";85;"en";"POSITIVE"
341;1449744305;"FilmMusicPro";"https://itunes.apple.com/us/reviews/id147305434";"3.2.0";4;"Great & not so";"What others have stated before, settings can,- in the current version-, not be accessed by an iPhone 6 or higher (crash). This needs to be fixed. What's great is the video quality. BUT, as it is in my situation, the doorbell is situated in a 90 degree angle to the door. This means for the longest time, approaching visitors won't get captured by Skybell HD. As a result, (at best), my videos shows only the people from behind as they leave the vicinity of the door. The software needs a buffer, which shows several seconds BEFORE the trigger-event happened.";"2016-09-14T14:08:53-07:00";"https://itunes.apple.com/us/review?id=1035457926&type=Purple%20Software";"1035457926";99;"en";"POSITIVE"
342;1475358351;"MilitaryMight!";"https://itunes.apple.com/us/reviews/id86357632";"3.3.2";5;"Night and Day difference! WOW 3rd time IS a charm!";"Ok I was one of the original adopters of the indiegogo campaign and needless to say the product AND the app were horrific. Version 2 wasn't any better. IF you had either of those and lost confidence, you have ABSOLUTELY nothing to worry about - but with confidence and KNOW the app is just as amazing. Super easy to hook up, app programs EVERYTHING by itself and it finally ""just works.""  Love the new product and the new app - you can't go wrong!!!!";"2016-10-29T14:51:27-07:00";"https://itunes.apple.com/us/review?id=1035457926&type=Purple%20Software";"1035457926";84;"en";"POSITIVE"
343;2078779726;"Tonewheel";"https://itunes.apple.com/us/reviews/id30895385";"3.4.2";3;"Cold weather means constant, false motion detection.";"The past five weeks have turned our normally reliable motion detection to a grinding halt. Passing cars (40’ away) set off notifications. Sensitivity settings make no difference. We’ve had to switch off notifications so we can sleep at night. We can’t use this very important feature.

I contacted SkyBell customer support and was informed that this is a known issue, and a future firmware update will take care of it.

With solid competition, I have to consider changing brands if you can’t fix this problem.";"2018-01-11T07:02:07-07:00";"https://itunes.apple.com/us/review?id=1035457926&type=Purple%20Software";"1035457926";85;"en";"POSITIVE"
344;1289361636;"TechnoCn";"https://itunes.apple.com/us/reviews/id30109524";"3.0.3";1;"Possibly one of the worst devices I’ve used";"I have tried multiple versions of SkyBell and I have to say it is one of the worst consumer product experiences to date.  Plain and simple, it doesn’t work!   Video quality is horrible.  Audio can not even be heard by people standing front of my door.  And that is if I can even connect to the device when someone presses the button.   My “infrastructure” is fairly simple.  150Mbps up and down with Apple Airplay Routers and trying to access on Wifi or LTE works about 50% of the time.   

The bottom line is that this product should still be in beta.   I’m not happy and experience with other doorbells have been much better.";"2015-11-20T17:18:17-07:00";"https://itunes.apple.com/us/review?id=1035457926&type=Purple%20Software";"1035457926";113;"en";"NEGATIVE"
345;1622368944;"Afterowl";"https://itunes.apple.com/us/reviews/id572966357";"3.3.8";3;"Randomly works";"I ditched the Ring Pro because it couldn't handle high degree temperature. I decided to buy SkyBell however the motion detection randomly works. I had UPS drop off a box at my front door. I received a text message from UPS that my package had been delivered. Huh? I quickly ran downstairs and open my front door and there was my packages. SkyBell never notified me nor did the motion detection turned on. I decided to jump in front of the unit and the motion detection kicked in. 99% of the time, I get a recording when the person pushes the button rather then motion.";"2017-05-23T18:09:38-07:00";"https://itunes.apple.com/us/review?id=1035457926&type=Purple%20Software";"1035457926";105;"en";"NEGATIVE"
346;1616540548;"Dad101 not worrying as much.";"https://itunes.apple.com/us/reviews/id176084830";"3.3.8";5;"So progressive!";"I've had a skybell for over 6 months now and the app keeps getting better and better. I like that they are adding features while keeping it easy to use. Quick rings and history is easy to manage. Looking forward to the next 6 months!
Regular app updates when needed and they keep adding things customers ask for. To me that's a sign of a really good company. Keep up the good work Skybell!";"2017-05-17T13:25:37-07:00";"https://itunes.apple.com/us/review?id=1035457926&type=Purple%20Software";"1035457926";74;"en";"POSITIVE"
347;1521372618;"Sf4 god";"https://itunes.apple.com/us/reviews/id123092484";"3.3.5";5;"Better than before";"Motion recording is so much better now, it records right when someone comes on camera.  I would say it's improved from the last version and would have to say better than Ring Doorbell.  The only con is that sometimes saved recordings show up a few minutes to a couple of hours later.  Still a work in progress I suppose but definitely the best version yet.";"2017-01-13T08:59:26-07:00";"https://itunes.apple.com/us/review?id=1035457926&type=Purple%20Software";"1035457926";65;"en";"POSITIVE"
348;1999183513;"Qnigma";"https://itunes.apple.com/us/reviews/id128683454";"3.4.2";1;"not great";"I talked a friend into getting one, we both have the same issue... if the button is pressed, it rings all the devices (so that is great)... but you will never see the video from it real time... if you open the app and click live video, same thing... ALWAYS an error... it does seem to do ok recording the video when the button is pressed, but that never helps me... i want to be able to see it real time. i thought it was just my house / my wireless, even though the device shows “green” for connection... but when my friend said his does the exact same thing... i was like... huge bummer!! i would not buy this device again...";"2017-12-15T13:05:02-07:00";"https://itunes.apple.com/us/review?id=1035457926&type=Purple%20Software";"1035457926";122;"en";"POSITIVE"
349;1577257327;"Bleeding Edge1990";"https://itunes.apple.com/us/reviews/id314291109";"3.3.6";5;"I really love the HD version!!!";"Update:  Thank you for the new version!  I love the new features!!!  My Dad and 2 siblings now have it and love it as well!

I had a Ring first for 6 months (glitchy and hated the huge size) and then a non-HD SkyBell for about a year and a half which was a big improvement.  After seeing the HD picture that a friend had, I upgraded.  Liked it before but now, it's so clear it is just AMAZING!  I'm also loving all of the features!";"2017-03-31T08:25:10-07:00";"https://itunes.apple.com/us/review?id=1035457926&type=Purple%20Software";"1035457926";86;"en";"POSITIVE"
350;1370433170;"Dave804";"https://itunes.apple.com/us/reviews/id36333389";"3.0.12";2;"A little good.  A lot of bad!";"SkyBell HD is a mixed bag. The video is outstanding ...the app is easy to use. But it's main feature of motion detection is horrible. The amount of false alerts is intense to the point a user has to turn off the option. 

Even with this new update (which now allows users to select different trigger sensitivity), the false alarms are only cut in half at the lowest setting. For a motion detecting security camera this is severely disappointing. There are plenty of other companies and products that I've gotten this right. Their inability to master this issue is getting to be a little pathetic.";"2016-04-28T20:13:24-07:00";"https://itunes.apple.com/us/review?id=1035457926&type=Purple%20Software";"1035457926";105;"en";"NEGATIVE"
351;1678174001;"12345user";"https://itunes.apple.com/us/reviews/id163689098";"3.3.9";5;"SkyBell Hd";"The wind chime is really low.  I actually use my motion on my camera and the door bell sound woke me up letting me know someone was underneath my carport at 2:55am.  Now this new sound is low and you can barely hear it.  Think we should be able to change the sound ourselves. Other than that change this doorbell camera is one of the best.  I would recommend it and I have told a lot of people about it already.";"2017-07-11T08:48:36-07:00";"https://itunes.apple.com/us/review?id=1035457926&type=Purple%20Software";"1035457926";81;"en";"POSITIVE"
352;1392872967;"Steel Inquisitor";"https://itunes.apple.com/us/reviews/id156346949";"3.0.14";4;"Works wonderfully";"It works. However, there are annoyance in the beginning. One of the power screws got stripped using the supplied screw driver. Therefore, I had to Dremel it so that I can re-use it. The customer service was very kind and they're going to send a mounting replacement. 

Another con was the plastic screw. I was securing the camera then the screw head snapped. Now, I have no idea how am I going to remove the unit. 

Now, hope Skybell would update the app to allow us to select multiple videos to delete.";"2016-06-11T15:42:10-07:00";"https://itunes.apple.com/us/review?id=1035457926&type=Purple%20Software";"1035457926";92;"en";"POSITIVE"
353;1328994199;"Aifonu'";"https://itunes.apple.com/us/reviews/id43407248";"3.0.11";3;"Good with problems...";"The app is working in general, but it has some questionable choices in its design: login every time? excuse me? Please add touch ID, or remember credentials forever. Swiping on notifications (even hours after the fact) brings up live video, which in turn record a new video. Why? Either only open the app or open the video recorded for that notification, but not live video. Motion detection works fine, even if the 10 sec delay is a bit too much. Overall, good, but definitely with room for improvements.";"2016-02-06T15:48:19-07:00";"https://itunes.apple.com/us/review?id=1035457926&type=Purple%20Software";"1035457926";88;"en";"POSITIVE"
354;1276180353;"MacMan00";"https://itunes.apple.com/us/reviews/id33172314";"3.0.1";1;"Horrible";"The new hd model is a joke. I am a proto type tester. The first ones out I found out are just testers to fix All the bugs. 1. It took 3 hours to mount it. Horrible design. Once on the wall it is never coming off without damage. App does not do what it shows. It has start and stop only. No configuration at all. It takes 5 min to disconnect and if you don't stay on the app it will never close. You get time out messages 4 out of 5 times of connecting. If you make more than one doorbell connection there is no way to delete it. I will say the few time
I got it to connect the image was very good. But slow and pixelated at times. They blew this one.";"2015-10-23T21:35:44-07:00";"https://itunes.apple.com/us/review?id=1035457926&type=Purple%20Software";"1035457926";137;"en";"NEGATIVE"
355;1503658971;"Tungsten Carbide";"https://itunes.apple.com/us/reviews/id111356764";"3.3.4";2;"Slow motion detection, duplicate notifications";"Video capture of people that trigger motion detection was never great, but with a recent update it is now worse.  The person would basically have to stand in the SkyBell camera's field of view for several seconds before they are actually captured on video.  Presumably a firmware update will address this problem soon.

I also get two duplicate notifications for the same event.  For example, motion detection will result in two push notifications, and similarly for a button press.

The app still needs refinement.";"2016-12-17T08:53:58-07:00";"https://itunes.apple.com/us/review?id=1035457926&type=Purple%20Software";"1035457926";84;"en";"NEGATIVE"
356;1520672180;"zzooioozz";"https://itunes.apple.com/us/reviews/id110178252";"3.3.5";5;"Update and its all good!";"5stars now with update! recording few seconds ahead so you see a person approaching before bell was pressed or motion detection starts!(Exactly how all reviewers requested, before you only saw person's back away from where the sky bell is located). I guess only catch is the recorded video is saved fee seconds later but thats totally understandable.

I am very happy with how it works.";"2017-01-12T08:57:35-07:00";"https://itunes.apple.com/us/review?id=1035457926&type=Purple%20Software";"1035457926";65;"en";"POSITIVE"
357;1645906873;"Bstot";"https://itunes.apple.com/us/reviews/id114431908";"3.3.8";3;"Becoming more of a hassle";"I like several of the reviewers really liked this product. However, over the past several months the notifications have become spotty and I have to keep re-syncing it. Tonight nothing worked and even after stating successful configuration it would not load the configuration settings. It is starting to become a hassle and right now it is useless. Hopefully my email into their service team will fix this once and for all...";"2017-06-15T20:38:33-07:00";"https://itunes.apple.com/us/review?id=1035457926&type=Purple%20Software";"1035457926";71;"en";"POSITIVE"
358;1317573784;"TLP34";"https://itunes.apple.com/us/reviews/id204952691";"3.0.9";1;"Good idea, horrible execution";"Non-stop issues. Some days it won't record, some days you can't talk with someone at the door, some days it doesn't work at all period. The motion detection is a joke, it goes off every 3 minutes to the point you just have to turn it off (and turning that function is off is the only solution their help dept gives as well). 
When the thing works, it's great. But it's rare to string more than a couple days together without more/new issues arising. 
I have a very tech filled house, I thought this would be a good addition. My mistake. 
I wouldn't recommend this product to anyone.";"2016-01-16T16:04:06-07:00";"https://itunes.apple.com/us/review?id=1035457926&type=Purple%20Software";"1035457926";108;"en";"POSITIVE"
359;1993739036;"PowerCoupleLife.com";"https://itunes.apple.com/us/reviews/id529667172";"3.4.2";2;"Worthless Junk";"The SkyBell is useless! Everything worked OKAY at best the first 3 months but over the past three months I have not been able to connect. The sensor is late so only records activity after a person has walked away. Get notifications that activity is at front door but have to restart the app at least 20x to watch anything. The app only works when I am NOT connected to wifi even when I am the same network I can't connect. Avoid this app and overall the product.";"2017-12-13T09:58:15-07:00";"https://itunes.apple.com/us/review?id=1035457926&type=Purple%20Software";"1035457926";88;"en";"POSITIVE"
360;1615661827;"jpckrate";"https://itunes.apple.com/us/reviews/id104548395";"3.3.8";5;"So much more than a doorbell!";"In my estimation, this is one of the most highly innovative, easy to use products I've seen in 25 years.  It provides REAL security and real prevention as opposed to the illusion of security that I get from my alarm system.  The probability of catching a thief?  100%. The probability of avoiding a bad situation at my front door?  Very high!!  All at an absurdly low price for the value.  Thanks, SkyBell!";"2017-05-16T15:37:27-07:00";"https://itunes.apple.com/us/review?id=1035457926&type=Purple%20Software";"1035457926";72;"en";"POSITIVE"
361;2086591624;"Wolverinintx";"https://itunes.apple.com/us/reviews/id30012841";"3.4.2";3;"Seems to do the job - Could be better";"Just installed my SkyBell trim HD today. Installation is fairly simple and getting it setup on the network was a breeze.  App functionality is pretty good but could have a few more options. For instance, being able to have the quiet mode automatically turn on/off at specific times during the day (like kids nap or night time).

I will try to come back and update after a couple of weeks of use.";"2018-01-13T17:09:46-07:00";"https://itunes.apple.com/us/review?id=1035457926&type=Purple%20Software";"1035457926";72;"en";"POSITIVE"
362;1619627913;"AreuSleepy";"https://itunes.apple.com/us/reviews/id294624688";"3.3.8";4;"Awesome product... could always use some improvement";"Product is awesome, the app could use some work in a few places.  Started getting double notifications of doorbell presses (not sure when it started).  Maybe add date to the recorded videos.  Interesting idea... use the app to record constant video to a network connected hard drive (more of a security camera feature).";"2017-05-20T19:41:28-07:00";"https://itunes.apple.com/us/review?id=1035457926&type=Purple%20Software";"1035457926";53;"en";"POSITIVE"
363;1501389608;"Yuniverse";"https://itunes.apple.com/us/reviews/id27574389";"3.3.4";2;"Very clunky";"I love the idea but it's still very rough around the edges. It takes a full second or more to recognize that someone's there by which time they might be headed away from the door and you would never see their faces. Also with iOS 10.2 I cannot ever get a video stream overthe T-Mobile connection. Even on Wi-Fi the video starts very slow - takes 2 to 3 seconds just to get the video up. Hopefully these shortcomings will be patched with future firmware updates and app updates?";"2016-12-13T17:05:33-07:00";"https://itunes.apple.com/us/review?id=1035457926&type=Purple%20Software";"1035457926";89;"en";"POSITIVE"
364;1391687017;"Ampre";"https://itunes.apple.com/us/reviews/id9354171";"3.0.14";3;"Good device - decent app";"Love the device. The app is ok but a few frustrations that I hope future versions will cleanup. 

First - deleting videos (motion activation will create a lot) takes a long time. Ability to select multiple videos for deletion at once would be helpful. 

Second - all the video thumbnails constantly refresh which slows down the deletion process. Caching these would save both time and cellular data usage. A user isn't going to have thousands of these so not that much memory. 

Finally motion activation doesn't record until a person is gone which is only a few seconds from when they arrive (dropping off package, etc). Any way to capture the moment the motion began would be nice as most evil-doers aren't going to hang around very long.";"2016-06-09T12:37:51-07:00";"https://itunes.apple.com/us/review?id=1035457926&type=Purple%20Software";"1035457926";128;"en";"POSITIVE"
365;1531809180;"Scotty_rz";"https://itunes.apple.com/us/reviews/id86251942";"3.3.5";4;"Solid stable app";"This app does does everything it's suppose too.  You get a nice list of all your motion activity videos. Changing the color of the light on the door bell is one of my favorite things to do in the app. 

Feature request. Wish there was a way to delete a batch of videos by day or all at once.  

Depending on your sensitivity you can quickly accumulate lots of videos you don't want.";"2017-01-27T11:42:21-07:00";"https://itunes.apple.com/us/review?id=1035457926&type=Purple%20Software";"1035457926";73;"en";"POSITIVE"
366;1535047693;"TRL2020";"https://itunes.apple.com/us/reviews/id460145335";"3.3.5";5;"Absolutely love this thing!";"I installed my device in the middle of 2016 and absolutely love this thing, as does my wife. In fact, liked it so much I ensured that several of my friends and business associates got one and installed it. Great quality video day or night and the microphone and speaker work surprisingly well. Very happy, highly recommend!";"2017-02-01T11:19:41-07:00";"https://itunes.apple.com/us/review?id=1035457926&type=Purple%20Software";"1035457926";57;"en";"POSITIVE"
