"";"id";"userName";"userUrl";"version";"score";"title";"text";"updated";"url";"app";"wordCount";"language";"sentiment"
249;2526149654;"Rcefreak";"https://itunes.apple.com/us/reviews/id111273145";"4.0.1";4;"No subscription!!!! Yeah!!!";"First review of an iPhone app. 
No subscription. 
Great camera with night view.";"2018-05-09T18:50:06-07:00";"https://itunes.apple.com/us/review?id=1035457926&type=Purple%20Software";"1035457926";13;"en";"NEGATIVE"
250;2843231144;"Mjbr24";"https://itunes.apple.com/us/reviews/id490053429";"4.0.1";2;"Motion detection does not work";"Motion detection is measured in inches, not feet. It doesn’t detect anyone and if it does, the camera needs 3 minutes to reset to be able to detect again. Returned.";"2018-07-05T08:28:33-07:00";"https://itunes.apple.com/us/review?id=1035457926&type=Purple%20Software";"1035457926";30;"en";"NEUTRAL"
251;3503754568;"Non Secure System";"https://itunes.apple.com/us/reviews/id946047855";"4.1.1";1;"Not worth it!";"Camera and motion detector stop work 3 months after it was installed. Called and emailed customer service FIVES times and not once gotten thru or received a response. DO NOT entertain purchasing this item.";"2018-12-07T05:14:26-07:00";"https://itunes.apple.com/us/review?id=1035457926&type=Purple%20Software";"1035457926";34;"en";"NEGATIVE"
252;3539772492;"Brendon Gone";"https://itunes.apple.com/us/reviews/id85092920";"4.1.1";1;"App broken";"The time of the year you need to work the most it doesn’t. No notifications being sent. Rebooted system and nothing.";"2018-12-16T20:15:52-07:00";"https://itunes.apple.com/us/review?id=1035457926&type=Purple%20Software";"1035457926";21;"en";"NEGATIVE"
253;2285052674;"Numacos world";"https://itunes.apple.com/us/reviews/id573226604";"4.0.0";2;"App won’t open anymore";"I have a iPhone 6s and I’m on iOS 11.2.6. When I try to open the app it shows a white screen then closes";"2018-03-08T12:05:27-07:00";"https://itunes.apple.com/us/review?id=1035457926&type=Purple%20Software";"1035457926";24;"en";"NEUTRAL"
254;3748053423;"Cassocks";"https://itunes.apple.com/us/reviews/id311033494";"4.1.1";1;"SkyBell";"This has been the worst experience trying to set this SkyBell up. It worked for a month then when we tried to set it up on my phone. Everything went bad
I would never never recommend this product. 
Today spent 5 1/2 hours trying to set up again No luck
4 hrs the other day
3 hours on the first install
Don’t buy it.";"2019-02-08T14:51:08-07:00";"https://itunes.apple.com/us/review?id=1035457926&type=Purple%20Software";"1035457926";64;"en";"NEGATIVE"
255;3543145382;"sarah2060";"https://itunes.apple.com/us/reviews/id115714914";"4.1.1";2;"Awful";"Poor notifications - losses WiFi all the time - download speeds are way over what’s needed.";"2018-12-17T18:42:25-07:00";"https://itunes.apple.com/us/review?id=1035457926&type=Purple%20Software";"1035457926";16;"en";"NEGATIVE"
256;4821358628;"Get rid of poor sports";"https://itunes.apple.com/us/reviews/id103336406";"4.1.1";1;"Too many false notifications";"Even on low sensitivity the motion detection goes off constantly for no apparent reason. Seems like the street lights cause it to give false motion.";"2019-09-21T20:22:26-07:00";"https://itunes.apple.com/us/review?id=1035457926&type=Purple%20Software";"1035457926";25;"en";"NEGATIVE"
257;4762713532;"Shopaholic friend";"https://itunes.apple.com/us/reviews/id333808833";"4.1.1";1;"Fix and update app";"It’s been 10 months and this app still not working. Not able to view live. It’s time to try Ring!";"2019-09-11T15:19:47-07:00";"https://itunes.apple.com/us/review?id=1035457926&type=Purple%20Software";"1035457926";20;"en";"NEUTRAL"
258;4130313062;"Bobson Duggnut";"https://itunes.apple.com/us/reviews/id466148227";"4.1.1";1;"Piece of junk";"Never stays connected. We’ve had delivery people leave with packages because they rang the bell and nothing happened. I wish I could give it -1 stars!";"2019-05-10T13:31:51-07:00";"https://itunes.apple.com/us/review?id=1035457926&type=Purple%20Software";"1035457926";26;"en";"NEGATIVE"
259;2138871329;"CKendallS";"https://itunes.apple.com/us/reviews/id17170441";"4.0.0";1;"Ap Update not good.  Big Downgrade!";"The thumbnails for browsing are way too big.  Very slow to scan the motion activated videos.  Thinking of returning a new one I just got for a new house now for a Ring.";"2018-01-28T19:38:13-07:00";"https://itunes.apple.com/us/review?id=1035457926&type=Purple%20Software";"1035457926";33;"en";"NEUTRAL"
260;6217588056;"Joe Derek";"https://itunes.apple.com/us/reviews/id1147008651";"4.2.0";1;"SkyBell app on apple";"I have tried so many time to connect it to my WiFi and I have had no luck at all.
This app is useless.";"2020-07-19T12:55:19-07:00";"https://itunes.apple.com/us/review?id=1035457926&type=Purple%20Software";"1035457926";24;"en";"NEGATIVE"
261;2292618258;"Maxine Leonard";"https://itunes.apple.com/us/reviews/id329748223";"4.0.0";1;"Update is bad";"Everything was working fine until it updated. Now my videos dont store. Please fix!";"2018-03-10T16:27:27-07:00";"https://itunes.apple.com/us/review?id=1035457926&type=Purple%20Software";"1035457926";14;"en";"NEGATIVE"
262;2169117134;"Ekit97";"https://itunes.apple.com/us/reviews/id85171135";"4.0.0";1;"4.0 Issues and Buggy";"Firmware 4.0 is faulty for the following:

1. Poor connectivity always reported even if Wifi is close and full bar on my testing

2. Poor coonectivity report jumps suddenly to good connectivity giving a false report

3. Sync device issues with iOS were sync takes a long time to load if reconnecting

4. Random disconnects";"2018-02-04T23:04:10-07:00";"https://itunes.apple.com/us/review?id=1035457926&type=Purple%20Software";"1035457926";55;"en";"NEGATIVE"
263;4092598040;"Zello6678";"https://itunes.apple.com/us/reviews/id309088775";"4.1.1";1;"Malfunction";"Not able to record after several reset attempts";"2019-05-02T21:07:12-07:00";"https://itunes.apple.com/us/review?id=1035457926&type=Purple%20Software";"1035457926";8;"en";"NEUTRAL"
264;3264345559;"Eric 1138";"https://itunes.apple.com/us/reviews/id34652818";"4.0.1";1;"Useless on iOS 12";"iPhone microphone doesn’t work when talking to visitors. Live feed fails to load far too often. Please fix this!";"2018-10-04T17:03:25-07:00";"https://itunes.apple.com/us/review?id=1035457926&type=Purple%20Software";"1035457926";19;"en";"NEGATIVE"
265;3821852210;"Olmancars1";"https://itunes.apple.com/us/reviews/id263085584";"4.1.1";2;"SkyBell app";"Just installed SkyBell worked great 4 mo now the bell won’t snuck with my phone app and app is frozen not happy might have to change";"2019-02-27T13:20:13-07:00";"https://itunes.apple.com/us/review?id=1035457926&type=Purple%20Software";"1035457926";26;"en";"POSITIVE"
266;2936249156;"IKnowWhereMyStarbucksIslocated";"https://itunes.apple.com/us/reviews/id109567402";"4.0.1";1;"Crashes on jailbroken device";"Stupid that the app crashes on a jailbroken device. This isn’t a banking app... i just need to check my front door...";"2018-07-19T15:31:30-07:00";"https://itunes.apple.com/us/review?id=1035457926&type=Purple%20Software";"1035457926";22;"en";"NEGATIVE"
267;2533017272;"A Stacher";"https://itunes.apple.com/us/reviews/id29966160";"4.0.1";3;"Indoor chime schedule";"Please add a feature to have a schedule to turn on and off the indoor chime!";"2018-05-11T08:39:14-07:00";"https://itunes.apple.com/us/review?id=1035457926&type=Purple%20Software";"1035457926";16;"en";"POSITIVE"
268;6916890768;"kroma";"https://itunes.apple.com/us/reviews/id39344473";"4.2.0";1;"App crashes continually";"Can't add a device as the app crashes continuously after syncing.";"2021-01-26T12:28:28-07:00";"https://itunes.apple.com/us/review?id=1035457926&type=Purple%20Software";"1035457926";11;"en";"NEUTRAL"
269;6474384480;"Annalynne";"https://itunes.apple.com/us/reviews/id41446140";"4.2.0";2;"NO SUPPORT AND LOTS OF SUPPORT NEEDED";"Stopped clearing old captures so won’t capture new ones on its own. NOT SPIDER PROOF, little ones get inside and it stops working til you clean them out. NO NO NO SUPPORT. New problems=no help. No way to contact, the link in the app USED to bring you thru a million steps where eventually you could get help... now it only brings you to a partner sign up page FOR BUSINESSES. If you dig around long enough you can find videos of how to reset the bell, etc. If you are away you can’t reset it if it malfunctions so all features are the useless when you need them the most. You used to be able to have them do a remote reset but you can’t contact them at all anymore to ask them to! Worst ever! Also the camera misses so many things! It records for only so many seconds at a time so you see a car pull up, for instance, but miss who got out of it and where they went. There is no option to record continuously to search thru to watch more. I see a package dropped off, then I see it’s gone but not who stole it!! The only thing it’s slightly good for is seeing who’s at your door when they ring the bell. And you can speak to them thru it IF it connects before they give up and walk away. There are multiple other issues with this device, but I’d go on all day if I listed them all. I finally was able to get support but the support was ridiculous and didn’t work. They told me to sign out and delete the app and sign back in and manually delete every video. I live in a busy area there are countless videos in the more I believe the more come back from previous days. It takes me forever. Eventually it did fix the problem but then it started right that happening again. I have done this multiple times I don’t have time to delete and over and over again. The videos and days keep appearing all out of sequence. Also when I use the filter to see who rang the doorbell it shows no videos even though my doorbell really ran multiple times. Also Also doesn’t all The filter also doesn’t work. If I watch and create an on-demand video, it appears nowhere. EXTREMELY DISAPPOINTING";"2020-09-27T07:55:14-07:00";"https://itunes.apple.com/us/review?id=1035457926&type=Purple%20Software";"1035457926";405;"en";"POSITIVE"
270;2852963601;"nas_p";"https://itunes.apple.com/us/reviews/id185707203";"4.0.1";5;"Works great";"Bought the bronze one for $158. Worth it!";"2018-07-06T17:52:48-07:00";"https://itunes.apple.com/us/review?id=1035457926&type=Purple%20Software";"1035457926";8;"en";"POSITIVE"
271;2119659066;"Joyman74";"https://itunes.apple.com/us/reviews/id36554593";"4.0.0";4;"Nice App Update";"Like the new App Update. Better response time";"2018-01-23T14:44:09-07:00";"https://itunes.apple.com/us/review?id=1035457926&type=Purple%20Software";"1035457926";8;"en";"POSITIVE"
272;7784652905;"Jgrojr.";"https://itunes.apple.com/us/reviews/id290578686";"4.2.1";1;"Does not work";"This app does not work when I click on the live feed. Please fix";"2021-09-08T08:20:27-07:00";"https://itunes.apple.com/us/review?id=1035457926&type=Purple%20Software";"1035457926";14;"en";"POSITIVE"
273;5064675743;"Cjdjdjdjshskdaawp";"https://itunes.apple.com/us/reviews/id538836559";"4.1.1";1;"The worst";"Super horrible app and camera. What a waste of money. I’m always deleting and installing the app so it can work";"2019-11-01T14:56:35-07:00";"https://itunes.apple.com/us/review?id=1035457926&type=Purple%20Software";"1035457926";21;"en";"NEGATIVE"
274;8141259870;"SMRRBA";"https://itunes.apple.com/us/reviews/id1157653807";"4.2.1";1;"Useless";"This has got to be the worst system ever! It’s constantly offline, defeats the purpose of what it’s supposed to do.";"2021-12-17T16:56:35-07:00";"https://itunes.apple.com/us/review?id=1035457926&type=Purple%20Software";"1035457926";21;"en";"NEGATIVE"
275;3279195260;"mjdelf";"https://itunes.apple.com/us/reviews/id42754630";"4.0.1";1;"No audio after IOS 12 update";"After my phone update to ios12 you cant hear anything on your doorbell";"2018-10-08T12:51:47-07:00";"https://itunes.apple.com/us/review?id=1035457926&type=Purple%20Software";"1035457926";13;"en";"NEUTRAL"
276;6527152053;"PaprikaPurchaser";"https://itunes.apple.com/us/reviews/id34258716";"4.2.0";1;"Terrible!!!";"Doesn’t refresh. Often “offline.” Almost useless.";"2020-10-12T05:22:15-07:00";"https://itunes.apple.com/us/review?id=1035457926&type=Purple%20Software";"1035457926";6;"en";"NEGATIVE"
277;4422545559;"EmperorKuzko";"https://itunes.apple.com/us/reviews/id42883414";"4.1.1";1;"Never connects";"Been trying for 45 minutes and it won’t connect to the app.";"2019-07-06T19:50:57-07:00";"https://itunes.apple.com/us/review?id=1035457926&type=Purple%20Software";"1035457926";12;"en";"NEUTRAL"
278;3236194660;"SDgopher";"https://itunes.apple.com/us/reviews/id324829664";"4.0.1";1;"Doesn’t work anymore";"No longer works under Apple iOS 12. Cannot talk to people at the door";"2018-09-27T07:21:22-07:00";"https://itunes.apple.com/us/review?id=1035457926&type=Purple%20Software";"1035457926";14;"en";"NEGATIVE"
279;3538446726;"dwest1023";"https://itunes.apple.com/us/reviews/id42691117";"4.1.1";1;"Notifications stopped workin";"I have iPhone 10 and 12.1.1 and recently the notifications stopped working! Please fix!!!!";"2018-12-16T10:56:14-07:00";"https://itunes.apple.com/us/review?id=1035457926&type=Purple%20Software";"1035457926";14;"en";"POSITIVE"
280;3082277130;"36OverPar";"https://itunes.apple.com/us/reviews/id278077483";"4.0.1";1;"Total Garbage";"Do NOT waste your money on this piece of garbage. Heck, go to their own website, and you will see dozens of excuses as to why your doorbell isn’t working.";"2018-08-18T07:45:59-07:00";"https://itunes.apple.com/us/review?id=1035457926&type=Purple%20Software";"1035457926";30;"en";"POSITIVE"
281;5717649676;"rippoff junk";"https://itunes.apple.com/us/reviews/id240586675";"4.2.0";1;"Piece of junk";"Components are a piece of junk. Less than $5.00 in parts, made in Mexico. Waste of $200. Buy a nest or ring";"2020-03-26T12:54:05-07:00";"https://itunes.apple.com/us/review?id=1035457926&type=Purple%20Software";"1035457926";22;"en";"NEGATIVE"
282;4219962217;"Johnslack";"https://itunes.apple.com/us/reviews/id688439940";"4.1.1";1;"Horrible";"I hate this doorbell. I only had it for less than 6months. My alarm switched it out with another brand. So far so good with brand. SkyBell is trash.";"2019-05-27T09:18:59-07:00";"https://itunes.apple.com/us/review?id=1035457926&type=Purple%20Software";"1035457926";29;"en";"NEGATIVE"
283;5981017966;"Jjhkjhhf22";"https://itunes.apple.com/us/reviews/id416203689";"4.2.0";1;"Stoped working and crashes";"The App won’t even connect to the door bell anymore.";"2020-05-22T15:55:01-07:00";"https://itunes.apple.com/us/review?id=1035457926&type=Purple%20Software";"1035457926";10;"en";"NEUTRAL"
284;6419746888;"TiredAndSick";"https://itunes.apple.com/us/reviews/id803685629";"4.2.0";1;"Should’ve gotten Ring!";"App doesn’t work and SkyBell hardly stays connected. What is the purpose!?";"2020-09-11T18:18:24-07:00";"https://itunes.apple.com/us/review?id=1035457926&type=Purple%20Software";"1035457926";12;"en";"NEUTRAL"
285;6950223349;"Bee-Ten";"https://itunes.apple.com/us/reviews/id24820063";"4.2.0";1;"Soooo unreliable.";"Cons - 

Can almost never connect to “answer” doorbell. Force-quitting the app once or many times eventually resolves the issue but the person is gone by then. 

Tons of false alarms. 

And occasionally doesn’t record visitors and even misses some deliveries. 

Pro - 

No fees.";"2021-02-03T13:47:09-07:00";"https://itunes.apple.com/us/review?id=1035457926&type=Purple%20Software";"1035457926";45;"en";"NEGATIVE"
286;2153934012;"Dhhjhff";"https://itunes.apple.com/us/reviews/id141619631";"4.0.0";1;"Do not update";"Ever since the new update I have been unable to see any activity saved";"2018-02-01T07:12:39-07:00";"https://itunes.apple.com/us/review?id=1035457926&type=Purple%20Software";"1035457926";14;"en";"POSITIVE"
287;7576807853;"Relubwu";"https://itunes.apple.com/us/reviews/id893230027";"4.2.1";1;"Trash";"The connection/pairing UX is total trash, 100% garbage. How could they ship this to customers? I’d give it a zero star.";"2021-07-14T13:43:01-07:00";"https://itunes.apple.com/us/review?id=1035457926&type=Purple%20Software";"1035457926";21;"en";"NEUTRAL"
288;2426974231;"Zacholas";"https://itunes.apple.com/us/reviews/id191462461";"4.0.0";1;"Updated version 4.0.0 crashes";"Updated version 4.0.0 crashes. Now this is unusable.";"2018-04-15T13:18:58-07:00";"https://itunes.apple.com/us/review?id=1035457926&type=Purple%20Software";"1035457926";8;"en";"NEUTRAL"
289;6859214163;"sean0thedead";"https://itunes.apple.com/us/reviews/id1221454928";"4.2.0";1;"Garbage app";"I couldn’t even get the Skybell to learn in the app kept failing. What a waste of time and energy";"2021-01-11T18:13:12-07:00";"https://itunes.apple.com/us/review?id=1035457926&type=Purple%20Software";"1035457926";20;"en";"NEGATIVE"
290;5485496571;"StandardCustomerCT";"https://itunes.apple.com/us/reviews/id457375746";"4.1.1";1;"Performance";"I miss Ring. This app’s performance is horrible. Slow and unreliable.";"2020-02-03T21:09:31-07:00";"https://itunes.apple.com/us/review?id=1035457926&type=Purple%20Software";"1035457926";11;"en";"NEGATIVE"
291;2853102065;"Soda234145$";"https://itunes.apple.com/us/reviews/id100605339";"4.0.1";1;"App won’t even open";"The app literally won’t even open on my iPhone 7 Plus or on my brother’s iPhone SE.";"2018-07-06T18:26:16-07:00";"https://itunes.apple.com/us/review?id=1035457926&type=Purple%20Software";"1035457926";17;"en";"NEUTRAL"
292;2890113547;"brYsturr";"https://itunes.apple.com/us/reviews/id20189771";"4.0.1";1;"App Crashes On Opening";"DO NOT UPDATE. App crashes upon opening every time now and I wish I could downgrade.";"2018-07-12T01:14:44-07:00";"https://itunes.apple.com/us/review?id=1035457926&type=Purple%20Software";"1035457926";16;"en";"POSITIVE"
293;2132934020;"Kathy-Indiana";"https://itunes.apple.com/us/reviews/id43404464";"4.0.0";1;"Update pretty bad";"Come on..your new update is bad. You need to fix the way it appears..landscape.";"2018-01-27T06:41:50-07:00";"https://itunes.apple.com/us/review?id=1035457926&type=Purple%20Software";"1035457926";14;"en";"NEGATIVE"
294;2130683839;"Kenika1226";"https://itunes.apple.com/us/reviews/id13649273";"4.0.0";1;"Inconsistent";"Skybell updated app recently. Now I’m no longer alarms and video feed. What happened?";"2018-01-26T17:00:13-07:00";"https://itunes.apple.com/us/review?id=1035457926&type=Purple%20Software";"1035457926";14;"en";"NEGATIVE"
295;7415481938;"SJS1958";"https://itunes.apple.com/us/reviews/id407048866";"4.2.1";1;"Poor";"Not satisfied with this in any way.";"2021-06-01T15:51:26-07:00";"https://itunes.apple.com/us/review?id=1035457926&type=Purple%20Software";"1035457926";7;"en";"NEGATIVE"
296;3812613222;"M4883a";"https://itunes.apple.com/us/reviews/id130645106";"4.1.1";1;"Junk.  Never actually worked.  What garbage. Company never responded at all.";"The Skybell and software are complete JUNK!";"2019-02-25T01:40:21-07:00";"https://itunes.apple.com/us/review?id=1035457926&type=Purple%20Software";"1035457926";7;"en";"NEUTRAL"
298;3797020504;"Anonymous73x";"https://itunes.apple.com/us/reviews/id106250608";"4.1.1";1;"Stopped picking up motion";"Used to work great and suddenly stopped picking up motion. Don’t waste your money.";"2019-02-21T06:18:57-07:00";"https://itunes.apple.com/us/review?id=1035457926&type=Purple%20Software";"1035457926";14;"en";"POSITIVE"
299;2142578588;"Tronlapse";"https://itunes.apple.com/us/reviews/id108748333";"4.0.0";1;"Last update broken, no QA";"Last update does not work on iPhone 6s Plus. Just launches and exits.";"2018-01-29T12:00:21-07:00";"https://itunes.apple.com/us/review?id=1035457926&type=Purple%20Software";"1035457926";13;"en";"NEUTRAL"
300;1913485324;"K rub";"https://itunes.apple.com/us/reviews/id101109099";"3.4.2";2;"Needs improvement";"The hardware itself has some major design flaws that contribute to overall poor performance.  The wifi connectivity isn't great and basically demands that you have a rock solid router located 15 feet or less from your front door with 6 Mbps upload speed.  

I have a very high end router, 8 Mbps upload speed (when running a speed test from my phone on my front doorstep), and my router is located about 10 feet inside my front door. 

The connectivity is still hit or miss.  I've tried these doorbells on a lot of different network configurations at different houses and even in the ""best case scenario,"" the performance will be inconsistent at times.

The motion detection will only work in some instances and not others depending on the layout of your porch, the ambient temperature, and the direction people take will approaching your door.  Don't count on it.

Live chatting with a visitor is unlikely unless the person stands there for quite some time and you react to the notification instantly.  

The app doesn't tell you the temperature outside, so this is just plain false advertising.  This is not a critical feature, but they still shouldn't advertise something that it doesn't actually do.

I look forward to future generations of products like this to make some major improvements that are vital to delivering a good user experience.";"2017-11-11T07:40:40-07:00";"https://itunes.apple.com/us/review?id=1035457926&type=Purple%20Software";"1035457926";227;"en";"POSITIVE"
301;3687467281;"g60n";"https://itunes.apple.com/us/reviews/id307162618";"4.1.1";1;"App is crap";"Always cuts out and or freezes";"2019-01-23T19:49:52-07:00";"https://itunes.apple.com/us/review?id=1035457926&type=Purple%20Software";"1035457926";6;"en";"NEGATIVE"
303;2257253901;"TheophilusTheSmall";"https://itunes.apple.com/us/reviews/id189360300";"4.0.0";1;"Unreliable";"Motion detection doesn’t work (and, yes, it is set to ON in the app). Notifications rarely work.";"2018-02-28T14:59:14-07:00";"https://itunes.apple.com/us/review?id=1035457926&type=Purple%20Software";"1035457926";17;"en";"POSITIVE"
304;4992972467;"lilste505";"https://itunes.apple.com/us/reviews/id797097176";"4.1.1";1;"Please update";"Please update your app to work with iOS 13";"2019-10-21T07:20:25-07:00";"https://itunes.apple.com/us/review?id=1035457926&type=Purple%20Software";"1035457926";9;"en";"POSITIVE"
305;4284804876;"TinY8";"https://itunes.apple.com/us/reviews/id43400450";"4.1.1";1;"activity stops working every few weeks";"the worst. the activity feed constantly stops working and requires frequent reboots. pain.";"2019-06-08T10:59:10-07:00";"https://itunes.apple.com/us/review?id=1035457926&type=Purple%20Software";"1035457926";13;"en";"NEGATIVE"
306;3271917281;"TsiTuBonLeiSoN("",)";"https://itunes.apple.com/us/reviews/id197032703";"4.0.1";1;"No audio on iOS12";"It's terrible now... No audio... please fix soon...";"2018-10-06T15:51:07-07:00";"https://itunes.apple.com/us/review?id=1035457926&type=Purple%20Software";"1035457926";8;"en";"NEGATIVE"
307;7224897924;"Aleeking1";"https://itunes.apple.com/us/reviews/id147729099";"4.2.1";1;"Garbage";"My SkyBell Slim Line would not connect to this";"2021-04-15T06:18:10-07:00";"https://itunes.apple.com/us/review?id=1035457926&type=Purple%20Software";"1035457926";9;"en";"NEUTRAL"
308;3264923705;"goofy10v3";"https://itunes.apple.com/us/reviews/id40844624";"4.0.1";1;"Worst";"Wth, CRASH. Seriously please fix asap. Don’t waste ur $$$$ on this doorbell";"2018-10-04T20:47:29-07:00";"https://itunes.apple.com/us/review?id=1035457926&type=Purple%20Software";"1035457926";13;"en";"NEGATIVE"
309;3538233762;"Oraq88";"https://itunes.apple.com/us/reviews/id125409691";"4.1.1";1;"NO NOTIFICATIONS";"No more notifications on iPhone 8,X and ipads. Useless doorbell";"2018-12-16T09:36:00-07:00";"https://itunes.apple.com/us/review?id=1035457926&type=Purple%20Software";"1035457926";10;"en";"NEGATIVE"
