"";"id";"userName";"userUrl";"version";"score";"title";"text";"updated";"url";"app";"wordCount";"language";"sentiment"
89;5616106277;"EssoBC";"https://itunes.apple.com/us/reviews/id1141220240";"4.1.1";1;"App is a piece of junk, I am going to Ring";"The app is piece of junk. If I want to delete a video from it, I have to repeat the procedure 5-6 times before it deletes it.

As for the bell, lot of false positives, even with motion set to lowest setting. Additionally, I think they might have a breach like Ring had. At random times the bell is being ‘live’
I switched it to a different network and still issues.
Do yourself a favor and get different bell!";"2020-03-04T10:17:28-07:00";"https://itunes.apple.com/us/review?id=1035457926&type=Purple%20Software";"1035457926";79;"en";"POSITIVE"
90;3833069159;"RikSan50!";"https://itunes.apple.com/us/reviews/id518664665";"4.1.1";4;"So far works well";"I installed SkyBell and SkyBell HD app last week. After replacing a defective transformer that powers the analog doorbell and SkyBell, it’s working pretty well. My only complaint is the app sometimes doesn’t connect to the SkyBell. I get an error.  Need to close that app and reopen. Hopefully they’ll correct this in their next app update.";"2019-03-02T07:15:07-07:00";"https://itunes.apple.com/us/review?id=1035457926&type=Purple%20Software";"1035457926";57;"en";"POSITIVE"
91;6129543748;"3Qwerty70";"https://itunes.apple.com/us/reviews/id182457169";"4.2.0";1;"Doesn’t work properly!";"Just installed it yesterday. It worked....yesterday! And on the Activity page, nothing shows up on that screen with all the filters checked!  What’s the point of having this if I can’t view whose been hanging around my door while I’m gone???  I’m going to uninstall this thing and go with another brand! No troubleshooting information came with the device!👎🏾";"2020-06-27T14:56:20-07:00";"https://itunes.apple.com/us/review?id=1035457926&type=Purple%20Software";"1035457926";59;"en";"NEGATIVE"
92;3266378017;"DTXSFC";"https://itunes.apple.com/us/reviews/id30767071";"4.0.1";2;"No Longer Records";"SkyBell HD app used to work until the latest app version 4 doesn’t record video. Plus I have issues with it showing video. My SkyBell HD is officially a basic doorbell. I even with through the pain of resetting it a couple of times and still no good. It’s a joke also that this model only operates over 2.4GHz WiFi and now there’s a new one that operates over 5GHz. Waste of money!";"2018-10-05T05:25:53-07:00";"https://itunes.apple.com/us/review?id=1035457926&type=Purple%20Software";"1035457926";73;"en";"NEGATIVE"
93;6524054597;"E J Bell";"https://itunes.apple.com/us/reviews/id1218408723";"4.2.0";3;"Motion Detection";"The doorbell has great video quality and works well for the main purpose needed. However, the motion detects TOO much. It is even detecting the tree in my lawn and the flag at my neighbor's house. It would be GREAT if an update was added where the user can set motion detection range. Will give 5 stars once an update like this is implemented.";"2020-10-11T06:41:12-07:00";"https://itunes.apple.com/us/review?id=1035457926&type=Purple%20Software";"1035457926";64;"en";"POSITIVE"
94;3542032241;"AusTex01";"https://itunes.apple.com/us/reviews/id15207374";"4.1.1";1;"Notifications";"Looks like SkyBell knows there is a current issue with notifications and are working to resolve in an app update. No ETA at this time.

Let me just say, I really like the HD quality and ease of use of SkyBell, which makes it hard for me to think about going elsewhere. I am really trying hard to keep this product, but so many recent issues back2back makes it difficult. Ring Pro is a strong competitor.

Please resolve these issues soon.";"2018-12-17T10:36:50-07:00";"https://itunes.apple.com/us/review?id=1035457926&type=Purple%20Software";"1035457926";81;"en";"POSITIVE"
95;2816195571;"Spotgirl39";"https://itunes.apple.com/us/reviews/id370894266";"4.0.1";3;"Sky bell HD";"It is hard to pick-up the WiFi on brick wall outside the house. Sometimes you get it or not. I ring the door bell twice to get my sons to open up the front door. The door bell start to ring every five minutes. After stranger ring door bell twice then it stop ringing. My husband had to get door bell back on track with the WiFi.";"2018-07-01T20:08:15-07:00";"https://itunes.apple.com/us/review?id=1035457926&type=Purple%20Software";"1035457926";67;"en";"NEGATIVE"
96;2226130896;"DevNallware";"https://itunes.apple.com/us/reviews/id478729414";"4.0.0";1;"Crashes every time on iPhone 6S";"1/26 I ordered the Skybell Trim Plus several days ago and decided to go ahead and download the app. I wish I would have downloaded the app BEFORE I ordered the skybell because I am now not sure if it will even work. Very concerned and will revise my 1* if this is handled properly. 
2/19 Update: Called customer support and they advised me to try again after the next update. It works perfectly on my wife’s iPhone 6s but not on my EXACT SAME PHONE!";"2018-02-19T11:17:56-07:00";"https://itunes.apple.com/us/review?id=1035457926&type=Purple%20Software";"1035457926";86;"en";"POSITIVE"
97;7557361106;"Pareddy";"https://itunes.apple.com/us/reviews/id35088448";"4.2.1";1;"Support non existent";"While the app live stream is pretty decent and notifications rather responsive, the integration is super limiting. IFTTT is broken and the pass through with google accounts is messed up. And when trying to get support, you need to enter all sorts of required info (cell phone provider-really?). The payoff for sharing your data is that your won’t get a response from support.";"2021-07-09T08:21:55-07:00";"https://itunes.apple.com/us/review?id=1035457926&type=Purple%20Software";"1035457926";63;"en";"POSITIVE"
98;2137962841;"montemrj";"https://itunes.apple.com/us/reviews/id39924893";"4.0.0";2;"Was great - motion detection stopped working";"SkyBell, you need to fix the motion detection that stopped working once I updated to the latest version. It was working fine and then all is a sudden stopped. Then I realized it stopped as soon as I updated the app. You also added automation, but didn’t add any HomeKit features? What’s up with that?! Huge selling point over Ring for me and nothing in this update?!";"2018-01-28T15:03:50-07:00";"https://itunes.apple.com/us/review?id=1035457926&type=Purple%20Software";"1035457926";67;"en";"POSITIVE"
99;6761042627;"Tcubb";"https://itunes.apple.com/us/reviews/id135774869";"4.2.0";1;"Does not work!";"The app does not work, therefore the doorbell is useless. I don’t get alerts when the doorbell is rang. When I try to ‘Watch live’ it never loads. Just a black screen with a spinning icon. Videos are constantly missing from the ‘Activity’ screen. Hardly ever actually detects motion. Doorbell constantly goes offline. Keep getting an error that my “SkyBell isn’t available right now”.";"2020-12-16T15:45:23-07:00";"https://itunes.apple.com/us/review?id=1035457926&type=Purple%20Software";"1035457926";64;"en";"NEGATIVE"
100;6234431735;"kashme@27";"https://itunes.apple.com/us/reviews/id807117511";"4.2.0";2;"Works for a while and then stops completely.";"The problem I have noticed is video recording stopped completely and deleted and added the device but the issue exists. However the chime works and notifies. One of the inconsistent apps of all. Definitely feel the purchase is a bad one.";"2020-07-23T19:39:20-07:00";"https://itunes.apple.com/us/review?id=1035457926&type=Purple%20Software";"1035457926";41;"en";"NEGATIVE"
101;6823711498;"kdb94";"https://itunes.apple.com/us/reviews/id27391509";"4.2.0";2;"Why no more Notifications?";"When ADS first installed this doorbell in August, it worked great!  Motion was detected and Notifications were received as a result.  In the past month, motion detection and notifications have both ceased!   My notifications are still set to always be “on” and motion detection is ON.  We are very disappointed customers.";"2021-01-02T14:47:28-07:00";"https://itunes.apple.com/us/review?id=1035457926&type=Purple%20Software";"1035457926";51;"en";"POSITIVE"
102;4956867154;"GeorgiaBread";"https://itunes.apple.com/us/reviews/id348927941";"4.1.1";1;"Trash";"Worked for a few months and stopped working properly. We called the company and they updated the app. They helped a little, but it still does not work correctly. It doesn’t alert us as people approach the door and we are not able to cut on the live Camara once they ring the door bell. 
By the way, it’s not my WiFi strength. I have Comcast with a strong signal and I bought a WiFi booster specially to help the SkyBell to no avail.";"2019-10-16T12:54:49-07:00";"https://itunes.apple.com/us/review?id=1035457926&type=Purple%20Software";"1035457926";84;"en";"POSITIVE"
103;3263481705;"mistitwister";"https://itunes.apple.com/us/reviews/id110020276";"4.0.1";2;"No audio since iOS 12";"So far I was happy with SkyBell HD until upgrading to iOS 12. Since then I don’t have any audio on my iPhone nor iPad when visitors are trying to communicate. Device has become useless to me and support hasn’t come up with a new release since September 17. Clearly dropped the ball here - that’s what beta tests are for to ensure that apps function and are consistent.";"2018-10-04T10:26:14-07:00";"https://itunes.apple.com/us/review?id=1035457926&type=Purple%20Software";"1035457926";69;"en";"POSITIVE"
104;5899585806;"Njborn114";"https://itunes.apple.com/us/reviews/id210752105";"4.2.0";5;"Great.";"Have had mine for 2 years with No problems. People complain about it but it’s All About your Internet Speed. Bad speed bad device. Good speed great device.";"2020-05-03T17:48:54-07:00";"https://itunes.apple.com/us/review?id=1035457926&type=Purple%20Software";"1035457926";28;"en";"NEUTRAL"
105;2613809028;"Shahin773";"https://itunes.apple.com/us/reviews/id603026048";"4.0.1";1;"Not working with iPhone 6s+";"It worked before the last firmware update. After updating the application is not starting. Try so many time by uninstalling and reinstalling the application but all in vain. Giving 2 star and if you fix the bug will give you a 5 star. 

Update on 30th May
Still program not starting. Can you please fix this issue? No response from you which is very disappointing. Please response.";"2018-05-29T13:30:18-07:00";"https://itunes.apple.com/us/review?id=1035457926&type=Purple%20Software";"1035457926";67;"en";"NEGATIVE"
106;7911691743;"Pendlebug";"https://itunes.apple.com/us/reviews/id185020439";"4.2.1";5;"Love it";"Super clear video. App works great.
Any negative reviews seem to be related to user error, poor internet service needing upgrade, or lack of patience. 
My whole family loves it.";"2021-10-13T16:04:41-07:00";"https://itunes.apple.com/us/review?id=1035457926&type=Purple%20Software";"1035457926";30;"en";"POSITIVE"
107;7866206070;"BStreett 975";"https://itunes.apple.com/us/reviews/id269630373";"4.2.1";2;"Troublesome";"About two updates ago I was no longer able to zoom during live monitoring and about 90% of the time the video is black and all I get is audio. I can go back and access the on-demand video and watch it then. Tells me the camera is working correctly.";"2021-10-01T10:14:47-07:00";"https://itunes.apple.com/us/review?id=1035457926&type=Purple%20Software";"1035457926";50;"en";"NEGATIVE"
108;2138961968;"Hollywood food";"https://itunes.apple.com/us/reviews/id295022713";"4.0.0";5;"Love my Skybell and the new app";"The latest app is fast and the history is the best part.  If you have more than 1 skybell like do it was a treat.  Skybell installation is simple and fast.  It took me about 10 minutes from start to finish!!!";"2018-01-28T20:00:18-07:00";"https://itunes.apple.com/us/review?id=1035457926&type=Purple%20Software";"1035457926";41;"en";"POSITIVE"
109;7237462210;"orgngrnder";"https://itunes.apple.com/us/reviews/id328143621";"4.2.1";1;"Below Par Operation";"Listen. It’s a doorbell with WiFi, motion detection and camera/video. And it used to work well. Nothings changed on my end. Your support states minimal assistance to alleviate issues. The mass reviews of this Skybell HD speak columns that you don’t know what you’re doing with this product. It’s not rocket science. Fix the issues with your crappy product as you fail your customer in security and peace of mind.";"2021-04-18T12:51:01-07:00";"https://itunes.apple.com/us/review?id=1035457926&type=Purple%20Software";"1035457926";70;"en";"POSITIVE"
110;2127298086;"ClaytonJS";"https://itunes.apple.com/us/reviews/id110877581";"4.0.0";3;"New update is a step backwards";"Thumbnails of the videos are too big. To view live you have to switch screens, which takes more time. The ability to view live quickly is the most important thing, and that’s more difficult with the new update.";"2018-01-25T19:07:42-07:00";"https://itunes.apple.com/us/review?id=1035457926&type=Purple%20Software";"1035457926";38;"en";"POSITIVE"
111;7738045719;"argh update broke it";"https://itunes.apple.com/us/reviews/id157025989";"4.2.1";1;"What’s the point of the updates? When they don’t work";"It’s been a roller coaster ride of isolated at certain updates the skybell works perfect and now I can’t even pull up a live feed on low or high resolution on WiFi or via lte on my phone. 

I’m taking this junk off and switching over to netatmo doorbell cam

Tired after 3 years of crappy unreliable live feed and app use";"2021-08-26T13:20:58-07:00";"https://itunes.apple.com/us/review?id=1035457926&type=Purple%20Software";"1035457926";62;"en";"NEGATIVE"
112;4021757306;"KOB82";"https://itunes.apple.com/us/reviews/id495684258";"4.1.1";1;"Works initially and then not at all";"It worked out of the box. Notifications were great, it was fast, storage was free. After a few months it stopped working all together. I don’t get notifications, it constantly resets itself, it is very hard to get live video. I have troubleshot this thing to oblivion. Including moving my router and nothing will fix the issue. I highly do not recommend this product.";"2019-04-16T16:42:04-07:00";"https://itunes.apple.com/us/review?id=1035457926&type=Purple%20Software";"1035457926";64;"en";"POSITIVE"
113;2888053943;"Mikecorn";"https://itunes.apple.com/us/reviews/id143797498";"4.0.1";1;"Motion Detection no good";"The doorbell button when pressed, sends and instant notification and you can see who is there and talk to them. On the other hand, the motion detection refuses to pick up anyone there and send me a notification.   No matter what I change it will not work. That is the second brand new SkyBell with the same problem. I have excellent upload and download speeds with and excellent connection status to the SkyBell.";"2018-07-11T18:08:18-07:00";"https://itunes.apple.com/us/review?id=1035457926&type=Purple%20Software";"1035457926";73;"en";"POSITIVE"
114;2999286881;"VTJLaw";"https://itunes.apple.com/us/reviews/id371027384";"4.0.1";2;"Unusable for the reason we bought it";"The motion detection sensitivity is not configurable enough so I get notifications non-stop from car traffic 20 feet away even on the lowest setting yet it misses detections right on my porch. 
The connection to the camera is also unreliable and way too slow to actually catch anything in time when needed.";"2018-07-31T21:48:15-07:00";"https://itunes.apple.com/us/review?id=1035457926&type=Purple%20Software";"1035457926";52;"en";"NEGATIVE"
115;3237722338;"Bmoreno74";"https://itunes.apple.com/us/reviews/id100282099";"4.0.1";1;"Terrible App";"This app never works and it never brings up the camera when I need it the most. It usually takes no less than 5 mins for the camera to pull up a picture if it even pulls one up at all. Most of the time its just a black screen with the spinning circle in the middle. I have a perfectly good internet signal going to it and I am still having issues.";"2018-09-27T17:58:06-07:00";"https://itunes.apple.com/us/review?id=1035457926&type=Purple%20Software";"1035457926";73;"en";"POSITIVE"
116;2343736225;"Thevans8903";"https://itunes.apple.com/us/reviews/id102394098";"4.0.0";2;"No ability to share videos anymore!?!?!";"Why would you take the ability to share videos away from customers???  This is insane that I have to allow someone acces to or invite them to share a skybell video.  Please put this back as a feature or we are getting a different doorbell.

Period.";"2018-03-24T22:17:29-07:00";"https://itunes.apple.com/us/review?id=1035457926&type=Purple%20Software";"1035457926";46;"en";"POSITIVE"
117;3064477306;"tim payne";"https://itunes.apple.com/us/reviews/id855190542";"4.0.1";1;"Terrible.";"I don’t what they did but this thing is absolutely awful. It worked great when I bought it a few months ago now it randomly goes offline. I have a repeater right next to the door so the signal is perfect. They should have a function is the app to reset the doorbell. Having to delete the door bell and re syncing it is way to time consuming. 

I should have bought a ring.";"2018-08-14T12:01:48-07:00";"https://itunes.apple.com/us/review?id=1035457926&type=Purple%20Software";"1035457926";74;"en";"POSITIVE"
118;6743484586;"MarkDeMoss";"https://itunes.apple.com/us/reviews/id277744527";"4.2.0";5;"So far it's been perfect";"I’ve had my sky bell HD since 2016, over the past four years it’s worked well. No complaints here as of Dec 2020. Love the free 7 day cloud storage.";"2020-12-11T19:18:25-07:00";"https://itunes.apple.com/us/review?id=1035457926&type=Purple%20Software";"1035457926";30;"en";"POSITIVE"
119;2251078344;"Lovesgirlystuff";"https://itunes.apple.com/us/reviews/id27299468";"4.0.0";1;"Awful";"After the new iOS update, our app completely stopped working. I even uninstalled and reinstalled and it still won’t show any activity. Aside from that there’s always a 30 second to 1 minute delay of activity when someone approaches the door or ring the bell. We don’t see them until after the fact. I would not recommend this product.";"2018-02-26T18:39:31-07:00";"https://itunes.apple.com/us/review?id=1035457926&type=Purple%20Software";"1035457926";59;"en";"NEGATIVE"
120;3012556378;"dman1961";"https://itunes.apple.com/us/reviews/id660522975";"4.0.1";2;"Needs more improvement";"The app is Ok on my iphone, but the activity portion does not work most of the time. I can se the front door and watch it live. I received a notification on my Samsung tablet, but the app is configured poorly to work on a a tablet. I am writing this review in hopes they will improve the app, as overall I like the product.";"2018-08-03T11:31:28-07:00";"https://itunes.apple.com/us/review?id=1035457926&type=Purple%20Software";"1035457926";66;"en";"POSITIVE"
121;2155069254;"iAMmeStyle";"https://itunes.apple.com/us/reviews/id7696863";"4.0.0";3;"New filter is not really working";"The video clip tags are not always correct. A button tag is actually still a motion tag. When do filter, not all the button clips are filtered in since the tags are wrong. It make the filter function like a junk useless.";"2018-02-01T14:48:03-07:00";"https://itunes.apple.com/us/review?id=1035457926&type=Purple%20Software";"1035457926";42;"en";"NEGATIVE"
122;6846295665;"dontbuyskybell";"https://itunes.apple.com/us/reviews/id630710718";"4.2.0";1;"Not a good product or app";"The SkyBell products and app are not good products. They hardly ever function correctly and I can never get a live view of my camera... it is very frustrating when you want to see a love view of your front porch but it just stays on a dark screen and doesn’t ever show the live view. I do not recommend SkyBell at all.";"2021-01-08T11:21:47-07:00";"https://itunes.apple.com/us/review?id=1035457926&type=Purple%20Software";"1035457926";63;"en";"NEGATIVE"
123;3547738067;"Firejohnfarrell";"https://itunes.apple.com/us/reviews/id452048753";"4.1.1";5;"Not one problem";"I don’t get all the bad reviews. Once I changed from a 10v to a 16v transmitter, all is good. I’ve had my skybell for 2 months. Single install and not one problem.";"2018-12-19T01:15:47-07:00";"https://itunes.apple.com/us/review?id=1035457926&type=Purple%20Software";"1035457926";33;"en";"POSITIVE"
124;3279803976;"Geebros";"https://itunes.apple.com/us/reviews/id34287418";"4.0.1";1;"Horrible!";"So it worked okay before IOS 12.  Now you can’t hear out of your device.  This is a major problem.  The reason we get these is for security.  It has been a couple weeks and no update for the app to fix the issue!!!!  This is unacceptable for the amount we pay for this.  It can’t be that hard to come up with a fix for the issue!";"2018-10-08T17:51:31-07:00";"https://itunes.apple.com/us/review?id=1035457926&type=Purple%20Software";"1035457926";68;"en";"NEGATIVE"
125;3588511760;"Burt in Dallas";"https://itunes.apple.com/us/reviews/id265840749";"4.1.1";5;"App works great! Made install a snap!";"Using this app made the installation so simple and easy and quick. And the doorbell works great! The motion detector activates as it should. And the video clarity is like our TV. Very impressed.";"2018-12-29T10:17:29-07:00";"https://itunes.apple.com/us/review?id=1035457926&type=Purple%20Software";"1035457926";34;"en";"POSITIVE"
126;3543000665;"BaBoooommmm";"https://itunes.apple.com/us/reviews/id87730334";"4.1.1";1;"Awful";"My skybell worked perfectly about 6 months ago. Now, terrible. When I try to watch live, all I see is a black screen. The motion detection constantly detects motion when there is none (it will go off in 2 minute increments until I finally turn it off) then won’t detect motion when I’m waving my hand in front of it. 

It’s absolutely useless. They need to fix their software.";"2018-12-17T17:46:22-07:00";"https://itunes.apple.com/us/review?id=1035457926&type=Purple%20Software";"1035457926";69;"en";"POSITIVE"
127;3100836375;"Deb499";"https://itunes.apple.com/us/reviews/id324266322";"4.0.1";1;"Disappointed";"This app use to work and doesn’t anymore.   So now I have a doorbell that I can’t even use!   I contacted SkyBell and they said others were having issues and were working on it.  That was over a month ago!  I guess they need new techs!   I am not happy with a door bell that is now useless!   It had been over three months and I still cannot use this app!  RIDICULOUS";"2018-08-22T15:32:56-07:00";"https://itunes.apple.com/us/review?id=1035457926&type=Purple%20Software";"1035457926";72;"en";"NEGATIVE"
128;2516707949;"jrae16";"https://itunes.apple.com/us/reviews/id198519252";"4.0.0";3;"Delete All option";"Please bring back the “delete all”
Option by swiping left. With many notifications daily, this was a necessary feature that was unfortunately removed.";"2018-05-07T09:05:32-07:00";"https://itunes.apple.com/us/review?id=1035457926&type=Purple%20Software";"1035457926";23;"en";"NEUTRAL"
129;5332259925;"Monte87";"https://itunes.apple.com/us/reviews/id172480513";"4.1.1";1;"Too many false alerts - no mask zones";"The app has not been updated in over 1 year. There is no function in the app to mask off zones in the view to ignore

So you get hounded by so many false alerts from bishes blowing in the wind, reflections, shadows etc, they you end up turning off alerts. 

Look for another product with current development.";"2019-12-28T15:16:53-07:00";"https://itunes.apple.com/us/review?id=1035457926&type=Purple%20Software";"1035457926";58;"en";"NEGATIVE"
130;3293073059;"BRooskey";"https://itunes.apple.com/us/reviews/id179710110";"4.0.1";1;"Update your app";"iOS 12 was released on September 17 and since then, you can not hear audio coming from the doorbell to your device. Once the video is able to be played back, after the person has left your door, you can hear audio just fine. It is now October 12 and it is still not working. Please have your developers fix this!";"2018-10-12T06:06:13-07:00";"https://itunes.apple.com/us/review?id=1035457926&type=Purple%20Software";"1035457926";61;"en";"POSITIVE"
131;3136646256;"USMC-RAID";"https://itunes.apple.com/us/reviews/id463682101";"4.0.1";5;"Excellent product";"Excellent product and app

Key is to have a great WiFi connection, perhaps placing and extender by the window. Solved all the issues I’ve had before.";"2018-08-31T03:49:00-07:00";"https://itunes.apple.com/us/review?id=1035457926&type=Purple%20Software";"1035457926";26;"en";"POSITIVE"
132;2138942772;"LindaTech";"https://itunes.apple.com/us/reviews/id14706756";"4.0.0";5;"Love the new view";"This new app is great.  I love that I can scroll from camera to camera. It’s clean and smooth and the new history using time and dates makes sense.";"2018-01-28T19:55:35-07:00";"https://itunes.apple.com/us/review?id=1035457926&type=Purple%20Software";"1035457926";29;"en";"POSITIVE"
133;6818278372;"charmgirl13";"https://itunes.apple.com/us/reviews/id25834740";"4.2.0";1;"The WORST - Do Not Buy";"This doorbell is trash. It is literally impossible to connect it to Wifi. The online “Help” section is horrible and is absolutely no help at all. It should be so simple to connect a device to Wifi, especially through your own app, but Skybell clearly doesn’t care about customer experience. DO NOT BUY THIS PRODUCT!!";"2021-01-01T07:41:04-07:00";"https://itunes.apple.com/us/review?id=1035457926&type=Purple%20Software";"1035457926";55;"en";"POSITIVE"
134;3313872918;"Ckskorganizer";"https://itunes.apple.com/us/reviews/id101221822";"4.1.0";1;"Won’t stay connected";"This system is great when it works but horrible most often. Even worse, when it is offline and not working, it blinks a bright red to make sure the world knows that your house is unprotected.  
I try to resync it over and over with no success. Then randomly it will sync for a few weeks. Very frustrated with this system.";"2018-10-17T17:44:06-07:00";"https://itunes.apple.com/us/review?id=1035457926&type=Purple%20Software";"1035457926";61;"en";"NEGATIVE"
