"";"id";"userName";"userUrl";"version";"score";"title";"text";"updated";"url";"app";"wordCount";"language";"sentiment"
0;6778644646;"chunked_element";"https://itunes.apple.com/us/reviews/id118386098";"4.2.0";2;"Cameras good app average";"Cameras work good x2 HD slims and were the only slim ones that would fit in the narrow area I had without major mods to mounting. Picture /video quality is good. After a few years I had the plastic bracket just fall off and SkyBell sent me a replacement. One of the cameras motion sensor plastic cover has fallen off but still works. Silicone works good around the sides to seal up bc I have spiders living in one of mine setting the motion off lol. It would be nice if night mode had a option to disable the lights so to see the actual night video instead of reflections from the led lights which drown out the pictures beyond 3-5 feet. The app stopped getting updates over a year ago and it sometimes crashes and locks up. Also I’ve noticed random disconnects from the cams to the iPhone app even though I have WiFi extenders everywhere and WiFi signal is strong. Does the cameras receive firmware updates causing reboots randomly? Any chance there will be updates to the App and firmware soon? I can’t really complain though as skybell is one of the few cams that doesn’t require a subscription which I really like and appreciate. The cams I will give a 4/5. And the app 3/5. Thanks again for reading my review.";"2020-12-21T11:01:14-07:00";"https://itunes.apple.com/us/review?id=1035457926&type=Purple%20Software";"1035457926";224;"en";"POSITIVE"
1;2866171623;"RalPh8";"https://itunes.apple.com/us/reviews/id27326158";"4.0.1";5;"Used to work, now barely works";"Like a number of others that have already reviewed this doorbell I had a similar experience. When I first installed this 3.5 months ago it worked great! I mean it never missed picking up motion and anytime anybody got anywhere close to the doorbell bam! Camera on! Now it’s just an expensive normal doorbell. SOB. It won’t pick up motion anymore. Don’t know what happened. All it does is activate the camera when the button is pressed but I can walk in and out of my front door ten times and it will never detect me or my roommate. About a month ago I called SkyBell customer service not once but twice. I was told that others were having a similar issue and that I need to let them upgrade me from version 5017 to 5025. I was told that would take 3 days. I waited a week. Nothing. I called back. I was told that yes I would have to keep waiting because it was taking them longer than normal and that they were having to do the upgrades one by one. They said this time that would be closer to two weeks. Well now I’ve waited a whole month and the only thing that has happened as the skybell motion sensing has gotten even worse. I mean it’s just pathetic.  For something that originally worked great out of the box and had no flaws and did everything exceptionally well, it’s baffling how a reputable company can take something so positive and screw it all up. Really starting to regret skybell all together now. I hope they get their s#!£ figured out.";"2018-07-08T14:42:36-07:00";"https://itunes.apple.com/us/review?id=1035457926&type=Purple%20Software";"1035457926";273;"en";"POSITIVE"
2;2689436099;"Me. X";"https://itunes.apple.com/us/reviews/id107243656";"4.0.1";1;"Great at first, but now it’s horrible!";"When I first purchased and installed this door bell, it worked fine. After a few months, the doorbell stopped detecting motion. So people are able to walk right up to my front door and the doorbell detects absolutely nothing unless it’s pressed. Then and only then will I get a notification stating that someone rang the bell. As far as getting notifications that there was motion detected, that is no more. I’ve done absolutely everything that could be done to troubleshoot this issue and nothing seems to work. Oh, and as far as customer service goes, good luck. No matter what time of day that you call or how many times that you call, NO ONE EVER PICKS UP THE PHONE. You get to listen to an automated recording that states that they are experiencing a higher than usual call volume and to please be advised that your call will be transferred to a voicemail after 15 minutes (WHICH IS GUARANTEED TO HAPPEN). When someone called me back a day or two later, I was advised that my software might be out of date and that the only way to update it would be on their end. I was told to give it a couple of days and that I would get a phone call back. That never happened. I can almost guarantee that my software is not the issue and that they can’t figure out what the problem is.
I’m going to give the ring doorbell a shot.";"2018-06-13T14:42:51-07:00";"https://itunes.apple.com/us/review?id=1035457926&type=Purple%20Software";"1035457926";249;"en";"POSITIVE"
3;6021792021;"OmeNay";"https://itunes.apple.com/us/reviews/id234330726";"4.2.0";2;"I had it for 2 years I want to love it";"The color night vision is awesome the app is not up to par I cant integrate it with google and I’m forced to change this bell The  of motion detections don’t allow you to grid events by day so you have to scroll scroll scroll and after you watch the recorded event it takes you back to the top again then guess what you have scroll scroll scroll so frustrating and it disconnects about 2 times a month I tried my best and 2 years equals patience the app hasn’t updated since I was waiting for an update but the look of the product and the quality of camera is amazing hd and radius of coverage is my whole block and street but it needs a better app it should launch updates to keep the bugs fixed and up to date of tech savvy ones I think I will wait 6 more months and pray for an update";"2020-06-01T06:11:23-07:00";"https://itunes.apple.com/us/review?id=1035457926&type=Purple%20Software";"1035457926";158;"en";"POSITIVE"
4;3248901698;"lswelsh";"https://itunes.apple.com/us/reviews/id149038399";"4.0.1";1;"Return ASAP";"If we could return our SkyBell we would but it came preinstalled when we bought the place. From the beginning it was not great. To start we had a difficult time getting it to connect. Once it finally started working we found that it doesn’t detect motion well. It should detect motion within 5 feet but we have people walk right up to the door and it doesn’t notify us. Some homeless guy came up and used our patio outlet to charge his phone at 2am and we had no idea. The outlet is practically below the doorbell. It wasn’t until the guy came back to check on his phone that we were notified of motion. The video starts at the top of the guys head because he is already bent over checking his phone. Now we have no audio and we cannot review videos of recorded activity. The audio went out when our device was updated to the new iOS 12 a couple weeks ago. Skybell’s reply when I reported this was to uninstall iOS 12 if audio is important. Easier said then done. Now we have no audio, we are not being notified of all activity near our door, and now it’s been more than 2 days since our log updated any activity. If you haven’t bought skybell don’t. If you just bought it TAKE IT BACK. It is not worth your time.";"2018-09-30T12:20:55-07:00";"https://itunes.apple.com/us/review?id=1035457926&type=Purple%20Software";"1035457926";235;"en";"NEGATIVE"
5;3166101432;"Class77";"https://itunes.apple.com/us/reviews/id27663525";"4.0.1";4;"Skybell started working again!";"I bought a competitor's doorbell to replace the Skybell because I was frustrated. The motion detector had not worked properly since June and for the last 3 weeks, nothing worked. I wrote Skybell and they updated me unannounced to Firmware 1148. Out of the blue, I got a motion detection,  but my wifi strength took a nosedive for no reason.  I got to my vacation home and got a motion alert when I got out of my car. I reset the router locally and about 1 hour later, my wifi strength returned.  

Since then, I gotten motion alerts every time we entered or exited the house and the alerts were the perfect distance from the front door. I had plenty of time to see who the person was.  The doorbell was working again in the way I had intended it to when I bought it. I'm returning the other doorbell.

I still would like to know what the 4 filters(motion, button, on demand, integration) and I can't find that information anywhere. What exactly do all the filters do if they are checked and applied. That's my only small criticism";"2018-09-07T22:19:06-07:00";"https://itunes.apple.com/us/review?id=1035457926&type=Purple%20Software";"1035457926";189;"en";"POSITIVE"
6;3193508875;"Nicholas306";"https://itunes.apple.com/us/reviews/id554019489";"4.0.1";1;"Do not recommend";"I’ve had mine for over a year now. I purchased SkyBell because it would integrate with my Total Connect. At first, it worked pretty good. It never had a good connection to the network, but it worked most of the time. Slowly it got worse, until the device was offline a lot, then always. I even upgraded my WIFI, but the SkyBell would just never have a solid connection. Zero problems with my Nest thermostat, which is actually further away from the router than the SkyBell. I can’t even get the thing to go into sync mode anymore, even with a hard reset. I called tech support, no answer. Decided to receive a call back from them. I got the call back 2 days later. Completely useless tech support because I wasn’t standing around my SkyBell waiting for them. I’m a special systems tech. I install fire alarm, security systems, access control systems, cameras, and other systems. I’ve placed many, many devices and systems on networks before, but not the SkyBell. Good thing I found that this device is junk before recommending to a customer.";"2018-09-15T14:53:22-07:00";"https://itunes.apple.com/us/review?id=1035457926&type=Purple%20Software";"1035457926";185;"en";"NEGATIVE"
7;5484895939;"406Girl";"https://itunes.apple.com/us/reviews/id28324408";"4.1.1";3;"Needs improvements";"So I live in a large building and they’ve included this SkyBell for all units. Since I’m not in a neighborhood, this thing goes off often, so I’ve had to turn off the notifications for motion. The camera and doorbell work well. No complaints there, however, the app needs a lot of improvements.

App cons:
If you view a video in the “activity” feed, once you’re done viewing the video, the app automatically takes you all the way to the top of the videos instead of keeping you in the place you’re searching (so if you’re searching for videos that are towards the bottom, you get sent to the top and have to scroll all the way down through all the other videos when searching for a specific event). So it would be more efficient to watch a video and pick up where you left off on the list (especially when we have 50 different video events).

When you download a video to your cloud it doesn’t time stamp the video.

When the doorbell is activated, if I try to view/talk to the person at the door, the app takes a solid minute or two to connect. So usually someone leaves before I can address them.

You can’t access your SkyBell account, videos, activity, etc. online. It’s cell phone app only (unlike Nest, Reolink, etc).";"2020-02-03T17:32:47-07:00";"https://itunes.apple.com/us/review?id=1035457926&type=Purple%20Software";"1035457926";225;"en";"POSITIVE"
8;2475500106;"Chompin' Skip";"https://itunes.apple.com/us/reviews/id28625321";"4.0.0";1;"Buy the Nest Hello or Ring";"There’s a reason why the other manufacturers sell more - they have their devices and the apps figured out. I had this doorbell-cam professionally installed and immediately it. Let’s not even talk about the issues with the doorbell itself yet - just the misleading advertising is enough to trash this doorbell. They say it works with the Nest app - sure it does - the only thing it does with Nest is find out when you’re home or gone. That’s it. It doesn’t work in the Nest app at all!? And then if I address the doorbell functionality itself? It’s just awful: it never stayed latched to our WiFi - it was consistently unreliable at notifying us of visitors (even when they RANG the doorbell) - and it would periodically just start ringing for five or ten minutes at a time. Seriously - skip this doorbell and go with either of the two manufacturers that have it figured out. (I personally prefer the Nest - I was able to install it myself in about an hour and it’s been amazing ever since we turned it on)";"2018-04-27T10:40:44-07:00";"https://itunes.apple.com/us/review?id=1035457926&type=Purple%20Software";"1035457926";186;"en";"NEGATIVE"
9;5236909184;"Geez, nickname already.";"https://itunes.apple.com/us/reviews/id230021382";"4.1.1";3;"No sleazy subscription “service“.";"Favorite thing about the skybell is that there is no sleazy subscription “service” to view my own videos, so based on that alone this is the best doorbell camera available that I know of.  Amazing to me that some people are dumb enough to pay infinite monthly fees for stuff like that, btw.

Would love to see them expand into similar offerings like garage cameras, porch- and carriage-light cameras, homekit compatibility, a roku channel or something so I can see who’s at the door on my tv, etc.

However, it is pretty cheesy that they lied about having a temperature sensor, and though they did honor their warranty on my first one which was defective, they told me that its replacement had no warranty at all, so I guess it’s just luck that the replacement is doing ok so far, otherwise it would’ve been a complete ripoff.";"2019-12-05T08:53:29-07:00";"https://itunes.apple.com/us/review?id=1035457926&type=Purple%20Software";"1035457926";147;"en";"POSITIVE"
10;6761123727;"Drashish123456";"https://itunes.apple.com/us/reviews/id103672035";"4.2.0";2;"Why are they so behind";"2 years ago, after lots of research I investigated in SkyBell because of its costs and integrations.  I passed over Ring because of rings costs.  2 years later there are over a dozen smart door bells.  Each has improved their product but Ring really has (excluding the hacking and causing fire issues :) My primary is that SkyBell hasn’t improved functionality at all.  It’s becoming outdated.  The software doesn’t even have a snooze feature like ring does which is helpful when windy days cause items to move in its view.  I can’t suppress it like I can on ring.  So I have to live with false alarms all evening on blizzard like evenings like now. My ring flood lights (and I have 3) haven’t had a single false alarm.";"2020-12-16T16:19:57-07:00";"https://itunes.apple.com/us/review?id=1035457926&type=Purple%20Software";"1035457926";129;"en";"POSITIVE"
11;3850490690;"L U M S";"https://itunes.apple.com/us/reviews/id194409262";"4.1.1";5;"Free Free Free";"Have had this for more than two years now and still works fine even after 105 degree highs and -20 lows. I’d estimate that 90% of the time the motion detection works fine, sometimes light changes and wind can cause false detections and on occasion it may not pick up a package delivery. Once or twice a year it disconnects itself and I’ve had to reinstall on the app but has worked fine afterwards, may very we’ll be something caused by my Wi-Fi. No other Wi-Fi issues for me, the device is outside so you need to make sure there are not too many barriers between your router and the device. Unlike other options it’s totally free to view videos, keeps them stored for free, and you can download videos to your phone.";"2019-03-06T12:38:00-07:00";"https://itunes.apple.com/us/review?id=1035457926&type=Purple%20Software";"1035457926";133;"en";"POSITIVE"
12;3529524613;"billy'n'holly";"https://itunes.apple.com/us/reviews/id126272059";"4.1.1";5;"Thank goodness for v4.1.1 update!";"Ever since v4.0.0 (and incl v4.0.1 and v4.0.2), the app would ALWAYS crash on both my iPhone SE and my wife’s iPhone 5S, both on the current iOS versions ... this was obviously because the Skybell dev’s weren’t testing or reading the older 4” screen size. This has seemingly changed and I’m so excited!

BTW, unlike other reviews, I’ll tell you to stay clear away from Ribg, since you must PAY to get your own video recordings, but also the device leaks your WiFi credentials to anyone who can plug into the device.  Skybell avoids this with an ad-hoc WiFi Network to your device, and then the device copies the WiFi over to the Skybell, ao that credentials are an input-only setup (much more secure).";"2018-12-14T04:30:39-07:00";"https://itunes.apple.com/us/review?id=1035457926&type=Purple%20Software";"1035457926";125;"en";"POSITIVE"
13;8136758241;"A Link To The Apps";"https://itunes.apple.com/us/reviews/id176981771";"4.2.1";3;"Unclear guidance for incompatible Slimline models";"Update: So upon reading the developer’s response, I did some more digging and found that the model installed in my home is in fact a Slimline. I’ve amended my review from 1 star to 3 stars. By way of feedback, perhaps the developer may want to consider updating the app to recognize when an incompatible Slimline model is being used and notify the user accordingly? I was pulling my hair out trying to troubleshoot because every indication within the app seemed to imply that it was compatible and the issues were network-based.

I’m not interested in having a doorbell camera that requires a monthly security monitoring fee to use, so I’ll have to replace it eventually—perhaps with one of the stand-alone Skybell models, if they’re found to be reliable.";"2021-12-16T09:16:28-07:00";"https://itunes.apple.com/us/review?id=1035457926&type=Purple%20Software";"1035457926";129;"en";"POSITIVE"
14;7682022112;"CruiseCacher";"https://itunes.apple.com/us/reviews/id108189458";"4.2.1";5;"Works Flawlessly!";"I’ve had my SkyBell HD installed for over two years. While I’ve had problems (as many other people reported) with motion detection not working, or not being able to play back activity, it has been working flawlessly for the past few months. (I should note the “button pressed” notifications and live view has always worked fine on my unit.)  I can only assume SkyBell pushed out an update sometime in the recent past that fixed the problems, and it’s been rock solid since. I chose this model because they don’t charge monthly fees.  Super happy with the product now that it’s fully back in action.";"2021-08-11T14:38:55-07:00";"https://itunes.apple.com/us/review?id=1035457926&type=Purple%20Software";"1035457926";105;"en";"POSITIVE"
15;3467239737;"andrearuthandrea";"https://itunes.apple.com/us/reviews/id188433747";"4.1.1";1;"Should have went with Ring";"Loved this at first, first month: loved not having a subscription cost, the motion sensor worked great, the live video and intercom worked great. 5 stars. Even bought one for my parents home.

Fast forward month by month it all got worse until today, a little over a year in:  the motion sensor works 1 out of 10 times the delivery man comes straight up to the door.  The app won’t connect to show live so I can’t see or talk to the person at the door. Strong internet connection, still no joy.  The 1 in 20 times I can get the live video to connect the intercom is then garbage, it’s garbled and delayed, a very bad experience for both parties.

I absolutely should have went with Ring. Over time the SkyBell product gets worse until it reaches the point of being worthless. As opposed to what should happen over time with fixes and upgrades that make the product better.";"2018-11-27T11:44:57-07:00";"https://itunes.apple.com/us/review?id=1035457926&type=Purple%20Software";"1035457926";161;"en";"POSITIVE"
16;2969308066;"Texh642";"https://itunes.apple.com/us/reviews/id110283767";"4.0.1";1;"Does NOT support all door bells out of the box";"For every house there is a different door bell. As such, you may find yourself in the situation where you need to pull more money out of your wallet to purchase their adapter, different transformer(will not work on 120v AC), a resistor for DC connection, and so on.
I am not complaining about the extra price  that I need to pay for those items, but I complain about the extra work and research needed to implement this video doorbell into a regular house.
Voltage, AC, DC, AMPs, electricity safety, a voltmeter and knowledge how to work with it, are just a few of the drawbacks.
I am an IT tech and by far I am more knowledgeable and ready to pick up the needed info to accomplish the task of connecting it and configure it, but the hurdles don’t stop here, and for other, they don’t even get to the point of configuring the device.
So now, the device blinks different color codes, and you will match each type of blinking to a map/legend. Let’s say for a minute - no biggie - but now the device does not do what it is supposed to do - e.g. syncing, broadcasting video and sound, in 20 attempts it works maybe once, if you’re lucky.
Now, luck is not a thing for a computer guy. Electronics should be binary, either work, or not. Anything in between is not acceptable.
Not a good job, skybell.";"2018-07-25T17:43:01-07:00";"https://itunes.apple.com/us/review?id=1035457926&type=Purple%20Software";"1035457926";242;"en";"POSITIVE"
17;2122405548;"Alarmdealer5446";"https://itunes.apple.com/us/reviews/id349900239";"4.0.0";4;"Overall a great product.";"I have installed HUNDREDS AND HUNDREDS of these. I have 4 at my house. They work about 90% of the time AS LONG AS YOU HAVE GOOD WIFI. Don’t complain if you have garbage WiFi on the other side of your house. Anyway, you need AC or DC power which is nice. Minimum 2mbps upload is really what works well. I’ve installed them with a .3mbps upload and it worked. The biggest issue people had was it not ringing inside their house. You need a GOOD functioning doorbell for it to work.  If you don’t, then it won’t work like that. I’ve talked to reps at skybell and said they really need to add an in line chime between the skybell and the transformer to fix this issue.  All things considered they’re great. Easy set up and pretty reliable.";"2018-01-24T09:34:36-07:00";"https://itunes.apple.com/us/review?id=1035457926&type=Purple%20Software";"1035457926";139;"en";"POSITIVE"
18;3270927294;"NaNurse";"https://itunes.apple.com/us/reviews/id28932654";"4.0.1";4;"Great Value";"I’ve owned a SkyBell since 2016 and now have had them in two houses.  My bottom line is that there is tremendous value and it seems others have had bad experiences but mine has been a good one. I haven’t owned Ring or any other video doorbell so I can’t speak to comparisons but what I do know is that my motion activation has worked well, I get alerts on my phone and I do not have to pay any sort of monthly fee to see my archived video. 

Most recently the unit disconnected from my router when Netgear updated their firmware on my Orbi unit. I called SkyBell support after trying to resync myself and they walked me through tying the unit the 2.4 GHz channel of the Orbi Mesh network and the unit is back up and running.  

Good unit, good value.";"2018-10-06T09:11:29-07:00";"https://itunes.apple.com/us/review?id=1035457926&type=Purple%20Software";"1035457926";144;"en";"POSITIVE"
19;6902384550;"Xerox employee";"https://itunes.apple.com/us/reviews/id86171197";"4.2.0";4;"Why all the hate? Doorbell works great.";"I’ve had the sky bell for three years. During this time the doorbell has worked flawlessly along with the app. However there are a few things that I wish they would update on the software.

1- A Must IMO - Ability to either focus motion sensor zone or intelligently eliminate multiple notifications for things like shadows, tree branches and/or car headlights.

2- Add integrations to other camera systems aside from Nest. Other than that, I’ve been very happy with it because I do not have to pay for an expensive subscription service, the pricing was reasonable for the system, and cloud based storage for videos.";"2021-01-22T19:42:15-07:00";"https://itunes.apple.com/us/review?id=1035457926&type=Purple%20Software";"1035457926";105;"en";"POSITIVE"
20;3074605173;"Reviewing_Stuff4U";"https://itunes.apple.com/us/reviews/id239423192";"4.0.1";1;"Don’t do it";"If you’re reading reviews, you are probably thinking about buying a Skybell. Save yourself the trouble and get a different product. If you read reviews by people who have had this for more than a few months, they are almost all negative. Like most folks, ours worked well the first few months. We’ve had it almost a year now and it’s a brick. WiFi connection is horrible (and no, it’s not my router). And even when it does have a decent connection, the motion sensor only works about half the time. These two issues make it useless. And as so many others have said tech support is nonexistent. Literally. I got two replies to my request for help and then they just stopped. I sent 3 emails asking for continuation to my open ticket and I got zero reply. Trust the reviews from people who have had this for more than a week. It’s junk.";"2018-08-16T16:33:55-07:00";"https://itunes.apple.com/us/review?id=1035457926&type=Purple%20Software";"1035457926";155;"en";"POSITIVE"
