"";"id";"userName";"userUrl";"version";"score";"title";"text";"updated";"url";"app";"wordCount";"language";"sentiment"
341;756246080;"Bear2001";"https://itunes.apple.com/us/reviews/id105909121";"2.6.1";1;"Reliably unreliable";"I rarely write reviews... I don't remember the last time I wrote one but I feel I need to warn fellow customers on how terrible this product is.  In honesty when this product works its pretty good....nice picture, good quality audio, fast connection time, the ability to view using  my phone from anywhere.  However, I have had this product over a year and it fails to connect constantly.  Sometimes if you try and try again you will eventually connect and other times it won't work for weeks (not at all exaggerating).  At the time of writing this review it hasn't worked for about a 1 week and counting.  I think the camera itself is good but I am guessing the background ""cloud"" service is where the issue lies.  And you have to use this service  no matter what you are using to access the camera.  It's particularly disturbing given what dLink does as a company...given my experience I probably wouldn't buy a single piece of networking equipment from this company.  I hope this helps but I am guessing if you are looking into this app you have already bought the product...return it not so much to recover your money  but to maintain your sanity.";"2013-02-21T19:08:46-07:00";"https://itunes.apple.com/us/review?id=372571229&type=Purple%20Software";"372571229";204;"en";"POSITIVE"
342;1048963159;"Th3rmos";"https://itunes.apple.com/us/reviews/id112818307";"3.3.3";1;"Bring back the old controls";"Ever since the ""swipe"" update, I have hated this app.  When I'm needing to survey a room - I would like to ACTUALLY move the camera enough to get good coverage. This ""swipe"" thing is awful. It takes forever to be detected, then moves a fraction of what I swipe (and I'm talking to the point of being USELESS).  Almost tempted to get rid of this device if THIS is what you guys do for ""updates""- did you even run it through testing?? Very disappointing- feel like I wasted money.
The new update also forces the camera into the ""center"" position, which is NOT helpful or better. With the controls being horrible as is, now anytime I check on my son, I have to go through at least several minutes of swiping the screen, waiting for the camera to get the signal and pan towards where I want, and repeating until I can see if he's asleep or if he's having issues.  I am disappointed that I paid extra for quality and ""ease of access"" - my $65 monitor was a much better option.  I wish they'd stop changing this app- you are not helping... It has only gotten worse and become a headache to work with.";"2014-08-18T09:45:31-07:00";"https://itunes.apple.com/us/review?id=372571229&type=Purple%20Software";"372571229";207;"en";"NEGATIVE"
343;1363158679;"iseverynictaken";"https://itunes.apple.com/us/reviews/id191055591";"3.6.2";2;"App is okay but the D-link firmware is terrible";"Unfortunately this is a two-part system and the firmware in the cameras (I have 3, and 2 are different models) is awful.  I have a myriad of devices that with a simple SSID and password connect to my WiFi.  Blu-ray, AppleTV, Stereo, etc.  The D-link cameras are the only devices I have that cannot connect to the WiFi by selecting the SSID and entering the password in the GUI --The built-in webpage for configuration.  All of these cameras will only connect if you manually use the WPS feature (if you have it) pressing the button on both camera and router.  I need to move it around on SSID without physical access and so this is a problem.  Every other device out there can do this without WPS why not the D-link?  I tried 3 brands of WiFi router (one with an open source firmware) but WiFi can't connect to any.  The wired cable works fine, so does WPS.  D-link Tech support gives me the runaround I suppose because they are trying at all cost to not bump me up to a higher tech that might be able to understand the problem. Very frustrating.";"2016-04-13T20:07:37-07:00";"https://itunes.apple.com/us/review?id=372571229&type=Purple%20Software";"372571229";193;"en";"NEGATIVE"
344;1439595521;"Esteban K.";"https://itunes.apple.com/us/reviews/id46219825";"3.6.6";5;"Convenient, excellent app";"This app has improved over the years, thereby making the cameras (my initial investment) actually become *more* useful over time. Performance of app is good on both new and old iPhones/iPads. 

MY WISH LIST: The iPad version allows (A) multiple cameras to be viewed at once...a feature that would be nice to have implemented on the iPhone app (especially now that screen resolutions and screen sizes have increased for the Apple's phones). (B) For ""power users"", it would be nice to have ""user-defined, preset positions (views) for motorized cameras...for example, if I am viewing the table and want to see the deck, it would be nice to select ""DECK"" and have camera pan/tilt to the preset position I defined. Then, to see what's happening at the table, instead of manually panning/tilting, I could simply select ""TABLE"" from my user-defined list and the camera would automatically move.";"2016-08-26T07:28:27-07:00";"https://itunes.apple.com/us/review?id=372571229&type=Purple%20Software";"372571229";146;"en";"POSITIVE"
345;1318429784;"Veryunhappywiththisapplication";"https://itunes.apple.com/us/reviews/id190751510";"3.6.1";1;"Does not work. Very disappointing.";"My boyfriend and I recently purchased the DCS-5222L camera for our home and were initially very pleased with it. We are very impressed by the quality of picture both the day and night lenses capture, as well as the panning, motion sensor, and microphone features. 

Imagine how disappointed we were when we discovered how incredibly poorly the IOS app functioned. Neither myself nor my boyfriend were able to get a consistent connection to our home camera via the app. The Mydlink website does not allow us to connect via safari, either. We even drove to the next town, to see if the issue was our cell phone service providers (he has Sprint and I have Verizon), and even at 4 bars of LTE service, we were still unable to connect. 

The reason we purchased your camera was to give us the ability to view it from our smart phones at any time, any place we had internet connection. I was deeply saddened when I had to remove your camera from our wall and box it back up. I am VERY sad that today I will be exchanging it for another brand. 

Because we honestly were SO impressed and pleased at the quality of the camera itself, I wanted to reach out to you and suggest that your company makes some serious improvements to the IOS app. The app reviews are very poor, as many other users seem to have experienced the same issues I do. 

Thank you for taking the time to read this. I hope you all have a wonderful day! :)";"2016-01-18T05:48:50-07:00";"https://itunes.apple.com/us/review?id=372571229&type=Purple%20Software";"372571229";263;"en";"POSITIVE"
346;453709454;"Tasop7";"https://itunes.apple.com/us/reviews/id85635718";"2.1.0";5;"They added audio!";"D-Link added the ability to stream audio when viewing the camera through this app... thank you!!!

Having the ability for the camera to send email alerts when audio is detected above a configurable threshold would be amazing... sadly, the new cameras I just bought from you don't have that feature.  These types of features would really make your products stand out compared to the other manufacturer's IP cameras.  Don't overlook the little stuff, your customers want and appreciate feature-rich products!  How about the ability to view more than one cam using split screen?

But in general functionality, this system works very well. I view the cameras I have over 3G all the time. For what I paid for everything, I'm very happy with this system.";"2011-08-16T10:42:28-07:00";"https://itunes.apple.com/us/review?id=372571229&type=Purple%20Software";"372571229";125;"en";"POSITIVE"
347;1531888538;"Talihassee";"https://itunes.apple.com/us/reviews/id86470750";"3.7.1";1;"App is OK, Cameras are trash";"I have three DCS-930L's and two DCS-932's. If the power goes out or the router reboots, all the cameras cannot restart their web service communication which knocks them all offline until I power cycle them. They will reconnect to the router and I can view them locally but they all will drop their ability to be viewed remotely. This is a known problem with D link cameras and they seem to not care enough to fix this via firmware. 

The app has no ability to enable or adjust settings for the snapshot feature. This is the feature that can automatically take a photo(s) if motion is detected. The only way to configure this is by logging into each camera manually via a web browser. They need to add this feature to the app so I can toggle it remotely. 

The added ability to record from the app is nice. My biggest problem is the reconnection issue. This makes these cameras not reliable if you want to leave them in a remote location. Please fix this DLink!";"2017-01-27T15:54:50-07:00";"https://itunes.apple.com/us/review?id=372571229&type=Purple%20Software";"372571229";176;"en";"NEGATIVE"
348;1235453982;"aniceberg";"https://itunes.apple.com/us/reviews/id3443694";"3.4.5";3;"Good app, could be great";"I like the app, just wish these features could be added (where  it can supported in the camera firmware.)

1) Please make it possible to share a specific camera with other MyDlink user accounts so that you don't have to share your credentials and all the cameras tied to an account. There would be a share feature where you'd select a contact from your device and the app would send an email inviting them to share that camera or cameras. 

2) Add a snooze feature to the motion alerts so that the user can instruct the app to temporarily ignore motion events from specific cameras for a specified time period (e.g. 1 hour)

3) the camera should not only send motion alerts to the smartphone, but accompany it with an image of the motion so that the user can quickly determine whether to ignore the alert without the need for opening the app and connecting to the camera

4) Allow users to set the motion detection cells and adjust overall sensitivity level 

5) Allow users to manually adjust sensitivity for specific cells

6) there should be a motion activity log for each camera, and a combined list of all motion alerts with a little thumbnail focused on the area in which the motion was detected. When tapped it should open a full-frame of the captured motion activity.";"2015-07-30T07:25:08-07:00";"https://itunes.apple.com/us/review?id=372571229&type=Purple%20Software";"372571229";227;"en";"POSITIVE"
349;732368463;"Eclipse1825";"https://itunes.apple.com/us/reviews/id145887593";"2.6.0";5;"Great App and Camera!";"Despite all the negative reviews this is a great app! I had the trouble with the ? And not being able to use the cameras but all is well now. Sometimes tweaks don't always work. They may work in a controlled environment but not in the consumers hands. So I expect there to be some bumps. It works great on my iPhone 5! It loads up quick and I am viewing in seconds whether I am in my home network or on LTE. It also works great on my iPhone 4 also.  I do wish the would update the app to take advantage of the screen real estate on the 5 though. All in all it does what it says. The snapshot is also a great feature for the times you are watching and motion detection doesn't catch it because it is to small and far away to pick it up.";"2013-01-19T10:27:41-07:00";"https://itunes.apple.com/us/review?id=372571229&type=Purple%20Software";"372571229";151;"en";"POSITIVE"
350;526696170;"Soyza";"https://itunes.apple.com/us/reviews/id24622351";"2.4.0";4;"It's ok, does what it says";"Could be better? Could be native ipad/iphone, could record video locally, could have a nicer interface.. All other complaints are not about the app, but related to the mydlink service which sometimes fail to connect, or the camera image quality and audio quality.. If you really want this, then get a better camera and a faster internet connection, and connect directly to your camera via router port forwarding. Otherwise, the camera and the app serve its purpose. I' m actually going to buy a couple more cameras to watch other rooms while I'm away. People have to start giving reviews to the app instead of criticizing the hardware and underlying internet services.";"2012-02-11T20:23:45-07:00";"https://itunes.apple.com/us/review?id=372571229&type=Purple%20Software";"372571229";112;"en";"POSITIVE"
351;1472117430;"bedouin";"https://itunes.apple.com/us/reviews/id31064881";"3.6.6";2;"Slow Connections";"First, my camera has a static IP address.  Why does this app need to search for it after every launch?  Just let me enter the information manually instead of using its braindead, hideously slow, autodiscovery.  If I open the app it's usually because I want to see something that is going on at that very second; by the time it actually locates the camera what I wanted to see has already concluded!

Second, I *ONLY* access my camera locally and have no intention of creating an account to use with D-Link's web-based services.  Why does the app begin with a splash screen asking for a login and password for the website instead of just immediately letting me view my camera locally?

Provide a means for me to bypass autodiscovery and add a camera manually.  By attempting to make it easier to use you have made it worse for people who do not need their hand held through the setup process.";"2016-10-24T01:02:25-07:00";"https://itunes.apple.com/us/review?id=372571229&type=Purple%20Software";"372571229";160;"en";"NEGATIVE"
352;1073596039;"designhero";"https://itunes.apple.com/us/reviews/id8337409";"3.3.3";2;"Works 50% of the time, no customer service";"Had a pair of DCS-5010L cameras for almost a year now. The main reason I went with the mydlink setup was for the app. I check the cameras a few times a day, pretty much everyday. About half the time the app will not connect to cameras, giving an unending connecting notice, or just an outright error message. This will happen no matter how close or far I am away from the house. I constantly cannot connect to the cameras while sitting in my driveway. One of my cameras has a broken microphone and I've tried twice now to contact drink through their website since it should still be under warranty. I've yet to receive a reply back, going on two months now. When the cameras and app work, then its a handy device and app. But the error rate with connectivity is extremely high and the company behind them has no customer service to back them up after purchase.";"2014-10-01T20:53:34-07:00";"https://itunes.apple.com/us/review?id=372571229&type=Purple%20Software";"372571229";160;"en";"NEGATIVE"
353;1343197680;"HBsunshine7";"https://itunes.apple.com/us/reviews/id19594418";"3.6.1";3;"Banner won't stay down??";"Glad to see they finally fixed the issue where the app was displaying the password. I just had to reinstall this app on a new phone. Seems like it is working better than ever. Except one issue...the banner with all of the controls that appears along the bottom of the screen. It used to be that you could tap on it and it would go away (and stay away until you needed it). Now it seems that it drops down for a few seconds and then returns. This is very bothersome considering that when the phone is turned to landscape, the banner always covers directly where my baby's head is. What a pain to have to tap on the screen and drop the banner EVERY TIME I want to quickly glance in on the baby. Am I missing something? Is there a way to keep the banner down or change a setting??";"2016-03-05T07:25:02-07:00";"https://itunes.apple.com/us/review?id=372571229&type=Purple%20Software";"372571229";152;"en";"NEGATIVE"
354;1015822553;"Truestgem";"https://itunes.apple.com/us/reviews/id17830770";"3.3.1";1;"Terrible last update";"I am very disappointed with the last update. I am experiencing a multitude of problems that I never experienced before. Sound comes and goes as it pleases. The one finger motion turning is awful. The little box in the top left-hand corner that shows you where the camera is going to look is just stupid. At least with the arrows you could still see where the camera was moving, but with the little box in the top you can't see where the viewport is going to land. I can't enlarge the picture without moving the camera because of the motion finger turning. I finally get the picture where I want it, but I can't enlarge it because it keeps on moving the stupid camera every time I put my fingers on the screen!!!  I continually have to refresh going in and out of the application because it tries to continue to stream but then it crashes. I completely wish I could go back to my previous version!!!!!!!!!";"2014-06-23T16:58:47-07:00";"https://itunes.apple.com/us/review?id=372571229&type=Purple%20Software";"372571229";167;"en";"NEGATIVE"
355;1278327261;"scotdwg";"https://itunes.apple.com/us/reviews/id43532940";"3.5.1";1;"Buyer beware, Models advertised are not actually supported on newer hardware versions";"Buyer beware, the app says it works for your model of camera.   Then when you’re asked  for a hardware version, mysteriously version B isn’t supported, only version A.  Call it a model version, call it a hardware version, the box advertises a picture of a mobile device, the app advertises support for the model I bought.   Clearly neither are true.   I don’t even care about the 200$ I wasted on a brick of junk, this has been a huge waste of my time.    I sent this to a friend that works in consumer affairs litigation and this has class action lawsuit written all over it.

Sorry that none of you will ever see your money back, on this app or the device you purchased that doesn’t actually work with this app….  even though it was advertised.   Hopefully the lawyers will have a field day with it and make a pretty penny from dLINK.   That will be satisfaction enough for me.";"2015-10-27T22:58:52-07:00";"https://itunes.apple.com/us/review?id=372571229&type=Purple%20Software";"372571229";160;"en";"POSITIVE"
356;1670675905;"overdone with this";"https://itunes.apple.com/us/reviews/id517192536";"3.7.2";1;"If I could leave no stars";"I have had nothing but problems with this system the whole system , from the start. I should have trusted my instinct and returned it then but I went through tech support (slapping my head) and at least got it running. For some reason when I switched phones my camera is absolutely useless. So an update in my products cannot be the issue it is the camera and the app that is the issue . Light is green , won't connect to app nothing recognizes anything. Many are being sold on a free service but what is it worth if it doesn't work when you need it most . Nothing worse than something happening at home and you needing to check the camera and oh it doesn't work !!!!!!!!! I have resorted to junking this $200 camera out of satisfaction for all the aggravation it has given me , and purchased a reliable system . Please do yourself a favor and return it if you have time .";"2017-07-05T21:10:26-07:00";"https://itunes.apple.com/us/review?id=372571229&type=Purple%20Software";"372571229";168;"en";"POSITIVE"
357;1177018698;"jayte2001";"https://itunes.apple.com/us/reviews/id120705829";"3.4.3";4;"Crash on startup";"I have a iPhone 5S and a iPhone 6 Plus. I've always had problems with the application crashing or not being able to view my Cameras.  I have a total of 12 Cameras that I use for personal security. The iPhone 6 Plus was not able to login automatically so I had to keep putting in my email address and passwords which was very frustrated.   After the latest release and reading reviews, I was able to upgrade and was able to log on automatically with the 6Plus.  At this point everything seems to be working just fine. My only recommendation is before you make any changes is to always check the reviews to see what other people are experiencing before upgrading your app.  Good luck.";"2015-04-02T20:01:02-07:00";"https://itunes.apple.com/us/review?id=372571229&type=Purple%20Software";"372571229";125;"en";"POSITIVE"
358;1528300164;"JRJMan123";"https://itunes.apple.com/us/reviews/id17673781";"3.6.7";4;"Just one little fix to make it perfect!";"This app easily connected to our DCS-936L camera to watch our little girl while a babysitter was at our place.  

The biggest gripe is that when you are watching the live stream and you want to see a bigger picture, you turn the phone into landscape mode.  This works fine, but the default state of the app in this orientation is to overlay the menu bar at the bottom of the screen.  This blocks the view of our daughter.  We can tap the screen to remove the menu bar, but then the bar returns to blocking our view after about 5 seconds. This should be reversed - the bar only appears when it is needed, or when the screen is tapped.  Otherwise, great app!";"2017-01-22T13:45:48-07:00";"https://itunes.apple.com/us/review?id=372571229&type=Purple%20Software";"372571229";124;"en";"POSITIVE"
359;1206386203;"Puttndrive";"https://itunes.apple.com/us/reviews/id36011193";"3.4.4";3;"Glitchy and unstable at times";"Needs more development on the app to make it more dependable and faster. The app doesn't give you access to the more advanced settings for the camera. You have to access the advanced settings for the camera from your computer using Internet Explorer. Forget about using Chrome or Safari. All you can do with the app is view the camera and turn on/off the motion or sound detection. Everything else you have to access from your computer. The app does not always connect to the camera. I had to close and open the app a few times in some instances. 

I gave it 3 stars because you can access the camera and turn on/off the notifications. But that's it. I wish there's other features available and it's more dependable.";"2015-06-02T14:13:29-07:00";"https://itunes.apple.com/us/review?id=372571229&type=Purple%20Software";"372571229";129;"en";"POSITIVE"
360;1513411324;"liindseyymariee";"https://itunes.apple.com/us/reviews/id466197774";"3.6.7";4;"Great App and Camera";"not sure why this has so many negative reviews. I have not once lost connection nor have had any problems with the camera or app. I use it to monitor my dog when i'm away from home. you are able to set motion detection alerts and immediately start recording to a SD card that is used for playback. I also have alerts set for noise detection. The app does what it needs to do perfectly. 

People experiencing wifi issues might need to bump up their internet speed (i have 38mbps), change their router (i have a nighthawk) or implement wifi boosters (i have two across 1900sq ft). 

i have had no issues with this product whatsoever, and its a much better deal than a nest or arlo for what i use it for.";"2017-01-01T10:37:21-07:00";"https://itunes.apple.com/us/review?id=372571229&type=Purple%20Software";"372571229";133;"en";"NEGATIVE"
361;1235700711;"Ashlybrooke";"https://itunes.apple.com/us/reviews/id37341404";"3.4.5";5;"Best Camera App I've Used";"We use this app as a baby monitor. For the first 3 years of my son's life, we used the very expensive Y Cam/Baby HD Wifi camera and app. It was so complicated only tech services could set up the camera on our network. It was constantly going off-line or unable to connect. We finally gave up and decided to go the ""cheap"" route. To our surprise, the $50 D Link camera and free app has been 100% more reliable than what we had previously. No, the picture isn't HD and the sound buzzes when it's at full volume, but it's completely stable and perfect for what we use it for- to make sure the kid is still in bed. 5 stars and 2 enthusiastic thumbs up.";"2015-07-30T19:37:30-07:00";"https://itunes.apple.com/us/review?id=372571229&type=Purple%20Software";"372571229";127;"en";"POSITIVE"
362;1233743760;"Tcpandi";"https://itunes.apple.com/us/reviews/id217126473";"3.4.5";4;"Love the app & camera but poor customer service";"I've been using the DCS-5010L for a little over a year and I have no complaints. The camera works well.  Occasionally there will be an update where the pan/zoom acts differently than it should but with the next update the issue is usually fixed. I use my IPhone 6 and IPad to view the camera remotely.  The camera runs on my home wifi. 
*Beware, there seems to be zero customer service.  When I first got the camera I had trouble with the installation and after no response from 3 separate emails I finally gave up.  I was eventually able to trouble shoot it myself but I went almost a month before I could get it working.";"2015-07-26T22:01:38-07:00";"https://itunes.apple.com/us/review?id=372571229&type=Purple%20Software";"372571229";116;"en";"NEGATIVE"
