"";"id";"userName";"userUrl";"version";"score";"title";"text";"updated";"url";"app";"wordCount";"language";"sentiment"
0;4438031842;"slowmotoad";"https://itunes.apple.com/us/reviews/id209967110";"3.8.14";4;"Excellent picture";"I have been using the camera for over a year. I used it to check on my mom at night when I was at work to make sure she was ok. No falling or stroke. Now I use it to check if she is awake so I won’t wake her up, she is on hospice now. The picture is great and easy to see with night view, very clear. It did not want to set up with my internet but got ahold of customer service and they got it up and running. Then when it updated it went offline my daughter got it back on line. With those little hiccups I really like the camera great for what I am using it for. It gave me piece of mind while at work to make sure mom was safe. Would buy again very good camera.";"2019-07-10T04:51:16-07:00";"https://itunes.apple.com/us/review?id=372571229&type=Purple%20Software";"372571229";144;"en";"POSITIVE"
1;6603315699;"ShoobyTaylor";"https://itunes.apple.com/us/reviews/id20228791";"3.8.14";1;"Total nightmare!";"I had my camera installed all of 20 minutes before my router notified me that a hacker was trying to break into my network using an exploit found in the camera. So I tried to remove the camera from my D-Link account, and this app doesn’t let you remove device once you’ve added it. So I open the web browser to try and login to remove it, and he told me that I cannot use chrome to sign into the website, which just might be the stupidest, most unprofessional thing I have ever encountered. So I tried to use Firefox, which is the only thing that allows you to use, and I couldn’t sign in with Firefox, so I’m screwed, and all I can do is throw out the camera unless I want to hackers trying to break into my network.

EDIT: even better, I got another computer and finally managed to login with fire fox… And it tells me fire fox is an unsupported browser, and he only supported browser is Firefox. That’s right, you can’t login on any browser from macOS, because when you login on the only browser that it tells you you can use, it tells you you’re using the wrong browser. This is total garbage, it is unprofessional as I have ever seen, it’s a nightmare and I’m sorry I ever got involved with this. Dlink you have permanently lost a customer.";"2020-11-02T20:38:18-07:00";"https://itunes.apple.com/us/review?id=372571229&type=Purple%20Software";"372571229";237;"en";"NEGATIVE"
2;2403362216;"Sandra499";"https://itunes.apple.com/us/reviews/id246755929";"3.8.5";5;"Does what it’s supposed to do - perfectly!";"Set it up for motion activation, noise activation or both.   Set up notification prefs on your phone - my Notification shows on my phone immediately and when I click on it, it opens the camera immediately.   Click on the camera icon to take stills that go automatically to your photos area...or hit the red button to record video  on se card (if you’ve put one in the unit).   Custom set the camera to the view you want to set it to monitor and how sensitive you want it to be to noise or motion.  
We plug it in when we go out/want it monitoring and unplug it if we don’t want monitoring.  If there’s a shut off button I don’t know where it is but it’s not a big deal.   
You only have to enter the password on setup and if you logged out.  If I had a 32 digit password I’d just set it to a 30 letter password for this app.   
 What’s important to me is that it’s very reliable, good camera quality.   Ours is a baby monitor.   Does what it says it will.  Great peace of mind.";"2018-04-09T13:56:48-07:00";"https://itunes.apple.com/us/review?id=372571229&type=Purple%20Software";"372571229";190;"en";"POSITIVE"
3;2632939905;"Kayliana™";"https://itunes.apple.com/us/reviews/id465719331";"3.8.5";2;"Works intermittently";"I am using the app to try and view dlink cam on local network. When I click on the camera in the app to connect to it, sometimes the app will connect and sometimes it won't. No error message or anything; the app simply stops trying. Considering that connecting to the camera to view the video feed is this app's primary purpose, this is extremely disappointing. Also most settings cannot be accessed or changed using this app. Why? Dlink can and should do better.

I also tried the remote feature, which is equally hit and miss. 

Configuring the camera via a web browser (the only way to access the majority of the camera’s settings) and setting it to “HTTPS only” will break the remote portion of the mobile app because the mobile app doesn’t support this setting, but the app won’t tell you that, it will just fail. The My D-link website live view will also fail and not tell you why. I will never buy another DLink camera because the software is a broken mess.";"2018-06-02T14:00:53-07:00";"https://itunes.apple.com/us/review?id=372571229&type=Purple%20Software";"372571229";176;"en";"NEGATIVE"
4;1821328962;"Namdnas78";"https://itunes.apple.com/us/reviews/id101841777";"3.8.1";1;"Sheer stupid oversight within app";"Just received my 2-pack of the new DCS-8000LH cameras to review. From the unboxing to getting them ready to use, they seem really nice. Too bad I can’t use them due to an oversight in the app. Coming from a company that makes routers, this particular oversight is inexcusable.

When I go to set the cameras up using the app on my Wi-Fi network, it will not take my 32-character password. It’s limited to accepting 30 characters. Really? I entered my password 5 different times and encountered a “connection timeout” error each time. Then I realized upon the 6th try that when I typed the 31st character, it wouldn’t temporarily show the letter, indicating it wasn’t taking it.

I called tech support and they said “it sounded like a limitation with the app” and with this particular model, there are no other workarounds for setup outside the app. So, because of this, these cameras are nothing more than paperweights. And I’m not changing my Wi-Fi password to set these up. Garbage setup. 😡";"2017-10-01T12:55:24-07:00";"https://itunes.apple.com/us/review?id=372571229&type=Purple%20Software";"372571229";173;"en";"POSITIVE"
5;1780874295;"Cesarson";"https://itunes.apple.com/us/reviews/id370104657";"3.8.1";4;"So far so good.";"The app is very smooth and easy to use once you get it up and running. I love the control features that allow you to take screen shots whenever you want. The only snag was getting it set up and connected to each camera (2). I will always admit bay some may have been user error but for the most part I have sufficient knowledge and skills with lost technology. With all that being said, will definitely keep using if all stays consistent and maybe even get more.";"2017-09-08T15:25:18-07:00";"https://itunes.apple.com/us/review?id=372571229&type=Purple%20Software";"372571229";88;"en";"POSITIVE"
6;4360202052;"Juliet8786";"https://itunes.apple.com/us/reviews/id426754701";"3.8.13";1;"Owner";"I have a lot of troubles with my cameras.  I have three outside cameras, four inside cameras. I'm constantly making adjustments the auto day and night never work every time there's an update I have to make adjustments. These cameras are the worst and I wish I would've never installed them.  I'm also very worried about hackers and them also hacking into D-Link what is their security I don't trust D-Link.
Now these cameras I cannot even load them onto my new router which I upgraded because dlink does not have set up wizard working right now and have no timeline in the future to get it back on dlink support. What the heck is wrong with these people. How can they still sell their cameras when you can’t even load them on your wireless WiFi. This is criminal!!!";"2019-06-23T13:33:43-07:00";"https://itunes.apple.com/us/review?id=372571229&type=Purple%20Software";"372571229";139;"en";"NEGATIVE"
7;2731470317;"MamabearLou";"https://itunes.apple.com/us/reviews/id105257622";"3.8.6";1;"Garbage, garbage, piece of junk system. Don’t waste your money.";"We’ve had D Link for three years, and use it for a baby video monitor as well as house security. GARBAGE!!!!! It RARELY works. The cameras are ALWAYS going offline, which makes the whole thing useless. Our internet is very highspeed and works well, so it’s not that. If your baby is asleep or you’re away from home, how are you supposed to fix that? And why should you need to??? Make a product and app that WORK! The night vision is black and white and grainy when it does work. We have several cameras, two of which are never online. And they were the most expensive one. This is utter garbage and honestly feels like a scam it’s so bad. DON’T WASTE YOUR MONEY.";"2018-06-20T06:05:37-07:00";"https://itunes.apple.com/us/review?id=372571229&type=Purple%20Software";"372571229";125;"en";"NEGATIVE"
8;1788768421;"KearleeQ";"https://itunes.apple.com/us/reviews/id38468971";"3.8.1";4;"Very Pleased";"It took some doing to get the camera connected, but this app has been terrific. Most of the time it works well.  Once in a while we have needed to shut the camera off and then turn it on - to reboot the camera.  We've had it working for 15 months and had to reboot it three times.  We use this app to check in on an elderly family member.  It's nice to be able too know if she's alright- wherever we may be and at the same time allow her to keep her independence.";"2017-09-13T16:10:29-07:00";"https://itunes.apple.com/us/review?id=372571229&type=Purple%20Software";"372571229";95;"en";"POSITIVE"
9;2474358307;"RockyMaine";"https://itunes.apple.com/us/reviews/id534788890";"3.8.5";5;"Review";"Works exactly as I expected. Real time surveillance with ability to take still shots or video. 
It seems to time out often, but able to resume quickly. The video image is clear for my needs but doubt would be able to pick up facial details unless up close to camera.
Overall, I would recommend for child or pet surveillance, but would suggest higher tech performance for home protection.";"2018-04-27T05:09:59-07:00";"https://itunes.apple.com/us/review?id=372571229&type=Purple%20Software";"372571229";68;"en";"POSITIVE"
10;2166471320;"iBikeNE";"https://itunes.apple.com/us/reviews/id176133389";"3.8.5";4;"D-Link App review";"App in general is pretty good, but have to go into D-Link software on my PC for other functions, like recording.  App seems to ""disconnect"" way to often, and not sure what is causing that...maybe because my camera is a bit older.  As with other alarm apps, it takes quite a while to get familiar with them and figure out how they function.  Overall pretty good though.";"2018-02-04T06:01:34-07:00";"https://itunes.apple.com/us/review?id=372571229&type=Purple%20Software";"372571229";67;"en";"POSITIVE"
11;4507227444;"bkkwayne";"https://itunes.apple.com/us/reviews/id156189401";"3.8.14";1;"never update your camera through the app";"Never update your camera through this app. It just bricked mine. Worst of all, you have to pay the ships back to the manufacture to get it fixed. If it mentioned update may destroy your camera, I would have never take the risk. The customer service is the hardest one to solve the problem compared with other band products. Other product if defected, either a replacement will send to you or prepared label will be provided. After seven days communicating with the customer support, they said I have to pay for the shipping back to them for the replacement. Very disappointed and never try again with Dlinks.";"2019-07-23T11:28:14-07:00";"https://itunes.apple.com/us/review?id=372571229&type=Purple%20Software";"372571229";107;"en";"NEGATIVE"
12;3189284305;"equalsalot";"https://itunes.apple.com/us/reviews/id798926558";"3.8.8";5;"Great cam";"I built an outdoor stand for my D-Link tilt/pan cam and found a glass vase to cover it with and everything including the WiFi connection works great...now I can cover my entire property with one camera for security...the only things that could be improved for my purposes for this cam are zoom, and infrared night vision, but I love this setup rather than having several cameras and I can use it from anywhere with my IPhone ...Thanks";"2018-09-14T11:46:43-07:00";"https://itunes.apple.com/us/review?id=372571229&type=Purple%20Software";"372571229";77;"en";"POSITIVE"
13;4243362904;"Love Da Puss";"https://itunes.apple.com/us/reviews/id169313428";"3.8.13";3;"Decent Security";"I purchased a DCS-5030L Aug/Sept 2016 which, at the beginning, served it's purpose in allowing me to monitor the going's-on at my home while I'm away. Currently, I've had to call the help desk with connectivity issues and a few other hiccups. The help desk was great and was able to get me back up and running only to realize that I may have to repeat certain steps in order to reconnect, which seems counterintuitive, should you need to connect rapidly. Other than that, I've been able to monitor my home for the most part.";"2019-05-31T19:24:15-07:00";"https://itunes.apple.com/us/review?id=372571229&type=Purple%20Software";"372571229";95;"en";"POSITIVE"
14;4129767291;"Harrypol9853.45";"https://itunes.apple.com/us/reviews/id210713056";"3.8.11";3;"Relay connection errors – all too frequent";"The cameras have a very low dynamic range. So shadows tend to be black and highlights tend to be blown out. The image is fine for noncontrasty scenes. 
It fails to connect about 10% of the time. Which doesn’t seem bad but it always seems to be those times when you most need to connect.
 And of course there’s absolutely no support. But if you’re looking for a cheap solution these will fill the bill. Just not with the quality and reliability of more expensive alternatives.";"2019-05-10T10:34:40-07:00";"https://itunes.apple.com/us/review?id=372571229&type=Purple%20Software";"372571229";86;"en";"NEGATIVE"
15;3196118824;"Chuck die";"https://itunes.apple.com/us/reviews/id243006109";"3.8.8";2;"Security cameras should work 100% of the time!!!";"Sooo.. we are headed out of the country.  Checked the camera before leaving home.  Seemed fine. One day later I get a screen (that I assume is) telling me I need to connect the device to a server to run a firmware upgrade. So no camera for the entire week we will be gone!   The worst part is, this type of thing is not unusual!  More often than not, when I need to quickly access the camera, I have been kicked out and have to re-login.... or some other delay.  Time to change to a different brand!";"2018-09-16T07:28:19-07:00";"https://itunes.apple.com/us/review?id=372571229&type=Purple%20Software";"372571229";97;"en";"NEGATIVE"
16;6197056214;"Rbrun";"https://itunes.apple.com/us/reviews/id131180023";"3.8.14";2;"Hmmm";"-Slow. Maybe it’s my internet connection, but many times it gives me a “connection timed out” message. Sometimes the message comes after the picture is already displayed. 
-And it’s a real pain trying to replay recorded material. First it’s slow to gather and display All the files even ones from the time you last formatted. Then very slow again after you select the date to view. Then the date is broken down to hourly. Again is is slow to access the hour to view. 
It has to be worst slow and cumbersome software one might encounter. It certainly is on mine. 

I have used the D-Link cameras for several years and am now looking to replace them all. I have four. The picture is good and the ability to remotely control the view is very good. 
If you buy them you will need a lot of patience. 

Bob B";"2020-07-14T07:23:08-07:00";"https://itunes.apple.com/us/review?id=372571229&type=Purple%20Software";"372571229";149;"en";"NEGATIVE"
17;2297620989;"Jaimees4567";"https://itunes.apple.com/us/reviews/id301543201";"3.8.5";1;"Timeout too frequently, slow opening app";"When I would get a notification of a sound or detection of movement, it takes FOREVER for me actually to view. Very sloooooow. Also recently, as I would be watching live streaming, it will give a warning that it will time out and starts the countdown! Why??  Very frustrating. NOW, I cant even view live streaming, it just gives connection error. These cameras worked OK for about 2 years with some minor glitches but now they are total garbage! Too bad we have 4, I was never really impressed with them but they did the job for a CHEAP price. You get what you pay for.";"2018-03-12T02:44:43-07:00";"https://itunes.apple.com/us/review?id=372571229&type=Purple%20Software";"372571229";106;"en";"NEGATIVE"
18;4697197892;"marcusp75";"https://itunes.apple.com/us/reviews/id8777619";"3.8.14";3;"Overall a good system, but frequent issues";"I have used the app with several cameras for years, but every few months they release an update, that messes everything up. Cameras I haven’t had an issue for years, suddenly loose their connection and it’s always the cameras most difficult to physically access. Sometimes you have to reset all cameras and re-install the app to fix connectivity issues. I bought smart switches to reset the cameras remotely now.";"2019-08-30T10:30:07-07:00";"https://itunes.apple.com/us/review?id=372571229&type=Purple%20Software";"372571229";69;"en";"NEGATIVE"
19;6772031386;"Leigh Gen";"https://itunes.apple.com/us/reviews/id27332399";"3.8.14";1;"Expensive piece of trash camera and app";"This camera sometimes finds the app, sometimes doesn’t. The WPS doesn’t work at all for me. (But my printer finds my WPS just fine...) Right now I moved it to a different wifi and it won’t connect at all. I used to at least be able to connect through ethernet and see an image. 

Can’t upgrade firmware unless you have a PC. Can’t format the SD card unless you have a PC.

I have a Ring camera that works perfect, set up is simple. Had this for several months and it’s going in the trash and I’ll get another Ring. Bye bye. 👋";"2020-12-19T15:08:19-07:00";"https://itunes.apple.com/us/review?id=372571229&type=Purple%20Software";"372571229";103;"en";"POSITIVE"
20;2127579770;"Kat6582";"https://itunes.apple.com/us/reviews/id296985672";"3.8.5";2;"A few problems";"Setup and download was easy. Relatively intuitive user interface. But audio does not play with phone locked (in using this as a baby monitor, so I need the audio always on) and video times out often. I'm hoping to find a work around.

After using for a few months, I’m giving this 2 stars. The app takes forever to connect to the camera, and it only will connect about half the time. Sometimes while I’m viewing the baby, it will just “time out”. It’s a pretty terrible app.";"2018-01-25T20:53:53-07:00";"https://itunes.apple.com/us/review?id=372571229&type=Purple%20Software";"372571229";88;"en";"POSITIVE"
21;3826197245;"Goofy Chef";"https://itunes.apple.com/us/reviews/id19464964";"3.8.11";2;"I was going to give this 4 stars";"My review is quite simple as a business owner of father and as a consumer most of all d-link light the latest download very very very bad!! The app crashes all the time I can’t log into either one of my devices locally on the same Wi-Fi network so I’m burning up data both on my phone into my Wi-Fi carrier I have two cameras one is for the protection of my six month old child in the other one is for the safety of my house in my family until they get d-link light fixed don’t do it!!!!!!!!!!!!";"2019-02-28T17:19:36-07:00";"https://itunes.apple.com/us/review?id=372571229&type=Purple%20Software";"372571229";99;"en";"NEGATIVE"
22;3758846837;"Blue-Jay-";"https://itunes.apple.com/us/reviews/id85992072";"3.8.10";2;"Not smart";"The most recent recording should be listed from the top .  Why would anyone want to scroll each time to the bottom to view most recent recording is stupid.  Plus almost every time you need to refresh to see recorded entries.  Also. Why can’t you have ability to record or transfer the video that’s already recorded on camera.  How else can you save this for evidence besides having short little clips sent to your email.  Poor thinking who ever design these apps.";"2019-02-11T11:00:25-07:00";"https://itunes.apple.com/us/review?id=372571229&type=Purple%20Software";"372571229";82;"en";"NEUTRAL"
23;6377249328;"Rollo1985";"https://itunes.apple.com/us/reviews/id1205380286";"3.8.14";4;"Consistent Quality";"I’ve owned the camera for about 2 yrs. the quality of operation has always been great. Sometimes the picture is in color but mostly black and white. I’m not sure if it is the difference between local and remote either way the picture is crystal clear!";"2020-08-30T05:57:52-07:00";"https://itunes.apple.com/us/review?id=372571229&type=Purple%20Software";"372571229";46;"en";"POSITIVE"
24;1789771552;"Jusluvbeinme";"https://itunes.apple.com/us/reviews/id30017433";"3.8.1";5;"Love the app..";"I bought this device as a doggy camera to watch my mini schnauzer at home while I am work because he's 2 months old. The set up was very easy. The camera has a good picture and good audio. However, if you set your setting for audio notifications...it's going to notify you of every single noise. Great app!";"2017-09-14T07:30:06-07:00";"https://itunes.apple.com/us/review?id=372571229&type=Purple%20Software";"372571229";58;"en";"POSITIVE"
25;5091800428;"Stel NYC";"https://itunes.apple.com/us/reviews/id961340290";"3.8.14";3;"Ok";"It’s an ok camera but lately the sound doesn’t always come on with the picture. Another’s issue is that when I go in, the camera plays 1 or 2 seconds of the end of the previous video I viewed. It’s frustrating. These issues only started within the last 2 months so it’s making me re-evaluate if it’s time to replace what used to be a really good camera.";"2019-11-05T18:29:07-07:00";"https://itunes.apple.com/us/review?id=372571229&type=Purple%20Software";"372571229";68;"en";"POSITIVE"
26;1874484375;"Bags305";"https://itunes.apple.com/us/reviews/id210271721";"3.8.1";2;"Hate it already";"Nvm that it doesn't stream (and that wasn't made clear on the packaging), but it was terribly difficult to set up without WPS... And I work in IT. The troubleshooting wasn't intuitive at all and I'm still not exactly sure how it finally connected. Also, constant loss of connections, have to restart my phone to get out of freeze-ups. Plus when you record video, it records at the camera distance, not the pinch-zoom distance. What a disaster. Taking it back tomorrow.";"2017-10-25T10:25:40-07:00";"https://itunes.apple.com/us/review?id=372571229&type=Purple%20Software";"372571229";81;"en";"NEGATIVE"
27;6971036761;"OhioSnowShoe";"https://itunes.apple.com/us/reviews/id637354723";"3.8.14";5;"Very reliable camera over 5 years outside";"Have looked at this camera from one side of U.S.A. to the other side of U.S.A.  Keeps an eye on who comes and goes out of my driveway and insures that my garage doors stay shut.  Not a fancy camera or high res. but gets the job done for what I need.";"2021-02-08T14:20:15-07:00";"https://itunes.apple.com/us/review?id=372571229&type=Purple%20Software";"372571229";52;"en";"NEUTRAL"
28;1867296566;"Shannarrie";"https://itunes.apple.com/us/reviews/id540063733";"3.8.1";4;"The more things change, the more they remain the same";"After almost 6 month Without being able to view my camera without the use of WiFi T-mobile version, now I can’t take pictures with it the app anymore and the recorded videos I manually did is not save on the device.";"2017-10-22T10:51:36-07:00";"https://itunes.apple.com/us/review?id=372571229&type=Purple%20Software";"372571229";41;"en";"NEGATIVE"
29;2032635979;"K311Y83";"https://itunes.apple.com/us/reviews/id498253879";"3.8.3";4;"Simple to Use";"The product was a little difficult to set up for a novice, but a great product for the price. Allows me to check in on my pup from work. Everything is password protected & only I have access; although I believe you have the option to add others. It even has night vision! I’d highly recommend the DCS-5020L Camera";"2017-12-27T09:57:48-07:00";"https://itunes.apple.com/us/review?id=372571229&type=Purple%20Software";"372571229";59;"en";"POSITIVE"
30;5751957824;"Wickedvick";"https://itunes.apple.com/us/reviews/id416664498";"3.8.14";5;"Great working cameras!";"These do what I want them to do and need them to do. I have them throughout my house and in my windows watching my yard. They work great. The only ones I have had trouble with were the refurbished ones that are stationary. My moveable ones are terrific! Thanks DLink😃";"2020-04-02T10:18:15-07:00";"https://itunes.apple.com/us/review?id=372571229&type=Purple%20Software";"372571229";51;"en";"POSITIVE"
31;1883897760;"bb318";"https://itunes.apple.com/us/reviews/id561006355";"3.8.1";4;"I like it but wish it would record with me off the app";"I like it but wish it would automatically record with motion even with me off of the app. Mine faces my driveway because of the recent car break ins and I wish I wasn’t having to be stuck to the app. Or if there is a way it would and I’m missing it. Any advice?";"2017-10-29T12:47:39-07:00";"https://itunes.apple.com/us/review?id=372571229&type=Purple%20Software";"372571229";55;"en";"POSITIVE"
32;6704828989;"MikeOoh";"https://itunes.apple.com/us/reviews/id86581859";"3.8.14";3;"Motion and sound stopped";"I can’t get motion or sound to notify me. Do I really need to reset???? I have read many reviews and I think the cameras released are on their own and they are not maintained at all.
Maybe the latest but my cameras are like eight years old or something the 930L and another but I cannot fix the lack of motion or sound notification to the app";"2020-11-30T22:05:32-07:00";"https://itunes.apple.com/us/review?id=372571229&type=Purple%20Software";"372571229";68;"en";"POSITIVE"
