"";"id";"userName";"userUrl";"version";"score";"title";"text";"updated";"url";"app";"wordCount";"language";"sentiment"
388;1761539810;"MusicMac";"https://itunes.apple.com/us/reviews/id37951098";"3.8.0";1;"D-link having reviews deleted! 😡";"WHATS GOING ON?!!?  My 1 star review had been deleted!  I continually updated my review with each issue and today it was gone, but I noticed A LOT of seemingly bogus, positive reviews. SUSPICIOUS!

I'm about ready to ditch all our d-link cams (7) because their app continually has issues.  If not one thing another.  Anyone who says differently just hasn't had their product long enough, or wrote a bogus review.

Since my review got mysteriously deleted - I can only remember the last couple of major problems, and they all can't be blamed on a cellular carrier.  

We've had T-mobile for 19 years, through other d-link problems including earlier this year with their app crashing after opening and selecting a camera.  It seems when that issue was fixed - their developers screwed up something else.  This is NOT a T-mobile issue!  It's a d-link problem!  

On their own forums they claimed they were working on a fix - nearly TWO months ago!!  Still nothing!  It seems too easily convenient that all these positive reviews have popped up at the same time mine was deleted.

Fix your software d-link or we're moving to another.";"2017-08-30T05:50:31-07:00";"https://itunes.apple.com/us/review?id=372571229&type=Purple%20Software";"372571229";194;"en";"NEGATIVE"
389;1496490986;"lakesideretreat";"https://itunes.apple.com/us/reviews/id36498690";"3.6.7";2;"Not reliable and not a good investment, needs work...";"I've had 8 cameras for several years now and still consider them unreliable.  Slow to connect, unable to connect, late or no event notifications, and offline are all common issues depending on the day, or time of day. Since I've invested in D-Links products It would be great if D-Link would invest some resources into making them right.
My 8 cameras are at 2 different locations and I have cameras go offline almost daily which requires the router to be restarted to regain access to them, my 4- DCS5222Lb's often go offline at both locations at the same time which tells me this is a DLINK issue, not a local network issue!  Hey DLINK, please get these issues figured out and fixed!!";"2016-12-05T06:24:14-07:00";"https://itunes.apple.com/us/review?id=372571229&type=Purple%20Software";"372571229";122;"en";"POSITIVE"
390;1372423876;"Flyerguy1";"https://itunes.apple.com/us/reviews/id116798348";"3.6.2";2;"Don't update presets gone, need it fixed now,";"I don't understand why every time the app has an update, things that worked before no longer work?  And then it takes months for another update to fix it so it works again.  It seems like if you do an update that causes a bug, you should fix and get a new rev available adapt, or bring the old version back to the App Store.  This is the one app that I purposely never just update automatically because there's alway a major bug.  This time I forgot to not update it on my phone and I have no presets. I didn't update my iPad, and presets work great.  Dlink needs to put more emphasis or resources on their apps, or at least let beta testers test them before releasing to the general public.";"2016-05-02T09:19:50-07:00";"https://itunes.apple.com/us/review?id=372571229&type=Purple%20Software";"372571229";133;"en";"POSITIVE"
391;1557438501;"PigTailLeo";"https://itunes.apple.com/us/reviews/id19310075";"3.7.1";2;"A long way to improve.";"Poorly designed. It's okay to start at adding a camera but it has to provide a way to jump out this 1st initial process. Not everyone needs to start at the beginning. In my case after I finally add one of my cameras, I can see a list of my others under the general interface. What a waste of my time to setup the 1st one. I could had a way to let it scan the whole environment and pick what it has found! Another issue is this app only recognizes default http port 80, which in contrary the camera web setup page allows ppt to change the port to other number. So if I changed the default port number for my safety concern, I cannot use this app any more caz it cannot connect to the camera anyhow.";"2017-03-04T09:26:58-07:00";"https://itunes.apple.com/us/review?id=372571229&type=Purple%20Software";"372571229";139;"en";"POSITIVE"
392;1201111136;"Ciburserfur";"https://itunes.apple.com/us/reviews/id105296002";"3.4.4";1;"New Update Horrendous";"App worked marginally prior to update.  I used to have a few glitches, but at least it worked as intended most of the time. Now with the recent update, the camera and app are virtually useless. Continuous crashes, and constantly tries to connect to device, then fails. Once in every 10 or so attempts to view the live feed, it will successfully connect for about 3 seconds, then fail. Then will send a push notification about once every 10 minutes that the device has ""been disconnected"". Reinstalled app twice with no change.  Called technical support(foreign country outsourced phone support), and they were absolutely no help. They lied to me about trying to solve the issue just to get me to hang up. Very annoyed since now my $200 camera is basically useless.";"2015-05-22T11:45:53-07:00";"https://itunes.apple.com/us/review?id=372571229&type=Purple%20Software";"372571229";132;"en";"NEGATIVE"
393;1308783353;"FiveLonghorns";"https://itunes.apple.com/us/reviews/id114591019";"3.6.0";4;"Works well";"Just installed on a vacation property earlier today and it has already emailed me that it detected movement on my porch! Caught the Yardman blowing leaves off the porch. I am pleased with the video and motion detection however it came preloaded with very old firmware and can't seem to upgrade. I have tried upgrading via the app...times out. Via the web dashboard on my PC...says upgrade failed. And tried hooking camera via cable directly to router and laptop via cable to router and still unsuccessful upgrading firmware. Went to DLink site and downloaded upgrade to my computer and still could not install to camera. Ugh!!!";"2015-12-30T16:59:23-07:00";"https://itunes.apple.com/us/review?id=372571229&type=Purple%20Software";"372571229";106;"en";"NEGATIVE"
394;425412352;"ACG1911";"https://itunes.apple.com/us/reviews/id30749431";"2.0.0";1;"More trouble than it's worth";"Spent over 2 hours plus an hour with technical support on the phone trying to set the camera up. Support guy was sort of helpful. But he kept trying to get off the phone. ""here's a case number if you need to call us back."" I said ""I don't need to call you back. I need to stay on the phone until we fix the problems."" Anyway, I figured out how to get the camera to work. But only on my laptop in the same room with the camera. This app always said my camera was offline. Even when I was watching the image on my computer. I seemed to have many of the same issues as other bad reviews here. Oh well. Returning the camera. Deleting the app. I gave it one star because I was afraid zero stars wouldn't register.";"2011-05-03T10:52:27-07:00";"https://itunes.apple.com/us/review?id=372571229&type=Purple%20Software";"372571229";142;"en";"NEGATIVE"
395;1280622543;"Upset about update";"https://itunes.apple.com/us/reviews/id238386882";"3.5.1";4;"Works decent, minor bugs";"As far as monitoring the camera field of view when away, this app excels. I have noticed that the app to camera voice support doesn't seem to work at all unless we are on the same wifi network as the camera. I also noticed that the recordings time indication does not match the time indicated by the camera itself writing the file, making it difficult to pinpoint triggered events at the appropriate time to review the video. Other than that it works quite well. Looking forward to adding a couple more cameras to the network for other areas.";"2015-11-01T13:44:38-07:00";"https://itunes.apple.com/us/review?id=372571229&type=Purple%20Software";"372571229";98;"en";"POSITIVE"
396;1254774663;"SonicFox";"https://itunes.apple.com/us/reviews/id101620742";"3.4.5";5;"Works great!";"The most recent update of the lite version works great!  On the AT&T network the camera views are available within 3-4 seconds of choosing a camera to view while on the G network.  Wireless connection makes the views pop up almost instantly even on slower DSL connections.  I like the new layout because for me it allows for easier use of the zoom capability.  The snap shot feature works great too!

Yes, as other reviewers have mentioned, there are a couple of spelling errors.  However, for me the new version has been working great so far!";"2015-09-08T04:51:59-07:00";"https://itunes.apple.com/us/review?id=372571229&type=Purple%20Software";"372571229";96;"en";"POSITIVE"
397;1297075396;"DocCanFixIt";"https://itunes.apple.com/us/reviews/id100054141";"3.6.0";4;"I see you now mr maintenance man!";"I like the app update that I can adjust more settings, but it must have a bug that keeps turning the motion sensitivity down to 30%? This DCS 5020L does the trick and seems to work very good. Now I can keep an eye on my apartment when I'm not home.
You see I have a problem with the maintenance people just coming into my apartment anytime they feel like it without giving any prior notice!  It's not that I don't trust them, I am just concerned if something would get broken they would probably deny it then I would have to fight it out with my renters insurance to cover the items!
DocCanFixIt";"2015-12-06T19:40:17-07:00";"https://itunes.apple.com/us/review?id=372571229&type=Purple%20Software";"372571229";114;"en";"NEGATIVE"
398;1475834031;"SupahStah******";"https://itunes.apple.com/us/reviews/id295045846";"3.6.6";1;"What a Hassle";"Such a waste of my money and time. The most overly complicated way to access your camera from mobile devices. The resolution is set to 360x 240 which pretty much means pixel-ish video, and very delayed motion detector. I can't access the pics that were supposedly taken, the link to access that sends me to some shady page that my computer warns me four different ways not to enter. You're asked to put your log in info in, and when you Dom they ask for it again, and still nothing. Such a rip off, such a scam, and an even bigger disappointment. Luckily I bought this on Groupon to try their product out before getting  full system. It's getting sent right back and I'll be investing in one of their competitor's home security products instead.";"2016-10-30T09:06:49-07:00";"https://itunes.apple.com/us/review?id=372571229&type=Purple%20Software";"372571229";135;"en";"NEGATIVE"
399;1220087682;"laurabiercestephenson";"https://itunes.apple.com/us/reviews/id87452892";"3.4.5";2;"Not a great app or camera";"If you're using this camera or app for a dog it might be suitable but isn't suitable for any type of security measures. The app does have connection issues at times, notifies you of motion when there is no motion, and needs to have an updated features. There also needs to be better help documentation available on the features and how to use them. I had to spend too much time trying to figure it out on my own because there is no documentation One evening we continued to get alerts of motion and we finally figured out the camera was picking up lightning strikes. I think we're going to return the camera and look at other models to see if we can get better performance.";"2015-06-30T06:47:43-07:00";"https://itunes.apple.com/us/review?id=372571229&type=Purple%20Software";"372571229";126;"en";"POSITIVE"
400;1377611301;"CrisRoyzen";"https://itunes.apple.com/us/reviews/id148559318";"3.6.4";4;"Cameras are great, set up is a bit tricky.";"The cameras work great. I bought two so that I can keep an eye on the kids, pets and my home. I would say it is worth the money. If you follow the instructions set up is a breeze. I encountered some problems at first with set up through the phone app. Once I set it up online though the phone app picked up the cameras right away. All you need to do is follow the instructions given. There are various different ways to set up the cameras, so if one does not work you can try another. This is what I did and it works great! Very happy with the product!";"2016-05-12T13:04:21-07:00";"https://itunes.apple.com/us/review?id=372571229&type=Purple%20Software";"372571229";112;"en";"POSITIVE"
401;934621868;"DrudgeSmusge";"https://itunes.apple.com/us/reviews/id20877473";"3.2.2";1;"Stay away!";"Worst app and worst product ever.  Upon viewing any of the cameras I have setup the picture instantly freezes 100% of the time (and that's if it will even connect which is about 50% of the time), 75% of the time can't even get audio.  What a waste of money I flushed down the toilet on this.  I'm currently trying to view cameras while on a trip and I'm extremely frustrated.  The technology seems to be in its infancy and it's obvious the guys writing the firmware have no interest in improving robustness whatsoever.  It seems to be there is no clear winner in this market as each manufacturer (dlink, linksys, swann,etc) are only interested in inching ahead of the competition regardless of how crappy their products truly are.  If I could give this negative stars I would.";"2014-01-31T22:44:19-07:00";"https://itunes.apple.com/us/review?id=372571229&type=Purple%20Software";"372571229";138;"en";"NEGATIVE"
402;1672692276;"Edmonam82";"https://itunes.apple.com/us/reviews/id130610110";"3.7.2";2;"A temporary fix for those who can't connect on LTE";"After buying this cam and going through the setup process I discovered that I can't use it when I'm on LTE network which is making this a completely useless. It still works on wifi though. 
And I see a lot of people complaining about the same issue here. Well after couple of days googling the issue and not finding a solution, I found it myself🙂 For using it with an LTE network one only needs to setup a vpn connection on the iPhone and that's it, it simply starts working. Just download any vpn app from AppStore. One more fix I'd like to see in the next update it to be able to save files from camera to iPhone photos.";"2017-07-07T06:14:40-07:00";"https://itunes.apple.com/us/review?id=372571229&type=Purple%20Software";"372571229";120;"en";"POSITIVE"
403;516184825;"Shezzza watching Ponyboy";"https://itunes.apple.com/us/reviews/id168177357";"2.3.0";4;"It was a breeze!";"Setup was easy, works great! I can view it from the website on my Dell laptop, or my iPhone with this app.   We have 2 wireless routers so I did have to make sure the laptop was connected to the same router as the camera during setup & my browser needed a java update to view it on the website. The only cons are I wish the power cord for the camera had been longer and the white noise when you have the sound on can be annoying. The picture could have been better but for the price, I can't complain.";"2012-01-22T09:21:47-07:00";"https://itunes.apple.com/us/review?id=372571229&type=Purple%20Software";"372571229";101;"en";"POSITIVE"
404;798579703;"Grouchy Kona";"https://itunes.apple.com/us/reviews/id146802721";"3.0.0";4;"Updated review of version 3.0";"Holy wow!!!!  Did D-Link FINALLY figure it out after all these years?? This version actually works pretty good. I'm in shock!  I feel dizzy... Need cold water. 
---------------------------------------------------------------------------
Updated review of version 2.6.0 (and previous versions):

2.6.0 = Still not getting the connection speed on LTE:  Only able to connect around 1-3 fps as opposed to 20 fps on LTE like I was getting on version 2.4.4 (best version so far)

2.4.4 = great connection speeds, but needs iPhone 5 support (full screen)
2.4.5 = FAIL
2.4.6 = at least it connects, but no LTE speed like 2.4.4
2.6.0 = new UI looks nice, but same problems as 2.4.6:  no LTE speed like 2.4.4;  needs iPhone5 support (larger display)

So far, 2.4.4 is the best version:  Able to get LTE speed connections with iPhone5 (15+ fps).  All other versions connects very slow (2-3 fps). 

Going back to 2.4.4 again until the devs can figure this out.  VERY FRUSTRATED with this app and their updates.";"2013-05-03T12:24:55-07:00";"https://itunes.apple.com/us/review?id=372571229&type=Purple%20Software";"372571229";164;"en";"POSITIVE"
405;1259142869;"YelpTruster";"https://itunes.apple.com/us/reviews/id206588666";"3.5.1";5;"Great App";"I have been using this camera and app for over 2 years now. We love it. We now have 2 cameras and It is so convenient to check on both our kids while in the house and outside the house. It's cool because my mom lives out of town and she often watches them sleep. One thing I will note is that I live in a large town home so usually it's easy to head then cry. If you live in a large home where you cannot hear your kids cry. You may need to have your app display on your iPad plugged up or on your Internet TV.";"2015-09-18T03:17:23-07:00";"https://itunes.apple.com/us/review?id=372571229&type=Purple%20Software";"372571229";109;"en";"POSITIVE"
406;1402349570;"Frustrated628";"https://itunes.apple.com/us/reviews/id317946313";"3.6.4";4;"Love.... Wish you could save to iPad";"Once I got through the tough part of setting it up online and figured out how to add the motion along with always record, I love it. I have an SD card that saves about 1 1/2 days before it overwrites. However, it would be great if you could actually SAVE a file to iPad or PC easily, without going into the setup. So if someone were to try to break in, I could have proof. As it is now I have to go into the setup on my PC and figure out which file it is to download. Can't you just have a button to save it after viewing? That would be great.";"2016-06-29T04:48:01-07:00";"https://itunes.apple.com/us/review?id=372571229&type=Purple%20Software";"372571229";114;"en";"POSITIVE"
407;1563598593;"B2201234567890";"https://itunes.apple.com/us/reviews/id108756257";"3.7.1";4;"Exactly what I needed.";"Works with my 2 dlink cams well enough. Only time I have trouble is when my internet cuts - sometimes this requires me to ""reset"" the cam by turning it off and back on, which I can't do wirelessly. I don't feel like I'm missing any features, and the app itself is easy to use - haven't had any glitches.

I don't remember my camera models, but both have microphones and the sound comes through okay (a bit of white noise if my pets are quiet). Pan and tilt works quickly enough, but the sudden human-less movement of the camera initially creeped out my cat.";"2017-03-13T05:30:38-07:00";"https://itunes.apple.com/us/review?id=372571229&type=Purple%20Software";"372571229";105;"en";"POSITIVE"
408;1415622917;"DadlyEdly";"https://itunes.apple.com/us/reviews/id101949523";"3.6.5";1;"Sluggish, not working well";"I've been reading reviews that say the old version of the app used to work. I can't judge that since I just got two of these cameras.
Setup of the cameras didn't go well. Everything seemed designed to be easy, but the connection between my iPhone and the dlink server always timed-out, even though I was using a solid wifi connection.
Now that I have one camera working, the app is asking me to update that camera's firmware. Guess what? Over a half hour of watching the camera reboot itself later I'm waiting for the process to complete to the app's satisfaction.
I'm not impressed. I don't know if the problem is the app, their servers, or the camera, and I'm not in a position to diagnose it.
Don't buy one of these cameras.";"2016-07-19T16:01:16-07:00";"https://itunes.apple.com/us/review?id=372571229&type=Purple%20Software";"372571229";134;"en";"NEGATIVE"
409;505513333;"Boochie1220";"https://itunes.apple.com/us/reviews/id41475048";"2.3.0";5;"Works Great!";"I'm using a d-link router and it could not be easier.  Push a button on the camera and push a button on the Router and it is connected via Wifi. Then create an account go to the website and upload firmware update and camera is working.  It took less than 10 minutes.  If you are having the 60 second issue, it is related to the router used not the camera used.  This is totally awesome, could not be easier!";"2012-01-02T13:49:29-07:00";"https://itunes.apple.com/us/review?id=372571229&type=Purple%20Software";"372571229";79;"en";"POSITIVE"
410;1208791495;"Coolbreezer4";"https://itunes.apple.com/us/reviews/id337801584";"3.4.5";2;"App has many issues";"Concept is great, app regularly has problems. So often we can connect to one or all of our cameras, then 10 minutes later we can (no issues with our internet or modem), get loud ticking noise sometimes when doing multi-camera view, sometimes when logging back in the camera is not pointed where I left it.  App works very poorly and has so much more potential. You'd think with whats out there now a days they could hire someone better to make this app. If the cameras hadn't been so expensive or I had another app option I would definitely make a change!  Recommend looking else where for something easier and more reliable.";"2015-06-07T17:41:57-07:00";"https://itunes.apple.com/us/review?id=372571229&type=Purple%20Software";"372571229";112;"en";"POSITIVE"
411;914582279;"Racer421";"https://itunes.apple.com/us/reviews/id158046443";"3.2.1";4;"Working well except...";"Just put some cams up and hook up was amazingly simple! I had just returned some other cams that were a nightmare to hook up.  The software downloaded to my iPhone and iPad easily and hooks up well to cams from anywhere. Only thing I am not happy about is the notifications not working. I understood these cams and SW were to detect motion or sound and send push notification either via email or text. It has not done either even w the feature turned on.  Maybe there is something I need to do via the website and not the app?";"2013-12-25T09:53:10-07:00";"https://itunes.apple.com/us/review?id=372571229&type=Purple%20Software";"372571229";101;"en";"POSITIVE"
412;1201054467;"RandyLe";"https://itunes.apple.com/us/reviews/id151652967";"3.4.4";2;"Crashed and crashed";"My update for the current version: it crashed everytime I re-open it. It works again if I restart the app. What an in convenienve.

This is my frustrating using this app. Every time I open it, it takes a long time to load. Once loaded, a touch to any function icons will just freeze the app. When try to pan or tilt, it might or might not work for the first time. And so likely that if the first pan/tilt works, the second one will just fail. I'd rather not use this app, and go straight to the web to view, even though it means a longer process to log in and wait for the images routed to my browser via the internet. It’s supposed to be a local network access since I'm using both Dlink cam and router. But for now, the only solution now is to go to the web and view live video over the cloud. 

One side note, the same app, but it works fine on an iPhone. WHY???????????????????????

The title says Useless, and I mean it literally.

If there were an option for not selecting any star, it would be my selection.";"2015-05-22T08:47:31-07:00";"https://itunes.apple.com/us/review?id=372571229&type=Purple%20Software";"372571229";197;"en";"NEGATIVE"
413;502154981;"Mike_ChiTown";"https://itunes.apple.com/us/reviews/id126286750";"2.3.0";5;"Exelent";"MyDlink  , works  excellent.... however need some improvement when using WIFI -  60 second of time it's definitely bad idea.. On other hand perfect when using 3G .. Question for MyDilink ! Why not improve this ..? Just to let every one to know quality can be improve drastically in setting using  computer. In good detail ... Please read documentation ..... No secrets  .. For douse who can or care to read  instruction ..... after al it's security camera ... Just for authorize  users ..!";"2011-12-27T13:58:29-07:00";"https://itunes.apple.com/us/review?id=372571229&type=Purple%20Software";"372571229";85;"en";"POSITIVE"
414;1246718167;"AndyM of Sumter";"https://itunes.apple.com/us/reviews/id11693908";"3.4.5";3;"Could be so much more";"Camera is not bad , software is weak on so many fronts. Would love to be able to set the points where the camera would automatically return to specific points in its rotation as moving the camera is cumbersome and slow, would be so much faster if once you fine tuned a location you could return to it by tapping a favorite key. Not having it send a snap shot of the motion event is just plain weak as this software is almost worthless for any type of security. Hopefully the company will take my suggestion and others and release something that is worthy of this product";"2015-08-21T20:13:53-07:00";"https://itunes.apple.com/us/review?id=372571229&type=Purple%20Software";"372571229";107;"en";"POSITIVE"
415;1221598121;"parker291";"https://itunes.apple.com/us/reviews/id110281686";"3.4.5";1;"Horrible cameras and app";"Since it reminds you constantly to review the app instead of letting you view your cameras might as well do so. Both the cameras and app are bad. Cameras lock up almost daily and have to be power cycled. Firmware releases make everything worse. New warnings not to update over wifi so you have to make a really long Ethernet cable or physically uninstall cameras and power supplies to update firmware. Can take up to a minute or more, assuming it does not time out, to connect to a camera with the app. App will not let you view HD cameras in HD. Overlay in landscape mode blocks important parts of the picture. Forces you view a tutorial after every update and won't let you cancel when you need to quickly view a camera.";"2015-07-03T07:40:41-07:00";"https://itunes.apple.com/us/review?id=372571229&type=Purple%20Software";"372571229";134;"en";"NEGATIVE"
