"";"id";"userName";"userUrl";"version";"score";"title";"text";"updated";"url";"app";"wordCount";"language";"sentiment"
140;1896837783;"Ythompson";"https://itunes.apple.com/us/reviews/id300400436";"3.8.1";4;"Peace of mind";"I really wish I had bought the d link camera sooner.  I feel a more safer. The app is really good to be able to check on your home.";"2017-11-04T06:34:47-07:00";"https://itunes.apple.com/us/review?id=372571229&type=Purple%20Software";"372571229";29;"en";"POSITIVE"
141;2175953646;"App@@""@&$&$""";"https://itunes.apple.com/us/reviews/id299865782";"3.8.5";5;"Good appl";"The appl is very easy to use and very fast connection to WiFi and the camera , no complaint";"2018-02-06T18:49:27-07:00";"https://itunes.apple.com/us/review?id=372571229&type=Purple%20Software";"372571229";19;"en";"POSITIVE"
142;1925425368;"Meaty10";"https://itunes.apple.com/us/reviews/id100628854";"3.8.1";5;"5 Star App!";"Works perfectly with my cameras! Could use an update to fit better on ‘Plus’ sized iPhone screens.";"2017-11-16T08:02:59-07:00";"https://itunes.apple.com/us/review?id=372571229&type=Purple%20Software";"372571229";17;"en";"POSITIVE"
143;3811367514;"AmericanCycler";"https://itunes.apple.com/us/reviews/id143756811";"3.8.10";5;"Great app!";"Once the camera is up the app is friendly and easy to navigate.";"2019-02-24T17:33:39-07:00";"https://itunes.apple.com/us/review?id=372571229&type=Purple%20Software";"372571229";13;"en";"POSITIVE"
144;1829007041;"davanzoie";"https://itunes.apple.com/us/reviews/id150229259";"3.8.1";2;"Very frustrating!";"It pauses, it won't open all the time! Then it skips back and then it times out. I'm not
Very happy with this product. I have unlimited data on my phone and it still doesn't work whether I'm on data or wifi.";"2017-10-05T09:04:57-07:00";"https://itunes.apple.com/us/review?id=372571229&type=Purple%20Software";"372571229";42;"en";"NEGATIVE"
145;7581241353;"vertex01";"https://itunes.apple.com/us/reviews/id125175448";"3.8.14";3;"Had these cam for years";"Overall very nice. Have had WiFi connection issues. Must be very close to router or gateway. I have 6 of these cameras. Fir the price they are a good buy.";"2021-07-15T18:33:09-07:00";"https://itunes.apple.com/us/review?id=372571229&type=Purple%20Software";"372571229";30;"en";"POSITIVE"
146;6061405373;"leesushimiami";"https://itunes.apple.com/us/reviews/id1094815057";"3.8.14";3;"Need automatic recording";"The picture was clear great,received notification thru sound and motion but it doesn’t record automatically.";"2020-06-10T20:53:13-07:00";"https://itunes.apple.com/us/review?id=372571229&type=Purple%20Software";"372571229";15;"en";"POSITIVE"
147;2525989644;"drequa";"https://itunes.apple.com/us/reviews/id41937755";"3.8.5";1;"Terrible firmware update";"I just did the firmware update to my two cameras per instructions. What I now have is two cameras that won’t connect to the app. They won’t connect to Mydlink Lite or Mydlink. They have become trash at this point. 

I can not recommend that anyone buy these cameras based on my nightmare. They simply don’t work.";"2018-05-09T17:44:53-07:00";"https://itunes.apple.com/us/review?id=372571229&type=Purple%20Software";"372571229";57;"en";"NEGATIVE"
148;6406673718;"RonnieZeller";"https://itunes.apple.com/us/reviews/id154666735";"3.8.14";2;"Push notifications";"Reset the cameras several times and they still won’t sent push notifications to my phone. Kind of a joke";"2020-09-07T21:23:48-07:00";"https://itunes.apple.com/us/review?id=372571229&type=Purple%20Software";"372571229";19;"en";"POSITIVE"
149;3487839873;"Cm52802";"https://itunes.apple.com/us/reviews/id114800561";"3.8.10";2;"I give up.";"Tried and Tried and i cant get this junk set up.  The Password is correct and it will not except.. waisted two hours of my life plus now i must return ant wait for my credit.  I knew i should of jus ordered more of my existing camera....";"2018-12-02T22:07:15-07:00";"https://itunes.apple.com/us/review?id=372571229&type=Purple%20Software";"372571229";48;"en";"POSITIVE"
150;2757817534;"_nvcke_";"https://itunes.apple.com/us/reviews/id226087163";"3.8.7";4;"Good";"Really haven’t had a problem with it. I can see what my dog and friends are doing when I’m not home and it feels amazing.";"2018-06-23T23:51:39-07:00";"https://itunes.apple.com/us/review?id=372571229&type=Purple%20Software";"372571229";25;"en";"POSITIVE"
151;2324588160;"Roadhou449";"https://itunes.apple.com/us/reviews/id222609623";"3.8.5";1;"Terrible App / Great Cameras";"This is one of the worst apps I have used. It never gets updated, only updates come with new cameras. I have an iPhone 10 and this app still does not support the new screen layout. I would want to buy more cameras if the UI was updated and they supported app improvements more often.";"2018-03-19T16:10:53-07:00";"https://itunes.apple.com/us/review?id=372571229&type=Purple%20Software";"372571229";55;"en";"NEGATIVE"
152;1778824330;"Zmo2222";"https://itunes.apple.com/us/reviews/id499256398";"3.8.1";3;"iPhone on iOS 10.3";"It works on LTE T-Mobile. It's about time. Thought they will never fix it but will not buy any more camera from dlink because it took 5 months to fix. Stupid..";"2017-09-07T07:55:21-07:00";"https://itunes.apple.com/us/review?id=372571229&type=Purple%20Software";"372571229";31;"en";"NEGATIVE"
153;5291602934;"DFWNTX";"https://itunes.apple.com/us/reviews/id159299448";"3.8.14";1;"Use to work";"Worked a little now cannot access cameras.  Regular updates done to cameras and phone and iPad.  App hasn’t had an update for a while it appears.  Half my cameras show to be offline, yet they status led it green.  Connection time outs are the norm now.";"2019-12-19T06:14:51-07:00";"https://itunes.apple.com/us/review?id=372571229&type=Purple%20Software";"372571229";46;"en";"NEGATIVE"
154;2553195326;"Moxie4442";"https://itunes.apple.com/us/reviews/id48811929";"3.8.5";2;"Unreliable";"Thought it was a little quiet in my toddlers room one night. Went to look at the camera feed and she was hysterically crying after falling out of her bed. Audio dropped for no reason and continues to do so. No longer trusting this software or hardware.";"2018-05-15T21:00:11-07:00";"https://itunes.apple.com/us/review?id=372571229&type=Purple%20Software";"372571229";47;"en";"NEGATIVE"
155;3473637731;"peoriaone";"https://itunes.apple.com/us/reviews/id41582618";"3.8.10";5;"Awesome";"Easy to set up and has worked well for years now. Have three";"2018-11-29T05:26:58-07:00";"https://itunes.apple.com/us/review?id=372571229&type=Purple%20Software";"372571229";13;"en";"POSITIVE"
156;1783801298;"timewarp2kad";"https://itunes.apple.com/us/reviews/id43158168";"3.8.1";5;"Watching my home while away";"Working for now in trailer, riding out the storm (IRMA) with family in strong Home.";"2017-09-10T09:30:55-07:00";"https://itunes.apple.com/us/review?id=372571229&type=Purple%20Software";"372571229";15;"en";"POSITIVE"
157;3906337483;"TTtttttttttttttteeeewwwrrrttt";"https://itunes.apple.com/us/reviews/id124568327";"3.8.11";1;"Useless";"An update is usually to improve something. Not the last one. Half the time it says that I can't connect to the camera. I wonder if Dlink tests the updates before releasing them??? Junk products with junk apps. Nest takes a few minutes to set up and works.";"2019-03-20T20:30:47-07:00";"https://itunes.apple.com/us/review?id=372571229&type=Purple%20Software";"372571229";48;"en";"POSITIVE"
158;2992735344;"Stevetrk57";"https://itunes.apple.com/us/reviews/id206318383";"3.8.7";1;"Horrible";"Always drops cameras even tho they r up and running. I have 4 cameras and 2 drop off on a daily basis. I'm an it guy and it has nothing to do with my settings it's a problem with dlink. 
Wish they could figure it out. Consider another camera before purchasing a dlink camera.";"2018-07-30T10:15:48-07:00";"https://itunes.apple.com/us/review?id=372571229&type=Purple%20Software";"372571229";54;"en";"NEGATIVE"
159;2381039971;"PS323";"https://itunes.apple.com/us/reviews/id106413585";"3.8.5";2;"Used to be better";"I’m not sure what happened but with the latest app and iOS the camera disconnects all the time over wifi and then I have to restart the app 2-3 times before it reconnects. It’s a really really big pain.";"2018-04-03T19:57:47-07:00";"https://itunes.apple.com/us/review?id=372571229&type=Purple%20Software";"372571229";39;"en";"NEGATIVE"
160;2208237270;"am2gold3";"https://itunes.apple.com/us/reviews/id42025695";"3.8.5";3;"Good quality";"The app is sometimes unreliable. Having an issue with push notifications since updating";"2018-02-14T12:36:43-07:00";"https://itunes.apple.com/us/review?id=372571229&type=Purple%20Software";"372571229";13;"en";"NEUTRAL"
161;2012478589;"Catman222";"https://itunes.apple.com/us/reviews/id292047048";"3.8.3";2;"Better than nothing, sometimes.";"Poor image quality and it keeps losing the connection. Sometimes it works okay and at other times it is utterly frustrating.";"2017-12-20T10:35:33-07:00";"https://itunes.apple.com/us/review?id=372571229&type=Purple%20Software";"372571229";21;"en";"NEGATIVE"
162;7905932908;"Hossamee123";"https://itunes.apple.com/us/reviews/id346518784";"3.8.14";3;"Need update";"The app need updates to fix some problems 
Like notifications are not working";"2021-10-12T03:14:19-07:00";"https://itunes.apple.com/us/review?id=372571229&type=Purple%20Software";"372571229";13;"en";"NEGATIVE"
163;4203440594;"Sasjas";"https://itunes.apple.com/us/reviews/id175674859";"3.8.11";1;"The change";"Ever since the baby monitor app changed to this it’s crap! The movement is horrible and so much harder to adjust to see the kids. The app also times out multiple times in the middle of the night. All the money spent on the camera is down the drain now.";"2019-05-24T14:39:57-07:00";"https://itunes.apple.com/us/review?id=372571229&type=Purple%20Software";"372571229";50;"en";"NEGATIVE"
164;2423122787;"toolmantiffin";"https://itunes.apple.com/us/reviews/id763128301";"3.8.5";3;"Thank you";"This is a useful devise and the quality is just fine for how much it cost. The quality of all my other devises I use to look at it determines its usefulness. Thank you to the developers.";"2018-04-14T13:42:42-07:00";"https://itunes.apple.com/us/review?id=372571229&type=Purple%20Software";"372571229";37;"en";"POSITIVE"
165;2064052555;"csoong";"https://itunes.apple.com/us/reviews/id621256919";"3.8.3";2;"DCS5020L";"The apps doesn't work on cricket wireless user since merging with AT&T Dlink customer service just reply receive ur email and no any solutions could be provided and suggested me to contact the Cricket IT to solve my problem 
Very disappointed it almost 7 months";"2018-01-06T16:08:44-07:00";"https://itunes.apple.com/us/review?id=372571229&type=Purple%20Software";"372571229";45;"en";"NEGATIVE"
166;2023383629;"keepingsafe";"https://itunes.apple.com/us/reviews/id283406169";"3.8.3";5;"Works great. Easy setup.";"Would recommend to anyone who wants to keep an eye on their home... or someone in it.";"2017-12-24T05:39:16-07:00";"https://itunes.apple.com/us/review?id=372571229&type=Purple%20Software";"372571229";17;"en";"POSITIVE"
167;1939187649;"arliley";"https://itunes.apple.com/us/reviews/id40679499";"3.8.3";3;"Terrible";"There needs to be an ability to delete an entire days recordings vice having to go hour by hour to delete recordings.";"2017-11-21T21:27:26-07:00";"https://itunes.apple.com/us/review?id=372571229&type=Purple%20Software";"372571229";22;"en";"POSITIVE"
168;4744356139;"Raouf H";"https://itunes.apple.com/us/reviews/id258418633";"3.8.14";5;"Great";"Thanks for D-link it’s great.
I still use 930l it’s works great but I wish if I can hear something without recording. Man";"2019-09-07T13:35:39-07:00";"https://itunes.apple.com/us/review?id=372571229&type=Purple%20Software";"372571229";23;"en";"POSITIVE"
169;4332387354;"Waccabuc Willie";"https://itunes.apple.com/us/reviews/id268033144";"3.8.13";5;"Just love D-Link";"The app and the hardware are great! Very happy and just bought  another two cameras this week.";"2019-06-17T17:56:51-07:00";"https://itunes.apple.com/us/review?id=372571229&type=Purple%20Software";"372571229";17;"en";"POSITIVE"
170;3707471886;"Will Notbuythiscameraeveragain";"https://itunes.apple.com/us/reviews/id120210726";"3.8.10";1;"Will not buy again";"Very disappointed. Have several cameras, half are out most of the time. Constantly getting errors. Have tried everything. Dlink support no help, tells me they don’t support their own product. Would not ever buy again.";"2019-01-28T22:59:11-07:00";"https://itunes.apple.com/us/review?id=372571229&type=Purple%20Software";"372571229";35;"en";"NEGATIVE"
171;2204090812;"The Dotte";"https://itunes.apple.com/us/reviews/id203011525";"3.8.5";5;"It works!!";"Im s simple dude. All I want is for the things I spend money on to work. This works. It’s basic. But I’m not a spy so that works for me.";"2018-02-13T10:54:51-07:00";"https://itunes.apple.com/us/review?id=372571229&type=Purple%20Software";"372571229";31;"en";"NEUTRAL"
172;3060514032;"kristenl19373929373";"https://itunes.apple.com/us/reviews/id283722546";"3.8.7";2;"Config error";"Used to be great but I constantly get a “config timeout” error message after having the app open for maybe 5 seconds. It’s worked well for 2 years until a month or so ago.";"2018-08-13T16:22:30-07:00";"https://itunes.apple.com/us/review?id=372571229&type=Purple%20Software";"372571229";34;"en";"POSITIVE"
173;2081733973;"IllyriaMadison";"https://itunes.apple.com/us/reviews/id175802973";"3.8.3";4;"Great cameras shorty app issues.";"Liking the use of them not likin the fact that the system is no longer notifying us of movement detections! Please fix this!!!";"2018-01-12T05:46:13-07:00";"https://itunes.apple.com/us/review?id=372571229&type=Purple%20Software";"372571229";23;"en";"POSITIVE"
174;4855697676;"TotowaSteve";"https://itunes.apple.com/us/reviews/id548102482";"3.8.14";5;"Super easy to use";"I use this DLink software for my 5020L, and it works great, loads quick, and utilizes the pan and tilt smoothly.";"2019-09-28T14:31:25-07:00";"https://itunes.apple.com/us/review?id=372571229&type=Purple%20Software";"372571229";21;"en";"POSITIVE"
175;1900835941;"Maniacslot";"https://itunes.apple.com/us/reviews/id245184175";"3.8.1";2;"Still needs work";"SD recording options are ok, but could use some improvements.

Cameras are decent and clear.
SD recording is touchy, you can easily accidentally disable recording.
SD card support is lacking, 32GB limit.
My camera is working for motion detection, but now I cannot do recording on demand, it just stopped working.
Tech support is by email, lucky to get a response after 3 days, even then, it’s just to find out more info...not great, but that’s why we do reviews!";"2017-11-05T21:52:26-07:00";"https://itunes.apple.com/us/review?id=372571229&type=Purple%20Software";"372571229";80;"en";"POSITIVE"
176;3165113692;"Moebe007";"https://itunes.apple.com/us/reviews/id126160794";"3.8.8";5;"Viewing";"Would love to review all camera on a split screen";"2018-09-07T15:52:04-07:00";"https://itunes.apple.com/us/review?id=372571229&type=Purple%20Software";"372571229";10;"en";"POSITIVE"
177;2410903836;"Lobo80503";"https://itunes.apple.com/us/reviews/id533904256";"3.8.5";5;"Awesome";"Don’t know why so many people complain. These cameras aren’t hard to setup!";"2018-04-11T12:58:10-07:00";"https://itunes.apple.com/us/review?id=372571229&type=Purple%20Software";"372571229";13;"en";"NEGATIVE"
178;7208602295;"no_2u";"https://itunes.apple.com/us/reviews/id46220772";"3.8.14";1;"No live audio unless Microphone enabled";"Audio is disabled during live video unless the bidirectional microphone is enabled, and the app is given permission to use your phone's mic.  Why can't I listen to the baby without my microphone being enabled?!";"2021-04-10T20:08:27-07:00";"https://itunes.apple.com/us/review?id=372571229&type=Purple%20Software";"372571229";35;"en";"NEUTRAL"
179;4992667407;"MajorAV8er";"https://itunes.apple.com/us/reviews/id49989015";"3.8.14";1;"You’re being watched";"Had one of my camera’s moving, following me around. No one that I know was watching. A couple days ago my router pass word was changed. 
Apparently the Chinese with their imbedded software are the only ones allowed to watch my cameras now.";"2019-10-21T06:11:22-07:00";"https://itunes.apple.com/us/review?id=372571229&type=Purple%20Software";"372571229";43;"en";"NEGATIVE"
180;3770592646;"stevemarseattle";"https://itunes.apple.com/us/reviews/id163110406";"3.8.10";2;"Works sometimes";"I have 4 cameras. Sometimes thwy work, sometimes I get a Connection Timeout and they do not work. Intermittently go offline. 
When they work they are fine and do the job. When they don’t- frustration.";"2019-02-14T17:25:08-07:00";"https://itunes.apple.com/us/review?id=372571229&type=Purple%20Software";"372571229";35;"en";"NEGATIVE"
181;3705473550;"satishone";"https://itunes.apple.com/us/reviews/id219822247";"3.8.10";1;"Login";"I have to login every time when I want access to camera. I don’t see a auto login feature.
Camera frequently disconnects with WiFi.
I  brought camera’s from other companies, no problem connecting to WiFi and staying on.";"2019-01-28T09:54:03-07:00";"https://itunes.apple.com/us/review?id=372571229&type=Purple%20Software";"372571229";38;"en";"POSITIVE"
182;1896886186;"Dave339";"https://itunes.apple.com/us/reviews/id263999111";"3.8.1";5;"Easy to setup & use";"Love the D-Link app. Equipment worked great. Ordered more, can't wait for it to come in.";"2017-11-04T07:00:16-07:00";"https://itunes.apple.com/us/review?id=372571229&type=Purple%20Software";"372571229";16;"en";"POSITIVE"
183;3465319205;"joebonjoey";"https://itunes.apple.com/us/reviews/id215079285";"3.8.10";1;"Cannot playback recorded videos!";"I can no longer playback my recorded videos off the SD card with this app. I’m forced to use the regular Mydlink app just to playback videos, but the app itself is cumbersome, and slow to navigate the timeline of my recorded videos! DLink needs to fix this!";"2018-11-26T23:33:09-07:00";"https://itunes.apple.com/us/review?id=372571229&type=Purple%20Software";"372571229";48;"en";"NEGATIVE"
184;3323408078;"Inqu17";"https://itunes.apple.com/us/reviews/id479491188";"3.8.9";1;"Updates is useless";"We been using this monitor for few years, suddenly updates comes and guess what? Nothing works. Keep looking for camera but in the end errors comes and it shuts off. Do you have some solution?";"2018-10-20T07:22:20-07:00";"https://itunes.apple.com/us/review?id=372571229&type=Purple%20Software";"372571229";35;"en";"NEGATIVE"
186;2247913420;"MichealTX";"https://itunes.apple.com/us/reviews/id258923002";"3.8.5";5;"Essential part of your smart home";"With this as part of DYI Home security, no need to pay for ADT et al and get locked in long term contract";"2018-02-25T19:26:48-07:00";"https://itunes.apple.com/us/review?id=372571229&type=Purple%20Software";"372571229";23;"en";"NEGATIVE"
187;3502513628;"ASAP devito";"https://itunes.apple.com/us/reviews/id525646714";"3.8.10";1;"Not updated for iPhone X";"You would think that them selling products in bestbuy and other major retail stores that use this app as a companion, that the app would at least be updated and not look like something from 2009 on iOS 5";"2018-12-06T21:52:05-07:00";"https://itunes.apple.com/us/review?id=372571229&type=Purple%20Software";"372571229";39;"en";"NEGATIVE"
188;3169564004;"Spikey567";"https://itunes.apple.com/us/reviews/id390155808";"3.8.8";1;"Slow to respond, clunky, not very good";"Very slow to respond when switching between cameras the Wi-Fi is marginal at best while the cameras do work at the frustration level is very very high please fix your app so it runs smoothly because right now it runs like crap";"2018-09-08T19:23:10-07:00";"https://itunes.apple.com/us/review?id=372571229&type=Purple%20Software";"372571229";42;"en";"POSITIVE"
189;2391104623;"LessStars";"https://itunes.apple.com/us/reviews/id521052512";"3.8.5";1;"I wish I could give less stars";"I have never been to fond of this camera & the app due to the EXTREME lag in the notifications & connection speed once motion is detected. After the last update the motion detection DOES NOT WORK AT ALL. I am currently looking for another security camera.";"2018-04-06T09:12:22-07:00";"https://itunes.apple.com/us/review?id=372571229&type=Purple%20Software";"372571229";47;"en";"NEGATIVE"
190;1823502662;"Yeahhh Budddyyyy";"https://itunes.apple.com/us/reviews/id306596575";"3.8.1";1;"Garbage -0 Stars";"Not only the worst camera I've ever owned, but possibly the worst product. I NEVER leave reviews but this is unreal.

Camera needs firmware upgrades everyday, and it doesn't even let you upgrade without unplugging everything and physically hooking the camera to the router with an Ethernet cable. Why would I want to do all this?

The rep on the phone was rude, disrespectful and made me not even want to attempt to make the camera work.

I will never buy anything from this company again.";"2017-10-02T16:23:29-07:00";"https://itunes.apple.com/us/review?id=372571229&type=Purple%20Software";"372571229";86;"en";"NEGATIVE"
191;1801252721;"I love to Surf!";"https://itunes.apple.com/us/reviews/id386934693";"3.8.1";3;"Not getting notifications";"It was working fine
Sometimes I get the time out error then I need to refresh 
But it works pretty good
iPhone 6 user";"2017-09-20T22:13:41-07:00";"https://itunes.apple.com/us/review?id=372571229&type=Purple%20Software";"372571229";24;"en";"POSITIVE"
192;1982777176;"pkweagle";"https://itunes.apple.com/us/reviews/id595120362";"3.8.3";5;"Mydlink lite";"No problems other sometimes you must add cameras manually. Display is nice. Seems to operate promptly.";"2017-12-09T06:13:31-07:00";"https://itunes.apple.com/us/review?id=372571229&type=Purple%20Software";"372571229";16;"en";"POSITIVE"
193;2693457036;"Dorothy Plisner";"https://itunes.apple.com/us/reviews/id772668187";"3.8.6";5;"Can it be opened on Apple Watch";"Can you use this app on the Apple Watch gen 2";"2018-06-14T07:03:53-07:00";"https://itunes.apple.com/us/review?id=372571229&type=Purple%20Software";"372571229";11;"en";"NEUTRAL"
194;2674597935;"cancelm";"https://itunes.apple.com/us/reviews/id581205687";"3.8.5";5;"Love it!";"I got this camera to monitor my dog from work and its working like a charm!! Love it thank you!";"2018-06-10T21:29:55-07:00";"https://itunes.apple.com/us/review?id=372571229&type=Purple%20Software";"372571229";20;"en";"POSITIVE"
195;1952353920;"coleoney";"https://itunes.apple.com/us/reviews/id620187655";"3.8.3";2;"Dissatisfied";"My camera has more down time than I care for. The refresh rate is very slow and half of the motion never gets reported to me nor recorded. Defeats the purpose of having the camera.";"2017-11-27T02:20:32-07:00";"https://itunes.apple.com/us/review?id=372571229&type=Purple%20Software";"372571229";35;"en";"POSITIVE"
196;3482880145;"Rod@900";"https://itunes.apple.com/us/reviews/id189076129";"3.8.10";1;"Very limited app";"I got a new D-Link camera to my system but I was unable to setup due to incompatibility. I receive a messages asking to use another app to connect my DCS8200LH.
Currently need 2 different D-Link apps to access all my cameras.

D-Link, include DCS8200LH to the list of compatible cameras PLEASE!!!!";"2018-12-01T14:54:52-07:00";"https://itunes.apple.com/us/review?id=372571229&type=Purple%20Software";"372571229";52;"en";"POSITIVE"
197;1977002217;"mascort2";"https://itunes.apple.com/us/reviews/id165255679";"3.8.3";1;"Constant issues";"Constant server and connectivity errors despite good internet connection. Always seems to happen in the middle of the night. HUGE problem when it’s job is to help me make sure my child is safe!!";"2017-12-07T01:18:43-07:00";"https://itunes.apple.com/us/review?id=372571229&type=Purple%20Software";"372571229";34;"en";"POSITIVE"
198;1953425729;"NJE31";"https://itunes.apple.com/us/reviews/id317732113";"3.8.3";1;"Relay connection errors";"When it works it’s fine, but I frequently get “relay connection error”. After a few hours of getting this it will go away and be ok again for a while. I’ll never buy another Dlink cam at this rate.";"2017-11-27T12:57:35-07:00";"https://itunes.apple.com/us/review?id=372571229&type=Purple%20Software";"372571229";39;"en";"POSITIVE"
199;2828705295;"FireAn7";"https://itunes.apple.com/us/reviews/id150711877";"3.8.7";1;"Don’t get notifications anymore";"I updated my phone to the iPhone X now I don’t get notifications. It worked fine with my iPhone 7 Plus it also still works with my Second generation iPad. Very disappointed with this app.";"2018-07-03T08:50:57-07:00";"https://itunes.apple.com/us/review?id=372571229&type=Purple%20Software";"372571229";35;"en";"NEGATIVE"
200;2350520879;"feredrocket";"https://itunes.apple.com/us/reviews/id121087241";"3.8.5";4;"Seems to work ok";"Setup can be tedious but great functionality and a good number of useful features. Great deal for the price";"2018-03-26T19:16:59-07:00";"https://itunes.apple.com/us/review?id=372571229&type=Purple%20Software";"372571229";19;"en";"POSITIVE"
201;2678502273;"Vic/Bullet";"https://itunes.apple.com/us/reviews/id24798638";"3.8.5";4;"Just purchased a unit";"After a few tries at the installation process, I was successful. So far, so good. Wish me luck.";"2018-06-11T14:40:35-07:00";"https://itunes.apple.com/us/review?id=372571229&type=Purple%20Software";"372571229";18;"en";"POSITIVE"
202;2193250946;"Oquinn24";"https://itunes.apple.com/us/reviews/id342464526";"3.8.5";3;"Not great";"Not as bad as it could be, and it is free! However, it isn’t the best, and sometimes it doesn’t connect correctly. Like I said though, not so bad!";"2018-02-10T18:21:48-07:00";"https://itunes.apple.com/us/review?id=372571229&type=Purple%20Software";"372571229";29;"en";"POSITIVE"
