"";"id";"userName";"userUrl";"version";"score";"title";"text";"updated";"url";"app";"wordCount";"language";"sentiment"
218;7674006311;"Tjer21";"https://itunes.apple.com/us/reviews/id37988936";"5.65.0";2;"Needs work";"I really want to give this app a higher rating, but I just can’t until some things are fixed, so I hope this serves as a note about an ongoing issue. The app works well for a few days and then suddenly, it stops giving me notifications, despite everything being turned on to receive notifications. Nothing changes in the settings, it just simply stops working. So that means, every few days, I have to delete and then re-install the app to get the notifications working again. This has been going on for months now. It’s pretty annoying and I’d love to see this fixed. Otherwise, it’s a good app and it’s nice to see what’s going on outside. If only I was always able to be alerted about the things the camera detects…";"2021-08-09T12:21:06-07:00";"https://itunes.apple.com/us/review?id=464988855&type=Purple%20Software";"464988855";133;"en";"POSITIVE"
219;6759792105;"Davesleep";"https://itunes.apple.com/us/reviews/id148091314";"5.60.0";2;"Frustrating. I had faith but lost it.";"I’ve been using this app and Nest thermostats and cameras for about four years. Over the last year the app is increasingly forcing me to sign in every few times (at least) I use it. The hardware is only on my secure home google mesh network so I don’t accept having issues like this. I’ve become tired of not being able to rely on the app being available and deleted it out of frustration. Now, I change the thermostat manually and can’t easily access the cameras but it’s better than having to do a password dance any time I want to change the temp or check on a camera. The Nest brand has lost its value to me. Actually, the Google brand is losing value to me very quickly, too. I used to have faith, but no more.";"2020-12-16T07:56:25-07:00";"https://itunes.apple.com/us/review?id=464988855&type=Purple%20Software";"464988855";138;"en";"POSITIVE"
220;6745420985;"Bbvvccxxzz";"https://itunes.apple.com/us/reviews/id86020925";"5.60.0";2;"My Nest died. How happy am I supposed to be?";"I have really enjoyed the two nest thermostats in my house. But a few nights ago my furnace turned on and stayed on. The thermostat said that it was set to 70° but it was currently 84°. It was 3 o'clock in the morning and I could not get my furnace to turn off. It was very frustrating and a little scary. I finally switch to the power off on the big switch next to my furnace. The base plate of the thermostat failed. When it failed it turns on my furnace. If I remove the white wire my furnace stops. If I plug in the white wire and don't even attach the front display, the furnace turns on and does not turn off. Imagine if my wife and I had been away from home! I fear for my house. I bought two new thermostats from a different company. I cannot trust Nest.";"2020-12-12T07:26:16-07:00";"https://itunes.apple.com/us/review?id=464988855&type=Purple%20Software";"464988855";153;"en";"NEGATIVE"
221;6579628634;"K_jayroe";"https://itunes.apple.com/us/reviews/id294986966";"5.57.0";3;"Glitchy but also good";"I wish the schedule feature worked. I’ve set a schedule a few times and it deletes it or doesn’t actually set the temp I’m trying to get to. It’s not easy to make the schedule in the first place and takes too much time, so I’ve given up. I have to change it when I leave my house for work. First world problem, I know, but if it’s a feature that’s offered it should work. 

The app is cute in appearance and offers a lot of features. The one feature I want to use doesn’t work through. The neat system as a whole is really good. Again, only the scheduling is dumb and does not work. I like the timing feature that says “temp reached in 30 minutes” or whatever.";"2020-10-27T07:40:42-07:00";"https://itunes.apple.com/us/review?id=464988855&type=Purple%20Software";"464988855";130;"en";"POSITIVE"
222;6001833693;"KANH77";"https://itunes.apple.com/us/reviews/id321019076";"5.50.0";3;"Wish it were compatible with Apple Watch";"We have both the Nest thermostat as well as the Nest doorbell. While I understand there weren’t many people remotely controlling their thermostat through the Apple Watch, it seems like a big miss not to have the app available for those who have the doorbell. Although I’m able to view a the live feed through my phone, the the idea of the watch is that you don’t necessarily need to have your phone on you at all times. Currently we pay the monthly subscription fee to view a record of the video feed but if we aren’t able to at least view the live stream the Apple Watch we will need to switch to a company that does offer that feature.";"2020-05-27T12:41:22-07:00";"https://itunes.apple.com/us/review?id=464988855&type=Purple%20Software";"464988855";121;"en";"POSITIVE"
223;5204606811;"Izzy83749483";"https://itunes.apple.com/us/reviews/id378378478";"5.42.0";5;"Great products";"I have three exterior cameras (the cheaper ones) and they work good. I wish the video quality was better but I can’t afford the more expensive nest cameras. I imagine the quality is better. I also have the nest thermostat. That works great. I also have the nest Yale lock. The lock is great but there’s one thing I don’t like about it. If you open or lock your door with the app you can monitor the status of your lock with your phone. I can be at work and know what the status is. But if I open the door or lock it with my hands, the app doesn’t know the status of the lock";"2019-11-27T10:47:14-07:00";"https://itunes.apple.com/us/review?id=464988855&type=Purple%20Software";"464988855";116;"en";"POSITIVE"
224;5221610542;"drfrp";"https://itunes.apple.com/us/reviews/id133009637";"5.42.0";1;"BEWARE of Nest Thermostats";"Two thermostats almost destroyed my air conditioner. I thought the first time was just a fluke and they covered the costs of replacing a bad face plate and had admitted responsibility for the issue. The second time (after Google purchased Nest), they refused to take responsibility and kept making up inconsistent statements. Over months various departments kept requesting document after document only to claim I hadn’t followed instructions or there was new document request. I was left with $750 in repair bills. I have heard similar issues with friends and others who own Nest thermostats. Nest was once a great company but their ability to back up their product with good customer service is gone. Don’t expect this thermostat to last much longer after the warranty expires. For $250, that is a costly replacement every other year.";"2019-12-01T08:43:52-07:00";"https://itunes.apple.com/us/review?id=464988855&type=Purple%20Software";"464988855";137;"en";"POSITIVE"
225;8122521894;"hernandezrluis";"https://itunes.apple.com/us/reviews/id122600522";"5.67.0";4;"Minor bugs";"This app work really well I use it more than the google home to see my cameras and to control my thermostat. If they can keep this app tuning a little smoother the loading time for all device are so slow now. It was super fast before but waiting to load when door bell rings is not good wen I notification there super late. I click to view them and replay takes so long on the main app. Still need a way to save video on my phone in HD I need to able to sharing to the authorities. Nest is the best and I pay there subscription and I don’t think I’m getting the best out the smart feature. Needs improvement or speedier.";"2021-12-12T06:38:28-07:00";"https://itunes.apple.com/us/review?id=464988855&type=Purple%20Software";"464988855";124;"en";"POSITIVE"
226;6210560756;"Seashellstew";"https://itunes.apple.com/us/reviews/id112888643";"5.53.0";1;"Will try to FORCE you into google";"After having a Nest camera for over 3 years, we decided to get the google hub so we could watch the cameras live. The google hub ended up being trash and we returned it but it forced me out of the Nest camera app and will not allow me to sign in using my yahoo account. I have tried to get ahold of Nest for about 3 weeks and they claim they are “too busy due to COVID” meanwhile all kinds of activity is going on in front of my house that I can no longer monitor! I feel unsafe! It’s funny because there are no issues or technical difficulties for them collect my annual fee for their cloud. For Google to be such a large company their service is horrible and I don’t want anything to do them. Nest - let me know how to get ahold of you!! I left a message for Google two days ago and they have not called me back!";"2020-07-17T16:51:40-07:00";"https://itunes.apple.com/us/review?id=464988855&type=Purple%20Software";"464988855";166;"en";"NEGATIVE"
227;5356460996;"scottxb234";"https://itunes.apple.com/us/reviews/id169452122";"5.42.0";4;"Nest Cam System";"1 week in after doorbell and 2 outside camera install. Installations easy and getting the app up on both my Ph and Computer was fairly easy ( took help from Millennial son).  Video quality in both daylight and night time is excellent, met expectations.  Being able to replay triggered events is nice, but takes a while to learn how to navigate that. Only complaint would be the cost to store activity on the Cloud, even for just 5 days back view the cost is not for the System, but for each Camera, so the cost is X 3 which makes it prohibitive, just too expensive for a Residence application......  otherwise, no complaints!";"2020-01-03T10:16:49-07:00";"https://itunes.apple.com/us/review?id=464988855&type=Purple%20Software";"464988855";112;"en";"POSITIVE"
228;5340991150;"Jogger4";"https://itunes.apple.com/us/reviews/id23345003";"5.42.0";2;"Doesn’t control temperature well";"I love the convenience of a thermostat on WiFi and was excited that our new home came with it. However, for all the fancy things the Nest can do, they seem to have forgotten this is primarily a thermostat. The temperature swing is too large. It will run 2 degrees past the temperature I have set it (especially awful when I was pregnant and getting too hot would make me sick), and won’t turn on right away when them temp changes. I have an infant and toddler and the large (as much as 4 degree) temperature swing can mean my baby wakes up because she’s too hot or too cold. I don’t like suddenly feeling a chill only to see that it’s 2 degrees lower than the temperature I’ve set the heat, either. AC is similarly problematic. I look forward to replacing this device.";"2019-12-30T18:45:54-07:00";"https://itunes.apple.com/us/review?id=464988855&type=Purple%20Software";"464988855";144;"en";"NEGATIVE"
229;5195749872;"Emelu";"https://itunes.apple.com/us/reviews/id42296066";"5.42.0";5;"Works by phone/tablet + voice and saves energy";"Our Nest(s) work from our phone/tablet(s) via the app, or by voice via Alexa (or Google), & it’s just so easy to set up. It almost looks like a piece of art on the wall, but the best is it’s a seamless app, and saves a ton of energy. We have a separate heating/cooling system for each floor, and a Nest app to run it, but with this system, it can all run from my sofa: or even another continent if I need to set the temp as away while I’m on Holiday (but I forgot before I left)! I’ve even used the PIN feature to keep hubby & kids from changing the weekly program.";"2019-11-25T06:35:58-07:00";"https://itunes.apple.com/us/review?id=464988855&type=Purple%20Software";"464988855";115;"en";"POSITIVE"
230;7694396783;"claw830";"https://itunes.apple.com/us/reviews/id33896745";"5.65.0";5;"Couple of things…";"First, love the nest features and the product is amazing. We have the camera we use for our baby monitor. My biggest issue is that the app will not allow me to set a schedule for when the camera is on/off. It has the option to do it, but when i attempt to change the schedule, it acts as though there is an overlay button to the time button and it closes the time selection option. Please fix this. I would like to use the high resolution on recording but i don’t want to be recording an empty bed for 12+ hours a day.";"2021-08-14T22:32:46-07:00";"https://itunes.apple.com/us/review?id=464988855&type=Purple%20Software";"464988855";104;"en";"POSITIVE"
231;7945517770;"AtotheSoloJ";"https://itunes.apple.com/us/reviews/id107840024";"5.66.0";1;"Not a good app.";"Google should fine tune their products before fine tuning their advertising. This app is slow, has a bad UI and scrolling through history takes too many clicks and requires scrolling from an angle that doesn’t make sense . When getting a notification for movement I should be able to click and go straight to the movement rather than waiting a minute or 2 to see it come up. Green zones don’t seem to work. I get notifications outside the zones all the time. The cameras also don’t recognize things accurately sometimes but that may not be the fault of the app. It’s too bad that users don’t see the app before buying the cameras otherwise we might go elsewhere. I heard that Google makes money sometimes. Maybe they should use it on their current products rather than hype.";"2021-10-23T07:37:40-07:00";"https://itunes.apple.com/us/review?id=464988855&type=Purple%20Software";"464988855";138;"en";"NEGATIVE"
232;5768578430;"Lola77054";"https://itunes.apple.com/us/reviews/id283437065";"5.47.5";5;"Better than ADT";"I have the nest alarm only. My cameras are ring. My townhome is 1380 sq ft. One way in one way. 
I had ADT locked into a 2 year contract for 80 plus dollars for a town home with no other entrance. Finally got out of my contract and got Nest. I’m paying a 1/4 of the cost of my last company with Brinks. I have all the same bells and whistles just with one item (the hub). I have even tested response  time and it was within 2 sec they called me. My last company (ADT) took minutes. It’s like they wanted to confirm it was a real alarm before even calling. That’s actually one of the reasons I got out of my contract.";"2020-04-05T17:44:41-07:00";"https://itunes.apple.com/us/review?id=464988855&type=Purple%20Software";"464988855";125;"en";"NEGATIVE"
233;6789342295;"jerkyfeep";"https://itunes.apple.com/us/reviews/id239218105";"5.60.0";3;"Thermostat works well, but there is nothing smart in it";"Thermostat was in learning mode for about a month and produced schedule didn't make any sense.
I simplified the schedule to just 70 in the morning and 60 at night.
Even though Early-on feature was off, it still turned on earlier than what's scheduled and waked me up. So now I raise the temp manually when i wake up, and the only left scheduled event is 60 at 10pm.
The schedule screen in the app is terribly inconvenient: it voluntarily rotates the screen, and it's hard to hit the back button - always takes me at least 3-4 attempts.
The app starts so slowly that in most cases it's easier to come over and manually rotate the bezel.

I also wish there were more stats and graphs. Room temp during the day, humidity, correlation between room temp and outside temp. Currently there is nothing. Currently i own this ""smart"" thermostat, but i still had to get a separate device to simply track the temp/humidity over time.

My verdict: this product doesn't have any significant advantages over any simple thermostat, and there is nothing smart in it.";"2020-12-24T11:14:16-07:00";"https://itunes.apple.com/us/review?id=464988855&type=Purple%20Software";"464988855";186;"en";"POSITIVE"
234;6679482313;"Dark Knight 07";"https://itunes.apple.com/us/reviews/id1232023641";"5.59.0";2;"Signs me out and privacy";"This app has become frustrating to the point I’m thinking about getting rid of my Nest. It routinely signs me out when I try to access the app to adjust temperature settings and asks for me to sign in. It routinely sets a schedule to significantly drop the temperature of my home in the early hours of the morning so I wake up freezing. I delete the programmed temperature settings it adds but they still somehow come back. When you sign back in you feel like you’re signing away yourself because Google needs to have 100% access to your email account. I would like it if Google would fix the glitches with the app signing me out and change the requirement to have access to my email to use this device.";"2020-11-23T21:09:52-07:00";"https://itunes.apple.com/us/review?id=464988855&type=Purple%20Software";"464988855";131;"en";"POSITIVE"
235;6249823942;"Treulant";"https://itunes.apple.com/us/reviews/id85716287";"5.53.0";1;"Doesn't work. Wouldn't run heat. In December.";"Update: This app is designed to make sure users do not use it. Not a joke - the usability is intentionally awful. Have fun trying to adjust the schedules in landscape when nearly all the usable space for haptic interaction does not work. Don’t rotate your phone,  because this app by a TRILLION dollar company doesn’t know the difference between landscape and portrait.

Useless, nonfunctional, uninformative and in the end, preventing me from turning the heat on. In the dead of winter. Furthermore, edging towards a quarter gig of software and it doesn’t do a whole lot, or perhaps it just doesn’t do it that well. 
12-June-2018: Still an enormous app.
12-Dec-2018: App/device would not turn on heat. Removed all schedules, disable home/away, set heat on, set manual and eco temperatures. Over and over. No response. Garbage. Trash. Abomination.";"2020-07-27T19:27:57-07:00";"https://itunes.apple.com/us/review?id=464988855&type=Purple%20Software";"464988855";139;"en";"NEGATIVE"
236;5854882435;"Adira angel";"https://itunes.apple.com/us/reviews/id105912409";"5.47.7";3;"great product, mostly user friendly, except for the tedious schedule settings.";"My review is actually pretty long,I love my smart thermostat! The app homepage is simple and straightforward. Overall, it is pretty user friendly.

However, the schedule settings need an upgrade because resetting the schedule is very tedious. If you want to clear the schedule, you have to remove each item individually. And you cannot select more than one. There’s no “Clear All” button. It’d be very useful to include a “Clear All” button next to the ”Add” and “Remove” buttons.

Cool trick I just figured out. Two ways to speed up the process of clearing the schedule. Both are Copy/Paste solutions.

1) Clear one day, copy it, Then select a different day and paste. Repeat until the schedule is clear.

2) clear the schedule except for one item. Then hit “Copy Week” (note: deselect the day). Assuming you have more than one Nest thermostat, you go to a different schedule and hit “Paste Week”.

I would recommend the first solution. It’s simpler and faster.

Sorry this review is so long. I hope it was helpful.";"2020-04-23T16:51:53-07:00";"https://itunes.apple.com/us/review?id=464988855&type=Purple%20Software";"464988855";175;"en";"POSITIVE"
237;5296676974;"Vic30";"https://itunes.apple.com/us/reviews/id27126597";"5.42.0";4;"Upgrade";"Nest app for temp has been great, we just changed out our broken ring doorbell for the hello doorbell and so far major upgrade, no connection issues and good quality video. Only thing I’ve noticed so far is the Home/Away settings it seems to not recognize when we are away as accurately as it used to. Also, the thing we miss about Ring that Nest so far doesn’t have us the neighborhood feature. We would get notifications from neighbors with the doorbell cams when something suspicious was going on or stray animals etc. that was pretty cool besides the fact that the ring doorbell connectivity was terrible all the time!";"2019-12-20T10:43:19-07:00";"https://itunes.apple.com/us/review?id=464988855&type=Purple%20Software";"464988855";110;"en";"POSITIVE"
238;5238586787;"GGTOH2017";"https://itunes.apple.com/us/reviews/id122624288";"5.42.0";1;"Don’t Purchase Nest now that google owns it";"I’ve had Nest products for years and it was a great product that did have its hiccups but it was very tolerable. Ever since google bought Nest I’ve had constant problems with connection issues and the app just tries to load with no success. 

Notifications on movement for the doorbell either is significantly late or nonexistent. My living room camera has been offline for days. The home/away setting on the thermostat changes when it’s not supposed to. My stat heats two degrees past set point. 

I think my smoke/CO detectors are working but at this point - I have no idea. 

I really enjoy knowing that google has know privacy issues; gives a guy a nice fuzzy feeling. 

I loath google and wish Apple would come out with something similar because I know it would work and I wouldn’t have the privacy concerns. I have two Smoke/CO detectors, inside camera, doorbell, and the keyless entry door lock along with the subscription. Without hesitation, if Apple offered similar products I would rip out my old system, that worked great before google bought Nest, and switch. 

Nice job google, thank you for reminding me how incompetent you are and why I don’t patronize you.";"2019-12-05T20:28:22-07:00";"https://itunes.apple.com/us/review?id=464988855&type=Purple%20Software";"464988855";202;"en";"POSITIVE"
239;6605608416;"Disappointed2012ugh";"https://itunes.apple.com/us/reviews/id190086152";"5.58.0";2;"Thumbs down on latest updates👎";"Stop taking features away!Do not like the updates. I don’t always want the camera light on. I want to be able to turn it off on some cameras. Put the light switch back please. Also, now I can’t scrub the video forward or backwards looking for when an event actually started. And then, there’s times I get a notification that a “person” has been spotted, but when I check video, it’s a cat in the yard, or it’s the fan that’s oscillating, geesh. If a feature can’t be accurate then it needs fixed or removed. To improve is the goal of an update right? y'all keep changing the ""how it works"" not improving on speed or ease of use. I'm paying too much hard earned money on a service that keeps degrading.";"2020-11-03T11:37:14-07:00";"https://itunes.apple.com/us/review?id=464988855&type=Purple%20Software";"464988855";132;"en";"POSITIVE"
240;6040124169;"WVTKIINS";"https://itunes.apple.com/us/reviews/id162321834";"5.50.0";3;"Love the design of the app HATE the lag";"Don’t get me wrong, i love Nest. I have the video doorbell, the inside cam, the door lock, and the thermostat. My doorbell camera lags so much. The person could be at the door for 15 seconds already before it notifies me. I originally left Ring doorbell to come to Nest because the quality of the image is amazing. Also, when speaking to the indoor camera or doorbell you cannot hear anything when you’re talking. A few flaws I’m hoping Nest will fix with an update.
Recently it will show me an event but when i click it...... NOTHING. I have to rewind using the 15 second feature to get back to the time it captured motion. I really love the best products but not a fan of the glitches";"2020-06-05T15:40:22-07:00";"https://itunes.apple.com/us/review?id=464988855&type=Purple%20Software";"464988855";130;"en";"POSITIVE"
241;6021884251;"Tyson J.";"https://itunes.apple.com/us/reviews/id10863017";"5.50.0";2;"“Hello” is disappointing";"The thermostat is fine, so if that’s what you’ve got the app for, ignore this review. I bought Google/Nest’s doorbell “Hello” because Ring gets bad scores for their poor privacy. You pay a premium price for Hello and it is absolutely a sub-par experience. It feels like the teams working on Nest products are understaffed and demoralized. Hello “works”, I guess. It recognizes people and rings the doorbell when people press it. There’s several seconds of delay for both, and since I don’t pay for one of their overpriced monthly plans, I don’t get recorded video. That means when delivery people show up, I get notified, tap the notification, and see an empty porch. The stills they keep never include the people. So useful. Overall, I regret buying it and wouldn’t do it again.";"2020-06-01T06:37:02-07:00";"https://itunes.apple.com/us/review?id=464988855&type=Purple%20Software";"464988855";134;"en";"NEGATIVE"
242;5125214572;"cbreier";"https://itunes.apple.com/us/reviews/id34328110";"5.41.0";5;"App is great! Family share is a cluster now with google.";"App works great. Problem is with the way google does family sharing now through the home app. Basically have to create home in google home and add people to share with through home app. Then in the nest app have to add a new home but select the home you setup in google home app. Of course this is not documented really anywhere else. Feel like google needs to invest a lot in changing product documentation as ithere seems to be huge gap since the took over product. Once I figured that out though it works great.";"2019-11-11T16:49:12-07:00";"https://itunes.apple.com/us/review?id=464988855&type=Purple%20Software";"464988855";97;"en";"POSITIVE"
