"";"id";"userName";"userUrl";"version";"score";"title";"text";"updated";"url";"app";"wordCount";"language";"sentiment"
0;7945068832;"Romkins1953";"https://itunes.apple.com/us/reviews/id970034727";"5.66.0";5;"Outstanding system";"I’ve had the nest thermostat for almost a year now, and I can say it’s money well spent. First, it was very easy to install. The instructions are easy to follow; I did not have to do any rework. I did not have to hire a professional. Programming the controls was also easy with step by step instructions. I like the fact that it self programs economic settings based on when you’re home. I’m single and working so it’s nice to know it is saving me money by reducing back the heating and cooling temps when I’m not home. And it does it automatically through a sensor that detects motion. This could, however, be a problem if you have a big dog. You can also control the settings using your smart phone, which is what I do pretty much all the time. I can even control it from work and by using Google voice. This system requires a dependable WiFi. If the WiFi goes off line, however, as it has done with me a few times, the system will still function but you won’t be able to control it from you smart phone. Once the WiFi is back on line, the thermostat will automatically resume previous settings. And best of all, it has saved me hundreds of dollars in utility savings. And it looks sharp on the wall. Well worth the money, and so easy for DIY’ers. Definitely worth a five-state rating!!";"2021-10-23T05:20:31-07:00";"https://itunes.apple.com/us/review?id=464988855&type=Purple%20Software";"464988855";242;"en";"POSITIVE"
1;5826022476;"Firemanndave";"https://itunes.apple.com/us/reviews/id260078387";"5.47.5";5;"Replacement Thermostats";"I’ve had Honeywell internet-compatible thermostats in my house for nearly six years, and they just stopped communicating with the internet after multiple calls with service.  Luckily I got them at Costco!  Costco returned them with no issues, and they also happened to have Nest thermostats available too.  So I got a full refund for the old thermostats, and bought two new Nest Version 3 thermostats (as my house is divided into two areas).  Replacing the first thermostat took a little longer than the second, as it was just getting to know how the unit works and confirming the wire schematic.  The first unit connected to my router with no problems, but the second one kept failing at first.  I ended up temporarily moving the second unit to the first unit’s location and got it to connect.  After I moved it back to its correct location, it was still connecting ok.  

The only reason I gave it 4 out of 5 stars was that the actual application kept disconnecting after both thermostats were connected, and several times during installation.  It’s almost like it reset, and you’d have to start the install from the beginning again with the Nest app.";"2020-04-17T11:53:04-07:00";"https://itunes.apple.com/us/review?id=464988855&type=Purple%20Software";"464988855";198;"en";"NEGATIVE"
2;5968349966;"Yimmy291";"https://itunes.apple.com/us/reviews/id120402990";"5.50.0";3;"Needs hold feature and to be night shift worker friendly";"Don’t get me wrong I love nest and nest products they are great. However, I have the Nest E and I wish that there was a temperature hold feature for this or something similar to that. I have attempted to troubleshoot this problem by clearing out The schedule and setting it two times but it always reverts back to Eco or the temperature goes up. I work nights which means I sleep during the day and since I live in a hot dry air and state waking up at 1300 hrs drenched in sweat because The thermostat and the app didn’t talk to each other showing my location and the thermostat were in the same place; the schedule that I set up wasn’t followed; or the fact that the thermostat did not detect any motion for an extended period of time. Not only is this a problem when I am sleeping on my work days as a nurse, but it’s also a problem on my off days when I just want to spend the morning in bed and after six or 7 AM it throws the temperature up to 86°.
Google developers I know you can fix this and I hope you can even if it means downloading firmware to help and upgrading the app. I also know that these are changing times and more people are at home so even more now than ever the thermostat doesn’t know what the hell it’s doing because we are all home now. But you would really help an ER nurse out if you could truly get this fixed on the Nest E and other thermostat.
Thanks";"2020-05-19T20:12:53-07:00";"https://itunes.apple.com/us/review?id=464988855&type=Purple%20Software";"464988855";274;"en";"POSITIVE"
3;6544678216;"larry_ren";"https://itunes.apple.com/us/reviews/id17375316";"5.57.0";1;"Frustrating";"The products themselves are excellent quality.  But this app is a huge disappointment. It has such a high latency rate - you open the app and it takes 45 seconds to load up to the main menu. (It’s not my wifi or cellular connection) So let’s consider this: your doorbell rings. You open the app, wait 45 seconds, then navigate to the doorbell where you can access the microphone and begin talking. At that point, the interaction time has been about 55 seconds. Most people, after ringing a doorbell, won’t stay at the door that long, thus by the time I can finally get to the mic the person is gone and the feature is no longer useful. Additionally, it’s a pain to guard nest guard with the app. I’ll tap the shield and it will load for 30 seconds and then say it can’t connect. I do it again. Can’t connect. After 5 or 6 times it will FINALLY arm the system. A last complaint I have is that nest is no longer integrated with HomeKit. It was previously before the company was purchased by Google. I get that Google instead wants you to use the Google home system however, as an avid Apple user, it’s frustrating to have to use 2 systems. We chose Nest because the physical products are far beyond the competition but there are some serious rooms for improvement for this application. Reduce network calls on app launch, considering auditing latency for the app and see where the problem lies, and please integrate with HomeKit.";"2020-10-17T06:18:33-07:00";"https://itunes.apple.com/us/review?id=464988855&type=Purple%20Software";"464988855";260;"en";"NEGATIVE"
4;7264995381;"John Alden";"https://itunes.apple.com/us/reviews/id101720895";"5.60.0";5;"Great, intuitive, useful app for a great product (Nest thermostat).";"I bought this thermostat at the same time I replaced my HVAC system a couple weeks ago, but I wish I'd gotten one sooner. I'm sure I've already saved money, because the learning function has already made it WAY easier to maintain a comfortable temperature, and I don't forget that I have the AC or heat on, and overshoot a comfortable temperature.  I was really impressed how quickly it learned my habits, and began preempting my changes, so I find I'm quickly losing the habit of constantly thinking about the temperature, and I haven't found  myself uncomfortable enough to be reminded since about day 2. It's really cool to be able to control it from my phone, but I find the more technical controls useful, and the data it records and aggregates is just as interesting and useful. I know this is supposed to be a review for the app, not the thermostat, but it's really just an aspect of the same product, so I believe it's relevant. It IS a solid, intuitive app, user friendly & well laid out, and it's an app for an undeniably great product.

Pricey, but absolutely worth it.";"2021-04-25T22:29:02-07:00";"https://itunes.apple.com/us/review?id=464988855&type=Purple%20Software";"464988855";194;"en";"POSITIVE"
5;7573059937;"Liqalotapus";"https://itunes.apple.com/us/reviews/id1179920675";"5.65.0";3;"Works great until you change the WiFi Password";"Worked great in -40 temp to 104degree F temperatures, night/Day, worked great for really almost a year. The girlfriend changed the WiFi password about a week ago, and since then I have tried and tried to get back in to the camera, it just won’t connect, google has no support for it in the end. Just leads you around for trouble shoot your issues, I only keep getting the C100-C119 codes. Trouble shoot them atleast 3 times a day for the last week. NO LUCK AT RECONNECTING. Google says try using your old password, umm yeah okay so change wifi back to original password, reset everything uninstalled the app etc etc tried to connect with it and still nothing. So changed password again disconnected everything then rebooted it all left the camera plugged in and gave it the password again, wouldn’t connect to wifi, dun matter how close u bring it to the router it won’t connect. Anyways I left it alone for almost the whole day and it connected for about 5mins. Then it just lost connection again. So $188 don’t seem like much to a lot of ppl but it’s a lot to me. ALSO GOOGLE JUST TOOK $60 from me to renew the fkin yearly plan for data I did cancel it and still yet to be reimbursed so there’s that too.";"2021-07-13T14:11:58-07:00";"https://itunes.apple.com/us/review?id=464988855&type=Purple%20Software";"464988855";225;"en";"NEGATIVE"
6;7065377359;"Kurt Kinetic";"https://itunes.apple.com/us/reviews/id32802816";"5.60.0";2;"Google ruined Nest";"Not sure what happened to the Nest thermostat product line, either Google took over and tweaked the product to their specifications, or Nest produced a product that was meant to be disposable and then sold it to Google...
My two year old nest thermostat woke up one day and decided that it couldn’t/wouldn’t connect to my wifi.  No reason, that Google would admit to, just because it felt the need to be independent I guess?  After a day of back and forth with google support, they graciously offered to replace my two year old thermostat (just a few months out of warranty... what happened to products that were designed to last and last and last???). I waited the week to get my new thermostat and just finished the almost two hour installation process... same issue as before, first it couldn’t/wouldn’t find my wifi network, then when it finally found it, it wouldn’t/couldn’t connect (keep claiming the password was incorrect...no it wasn’t), then when it finally conceded to doing what it was designed to do, it wouldn’t connect to my nest app on my iPhone... after several resets and retry’s, I was finally able to convince the two products to communicate with each other... probably my last nest product... my A/C guy says go with Honeywell... think I will next time...";"2021-03-04T12:22:42-07:00";"https://itunes.apple.com/us/review?id=464988855&type=Purple%20Software";"464988855";220;"en";"POSITIVE"
7;7923944435;"ChitownOne";"https://itunes.apple.com/us/reviews/id134488999";"5.66.0";5;"On The Fence because of Price of Unit";"The nest is second to none. I have replaced three electronic thermostats and was hesitant to purchase the unit for couple reasons. I have Alexa units through out the house. The cost compared to other units. My only regret I should have bought it earlier. It’s easy to install and use. The Mobil app is so convenient. If your laying in bed you can adjust the temperature from your phone. If your away from your home you can monitor and change any setting remote. Ladies turned the heat up or air conditioning down no problem Mobil app! The features are amazing it’s a well thought out product. The unit view awakes when you look to see what the temp is.. Only negative about nest is if you have google workspace you have to create another email outside of workspace. The google nest product does not connect to google nest thermostat. That’s a very small one time inconvenience for the most sophisticated easy to use thermostats I have used as a  home owner of over 30 years! On the fence but it! You won’t be disappointed but amazed with the quality and convenience of the unit.";"2021-10-17T02:26:11-07:00";"https://itunes.apple.com/us/review?id=464988855&type=Purple%20Software";"464988855";195;"en";"POSITIVE"
8;6848500914;"ludwigj";"https://itunes.apple.com/us/reviews/id33764690";"5.60.0";3;"Long term user";"I have had Nest products for about 8 year in my 2 homes. I have enjoyed being able to monitor and manage the temperatures at each home at any time. I have not found the Protect product as useful. I went all in a brought 5 Protects and found them to be supper expensive and annoying to maintain. After about 6-8 years Nest will send you a notice that you Protect will no longer work and you have to replace it with a new. The other annoyance it takes allot of batteries 6-8 that don’t last that long. It test it self once a month which is annoying and create a lot of unnecessary messages and disruption. Given the cost of batteries and the device and frequent messages I have decide not to replace theProtect as they obsolete. I will just replace them with stand alone 10 year maintenance free devices and save a fair amount of money and aggravation. When I started with nest they were just Nest but now that Google owns them ever time I sign it to maintain my device Google wants me to switch over to my Google account to manage them. I use a lot of Google products but at some point I want to restrict how much info they have on me so I keep saying no I don’t want to switch to Google. It is very annoying.";"2021-01-09T01:54:49-07:00";"https://itunes.apple.com/us/review?id=464988855&type=Purple%20Software";"464988855";235;"en";"NEGATIVE"
9;5330945995;"carcar advancer";"https://itunes.apple.com/us/reviews/id179367327";"5.42.0";5;"Love My Nest Cameras";"i have had my nest cameras for about a year & a half and i would recommend them to anyone! the quality of both the video & audio is still amazing to me. 
i bought the cameras after having a recurring issue with a neighbor & their teenagers. it was not long before the cameras put an end to the ongoing issue. the teens were in rare form one day, yelling obsenities & making crude gestures. then they called their mom & said i was harrassing them. when she got home i walked across the street with my cell phone. both cameras caught the entire episode. at one point the teens were out of view of the cameras, but the AUDIO was still captured of them threatening to destroy my cameras.
i have not had an issue since then. the cameras were a lifesaver!
on another occasion, my mailbox had been hit, so i just scrolled back through the video & there it was. a landscaping truck had taken it out. i simply called the company, forwarded the video & they replaced my mailbox.
i am a single woman, so the cameras give me peace of mind. they have paid for themselves many times over!";"2019-12-28T07:48:25-07:00";"https://itunes.apple.com/us/review?id=464988855&type=Purple%20Software";"464988855";205;"en";"POSITIVE"
10;7096908610;"TheRidetohealth";"https://itunes.apple.com/us/reviews/id302155137";"5.60.0";1;"Trapped in a service that I did not want.";"I bought my cameras two years ago and have had no complaint until recent. I have upgraded my plan and down graded my plan with no problems until late. I called myself upgrading back to 30 days video history to find out about EBR(event based recording). The most ridiculous thing I have ever came across. Now there are patches of footage in my history that are missing. I have missed arguments that the cameras use to pick up but now don’t because no one was in view of the camera. I can not stand it. I bought the cameras because the way they function. With the upgrade I’m now generation two and the owner of 300 dollar cameras that function how google feels they should. To top it off I was paying $40per camera a year. Now to get them to function the way they were when I bought them.I have to pay $60 a year per camera. The costumer service is below average the take turn transferring you to the next person that can not help you. Defiantly a product to avoid. There are other cameras out there for cheaper. That offer the same thing cheaper and you can avoid having patches of important footage missing. The company is trying to save storage space or charge you monthly for it is my best guess. Either way it’s at the cost of the consumers sense of security.";"2021-03-12T21:36:28-07:00";"https://itunes.apple.com/us/review?id=464988855&type=Purple%20Software";"464988855";237;"en";"POSITIVE"
11;6696201969;"Tuwharetoa7";"https://itunes.apple.com/us/reviews/id40539167";"5.59.0";1;"Consistently worse every time I use it";"The nest app used to be great and worked seamlessly. Somehow Nest consistently releases bugs and the app gets worse every time I use it. At this point scrubbing through video streams is completely unusable. It glitches and jumps and freezes so much while trying to scrub that it becomes so irritating that I just give up. What’s strange is that it used to work just fine, some how they totally messed it up. Not only that but they actually accidentally removed the button to be able to switch between events and the ability to scrub through the video feed. The button was still there just didn’t have an icon so you could still activate it for a while. Overall I’ve become so consistently disappointed with nest and their app that I’m slowly getting rid of all of my nest equipment. For the record, I have four nest cameras, a doorbell, thermostat, the security system and two smoke detectors. I also pay for the subscription monthly. 

I also understand it might be hard having employees work from home and that updates might be tough but honestly it’s almost as if there is no quality assurance whatsoever. I work in software engineering and if I released the garbage that nest releases I might get away with it once but on a consistent basis, like nest,  I would totally be fired.";"2020-11-28T11:13:53-07:00";"https://itunes.apple.com/us/review?id=464988855&type=Purple%20Software";"464988855";229;"en";"NEGATIVE"
12;5214526634;"___________________________.__";"https://itunes.apple.com/us/reviews/id470595871";"5.42.0";4;"One small thing that makes a big difference to me";"The app itself works well.  There are periods of time through the year where I would just like to run the fan on my furnace without being in heating or cooling mode.  The nest thermostat can run the fan by itself, but when doing so it must be in heating or cooling mode.  In spring, I like to circulate cool air from the basement through the house.  I also like to leave windows open for fresh air, and circulate that air too.  There are days where it’s 80* during the day and 50* at night.  These are perfect days to leave windows open and periodically run the fan.  However, for this to work with the nest, I have to set the cooling mode on and use a cooling set point above 80* to make sure the air conditioning isn’t coming on wastefully while windows are open.  It’s not the end of the world, but an item that I believe should be simple functionality that would bring me to like the product better.  If it worked as I would like it to, I could check in on the temperature with the app and run the fan during the day, without having to mess around and closely monitor temperatures.";"2019-11-29T19:27:57-07:00";"https://itunes.apple.com/us/review?id=464988855&type=Purple%20Software";"464988855";207;"en";"POSITIVE"
13;6983143582;"tjonlyric";"https://itunes.apple.com/us/reviews/id194839756";"5.60.0";3;"Mixed feelings about the product";"I have to be honest that I had really high hopes for the Nest product and it’s family of devices, but over time I have grown a little frustrated with its operation. I own a Nest thermostat and a Nest Protect, the thermostat is constantly resetting my manually set programs without making physical adjustments on my phone or at the thermostat itself, I am having to reprogram the Nest about once a month. I changed my internet provider last year and ever since my Protect has been offline, I have followed all the instructions to connect the project to the Nest, and keep getting an error message saying the Protect is too far from the Thermostat to connect, this message arrives as I am physically holding the Protect in hand while standing next to the Thermostat. I have deleted the device and tried adding it numerous times with the same failures. Beyond that the protect consumes batteries at an incredible clip, you would think that such a powerful company behind the. Eat products would be able to deliver an energy efficient product, but I guess that has yet to happen. Sadly, I am more disappointed than excited about how this product has functioned over the years.";"2021-02-11T15:48:12-07:00";"https://itunes.apple.com/us/review?id=464988855&type=Purple%20Software";"464988855";206;"en";"POSITIVE"
14;5301765782;"stlrunningman";"https://itunes.apple.com/us/reviews/id111963878";"5.42.0";5;"Nest Thermostat App";"Pros:
-well built.  
-easy to install
-built in lithium ion battery backup
-Geofencing.
-runs fan after the heat turns off for a couple minutes to get the rest of the heat out of the ductwork instead of heating the walls.
-seems to connect well on both 2.4 and 5 G networks.
- the app does well at showing the thermostat wire connections.

Cons
-does not work with Apple home kit which would put the Thermostat control right in the control center of the iPhone.   I am hoping they add this in a future update!
-no geofencing range limit that can be set.  Not sure what range it is using.  It would be great to at least know.
-requires all home members who want to use geofencing (home/away) feature to have separate google accounts. 
-does seem to always recognize when I come home and doesn’t switch from Away to Home mode.
-cannot set the cycle rate so the temps fluctuate way to much.  I am guessing the different is about 2 or 3 degrees.  This maintenance band is too wide.
-both on the app and the thermostat it’s hard to know what temperatures you are looking at, is it the actual temperature or set point.  Especially around the dial, it just uses points and does not list out the actual temperature.  Very annoying.  I don’t want to have to add up 1/2 degree tick marks.  Include some numbers already.
-lithium ion battery is probably not replaceable.

Was a tough choice between this and the Emerson Sensi.  Just hoping for some good updates now that google owns it.";"2019-12-21T14:06:53-07:00";"https://itunes.apple.com/us/review?id=464988855&type=Purple%20Software";"464988855";266;"en";"POSITIVE"
15;6598008318;"Justin Boucher 123";"https://itunes.apple.com/us/reviews/id18012844";"5.58.0";1;"Horrible from start to finish";"As with just about all of my nest products I’m mortified at how horrible this app performs. I’m so invested with nest at this point I feel stuck after buying a massive bundle package a year or so ago. They’re app crashes constantly and takes forever to load anything. They’re notifications would rather focus on shadows and bugs then the mail man or cars in my driveway. Their previews never load and instead I get a blank screen. While using the app or in between opening the app I am constantly logged out as is my wife on her phone. The quality of my WiFi doesn’t seem to matter but cameras are co stay my offline. The smoke detectors are constantly giving false smoke detections giving me a heart attack. They’re support is horrible and says use the google home app. Well that apps worse as you can’t open the app and see your cameras. You have to click on every camera to see it and it loads just as slowly and horribly as the nest app. I’m about to just throw it all in the trash and drop a bunch of money on a better product. You’d think a massive company like google would be on top of their tech and have something as sought after as this preforming like the public would expect it to do. So yourself a favor and look into other security options.";"2020-11-01T09:00:10-07:00";"https://itunes.apple.com/us/review?id=464988855&type=Purple%20Software";"464988855";238;"en";"POSITIVE"
16;5187819581;"Laurenrfisch";"https://itunes.apple.com/us/reviews/id42824405";"5.42.0";1;"Integration with Google has made things awful";"We use our nest cameras as baby monitors. We like the capability to check them anywhere with WiFi and knew there would be trade offs given that these weren’t designed to be baby monitors. They’ve always been a bit spotty and the nest service has been down in the middle of the night at less than ideal times. However, now that they’ve forced users to merge a google account with nest account, we have had nothing but problems. We leave the app up all night to monitor our kiddos and it hasn’t stayed active without crashing in WEEKS. I have to wake up multiple times each night to re open the app and check on our kids. This is absolutely unacceptable especially given that they’re designed to be security cameras. I expected the service to improve from our previous issues with the integration with google accounts but it has been nothing but downhill from there. I am seriously considering a different product because the app experience is so poor. Get it together google. You’re supposed to set the gold standard for app experiences. If you’re a user reading this it’s probably too late and you’ve already bought the equipment to go with the app but if I’ve caught you early enough, steer clear.";"2019-11-23T10:39:29-07:00";"https://itunes.apple.com/us/review?id=464988855&type=Purple%20Software";"464988855";213;"en";"POSITIVE"
