"";"id";"userName";"userUrl";"version";"score";"title";"text";"updated";"url";"app";"wordCount";"language";"sentiment"
323;6587563321;"CharlieS2013";"https://itunes.apple.com/us/reviews/id202237154";"5.58.0";4;"Update";"There was an update at some point recently to either Nest or my Apple Watch and it won’t allow me to play the motion video clips on my watch anymore. That is probably my only complaint but I do find it pretty inconvenient and the only reason why I am giving 4 stars instead of 5. I have had the cameras for over a year now and love them. I chose these over the ring to have the ability to review all footage 24/7 and not just motion. I am hoping Nest will come out with a spotlight camera and update so motion clips are able to be viewed on my watch again.";"2020-10-29T12:39:36-07:00";"https://itunes.apple.com/us/review?id=464988855&type=Purple%20Software";"464988855";113;"en";"POSITIVE"
324;5468664683;"crazybirdlady7";"https://itunes.apple.com/us/reviews/id160359850";"5.45.0";3;"Nothing but trouble lately";"I don’t know whether it was a recent update or what it is but my Nest is not staying programmed and functioning the way it used to. I have it set for heat-cool as it’s winter in Florida and temperatures vary. It is not maintaining the temperatures that I have set it for. Quite frustrating. I mentioned it to my neighbor and he is having the same issue with his thermostat. It isn’t holding the temperature we select, it seems to sense you aren’t moving so it changes the temperature. I work from home and sit at a desk with minimal movement and then I wonder why I’m too hot or too cold. I don’t like it; am thinking about looking for another programmable thermostat";"2020-01-30T20:46:49-07:00";"https://itunes.apple.com/us/review?id=464988855&type=Purple%20Software";"464988855";125;"en";"NEGATIVE"
325;5408951937;"LxSiPhone";"https://itunes.apple.com/us/reviews/id156443429";"5.42.0";3;"Bring back Nest App with Apple Watch";"I use my Apple Watch 24/7 so I don’t carry around my phone.  The Nest app used to have Apple Watch app so I never had to get out of bed to change the thermostat and it had third party apps that allowed me to live stream my cameras. I mistakenly changed over to my google account because my notifications took forever to receive and I thought it would help. Well my notifications are a little closer to real-time at the expense of the convenience of having it on my watch. I have been a nest customer since the beginning but I am seriously thinking there are better options out there now.";"2020-01-15T19:09:43-07:00";"https://itunes.apple.com/us/review?id=464988855&type=Purple%20Software";"464988855";112;"en";"POSITIVE"
326;7708991029;"harvbluman";"https://itunes.apple.com/us/reviews/id115881568";"5.66.0";1;"Wish it was better";"This app is terrible. The cameras produce a high quality and sharp image i like that part.  Why is it that when I need to view the camera through the app when the doorbell rings, it takes forever to load up??? It’s not the WiFi and it isn’t my cell data. Also, why hasn’t this been faceid enabled yet for iPhone? If I can’t log in through the app it reverts to google home and then I have to click a bunch of buttons to get back to my home page. It’s annoying. Incorporate a hold temp feature for the thermostat too. I work nights and wake up in a sweat because my thermostat wants to be in ECO mode in the summer…in Florida. There are cheaper alternatives to cameras yes with faster load times, but I want to give my nest a chance.";"2021-08-18T18:55:17-07:00";"https://itunes.apple.com/us/review?id=464988855&type=Purple%20Software";"464988855";144;"en";"POSITIVE"
327;7603820562;"IHeartRadio s&cks";"https://itunes.apple.com/us/reviews/id416376530";"5.65.0";3;"Only one schedule available";"I am pretty happy with the Nest and app for heating and cooling our house. With crazy schedules it’s hard to get a schedule that works. One issue is that you can only set one schedule, and it’s either for hearing or cooling, not both. I just don’t want extremes for either heating or cooling, but heating is dominant in our northerly climate so that’s how our schedule temps are oriented. I found that during the summer the AC was always blasting right before bed. It was the schedule making the nightly change, not a family member! So I’ll have to adjust it every season or just turn off the schedule until winter.";"2021-07-21T20:55:37-07:00";"https://itunes.apple.com/us/review?id=464988855&type=Purple%20Software";"464988855";113;"en";"POSITIVE"
328;7588575445;"fichyyy";"https://itunes.apple.com/us/reviews/id1129895758";"5.65.0";1;"Shocking how crappy";"If you are intending on using a remote temperature sensor, save your money and don’t buy this junk. You can only schedule the 2nd sensor over 4 time blocks that are preprogrammed by nest and you cannot change. It is so stupid, I probably sound like a boomer that can’t figure out how to use Facebook, but it is true. 

This thing will often be below the temp the a/c is set to and it will still be running and will say “in 10 minutes” as if it still has more cooling to do. 

The app constantly logs me out of the app and requires me to sign back into my Google account and then Google security emails me to tell me that someone logged into my account. Yes, it’s true. For a thermostat, it probably has way too much access to my life. Way too much overkill for something that can barely control the temp in my house. 

If you use Alexa, you can’t instruct it to turn the fan on for a period of time and you can’t ask it to use the second temperature sensor. 

If this was a prototype it would be cool. As a product sold at a retail price, I would be embarrassed if I was part of the team that developed this joke.";"2021-07-17T17:27:57-07:00";"https://itunes.apple.com/us/review?id=464988855&type=Purple%20Software";"464988855";220;"en";"POSITIVE"
329;7368575254;"Nesto user";"https://itunes.apple.com/us/reviews/id459996006";"5.60.0";1;"User interface is too cluttered";"Why can’t you software guys make the user interface simple and easy to use? The first thing the user wants to do is go into the thermostat. Put that at the top, not at the bottom of the page. I could only find it when I looked all the way at the bottom called “Hallway.” Why does Hallway have to be at the very bottom of the page? Why?
Take a cue from Apple‘s iOS user interface. It’s clean and simple. And yes, even though this is a learning thermostat, being able to program it manually is a nightmare. And lastly, for some reason, I cannot get the Farsight function to turn on; the option is locked out. So this means the unit is dark when I’m sitting across the room. What’s the room temperature Google?";"2021-05-20T21:34:54-07:00";"https://itunes.apple.com/us/review?id=464988855&type=Purple%20Software";"464988855";136;"en";"POSITIVE"
330;6731149307;"Eggerlady";"https://itunes.apple.com/us/reviews/id248428515";"5.60.0";2;"I wanted to like it";"I love the idea and the design.  Everything seems to be pretty intuitive and easy to figure out.  None of that matters, however, because the app constantly crashes.   It will never stay open more than 5-10 seconds.  The only way for me to actually view my camera is when I log in using a laptop...which means I have to be at home to see anything.  It is crazy that I can’t check a camera I got for security unless I’m at home.  It also means the features like two-way communication are useless.   Check out the community discussions for troubleshooting to see the real problems with this app.  I wish I had before I bought the camera.";"2020-12-08T08:39:15-07:00";"https://itunes.apple.com/us/review?id=464988855&type=Purple%20Software";"464988855";116;"en";"POSITIVE"
331;6428878537;"saucyraichu";"https://itunes.apple.com/us/reviews/id38382734";"5.55.0";3;"Scheduling on app is buggy";"I wish Nest would stabilize their app interface a little better. Trying to set a schedule after resetting our thermostats is a pain because you’ll set the times/temps for a day, back out to copy that day across the week, and you’ll come back later to find temps and times completely changed. And that’s with auto-schedule turned OFF. It’s like the app is trying to sync a little too quickly so it’s registering settings as you’re scrolling the temp up or down, instead of waiting to sync the setting a few seconds after you’ve lifted your finger from the screen.";"2020-09-14T10:06:02-07:00";"https://itunes.apple.com/us/review?id=464988855&type=Purple%20Software";"464988855";100;"en";"POSITIVE"
332;6363366201;"ChaseJoy";"https://itunes.apple.com/us/reviews/id305654166";"5.55.0";1;"Not what it used to be";"I was an early adopter and quickly purchased the Protect, Thermostat, and two Nest Cams.  Through the “works with Nest” connections and third party apps I had a wonderful set up that made changes based on geofence settings and native Nest schedules. Everything just worked beautifully.  However, Nest slowly banned third party connections and ultimately killed the “works with Nest” program while simultaneously configuring their app in a way that requires a lot of manual setting changes as you come and go, rather than setting and forgetting.  It’s made the app and products just like any other non-connected device and has made any smart features defunct.  I will not be adding to my Nest devices and will rather be transitioning to another platform.";"2020-08-26T08:37:08-07:00";"https://itunes.apple.com/us/review?id=464988855&type=Purple%20Software";"464988855";123;"en";"POSITIVE"
333;5164105960;"Pettifogger from Boston";"https://itunes.apple.com/us/reviews/id19428113";"5.41.0";5;"Good Equipment, Bad App.";"I love the Nest thermostat and it’s convenience. Nevertheless the mobile app is very unreliable. My connection to the app is spotty. It takes too long to connect and often shuts down after it does. It is not a question of my own equipment because it is the only app I have that behaves that way. It all started after I overpaid for a Nest camera. Because I have three separate locations where I have Nest thermostats, including my office but the camera is at only at my home, it should not be the fault of the camera.";"2019-11-18T04:21:40-07:00";"https://itunes.apple.com/us/review?id=464988855&type=Purple%20Software";"464988855";98;"en";"POSITIVE"
334;5549193251;"Fastplant";"https://itunes.apple.com/us/reviews/id112449089";"5.46.0";3;"Missing small features";"This is not my first smart thermostat. Some features I miss from prior apps are being able to see what the actual temperature is in a room quickly. Instead I can only see what the temp is set to and a line that’s marginally higher or lower than the set temp. The current temp should be able to be shown at a glance. 

Another feature missing is even simpler. I should be able to swipe from one thermostat to another. Instead you must swipe back to the main page and then select the next thermostat. For efficiency I’d like to be able to go into one thermostat and swipe to the next one.";"2020-02-18T11:42:40-07:00";"https://itunes.apple.com/us/review?id=464988855&type=Purple%20Software";"464988855";113;"en";"NEGATIVE"
335;5378873674;"Malfunctioning cameras";"https://itunes.apple.com/us/reviews/id262361012";"5.42.0";1;"Cameras keep on disconnecting";"I purchased several nest outdoor cameras. All but one keep on disconnecting. The most frustrating time this happened was when I was on vacation. What made this situation even more frustrating was when I requested assistance using the chat option, I was informed that there was nothing the nest technician could do because I had to be physically present with the cameras in order for tech to troubleshoot. While I understand this is a limitation of the system, I am disappointed in the frequency at which this happens. Additional troubleshooting has not fixed this issue. (side note: in order to post this review, I have to put in a unique nickname. “Disappointed customer” and “Another disappointed customer” are already taken)";"2020-01-08T19:20:28-07:00";"https://itunes.apple.com/us/review?id=464988855&type=Purple%20Software";"464988855";120;"en";"NEGATIVE"
336;5250777409;"SupercalaMaryPoppins";"https://itunes.apple.com/us/reviews/id366679424";"5.42.0";5;"Easy setup a kid could do it.";"I just received the Nest and our family loves it. My 13 year old was so excited about it she unboxed it herself and started installing it. With my help turning off the electricity during installation it was a breeze and she pretty much did it all. After installation it was easy to download the app and was up and working in minutes. Alexa was immediately linked up and we can tell her the temp we need from every room. I also love the ease of use controlling the temperature while I’m home or away.";"2019-12-08T19:50:47-07:00";"https://itunes.apple.com/us/review?id=464988855&type=Purple%20Software";"464988855";95;"en";"POSITIVE"
337;7614390329;"sjlorac";"https://itunes.apple.com/us/reviews/id676334668";"5.65.0";4;"Frustration";"I love this app, however, when I first got the thermostat, I found it extremely frustrating to figure out how to get it to stop regulating the heat/cool automatically. I’m retired & in & out at all different times...every day. I wanted to be able to control the thermostat from my phone when I went out & forgot to change the temperature or whenever I’m home. I sure didn’t want it running when I’m not home, just because I was home another day & had it running. Thank you You Tube- what a lot of frustration. Others had the same issues.";"2021-07-24T17:04:41-07:00";"https://itunes.apple.com/us/review?id=464988855&type=Purple%20Software";"464988855";101;"en";"POSITIVE"
338;5455982807;"Sophs iPod";"https://itunes.apple.com/us/reviews/id32146273";"5.42.0";3;"Nest app features no longer working after Google bought";"The Nest app and dropcam worked great before Google. Something happened and certain Nest features were either removed or broken by Google. For example, you can no longer save a clip from the app. You have to go to the website, log in, find the clip, save it. Also, it won’t let you select the length Luke the Nest app did. You just save clip and it automatically pics some length, 1 minute? Let me select my exact clip from the app, start and stop time, then save it. I’m hoping this is improved very soon. I miss you, Real Nest app.  Test in your users next time.";"2020-01-27T12:08:55-07:00";"https://itunes.apple.com/us/review?id=464988855&type=Purple%20Software";"464988855";108;"en";"POSITIVE"
339;5271409515;"MattyM823";"https://itunes.apple.com/us/reviews/id311007523";"5.42.0";4;"Great Concept but missing simple things";"Love the interface and setup.  However, there are some trivial settings that should be updated.  The Home/Away Assist does not work consistently and if you are Away with auto Eco temperatures set, the assigned schedule should turn on the designated times.  However, it doesn’t and stays in Eco mode because you cannot use both features together.  The schedule will not resume until you manually set to Home or arrive Home.  The whole point of schedules is so that you don’t come home to a cold house that needs to warm up.";"2019-12-14T03:55:46-07:00";"https://itunes.apple.com/us/review?id=464988855&type=Purple%20Software";"464988855";91;"en";"POSITIVE"
340;5200313479;"Wayne66669";"https://itunes.apple.com/us/reviews/id228395303";"5.42.0";5;"Very little use to this unless you want expensive subscription";"The Nest camera is a Ring for those people who do not want a Ring. The camera is decent. But unless you want to purchase an expensive subscription it is pretty worthless. 

You can do much better much cheaper by purchasing a good camera system and using a dedicated hard drive with software on it. No subscription, no unhelpful customer service and no expensive subscription once you pay for the system it is yours.";"2019-11-26T10:06:55-07:00";"https://itunes.apple.com/us/review?id=464988855&type=Purple%20Software";"464988855";74;"en";"POSITIVE"
341;5223441843;"pat_card1";"https://itunes.apple.com/us/reviews/id15298096";"5.42.0";3;"Useful but glitchy";"I like being able to control the thermostat from my phone, but the learning feature was not able to figure out how to adjust for seasonal weather changes so we turned that off

The MOST frustrating thing was trying to set a manual schedule. The app lets you set a schedule for a given weekday. So I set a schedule of temps for Monday. I copied and pasted into Tuesday and several of the temps changed themselves (on both Monday and Tuesday). So my 68° setting for 5am changed to 82° all on its own. Very bizarre and very frustrating. Google/Nest should be able to figure out bugs like this before updating the software.";"2019-12-01T20:03:32-07:00";"https://itunes.apple.com/us/review?id=464988855&type=Purple%20Software";"464988855";114;"en";"NEGATIVE"
342;7889415599;"PDX Reader";"https://itunes.apple.com/us/reviews/id36247691";"5.66.0";4;"Long time Nest Camera user";"I’ve had these in multiple buildings in several states. I can see if I’m interrupting before calling or texting and tell if there’s someone I actually want to just say hi to. The resolution is fine on several iPhones and I only have one complaint. Why did Google, upon co-branding Nest, feel the need to keep the dozy looking little green led light on 24/7? It’s intrusive and a dead giveaway. S t u p i d. Particularly if it’s used for after hours or night backup for an ADT or similar serious alarm system. Why oh why Mr. Google?! Asking for your actual users. Hello?";"2021-10-07T15:16:42-07:00";"https://itunes.apple.com/us/review?id=464988855&type=Purple%20Software";"464988855";106;"en";"NEGATIVE"
343;7587519601;"Comadog";"https://itunes.apple.com/us/reviews/id37860399";"5.65.0";1;"Thanks for NOTHING Nest/Google!";"You buy all their products, spend thousands of dollars and  they make you switch from nest to google migration and kill all the Apple TV support without warning you and they force you to migrate to have necessary features going forward.   I use your products and spent my money with you!! Google weakens my experience and you give your company a black eye by limiting where you customers can utilize your products. Your only harming yourself, not apple.  You making your customers mad and disappointed by robbing them of features and functionality they had before and were part of the reason they purchased your products in the first place!!  Disappointed and betrayed by Google/Nest!  Buyer beware!";"2021-07-17T09:55:35-07:00";"https://itunes.apple.com/us/review?id=464988855&type=Purple%20Software";"464988855";116;"en";"NEGATIVE"
344;7206846693;"Nksmfamjp";"https://itunes.apple.com/us/reviews/id107287595";"5.60.0";3;"Thermostat controls HVAC, but app is lacking common sense";"The thermostat controls all my HVAC equipment. The app has basic features, but lacks anything more than a bit over basic. 

Learning works, but who really wants a thermostat working to make you less comfortable today based on yesterday’s inputs. Basically if it is 10 deg cooler today than yesterday, I want to bump it up a degree once or twice a day, but I don’t want that permanently..because today will be normal or hotter, most likely. So, turned off learning.

Vacation settings? None

Efficiency settings, yes, but will likely kill pets/plants....so, turned off. Can I adjust efficiency setting to get some gain, but sustain life? No.

More than 6 settings a day....yes, but slows app function horridly.

All I want are like 4-6 settings a day, adjustable increase/decrease for abnormal seasonal high/low outdoor temps, vacation mode, more adjustment on away from home modes, better high humidity control (fan or a/c to dry)....contact me, I’ll write you a use case document!";"2021-04-10T09:33:50-07:00";"https://itunes.apple.com/us/review?id=464988855&type=Purple%20Software";"464988855";161;"en";"POSITIVE"
345;7027225513;"unfair12780942";"https://itunes.apple.com/us/reviews/id148168904";"5.60.0";2;"Quirks, funky quirks";"Nest thermostat has quirks, funky quirks that makes it more difficult to use.  I don’t like it and when they finally fail on me, I will not purchase another nest product...
I think google is too big to make anything work well, including your droid phones.  And your big brother information gathering is dangerous.  I’ve lived long enough to know that just because a firm is big, doesn’t mean it’s the best or even good.  You are a monopoly, period...!!!
Not good for real competition!
I hope this helps in your endeavor to control the world.  Ad words is a perfect example of how google has hijacked what was supposed to be a free internet and a level playing field for businesses...";"2021-02-22T17:50:50-07:00";"https://itunes.apple.com/us/review?id=464988855&type=Purple%20Software";"464988855";122;"en";"POSITIVE"
346;6826338447;"LifetimeJourneys";"https://itunes.apple.com/us/reviews/id161371537";"5.60.0";1;"Landlord controlled";"As a tenant having this installed with the landlord controlling the temperature is a major problem. I understand that they want to save on costs long term. During the summer it was decent since most people like to have it cooler then, now during the winter, it’s so frigid cold because if I attempt to turn the heat up it won’t. I have it connected to my wifi still doesn’t work. I have even tried using this app and it crashes every time I try to use it. My daughter has downloaded the app on her  new iPhone 12 and it crashes for her as well. When I learned that the landlord controlled the temperature I was beyond ticked off. I’m looking for a different place to stay now. I would not recommend this product to anyone.";"2021-01-03T07:12:59-07:00";"https://itunes.apple.com/us/review?id=464988855&type=Purple%20Software";"464988855";137;"en";"POSITIVE"
347;6461572221;"1keith1";"https://itunes.apple.com/us/reviews/id315416247";"5.56.0";2;"Worse than a dumb thermostat and dumber than a smart thermostat";"Nest API is closed source so no integration with Apples HomeKit. But more critically the app makes lots of poor assumptions, so I turn off the learning features. The app takes a real long time to load and I don’t like the wait, could just go over and adjust temperature quicker.

Setting a schedule is lots of tedious work and its hard to select time, touch interface is harder than just putting times in. Also when I put times in and close it, the temperature often gets corrupted. Why has the AC not run today? It saved cool to 92 instead of cool to 74, and now I have to redo the entire schedule one item at a time.

Buy an Ecobee.";"2020-09-23T16:43:54-07:00";"https://itunes.apple.com/us/review?id=464988855&type=Purple%20Software";"464988855";122;"en";"POSITIVE"
348;5239646182;"new england freezes";"https://itunes.apple.com/us/reviews/id37019840";"5.42.0";1;"Too little information available in your app";"I am very disappointed with this NEST thermostat. The message System does not trigger an alert that will  inform me that the house temp is not at target.  The problem is that you have to go into the app and look at it to get the message.  Also the section that tells you that the temp is not at goal does not have a date and time.  How long has my heating system been down?   No help from your app.  Also the temp on the dial is not the actual house temp but the target temp. So In order to  see what the house temp is, again you have to open the app.
No one at google has been able to help me with these concerns.  If someone at google would help solve these problems for me I would be more impressed.";"2019-12-06T02:57:10-07:00";"https://itunes.apple.com/us/review?id=464988855&type=Purple%20Software";"464988855";142;"en";"POSITIVE"
349;5138889696;"Gigyj";"https://itunes.apple.com/us/reviews/id189185435";"5.41.0";3;"Slow Slow  Horrible Service server issues are the newest debacle";"App can take up to 20 seconds to open. No doubt Google is gathering information.  I regret that Nest sold its customers out and I am stuck with my purchase. Don't be a fool and buy anything from Nest/ Google their mobile app is marginal and main frame computer is even worse.  Multiple times it looses your account info so you have resign back in.  Both have frequent "" offline"" issues and server problems are getting to be more frequent.

Latest upgrade is generating “cannot connect to server try again later” quite frequently.";"2019-11-14T15:13:05-07:00";"https://itunes.apple.com/us/review?id=464988855&type=Purple%20Software";"464988855";93;"en";"NEGATIVE"
350;7708408949;"Russo30332";"https://itunes.apple.com/us/reviews/id86436183";"5.66.0";5;"Saved my mother";"I installed the nest protect at my parents house along with the app on my phone. About a week ago I received an alert on my phone that The carbon monoxide levels were high at my parents house. I  Immediately called my mother to see if she was home I had no answer. So I called the fire department they responded and she was home they took her outside and they checked the entire house with there meters and told me the readings were high and if I didn’t call she would have been in trouble. Thank you Nest!!!!";"2021-08-18T14:42:29-07:00";"https://itunes.apple.com/us/review?id=464988855&type=Purple%20Software";"464988855";99;"en";"NEUTRAL"
