"";"id";"userName";"userUrl";"version";"score";"title";"text";"updated";"url";"app";"wordCount";"language";"sentiment"
97;6499930080;"serickjr";"https://itunes.apple.com/us/reviews/id34279836";"5.56.0";1;"Terrible! What Happened...";"I can no longer watch any of my recorded events, they show up in my history with how long the recording is, but when I tap on an event it’s a still shot, video does not play!! I’ve uninstalled and reinstalled multiple times and nothing. This is very troublesome... 
We’ve had our Nest cam & thermostat for several years (it was our first security camera) and never had a single issue until Google took it over. I even tried viewing my history in the Google Home app and still nothing, which tells me this is a Google problem. PLEASE FIX THIS ASAP!!
I also use Ring Camera’s and have no problem getting rid of my one Nest camera and going exclusively with Ring if this issue is not fixed quickly.  
Reading many other reviews here I am clearly not the only one having problems! 
I will change my Star’s from one to 5 when and if this gets fixed back to its original state when it worked flawlessly!";"2020-10-04T08:08:17-07:00";"https://itunes.apple.com/us/review?id=464988855&type=Purple%20Software";"464988855";168;"en";"POSITIVE"
98;7722973937;"Mike121509";"https://itunes.apple.com/us/reviews/id1280600472";"5.66.0";3;"Nest app very irritating";"I do like the ability to control my thermostat from my phone and tablet, but there are several issues with the Nest app that is annoying. 1) Often it says not able to connect and says “Try again”. There nothing wrong with my network, it is the app. 2) It often changes my schedule without asking even though I have the auto schedule turned off. Then I have to go back and correct the changes it made to my schedule. Very annoying. 3) Home/away feature doesn’t work right. It often says away when I am sitting in my living room. 4) Occasionally wants to sign in again with my Google account. I don’t like this in the first place, but why does it repeat this ever so often. Overall, this app does not meet my expectations. But what difference will complaining actually make?";"2021-08-22T12:50:20-07:00";"https://itunes.apple.com/us/review?id=464988855&type=Purple%20Software";"464988855";143;"en";"NEGATIVE"
99;5499388376;"idkillu4adollar";"https://itunes.apple.com/us/reviews/id769805490";"5.45.0";3;"App lags too often";"I love the prospect of this app but for $300 a year annually this app should work flawlessly. Every time I want to view my video history it take forever to load. Once it actually loads the footage plays for maybe 2-3 seconds tops before it shuts off midway through. It’s a constant annoyance to have to mess around with this. Please fix this issue. Another thing that is a bother is not having the option to shut the light off. That feature should not have been removed. You can literally put a piece of black duct tape over the tiny light and never notice the dang difference so when the feature was removed and there was commotion over it I thought how dumb. Anyway, I like nest and the fact that I feel a lot safer with the security of the camera in my home just want the video to stream without any issues.";"2020-02-07T05:24:01-07:00";"https://itunes.apple.com/us/review?id=464988855&type=Purple%20Software";"464988855";155;"en";"POSITIVE"
100;7707135557;"one world bj7";"https://itunes.apple.com/us/reviews/id243154701";"5.66.0";5;"Nest thermostats";"We have two in our home in Wisconsin, and one in our Florida cottage. They are great to control the settings from in bed on your mobile phone or across the country to check on the HVAC system.
One issue to be aware of now that Google is in the picture (as of May 2019) is that notifications may be sent changing your schedule due to what Big Brother thinks it’s learned about your activity or needed energy savings. I can’t locate the copy of the message as I write this review, but our schedule and temperature settings were changed w/o our permission or acknowledgment causing guests to not feel comfortable. The notice didn’t require much awareness to try increasing efficiency and caused a problem with comfort.";"2021-08-18T06:51:54-07:00";"https://itunes.apple.com/us/review?id=464988855&type=Purple%20Software";"464988855";127;"en";"POSITIVE"
101;5245525949;"Another Former Player";"https://itunes.apple.com/us/reviews/id70013543";"5.42.0";1;"Status light and false notifications.";"My dog is consistently recognized as a human and sets off the notification that a person is in my home whenever he stretches out, which is several times a day, creating a chicken little effect.  Additionally, the ability to turn off the status light indicator was removed several months ago.  Now the cameras I have setup in windows reflect a bright blue light in the video that I record on outward facing cameras.  Additionally, it draws attention to the cameras which makes them easily spotted and allows for blind spots in the setup to be identified and alerts any would be thieves that they should take care to cover their faces when entering their field of view.  For my purposes the status light indicators not being able to be turned off, except in connection or troubleshooting issues, is counter productive.  Being able to override these settings manually is a choice that I as an end user would like to maintain.";"2019-12-07T11:43:07-07:00";"https://itunes.apple.com/us/review?id=464988855&type=Purple%20Software";"464988855";160;"en";"POSITIVE"
102;6430204274;"MY CHICKEN POT PIE!";"https://itunes.apple.com/us/reviews/id258011696";"5.55.0";5;"Slow, useless, clumsy";"Prepare to want to throw your phone. The features are somewhat straight forward, but not really. The biggest problems are constant resyncing of your phone to the Nest, the in-app speed is painfully slow at updating, to the point where you’ll think the app has frozen. Notifications are useless and CONSTANT, until you turn them off. Be prepared for “quirks”...yes, I promise you it will change your set points, not per the “learning” feature, it will set your set points to more “green” settings, 100% regardless of how many times you turn off the green feature, or reprogram your schedule. The nest was absolutely not worth the money, the painful app, and everything else. Buy a Honeywell.";"2020-09-14T20:02:39-07:00";"https://itunes.apple.com/us/review?id=464988855&type=Purple%20Software";"464988855";117;"en";"NEGATIVE"
103;6450816145;"Rjvipyoutuber";"https://itunes.apple.com/us/reviews/id1210245754";"5.56.0";1;"Please fix app is buggy and broken after iOS 14 launch";"App needs updated to work with the new Apple software update iOS 14 on the iPhone 11 Pro Max when using the app the security cameras barely work with the app now and have to load every couple seconds instead of being able to stream them live it loads after a few seconds every time and takes at least 20 seconds to load making the live indoor and outdoor nest cameras useless and when you open the app the security camera feed hardly ever shows up you have to keep opening and closing the app until your security cameras finally work. Please fix or I will continue to give one star from many accounts very unsatisfied with the product if the app is fixed I will change my review to 5 stars until then as of September 20, 2020 I do not recommend that anyone buy nest products until this app is updated and fixed to work with the newly released version of iOS 14";"2020-09-20T16:30:50-07:00";"https://itunes.apple.com/us/review?id=464988855&type=Purple%20Software";"464988855";165;"en";"POSITIVE"
104;5263545476;"Mattiarch";"https://itunes.apple.com/us/reviews/id503525660";"5.42.0";2;"Hard to control";"I have a home with an ever changing schedule of people  .  I would like to control the nest temperature from my phone when elderly people are home or pets or bump it up occasionally for kids who cannot do Nest on their own.  My Nest keeps reverting back to Away mode because I am not home.  This is extremely frustrating as people are extremely cold at my house.   As soon as I get home the Nest recognizes my phone but when I pop back out to the store the stupid Nest thinks I am Away and turns down the heat and I come back to a really cold environment.  I am totally onboard with conserving energy while the house is empty but this system is not friendly to those extra family members who can’t control the Nest without a phone.  Changing the dial hardwired to the wall is frustrating because if I am out of the house with my phone the dial reverts back to Away mode for my elderly Parents.";"2019-12-12T05:01:04-07:00";"https://itunes.apple.com/us/review?id=464988855&type=Purple%20Software";"464988855";172;"en";"NEGATIVE"
105;8073564938;"Periboea123";"https://itunes.apple.com/us/reviews/id77968";"5.67.0";1;"Won’t stay Connected to App since the 5.6.7.0 update";"I have had the Nest thermostat for 4+ yrs never had a problem with it… Until Google bought them out. Now on to the latest problem: Since the recent update (5.6.7.0) the Nest and the Phone App (IPhone) will not stay connected. It has messed with my inputed schedule and because it won’t connect it thinks I am away from home? (Home Away is marked Off) Which is causing the heat to kick in at odd times, flipping between the away schedule (which I don’t have enabled) and what ever it or Google deemed it wanted. Sadly, there is no way to report the issue or fix it.  Before anyone asks, Yes, I have tried turning it off and on again, reinstalled it on my phone. Checked all settings on the unit (which are normal and it is connected and on line, WiFi connection is strong and the router is close and the phone and the unit are on the same WiFi.) The problem seems to be solely with the app.";"2021-11-28T10:08:43-07:00";"https://itunes.apple.com/us/review?id=464988855&type=Purple%20Software";"464988855";171;"en";"NEGATIVE"
106;6362988716;"JWrightCA";"https://itunes.apple.com/us/reviews/id12585005";"5.55.0";5;"Technology is great!";"I have now had my Nesr thermostat for several years. I don’t use the schedule feature much but what I love about it is that, summer or winter, I can set the temperature using my iPhone. In the summer when we have warm nights, I will turn the air-conditioning on mine when I get in bed. I I turn off the air when I first wake up and open the house to let the cool area.

In winter, it’s even better! I prefer to sleep with no heat on and so the mornings can be pretty chilly! When my alarm first goes off, I turn the heat on and hit the snooze button. When the house has warmed up a bit, I get up to a toasty house! As soon as I am dressed, I turn the temperature down I turn the furnace off entirely.

I love this thermostat!";"2020-08-26T06:33:01-07:00";"https://itunes.apple.com/us/review?id=464988855&type=Purple%20Software";"464988855";149;"en";"POSITIVE"
107;5187123888;"Tx allergies";"https://itunes.apple.com/us/reviews/id149397652";"5.42.0";4;"Nest Thermostats";"Works pretty good for the most part, usually responsive with little lag time. New devices are easily set up. Being able to control when away from home is a huge perk. 

The home/away feature is great but every persons phone has to be connected for it to operate correctly (my wife’s wasn’t for a while, so nest would go into eco mode while she slept if i left for work). 

The scheduling however is pretty poor and the reason it loses a star. Autoscheculing seems to take a while to learn and adjusts to pretty much every time you touch the thermostat (say if you have guests over and want some cool air). I gave up on it. Manual schedules work well but are tedious to set up on the app (maybe a web based scheduling feature could help) but work well once in place.";"2019-11-23T07:36:39-07:00";"https://itunes.apple.com/us/review?id=464988855&type=Purple%20Software";"464988855";145;"en";"POSITIVE"
108;5089641549;"ibjoxl";"https://itunes.apple.com/us/reviews/id49295407";"5.41.0";1;"Pathetic for interacting with your Nest ecosystem";"The app mangers clearly give zero craps about how a polished iOS app works. There are no widgets for this app, no ""quick actions"", nothing was done to make using this app easy.

Every launch of the app takes you back to the home screen, even when you just switched away for a moment. There are no quick links that can take you directly to a device (e.g. to unlock my Yale/Nest lock). Often launching the app takes me to a ""Sign up for feature X"" screen that I have to dismiss before actually using the app! What the??!? If I want to interact with any of my Nest products, it always involves a multi-tap workflow that requires waiting for EVERY Nest device to load before I can interact with any one of them. Shockingly bad user experience.

Recent updates to the app have broken the Nest doorbell camera viewing completely. Trying to scrub through video causes the app to freeze while my phone becomes lava hot.";"2019-11-05T07:42:41-07:00";"https://itunes.apple.com/us/review?id=464988855&type=Purple%20Software";"464988855";167;"en";"NEGATIVE"
109;6576389129;"e's reviews";"https://itunes.apple.com/us/reviews/id9702623";"5.57.0";1;"Much better option out there";"Update*** so the option to scroll through video was not removed the app was just not working properly which still proves my point. 

Long time nest user that just updated to ios14. Nest continues to go downhill and has just taken away the ability to scroll through your video. The option they leave you with, filters; which would be fine if nest did what it was supposed to and actually picked up movement, which it only does half of the time. Last year they took away the status light and removed the option to turn off your nest light. I love that I have invested over a 1k in these camera and thermostat and they continue to take away the options because THEY know better and know what WE need. Adding fuel to the file these cameras continue to live connectivity each day. I guess I’ll have a ton of paper weights when I invest in a new system that actually keep the use in mind.";"2020-10-26T09:00:22-07:00";"https://itunes.apple.com/us/review?id=464988855&type=Purple%20Software";"464988855";166;"en";"POSITIVE"
110;8010403969;"wintech147";"https://itunes.apple.com/us/reviews/id229548447";"5.67.0";3;"Loved but hard to trust";"I have been a huge supporter of the Nest brand for a long time. I have many products from cameras to the thermostats, temp sensors, and protects. But the app continues to be left behind with constant stability issues. I rely on this app and it’s products to help protect my home and offer convenience and peace of mind but as of late that peace of mind has been slowly dwindling. 

The new Google Home App is just not anywhere close to the Nest app. It requires more taps or pages to do one thing it seems and doesn’t even support the temp sensors that are tied to my  ear thermostats :(

I’m still loving the ecosystem I bought into but fear my love will bite me soon. Considering the newest Nest cams only work in the Google Home App worries me greatly and is keeping me from buying them. But at the same time, my Nest apps continues to crash and be unstable.";"2021-11-10T16:13:02-07:00";"https://itunes.apple.com/us/review?id=464988855&type=Purple%20Software";"464988855";164;"en";"POSITIVE"
111;5448325112;"Unclevacho";"https://itunes.apple.com/us/reviews/id332365561";"5.42.0";5;"Nest 2nd generation soundcheck";"Gave full access to my wife, she gained access, I was not receiving  pre sound check notification, and sometimes not getting when it was completed. After few weeks of troubleshooting with Nest support, as nothing was corrected, I gave up. Today we both got pre sound check notification, sound check was completed and only I got the completion notification. When looked into her phone app, I noticed it says: “As of last month you no longer have access to Nest”!
I totally gave up! Done!  I guess it is what it is! The concept is excellent, but it’s good when it’s functional. Who knows in case of a real fire will I get notified when I’m away? Not thrust worthy!";"2020-01-25T12:56:26-07:00";"https://itunes.apple.com/us/review?id=464988855&type=Purple%20Software";"464988855";120;"en";"POSITIVE"
112;7905319905;"GalaxyLudo";"https://itunes.apple.com/us/reviews/id34602994";"5.66.0";3;"UnReadable Temperatures";"This app function perfectly… For Google.  Unfortunately for human beings with normal eyesight it is almost unusable. 
Nest (and Google) have taken the position that this is a controller device and Not a thermostat. 
That would be OK if they would accept the fact that people are the primary users, not computers. 
On the device, you can have a giant number showing what temperature the house should be at, and a tiny little number that tells you that, yes, you are cold, or hot. 
This app is designed by the same non-human. The display will show you what you want but not what you have.   It is not a matter of available space most of the apps screen is completely empty. The least they could do is make the two settings the same size, and let me use the giant screen I paid for on my Apple device.";"2021-10-11T22:56:47-07:00";"https://itunes.apple.com/us/review?id=464988855&type=Purple%20Software";"464988855";148;"en";"POSITIVE"
113;5707386942;"Jeff horn";"https://itunes.apple.com/us/reviews/id111104030";"5.47.5";5;"Wish I had bought earlier";"My goodness, I absolutely....without a doubt absolutely love this Nest thermostat. I have the latest generation, third or fourth; but it’s the latest. I absolutely love this thing. It will remove the humidity, tell me when I’m saving energy remembers how I like it in my home and when I’m due to be back it makes sure it’s the temp I like when I’m home. But when I’m away it knows it and saves me energy by not keeping it so cool. It will also when it sees it’s possible to do so turn off the A/C compressor and just use the fan to keep my home circulated with heat or cool air. If your looking to put one of these in your home stop procrastinating and do it now!!  I promise you will be as delighted as I am.";"2020-03-24T11:38:20-07:00";"https://itunes.apple.com/us/review?id=464988855&type=Purple%20Software";"464988855";140;"en";"POSITIVE"
114;5121806009;"carlubar";"https://itunes.apple.com/us/reviews/id919709254";"5.41.0";4;"Good system until there is a power failure";"I like using Nest to control my home thermostat remotely but I think the system has a major design flaw. When there is a power outage and the internet connection is lost, Nest goes off line ( which is understandable); but that means heat/AC stops functioning. The problem is that once power is restored and internet is back Nest requires that the router be rebooted before thermostat starts functioning again.  If you are not physically on premises the system stays off line which makes controlling home temperature impossible and potentially dangerous in winter where cold temps cause pipes to freeze.  I’ve had to ask neighbors to go inside my house and reboot my system as I am away on business a lot— poor design and VERY inconvenient !";"2019-11-10T21:33:27-07:00";"https://itunes.apple.com/us/review?id=464988855&type=Purple%20Software";"464988855";128;"en";"NEGATIVE"
115;6562353366;"Brittnwilson";"https://itunes.apple.com/us/reviews/id956330078";"5.57.0";1;"You done messed up G-Google";"We’ve loved our nest products and our nest door bell for years now. Even pay for the Nest Aware subscription, which includes awesome 24/7 video feed. But to my surprise, the lovely developers decided even though you pay for a service, they will take away your ability to scrub through your 24/7 footage as you’ve done for years. All the ability you have now is clicking on short clips in which nest has decided you need to see and leaving you no ability to scrub. I guess just cross your fingers that what nest decided you get to see is good enough. Quick tip, it’s not. Hey google, how am I to review all of this 24 hour video? Oh sorry, I mean clips through out the day that are missing vital pieces even though I pay for more. I suggest you buy a Ring product, maybe they won’t lie to their consumers about features promised in a paid subscription on products you already spent a pretty penny on.";"2020-10-22T08:25:18-07:00";"https://itunes.apple.com/us/review?id=464988855&type=Purple%20Software";"464988855";169;"en";"POSITIVE"
116;5201139331;"vivfam";"https://itunes.apple.com/us/reviews/id181047044";"5.42.0";5;"Best app";"This is the best security app ever nest is awesome it gives us texts when someone is at our house we can also press a voice button then we talk and it comes out of the security camera if you are thinking about getting a app for your security camera please pick this one not because I am doing this for the app but because I am doing this because this is the best security app you could ever get my whole family has this app because it is so good not even good more than great if you are reading this and you helped make this or made it or was the one who had the idea great job you are incredible you are really smart and helped us about our security camera thank you so much";"2019-11-26T15:17:27-07:00";"https://itunes.apple.com/us/review?id=464988855&type=Purple%20Software";"464988855";138;"en";"POSITIVE"
117;8099268916;"Thea-longer-than-anyone-else";"https://itunes.apple.com/us/reviews/id278146290";"5.67.0";5;"Feels Like Luxury";"First, let me state that I’ve zero problems with my Nest set-up or functioning. Nest's online/shared wifi troubleshooting has got me through every not-fully-understanding moment. I highly recommend Nest home thermostat. 

I’m ever conscious of power costs AND also need my bedroom very, very cool (summer and winter) to be able to sleep. Setting TEMP SCHEDULES with Nest is one little life luxury. I come home from work very late at night, to my pre-cooled home. I’m in the desert and refuse to leave a thermostat anywhere close to sleep-comfort temps, winter or summer, while I’m at work, and especially when we’re in nonstop high-90s/triple-digit summer days.
 
REMOTE ACCESS is my Favorite Toy, for two reasons. 
1. I have house guests and I’ve forgot to either change the schedules or WARN 🥴the guest(s) they may start to roast 🥵 mid-afternoon, and wall thermostat will need adjustment. 
2. I fall in the category of 'elderly' 💁🏼‍♀️! I have old bones that hurt, big time, most of the time. Hauling myself out of bed to adjust temps is never pain free, it’s a project. Changing the thermostat from bed is an absolute, I’m-in-big-time-luxury, for me!";"2021-12-05T14:30:32-07:00";"https://itunes.apple.com/us/review?id=464988855&type=Purple%20Software";"464988855";193;"en";"POSITIVE"
118;7935725379;"STOP SUBSCRIPTION GUY";"https://itunes.apple.com/us/reviews/id1273242666";"5.66.0";1;"Useless without subscription";"It is more expensive than others. On top of that, you need to pay 60 dollars each year forever… it is absurdly overpriced. The responsiveness is slow compared to my other doorbell from eufy; and I have a very fast network. The product review only reviews the doorbell under subscription (since it is free for some time after activation). But without subscription, it is useless. The motion alerts are always late; they show no video but just a picture that is 9 out of 10 captured with delay and thus it shows no person or very far. There is NO reason for paying forever for a SUBSCRIPTION. Absurd! Buy something else and stop paying monthly “small” subscription fees for stuff shouldn’t have one. Then you get rid off the doorbell and forget the subscription and will be paying for a long time. Plus, with so many ‘cheat’ subscriptions, have you calculated how much is per year? For what?";"2021-10-20T12:56:14-07:00";"https://itunes.apple.com/us/review?id=464988855&type=Purple%20Software";"464988855";158;"en";"NEGATIVE"
119;5450705485;"Flat Rock Farm CT";"https://itunes.apple.com/us/reviews/id489175151";"5.42.0";4;"Great when it works";"Constantly dropping the WiFi connection makes for frustrating monitoring. When it does connect the resolution is excellent and the night vision better than I had expected - somewhat like a poor resolution b&w video but clear. The audio is a nice feature and the bi-directional functionality makes it my version of “ring”. The transmission lag is minimal compared to other less expensive cameras I have tried and removed. Overall an excellent product, I just wish the WiFi connection was better. In fairness, I don’t have the best WiFi network but I do not have the frequent drops with any other products (computers, Roku, smart TVs, etc). I give it a 4 for the connection issues but a 5 as a camera, app, and ease of installation.";"2020-01-26T04:04:54-07:00";"https://itunes.apple.com/us/review?id=464988855&type=Purple%20Software";"464988855";126;"en";"POSITIVE"
