"";"id";"userName";"userUrl";"version";"score";"title";"text";"updated";"url";"app";"wordCount";"language";"sentiment"
91;3079455796;"ckellar33";"https://itunes.apple.com/us/reviews/id113755881";"1.15.4";1;"Not very good";"App is slow to load. Styling is old and doesn’t even fit full screen on the iPhone 10. Desperate need of a modern update. The Insteon products are great, but lack good software.";"2018-08-17T17:45:51-07:00";"https://itunes.apple.com/us/review?id=564887346&type=Purple%20Software";"564887346";33;"en";"POSITIVE"
92;2300502834;"CAD.Bear";"https://itunes.apple.com/us/reviews/id443346416";"1.15.4";2;"Please fix DST";"Already 2 days since the switch, but my stupid Insteon hub is now an hour off.";"2018-03-12T21:46:56-07:00";"https://itunes.apple.com/us/review?id=564887346&type=Purple%20Software";"564887346";16;"en";"NEGATIVE"
93;4082182246;"TylerButtkiss";"https://itunes.apple.com/us/reviews/id418153600";"1.15.4";1;"No updates for a year?";"Literally no updates for an entire year, no new products, my guess is Insteon is dead.";"2019-04-30T13:19:38-07:00";"https://itunes.apple.com/us/review?id=564887346&type=Purple%20Software";"564887346";16;"en";"NEGATIVE"
94;4420690866;"Tulvox";"https://itunes.apple.com/us/reviews/id182275022";"1.15.4";1;"Terrible";"Very slow and hasn't been updated since Long time ago";"2019-07-06T10:44:12-07:00";"https://itunes.apple.com/us/review?id=564887346&type=Purple%20Software";"564887346";10;"en";"NEUTRAL"
95;3466954168;"Yitzy Aussie";"https://itunes.apple.com/us/reviews/id149003724";"1.15.4";1;"Needs updating!";"App has not been updated in extremely long time - no iPhone X screen support and watch app does not work with WatchOS 5. Unacceptable.";"2018-11-27T09:39:08-07:00";"https://itunes.apple.com/us/review?id=564887346&type=Purple%20Software";"564887346";25;"en";"NEGATIVE"
96;3175007754;"summer5156";"https://itunes.apple.com/us/reviews/id240799938";"1.15.4";1;"Not working at all";"It works good at beginning, but is not working now , I can not open the app , so , all my lights can tune on , and can not open garage too";"2018-09-10T07:36:21-07:00";"https://itunes.apple.com/us/review?id=564887346&type=Purple%20Software";"564887346";33;"en";"POSITIVE"
97;3432618095;"Bald Guy";"https://itunes.apple.com/us/reviews/id36838742";"1.15.4";1;"SLOOOOW";"The point of home automation is to make things easier, right? This app is SO SLOW to load that it creates more frustration than creating the ease of automation.";"2018-11-18T07:34:54-07:00";"https://itunes.apple.com/us/review?id=564887346&type=Purple%20Software";"564887346";29;"en";"POSITIVE"
98;1667868463;"Divisionday";"https://itunes.apple.com/us/reviews/id534357341";"1.15.3";1;"Does not work";"Doesn't want to connect any longer. Completely worthless";"2017-07-03T19:28:26-07:00";"https://itunes.apple.com/us/review?id=564887346&type=Purple%20Software";"564887346";8;"en";"NEGATIVE"
99;3848701720;"Philomathius2";"https://itunes.apple.com/us/reviews/id41911414";"1.15.4";1;"Do not buy";"This is the worst app and hardware I’ve ever purchased. Almost never works. I wish I could give it no stars.";"2019-03-06T01:54:35-07:00";"https://itunes.apple.com/us/review?id=564887346&type=Purple%20Software";"564887346";21;"en";"NEGATIVE"
100;3738014956;"Miles267";"https://itunes.apple.com/us/reviews/id19784666";"1.15.4";2;"Needs updated for iPhone X and Watch";"Severely outdated and buggy. May migrate from Insteon.";"2019-02-05T19:08:44-07:00";"https://itunes.apple.com/us/review?id=564887346&type=Purple%20Software";"564887346";8;"en";"NEGATIVE"
101;5871917438;"dolce far niente";"https://itunes.apple.com/us/reviews/id29989862";"1.15.4";1;"Total Useless Garbage";"These products and the app that controls them are useless

This app is crap";"2020-04-27T11:57:51-07:00";"https://itunes.apple.com/us/review?id=564887346&type=Purple%20Software";"564887346";14;"en";"NEGATIVE"
102;7583293936;"love2breathe";"https://itunes.apple.com/us/reviews/id703836666";"1.15.4";1;"Joke";"You call it an App? Ha ha ha
Better walking to the devise turn it on or of than
using the app.
Slowly but surely SmartHome going to the trash can of history.";"2021-07-16T07:25:11-07:00";"https://itunes.apple.com/us/review?id=564887346&type=Purple%20Software";"564887346";33;"en";"POSITIVE"
103;6743399290;"Bingnano";"https://itunes.apple.com/us/reviews/id195651078";"1.15.4";1;"Mr. Requester";"This app is out of date! They need to update for new Apple Watch! My new Apple Watch is not see of anything for installing!!";"2020-12-11T18:44:33-07:00";"https://itunes.apple.com/us/review?id=564887346&type=Purple%20Software";"564887346";25;"en";"NEUTRAL"
104;3575972849;"Tristanbroth";"https://itunes.apple.com/us/reviews/id186796189";"1.15.4";1;"Doesn’t work";"Needs updating. Reason enough to not buy Insteon.
Simply broken.";"2018-12-26T08:37:21-07:00";"https://itunes.apple.com/us/review?id=564887346&type=Purple%20Software";"564887346";10;"en";"NEGATIVE"
105;1605808595;"Jonnybegood6";"https://itunes.apple.com/us/reviews/id41692568";"1.15.3";1;"Needs a makeover already";"Time to redo this app and add color and life to it. Also needs to be more flexible to move icons around.";"2017-05-05T06:00:27-07:00";"https://itunes.apple.com/us/review?id=564887346&type=Purple%20Software";"564887346";22;"en";"POSITIVE"
106;3246138952;"Khorton";"https://itunes.apple.com/us/reviews/id49389174";"1.15.4";1;"Does not work on watchOS 5";"While the app works on the iPhone with iOS 12, it no longer runs on the Watch with watchOS 5";"2018-09-29T20:54:50-07:00";"https://itunes.apple.com/us/review?id=564887346&type=Purple%20Software";"564887346";20;"en";"NEGATIVE"
107;3585356813;"Tubbyp003";"https://itunes.apple.com/us/reviews/id137151722";"1.15.4";2;"App stopped Working";"Needs to update app, nothing working???";"2018-12-28T15:26:05-07:00";"https://itunes.apple.com/us/review?id=564887346&type=Purple%20Software";"564887346";6;"en";"NEUTRAL"
108;1867481092;"never buy la crosse again";"https://itunes.apple.com/us/reviews/id101135951";"1.15.3";1;"Insteon is “CRAP”";"The set-up instructions are wrong!  The app has s/w bugs.....crap!  The Hub app is missing options that should be there.....crap! Don’t buy!";"2017-10-22T12:43:51-07:00";"https://itunes.apple.com/us/review?id=564887346&type=Purple%20Software";"564887346";22;"en";"NEGATIVE"
109;3425342287;"John Verdonck II";"https://itunes.apple.com/us/reviews/id326721411";"1.15.4";1;"Connectivity";"Disappointing.  Worked well initially.  But very poorly as of late.  Can’t connect with iPhone or iPad";"2018-11-16T11:17:53-07:00";"https://itunes.apple.com/us/review?id=564887346&type=Purple%20Software";"564887346";16;"en";"NEGATIVE"
110;2526267281;"T9876";"https://itunes.apple.com/us/reviews/id85962141";"1.15.4";1;"Terrible coding.";"Directions should say, remove from box and place directly in garbage.";"2018-05-09T19:32:20-07:00";"https://itunes.apple.com/us/review?id=564887346&type=Purple%20Software";"564887346";11;"en";"NEUTRAL"
111;4005127783;"Mexico Magico";"https://itunes.apple.com/us/reviews/id38138942";"1.15.4";2;"User interface awful";"Think Windows 1997 versus Mac 2019. The GUI is awful and confusing.";"2019-04-12T18:17:57-07:00";"https://itunes.apple.com/us/review?id=564887346&type=Purple%20Software";"564887346";12;"en";"NEGATIVE"
112;1478122874;"Blogography";"https://itunes.apple.com/us/reviews/id39578426";"1.13.2";2;"It works... but needs a lot of work.";"This app does work for me. And that's about the only thing good I can say about it. From the obscenely loud button beeps you can't turn off to having to dismiss a useless, non-working initial control screen to get to the actual control screen... there's just too many irritating things about the app that keeps it from being a tool you want to use. What's even more inexplicable is how the app recognizes specific sensors... like a garage door opener... but had a confusing and generic interface for it. Is having the app say ""Door Open"" and ""Door Closed"" instead of the cryptic ""Relay Open"" and ""Sensor Closed"" really too difficult? Why isn't there a preset configuration for the FanLink switch that automatically populates the light on/off and fan speed buttions? Configuring that monster manually is not just horribly difficult, but you don't get actual radio buttons that light up properly. Somebody please put some effort into making this a more logical, helpful, and configurable app. The entire Insteon system isn't nearly as useful without it.";"2016-11-03T18:57:26-07:00";"https://itunes.apple.com/us/review?id=564887346&type=Purple%20Software";"564887346";177;"en";"POSITIVE"
113;2174899337;"Joyman74";"https://itunes.apple.com/us/reviews/id36554593";"1.15.4";3;"iPhone X support?";"Waiting for X Support 5 months now";"2018-02-06T11:09:06-07:00";"https://itunes.apple.com/us/review?id=564887346&type=Purple%20Software";"564887346";7;"en";"POSITIVE"
115;3332655675;"miamibeef04";"https://itunes.apple.com/us/reviews/id36520578";"1.15.4";1;"Apple watch support gone";"Bring back watch support please";"2018-10-22T18:07:12-07:00";"https://itunes.apple.com/us/review?id=564887346&type=Purple%20Software";"564887346";5;"en";"POSITIVE"
116;1644494493;"Ambitian";"https://itunes.apple.com/us/reviews/id7933251";"1.15.3";5;"User(s) Error(s)???";"Based on reviews, I warily installed 12 switches last year to control a few 3-way switches and other lights in my living room, family room and kitchen. 

Installation was fairly easy and the one problem I had was very adeptly handled by Insteon support team. 

I put the switches into several scenes and onto sunrise/sunset timers and everything  performed flawlessly for the last 14 months.

Now I'm in a bit deeper. Over the last few days, I swapped out 74 more switches and added a few dimmer modules and four outdoor controllers for my landscape lights. I also added 20 leak detectors. 

I was incredibly pleased by the fact that not a single device failed to function properly during installation. They all communicated flawlessly with the Insteon Hub and are now assigned to their various rooms and scenes and behaving well. 

I find the iPhone app to be quite easy and intuitive to use. There are a few things I'd tweak if I were in charge, including allowing for more flexible scheduling, conditional events and allowing and offset to the sunset/sunrise times, but these are all ""nice to haves"" not ""must haves"". 

All my switches are the 2477D model. 

Alexa works perfectly after reworking my naming conventions to suit her demands (hint: if you have a three-way switch, name the primary switch, for example, ""family floods"" and switches two and three ""fam flds 2"" and ""fam flds 3""). 

I'm a big fan of my Insteon setup, so am puzzled by all the negative reviews.  My guess is most of the reported problems are user errors.";"2017-06-14T16:03:14-07:00";"https://itunes.apple.com/us/review?id=564887346&type=Purple%20Software";"564887346";265;"en";"POSITIVE"
117;2369146562;"Born4TheSky";"https://itunes.apple.com/us/reviews/id41360541";"1.15.4";5;"Great";"Please add iPhone X support.";"2018-03-31T17:19:49-07:00";"https://itunes.apple.com/us/review?id=564887346&type=Purple%20Software";"564887346";5;"en";"POSITIVE"
118;3655561700;"Allen Alsamarraie";"https://itunes.apple.com/us/reviews/id256054484";"1.15.4";1;"iPhone x support";"iPhone x screen size need to be fixed and redesign required";"2019-01-15T22:51:42-07:00";"https://itunes.apple.com/us/review?id=564887346&type=Purple%20Software";"564887346";11;"en";"NEUTRAL"
119;1871308503;"Agentmikeyd";"https://itunes.apple.com/us/reviews/id144574238";"1.15.3";1;"Horrible";"No support for Siri w hub 2.";"2017-10-24T03:15:58-07:00";"https://itunes.apple.com/us/review?id=564887346&type=Purple%20Software";"564887346";7;"en";"NEGATIVE"
120;803014970;"MoColBeck";"https://itunes.apple.com/us/reviews/id32977569";"1.3.0";3;"Basically functions but clunky and has some bugs";"I've been setting up the hub today with a bunch of different existing devices and while it basically functions as it is supposed to it is fairly cumbersome to work with and there are a few things that just don't work properly, like support for I/O Linc devices. Regardless of the setting in the UI (where I am trying to control a gate with the on command closing the relay, off opening which is a listed option) only appears to be working in latching mode. I have not been able to add certain devices to scenes that have never been a problem with other applications, icons only show two lines for the name under the icon which truncates things often and there is no way to reorder the icons which aren't in any particular order. Note that you can only configure the hub from an iOS device - no web interface, no programming from the Insteon connect cloud offering and nothing on Mac or PC. Hoping for updates and improvements soon as this definitely does not reflect the quality of most Smarthome products and the Insteon brand at this point.";"2013-05-11T15:08:06-07:00";"https://itunes.apple.com/us/review?id=564887346&type=Purple%20Software";"564887346";190;"en";"POSITIVE"
121;722836874;"LDW 46";"https://itunes.apple.com/us/reviews/id138334893";"1.1.0";1;"Not complete & not reliable";"I have over 50 Insteon devices & this held the promise of a more elegant solution than previously available.  Unfortunately is doesn't deliver. Initial setup with the Hub is effortless & setting up individual devices is implimented well.  However many functions are not yet implemented, and there are major problems with both the software interface & functionality. There is no manual & the app interface is not very intuitive, requiring you to call tech support for many answers.  The software/hardware combination doesn't reliably communicate with the Insteon devices. I set up one scene just fine, but adding a second using the same lights resulted in unreliable reporting of  device status & lighting levels no matter what I did.  The second scene took some values from the first scene repeatedly making it's use problematic. 

I have spent many hours trying to set up automated lighting with this App & their Hub, but it has been a frustrating undertaking with 1 defective hub, several app reinstalls and hours of work by myself & their great tech support staff. This combo may suffice in some specific (and limited) situations, but it just doesn't work well overall.";"2013-01-04T16:31:16-07:00";"https://itunes.apple.com/us/review?id=564887346&type=Purple%20Software";"564887346";193;"en";"POSITIVE"
122;1414785372;"TroyusRex";"https://itunes.apple.com/us/reviews/id32386894";"1.13.1";5;"Great app. No real issues.";"I've been using the app for about three months now. I had originally planned to use a different app after I got all of my Insteon switches installed but this one works fine so I haven't bothered to switch. 

The best thing about the app is the ability to see all of my lights and sensors in one place. In seconds I can tell if any lights were left on and if any doors are open. I can then turn off any lights that are on (open doors, unfortunately, can't be closed remotely 😊). 

Once the app is loaded up lights respond instantly which is a big improvement over other brands I've tried. 

Scheduling works great. I'm not sure why some people have trouble with it but mine is easy and flawless. My pool is on one timer and I have various lights on other timers. Especially useful is having the ability to have lights set to turn on at sunset and off at sunrise. 

All that said, the app isn't perfect. It can take a good fifteen to thirty or more seconds to start up. That means you never just pull out you iPhone to turn on/off a nearby light. It's great for checking all lights but not so great individually. 

Also, the layout is a bit cumbersome what with devices, rooms and scenes and then having status vs edit in different places. Even now I almost always go to the wrong place to edit a device. 

All told, however, I'm very pleased with the app.";"2016-07-18T09:10:15-07:00";"https://itunes.apple.com/us/review?id=564887346&type=Purple%20Software";"564887346";257;"en";"POSITIVE"
123;1501841059;"Doug526";"https://itunes.apple.com/us/reviews/id7003126";"1.14.1";2;"so many serious flaws";"I keep getting signed out and have to constantly re enter my password when trying to access over my cellular connection. This technology in theory is great but it is really tedious to use, and set up. Creating a scene is not intuitive with the included videos. It took me awhile just to figure out how to trigger my lamps from my motion sensor. They have a pointless little 6 second movie clip but it does nothing to help. when I finally did figure out how to configure the motion scene it had to have me hold the button on the back of the motion sensor every time I wanted to make a change to the scene which was tedious. Imagine if you had multiple motion sensors or door sensors mounted on the ceiling and had to constantly get up there and press buttons every time you wanted to change a scene??!! Needs to be a better way to use this system. With how much all the proprietary hardware costs, you'd think it would all work elegantly. Not so much... i'm thinking of switching to Z wave since it's an open platform.";"2016-12-14T09:41:46-07:00";"https://itunes.apple.com/us/review?id=564887346&type=Purple%20Software";"564887346";192;"en";"POSITIVE"
124;1221329453;"DiegoA.";"https://itunes.apple.com/us/reviews/id193251390";"1.9.32";2;"Very beta at the moment";"The app definitely shows promise and there are glimmers of hope, however this system is more beta than production quality. 

-Setup is relatively easy, however adding devices via the sync feature doesn't work as well as manually entering in the device ID, so if you have a home full of numerous Insteon devices prepare an Excel spreadsheet before mounting your switch plates.
-The app occasionally takes a long time to load.
-No Roomie support, device list does not manifest
-Devices randomly stop working after hours or days of successful functionality.
-Siri integration works great but that's only when devices are actually detected which from my 1.5 weeks experience is about 50:50.
-No sunset schedule option
-No notifications
-No support for sensors 
-No support for IP cameras
-etc...

The list goes on, I'm just hoping Insteon provides several major updates especially considering the new WWDC HomeKit announcements. I know that HomeKit is a limiting factor to some of the missing features for the Insteon Hub Pro but there's a lot to be desired. For anyone looking to upgrade from ISY, I would wait a while unless you plan on using this solely for lighting with Siri control in mind and even then I would wait.";"2015-07-02T18:22:04-07:00";"https://itunes.apple.com/us/review?id=564887346&type=Purple%20Software";"564887346";204;"en";"POSITIVE"
125;1553373366;"waasy";"https://itunes.apple.com/us/reviews/id42160034";"1.15.1";5;"Really nice. Almost perfect!";"This is a great App that is perfect excel you should be able to set lights or other things to come on randomly within what ever time period you chose. This would be a great security feature that a competing company has. Everything they make is slick & easy to use & install (forme). It is absolutely great for home security & convenience! It helped me save money on my electricity bill as well. It's hard to pick apart something this good however, the only thing I can say is that if very bad is if you hub goes bad you can't import the old hub setting to you new hub and it's very difficult, almost impossible, to connect a previously connected LED light to a replaced hub. I know I've had to replace a hub. They need to have a web interface where you can retrieve your old settings. Other than that it's perfect!";"2017-02-26T17:45:28-07:00";"https://itunes.apple.com/us/review?id=564887346&type=Purple%20Software";"564887346";155;"en";"POSITIVE"
126;868820595;"Wakeboyx5";"https://itunes.apple.com/us/reviews/id111139567";"1.4.0";5;"Great security device";"I bought this for a basic function, when a door is opened, send me a SMS text. I bought the Insteon Hub, and a single Insteon Wireless open/close sensor. With this app, it took me less then 15 minutes to install and configure the Hub and open/close sensor. Everything was VERY straight forward. When does that ever happen when configuring Internet devices??? I positioned the Hub and sensor only 5 feet apart, so I can't speak to the range of the RF. I also get emails when the door is opened. I also didn't bother configuring my router to support remote (over the Internet) connection between the iPad add and the hub, so I can only configure my system when at home, but I still get emails and Text messages away from home.

This was so easy to set up that I want to buy more Insteon sensors and controls, but I really don't need them.";"2013-09-11T14:24:40-07:00";"https://itunes.apple.com/us/review?id=564887346&type=Purple%20Software";"564887346";156;"en";"POSITIVE"
127;1073279403;"rshanahan";"https://itunes.apple.com/us/reviews/id12317028";"1.9.0";3;"Update and still no Landscape mode on iPad!";"I too add my request for landscape/rotate mode.  I have an iPad mini wall mounted (for this and other home controls) and it’s not very appealing having this app sideways.  Would also like to have customizable icons (add your own as most of the supplied icons don’t really fit most locations/devices I have set up).  One more thing, maybe some color?  Kinda boring everything being sky blue.

Otherwise, I really like it.  Because I have scene control switches in the walls, use of the iPad is mainly for setting up scenes, and for now can just use my iPhone or my full sized iPad.  This leads me to how nice the hub keeps all connected iOS devices in sync.  When I was using Hue, if you set a scene/schedule up on one iOS device, it did not show up on others, so to edit the scene you had to go on the device it was created on.  They may have resolved that by now.";"2014-10-01T06:44:06-07:00";"https://itunes.apple.com/us/review?id=564887346&type=Purple%20Software";"564887346";164;"en";"POSITIVE"
128;1271213507;"Cal Reviews";"https://itunes.apple.com/us/reviews/id33979159";"1.10.1";5;"All in all good product";"I've been using Insteon throughout my home for 2 years now (60 plus wired-in light switches and 4 thermostats).  For the most part everything is been completely smooth and reliable.  I was able to set it up and just use it without it becoming a time draining science project.  From changing out all the light switches and thermostats, to getting them paired with the hub for which I relied 100% on the Insteon iphone App to do.   Super simply and intuitive.  I just upgraded to the Hub2 and that was bumpy but I've managed.  My call into technical support yesterday had a 3 hour wait or call back which if not improved is sadly going to end this company.";"2015-10-13T16:35:50-07:00";"https://itunes.apple.com/us/review?id=564887346&type=Purple%20Software";"564887346";119;"en";"POSITIVE"
129;1108629876;"Sasha K NY";"https://itunes.apple.com/us/reviews/id78011576";"1.9.6";2;"Great hardware; immature software";"Insteon's dual-band (plc + radio) mesh networking capability is the most robust home automation protocol on the market today (short of native RESTful ip implementations yet to emerge).

But it's held back by software such as this app. Consider:
1) There's not a way to back up / restore your entire house's configuration - not on the hub, not offline. If a lighting strike messes it up (which happened to me, even though I have a whole-house surge suppressor installed), you need to reset everything and start from scratch. From scratch!
2) There's no officially supported synchrony among configurations done via this app / hub, in the House Link desktop application, and locally on the devices. Unofficially there's evidence of engineering bias to push whatever capability the switches/devices can support by themselves, onto them - which is good as it minimizes a single point of failure / bottleneck. But you can't officially have a clear view yet if a particular scene or config resides in the device, in the hub, or in the software.
3) After the current update, this app consistently crashes in iOS6.1 right after the interface is populated from the house config and it begins reading device states.";"2014-12-05T23:16:15-07:00";"https://itunes.apple.com/us/review?id=564887346&type=Purple%20Software";"564887346";201;"en";"POSITIVE"
130;1068532075;"NotCranium";"https://itunes.apple.com/us/reviews/id41247016";"1.8.0";3;"Works ok but crashes";"I initially had many problems but after contacting Insteon and them walking me through a complete reset of the hub it started working.   Odd that it needed to be reset out of the box. 
I am now able to control and see the status off all of my Insteon devices.   I love being able to turn on the fan and turn off the lamps in the MBR from my bed. 
Now the major issue with the software is that I can not rename any device, room, scene without the application crashing.  This may be specific to IOS 8.0 because in the past, I was able to do this.  
Now I have 5 leak detectors and all are named the same.  It's a good thing I don't have the issue with Houselink application.   
This should be an easy fix and I hope they get it fixed soon.";"2014-09-22T06:06:15-07:00";"https://itunes.apple.com/us/review?id=564887346&type=Purple%20Software";"564887346";146;"en";"POSITIVE"
