"";"id";"userName";"userUrl";"version";"score";"title";"text";"updated";"url";"app";"wordCount";"language";"sentiment"
0;1627910872;"Dirk D.";"https://itunes.apple.com/us/reviews/id25053893";"1.15.3";2;"One word: Buggy";"It took me over a year to finally get my two homes (primary and vacation) working perfectly. Some wired units had to be replaced for failure to connect - may be my fault for mis-wirring. I'm giving them the benefit of doubt. I've bought range extenders. I've changed outdoor timers. I have my primary wired with lots of lamps and outdoor lights on a schedule. I have cameras to monitor my vacation home - which was a primary factor in my purchase. It took lots of tech support to get the cameras operating correctly for remote viewing, but when working they were great.

Lots of upfront cost, BUT I prefer that over monthly fees some systems require. I don't like the fact that I can't have more than one schedule to come on at sunset - everything that turns on at sunset must go off at the same time.

Now I go on vacation and I can't connect. My lake house alarm goes off and my alarm app tells me it's a motion sensor. Insteon fails to connect and I can't see inside. I can't connect to anything. I get home and still can't connect. I can't even connect inside my primary residence. Frustrating is an understatement. Is this a result of the hubs planned - and then delayed - updated?";"2017-05-29T10:31:36-07:00";"https://itunes.apple.com/us/review?id=564887346&type=Purple%20Software";"564887346";221;"en";"NEGATIVE"
1;3768652601;"Tyhtytyn";"https://itunes.apple.com/us/reviews/id145781215";"1.15.4";2;"Getting better but missing some things";"The UI is a little cumbersome to navigate. Alerts are nice but need their own menu section to allow me to view, edit, and add all the alerts from one screen. Also, alerts need a schedule of their own. I may only care about an alert at a certain time of day or day of the week. My garage door app has that and it makes a lot of sense.

Update:
Please make some updates to the feature set of this app. Allow for multiple schedules per device or seen. Allow time flexibility within those schedules so it doesn’t look like a computer is turning the lights on and off every day.

I downgraded the rating because this app gets updated once a year and even then it’s not adding new features. Please start putting some development effort into the app and hub.";"2019-02-14T04:19:17-07:00";"https://itunes.apple.com/us/review?id=564887346&type=Purple%20Software";"564887346";143;"en";"POSITIVE"
2;2277241786;"YanceMaster";"https://itunes.apple.com/us/reviews/id100308139";"1.15.4";1;"Would be 4-5 when they fix fatal flaw in App";"Your iOS App has a fatal flaw; I am writing to hope that your developers can fix this problem. For those who have multiple sites under ""House Management: Current House"", you need to fix the app so that the user can chose the current house at startup. At the present, the app defaults to the last chosen Current House, and this leads to preventing the user from connecting to any of their Houses, if the last house chosen has lost power. In the event of a power failure, the App ALWAYS continues to connect to the house with no power when that was the last house chosen, which prevents the user to connecting to any house, as there is no way to get to the settings menu to allow the user to change to a house that has power, so the app becomes useless for any account that has multiple houses.  There needs to be a user choice at startup to allow the user to switch Current House settings in the event that the app cannot connect to the last setting, in the case that either the server cannot be reached for any reason: power outage, internet connection problems, etc... you get the point.";"2018-03-06T06:43:37-07:00";"https://itunes.apple.com/us/review?id=564887346&type=Purple%20Software";"564887346";204;"en";"NEGATIVE"
3;7626428000;"Mike199";"https://itunes.apple.com/us/reviews/id43514035";"1.15.4";5;"Stop Complaining and Use This App!";"It’s July 28, 2021 and I just let my $50/year MobiLink subscription expire because this app does everything I need to do when away from home.  My Insteon system currently has 20 scenes (7 of which are scheduled), 32 KeypadLink buttons, and 23 other devices including an IO Link.  Everything is set up and managed via the ISY Admin Console on my Mac.  I don’t need to run every scene or set up any schedules when away from home, and it was no big deal to reprogram four scenes into this app.  This app runs the IO Link whereas the newer Insteon app does not, and this app works faultlessly across both my wife’s and my iPhones running the current iOS.  I have the newer Insteon Hub installed and I highly recommend this app to everyone who does.";"2021-07-27T23:26:23-07:00";"https://itunes.apple.com/us/review?id=564887346&type=Purple%20Software";"564887346";138;"en";"POSITIVE"
4;6578056175;"zorkguy";"https://itunes.apple.com/us/reviews/id37560565";"1.15.4";1;"Awful, awful.";"Minimum number of features, not to mention very buggy. Two of my water sensors show as being triggered all the time. There seems to be no way to reset them, despite having rebooted everything multiple times and gone through the forget and reinstall procedures several times. These sensors work perfectly with the Indigo home automation program, just not with Insteon's own app. Update: it shows the wrong IP address for all three of my cameras, and yet it still controls them. End it won’t allow me to change the IP address to the correct one. Poorly written software.

Edit: You can’t change your email address without change in your account name. This means if you get a new email address you have to wipe all of the information in the app and start all over again adding devices. Whoever wrote this software should be fired.";"2020-10-26T20:44:07-07:00";"https://itunes.apple.com/us/review?id=564887346&type=Purple%20Software";"564887346";145;"en";"NEGATIVE"
5;1671636976;"Den CO T";"https://itunes.apple.com/us/reviews/id25975174";"1.15.3";1;"Too basic and out of date";"The app is years behind the state of the art and the abilities that are available in competing products/apps. Insteon is not user friendly nor is it flexible, compatible with other systems, or capable of some basic type of programming. 

For example, you cannot use a sensor to turn on a light for 10 minutes (or any other duration). 

You cannot have two scenes (programs) that start at the same time (e.g., sunset). The app actually tells you to combine the scenes. That does a user no good, if the scenes are supposed to end at different times (or duration... if the app actually supported durations).

Insteon, please update the app and your hub to modern standards.

Follow-up: I tried using Alexa with the hub/app. That also barely works. Alexa shows notes that it cannot control scenes. Also, if you say, ""Turn off the porch light,"" Alexa does not work, because it does not know it is a light. It only understands, ""Turn off the porch.""  It is a bit of a bigger deal with the garage door opener, because it is much more unnatural to say, ""Turn on garage door"" to open the garage. 

Insteon, please add interoperability with Wink.  Their hub is hardware agnostic and works well for programming different scenarios and works well with Alexa.";"2017-07-06T12:26:13-07:00";"https://itunes.apple.com/us/review?id=564887346&type=Purple%20Software";"564887346";218;"en";"POSITIVE"
6;3613965974;"cjohnson14086";"https://itunes.apple.com/us/reviews/id101413854";"1.15.4";1;"Absolute garbage";"We can rarely connect to the app. Somehow the existing connected dimmer switch devices still function through Alexa, but accessing the Insteon app after login just yields a spinning wheel and the eventual error message stating it can’t connect to the hub. This is our second unit, we replaced the first for similar issues before it stopped working all together. The hub spends most of its time in a disconnected error state which means it has to be unplugged and re-plugged in to regain a solid green light and connection. It’s literally four inches from the range extender it connects to! This thing is becoming more frustration than its worth. If we are unable to get a resolution we’ll be returning it again and going with a different brand next time around. Very disappointing.";"2019-01-04T22:40:28-07:00";"https://itunes.apple.com/us/review?id=564887346&type=Purple%20Software";"564887346";134;"en";"NEGATIVE"
7;4349310195;"Opinion90";"https://itunes.apple.com/us/reviews/id336625035";"1.15.4";5;"Works great for me.";"I just bought the Insteon Hub and linked 5 devices (4 modules and a switch).    I had it all up and running in 45 minutes, including wiring in the switch.  Linking devices takes 1 minute per device and is super easy.  The App design is good in my opinion.   This new system replaced an older X10 system that was fraught with problems so maybe my expectations were low, but I am thrilled so far and didn’t expect to like it this much.   I won’t ever have 20 devices on it like some people — for how I use it, it is great so far.";"2019-06-21T13:08:52-07:00";"https://itunes.apple.com/us/review?id=564887346&type=Purple%20Software";"564887346";104;"en";"POSITIVE"
8;7103426800;"BobcatALR";"https://itunes.apple.com/us/reviews/id451597584";"1.15.4";1;"What a complete joke";"Featureless. Even those features that do work are severely handicapped. You cannot have more than one scene respond to sunrise/sunset? Really?! Even the old x10 junk could do that. And just try to set a schedule time in ios14.X. It’s like trying to use a slot machine to set time- minutes constantly scroll, and it ignores touches to reduce the number. This is basic stuff they’re failing on. I guess they want everyone to spend a couple hundred on an isy994i - but that’s overkill for most installs - and also fails at some very basic programming functions (like no calendar. Really?!).

Losing my appetite for insteon, and have been an insteon user since its earliest days. Shameful.";"2021-03-14T14:40:21-07:00";"https://itunes.apple.com/us/review?id=564887346&type=Purple%20Software";"564887346";118;"en";"NEGATIVE"
9;4902241472;"Manuel_Alonso";"https://itunes.apple.com/us/reviews/id135959728";"1.15.4";1;"Sad future";"I have been faithful to Insteon for over 17 years ... but in recent years they have not improved ... there is no progress in the application that certainly stopped working with Apple Watch a long time ago ... I used other devices like isy ... that helped mitigate the lack of advances in its platform ... the arrival of cheaper and more compatible technologies is taking away the Market from Insteon... to that we must add the unfulfilled promises they make when they talk about system updates.  .. where for months nothing changes ... it is sad but gradually I am migrating to other alternatives ...";"2019-10-06T18:41:46-07:00";"https://itunes.apple.com/us/review?id=564887346&type=Purple%20Software";"564887346";107;"en";"NEGATIVE"
10;1694160123;"ZombieGod2";"https://itunes.apple.com/us/reviews/id34623405";"1.15.3";4;"Sensors notifications master on/off needed";"The setup works OK. I wish there was an option to turn sensor notifications on/off when I am at home (kind of like arm/disarm option where you can create and manage a group of devices for which you want the functionality). I just do not want to get alerts every time door/motion/window sensor goes off when I am at home. How about that Insteon team?";"2017-07-22T19:57:50-07:00";"https://itunes.apple.com/us/review?id=564887346&type=Purple%20Software";"564887346";65;"en";"POSITIVE"
11;3763017067;"Rwp120";"https://itunes.apple.com/us/reviews/id87430358";"1.15.4";2;"Used to be happy";"I used to love this app as it worked great with my 70+ devices but it’s been over a year since the last app update and it hasn’t worked with the Apple Watch in months. A company that blatantly ignores cries from its customers and won’t update applications is an indication that the company is about to abandon its product line. I won’t buy another Insteon device for fear that I’ll never be able to replace them if they break in the future. Insteon needs to update its app and I’ll update my review.";"2019-02-12T15:02:33-07:00";"https://itunes.apple.com/us/review?id=564887346&type=Purple%20Software";"564887346";94;"en";"NEGATIVE"
12;3261459641;"Tboy2009";"https://itunes.apple.com/us/reviews/id43203472";"1.15.4";2;"App Keeps Making me Login - Apple Watch Broken";"App is mediocre and now Apple Watch doesn’t work with ios5. Would love a more consistent experience and a little more love for those who rely on it daily. Too bad Insteon doesn't ever read these reviews and use them as bug fix requests. Seems like they could benefit by trying to release a version that gets decent reviews at least once during its lifecycle. Also, it would be nice if the sunrise/sunset schedulesworked like they were supposed to.";"2018-10-03T22:10:30-07:00";"https://itunes.apple.com/us/review?id=564887346&type=Purple%20Software";"564887346";79;"en";"POSITIVE"
13;3580139105;"themeparkdad";"https://itunes.apple.com/us/reviews/id39051267";"1.15.4";2;"Abandoned developer support on Apple Watch";"This app has always had rocky support. Apple Watch connectivity last worked on WatchOS 3. Doesn’t work on anything newer. It’s a good product but has been neglected for a long time. If I was starting over creating my automated house, I probably wouldn’t choose these modules and software package again due to low interest by the developer.";"2018-12-27T07:52:43-07:00";"https://itunes.apple.com/us/review?id=564887346&type=Purple%20Software";"564887346";58;"en";"POSITIVE"
14;1951358437;"BatesJF";"https://itunes.apple.com/us/reviews/id227632141";"1.15.3";1;"Take it back to the store";"Terrible product. Apple Watch app works about 10% of the time. iPhone app works much better, but still unreliable and as such, totally unacceptable. Occasionally, the app won’t connect to Insteon account servers, rendering one unable to use the equipment. I should not have to sign in for a light switch to work. Come on. 

I’ve never been so frustrated with a light switch in my life. I never thought a light switch would be something that I could be frustrated with multiple days of the week. Thanks, Insteon?";"2017-11-26T15:43:55-07:00";"https://itunes.apple.com/us/review?id=564887346&type=Purple%20Software";"564887346";89;"en";"NEGATIVE"
15;3435932262;"Trail walker 2020";"https://itunes.apple.com/us/reviews/id245471084";"1.15.4";3;"Unreliable";"Great concept however continues to suffer from shortcomings in the app.  The app doesn’t save your login information and credentials.  For non tech savvy users and users who only bought a few modules will eventually tire of the lack of UI improvements and poor quality application. 

Looking for a better, more secure and reliable system to replace my insteon system with in the near future.  

Insteon user since 2015";"2018-11-19T05:27:25-07:00";"https://itunes.apple.com/us/review?id=564887346&type=Purple%20Software";"564887346";69;"en";"POSITIVE"
16;2263270195;"Cali Fornia";"https://itunes.apple.com/us/reviews/id42487574";"1.15.4";1;"The worst app I have on my phone";"Difficult to connect to the internet.  The app is extremely slow, I hate that I have to wait up-to 1.5 minutes for my devices to become active and manageable.  

I’m on my second hub, the first one died at 11 months.  I got a free replacement, but I’m having second thoughts about setting it back up, since I’m trying to eliminate hubs around my house, specially that ones that don’t cooperate and make my life more difficult.  I tried for at least 30 minutes to connect it and I gave up.";"2018-03-02T08:20:40-07:00";"https://itunes.apple.com/us/review?id=564887346&type=Purple%20Software";"564887346";91;"en";"NEGATIVE"
17;3642943686;"Insomniac62";"https://itunes.apple.com/us/reviews/id6947965";"1.15.4";5;"First day using";"So far, so good! All devices added and are controlled perfectly, time will tell! Wish there was an option to select based on time when to receive notifications instead of just on or off.";"2019-01-12T14:11:36-07:00";"https://itunes.apple.com/us/review?id=564887346&type=Purple%20Software";"564887346";34;"en";"POSITIVE"
18;3671879438;"what1234567890";"https://itunes.apple.com/us/reviews/id3711241";"1.15.4";1;"Bugs and slow";"Takes forever to load. Every time I want to turn on or off a lamp I have to wait 10-20 seconds to load. Sometimes longer other times it never loads and make me login in again. When I go edit a schedule I have to do it two, three or four times before it actually gets saved. Really. Find a software developer that has an ounce of integrity and actually takes pride in what they develop. And use beta testing. This is not rocket science!!!!";"2019-01-19T20:03:44-07:00";"https://itunes.apple.com/us/review?id=564887346&type=Purple%20Software";"564887346";85;"en";"POSITIVE"
19;4018199982;"TheFegman";"https://itunes.apple.com/us/reviews/id122080518";"1.15.4";1;"Hub died after 2 years";"Never buy a hub that has a proprietary network. Only buy devices and hubs with open-source protocols i.e. Zwave or Zigby.  Insteon hubs die after 2 years just past their warranty.  To replace it you need to abandon your account and start your configuration all over from scratch. There are thousands of devices that operate using Zwave and or Zigby protocol and universal hubs i.e. Wink.  My hub died So I will bite the bullet and reprogram a new hub but as the devices die I will replace them with ones that will work with my Wink.";"2019-04-15T19:45:06-07:00";"https://itunes.apple.com/us/review?id=564887346&type=Purple%20Software";"564887346";97;"en";"NEGATIVE"
20;6031661248;"Bryan is my guy";"https://itunes.apple.com/us/reviews/id36796997";"1.15.4";5;"Works great";"I’ve had Insteon for over three now , set up was a breeze. I have two homes on it with thermostat and cameras . the only thing I can’t figure out is how to record on the camera";"2020-06-03T15:22:44-07:00";"https://itunes.apple.com/us/review?id=564887346&type=Purple%20Software";"564887346";38;"en";"NEUTRAL"
21;3773763293;"OMRON disapointed APP user";"https://itunes.apple.com/us/reviews/id402579056";"1.15.4";3;"20 Amp remote switches";"This App is “okay”, 

I would like to see;

Time interval selections for the App. I’d like to be able to have particular switches (devices) on for a particular length of time, and not for just a calendar selection on-off (which also is not available, BTW). 

Instant on-off changes on the switches when a “Favorite” is turned on should show up on the App   As of now I have to go to the drop down menu and select “devices” to know if a particular switch is on or off.  When a device is included in favorites, its status should show under “favorites” immediately upon any change.";"2019-02-15T12:18:08-07:00";"https://itunes.apple.com/us/review?id=564887346&type=Purple%20Software";"564887346";106;"en";"POSITIVE"
22;1971518033;"Maui Kid";"https://itunes.apple.com/us/reviews/id43835701";"1.15.4";5;"Works perfectly!";"Not sure why the low reviews other than there are not many and they are possibly older.

I love this app and the Insteon products. They have always worked well.

I did have to call support for help with a camera, but all went well. The tech person was very kind and very helpful. He answered all my questions and explained the settings. I didn't feel rushed and when done everything worked. 

This is such a great and reliable system that is very affordable.";"2017-12-04T20:39:38-07:00";"https://itunes.apple.com/us/review?id=564887346&type=Purple%20Software";"564887346";84;"en";"POSITIVE"
23;4656362588;"cooper1961";"https://itunes.apple.com/us/reviews/id220380400";"1.15.4";1;"Don’t waste your money";"I have had Insteon devices for years , the app will not connect on iPhones , I have hub and purchased another hub , still won’t work properly! I have wasted over 2000 on cameras , bulbs , motion sensors and program is terrible ! I have to pay monthly for OWLR service , they no problem and getting service is horrible , said last week was going to be update and still waiting ! Haven’t had update in two years !";"2019-08-22T13:34:58-07:00";"https://itunes.apple.com/us/review?id=564887346&type=Purple%20Software";"564887346";82;"en";"NEGATIVE"
24;6796476310;"TechInTx";"https://itunes.apple.com/us/reviews/id289848750";"1.15.4";1;"Wrong choice for home automation";"They cannot fix something as basic as scheduling?  Also, app stability is clearly an issue as I am unable to reach my hub today from within my own house.  If cannot control devices on demand or via a reliable schedule, I have clearly made the wrong choice by going with Insteon.  Also, deleting scenes and devices prior to factory resets is garbage and the app just loops and loops.";"2020-12-26T10:36:58-07:00";"https://itunes.apple.com/us/review?id=564887346&type=Purple%20Software";"564887346";69;"en";"POSITIVE"
25;6775102982;"crsssss";"https://itunes.apple.com/us/reviews/id370277961";"1.15.4";1;"Worst hardware and software";"If your considering this system, look elsewhere or don't bother even reading these reviews.     Had my hub fail and it's impossible to get the replacement hub installed.   I even worked with support and still no working system.   Time now to donate this system to the local dump and go by a more reliable system that works.    It must be made in China and supported by Californian's....... oh yeah.....it is.";"2020-12-20T10:46:12-07:00";"https://itunes.apple.com/us/review?id=564887346&type=Purple%20Software";"564887346";69;"en";"NEGATIVE"
26;6441653558;"babadaboopee8867";"https://itunes.apple.com/us/reviews/id155656596";"1.15.4";5;"Just works!";"Works well most of the time for all devices and cameras.  A little slow and clunky at times but overall solid.";"2020-09-18T05:55:09-07:00";"https://itunes.apple.com/us/review?id=564887346&type=Purple%20Software";"564887346";21;"en";"POSITIVE"
27;5390945928;"Dr. Format";"https://itunes.apple.com/us/reviews/id37723802";"1.15.4";5;"Baffled by bad reviews";"The Insteon switches and devices have always worked great for me, and have been using them since 2007. 
This app is fine for what it does; the ISY hub truly expands the programming capabilities of Insteon devices.";"2020-01-11T11:12:30-07:00";"https://itunes.apple.com/us/review?id=564887346&type=Purple%20Software";"564887346";37;"en";"POSITIVE"
28;5277054866;"TxBay";"https://itunes.apple.com/us/reviews/id9849331";"1.15.4";2;"Scheduling";"Wish the app could schedule something like Sunrise + 1 hr or sunset - 1 hr 
Overall good products
I will also like this App to allow to reschedule recurring events / scenes . Example : Turn on / off switch every hour starting from a time until a time 
There are newer smart switches and their apps allow advanced scheduling .";"2019-12-15T12:38:55-07:00";"https://itunes.apple.com/us/review?id=564887346&type=Purple%20Software";"564887346";62;"en";"POSITIVE"
29;3371287186;"QSick";"https://itunes.apple.com/us/reviews/id30890342";"1.15.4";3;"Not compatible with Apple Watch Series 4";"I was spoiled by being able to control my home from my Apple Watch. Now that I updated to the Apple Watch Series 4, the Insteon for Hub app no longer even loads in the Apple Watch app or in the Watch. Please update for compatibility and take advantage of the larger watch face. Otherwise I’m happy.";"2018-11-02T00:34:08-07:00";"https://itunes.apple.com/us/review?id=564887346&type=Purple%20Software";"564887346";57;"en";"POSITIVE"
30;3525703561;"Tiger150123";"https://itunes.apple.com/us/reviews/id13875626";"1.15.4";2;"Slow and buggy";"Unfortunately I can get up off the couch and turn off the light, fan or any other device before Insteon can do it. The app is slow to open. It is a shame with a good product they cannot compliment it with a good, fast app. The last update was 12 months ago. Get cranking SmartLabs!";"2018-12-13T03:06:59-07:00";"https://itunes.apple.com/us/review?id=564887346&type=Purple%20Software";"564887346";56;"en";"POSITIVE"
31;2402867703;"BT1993";"https://itunes.apple.com/us/reviews/id42626136";"1.15.4";3;"Overhaul";"This app seriously needs an overhaul.  It needs to be updated with a more modern UI with updated Icons for the labels.  It also needs to be updated for the iPhone X screen at the very minimum.  I spent a lot of $ on Insteon gear to make my home “smart” and the hardware IS top notch.  Can we please get an app that matches the quality of the hardware?";"2018-04-09T10:32:04-07:00";"https://itunes.apple.com/us/review?id=564887346&type=Purple%20Software";"564887346";70;"en";"POSITIVE"
32;5462957613;"Camaleon-69";"https://itunes.apple.com/us/reviews/id197379276";"1.15.4";4;"Log";"Hello, please add to the app a place of registration where you can see all the events that were made with time and date.  This is very necessary to see if there were some scheduled activities ... thanks.";"2020-01-29T08:55:54-07:00";"https://itunes.apple.com/us/review?id=564887346&type=Purple%20Software";"564887346";38;"en";"POSITIVE"
33;2357265470;"KrisOlsch";"https://itunes.apple.com/us/reviews/id131280727";"1.15.4";1;"What a crap it becomes";"Nobody is cable to fix issue with outside hard wired receptacle , it worked fine for years then came update and never could be fixed again , one side of the House works the other dosen’t ! Even got talked into range extender and new receptacle and still no change ! So tired of this product , app is out dated programming is complicated and just not worth it 
Stay away from it";"2018-03-28T16:37:34-07:00";"https://itunes.apple.com/us/review?id=564887346&type=Purple%20Software";"564887346";73;"en";"NEGATIVE"
