"";"id";"userName";"userUrl";"version";"score";"title";"text";"updated";"url";"app";"wordCount";"language";"sentiment"
160;1229004570;"Chiphead";"https://itunes.apple.com/us/reviews/id31961493";"1.10.0";4;"Still logging out";"I actually had a decent run with the older version not logging me out and was able to control devices on my Apple watch. My wife had issues but now that we have both upgraded to this version it logs is out consistently rendering both the app and the watch app useless. Hope to see a fix soon. 
On the bright side there were other welcomed improvements just nothing good for the watch.";"2015-07-17T20:04:48-07:00";"https://itunes.apple.com/us/review?id=564887346&type=Purple%20Software";"564887346";73;"en";"POSITIVE"
161;958578397;"Eric Summers";"https://itunes.apple.com/us/reviews/id38076902";"1.7.0";5;"Great system";"Great device/app!  Besides controlling your Insteon devices, this app will also program them.  If you have a lot of Insteon devices, the Hub is indispensable to set everything up.  You need to make sure you do a factory reset on them first so that Hub knows all of the program settings.  The app will not change anything set outside the app.  

It is cool to see Nest support.  I hope they also add Ecobee wifi thermostat support.";"2014-03-12T19:58:47-07:00";"https://itunes.apple.com/us/review?id=564887346&type=Purple%20Software";"564887346";77;"en";"POSITIVE"
162;929268266;"CoreTech IT";"https://itunes.apple.com/us/reviews/id29713761";"1.6.0";2;"Fails to connect after performing update!";"After installing the update, App fails to authenticate and connect. I've been on the phone with support for hours over hours and still unable to get it to work. I'm able to go on the web and log into my account using their beta app, but no devices are there. It would be nice if you're able to use the beta app on the web to create and control your devices. Nice app if it worked. Needs another update.";"2014-01-22T06:36:15-07:00";"https://itunes.apple.com/us/review?id=564887346&type=Purple%20Software";"564887346";79;"en";"POSITIVE"
163;1322432150;"Artsez";"https://itunes.apple.com/us/reviews/id27943341";"1.11.0";1;"Apple Watch fix";"How about fixing the Apple Watch software to allow users to actually use their watches to control devices rather than having to log into your phone to do so. What is the point of launching the app on your watch, then having to find your phone, which you left somewhere in your house, just to control your devices. At that point, I'll just use the phone since I went thru all the trouble of finding it. Incredibly stupid guys, don't even bother marketing your Apple Watch version, it's useless. Thanks for the other pointless upgrade, control your Sonos speakers, I really needed that.";"2016-01-25T18:21:28-07:00";"https://itunes.apple.com/us/review?id=564887346&type=Purple%20Software";"564887346";103;"en";"NEGATIVE"
164;1233588345;"clinlx";"https://itunes.apple.com/us/reviews/id108405589";"1.10.0";1;"Problems saving login info, watch app is useless";"This version of the app does not save login credential or session token on the phone, every time you open the app you will have to login again.  Since the Apple Watch App requires the main app to be logged in to work, this essentially render the watch app useless.  It's very easy to persist the login token, and it doesn't seem like SmartHome has tested their app before releasing.  It will take any experienced developer just a couple hours to fix.  The company probably outsourced their app and don't know what they are doing.  I guess my next smart home setup won't be insteon anymore.";"2015-07-26T14:46:15-07:00";"https://itunes.apple.com/us/review?id=564887346&type=Purple%20Software";"564887346";106;"en";"NEGATIVE"
165;1008716809;"Wizzzilk";"https://itunes.apple.com/us/reviews/id331678512";"1.7.5";3;"Decent...";"Biggest complaint is that it definitely needs to rotate for the iPad. Seriously, this is a huge drawback of the app. Also really wish it was possible to adjust the sensitivity of the Insteon camera motion detection from within the app rather than logging into the camera's web interface. The UI isn't the best or the most intuitive, but the app is very quick and responsive and adding / editing devices is a breeze. Also very cool how it links directly to the manuals for all the devices.";"2014-06-11T19:20:02-07:00";"https://itunes.apple.com/us/review?id=564887346&type=Purple%20Software";"564887346";88;"en";"POSITIVE"
166;934985637;"Sdbirddog";"https://itunes.apple.com/us/reviews/id12958002";"1.6.7";4;"Awesome";"I really like this app. Although two way audio does not work on the IP cam which is why I bought the cam is still a great product. I do wish that you could fit more icons for your devices on the front page of the app therefore not have an escrow through second page after page to get to your other items to control. If those two things were different I would've given it five stars.";"2014-02-01T11:02:21-07:00";"https://itunes.apple.com/us/review?id=564887346&type=Purple%20Software";"564887346";77;"en";"POSITIVE"
167;1501369018;"JakeT2";"https://itunes.apple.com/us/reviews/id38782000";"1.14.0";4;"Needs more color.";"I like the app and the devices, but it could use more color than just blue and white. How about giving us some color icons for the devices? The little dot indicating when the device is on is confusing, since it's darker when on than when it's off. How about using a vertical bar to show brightness levels on dimmer switches? Use white or bright green, instead of dull blue. Use black color for off.";"2016-12-13T16:00:42-07:00";"https://itunes.apple.com/us/review?id=564887346&type=Purple%20Software";"564887346";75;"en";"POSITIVE"
168;1523850618;"Agentriegel";"https://itunes.apple.com/us/reviews/id12756110";"1.14.1";1;"More bugs. They never fix this app";"Two versions ago I could connect over cellular. Now I need to be on my local wifi for anything to work.

***Figured out if you're using a static IP set it to DHCP then set it back to static IP. That'll update your external IP address which you can't update manually. Never had this issue before***

It's clear they either don't care or don't have the resources to fix this or the several other major bugs they've been ignoring. I won't be buying any more Insteon devices and I'll migrate onto a more supported product like SmartThings moving forward.";"2017-01-16T19:32:34-07:00";"https://itunes.apple.com/us/review?id=564887346&type=Purple%20Software";"564887346";99;"en";"POSITIVE"
169;946023510;"apple1822";"https://itunes.apple.com/us/reviews/id86119840";"1.6.7";3;"Support could be better";"After calling support 4 times, spending hours to explain the bug that they have between this iOS app, insteon hub and the Morninglinc. They finally listened to me and went to test the combination and admitted that the iOS app has a bug that preventing unlocking the MI lock properly(double tap the ""off"" button will make the lock to be opened and lock back again within few seconds). Hope the new version will come soon.";"2014-02-18T12:14:52-07:00";"https://itunes.apple.com/us/review?id=564887346&type=Purple%20Software";"564887346";75;"en";"POSITIVE"
170;1516130530;"XxRakkMac101xX";"https://itunes.apple.com/us/reviews/id37293069";"1.14.1";4;"Super simple and works!!!";"I was able to install the app and get my first device working super quick. I was skeptical of this at first so I only bought the starter kit. I look forward to slowly upgrading.  The only reason I didn't give the 5 stars is because of the slightly annoying extra steps to coordinate it. It was not very difficult but it could be daunting to non-tech savvy people.";"2017-01-05T18:24:47-07:00";"https://itunes.apple.com/us/review?id=564887346&type=Purple%20Software";"564887346";69;"en";"POSITIVE"
171;1545856310;"Octygon1";"https://itunes.apple.com/us/reviews/id279005112";"1.15.1";3;"Great starter app, but...";"Really nice app for someone who's getting into the home automation kit. Also has plenty of custom features and schedules. Keep updating!

One thing that bugs me is the app randomly takes a long time to refresh device status, i.e., when I get home to use garage door opener or turn on a light. I often find myself waiting in front of the garage door for 20-30 seconds before device list refreshes and I can open door.";"2017-02-16T11:15:56-07:00";"https://itunes.apple.com/us/review?id=564887346&type=Purple%20Software";"564887346";77;"en";"POSITIVE"
172;1503721074;"Wasted spacer";"https://itunes.apple.com/us/reviews/id180376675";"1.14.1";1;"Terrible app - Needs a total rewrite!";"Convoluted, confusing, appalling app. Appears to be more like a random collection of bolted together utilities than a cohesive device control environment. Setting up and managing device schedules is possibly the most convoluted. For example you cannot appear to merge device schedules into a scene or even figure out how to delete an unwanted schedule! Even simple fader control to totally ""off"" seems beyond either this app and/or the device - there is still residual current flowing when scheduled unless the device is explicitly told to be ""off""!";"2016-12-17T11:26:52-07:00";"https://itunes.apple.com/us/review?id=564887346&type=Purple%20Software";"564887346";88;"en";"NEGATIVE"
173;725976743;"Avenna";"https://itunes.apple.com/us/reviews/id299181228";"1.1.0";5;"Easy to use and very cool technology";"I was given this as a gift and everything has been easy to install and use.  I feel a lot safer and in control of my surroundings even when I'm not home now.  The app is really easy and I have not had any issues with it.  Now that I have it I cannot believe I didn't know about it sooner.";"2013-01-09T07:58:03-07:00";"https://itunes.apple.com/us/review?id=564887346&type=Purple%20Software";"564887346";61;"en";"POSITIVE"
174;1110669850;"Jpass1";"https://itunes.apple.com/us/reviews/id126931996";"1.9.6";5;"Great app";"This is a great app that just keeps getting better. I first installed Insteon devices in my home a couple years ago and have continued to add devices several times a year. They keep, updating the app and have made awesome improvements each time. Their investment in the app gives me the confidence to keep buying more Insteon products.";"2014-12-09T15:41:22-07:00";"https://itunes.apple.com/us/review?id=564887346&type=Purple%20Software";"564887346";59;"en";"POSITIVE"
175;969838931;"Hank R. H.";"https://itunes.apple.com/us/reviews/id101232282";"1.7.1";1;"Useless!";"I have been an iPhone user since 2007 and have used countless apps! This is the first time I've ever felt compelled to write a review. This app hands down is the most useless app in the AppStore... Even more useless than the pocket therapist app... At least that one brought me some laughs! 

I have tried for the last 2 weeks to either A. Turn a light on... Or B. Turn one off with this app... It's hasn't worked.. Most of the time it takes 4-6 attempts to connect to the hub. After connecting to the hub(if it ever does) it cannot operate anything. 

This app did work at one point, but has been completely screwed up.

Let me close this by saying... I love Insteon products and I would recommend them to anyone  I know, with the exception of this app. It's an embarrassment to Insteon... Not to mention the money I wasted on the hub! 

Anyhow, I hope Insteon is able to fix this app!";"2014-04-01T21:20:33-07:00";"https://itunes.apple.com/us/review?id=564887346&type=Purple%20Software";"564887346";168;"en";"NEGATIVE"
176;1110620014;"Dkkwi";"https://itunes.apple.com/us/reviews/id326529546";"1.9.7";5;"Insteon product";"Fantastic product! Installed extremely easy. Didn't have to read the instructions as the hub just took over and installed everything. Had a simple question for customer support and they called me back with the info! Extremely happy with the purchase.";"2014-12-09T13:17:11-07:00";"https://itunes.apple.com/us/review?id=564887346&type=Purple%20Software";"564887346";40;"en";"POSITIVE"
177;1080463144;"Schm9952";"https://itunes.apple.com/us/reviews/id16652635";"1.9.1";3;"Decent system";"I've had an X10 system for over 30 years. Slowly I've been upgrading to Insteon. This a significant improvement over the old X10 but the price tag for switches and interfaces are higher. The Insteon Hub however is a huge convenience. Being able to check in from anywhere is great. The app does occasionally hang. I've had to delete and reinstall it a few times but over all it performs well.";"2014-10-14T15:15:20-07:00";"https://itunes.apple.com/us/review?id=564887346&type=Purple%20Software";"564887346";71;"en";"POSITIVE"
178;1067775716;"LiftGuy4life";"https://itunes.apple.com/us/reviews/id277604089";"1.8.0";4;"iOS 8 update please";"Still like the app just need an update, after updating my apple products to iOS 8 there seems to be at least a couple of issues. One being not able to change the name of a device, when trying to change the name the app crashes. Good stable app, not flashy and complicated, just basic and easy to use.";"2014-09-20T22:24:02-07:00";"https://itunes.apple.com/us/review?id=564887346&type=Purple%20Software";"564887346";59;"en";"POSITIVE"
179;1558225317;"WantStuff2Work";"https://itunes.apple.com/us/reviews/id40582016";"1.15.1";3;"Starting to slow";"This is great app for what it does but it's really starting to slow to the point of being almost unusable as a handheld controller. It can take 45sec+ to figure out the status of the various modules and display them. And if you move to another page of control a device, it starts polling all over again. Hopefully they can figure out how to speed this polling up a little";"2017-03-05T11:20:45-07:00";"https://itunes.apple.com/us/review?id=564887346&type=Purple%20Software";"564887346";71;"en";"POSITIVE"
180;1189006386;"Rijoro";"https://itunes.apple.com/us/reviews/id12118882";"1.9.29";2;"Apple Watch portion";"The Apple Watch app looks great and I love the design but there is still a long way to go. I originally had posted that the watch app did not work but discovered that you have to launch or have recently launched the Insteon app from your phone. There is no feedback as to if a light is on or off or otherwise and I still can't get the camera to display through the watch. I think it is a good beta version but has a way to go still.";"2015-04-27T15:50:47-07:00";"https://itunes.apple.com/us/review?id=564887346&type=Purple%20Software";"564887346";90;"en";"POSITIVE"
181;870923813;"Spandalicious";"https://itunes.apple.com/us/reviews/id31226451";"1.4.0";1;"Terrible Design";"Really poorly designed App. You can only have one scene mapped to the same starting time, like Sunset. Why can't two different scenes start at the same time, and end at different times? App makes it impossible to remove a start or end time, or just delete a schedule for a device. All you can do is change the time. INSTEON, please hire someone to do this and test it properly before selling the HUB which can only be accessed using this dumb App. The previous web app for Smartlinc was better than this, and that is not saying much.";"2013-09-15T18:25:42-07:00";"https://itunes.apple.com/us/review?id=564887346&type=Purple%20Software";"564887346";100;"en";"POSITIVE"
182;1481691686;"Shortsman Spiff";"https://itunes.apple.com/us/reviews/id14914898";"1.13.2";2;"Still not as good as X-10";"In theory, Insteon should leave X-10 in the dust. In practice, Insteon is more difficult to set up, less customizable, the Hub rarely operates in the same time zone that I live in, this app is painful to use, and to top it off, every time the app updates, it deletes my email and password, making my iPhone useless to run Insteon until I go look up and reenter all my data. Style does NOT beat substance. I'm really missing the usefulness and customizability of X-10.";"2016-11-09T17:23:20-07:00";"https://itunes.apple.com/us/review?id=564887346&type=Purple%20Software";"564887346";86;"en";"NEGATIVE"
183;1276334148;"daveslc";"https://itunes.apple.com/us/reviews/id29525005";"1.11.0";2;"Great app (for sending them data)";"I tried the insteon hub and app, setup was easy and I liked the camera interface but their hub uses an external web service which means all of your home automation data is being sent through their servers. I have since trashed their device since their is no good reason that they should be privy to this data. Home automation devices should not rely on outside web services, period.";"2015-10-24T04:55:31-07:00";"https://itunes.apple.com/us/review?id=564887346&type=Purple%20Software";"564887346";69;"en";"NEGATIVE"
184;733738042;"AuVidGuy";"https://itunes.apple.com/us/reviews/id25794631";"1.1.0";4;"Install was easy";"I already had a bunch of Insteon devices installed.  
I got a Hub and then started adding devices through the app.  
It was easy to add the devices, just follow the steps in the app.
Once I had a number of devices in the app, it was really easy to create scenes.
I just had to click on the devices I wanted in the scene and the app pretty much did the rest.";"2013-01-21T07:32:58-07:00";"https://itunes.apple.com/us/review?id=564887346&type=Purple%20Software";"564887346";73;"en";"POSITIVE"
185;1284518862;"Snarky707";"https://itunes.apple.com/us/reviews/id208076578";"1.11.0";3;"Disappointed";"Before I bought the hub I used a 3rd party app and was able to use the 2 way audio and zoom. I got the hub with excitement because the insteon app is supposed to be better. HUGE DISAPPOINTMENT!!! No zoom and no 2 way audio. Only benefit is I can see whats going on using cellular instead of wifi. I need lots more items but may choose another brand if this cant be fixed soon.";"2015-11-09T20:51:34-07:00";"https://itunes.apple.com/us/review?id=564887346&type=Purple%20Software";"564887346";76;"en";"POSITIVE"
186;918281975;"suchtrouble";"https://itunes.apple.com/us/reviews/id113846079";"1.6.0";3;"works well with all insteon hardware";"My only complaint is that SmartHome decided to change the thermostat access module.  It is very difficult to use with the slider.  It would be much better if they went back to the old thermostat where one could hit up or down arrows to change the temperature.  I would have given this app a '4 Star' if it hadn't been for the thermostat. Please fix the thermostat.";"2014-01-01T08:05:48-07:00";"https://itunes.apple.com/us/review?id=564887346&type=Purple%20Software";"564887346";67;"en";"POSITIVE"
187;1173090055;"javiMac";"https://itunes.apple.com/us/reviews/id41976946";"1.9.22";5;"Excellent...And getting better and better!";"I think INSTEON is the best company when we talk about home automation. 
If you are new in this and you're trying to find the right supplier,think in INSTEON,thry have the hardware,software and attention.

Now,when you are going to release the new version for the new HUB?";"2015-03-25T06:01:42-07:00";"https://itunes.apple.com/us/review?id=564887346&type=Purple%20Software";"564887346";47;"en";"POSITIVE"
188;1265342940;"Libra42";"https://itunes.apple.com/us/reviews/id33087377";"1.10.1";4;"Good start!";"The app, and the hub/cloud, is a very start for home automation.   

I would really like to see some form of offline management.   If your home internet service is out, you can't control any of your devices.  Even if you are in the same room, the app is hard coded to communicate with your devices via the Internet.";"2015-10-01T05:37:53-07:00";"https://itunes.apple.com/us/review?id=564887346&type=Purple%20Software";"564887346";58;"en";"POSITIVE"
189;788642064;"MCB1230125";"https://itunes.apple.com/us/reviews/id177947530";"1.3.0";4;"Better";"This new version of the app is a big improvement over previous releases. 
I was hoping for more some functionality after waiting almost 2 months for an update, but this version seems faster and my camera loads a lot quicker.  Haven't seen any crashes yet.";"2013-04-15T12:15:01-07:00";"https://itunes.apple.com/us/review?id=564887346&type=Purple%20Software";"564887346";45;"en";"POSITIVE"
190;1137753623;"Hgfffffgfsdvjkjh";"https://itunes.apple.com/us/reviews/id3063391";"1.9.13";1;"Poorly designed";"I don't understand all the positive reviews. This gives you the ability to control, but the interface is ridiculously poor. Very not intuitive, very hard to find many varied settings. Doing something as simple as setting a schedule to disable the controller is amazingly difficult. For a first release app from a developer that doesn't know anything about iOS, this isn't very bad. But for an app that several years old? This is stunningly badly designed.";"2015-01-28T16:13:26-07:00";"https://itunes.apple.com/us/review?id=564887346&type=Purple%20Software";"564887346";76;"en";"NEGATIVE"
191;1538152960;"Ipsprod";"https://itunes.apple.com/us/reviews/id27961038";"1.15.0";1;"PLEASE FIX THIS APP!!!!!!!!!!!";"This is incredibly frustrating that this new update has made the entire app useless. I cannot turn anything on from it anymore, none of my timers will work and now I can't even simply turn lights on from the Insteon light switches without doing a hard reset... seriously I can't even turn on a light anymore. I spent several hundreds of dollars on this and its installation and now it doesn't even work. PLEASE FIX THIS!!!!! Or at least offer a chance to load the old app";"2017-02-05T18:08:13-07:00";"https://itunes.apple.com/us/review?id=564887346&type=Purple%20Software";"564887346";87;"en";"NEGATIVE"
192;1228842341;"Three Locations";"https://itunes.apple.com/us/reviews/id187275448";"1.10.0";3;"Logging in issues";"I have insteon systems in three locations. When I launch the app it doesn't show which of my 3 locations I am logging into. I cannot determine the location I am loging into until I connect to the hub. Why not add the ability before logging in to choose a location. If a hub cannot be accessed then you cannot log onto other locations.";"2015-07-17T12:54:38-07:00";"https://itunes.apple.com/us/review?id=564887346&type=Purple%20Software";"564887346";64;"en";"NEGATIVE"
193;1535745636;"iHateMSFT";"https://itunes.apple.com/us/reviews/id111593670";"1.14.1";2;"Removing more functionality...";"I want this to work independently from the internet, you know, off the grid. Each version of the hub and app seems to remove functionality I once enjoyed. This version removes adding a device by id. Sometimes I just want to write the ids down, install the switches and add them later instead of running around the house. Now I can't. Stop removing features or releasing buggy software.";"2017-02-02T12:11:43-07:00";"https://itunes.apple.com/us/review?id=564887346&type=Purple%20Software";"564887346";68;"en";"POSITIVE"
194;1228653300;"JeffWhalen";"https://itunes.apple.com/us/reviews/id40044147";"1.10.0";1;"Broken Apple watch app";"Don't update! This version still logs you out of your iPhone when using the apple watch app and the iPhone app isn't open. Unlike the older version you could use the back button and log back in. This version clears your credentials all together! 

The apple watch app would be such a great app if it would work right! It's been broken since they released it, and I keep waiting on a fix for it. Still waiting after this version too!";"2015-07-17T05:02:26-07:00";"https://itunes.apple.com/us/review?id=564887346&type=Purple%20Software";"564887346";81;"en";"POSITIVE"
195;906393867;"Sumguyinfl18";"https://itunes.apple.com/us/reviews/id101874714";"1.6.0";5;"Works perfect";"Love the updates. Keep them coming! Everything works as stated. I have 6 scenes set up and 14 devices at home. All work like they should. Not one complaint. Works well on both iPhone and IPad. Not sure why others are having such issues.";"2013-12-08T17:52:18-07:00";"https://itunes.apple.com/us/review?id=564887346&type=Purple%20Software";"564887346";44;"en";"POSITIVE"
196;1022101611;"wwwxxxx";"https://itunes.apple.com/us/reviews/id27337712";"1.8.0";3;"Works, but lacks features";"The app works well and is reliable.  However it lacks very basic features like allowing offsets (ex. turn lights on 30 minutes before sunset or vary turn off time slightly for security). These are very basic things - X10 did this 20 years ago!  While I love the Insteon technology for its reliability, the software needs work to be more than flashy ""scenes"".";"2014-07-04T07:10:02-07:00";"https://itunes.apple.com/us/review?id=564887346&type=Purple%20Software";"564887346";63;"en";"POSITIVE"
197;1560975788;"hafeezfamily";"https://itunes.apple.com/us/reviews/id19079576";"1.15.1";3;"Fixed last issue.";"I removed my last 1 star because they fixed the issue but more importantly they owned up to the issue and said sorry (stuff breaks, got it, but you need to own it).

They app is getting better. Still too slow.

The Insteon system however is still the best of you want end to end home automation.";"2017-03-09T15:50:26-07:00";"https://itunes.apple.com/us/review?id=564887346&type=Purple%20Software";"564887346";57;"en";"POSITIVE"
198;1381101347;"BD35";"https://itunes.apple.com/us/reviews/id34250640";"1.13.0";1;"Doesn't work most of the time";"It takes several minutes to recognize even a few Insteon devices and then, after it recognizes them, only works a small fraction of the time.  When you find that you can save considerable time by walking over to the light switch and turning it on manually, the old-fashioned way, you know that the remote control app you're using is bad.  

This app is a waste if time, and the hub it required a waste of money.";"2016-05-19T13:38:19-07:00";"https://itunes.apple.com/us/review?id=564887346&type=Purple%20Software";"564887346";76;"en";"NEGATIVE"
