"";"id";"userName";"userUrl";"version";"score";"title";"text";"updated";"url";"app";"wordCount";"language";"sentiment"
300;1071286149;"Boater400";"https://itunes.apple.com/us/reviews/id165444802";"1.8.0";2;"App crashing when trying to rename a device.";"Worked fine until IOS8.  Not going to buy more sensors until they fix this.  Cannot identify the sensor that detected motion.
Also should allow landscape mode.";"2014-09-27T12:46:39-07:00";"https://itunes.apple.com/us/review?id=564887346&type=Purple%20Software";"564887346";26;"en";"POSITIVE"
301;1109661769;"Ow8888";"https://itunes.apple.com/us/reviews/id31378966";"1.9.6";1;"One star";"This is really a terrible app. The GUI isn't especially user friendly. Also when the Hub has any kind of problem at all, the app will not load as it needs to be connected to the Hub just to sign in. When it feels like working the Hub itself really is useful but app needs a lot of work,";"2014-12-07T18:15:41-07:00";"https://itunes.apple.com/us/review?id=564887346&type=Purple%20Software";"564887346";59;"en";"NEGATIVE"
302;1368358304;"Jon_8ball";"https://itunes.apple.com/us/reviews/id4221102";"1.13.0";1;"Huge issue!!";"I had a break in and had one huge issue please allow me to record manually from my iPhone to my videos there's no way to show the police who it was besides a description that I had seen of the guy and trying to push screenshot at the right moments. Thx";"2016-04-24T17:31:54-07:00";"https://itunes.apple.com/us/review?id=564887346&type=Purple%20Software";"564887346";52;"en";"POSITIVE"
303;1257056082;"194262male";"https://itunes.apple.com/us/reviews/id197813806";"1.10.0";3;"Unable to contact Hub";"No improvement since last update.  Still not able to connect to Hub outside my local network.";"2015-09-13T09:42:01-07:00";"https://itunes.apple.com/us/review?id=564887346&type=Purple%20Software";"564887346";16;"en";"NEGATIVE"
304;1114114187;"mnjmoore1";"https://itunes.apple.com/us/reviews/id42928458";"1.9.7";5;"Good product and app";"I use the products to create scenes and it works great. I use the app to control the products and my Nest Thermostat.";"2014-12-16T02:19:37-07:00";"https://itunes.apple.com/us/review?id=564887346&type=Purple%20Software";"564887346";23;"en";"POSITIVE"
305;1099591450;"howbacha";"https://itunes.apple.com/us/reviews/id26388077";"1.9.4";1;"Unneeded login";"Absolutely ridiculous to have to login to an Insteon account  to use this app. Why do I need to login to Insteon account to control my own devices in my own house? I love Insteon products but until I can access them without logging in I will not purchase the new Hub II & this app and I encourage everyone else to do the  same.";"2014-11-19T08:16:04-07:00";"https://itunes.apple.com/us/review?id=564887346&type=Purple%20Software";"564887346";65;"en";"POSITIVE"
306;877218848;"SoBayJake";"https://itunes.apple.com/us/reviews/id27650559";"1.5.0";3;"Now has better KeypadLinc support";"KeypadLincs (KPLs) are supported more with the latest update. Individual buttons can be responders, controllers, or both. However, still no FanLinc control for fan speed, just fan lights.";"2013-09-30T09:42:33-07:00";"https://itunes.apple.com/us/review?id=564887346&type=Purple%20Software";"564887346";28;"en";"POSITIVE"
307;1300529770;"MikeP54";"https://itunes.apple.com/us/reviews/id21634078";"1.11.0";4;"Good App";"The app did what I expected. The setup got a little confusing and I was in the wrong time zone. Took me a while to find why the scedule wasn't working.";"2015-12-14T07:09:23-07:00";"https://itunes.apple.com/us/review?id=564887346&type=Purple%20Software";"564887346";31;"en";"NEGATIVE"
308;1126130171;"d19sand";"https://itunes.apple.com/us/reviews/id23125989";"1.9.13";4;"Easy enough!";"I only use this to control my lights, which it does really well! Once I figured out how to set ""scenes"" the app was intuitive.";"2015-01-07T08:10:52-07:00";"https://itunes.apple.com/us/review?id=564887346&type=Purple%20Software";"564887346";25;"en";"POSITIVE"
309;1022751249;"JkellyIA";"https://itunes.apple.com/us/reviews/id15741482";"1.8.0";1;"Doesn't connect after update";"Updated and now says FAIL when trying to connect to hub. I assumed they would be quick to update, but nothing...... Using an iPhone 5S. I uninstalled and reinstalled but it still doesn't work. Old version still works on my iPad so I will not be updating that.";"2014-07-05T08:17:03-07:00";"https://itunes.apple.com/us/review?id=564887346&type=Purple%20Software";"564887346";48;"en";"NEGATIVE"
310;1355165662;"Jim314159";"https://itunes.apple.com/us/reviews/id110175158";"1.12.2";1;"Needs Work";"The app works okay at home on WiFi but connecting in from anywhere else takes a very long time to connect and half the time doesn't work at all.  When it doesn't work it doesn't give any indication why, it just doesn't do anything.";"2016-03-28T19:21:19-07:00";"https://itunes.apple.com/us/review?id=564887346&type=Purple%20Software";"564887346";44;"en";"POSITIVE"
311;1350479361;"DanaJones-MI";"https://itunes.apple.com/us/reviews/id275208624";"1.12.2";3;"When is geofencing going to be included?";"Love Insteon and building my network quickly.  Disappointed in no geofencing capability without significant 3rd party effort.  This is a basic feature of your top competitors.  Please add!!!";"2016-03-19T19:42:50-07:00";"https://itunes.apple.com/us/review?id=564887346&type=Purple%20Software";"564887346";28;"en";"POSITIVE"
312;1172032209;"Rock Music Lover";"https://itunes.apple.com/us/reviews/id31052209";"1.9.22";5;"LOVE Insteon!";"Our whole house is Insteon! 
No more annoying requests from the wifey to get up and adjust the lights! Money well spent!";"2015-03-22T19:22:31-07:00";"https://itunes.apple.com/us/review?id=564887346&type=Purple%20Software";"564887346";22;"en";"POSITIVE"
313;1111490730;"nadiamusic";"https://itunes.apple.com/us/reviews/id107054710";"1.9.7";5;"Todd";"Thanks for your help and clarity.   You got my insteon up and running after months of frustration.   Thanks.";"2014-12-11T05:55:04-07:00";"https://itunes.apple.com/us/review?id=564887346&type=Purple%20Software";"564887346";18;"en";"POSITIVE"
314;1595175534;"RJGroves";"https://itunes.apple.com/us/reviews/id42300745";"1.15.2";1;"Does not work with ""Insteon Hub for HomeKit""";"I contacted support via email. I was told to use the HomeKit app instead of their Insteon Hub app. I did download their Insteon+ app, (which is not an iPad app) and it works fine. I don't know why they have this hub app if it will not work with the hub designed for HomeKit. Don't waist time on this app if you bought the ""Insteon Hub for HomeKit"".";"2017-04-22T11:56:55-07:00";"https://itunes.apple.com/us/review?id=564887346&type=Purple%20Software";"564887346";69;"en";"POSITIVE"
315;1103470298;"Michael Martin";"https://itunes.apple.com/us/reviews/id32773137";"1.9.6";2;"Voice control";"After investing so much, we feel like we are being slapped in the face with voice control not being offered on the other more popular platforms.";"2014-11-26T05:23:21-07:00";"https://itunes.apple.com/us/review?id=564887346&type=Purple%20Software";"564887346";26;"en";"POSITIVE"
316;903348025;"MoreThanPlanes";"https://itunes.apple.com/us/reviews/id8517648";"1.6.0";5;"Great update";"Finally have proper Fanlinc support and the interface is faster loading.";"2013-12-01T19:25:18-07:00";"https://itunes.apple.com/us/review?id=564887346&type=Purple%20Software";"564887346";11;"en";"POSITIVE"
317;897956378;"gordonross";"https://itunes.apple.com/us/reviews/id36239192";"1.5.1";3;"Confusing";"Very strange and confusing UI. It works, but not without some head scratching. Also, does not use iOS Keychain so it repeatedly asks for login info every launch. Very annoying.";"2013-11-19T19:51:46-07:00";"https://itunes.apple.com/us/review?id=564887346&type=Purple%20Software";"564887346";30;"en";"NEGATIVE"
318;816966603;"TBSP";"https://itunes.apple.com/us/reviews/id16511031";"1.4.0";2;"Not a great app";"the app is not very polished - evern after adding devices via address - it still asks to press the set button.  Adding a scene - app askes to press the set buttons even after the devices have been added.

no way to bulk add devices (i have 75).";"2013-06-07T14:37:20-07:00";"https://itunes.apple.com/us/review?id=564887346&type=Purple%20Software";"564887346";49;"en";"NEGATIVE"
319;1253539780;"Peck68";"https://itunes.apple.com/us/reviews/id314875563";"1.10.0";2;"Do not work on all devices.";"iPhone 6+ and iPad 3rd gen garage door operates ok. However, on 6 it did not work. This is on verizon network while the 6+ is on ATT. This app seems to need a lot of work, it is unlike Apple to take on mediocre apps no matter it free.";"2015-09-05T09:32:46-07:00";"https://itunes.apple.com/us/review?id=564887346&type=Purple%20Software";"564887346";50;"en";"POSITIVE"
320;1289895166;"DannyRokit";"https://itunes.apple.com/us/reviews/id173813773";"1.11.0";5;"Awesom";"This things incredible I don't know why so many low ratings";"2015-11-21T18:33:22-07:00";"https://itunes.apple.com/us/review?id=564887346&type=Purple%20Software";"564887346";11;"en";"NEGATIVE"
321;981769291;"Denildo!!";"https://itunes.apple.com/us/reviews/id114003658";"1.7.5";4;"Navigation bar";"Prefer old version with navigation bar";"2014-04-23T11:10:14-07:00";"https://itunes.apple.com/us/review?id=564887346&type=Purple%20Software";"564887346";6;"en";"NEUTRAL"
322;711696527;"JackrtheRipper";"https://itunes.apple.com/us/reviews/id237966415";"1.1.0";1;"Beta Software, at best";"Software is very primitive. Does not have KeypadLinc as a device type, as far as I can tell. Selecting many features gets you a ""Available Soon"" apology box. I'll keep it until I get to thirty days, and then back it goes if it doesn't improve a whole lot. Too bad.";"2012-12-19T10:07:02-07:00";"https://itunes.apple.com/us/review?id=564887346&type=Purple%20Software";"564887346";51;"en";"NEGATIVE"
323;679318634;"DillonJFontaine";"https://itunes.apple.com/us/reviews/id11967032";"1.0.0";1;"What is ""The Hub""";"The photos of the UI look nice but there seems to be no actual hardware that this app can be used with. Im not sure why you would release an app for something that doesn't yet exist.. I will change my rating once you guys give more details such as where can I get this Hub!!";"2012-10-23T17:52:32-07:00";"https://itunes.apple.com/us/review?id=564887346&type=Purple%20Software";"564887346";56;"en";"NEGATIVE"
324;1494279323;"ScottieD doesn't do reviews.";"https://itunes.apple.com/us/reviews/id156854930";"1.14.0";1;"Worked great until 1.14.0 update";"Been an Insteon customer for 9+ years. I've never had any major problems until this newest update, 1.14.0. Now my lights randomly turn themselves off and refuse to stay on, sort of defeats the whole purpose of the technology.";"2016-12-01T17:12:48-07:00";"https://itunes.apple.com/us/review?id=564887346&type=Purple%20Software";"564887346";39;"en";"NEGATIVE"
325;1237155174;"Ketzelle";"https://itunes.apple.com/us/reviews/id31368438";"1.10.0";2;"Poor user interface";"Confusing and difficult to use. Really disappointed.";"2015-08-02T18:18:59-07:00";"https://itunes.apple.com/us/review?id=564887346&type=Purple%20Software";"564887346";7;"en";"NEGATIVE"
326;1564671982;"Zmtnbik";"https://itunes.apple.com/us/reviews/id253781874";"1.15.1";1;"Useless";"Not sure when the last update occurred, nor should I care, as it just worked.   That was until DST this past Sunday.   Lights never turn off, app never connects to devices.   Once I could dim lights remotely, now I can't even turn them off.";"2017-03-14T21:24:27-07:00";"https://itunes.apple.com/us/review?id=564887346&type=Purple%20Software";"564887346";44;"en";"NEGATIVE"
327;1432444298;"TeddyiMan";"https://itunes.apple.com/us/reviews/id87787203";"1.13.1";1;"Not well thought out";"This app could be much much better. Very slow to respond. It's a mystery why after so long in the marketplace the engineers at insteon could not figure out how to make this app and hub much faster to respond.  Still disappointed.";"2016-08-13T16:51:01-07:00";"https://itunes.apple.com/us/review?id=564887346&type=Purple%20Software";"564887346";42;"en";"NEGATIVE"
328;1076781399;"USAF E.........";"https://itunes.apple.com/us/reviews/id371201452";"1.9.0";1;"No Camera View since latest update.";"Cameras (indoor and Outside) were working fine.  Now theey cannot even connect.  I can still access through the internet app but not through the Iphone APP.  Please fix this ASAP!  All other modules are working.";"2014-10-07T13:25:44-07:00";"https://itunes.apple.com/us/review?id=564887346&type=Purple%20Software";"564887346";35;"en";"POSITIVE"
329;933185716;"Mykytt";"https://itunes.apple.com/us/reviews/id49747601";"1.6.7";5;"Excellent app";"Needs some improvement, but it's a nice and easy to use.";"2014-01-29T11:19:11-07:00";"https://itunes.apple.com/us/review?id=564887346&type=Purple%20Software";"564887346";11;"en";"POSITIVE"
330;1489628593;"Mike’s Mac";"https://itunes.apple.com/us/reviews/id365538650";"1.14.0";1;"Really screwed the pooch on this update";"After update can't get half of my stuff to work, can't connect to hub, have no current time and can't set a time and won't adjust to DST. Schedules now have stopped working. Taking to tech support is like talking to a hole in the ground. TOTALLY WORTHLESS";"2016-11-23T07:09:47-07:00";"https://itunes.apple.com/us/review?id=564887346&type=Purple%20Software";"564887346";48;"en";"NEGATIVE"
331;1475903397;"kjerred";"https://itunes.apple.com/us/reviews/id150097073";"1.13.2";5;"Works very well";"I have been using Insteon devices and the app for about a year and a half  and have had no problems, I have 72 devices and eleven cameras and they all seem to work reliably. I still had to call customer support to help add some of the cameras but that was with an older version of the app. I added the last 2 cameras using the newest version myself and I'm not very techy. When I refer to adding cameras, I'm including the ability to view them remotely when not at home which requires port forwarding of your router. If you only want to view while home and connected to wifi, the process is simpler, but once installed everything has worked well. I also use the Apple Watch application and that all works well also. You have great control of most of your devices through the watch and can even view the cameras. Amazon's Echo also works with this format.   I don't understand all the negative reviews, if you have any problems, call the free technical support line. They are very accessible and knowledgeable about the devices. Sometimes there are long waits, but they have a great system where they ring you back when it's your turn in line. There is also a Insteon/ Smarthome forum with some brilliant users willing to help figure out most problems if you need additional help. The Insteon hub and app is a great way for anyone with little or no experience with home automation to get started and of the apps available for Insteon that I've looked at, this one does the most and works the best when using the non-Apple HomeKit compatible Insteon hub. The HomeKit compatible Insteon app & Hub are a whole different system and I have had no experience with it, but for now this works great and I'm very happy with it.";"2016-10-30T12:23:27-07:00";"https://itunes.apple.com/us/review?id=564887346&type=Purple%20Software";"564887346";315;"en";"POSITIVE"
332;1437036245;"Reviewer8711";"https://itunes.apple.com/us/reviews/id5647785";"1.13.2";1;"Latest update fails to login";"The latest update has broken the ability to login. 
Get 'unable to establish a connection with your Insteon hub'.
Have deleted and reloaded app but does not work on any iOS device anymore.";"2016-08-21T18:54:39-07:00";"https://itunes.apple.com/us/review?id=564887346&type=Purple%20Software";"564887346";33;"en";"NEGATIVE"
333;1492077452;"jim15022";"https://itunes.apple.com/us/reviews/id134923675";"1.14.0";1;"Just purchased starter kit. Hub can't connect. Returning it";"New out of the box and cannot even connect to it to set it up.   If it is the latest app update that is causing this then it needs to be fixed.  Returning this and going to try a competitors product";"2016-11-27T14:49:37-07:00";"https://itunes.apple.com/us/review?id=564887346&type=Purple%20Software";"564887346";41;"en";"NEUTRAL"
334;945534919;"J35203";"https://itunes.apple.com/us/reviews/id33795797";"1.6.7";4;"Needs password protection";"Works good but needs password protection. Push alert would be good too";"2014-02-17T17:24:14-07:00";"https://itunes.apple.com/us/review?id=564887346&type=Purple%20Software";"564887346";12;"en";"POSITIVE"
335;1489881753;"Boznoko338";"https://itunes.apple.com/us/reviews/id43371502";"1.14.0";1;"Keeps logging me out";"This stupid app keeps logging me out and making me re-enter my password. Insteon's products have been nothing but buggy--I wish I'd gone with one of their competitors instead, but now I'm locked into their awful ecosystem.";"2016-11-23T19:25:27-07:00";"https://itunes.apple.com/us/review?id=564887346&type=Purple%20Software";"564887346";37;"en";"NEGATIVE"
336;1189037987;"Anonymous app lover!!!";"https://itunes.apple.com/us/reviews/id356788738";"1.9.29";5;"Insteon is Amazing!!!";"Great app!!! Works great with the products and really helps to keep my house organized!!! Great investment!!!";"2015-04-27T17:39:55-07:00";"https://itunes.apple.com/us/review?id=564887346&type=Purple%20Software";"564887346";17;"en";"POSITIVE"
337;1071421978;"ManTownRC";"https://itunes.apple.com/us/reviews/id237113194";"1.8.0";2;"Buggy app iOS 8 reboot";"Please fix the app so that we can rename devices    .   It crashes every time I try to rename a device, room, or scene.    Long time insteon customer but may have to switch to z wave!";"2014-09-27T19:19:38-07:00";"https://itunes.apple.com/us/review?id=564887346&type=Purple%20Software";"564887346";36;"en";"POSITIVE"
338;1453221034;"sbarab";"https://itunes.apple.com/us/reviews/id34670001";"1.13.2";2;"Has problems with OS 10";"Does not consistently work with OS 10 on the Alexa hub. Old model connects but not Alexa on two phones with iOS 10 but other phones with older os works fine. Please fix.";"2016-09-20T21:54:15-07:00";"https://itunes.apple.com/us/review?id=564887346&type=Purple%20Software";"564887346";33;"en";"POSITIVE"
339;1208570235;"JC2002jc";"https://itunes.apple.com/us/reviews/id38385651";"1.9.32";1;"Sign on problem";"As others have said, the sign on issue is a problem.  The apple watch app is worthless if I have to continually use my phone to log in every time.  Please fix this soon!";"2015-06-07T07:02:40-07:00";"https://itunes.apple.com/us/review?id=564887346&type=Purple%20Software";"564887346";34;"en";"NEGATIVE"
340;957425206;"lest54";"https://itunes.apple.com/us/reviews/id14874520";"1.7.0";1;"UI affected by iOS 7.1";"The bottom menu and AC control is all messed up on iOS 7.1. Haven't checked any other screens. Other than that, great app! I'll update the review as soon as it is fixed - just reviewing to report the problem.";"2014-03-10T17:35:06-07:00";"https://itunes.apple.com/us/review?id=564887346&type=Purple%20Software";"564887346";40;"en";"POSITIVE"
341;1219371080;"Gtas55";"https://itunes.apple.com/us/reviews/id5400745";"1.9.29";5;"Great tool!!!";"Get to have a video monitor on my phone...light switches are really nice too!!!!";"2015-06-28T19:20:44-07:00";"https://itunes.apple.com/us/review?id=564887346&type=Purple%20Software";"564887346";14;"en";"POSITIVE"
342;734757264;"Mjmercadante";"https://itunes.apple.com/us/reviews/id31588441";"1.1.0";1;"It's beta";"Sadly the features of the app and ihub don't yet support all insteon devices, the supported features are simplistic, and support is matter of fact about the whole thing. I would buy this controller again buy isy 99 instead";"2013-01-22T19:30:53-07:00";"https://itunes.apple.com/us/review?id=564887346&type=Purple%20Software";"564887346";39;"en";"NEUTRAL"
343;948410310;"X Vault X";"https://itunes.apple.com/us/reviews/id35243112";"1.6.7";2;"iOS does not write the Hub correctly";"iOS does not write several commands properly to the Hub.  It is known this app does not work properly.  Doesn’t seem to bother Insteon though.";"2014-02-22T12:45:54-07:00";"https://itunes.apple.com/us/review?id=564887346&type=Purple%20Software";"564887346";25;"en";"NEGATIVE"
344;1125149399;"Ausmos";"https://itunes.apple.com/us/reviews/id238248842";"1.9.13";3;"Meh";"It's alright for basic functions, but the lack of advanced features make insteon mostly pointless and overpriced.";"2015-01-05T09:19:20-07:00";"https://itunes.apple.com/us/review?id=564887346&type=Purple%20Software";"564887346";17;"en";"NEUTRAL"
345;1008198265;"Wolfer";"https://itunes.apple.com/us/reviews/id28276948";"1.7.5";4;"Just missing rotate option";"Great app. Making it rotate with the IPad would make it 5 star!";"2014-06-10T18:33:58-07:00";"https://itunes.apple.com/us/review?id=564887346&type=Purple%20Software";"564887346";13;"en";"POSITIVE"
346;1318429553;"Fjvfukseh5883236";"https://itunes.apple.com/us/reviews/id474668786";"1.11.0";2;"Way too Glitchy";"Scheduling scenes or devices is way too glitchy. I updated a schedule, saved it, but it will not save! So frustrating!";"2016-01-18T05:48:19-07:00";"https://itunes.apple.com/us/review?id=564887346&type=Purple%20Software";"564887346";21;"en";"NEGATIVE"
347;746927789;"Tunaman forever";"https://itunes.apple.com/us/reviews/id200991085";"1.2.0";4;"Ok";"It works well, what I don't like is the icons and lettering are hard to see. Icons and lettering are white on a light blue background.";"2013-02-08T06:57:09-07:00";"https://itunes.apple.com/us/review?id=564887346&type=Purple%20Software";"564887346";26;"en";"NEGATIVE"
348;719505000;"openkimono";"https://itunes.apple.com/us/reviews/id38401253";"1.1.0";1;"Buggy";"The hub is not ready for prime time. Scenes do not work. Many devices are not yet controllable. Does not support multi function keypads.  App is an improvement over the smart link app, but still doesn't make up for the hub.";"2012-12-30T17:52:58-07:00";"https://itunes.apple.com/us/review?id=564887346&type=Purple%20Software";"564887346";41;"en";"POSITIVE"
349;1165557938;"Ywest512";"https://itunes.apple.com/us/reviews/id39744313";"1.9.13";5;"Perfect";"Love this app and my insteon hub. Works perfectly for simple programs.";"2015-03-08T22:33:27-07:00";"https://itunes.apple.com/us/review?id=564887346&type=Purple%20Software";"564887346";12;"en";"POSITIVE"
350;1068278824;"JJ Help";"https://itunes.apple.com/us/reviews/id141446249";"1.8.0";2;"IOS 8 Crash";"I updated to iOS 8 and now the app crashes when you try to change the ""name"" of a scene or device.  Please fix!";"2014-09-21T17:25:22-07:00";"https://itunes.apple.com/us/review?id=564887346&type=Purple%20Software";"564887346";24;"en";"POSITIVE"
351;893149112;"beave408";"https://itunes.apple.com/us/reviews/id37007722";"1.5.1";1;"Headache to set up!";"How am I supposed to know the user name and password if I never was asked to provide initially?  This older version of this software was easy to install before.  This has been a horrible experience.";"2013-11-08T20:55:10-07:00";"https://itunes.apple.com/us/review?id=564887346&type=Purple%20Software";"564887346";36;"en";"NEGATIVE"
352;755414214;"Pass don't buy";"https://itunes.apple.com/us/reviews/id13215381";"1.2.0";3;"Much better";"I was about to give up. Update came and waited before re review. Very good please keep update going!!!";"2013-02-20T10:26:56-07:00";"https://itunes.apple.com/us/review?id=564887346&type=Purple%20Software";"564887346";19;"en";"POSITIVE"
353;1468690976;"DJ’s Apple Account";"https://itunes.apple.com/us/reviews/id140535075";"1.13.2";1;"Crashing and locking up app!!!!!";"So I have to reboot my iPhone every time I want to turn on or off the pos insteon controlled light!  Great.   Will be returning to costco for $49. and it started at over a $100.   

Fix the app or eat the returns and lost business!!";"2016-10-17T22:29:35-07:00";"https://itunes.apple.com/us/review?id=564887346&type=Purple%20Software";"564887346";46;"en";"POSITIVE"
354;1182656458;"Anthem!!";"https://itunes.apple.com/us/reviews/id25981741";"1.9.29";1;"Push doesn't work";"I updated to the latest version and no where did ask me to allow push notifications. Now, my app does not work!";"2015-04-14T07:13:23-07:00";"https://itunes.apple.com/us/review?id=564887346&type=Purple%20Software";"564887346";22;"en";"NEGATIVE"
355;1078794497;"Archer 911";"https://itunes.apple.com/us/reviews/id25122657";"1.9.0";1;"Rotten Tech";"Totally unreliable!
Totally unacceptable!
This system may compromise your home security.
Update:
There are no words to describe how rotten this app and system are. I am on vacation and have no control of my system because my hub won't respond.";"2014-10-11T11:16:15-07:00";"https://itunes.apple.com/us/review?id=564887346&type=Purple%20Software";"564887346";41;"en";"NEGATIVE"
356;1489188814;"Jeffjeff1512";"https://itunes.apple.com/us/reviews/id30047569";"1.10.1";1;"Schedule";"You still can NOT save a schedule for a device (and have it actually turn a light on and off) in this version on the xxxx-222 insteon hub.   When will this be fixed???";"2016-11-22T13:28:12-07:00";"https://itunes.apple.com/us/review?id=564887346&type=Purple%20Software";"564887346";33;"en";"NEGATIVE"
357;1212989718;"Gbenj";"https://itunes.apple.com/us/reviews/id235149848";"1.9.32";1;"App doesn't remember login information";"Doesn't work with apple watch because app keeps logging me out and I need to open it and log in before I can use it on apple watch.";"2015-06-15T19:32:10-07:00";"https://itunes.apple.com/us/review?id=564887346&type=Purple%20Software";"564887346";28;"en";"NEUTRAL"
