"";"id";"userName";"userUrl";"version";"score";"title";"text";"updated";"url";"app";"wordCount";"language";"sentiment"
189;6220383457;"dernhelm1";"https://itunes.apple.com/us/reviews/id21834694";"4.32";2;"Make activities editable";"I have a D2 Bravo. I use it for flying, hiking, and workouts. This watch does a great job of logging what I do. When connected to this app, it does a great job of showing what I did on a map I can email to others. This is important because my passengers do not care about my logbook or sectional chart. They only care about where they have been. I can email them a google map of where we have been with this app.  This app does not let me prioritize my flying activities causing me to spend too much time flipping thru the whole activities list. Please allow activities to be editable so I can get rid of the stuff I don’t care about (golf) and show what I do (flying hiking).";"2020-07-20T07:34:08-07:00";"https://itunes.apple.com/us/review?id=583446403&type=Purple%20Software";"583446403";134;"en";"POSITIVE"
190;6213236644;"jbirckh1";"https://itunes.apple.com/us/reviews/id41596812";"4.32";1;"Very glitchy";"So far I’ve had nothing but problems with this app. I’m surprised I’ve been able to get my watch up and running at all. First the issue was constant freezing. I’ve uninstalled and reinstalled it several times. Now it’s stuck on the “which wrist will you wear your watch?” screen. I can’t even complete the initial install. All this after I hade to get a replacement vivoactive 4 the day after I got the first one because the heart rate sensor didn’t work. At this point, I’m not so sure I made a good decision and will know in the next couple days if I want to continue with this or choose a different brand all together. I thought Garmin Was supposed to be good quality? So far my experience has been mediocre at best.";"2020-07-18T09:09:25-07:00";"https://itunes.apple.com/us/review?id=583446403&type=Purple%20Software";"583446403";135;"en";"POSITIVE"
191;6040054739;"Dottydotty72";"https://itunes.apple.com/us/reviews/id168646318";"4.31.2";2;"Unintuitive!!!";"Like most technology, this has more way more data than most people need. I’m not looking to record every possible data point from my run.  I don’t care about the number of steps I’ve climbed, calories burned, cups of coffee I drank, people I’ve chatted with, etc.  And that’s all I do is run. No biking, swimming, mountain climbing, parachuting, kayaking 10 continents, etc. I just want the simple basics. 

And, the pathway to get to the information you need is mind boggling to say the least. If I want to change a particular piece of data, I never know where to even start to get to it! Put me in a rubber room. 

And the graphs provided to show what you’ve done are ridiculous - I have no idea what I’m even looking at since the graphs don’t even have labels!! (Kind of a basic rule you learn in 4th grade math, Garmin. Please take note.) The technology should be built with the most basic in mind and those who want more complexity can add those features on. 

I’m sure there are many athletes who love this kind of detail, but those people are not the majority.";"2020-06-05T15:12:27-07:00";"https://itunes.apple.com/us/review?id=583446403&type=Purple%20Software";"583446403";198;"en";"POSITIVE"
192;5569674598;"Dave2451234";"https://itunes.apple.com/us/reviews/id46257100";"4.27";5;"245 Music";"I really like the watch and functions - there are some areas it can be improved: 
- accuracy climbing stairs (count) seems sporadic and delayed. Going down stairs vs up seems more accurate. 
- ski tracking is good, but calculations as to contribution to weekly load and performance metrics is wrong. For example - I was skiing in waist high powder at 3.5K altitude on 50 degree slopes and did over 10k vertical descent in one day and Garmin said my performance load reduced for the day?!?! 
- similar with yoga, the cardio contribution is too low for the type of work it is.";"2020-02-23T03:55:43-07:00";"https://itunes.apple.com/us/review?id=583446403&type=Purple%20Software";"583446403";104;"en";"NEGATIVE"
193;5438508605;"PrettyCountryGirl30";"https://itunes.apple.com/us/reviews/id124447381";"4.26";1;"Does not stay synced to device";"The Garmin Connect app refuses to remain synced with my Vivoactive 3 - in order to sync I have to forget my watch through Bluetooth and then pair again. I’ve also had to uninstall the app completely and reinstall, going through all the setup steps to get the app and watch to sync. This happens when there is more than 8 hours between not opening the app and hitting the sync wheel. The app is left running in the background per Garmin’s suggestions on the help forum, but does not help. Not only is this extremely frustrating, it definitely makes me want to look into other multi sport trackers. I’m running the app on an iPhone 7s fully updated to 13.3. Devs, please fix this issue! I know I’m not the only one!";"2020-01-23T04:16:54-07:00";"https://itunes.apple.com/us/review?id=583446403&type=Purple%20Software";"583446403";133;"en";"POSITIVE"
194;4541281404;"Raghu U";"https://itunes.apple.com/us/reviews/id902728985";"4.21";4;"Really good app could use a little improvement";"1) could not figure out how to rename a custom course via the App 
2) Appalliw for easy accees to Gps
3)Even after caliberation the indoor treadmill is off by 0.10 mile. Maybe an issue with the watch 
4) should come with a few more watch faces out of the box or the ability to design simple watch faces instead of another app
5) sometimes and this has been observed only once or twice the app looses connection to garmin fenix 5. Noticed this when I turned off bluetooth and then turned it back on and the app could not pick up the watch to sync";"2019-07-30T04:54:46-07:00";"https://itunes.apple.com/us/review?id=583446403&type=Purple%20Software";"583446403";106;"en";"POSITIVE"
195;5899009770;"Christian Reid";"https://itunes.apple.com/us/reviews/id702164691";"4.30";4;"Problem with syncing";"When I’ve been syncing Runs after I finish them it send it’s over to the app but as a different thing like skiing or Rowing, a couple of days ago I ran 4.5 miles and when I sent it over to the app it didn’t even count the workout is said it was an IQ event even though I had the data on the watch, is this a problem with the watch or my phone? 
I love the app and the watch but this last week it’s just continually messed it up, skiing isn’t even an option on my watch and it still said that I did that.";"2020-05-03T14:15:49-07:00";"https://itunes.apple.com/us/review?id=583446403&type=Purple%20Software";"583446403";108;"en";"POSITIVE"
196;7955105312;"alfred agahan";"https://itunes.apple.com/us/reviews/id549197904";"4.48";5;"First Smartwatch experience Garmin Venu";"For a smartwatch to cater towards apple users with its usability is top notch. Seamless transfer of watch data to smartphone is impressive. Although I wish the community was more interactive, one cannot really dictate how people interact on the Garmin leaderboards besides ask for a friend request. I’m assuming the forums are for that. Oh and by the way the application transfer via usb is a pretty great way to download certain widgets. Still haven’t gotten around to pairing the music, but when I do, it’s gonna be a doozy of a review.";"2021-10-26T01:51:44-07:00";"https://itunes.apple.com/us/review?id=583446403&type=Purple%20Software";"583446403";94;"en";"POSITIVE"
197;7117288693;"Hhornblower";"https://itunes.apple.com/us/reviews/id116053703";"4.40";1;"Updates are making this app useless";"The last two updates have made it impossible to view data on an annual basis. When I contacted support, I was told they had received numerous complaints about the new format for annual data and were going to correct it. Well, with the last update they extended the new annual formatting to other data segments. They’re not fixing it, they’re just extending this horrible concept. What is the point of giving them my data if they can’t show it to me in a format that is useful? At least give the option to customize how to view the data, that would be an upgrade. Once my 935 has reached the end of its useful life, I’m definitely not going to be buying another Garmin.";"2021-03-18T09:52:13-07:00";"https://itunes.apple.com/us/review?id=583446403&type=Purple%20Software";"583446403";124;"en";"POSITIVE"
198;7001665514;"And Another Unhappy User";"https://itunes.apple.com/us/reviews/id340374768";"4.39";1;"Doesn’t sync- have to manually sync";"This app works fine as an app but to use it in conjunction with a garmin watch you have to manually sync it through your computer or disconnect/forget the device through Bluetooth and reconnect- this happens daily. It also won’t sync to my fitness through the app or desktop feature, and it doesn’t actually sync with Strava. It will send your activity info to Strava but if you log an activity in Strava through your phone without wearing the watch you have to manually enter the information through the desktop website. Overall the app works fine on its own but does not sync well with a garmin watch or the other apps it’s advertised to be compatible with";"2021-02-16T08:24:37-07:00";"https://itunes.apple.com/us/review?id=583446403&type=Purple%20Software";"583446403";118;"en";"POSITIVE"
199;5682389945;"EastWestEZ";"https://itunes.apple.com/us/reviews/id137549834";"4.28.1";5;"Great app";"Bought the app, Vivosmart 4, subscription to MyFitnessPal, and the Garmin scale. These 3 products together track almost everything I’m interested in.

The one gripe I have that the weight lifting function on the app isn’t very good. It lacks a lot of basic exercises and isn’t very intuitive in recording number of sets and weight. It’d also be nice to see a function that recommends exercises based on your workout routine.

Except this one point, fantastic option to keep track of your health and daily activity.";"2020-03-19T07:32:48-07:00";"https://itunes.apple.com/us/review?id=583446403&type=Purple%20Software";"583446403";87;"en";"POSITIVE"
200;5447914667;"V81256";"https://itunes.apple.com/us/reviews/id26651730";"4.26";4;"Great for what I need";"I bought the garmin to track steps and log walking / biking route. The things that are accurate to a degree are step count, yoga minutes practiced/ heart rate, and walking / biking routes + elevation.  The steps calculated usually don’t relate well to miles walked  but overall it keeps a nice record of my walks. I like that it sends text messages, email and the weather is spot on ( if one can rely on forecasts). You can customize it as you like but the more stuff you add the shorter the battery life. 
Overall, I like the garmin and am happy with the purchase.
Vicky";"2020-01-25T10:32:46-07:00";"https://itunes.apple.com/us/review?id=583446403&type=Purple%20Software";"583446403";107;"en";"POSITIVE"
201;5558483506;"Unhappyuserstill";"https://itunes.apple.com/us/reviews/id101008373";"4.27";4;"Wish Livetrack was more reliable";"I love almost everything about this app. It makes accessing my data very easy and I end up using the info more than if I had to use a computer. 

My only issue is that livetrack rarely works on the first try. I seem to have to unpair watch and restart EVERY SINGLE TIME. I go through it because I run in pretty remote areas (still with cell coverage )

The Bluetooth pairing is flawless during that time it’s just the app not uploading or something. It’s an important safety feature that I wish worked better";"2020-02-20T16:24:13-07:00";"https://itunes.apple.com/us/review?id=583446403&type=Purple%20Software";"583446403";96;"en";"POSITIVE"
202;6361445223;"BLOODYDAWG";"https://itunes.apple.com/us/reviews/id40497519";"4.34.2";5;"New to training with Garmin";"I purchased a Garmin Instinct to use for cycling.  It replaced a 10 year old heart strap and another APP.  I like the tracking of the watch and not needing to have the phone with me in my pocket while walking.

I planned on using it primarily for cycling and really like it.  I have found the heart rate feature to be very close to accurate.  I purchased the Garmin Heart strap but have not paired it up yet, to get a more exact tracking.

I would recommend Garmin to a friend just like a friend recommended it to me.";"2020-08-25T20:15:53-07:00";"https://itunes.apple.com/us/review?id=583446403&type=Purple%20Software";"583446403";100;"en";"POSITIVE"
203;5479865171;"NS in KC";"https://itunes.apple.com/us/reviews/id281354674";"4.26";3;"Great watch - mediocre app; buggy";"Garmin Fenix watches are terrific, but handicapped by a mediocre app and software/firmware. A couple examples: (1) whenever my iPhone  11 restarts, after an update, for example, I have to sign into connect all over again, and re-pair my Fenix 3HR...annoying and ridiculous; (2) the weather display on the watch has NEVER worked reliably - users have been complaining for years; (3) if you try to set a custom alarm, the watch hangs necessitating a restart to break out of it. Come on, Garmin - you are better than this. Fix this once and for all and you will have the best fitness watch on the market.";"2020-02-02T10:45:04-07:00";"https://itunes.apple.com/us/review?id=583446403&type=Purple%20Software";"583446403";107;"en";"POSITIVE"
204;5309881011;"scubasteve0518";"https://itunes.apple.com/us/reviews/id584820861";"4.25.2";1;"Watch face keeps changing";"Great app, but problems since the most recent firmware update.  The watch face keeps changing back to the default face after just a few seconds.  If I hit the up or down button to go to a different screen, then return to the home screen, the watch face I downloaded shows up.  However, after just a few seconds, the screen goes black then changes back to the default watch face.  This started today after I noticed my watch conducted a firmware update overnight.  I have updated the app and turned the watch off and back on and the problem still exist.  Any ideas as to why this is happening and how it can be fixed.  My phone has not updated with the new ios 13.";"2019-12-23T10:54:05-07:00";"https://itunes.apple.com/us/review?id=583446403&type=Purple%20Software";"583446403";125;"en";"NEGATIVE"
205;3888335452;"Russ_Dallas";"https://itunes.apple.com/us/reviews/id46236219";"4.16";3;"Tells time very accurately vivoactive 3";"Pluses- Great battery life, Comfortable
Negatives- if you push a stroller or carry a kid you don’t get credit for STEPS (general motion doesn’t update.
Glass face chips very easily. I’m very afraid to take off the protector or get it wet.
Biggest negative- I do Trail riding with young kids and ideally my wish would be for LIVETRACK to work. It doesn’t and general garmin discussion groups and garmin tech people who participate in the group discussions admit it doesn’t work. It’s a great safety feature to be able to notify someone where we are. (I’m using ride alert which works like LIVETRACK should.)
If LIVETRACK ever does work it should be able to send a TEXT (not an email).
I’m sad about this. 
If you charge the watch in the evening and don’t wear it for some (who knows how long) length of time before bedtime, it will not track sleep.
If you wake up in the middle of the night and are up longer than a few minutes it often decides that’s all you slept, even if you went back to bed and slept 4 hours.
The watch is fun to own";"2019-03-16T06:50:46-07:00";"https://itunes.apple.com/us/review?id=583446403&type=Purple%20Software";"583446403";195;"en";"POSITIVE"
206;7378658749;"Rthinchey";"https://itunes.apple.com/us/reviews/id41886037";"4.42.1";3;"Route mapping not great";"Creating a route for a hike is frustrating. The Harmon connect app is great because you can auto snap to popular sections and roads/trails to make the route quickly. However, there are sections that the app doesn’t recognize as roads/trails so the route backtracks. This auto-snap feature can’t be turned off. So I go to the Garmin Explore app.. that app has no auto-snap feature at all for hiking even though it shows hiking routes. This must be a great challenge for the programmers but it makes you wonder why you pay hundreds for a garmin watch when you can use your phone for navigation.";"2021-05-23T08:04:15-07:00";"https://itunes.apple.com/us/review?id=583446403&type=Purple%20Software";"583446403";105;"en";"POSITIVE"
207;6706175991;"ClaytonCBL";"https://itunes.apple.com/us/reviews/id910758166";"4.37.1";4;"One complaint";"My only real complaint is regarding functionality when Garmin web services are down.  I understand many of the metrics are done at the server level, but at minimum the app should download the data from watch and store until later time when web services are restored.  Right now if web services go down the app is useless and you cannot even see tracking data like activities.  Even without the server analysis the app should be able to store and show the raw data.";"2020-12-01T07:04:45-07:00";"https://itunes.apple.com/us/review?id=583446403&type=Purple%20Software";"583446403";83;"en";"POSITIVE"
208;4881161828;"Thorski18";"https://itunes.apple.com/us/reviews/id481564486";"4.23.2";3;"Software problems with new updates";"Having the same problems as kdiff. Been having problems for weeks, now after update new software problems. I have a fenix 3hr. When i try to save watchface settings it asks if i want to open outside of garmin connect, when it shows me the same page again on the web and i try to save again it says something about downloading binary? And nothing happens. What? It used to be so simple and easy. Very frustrated, there’s no use in wearing the watch if i cant use it the way i want. I paid too much for this watch to not be able to use/customize  the way i want also. Please fix.";"2019-10-03T20:33:52-07:00";"https://itunes.apple.com/us/review?id=583446403&type=Purple%20Software";"583446403";113;"en";"NEGATIVE"
209;3815094831;"GrayGoose1104";"https://itunes.apple.com/us/reviews/id487246134";"4.15.1";5;"Perfect way to keep up with/track your progress";"As a young runner, I need a way to keep up with myself and how I’m doing. My garmin watch helps me do that, but honestly its pretty hard to access everything thats going on with my body and this app really helps me do that. Since I downloaded the app I’ve noticed that I haven't been getting enough sleep so I go to bed earlier, and also I noticed my stress was unhealthily high so now I try to omit stress out of my life and overall the app has really just helped me live my best life and run my best races!💯💯";"2019-02-25T16:36:10-07:00";"https://itunes.apple.com/us/review?id=583446403&type=Purple%20Software";"583446403";104;"en";"POSITIVE"
210;3570064029;"TeaSea.Inc";"https://itunes.apple.com/us/reviews/id191410090";"4.13.2";5;"Great App, if you have the right device";"I used this app when I had a Forerunner 220 and it was alright. However, I recently upgraded to the Fenix 5S Plus and that was when all the features really showed up. It seemed plain score but that was because I didn’t have a current device. 

The app works seamlessly with My fitness pal and with Strava. The app is easy to navigate and it very intuitive. The color palate is nice too. Eye simple and very aesthetic. 

If you drop the money for a Garmin, you should expect an excellent app to accompany it. And this delivered all the way.";"2018-12-24T23:04:32-07:00";"https://itunes.apple.com/us/review?id=583446403&type=Purple%20Software";"583446403";102;"en";"POSITIVE"
211;7099259947;"TerRin78";"https://itunes.apple.com/us/reviews/id196890013";"4.40";5;"Can’t live without it:-)";"I really enjoy using the Garmin Connect app. I am a beginner runner, and this app allows me to keep track of all the stats from a run. I certainly don’t need all the information it’s giving me for my level of running, but I find it inspirational to look at anyway after a workout. Even bought the chest mounted hr monitor to get even more out of it. If you connect this app to Strava you can easily share your workout with your friends if that’s your thing.";"2021-03-13T11:12:58-07:00";"https://itunes.apple.com/us/review?id=583446403&type=Purple%20Software";"583446403";89;"en";"POSITIVE"
212;6269750046;"Citychamp";"https://itunes.apple.com/us/reviews/id377548734";"4.33";2;"Constant trouble connecting";"I seem to have constant trouble staying connected to my phone. Because of this, I don’t get the weather feature, but more importantly I don’t get the calls or text messages which was the point of getting this Vivofit 3 (I believe). I don’t need GPS or lots of bells/whistles, but prefer a longer battery life. Allowing the use of a regular watch battery would be so much better. 

Also, now the app says experiencing issues every time I try to log in so I’m not getting to see any of my data which is a huge problem! It would also be nice to be able to expand the graphs in the app. Please get it together Garmin!!";"2020-08-01T21:40:43-07:00";"https://itunes.apple.com/us/review?id=583446403&type=Purple%20Software";"583446403";118;"en";"POSITIVE"
213;5718081533;"TurntUp4Jesus";"https://itunes.apple.com/us/reviews/id643080676";"4.28.1";5;"Garmin forerunner 35";"I absolutely love my 35, yup you heard me my 35 not 305 my 35.  I don’t like all the high tech stuff when I go for a run.  My 35 keeps it simple.  It tracks my run, puts it up on a map and gives me all my splits.  Plus it gives me all my text messages.  It’s great I don’t have to worry about all the touch screens, it’s simple push buttons, I don’t have to worry about switching screens by accident in the middle of my run and then trying to figure out how to switch back.  My 35 pure simple basic awesomeness.";"2020-03-26T15:16:08-07:00";"https://itunes.apple.com/us/review?id=583446403&type=Purple%20Software";"583446403";106;"en";"POSITIVE"
214;5570422050;"Marisab_16";"https://itunes.apple.com/us/reviews/id378390425";"4.27";5;"Forerunner 35 is great";"I have been using the Forerunner 35 to track my runs and biking trips. It has motivated me to exercise everyday in order to train for high school cross country and track. I would recommend this watch as well as this app to anyone interested in improving their running or biking. Unfortunately, the Forerunner 35 does not have a swim feature, but other Garmin watches have those. Additionally, the connection with Strava is perfect. I have had a great experience with Garmin and hope that you do too.";"2020-02-23T07:22:17-07:00";"https://itunes.apple.com/us/review?id=583446403&type=Purple%20Software";"583446403";88;"en";"POSITIVE"
215;6096870001;"REL195";"https://itunes.apple.com/us/reviews/id420963662";"4.31.2";5;"Very happy with the watch and the app";"I was hesitant to get the garmin forerunner 935 at first. I had an Apple Watch series 3 before and was used to its smart watch features and simplicity of the activity screens. However I made my decision based on the battery life and loads of information it can gather based on my activities. The app is very easy to use and allows me to follow my day to day. I also love that it gives explanations of each data point and the ranges that are desirable. Great app and great watch!";"2020-06-19T10:14:22-07:00";"https://itunes.apple.com/us/review?id=583446403&type=Purple%20Software";"583446403";92;"en";"POSITIVE"
216;5489385984;"Retops";"https://itunes.apple.com/us/reviews/id34670732";"4.27";5;"Useful for non-athletes";"Garmin is a great product for athletes, but it is also excellent for the average person monitoring their own health. The ability to track your exercise daily , monitor normal and active heart rate, record your personal exercise (walking in my case), and chart trends is really helpful. My Fenix 5x is a great watch with all these added features. 

The GPS is great when visiting an unfamiliar city. You can mark your location and track back if you get lost.  A valuable asset when you need it.";"2020-02-04T20:12:08-07:00";"https://itunes.apple.com/us/review?id=583446403&type=Purple%20Software";"583446403";88;"en";"POSITIVE"
217;5333182433;"Pistol_Pete_🔫🔫";"https://itunes.apple.com/us/reviews/id31930571";"4.25.2";3;"Beware, battery killer if left on standard settings.";"Pretty decent app overall. Needs some customization for the weather feature, it would use up to 20% of my battery for the day updating location to push the current temp to my watch. Ended up abandoning that feature of the watch and shutting off location services for the app. Needs to have an option for frequency of weather updates so your phone’s battery isn’t toast. Brand new iPhone 11 Pro so the age of the battery isn’t the issue. 3 stars for now will go to 5 if they fix the weather/battery issue.";"2019-12-28T20:56:53-07:00";"https://itunes.apple.com/us/review?id=583446403&type=Purple%20Software";"583446403";93;"en";"POSITIVE"
218;6394366908;"Sandylh1976";"https://itunes.apple.com/us/reviews/id433705838";"4.34.4";4;"Just one thing missing";"I recently bought a vivoactive watch and I’m loving it so much and the app is awesome but what I miss from other apps like Fitbit etc. Was the inclusion of a community of like minded people who are out there trying to be healthy and fit. This one checks if any of your contacts or Facebook friends are in it but if they’re not then you’re in it all alone 😥 make it an open community! I’m sure there’s a lot of people all over the world using garmin devices. Other than that I really enjoy the app and watch.";"2020-09-04T07:02:35-07:00";"https://itunes.apple.com/us/review?id=583446403&type=Purple%20Software";"583446403";101;"en";"POSITIVE"
