"";"id";"userName";"userUrl";"version";"score";"title";"text";"updated";"url";"app";"wordCount";"language";"sentiment"
348;8124812538;"lrlc";"https://itunes.apple.com/us/reviews/id186645513";"4.49.1";1;"Deleted, but tracking screen usage in the background";"Pretty frustrated with this app. I deleted it from my phone, never subscribed, but for some reason my phone thinks that it’s still running in the background. Setting a time limit on it does nothing to change how long it runs for. It’s draining my phone battery. My account has been deleted though because I literally can’t login again. 
Customer service email would work if I had the serial number, but since it’s deleted from my phone I don’t think I can access that. 

Customer service: please help me remove it completely.";"2021-12-12T22:29:33-07:00";"https://itunes.apple.com/us/review?id=583446403&type=Purple%20Software";"583446403";92;"en";"POSITIVE"
349;7198496976;"Eschiller6f03af";"https://itunes.apple.com/us/reviews/id191765926";"4.41.2";1;"Annoying in-app reminders EVERYDAY";"I used to love this app, but recently (last few weeks) I’ve been getting these annoying in-app reminders to set up three things (track my menstrual cycle, track my fluid intake, and set up LiveTrack). I have selected no, I don’t want to set these up and I don’t want to be reminded to do so at a later time. But I still receive these reminders almost daily when I open up my app for the first time each day. Allow users to turn off these pervasive and annoying reminders or you will lose us as customers because this is getting to the point of the app feeling so spammy 😫😓😡!";"2021-04-08T07:33:42-07:00";"https://itunes.apple.com/us/review?id=583446403&type=Purple%20Software";"583446403";111;"en";"NEGATIVE"
350;6259480082;"fionamarie:)";"https://itunes.apple.com/us/reviews/id1175405813";"4.33";4;"Great for running";"I’m 14 and I have been using the Garmin app for about a year now and I really like it. It’s so useful to just go for a run and have my watch track it. The distance tracking is pretty accurate when I’m not running at a track. I just wish that there was a way to go back to your old prs. I have my runs recorded in the app but when I tried to accept them as prs it didn’t work. It’s a great app but I just wish I could edit the prs.";"2020-07-30T06:43:41-07:00";"https://itunes.apple.com/us/review?id=583446403&type=Purple%20Software";"583446403";96;"en";"POSITIVE"
351;6493225726;"RobbiePcola";"https://itunes.apple.com/us/reviews/id42293521";"4.35";1;"Connectivity problems render app and watch useless";"Many times throughout the day I have to restart my phone and watch multiple times before they will connect. Right now my phone’s Bluetooth settings say it is connected to the phone, but the garmin app says it is not connected. This problem is the typical state of this app. It works less often than it fails. I can tell the physical garmin watch is well-built. The software ruins it. I’m using a vivoactive 4 with iPhone 11 with iOS 13.7. This problem has existed the entire time I’ve had this watch, since November 2019. This is my first and last garmin wearable.";"2020-10-02T12:20:02-07:00";"https://itunes.apple.com/us/review?id=583446403&type=Purple%20Software";"583446403";103;"en";"NEGATIVE"
352;6399365323;"skm1961";"https://itunes.apple.com/us/reviews/id22467918";"4.34.4";4;"For Golf";"Edit:   
Clio Country Club hole #8 is now a par 4... not a par 5.  
Initially, I loved this app... it synced perfectly with my Garmin Approach... now, I have to use a different app, which doesn’t sync... so I have to open this app and then go to the other app to see my scores?? Very disappointed. Plus- even before, if you accidentally hit save on your device- when maybe you’re playing a scramble- for example, there’s no way to delete the score. Just a crappy app.";"2020-09-05T16:53:19-07:00";"https://itunes.apple.com/us/review?id=583446403&type=Purple%20Software";"583446403";88;"en";"POSITIVE"
353;6017949298;"Gwblackw";"https://itunes.apple.com/us/reviews/id240152624";"4.31.1";5;"Garmin Forerunner 945";"When I started training for my 1st half Ironman a buddy told me to get a Garmin. I struggled justifying the price of this watch but he assured me it was worth the money. He couldn’t have been more right. It tracks me better than apple products and gives me more details and stats. One of the best is in the water and in my transition times. It’s worth every penny and I would recommend this for everyone.";"2020-05-31T07:27:01-07:00";"https://itunes.apple.com/us/review?id=583446403&type=Purple%20Software";"583446403";78;"en";"POSITIVE"
354;6014804186;"Elzbee3";"https://itunes.apple.com/us/reviews/id20951628";"4.31.1";5;"Transition to Garmin Connect";"For a number of years I used the on-line version of Garmin Connect, and enjoyed access to the data for each ride. Over the past few months I have used the the Garmin Connect app on the iPhone and found it to have more data from the ride in a more easily accessible format. Kudos to the Garmin team in developing the Garmin Connect app for the Apple iPhone!";"2020-05-30T12:39:53-07:00";"https://itunes.apple.com/us/review?id=583446403&type=Purple%20Software";"583446403";69;"en";"POSITIVE"
355;5771014985;"Applover269";"https://itunes.apple.com/us/reviews/id199597555";"4.29";5;"All around great app!";"Works really well with my forerunner 35, and I love that there is a manual activity entry function. There are so many options! I wish they had one for when I am skateboarding but they still have so many options. Syncs automatically when you open the app which is nice, and all of the figures it gives for runs and other activities are very informative! Love it!";"2020-04-06T06:25:15-07:00";"https://itunes.apple.com/us/review?id=583446403&type=Purple%20Software";"583446403";67;"en";"POSITIVE"
356;5563621549;"Spidermonkey101";"https://itunes.apple.com/us/reviews/id162066494";"4.27";5;"Great app, could use improvements";"The app is great and has been my favorite fitness tracker so far. My Garmin Instinct watch works great and I get a lot of use from it. Sometimes the app will log me out after updating so for several hours I won’t get notifications because of the disconnection. I’ve had other small bugs but they tend to receive regular updates to fix these.";"2020-02-21T20:10:58-07:00";"https://itunes.apple.com/us/review?id=583446403&type=Purple%20Software";"583446403";64;"en";"POSITIVE"
357;5288134162;"dvrapant";"https://itunes.apple.com/us/reviews/id467258055";"4.25.2";5;"Reliable App";"There are a few things that I don’t like but it’s reliable, always connects to my fenix and that’s what’s most important. There are things I’d like to see improved. The sleep monitoring is almost always wrong. Not sure why it’s much more reliable with Fitbit. I won’t use Fitbit again as I’ve had 2 expensive watches just brick after trying to update. Overall I like this app.";"2019-12-18T10:22:20-07:00";"https://itunes.apple.com/us/review?id=583446403&type=Purple%20Software";"583446403";68;"en";"POSITIVE"
358;4697287824;"My Nickname Was Taken....";"https://itunes.apple.com/us/reviews/id454252679";"4.22.1";3;"Dropped all my data on iOS update";"Garmin Fenix 5x

I’ve been using the watch and app for a couple months now and have been quite happy with it. But, when I recently updated iOS to the latest version (12.4.1), the app lost all my data. This is the only app on my phone to ever have done this, so I’m pretty irritated and disappointed about the whole thing.

I’d expect that Garmin would have higher quality control as I’ve been quite satisfied with every product I’ve ever used by them. Hopefully, this gets fixed in the next update.";"2019-08-30T10:47:57-07:00";"https://itunes.apple.com/us/review?id=583446403&type=Purple%20Software";"583446403";92;"en";"POSITIVE"
359;4111847747;"Dcdeland";"https://itunes.apple.com/us/reviews/id121045808";"4.18";3;"Update - what happened to training load graph";"Update - I used the training load info all the time to manage my daily training. Since the update the training load is blank which I believe is a bug in the update. Under training status I get my 7-day training load value but when I click on that there is nothing there??  Looks like that page is meant to be a graph of the 7 days like the VO2 but it is blank. All I see on that page is a definition of training load in white letters on a blank black background. Please fix";"2019-05-06T19:23:51-07:00";"https://itunes.apple.com/us/review?id=583446403&type=Purple%20Software";"583446403";96;"en";"POSITIVE"
360;6969795540;"Nerdy Nicky";"https://itunes.apple.com/us/reviews/id39956240";"4.39";1;"Sleep tracking";"I was really upset to find that with the update on February 2nd 2021 removed REM sleep tracking from my watch saying that suddenly my watch was unable to track it because I didn’t have an advanced enough features. Up to that point it worked just fine, it seems like Garmin is just trying to get people to purchase more Garmin equipment. This is really disappointing that they would do something like this. I’ve been a large supporter of Garmin for 5+ years and I’ve purchased 4 different watches up to this point so it makes me really upset to see that this is how they pay me back...";"2021-02-08T07:13:01-07:00";"https://itunes.apple.com/us/review?id=583446403&type=Purple%20Software";"583446403";109;"en";"NEGATIVE"
361;6909536777;"FratBroBeerPong";"https://itunes.apple.com/us/reviews/id189190494";"4.38";5;"Impressed";"I bought a garmin instinct solar and didnt know at the time of purchase this app was part of the garmin watch experience. I’ve never owned a smart watch prior, and this app blows me away. Its unbelievable how I’ve become obsessed with checking the data in the app and also how much the results motivate me to be more active. I havent found anything about this app or my garmin watch that I do not like.";"2021-01-24T14:41:14-07:00";"https://itunes.apple.com/us/review?id=583446403&type=Purple%20Software";"583446403";77;"en";"POSITIVE"
362;6430711168;"AC97346";"https://itunes.apple.com/us/reviews/id35247912";"4.34.4";1;"DOS called, they want their programmers back!";"Garmin consistently disappoints with app updates. There is no other app I have used in 10 plus years with an iPhone causes as much difficulty after an update as garmin connect. Every time, it causes issues. Whether needing to relogin to the web account, or worse, an endless cycle of forgetting Bluetooth connections, restarting to connect, failing to connect, etc. 

My advice, if you have GC installed and working try not to ever update it. And garmin, I’ll be trying a wahoo next. After 5 or 6 edges and a few forerunners, you should have figured this out by now. There’s no excuse.";"2020-09-15T00:18:24-07:00";"https://itunes.apple.com/us/review?id=583446403&type=Purple%20Software";"583446403";103;"en";"NEGATIVE"
363;3701063482;"josh h miller";"https://itunes.apple.com/us/reviews/id39501792";"4.13.3";4;"Good app";"Has done everything I want consistently with only a few exceptions: the weather does not update to the watch very often. I’ve seen 2 hour gaps when the watch is showing it’s sunny out, but it’s actually way past sunset. A great feature is the graph overlay of HR/speed/altitude from an activity. I’d love to see a way to overlay those stats onto the GPS map, maybe by coloring the gps line to show the speed/HR/altitude (like the heat line used for current HR in the home screen of the app). That would be cool.";"2019-01-27T06:52:09-07:00";"https://itunes.apple.com/us/review?id=583446403&type=Purple%20Software";"583446403";95;"en";"POSITIVE"
364;6306611545;"Updates $^*%";"https://itunes.apple.com/us/reviews/id177454469";"4.33";2;"Since the attack...";"This app has been terrible since the crash. Noticeably terrible this week. It takes forever for the watch to sync. When I click to view different items it will give me a network connection error or take forever to show me the data. The page where all the items are supposed to be, a majority of them are missing, similar to how it was when the attack happened. Is this just a glitch from them working out the issues due to the attack or is this how it will be from now on?";"2020-08-11T07:24:15-07:00";"https://itunes.apple.com/us/review?id=583446403&type=Purple%20Software";"583446403";93;"en";"NEGATIVE"
365;6251151190;"trk123456";"https://itunes.apple.com/us/reviews/id249214564";"4.33";2;"Not happy";"I don’t like the changes and I’m not one of those who check their stats throughout the day. I found the new update is too confusing. Please don’t make such drastic changes again.

I have been using my Garmin for several years. All of a sudden it posted that it was down for maintenance. That was 3 days ago. I can’t enter any data or even look at passed data. I ended up having to delete the app at the risk of loosing all my data and then restoring it. Nothing changed!  I still can’t use the app.  Not good!  Please try to fix the problem.";"2020-07-28T04:26:57-07:00";"https://itunes.apple.com/us/review?id=583446403&type=Purple%20Software";"583446403";106;"en";"NEGATIVE"
366;6241314026;"helodriver";"https://itunes.apple.com/us/reviews/id29838627";"4.33";1;"Keeps crashing";"It won’t work at all. When it does open, there’s a “we’re down for maintenance” message that has been displaying for three days as of the time of this writing. This, coupled with the terrible performance of my Vivoactive watch (regularly quits recording activities during those activities; even a replacement version of the watch behaves the same way), makes wonder how Garmin can make such great aviation navigation products yet provide such a terrible consumer-grade navigation product experience. I’m never purchasing Garmin ever again after this, my first foray into Garmin’s consumer product line.";"2020-07-25T12:29:39-07:00";"https://itunes.apple.com/us/review?id=583446403&type=Purple%20Software";"583446403";94;"en";"NEGATIVE"
367;3751303689;"pooooootatoooooooo";"https://itunes.apple.com/us/reviews/id511013140";"4.15";3;"update :(";"the update removed elevation and the graph for pace is very off. not sure what was really changed in the update but would appreciate getting the elevation graph back and having the pace graph fixed. when looking at my splits on my activities, the “time” column would show me the total time with each mile, not the time it took to do the mile and although I just ran my farthest, no badge was given. there’s also a badge for running on the first day of year of the dog yet the badge can’t be awarded because it happened in the past.";"2019-02-09T10:50:55-07:00";"https://itunes.apple.com/us/review?id=583446403&type=Purple%20Software";"583446403";102;"en";"POSITIVE"
368;5155458736;"Silliness 2";"https://itunes.apple.com/us/reviews/id288727796";"4.25";4;"Yes!";"I like the watch. I just wish it would sync faster I lost my walking record because the second page did not sync to the home page for over an hour. So at midnight it started over and I lost my 46 day record. And since then the mileage quadruples it self so instead of walking 7000 steps for 3.4 miles it says I’ve done over 12 miles. I don’t know how to set that back right. But other than that I really like it!";"2019-11-16T20:09:18-07:00";"https://itunes.apple.com/us/review?id=583446403&type=Purple%20Software";"583446403";85;"en";"POSITIVE"
369;7566143658;"Coti D";"https://itunes.apple.com/us/reviews/id1092813811";"4.44";5;"Sleep tracking";"I’ve had this app and venu sq for about a year. Great app. This week suddenly there’s no sleep data each night until 1 am. It’s like it isn’t keeping records between bedtime and 1 am. I don’t know if it was from an update. Hope this gets looked at by developers. Thank you

Update: Sleep stopped tracking correctly and syncing very slowly. Please fix in an update.";"2021-07-11T17:51:32-07:00";"https://itunes.apple.com/us/review?id=583446403&type=Purple%20Software";"583446403";68;"en";"POSITIVE"
370;7216111446;"abigailruby23";"https://itunes.apple.com/us/reviews/id513675492";"4.41.2";5;"Watch is amazing, app is complimentary";"I was gifted my Garmin Fénix 6s and I immediately forgot and resented ever having my Apple Watch. This watch has amazing battery life. Only lose tracking under dense trees-that’s the only con I have so far. The glass literally does not scratch. I was so scared that it’d scratch because I’m clumsy but nope! The app is great for looking at my progress and all the other data the watch collects. All around great experience.";"2021-04-12T19:42:35-07:00";"https://itunes.apple.com/us/review?id=583446403&type=Purple%20Software";"583446403";76;"en";"POSITIVE"
371;6775338275;"taco man 02";"https://itunes.apple.com/us/reviews/id792900124";"4.37.1";5;"Garmin App";"I’ve had my 620 for years , but never used the garmin app on my phone(it’s for work). I recently had to get rid of my laptop which I used for charging and uploading runs. My new chrome book isn’t compatible with my watch so I put the app on my work cell phone. So far so good.  Very easy to use and hopefully won’t have any issues. Sorry I didn’t do this sooner   😁";"2020-12-20T12:20:36-07:00";"https://itunes.apple.com/us/review?id=583446403&type=Purple%20Software";"583446403";75;"en";"POSITIVE"
372;6738689738;"DixonJS";"https://itunes.apple.com/us/reviews/id253839499";"4.37.1";3;"My Experience";"Great features for health and fitness. Does everything and more. The problem I have is I own a IPhone 11 and anytime I open the connect app my phone goes to shxx. The screen continues to freeze apps open and close typing becomes a pain. I reset my phone numerous times to include factory reset and still is a problem. I am sure it’s not the phone because I deleted the app and it worked perfect. Other than that I love what the app gives me as far as data and tracking.";"2020-12-10T11:34:58-07:00";"https://itunes.apple.com/us/review?id=583446403&type=Purple%20Software";"583446403";92;"en";"POSITIVE"
373;6706974677;"Camplou";"https://itunes.apple.com/us/reviews/id29159315";"4.37.1";5;"Garmin Connect with Fenix 6";"I have used this combo now for about 4 months and couldn’t be happier with how easy it is to use the Connect mobile app to review and edit my workouts. I wish I could say the same for the desktop version of Connect. It seems very hard to find the right edit cues to go in and add distance and elevation information to an indoor stationary workout .";"2020-12-01T11:53:55-07:00";"https://itunes.apple.com/us/review?id=583446403&type=Purple%20Software";"583446403";69;"en";"POSITIVE"
374;6133772748;"forgetmynicknameapple!";"https://itunes.apple.com/us/reviews/id1079092538";"4.32";1;"Non functional";"This has been the most frustrating app I’ve ever downloaded. I have a vivoactive 3 watch, downloaded the app to connect the watch to my phone. The app kept telling me that my phone couldn’t be connected because the watch couldn’t be found, the watch told me I’m already connected, my phone’s Bluetooth shows the watch connected. I delete the watch and reconnect for the 3rd time to see if the app will catch on, it works, but now I can’t get past the app setup screen. I hit next but nothing happens. 6 hours later, I’m still trying. This is so frustrating. This app is crap";"2020-06-28T17:05:03-07:00";"https://itunes.apple.com/us/review?id=583446403&type=Purple%20Software";"583446403";107;"en";"NEGATIVE"
375;5709152292;"Kelsey374";"https://itunes.apple.com/us/reviews/id164387638";"4.28.1";3;"Not good with iPhones";"I have the vivió smart watch and at least once a week I have to reset my watch, delete the app and restart/redownload in order for my watch to sync. I love the app otherwise. It offers free workouts and tracks exactly what you want it to track. With each update I get hopeful the problem will be fixed and with each update I end up disappointed. Maybe one day I can go an entire week with my watch and phone syncing without a problem.";"2020-03-24T20:27:30-07:00";"https://itunes.apple.com/us/review?id=583446403&type=Purple%20Software";"583446403";85;"en";"POSITIVE"
376;6774680637;"smilinggeek68";"https://itunes.apple.com/us/reviews/id108809893";"4.37.1";4;"Love it but would like to set my own step goals";"I love this Garmin app and have used it for four years.  I had a back injury 2 years ago and have been less active.  I would rate you a 5 except I would like to be able to set my steps goals according to doctor recommendations- which means much smaller and less often increment increases.  Please me meet my goals more often with this flexibility/functionality.  Thanks much for 4 yrs!";"2020-12-20T08:19:21-07:00";"https://itunes.apple.com/us/review?id=583446403&type=Purple%20Software";"583446403";71;"en";"POSITIVE"
377;5152753140;"Jprocket4";"https://itunes.apple.com/us/reviews/id260157911";"4.25";5;"Motivating";"The watch and Connect app are really fantastic. I’ve used Garmin watches for many years but the Forerunner 935 is the first I’ve used with the Connect app. All the data has been super motivating. The Performance Condition, Training Status, VO2 Max are all great. I PR’d in my last half marathon at 50 yrs old. Creating my own training workouts for custom speed work and intervals was key. Definitely worth the upgrade!";"2019-11-16T12:06:03-07:00";"https://itunes.apple.com/us/review?id=583446403&type=Purple%20Software";"583446403";73;"en";"POSITIVE"
378;4690155214;"T5M Indy";"https://itunes.apple.com/us/reviews/id27131314";"4.22.1";5;"Forerunner 35";"I recently bought the Forerunner 35 because I wanted something simple that tracked my runs and activity. It works great. And the Garmin app has great displays and information. Very helpful and much superior to the Fitbit app I had been using. 

I thought I was just getting a watch to track my running, but it also tracks steps, heart rate, encourages me to move if I’ve been sitting too long, etc.  Great product and I’m enjoying it immensely.";"2019-08-29T05:48:28-07:00";"https://itunes.apple.com/us/review?id=583446403&type=Purple%20Software";"583446403";79;"en";"POSITIVE"
379;3744388418;"jasnrx";"https://itunes.apple.com/us/reviews/id25329912";"4.15";4;"Good watch good app";"I’ve really enjoy my Garmin watch and this app has serviced it well. Sometimes it is a bit slower than expected, but most navigation moves along quickly.
Bluetooth connectivity is quite good at staying connected and reconnecting, but it had been a little spotty in the recent past.
I wish the sleep graphs had better time markings and a landscape mode.
Frequently, the watch fails to get weather data, but I don’t know if it is the watch or the app.";"2019-02-07T13:49:41-07:00";"https://itunes.apple.com/us/review?id=583446403&type=Purple%20Software";"583446403";81;"en";"POSITIVE"
380;5225497715;"18 Burgundy Explorer";"https://itunes.apple.com/us/reviews/id634627119";"4.25.1";1;"Constant reconnect with Fenix 5x";"Every time I open the connect app, I have to tell it which device I am connecting for the first time. This was never an issue before, and the watch shows that it is properly connected to the phone.  My notifications still come through fine.  Just the app requires me to tell it that I am using a fenix 5x every single time I open the app, and I can not get it to stop doing this.  

Also, why does the watch require an app to connect Bluetooth? It’s Bluetooth, and should, at a minimum, connect to Bluetooth without the app in between causing issues constantly.";"2019-12-02T08:56:48-07:00";"https://itunes.apple.com/us/review?id=583446403&type=Purple%20Software";"583446403";106;"en";"NEGATIVE"
381;5207865533;"asfghgf";"https://itunes.apple.com/us/reviews/id238982429";"4.25.1";5;"Garmin instinct";"I have used Apple Watch, Fitbit, and Garmin instinct. I feel Garmin instinct is the best. It has all features I need, including tracking for tri, heart rate, steps, very long battery, with a very reasonable price. It doesn’t have those unnecessary features which will make your watch slow and cost lots of battery, including touch screen, color screen, or other useless software. Love Garmin instinct!";"2019-11-28T06:22:55-07:00";"https://itunes.apple.com/us/review?id=583446403&type=Purple%20Software";"583446403";66;"en";"POSITIVE"
382;4826094172;"Ds12334566890";"https://itunes.apple.com/us/reviews/id130473158";"4.23";1;"There should be a class action lawsuit.";"I’m a long time Garmin user. You’d think I would’ve learned my lesson, but no. I’ve owned the 800, 810, 820 and now 1030. Each new Garmin that is realized literally takes 2 years until the firmware is stable. And the. The discontinue the device and release a new one. 
They can’t seem to release new functionality in the firmware without breaking previously working functions. 
Seriously. I have worked in the Software field for 25yrs. If the software QA in our company was as bad as Garmins we would have been out of business years ago. But Garmin has no serious competition. Sure. Wahoo, Lezyne, and Pioneer have released “competing” units but they don’t do all the things that a Garmin does, when it works. 
If only there QA on the cycling products was as good as their Marine and Aviation product!
Or presumably their aviation and marine products are a helluva lot better or ships would be sinking and airplanes would be crashing constantly. 
Can’t believe it’s even the same company!!!";"2019-09-22T19:07:34-07:00";"https://itunes.apple.com/us/review?id=583446403&type=Purple%20Software";"583446403";172;"en";"POSITIVE"
