"";"id";"userName";"userUrl";"version";"score";"title";"text";"updated";"url";"app";"wordCount";"language";"sentiment"
84;6586438402;"Hshdkc";"https://itunes.apple.com/us/reviews/id32001436";"4.36";1;"Sleep Function Doesn’t Work";"The sleep tracking on this app does not work. It leaves large holes sometimes an hour or long throughout the night. Instead of show the sleep stage there is nothing. And that nothing is subtracted from your total sleep time. If I sleep 8 hrs and there is a 2 he hole, the app only counts me as sleeping for 6. I contacted customer service about this multiple times. They are terrible and you don’t get a response for weeks. They told me over a year ago this would be fixed but it wasn’t a hot priority at the time. It still has not been fixed. This feature is one that sets their watches apart from others but it does not work. You can’t edit the holes to show you were sleeping. I really want to track my sleep but I can’t because it’s never accurate. This is so disappointing and the lack of help from Garmin is even more disappointing.";"2020-10-29T06:13:09-07:00";"https://itunes.apple.com/us/review?id=583446403&type=Purple%20Software";"583446403";161;"en";"NEGATIVE"
85;5365084321;"Winniwoman";"https://itunes.apple.com/us/reviews/id281399926";"4.25.2";1;"Do NOT use/buy a Garmin products!";"I am on my 4th Garmin Vivoactive 3
because they have all failed within a year each.  When something goes wrong, Garmin replaces their watches with ""refurbished"" watches that were originally sent back because something went wrong.  Clearly they don't fix the problems because all the ""refurbished"" watches I have been sent fail. There is also no ability to call 911 from the watch as there is from other watches.

As for the Connect application, it is also a bust.  In 4 years approximately half of the sleep recordings have been grossly wrong.  The mobile app freezes constantly and a hard boot and a reconnection routine is necessary to get it to sync.  I would never have started down the Garmin path with both the watch and scale (which I also had to replace in the first year) had I known how unreliable are all their products.";"2020-01-05T09:54:50-07:00";"https://itunes.apple.com/us/review?id=583446403&type=Purple%20Software";"583446403";147;"en";"NEGATIVE"
86;6241881826;"WelshyinUsa";"https://itunes.apple.com/us/reviews/id261606611";"4.33";1;"Latest version crashes on an iPhone SE.  Doesn't work in landscape mode on IPads.";"The app is generally ok but there are a few major issues:

1) the app is only made for an iPhone and as a result it will not work in landscape mode on an iPad.  It would be sensible to have the ipad support where graphs and data could be displayed more clearly.

2) the gui on the iPhone/iPad is really not intuitive.  You have to scroll around to figure out where the 'connect/upload' button is.  A user interface for a device like this should have a simple 'upload' as the first menu item as this is what most people do.  The graphs and stats should all be laid out logically.  Like a simple window that has 1. Health data, 2. Sports data and the sub catabolise under there such as health->graphs, health->averages. 3. Watch screens

3) the most important data should always be displayed on the first screen.  Ie calories burned, steps taken, avg HR, max/min HR, resting HR. Miles run, etc

I know there is a lot of data but just adding a mess of screens makes it very hard to navigate and I am incredibly computer literate.  If Garmin is to compete s space they need to up their game and get better at supporting a piece of hardware.  They are not the only hardware in the market and software is what differentiates now !!";"2020-07-25T16:41:36-07:00";"https://itunes.apple.com/us/review?id=583446403&type=Purple%20Software";"583446403";228;"en";"POSITIVE"
87;5558472528;"Brooks Ghost";"https://itunes.apple.com/us/reviews/id276116654";"4.27";5;"Audio Prompt Turning Off by Itself(Repaired)";"After update fixed issue changed from 3 Star to 5 Star, definitely a great App with a lot of useful info for Garmin user’s. 

This has been a great app!! Have truly enjoyed using it. But ever since the latest update the audio prompt keeps turning off on it’s on. I’ve used this App with my Garmin watch for 3 years now and no issues with audio prompts they worked all the time. Now I have to remember to set them before every run and they’ll respond 1 time then it turns off again. Very annoying!! I use the audio prompts all the time. Need another update to fix this issue. Thank you!";"2020-02-20T16:20:07-07:00";"https://itunes.apple.com/us/review?id=583446403&type=Purple%20Software";"583446403";113;"en";"POSITIVE"
88;5383525561;"Runner Tim";"https://itunes.apple.com/us/reviews/id739998758";"4.26";5;"Fantastic interface";"As a new runner (in the sense I’m finally taking it seriously and committing to a routine) this is a wonderful addition to my training.  I purchased a 945 forerunner and thus far have only used it to track runs on roads and trails.  The data syncs within minutes of the workout being completed and is really comprehensive even without having a chest hrm.  My watch automatically updates, I can easily view my previous runs, track miles of my shoes durability, and get a better picture of my sleep schedule/ quality.  Absolutely no complaints thus far!  Garmin has made a lifetime customer out of me.";"2020-01-09T20:56:13-07:00";"https://itunes.apple.com/us/review?id=583446403&type=Purple%20Software";"583446403";105;"en";"POSITIVE"
89;7950995673;"Ball in a statement";"https://itunes.apple.com/us/reviews/id300238778";"4.48";5;"Wish gear menu was more clear";"Love the app, I just have one suggestion. I wish the gear option was more clear about which shoes are retired. The screen has the same color for all the shoes and it's unclear which are active, which I used last, etc. I really like the color for the mileage (green for under the mileage limit and orange for over). I think if the background was slightly greyed out or something that would be much better, idk. I think adding a last recorded activity field for each shoe would be great too. I consider that to be more important then when I bought the shoe.

Anyway, thanks for a great product.";"2021-10-24T19:40:33-07:00";"https://itunes.apple.com/us/review?id=583446403&type=Purple%20Software";"583446403";111;"en";"POSITIVE"
90;5720789736;"bfbatp";"https://itunes.apple.com/us/reviews/id1102692452";"4.28.1";5;"Way better then FitBit";"Got Vivoactive 3 for Christmas and love it. 
I have had 3 FitBit’s and all broken faces, called them again and asked if they had a product that could hold up for people who work hard. What they said well you should buy another one and here is a discount, I said why they didn’t seem to hold up, well we can’t replace the one you have as it’s been 14 months. ( after taking pic of all three broken ones and sending ) I said ok time to fined something better and I did. This thing is great and tuff, I work hard and it has held up great even used it to play golf. I’m glad I switched to a much better product. 
Dan";"2020-03-27T04:50:06-07:00";"https://itunes.apple.com/us/review?id=583446403&type=Purple%20Software";"583446403";126;"en";"POSITIVE"
91;5479286792;"b7426";"https://itunes.apple.com/us/reviews/id27071886";"4.26";3;"Lots of good, but buggy";"I have a vivo style and the app loses connectivity with the device quite often. Is it the device? is it the app? hard to say but sometimes it wont sync even though im still getting notifications on the watch so something os connected. ive had to re-setup the watch several times now because the app has somehow reset itself. it takes just a minute, but its annoying. phone calendar support is ok but without any filtering mechanism, a lot of noise gets sent to the phone. anyways, i love the promise of the app and the hybrid smartwatch category. we’re just not really there yet in terms of things all working. note im not even mentioning all the little gaps in the biometic data that is clearly still a work in progress.";"2020-02-02T07:40:05-07:00";"https://itunes.apple.com/us/review?id=583446403&type=Purple%20Software";"583446403";133;"en";"POSITIVE"
92;7704528571;"bmwgsar1200";"https://itunes.apple.com/us/reviews/id415536956";"4.46";2;"Update issues please fix";"I have the Garmin Fenix 6 watch, the main reason I have this app.  I do not know why the majority of times there is an update the temperature does not work on my watch.   I have all the other functions except this one.  The high/low and now temperatures are just blank.  Usually this gets resolved within a few days and I let it go.  However, it has now been a few weeks and the temperature readings are still no absolute me on my watch.  

    Garmin, you are an established party in this workspace.  Why does this continue to happen.  I am really trying to avoid going to another brand but if this continues to be an issue I will have no choice.  

     Please fix whatever the reason is for the temperature not being available whenever there is an update.";"2021-08-17T14:01:55-07:00";"https://itunes.apple.com/us/review?id=583446403&type=Purple%20Software";"583446403";140;"en";"NEGATIVE"
93;6026784542;"The Hamigans";"https://itunes.apple.com/us/reviews/id415417154";"4.31.1";4;"Latest update";"After installing the latest update (on May 29th or something close to that) my phone no longer connects to my 520 plus. The blue tooth will connect via my iPhones settings but the app will not recognize it. I spent 30+ minutes uninstalling, resetting, and syncing to no avail. Hopefully a new update will fix it.

Update: I final got the app to see the edge 520 plus. I used my iPad that operated without any problem then went back to the iPhone where at long last it connect. Over all I like this app but I don’t know why it decided to forget my device after 7 months and then the reconnect process was not seamless. So I bumped the star rating up accordingly";"2020-06-02T11:03:09-07:00";"https://itunes.apple.com/us/review?id=583446403&type=Purple%20Software";"583446403";125;"en";"NEGATIVE"
94;6594012055;"JenJenPirate";"https://itunes.apple.com/us/reviews/id699512013";"4.36";3;"Expensive watch!!!";"I have an Apple iPhone and have the Garmin Forerunner 735XT watch. Two days ago the app was down for a server issue but I think there are still issues, just no message indicating as such. My “synced” step count is the only thing being displayed but it’s my numbers from two days ago, not current. No other information will display on the app. And, my watch battery drains is about 1 day when it used to last about 1 week. The watch is slow to respond to anything, taking about 5 seconds where it used to be near immediate response to button pushes. I’ve done all the troubleshooting suggested on the website. I think it’s a server issue and the attempts to sync are draining the battery. Please address.";"2020-10-31T07:51:46-07:00";"https://itunes.apple.com/us/review?id=583446403&type=Purple%20Software";"583446403";130;"en";"POSITIVE"
95;7655922244;"Me23157gshq";"https://itunes.apple.com/us/reviews/id316494299";"4.45.1";5;"Great for running";"I’ve been using this for past couple months and I’ve loved it! Gives way more data and breakdowns for running than Strava which I used before. Works seamlessly with the watch and doesn’t seem to have any bugs that I’ve noticed. The only thing I wish it did better is allow more formatting of your Garmin watch in the app itself rather than trying to play with it on your wrist. Being able to preset more functionalities and customization (such as customizing activities and their displays) on the app then uploading the changes to the watch would be a game changer.";"2021-08-04T17:42:51-07:00";"https://itunes.apple.com/us/review?id=583446403&type=Purple%20Software";"583446403";101;"en";"POSITIVE"
96;5436782805;"HawaiiHockeyMama";"https://itunes.apple.com/us/reviews/id574545207";"4.26";1;"About to give up on Garmin";"For the last 5 years I have used a Garmin fitness tracker, and was always very happy with the ease of use of the tracker and the app. I have highly recommended my tracker to friends, and they have gotten one too! However, for the last 2 months, I have had to re-sign in to the app just about every day. It’s gotten extremely frustrating. Half the time, it won’t even let me sign in. Every attempt takes a few minutes. I can’t tell you how many hours of my life I’ve wasted trying to connect to this app. I’m about ready to give up on Garmin altogether since the app has become almost useless to me. I’ve been considering just getting an Apple Watch instead. I’d hate to lose all of the stats I’ve been tracking for the last 5 years though! So please, do something about this problem! I know I’m not the only one!";"2020-01-22T17:08:06-07:00";"https://itunes.apple.com/us/review?id=583446403&type=Purple%20Software";"583446403";157;"en";"NEGATIVE"
97;3656450770;"sli37";"https://itunes.apple.com/us/reviews/id110472693";"4.13.3";2;"Hardware works, software falls short";"My vivofit HR is really accurate when it comes to heart rate (save the occasional blip). The software, however, leaves a lot to be desired.

My biggest gripe is that all of my activity shows up on the wrong day. On the watch the activities are correct. The time zone and date on my watch are correct. The time zone and date on my phone are correct. But no matter what I’ve tried, all activities show up a day ahead in the software. This basically makes the tracking useless. The point of data is for it to be accurate.

If you’re into data, you’ll also find that the mobile app doesn’t really let you splice and dice how you may wish. It’s a high level dashboard and nothing more.

You may also find that randomly your data will disappear, which make it really scary to try any suggestions that tech support throws your way.

For now the Garmin is a great tool to help me stay on track in my workouts, but other than that the only reason I use the software component is to sync my activity so I can get “points” in my employer’s healthy incentive program. I have never been able to use it for more than that because of persistent issues. (And yes, I have updated, uninstalled, and reinstalled).";"2019-01-16T04:21:50-07:00";"https://itunes.apple.com/us/review?id=583446403&type=Purple%20Software";"583446403";223;"en";"POSITIVE"
98;7038212909;"mrowland.11";"https://itunes.apple.com/us/reviews/id113102519";"4.39";5;"This App Does Everything";"I upgraded from a Fitbit Charge 3 to a Garmin Vivoactive 4s. The appearance of the watch is more attractive, which to be honest is the main reason I upgraded. I had no idea all of the other features I was getting. 

We are a pretty active family, so having all the extra activities like SUP, Snowboarding, hiking, not to mention the options between an outdoor run, treadmill use (it calibrates to your treadmill distance!) and indoor walking. The strength activity COUNTS YOUR REPS FOR YOU!!! 

Lastly, features like Pulse Ox for high altitude activities, body battery, *accurate* gps tracking and active minutes have made me a true convert.";"2021-02-25T12:52:02-07:00";"https://itunes.apple.com/us/review?id=583446403&type=Purple%20Software";"583446403";109;"en";"POSITIVE"
99;5953221883;"BrokenBranch";"https://itunes.apple.com/us/reviews/id136318828";"4.30";5;"Impressed All The Way";"Have had my Garmin Vivoactive Fitness watch for 3 weeks. Best and smartest purchase for fitness I have ever made...because it keeps me active and moving. After wearing a Fitbit for a month I didn’t like the way it kept my information. How the watch felt on my wrist...with golfing it was not comfortable. Sleeping the worst
This Garmin watch I can hardly feel and it is all day tracking and all night.
When a text comes in I get the text.
Listening to my Apple music on a run is great too. 
My husband had bought his first and told me how he liked it and I love mine. Looking to keep track of my laps coming up....hopefully.";"2020-05-16T07:23:03-07:00";"https://itunes.apple.com/us/review?id=583446403&type=Purple%20Software";"583446403";119;"en";"POSITIVE"
100;5345723521;"its spectacular";"https://itunes.apple.com/us/reviews/id25008115";"4.25.2";4;"Great! New update is bad";"I recently updated my phone, and it updated this app also. I had to re log into my account, no big deal. I also had to completely re set up my app data, which I was not too bothered by. I looked at the fitness calendar, and all my data was gone. Just blank panels. A years worth of fitness and hikes, for all the data to be wiped away on new years. I normally make a total of yearly miles, steps, all of that, but because of this data wipe, all of that is gone. Other than that, the app is great and I would recommend it to anyone, and the devises are great. Sometimes a bit inaccurate, but that is because I have a older model.";"2019-12-31T23:21:49-07:00";"https://itunes.apple.com/us/review?id=583446403&type=Purple%20Software";"583446403";128;"en";"POSITIVE"
101;5572502870;"bbboioooi";"https://itunes.apple.com/us/reviews/id1069294025";"4.27";1;"Sleep measurement is inaccurate";"It is completely incorrect for my sleeping stat. For a couple of days, I didn’t sleep over 6 hours but Garmin vivomove hr indicated my sleeping duration beyond my actual ones. For example, yesterday, I slept at 2 AM and woke up at 7 but my Garmin said that I was sleeping for 10 hours from 3:41 AM to 1:50 but I already woke up and check the app before that time at 7AM ????. I could not sleep well that night to because of too much caffein but they said my deep sleep was more than 1 hour. It happened days before too but the previous day is the worst counting ever. 

My friend’s Garmin app on samsung is totally fine with just a little bit inaccuracy. The residual is only few minutes. He also uses Vivoactive Hr.

 Please fix this bug. I feel super annoyed about the completely wrong stat like this. The most important tracking for me is the sleeping duration.";"2020-02-23T19:49:57-07:00";"https://itunes.apple.com/us/review?id=583446403&type=Purple%20Software";"583446403";164;"en";"POSITIVE"
102;5418328082;"Lethal-Onez";"https://itunes.apple.com/us/reviews/id213553237";"4.26";5;"Love It";"I purchased a Garmin Fenix 5 Plus and I absolutely love the watch. What makes it even better is the App. The App really goes well in supporting the watch, integrating capabilities with functionality, while meeting the needs of the user/watch wearer. The App is responsive and has never frozen up or stopped working for no reason. The App always syncs with my watch without any issues and I have never second guess the integrity of my data from the watch to my phone. I love how you can share data with other Apps like Strava, MyFitnessPal and many other Apps. I recommend a Garmin, and I absolutely recommend using the App.";"2020-01-18T02:17:16-07:00";"https://itunes.apple.com/us/review?id=583446403&type=Purple%20Software";"583446403";112;"en";"POSITIVE"
103;5296176516;"Texmur";"https://itunes.apple.com/us/reviews/id169358982";"4.25.2";5;"Won’t connect to Bluetooth";"Updating my rating to 5 stars. The APP pointed me to a very helpful troubleshooting video that has resolved my Bluetooth connection issue. I still have no idea why it stopped connecting but now happy that the issue seems to be resolved. Thank you.

I have had my Vivosmart HR for several years enjoy it. Ever since your most recent APP update I can no longer connect to Bluetooth. Your website seems to be blaming it on IOS 13 but my iPhone is only on IOS 12.4.4

Please correct this issue! I also have the Approach S20 and it still connects via Bluetooth with my IPhone so it must be a vivosmart HR problem?";"2019-12-20T07:58:53-07:00";"https://itunes.apple.com/us/review?id=583446403&type=Purple%20Software";"583446403";114;"en";"POSITIVE"
104;4819367427;"lorenzocfi";"https://itunes.apple.com/us/reviews/id207760522";"4.23";1;"Unbelievable bad!";"There’s a ton of complaints online regarding  several separate issues: “Edit My Day” does not work properly. It hasn’t worked in forever. If you edit the order of your day entries, and save it, it will only be temporary; sometimes it retains your saved setting for a few minutes, sometimes for that day only. Also, the inability to sync properly with MyFitnessPal, by not doing it automatically (as it should) but by having instead to “pull” down to refresh every single time. Also, within the Garmin app, calories count does not work (again, have to refresh manually, and if you forget to “pull” before midnight, the records are now gone!) Sleep also does not work: if you happen to go to bed late (after midnight) you have the chance of no sleep recorder at all, but when it does it shows solid straight sleep (as in dead/no different type of sleep).";"2019-09-21T12:41:42-07:00";"https://itunes.apple.com/us/review?id=583446403&type=Purple%20Software";"583446403";151;"en";"POSITIVE"
105;6827617975;"AKShellBell";"https://itunes.apple.com/us/reviews/id18914250";"4.37.1";5;"Love GARMIN";"I’m on my 3rd wearable, my last one has been retired to my dog and it’s awesome and so much fun to be able to track him! The Garmin badges have been a source of motivation for me, especially this last year with all races going virtual, I’m addicted to them! I love my Garmin Fenix 5s, at first I thought it was to luxurious for me ... poor thinking on my part! I use so many aspects of this watch and learn so much about my body with it. Not to mention I can download fun routes that others have gone on before me and my watch leads the way! Customer service is an after thought for most companies, NOT Garmin! Keep up the good work Garmin team!";"2021-01-03T14:35:57-07:00";"https://itunes.apple.com/us/review?id=583446403&type=Purple%20Software";"583446403";129;"en";"POSITIVE"
106;5079752417;"Mother Mucca";"https://itunes.apple.com/us/reviews/id38337634";"4.24.1";2;"Buggy and unintuitive";"It would be a 3 star app if it were less buggy. I’ve had the watch for over a year. The watch broke, and had to be replaced. When the new watch came, it would have to be turned off and on repeatedly to sync. I thought it was the watch, until they released the latest software update. Now it works. Every app update, I’m both excited about possible fixes for existing bugs, and wary about new ones. 

It would be a four star app if it had a little more flexibility. For example, I do martial arts. I can select “apnea diving” or video games as activities, but not martial arts, and there’s no way to add a custom activity. Or storing custom body measurements, like waist circumference or body fat percentage. Can’t do it. 

If it was more intuitive to use, that would be even better. There are four or five places for setting preferences, including one where there aren’t actually any settings to set. Cleaning that mess up would be a simple thing to do, but they haven’t done it. 

So, I guess, the concept is good, and it works mostly okay. But I don’t like the app very much, for reasons that would be easily fixable, if they were inclined. But Garmin doesn’t seem to be inclined.";"2019-11-03T06:57:20-07:00";"https://itunes.apple.com/us/review?id=583446403&type=Purple%20Software";"583446403";221;"en";"POSITIVE"
107;4396509361;"Amber2724";"https://itunes.apple.com/us/reviews/id32034480";"4.20";3;"Sleep update is NOT an improvement";"I understand introducing new features; an app must grow and evolve. However I’m not sure why you’d make this piece of it LESS intuitive and useful. 

The info is now on more than one screen (why?), which I didn’t think to scroll down until the next day, the time dots are gone (why?), the movement chart no longer extends slightly before and after my sleep start and wake times (why?) which always helped me determine if those times needed to be edited, the daily comparison of a week’s data is completely different (why?).

I no longer run, so this is basically the biggest feature I use this watch and app for (outside of tracking steps). This is NOT an improvement. If this was an experiment, it was not successful.";"2019-07-01T05:34:48-07:00";"https://itunes.apple.com/us/review?id=583446403&type=Purple%20Software";"583446403";129;"en";"NEGATIVE"
108;5480085184;"Jmich_1_TX";"https://itunes.apple.com/us/reviews/id101640299";"4.26";5;"A very good app.";"This app works very well for keeping track of the calories burned.  Still getting used to how the calculations are made concerning active vs rest calories.   I use a HRM strap when exercising and while it counts the HR while working out it doesn’t seem to automatically add that into the daily count for min/max.  

The sleep tracking seems to work well but it doesn’t add to the sleep amounts if there are significant amounts of awake time between sleep sessions.  Also, there are time when I am awake but not really moving and the watch/app count it as sleep.  

All-in-all I recommend this app to anyone using a Garmin device.";"2020-02-02T12:05:44-07:00";"https://itunes.apple.com/us/review?id=583446403&type=Purple%20Software";"583446403";111;"en";"POSITIVE"
