"";"id";"userName";"userUrl";"version";"score";"title";"text";"updated";"url";"app";"wordCount";"language";"sentiment"
0;1238456639;"jkg4";"https://itunes.apple.com/us/reviews/id36624489";1.4;3;"Great scale, mediocre app";"*UPDATE: Since I wrote my initial review almost a year ago, there have been no app updates. It's not optimized for the iPhone 6, crashes more frequently, sometimes is slow to receive new measurements from the scale, doesn't support the Share Sheet, etc. so I'm knocking off one star.*

The weighing scale itself is great, and the app is decent but needs some improvements. You can't update the scale's wifi settings without setting up the scale from scratch. The user interface could be enhanced to make it more user friendly.";"2015-08-05T08:55:13-07:00";"https://itunes.apple.com/us/review?id=588688639&type=Purple%20Software";"588688639";90;"en";"POSITIVE"
1;1106861306;"Pstyle777";"https://itunes.apple.com/us/reviews/id28070490";1.4;1;"It crashes constantly";"Just like some other people's feedback, the app crashes when you try to look at the historical data of the bottle feedings. This app can be very useful, especially if you buy the Withings baby scale but this bug renders the entire app basically useless. I have given this feedback repeatedly for 3 months without a response, any updates nor any feedback that they are working on the issue. Knowing how many bottles or how many ounces your baby is drinking a day is important data. There are other apps that do this... Though it doesn't automatically record the weight, I have switched over to Similac baby journal as it keeps all the information I need all in 1 app. This is truly such a shame... Seems like a simple fix but does not appear to be of any concern. I love the Withings products... I use the pulse health mate, the adult scale, the baby scale & the baby monitor. This app is the only product of theirs that I am truly disappointed and I have given them plenty of opportunity to fix this prior to my post.";"2014-12-02T07:57:44-07:00";"https://itunes.apple.com/us/review?id=588688639&type=Purple%20Software";"588688639";189;"en";"POSITIVE"
2;790007934;"Momma-doodles";"https://itunes.apple.com/us/reviews/id37800366";1.4;3;"Really needs diaper changing tracking function";"This is just as important as knowing when the baby last fed.";"2013-04-18T01:16:22-07:00";"https://itunes.apple.com/us/review?id=588688639&type=Purple%20Software";"588688639";12;"en";"POSITIVE"
3;1219398554;"rachel_eff";"https://itunes.apple.com/us/reviews/id42767670";1.4;1;"Look at Withings App history!!";"Withings has such a poor support history. Geez. After the last iPhone update trying to look at weights in list mode basically results in the app crashing. You can only view weights via the graph!
I have owned several Withings products and they are all garbage. I will be returning the scale ASAP, thank goodness I bought it at a store with an excellent return policy and not through withings who has a terrible track record for returning customer inquiries and fixing issues!";"2015-06-28T20:34:03-07:00";"https://itunes.apple.com/us/review?id=588688639&type=Purple%20Software";"588688639";83;"en";"POSITIVE"
4;1126372127;"Matt47112001";"https://itunes.apple.com/us/reviews/id430572394";1.4;1;"Do not expect much!";"This app only works for the sync with the kid's scale, forget the rest. All other functions may, if you are lucky, work for some time but they will then (suddenly and without any tangible cause) cease to operate, making all your history data (in our case of 7 weeks) useless because you will have to switch to another app that actually works. Use this only for the scale sync, nothing else. Support does not work, in fact I doubt that it exists...";"2015-01-07T20:16:32-07:00";"https://itunes.apple.com/us/review?id=588688639&type=Purple%20Software";"588688639";83;"en";"NEGATIVE"
5;865537294;"New Daddy Gizmo";"https://itunes.apple.com/us/reviews/id349430470";1.4;5;"Sync was a good surprise";"Yes, u can sinc with other phones.  It does it automatically.  If u want to track weight and know how feelings are going, great device.  It is expensive but so easy to track.  If you are standing on scale and subtracting your weight...then get this scale!";"2013-09-04T13:58:18-07:00";"https://itunes.apple.com/us/review?id=588688639&type=Purple%20Software";"588688639";46;"en";"POSITIVE"
6;985932752;"mkpub";"https://itunes.apple.com/us/reviews/id30160276";1.4;2;"Frustrating Buttons. Breaks Under iOS 7.1.1";"Similar to another Withings app, Healthmate, this app's buttons are very difficult to tap. It has strong ""right-hand"" bias and even using the right hand can often require multiple taps to make it respond.

May 1 update: It breaks under 7.1.1. Upon opening the table to review/delete a record, the app crashes.";"2014-05-01T10:53:03-07:00";"https://itunes.apple.com/us/review?id=588688639&type=Purple%20Software";"588688639";52;"en";"POSITIVE"
7;931484447;"RS99MA";"https://itunes.apple.com/us/reviews/id124434882";1.4;5;"Cool idea!";"Easy to put together and use. Great for times in between doctor appointments when you're curious to see how your child is growing.";"2014-01-26T10:57:13-07:00";"https://itunes.apple.com/us/review?id=588688639&type=Purple%20Software";"588688639";23;"en";"POSITIVE"
8;1063964943;"Jadezano";"https://itunes.apple.com/us/reviews/id147765730";1.4;1;"App crash on viewing list of feeding";"When trying to get to the list of feedings the app crashes. Reinstall action of app does not fix this and it happens on multiple devices so it isn't a device problem. Please fix this issue. It has happened for at least the past 2-3 months";"2014-09-13T19:44:43-07:00";"https://itunes.apple.com/us/review?id=588688639&type=Purple%20Software";"588688639";46;"en";"POSITIVE"
9;1638577449;"Superwoman75";"https://itunes.apple.com/us/reviews/id158861374";1.4;1;"Update to the app to 64bits or it won't work with iOS11";"This app hasn't been updated in 4 years and won't work on any recent device (released after iPhone 5) when apple release its next major iOS version in September..
Please do something so that we can keep using the app with iOS 11.";"2017-06-09T04:20:11-07:00";"https://itunes.apple.com/us/review?id=588688639&type=Purple%20Software";"588688639";43;"en";"POSITIVE"
10;1573421546;"kkmanm";"https://itunes.apple.com/us/reviews/id108559703";1.4;3;"Update?";"Is this app still in development? Please update the app.";"2017-03-26T16:53:31-07:00";"https://itunes.apple.com/us/review?id=588688639&type=Purple%20Software";"588688639";10;"en";"POSITIVE"
11;912032048;"Design&Function";"https://itunes.apple.com/us/reviews/id208973501";1.4;1;"Poor UX";"The app crashed the first two times I tried to set it up on my iPhone 5S, so it saved two entries for my baby. It won't let you delete or edit any of your information once it's been entered. I'm going to try another app that's been more thoroughly developed.";"2013-12-20T08:50:14-07:00";"https://itunes.apple.com/us/review?id=588688639&type=Purple%20Software";"588688639";51;"en";"POSITIVE"
12;1573774966;"Koritenshi86";"https://itunes.apple.com/us/reviews/id270904256";1.4;1;"First use - crashed phone";"First time using it, the app crashed. I don't have time for that to happen before I even put information in. Shame, the other Withings apps are much better and I use those all the time.";"2017-03-27T02:43:19-07:00";"https://itunes.apple.com/us/review?id=588688639&type=Purple%20Software";"588688639";36;"en";"NEGATIVE"
13;1304704304;"Sasa Z.";"https://itunes.apple.com/us/reviews/id259325460";1.4;1;"So disappointed.";"I can't believe how terrible this app is. As other have commented, does not appear to have any stability with iPhone 6S/iOS 9. Random ""length"" updates happen. 30-40% of the time the weight does not upload.";"2015-12-22T18:35:01-07:00";"https://itunes.apple.com/us/review?id=588688639&type=Purple%20Software";"588688639";36;"en";"POSITIVE"
14;1267605592;"cookingwithwood";"https://itunes.apple.com/us/reviews/id42102163";1.4;1;"Great scale crappy app";"Avoid buying a $180 scale because Withings puts 0% effort in the app. It hasn't been updated since 2013 and it acts like it. I'm sorry I didn't pay attention to the app reviews before purchasing the scale 9 months ago.";"2015-10-05T20:26:03-07:00";"https://itunes.apple.com/us/review?id=588688639&type=Purple%20Software";"588688639";41;"en";"POSITIVE"
15;1803272742;"Allexp2016";"https://itunes.apple.com/us/reviews/id364247812";1.4;2;"I loved the app but they stopped updating it.";"I only give 2 stars, because it’s stopped working in iOS 11. All the history of 3 years just vanished :(. Please update the app.";"2017-09-22T01:34:13-07:00";"https://itunes.apple.com/us/review?id=588688639&type=Purple%20Software";"588688639";25;"en";"POSITIVE"
16;1156557832;"beck41644";"https://itunes.apple.com/us/reviews/id42097402";1.4;1;"Avoid this app";"Last update is 2013. No iPhone 6/6+ support so it looks awful.

App crashes when looking at historical data. It also stops working randomly for days at a time.";"2015-02-22T18:57:48-07:00";"https://itunes.apple.com/us/review?id=588688639&type=Purple%20Software";"588688639";29;"en";"NEGATIVE"
17;808297590;"p.goughary";"https://itunes.apple.com/us/reviews/id9820845";1.4;5;"Well done";"As I would expect a Withings App to be!";"2013-05-21T12:18:15-07:00";"https://itunes.apple.com/us/review?id=588688639&type=Purple%20Software";"588688639";9;"en";"NEUTRAL"
19;789384809;"Milakd";"https://itunes.apple.com/us/reviews/id129463377";1.4;1;"Inaccurate comparison";"I do not know where the get percentile but we just came back from docs exam and our kid is in 72 percentile. This app is saying he is in 25 percentile which is impossible! Wasted my time setting it up!";"2013-04-16T21:28:35-07:00";"https://itunes.apple.com/us/review?id=588688639&type=Purple%20Software";"588688639";41;"en";"NEGATIVE"
20;1276727733;"Bashik";"https://itunes.apple.com/us/reviews/id31879438";1.4;2;"Needs an update badly";"When the hell the devs going to update the app? Table view of the measurements crash the app instantly.";"2015-10-24T22:32:49-07:00";"https://itunes.apple.com/us/review?id=588688639&type=Purple%20Software";"588688639";19;"en";"NEGATIVE"
21;1881171884;"kcarr57";"https://itunes.apple.com/us/reviews/id495077007";1.4;1;"Please update to make compatible with iOS updates";"I keep records in this app and it's no longer compatible. Please update so I can use and access records";"2017-10-28T08:19:20-07:00";"https://itunes.apple.com/us/review?id=588688639&type=Purple%20Software";"588688639";20;"en";"NEUTRAL"
22;1595726478;"eugeniof";"https://itunes.apple.com/us/reviews/id29819574";1.4;1;"Used to be great, but years ago";"Does not recognize my kid anymore... only as good as a traditional dumb scale.  Not going to trust Whitings with any other products, if this is the way they support them.";"2017-04-23T04:08:55-07:00";"https://itunes.apple.com/us/review?id=588688639&type=Purple%20Software";"588688639";31;"en";"NEGATIVE"
23;1334999348;"Airmanos";"https://itunes.apple.com/us/reviews/id42169410";1.4;5;"Great app for stastistics";"Nice program and it is working great!";"2016-02-18T11:08:21-07:00";"https://itunes.apple.com/us/review?id=588688639&type=Purple%20Software";"588688639";7;"en";"POSITIVE"
24;782017728;"LaurenC20";"https://itunes.apple.com/us/reviews/id320377480";1.3;2;"Inaccurate";"Just what every parent wants to hear....that my breastfed 2 week old is ""overweight"".  Thanks, jerks.  My kid is 90th percentile across the board.  Not sure where their data comes from. I'm deleting this app and am glad I used my junk email address.";"2013-04-04T16:26:40-07:00";"https://itunes.apple.com/us/review?id=588688639&type=Purple%20Software";"588688639";44;"en";"POSITIVE"
26;744930167;"Sir Cubealot";"https://itunes.apple.com/us/reviews/id34933504";1.0;4;"Nicely done";"Very nice app, not to over crowded with info but just enough IMO. Works well on iPhone 5, wish there was an iPad version as well not just an iPhone on iPad but not everything can be perfect. Easy to use and straightforward.";"2013-02-05T07:53:15-07:00";"https://itunes.apple.com/us/review?id=588688639&type=Purple%20Software";"588688639";43;"en";"POSITIVE"
27;768503753;"BelleLizbeth";"https://itunes.apple.com/us/reviews/id302936948";1.3;1;"Didnt like it";"Complicated and not too useful";"2013-03-12T16:27:58-07:00";"https://itunes.apple.com/us/review?id=588688639&type=Purple%20Software";"588688639";5;"en";"NEGATIVE"
