"";"id";"userName";"userUrl";"version";"score";"title";"text";"updated";"url";"app";"wordCount";"language";"sentiment"
158;5746339725;"Marty List";"https://itunes.apple.com/us/reviews/id178386583";"5.7.4";1;"This app is awkward and crashes";"I've been using this app for a couple years, and it's still painful anytime I need to make changes. Either I can't get it to do what I want or it crashes. I'm a software developer & work in IT so this shouldn't be so difficult to use. Just now I tried to change the input settings for a TV and it keeps saying an unfortunate error occurred, with restart & close buttons. I updated to the latest 5.7.4 but I get the same error. Are the Logitech employees proud of the crap they are putting out?";"2020-04-01T07:43:11-07:00";"https://itunes.apple.com/us/review?id=626853860&type=Purple%20Software";"626853860";97;"en";"NEGATIVE"
159;4609666046;"mikepsyche";"https://itunes.apple.com/us/reviews/id34129332";"5.6.2";1;"The app is designed to frustrate you.";"I believe that it’s possible. They want you to buy their expensive physical remotes that are also as cheaply made as possible. Only a few have figured out the remote dilemma. Logitech is better than most. But it still disappoints. No way I’m throwing 300 bucks on their top of the line because I don’t trust them.

I would love them to surprise me. The standards are high though. Probably not going to happen.

There is one truly great remote out there. I’ll probably end up with that one. Sevenhugs. Weird name. Interesting innovative and very simple device.";"2019-08-12T23:09:26-07:00";"https://itunes.apple.com/us/review?id=626853860&type=Purple%20Software";"626853860";98;"en";"POSITIVE"
160;2362092796;"Tenpoundhero";"https://itunes.apple.com/us/reviews/id106513933";"5.3.3";4;"Please add custom remote control capability";"The only thing missing is an update to make your own custom remote control for every device added to the harmony. Also some cool features for new iPhones and 3d touch would be press and hold a remote button then slide to change it. For example if you could press and hold the volume button then slide so raise or lower the volume. That would be awesome!";"2018-03-29T22:08:22-07:00";"https://itunes.apple.com/us/review?id=626853860&type=Purple%20Software";"626853860";67;"en";"POSITIVE"
161;4965187252;"Silent Prey35";"https://itunes.apple.com/us/reviews/id238452718";"5.7";1;"Horrible , this product is a joke right !!!";"Software is horrendous. I have used Harmony n Logitech for 15 years and this version for a year or so. It is the worst and the remote doesn’t even work I have to use my phone and it’s 6 am in the morning before work and I am writing a review because I’m waisting my freakin time trying to delete and download app again to watch news for 5 fn minutes  before I shower.   Why the hell did Logitech go and make such a lazy non tested piece of garbage product.  Fix it today or it goes in the garbage and loose a family of customers";"2019-10-18T03:17:52-07:00";"https://itunes.apple.com/us/review?id=626853860&type=Purple%20Software";"626853860";106;"en";"NEGATIVE"
162;6499607730;"McDBurl";"https://itunes.apple.com/us/reviews/id35257577";"5.7.6";2;"Buttons stop working";"The rocker switch worked great to control my hue light brightness...until it didn’t work. Now I get an error when I try to reprogram those buttons to control the lights. Bummer.

I’m back; the rocker switch still doesn’t work. This is the worst app for an otherwise expensive remote. How can you have buttons on the remote that you can’t program or use?

I was able to update the rocker switch; thanks.";"2020-10-04T06:28:41-07:00";"https://itunes.apple.com/us/review?id=626853860&type=Purple%20Software";"626853860";72;"en";"NEGATIVE"
163;2959888399;"HardcoreDalcour";"https://itunes.apple.com/us/reviews/id111090599";"5.4.2";1;"Why?";"Why is this the most difficult thing to set up and control? What happened? I ALWAYS have to enter the IP address manually to connect.. if it ever works!!! Yes I’m using the 2.4ghz WiFi. I’m failing to understand why I have to do this every time I open up the app. I shouldn’t have to keep forcing a shutdown on the device to get it to work either, if that ever works!! There has to be a smarter way to go about doing this... the range of my WiFi reaches the neighbors house so there’s no problem with that. There needs to be an easier way... Again, why does this not work?";"2018-07-24T01:40:53-07:00";"https://itunes.apple.com/us/review?id=626853860&type=Purple%20Software";"626853860";113;"en";"POSITIVE"
164;2577687306;"PTRFRLL";"https://itunes.apple.com/us/reviews/id87026793";"5.4";4;"Good start, room for improvement";"The lock screen widget is by far the best part. Being able to quickly turn on an activity makes this app immensely useful. However, I wish you could rearrange the buttons on an activity screen, having to swipe through a few pages just to get to the volume is cumbersome. Great start, just keep improving!";"2018-05-21T08:53:20-07:00";"https://itunes.apple.com/us/review?id=626853860&type=Purple%20Software";"626853860";55;"en";"POSITIVE"
165;2111313764;"Terri8502";"https://itunes.apple.com/us/reviews/id28780841";"5.3.3";2;"Constantly loses connection to my WiFi and freezes";"The application loses connection to my WiFi all the time, so if I need to make changes I have to wait until it connects, sometimes rebooting hub and iPad, than make changes fast, because it will lose connection in the middle of a change. App also has a tendency to freeze all the time. Once set up it works great. I have a 100 mps connection and the device is close to the router, nothing else in house has issues.";"2018-01-21T03:42:18-07:00";"https://itunes.apple.com/us/review?id=626853860&type=Purple%20Software";"626853860";80;"en";"POSITIVE"
166;4096258330;"BigPapaP";"https://itunes.apple.com/us/reviews/id42801364";"5.6";4;"Good enough";"I dont understand the hate. I use the app when we dont have the remote available or if someone else has the remote currently. It works just fine for that. Perhaps not ideal for all the time remote use, but thats just a function of remotes being a specialized tool for the job. Overall a good app and the harmony remote combo itself is excellent and easy yo program.";"2019-05-03T15:23:13-07:00";"https://itunes.apple.com/us/review?id=626853860&type=Purple%20Software";"626853860";69;"en";"POSITIVE"
167;2313932131;"BigHowdy";"https://itunes.apple.com/us/reviews/id39551037";"5.3.3";1;"An exercise in frustration";"The general idea is good and getting it online was a breeze with this app. But this is a HORRIBLE user experience. Home entertainment setups are notoriously complicated and therefore you really need to structure the experience so you can intuitively find things. FAIL. There is no flow logic to where you make changes or how you set it up. It feels like the most random thing in the world. And as best I can tell, it doesn’t really let you program the physical Harmony remote to even use it as a universal remote. It’s obvious no one at the company uses this product.";"2018-03-16T17:55:20-07:00";"https://itunes.apple.com/us/review?id=626853860&type=Purple%20Software";"626853860";104;"en";"NEUTRAL"
168;1874553210;"cklopfen";"https://itunes.apple.com/us/reviews/id37592365";"5.2.2";1;"Complete disaster";"The hardware works well, but this app should never have passed any kind of quality assurance process. The remote control screens are horribly designed (if you can call them ‘designed’). There is no rhyme or reason as to why certain function are grouped together on certain screens. There are actual TYPOS on the UI.

Please make this at least a professional quality app. I own freeware written by teenagers that has better user experience design than this.

And what could be more important for a remote control app than user experience?";"2017-10-25T11:10:07-07:00";"https://itunes.apple.com/us/review?id=626853860&type=Purple%20Software";"626853860";91;"en";"POSITIVE"
169;7268203988;"desert voice";"https://itunes.apple.com/us/reviews/id388785314";"5.7.9";1;"Disappointed";"I bought a Harmony Hub because my mother, in the early stages of dementia, keeps messing up her tv and I was looking for a possible remote solution. However, this app has only managed to successfully connect to the Hub once and allows for no way to exit. You can just watch the ‘wheel of death’ and if you close the app and go back, it’s still there. You seriously need menus and ‘close’ or ‘cancel’ buttons. I can’t believe Logitech can’t do any better than this. If I could rate it zero, I would.";"2021-04-26T19:02:09-07:00";"https://itunes.apple.com/us/review?id=626853860&type=Purple%20Software";"626853860";95;"en";"POSITIVE"
170;6757009658;"JordanZr";"https://itunes.apple.com/us/reviews/id285228751";"5.7.7";1;"Don’t use this app to configure a new device";"I attempted and failed to configure a harmony hub with this app about 10 times. It would setup and move to a green light on the hub and fail to connect each time. After every single failed attempt you need to sign back into your harmony account and agree to all disclaimers again and again. 

Walked it over to the computer and had it setup in a matter of minutes. This app is terrible. Save yourself some frustration and just use a computer.";"2020-12-15T12:21:26-07:00";"https://itunes.apple.com/us/review?id=626853860&type=Purple%20Software";"626853860";83;"en";"NEGATIVE"
171;2945916502;"Namwob.77";"https://itunes.apple.com/us/reviews/id106037377";"5.4.2";4;"Good as a remote, terrible as a way to setup";"Does everything I want it to when used as an actual remote. No complaints. 

When setting up devices and activities, save yourself a migraine and use a computer and a USB cable rather than this app. Every single step requires a sync and it takes 50 times longer than it does on a computer.";"2018-07-21T13:10:08-07:00";"https://itunes.apple.com/us/review?id=626853860&type=Purple%20Software";"626853860";54;"en";"POSITIVE"
172;7513141663;"wjbmn";"https://itunes.apple.com/us/reviews/id124563255";"5.7.9";2;"Incredibly balky app";"I’ve had the Harmony Hub app for a few years, and I always dread having to use it. It’s the balkiest app I’ve used in a long time. It takes several tries to get it to recognize the hub and my home WiFi that it has recognized many times before; software updates routinely stall and time out, and you have to start again. Once you get past those stages and it’s finally working, it’s ok, but it’s a trial to get to that stage.";"2021-06-27T14:10:26-07:00";"https://itunes.apple.com/us/review?id=626853860&type=Purple%20Software";"626853860";84;"en";"NEGATIVE"
173;6953416190;"Mr. Baz";"https://itunes.apple.com/us/reviews/id39167871";"5.7.7";1;"Can’t connect hub to wifi w app - returned remote";"SO many attempts trying to get the new hub to connect to wifi.  Says device using the app to setup  must be on same wifi as the hub (it is), tried all troubleshooting steps, keep getting “cannot connect to wifi” even though, under Bluetooth, it shows the new hub as “connected.”  Infuriating when we have other hubs on the same network that were setup using the old Mac app that no longer works.  Returned the product and looking elsewhere.";"2021-02-04T08:14:13-07:00";"https://itunes.apple.com/us/review?id=626853860&type=Purple%20Software";"626853860";79;"en";"NEGATIVE"
174;4854086908;"Kmockspeed";"https://itunes.apple.com/us/reviews/id161328333";"5.7";2;"Very buggy and incomplete";"Logitech decided we couldn’t do this from the desktop or browser anymore. That lost a bunch of features. It’s also very buggy and does not sync well with remote. If I reorder activities, they don’t reorder on remote. Some activities get stuck in start screen. I could go on, but why. Been using Harmony’s for years. Have had the hub for 4 years. You would think usability would get better. It’s gotten worse with every programming shift.";"2019-09-28T09:45:02-07:00";"https://itunes.apple.com/us/review?id=626853860&type=Purple%20Software";"626853860";77;"en";"NEGATIVE"
175;6699569605;"90404mike";"https://itunes.apple.com/us/reviews/id85291846";"5.7.7";1;"Garbage";"Red light blinked for days but was never able to connect to Verizon Fios WiFi - stuck on “preparing your hub”.  At least I can install with my Mac ... lol jk they don’t support Catalina (over a year old) and up ... what a joke.

EDIT: If you can’t find hub and you are using an Apple device then it’s too new. This essentially only supports old iPhones and iOS before Catalina. Finding hub worked as expected on an iPhone 7. After setup you can use your normal phone for the app which is to say the least not a great app.";"2020-11-29T09:16:13-07:00";"https://itunes.apple.com/us/review?id=626853860&type=Purple%20Software";"626853860";103;"en";"POSITIVE"
176;6979640616;"andersix";"https://itunes.apple.com/us/reviews/id107457662";"5.7.7";2;"Years of good & bad & ugly";"The Harmony hub is my third Logitech remote. 
Hardware keeps getting better, but why, Logitech can you not, as a company hire good software/app developers?
This app is flaky. Many times it ""looses Internet"" connection even though Internet is fine a reboot of the hub fixes this. But this necessary reboot does not bode well for what should be an always on stable device.
App UX at best is not very well thought out, but honestly, just horrible.
After initial setup you have to go back to what is the initial setup screen to add more devices or activities. 
So. I give you one star for having decent hardware, and one star for an app that barely gets the job done.  
If I were a decider at Logitech I would kill this app and start its development from scratch.";"2021-02-10T18:26:15-07:00";"https://itunes.apple.com/us/review?id=626853860&type=Purple%20Software";"626853860";139;"en";"POSITIVE"
177;4306788706;"enigma_acn";"https://itunes.apple.com/us/reviews/id150135221";"5.6.2";1;"What a joke!";"Be aware before you invest in this product. Their software implementation is just awful and amateur for the price tag! The app is slow, horribly designed and confusing. And their implementation of smart home devices, like smart lights is simply a joke! I bought this to control my media room devices and lights, and even with a light button on the remote controller I’m super limited as to how and what i can control. I’m super disappointed in this product. I would think twice next time before buying Logitech.";"2019-06-12T17:30:07-07:00";"https://itunes.apple.com/us/review?id=626853860&type=Purple%20Software";"626853860";89;"en";"POSITIVE"
178;1844858584;"Blazman11";"https://itunes.apple.com/us/reviews/id20935218";"5.2.2";1;"Awful awful awful awful awful software";"0 star review. So tired of fighting this garbage software. The 8 year old Harmony One was perfect and they’ve since replaced it with this total abomination. Good luck if you have multiple hubs. Your phone won’t pick up both hubs connected to same network and you won’t be able to edit or add devices through either the phone or the PC desktop software. You’ll get stuck in endless login loops. Did I mention this software is terrible?  Save your money and buy the $46 Logitech remote without a hub.";"2017-10-12T18:05:18-07:00";"https://itunes.apple.com/us/review?id=626853860&type=Purple%20Software";"626853860";90;"en";"POSITIVE"
179;7110190154;"localhawaiian693";"https://itunes.apple.com/us/reviews/id123949900";"5.7.7";1;"0 Stars";"Just to give some background, I worked as a custom home integrator for 4 years. Meaning, I’ve worked and programmed control and automation systems for a living. All of which are far more intricate than Logitech Harmony. That being said, this is the worst program I have ever seen. I’ve tried the simple setup process dozens of times only to have it crash and say “This is unfortunate”. It’s almost like they know their software is garbage. I am stunned at the incompetence of a company as big as Logitech. A total WASTE of $300.";"2021-03-16T10:59:27-07:00";"https://itunes.apple.com/us/review?id=626853860&type=Purple%20Software";"626853860";95;"en";"NEGATIVE"
180;3635276487;"Bullgator255";"https://itunes.apple.com/us/reviews/id33913216";"5.5";5;"Works perfectly";"I recently purchased the Harmony hub to replace the Harmony 1100 that finally died after eight years of use. I’m using the hub as a stand-alone system and relying on smartphones and tablets to function as remotes. It works great and is far easier to program than some of the older Harmony systems. Extremely satisfied.";"2019-01-10T14:49:45-07:00";"https://itunes.apple.com/us/review?id=626853860&type=Purple%20Software";"626853860";55;"en";"POSITIVE"
181;3596340372;"ET1123581321";"https://itunes.apple.com/us/reviews/id535819519";"5.5";1;"The person who made this app was either untalented or drunk...";"This is the worst experience I have ever had with an app...and I have set up an entire smart home. The app glitches, takes forever to connect, and takes multiple attempts to connect (up to 45 minutes) just to make a simple change. Once you are in, it becomes apparent that the programmers did not even try. The app is the most resistive, unhelpful, poorly designed interface I have ever seen. If I had known how bad the app would be, I would have avoided the product.";"2018-12-31T09:08:25-07:00";"https://itunes.apple.com/us/review?id=626853860&type=Purple%20Software";"626853860";87;"en";"NEGATIVE"
182;1888696220;"Fuhhcue";"https://itunes.apple.com/us/reviews/id524919626";"5.3";2;"Love the idea";"Love the idea but I don’t ONE part of the whole thing and that’s the part where you have to end one task (which turns everything off) just to start another. So if I want to raise he volume I have to turn off my tv, surround system and all other devices which makes the volume adjustment null. I REALLY want this to work but I’ve been seeing people beg for this to be fixed for a very long time. Hopefully they get it right or hire developers who can get it right.";"2017-10-31T18:04:20-07:00";"https://itunes.apple.com/us/review?id=626853860&type=Purple%20Software";"626853860";93;"en";"POSITIVE"
183;3042338370;"Gtille1";"https://itunes.apple.com/us/reviews/id481153963";"5.4.2";1;"Don’t waste your money";"Terrible app and remote. I’ve used it for 5 years had to reset weekly. Got a new one for my man cave set up nicely. Stopped working. Had to reset and start over. It can’t find my devices. Like I want to enter all serial numbers and all channel presets. Oh and my old one is always red and doesn’t work anymore. If you want an iPhone app where you have to spend hours a week trying to get it to stay working and redo setup constantly, this remote is for you. I threw both of mine in the trash and use the tv and cable remotes.";"2018-08-09T17:46:35-07:00";"https://itunes.apple.com/us/review?id=626853860&type=Purple%20Software";"626853860";107;"en";"POSITIVE"
184;6944926310;"Platypus Monk";"https://itunes.apple.com/us/reviews/id20172281";"5.7.7";1;"I’ve had this for 2 years";"I bought a Harmony Hub and wish I had thrown dollar bills out of my sunroof instead. Imagine the satisfaction that would bring to be that crazy guy throwing money away. Instead I have a shiny black square staring at me tauntingly. If the programming wasn’t a social experiment on torture, I might be able to see what this does. For the brevity believers, using your phone as a remote is un enjoyable. There is so much swiping and tapping that you look like you’re conducting an orchestra on your lap.";"2021-02-02T07:06:13-07:00";"https://itunes.apple.com/us/review?id=626853860&type=Purple%20Software";"626853860";91;"en";"POSITIVE"
185;5091209843;"paul4791";"https://itunes.apple.com/us/reviews/id157152519";"5.7";1;"Prehistoric, bug-ridden and slow";"Do yourself a favor and buy a different brand of universal remote control; the Harmony app is barely usable. For me, the app crashes every time I try to configure a particular device. The user interface is ploddingly slow, because it is entirely modal. Imagine a one-step-at-a-time 1990s ""wizzard"" interface, such that you have to go through all fifteen steps every time, when all you want to do is change one setting in the middle.";"2019-11-05T14:27:19-07:00";"https://itunes.apple.com/us/review?id=626853860&type=Purple%20Software";"626853860";75;"en";"POSITIVE"
186;3283078570;"bmilla77";"https://itunes.apple.com/us/reviews/id32218414";"5.4.4";1;"Awful software";"Got email saying to update the software. iPad on same SSID as Harmony. It kept scanning and never connect. Tried it on my iPhone. It kept failing on the login saying cookies were blocked. Turn off cookie blocking in Safari and turned off content blocker. Still got same message. Clearing cache and rebooting didn’t help. Nothing to do with this app but tried using desktop software. It doesn’t show any of the content in the description of how to update software. 2 apps on 3 different hardware and all failed in different ways.";"2018-10-09T13:36:09-07:00";"https://itunes.apple.com/us/review?id=626853860&type=Purple%20Software";"626853860";93;"en";"NEGATIVE"
187;2539678914;"J.Leug";"https://itunes.apple.com/us/reviews/id307200926";"5.4";1;"Really Bad App";"Bought the hub today!!! Follow up the instructions...it didn’t even completed the update and shut itself off. Now, the app doesn’t allow me to do the update or even set up the new hub, it keep sending me to “turn on my Bluetooth”...I have restarted/reset the hub, and uninstalled the app so many times I can’t remember!! What a waste of time and money! I will return this product tomorrow. The developer of this app or the manufacturer of this product must go back to the drawing board...the reviews of this product tell you all!!!";"2018-05-12T20:22:33-07:00";"https://itunes.apple.com/us/review?id=626853860&type=Purple%20Software";"626853860";95;"en";"NEGATIVE"
188;2520541021;"Keysrick";"https://itunes.apple.com/us/reviews/id28960426";"5.4";5;"Glad they fixed it";"I have been enjoying this Skill for many months without trouble. On May 5th it quit working and that’s when I realized how much I use and enjoy this Skill. It was down for a couple days but now works as it did before. I highly recommend Harmony. It works great for me!";"2018-05-08T08:34:31-07:00";"https://itunes.apple.com/us/review?id=626853860&type=Purple%20Software";"626853860";53;"en";"POSITIVE"
189;6374850520;"eddjmg";"https://itunes.apple.com/us/reviews/id164291693";"5.7.5";1;"Failed login and does not allow to login again";"I’ve had Logitech remotes for years. They’ve always worked decent, EXCEPT for when I try to edit settings after wanting to edit devices or make other changes. The app is horrible for making changes and the website is too. You would think that a company that’s been around a while would have this figured out. Can y’all add more people to your smart home devices department? Thanks";"2020-08-29T12:04:50-07:00";"https://itunes.apple.com/us/review?id=626853860&type=Purple%20Software";"626853860";67;"en";"POSITIVE"
190;2388424338;"bparnold";"https://itunes.apple.com/us/reviews/id40332462";"5.3.3";1;"Terrible and never gets better";"Despite having cornered the market for a universal remote system, Harmony’s app is consistently terrible. The latest update has effectively bricked my remotes because, for no apparent reason, it won’t let me accept their EULA. And it won’t let me use the app until I do.  It’s also as though Logitech only expects someone to buy a single remote as its impossible to switch hubs in the app with any regularity. All in all, really poor app design and terrible architecture and this review is coming from someone who works in IOT.";"2018-04-05T16:55:07-07:00";"https://itunes.apple.com/us/review?id=626853860&type=Purple%20Software";"626853860";92;"en";"NEGATIVE"
191;6150703479;"Dooms187Day";"https://itunes.apple.com/us/reviews/id378183235";"5.7.5";2;"Frustrating";"I would say I’m above the averagewhen it comes to modern tech. This thing had me bring out the note pad and pencil. I had to track my steps. There was a lot. Not sure if it’s the app, Hub, or there server. This thing just keeps having to reconnect, download setting every time. This should be far easier in 2020. To many steps to program and don’t make a mistake. Even trying to repair it becomes an issue.";"2020-07-02T20:38:23-07:00";"https://itunes.apple.com/us/review?id=626853860&type=Purple%20Software";"626853860";79;"en";"NEGATIVE"
192;4737635551;"Carmen O. Hio";"https://itunes.apple.com/us/reviews/id33237177";"5.7";1;"Bought a new TV and...";"I’ve been a Harmony Hub universal remote user for many years and have always enjoyed its ease of use. I have one hub for our great room and another in our home theater. When I purchased a new, larger TV, I figured it would be a snap to basically swap out the TVs while keeping all the other components the same. Wrong. Nothing is working correctly so I downloaded the current app. What a disaster it is. I’m back to juggling multiple remotes until Logitech can rewrite the app and eliminate these frustrating bugs.";"2019-09-06T12:43:28-07:00";"https://itunes.apple.com/us/review?id=626853860&type=Purple%20Software";"626853860";94;"en";"POSITIVE"
193;2447360763;"beautoa";"https://itunes.apple.com/us/reviews/id507977200";"5.4";5;"Works great!";"I use this app with my Logitech Harmony remote control system. It controls my TV (Pioneer Kuro), smart blu-ray player and Denon home theater receiver. It works great with all my devices. I’m glad I bought this remote. My equipment is older, but this remote system controls it all. The app works great and never crashes. It’s perfect for my set-up.";"2018-04-20T18:08:48-07:00";"https://itunes.apple.com/us/review?id=626853860&type=Purple%20Software";"626853860";61;"en";"POSITIVE"
