"";"id";"userName";"userUrl";"version";"score";"title";"text";"updated";"url";"app";"wordCount";"language";"sentiment"
316;5420988474;"Vegan61";"https://itunes.apple.com/us/reviews/id306077778";"5.7.1";1;"AWFUL App, Awful Logitech Hub!";"This app and the hub couldn’t even handle a simple setup of just a TV, a receiver and the cable box, even though all of them are supported. With everything setup correctly, it would turn off my cable box while turning on the TV, etc.  Don’t waste your money. I returned the Logitech hub-remote. 
I’m surprised how far behind the universal remote industry is. It’s 2020!!!";"2020-01-18T16:34:04-07:00";"https://itunes.apple.com/us/review?id=626853860&type=Purple%20Software";"626853860";66;"en";"POSITIVE"
317;4584283987;"kmont1234";"https://itunes.apple.com/us/reviews/id41552585";"5.6.2";3;"Love the Widget, Portrait support on iPad";"I use the Widget of the Harmony app all the time on my iPhone and iPad. What I do not like about the iPad app is that it is only available in Landscape mode. I’d like it if there was an option for it to also be usable in Portrait orientation. It’s annoying going between apps in Portrait, then opening Harmony and rotating my iPad.";"2019-08-07T20:02:01-07:00";"https://itunes.apple.com/us/review?id=626853860&type=Purple%20Software";"626853860";65;"en";"POSITIVE"
318;4445536913;"Papa__Joe";"https://itunes.apple.com/us/reviews/id14772230";"5.6.2";1;"So you’re about to return that remote you just bought...";"Seems like it was a great deal. Now you get to discover why the decent hardware was such a bargain. You thought you were going to save time from using three remotes but now you get to get stuck in endless loops that make no sense. Turn it off and then turn it back on? Ha. More like turn it off and ship it back to hell where it came from.";"2019-07-11T18:29:05-07:00";"https://itunes.apple.com/us/review?id=626853860&type=Purple%20Software";"626853860";71;"en";"NEGATIVE"
319;3866792323;"Merlin 309";"https://itunes.apple.com/us/reviews/id152806556";"5.6";1;"Absolute Garbage / Do NOT buy this";"Received last Christmas. Gifter visiting soon so I figured I better install it.  Multiple tries. Would not connect to Wi-Fi, would not respond to input from the app on my cell phone, absolutely zero utility. Unfortunately it has passed the time when I could return it I think I’ll probably just burn it. Absolute user unfriendly garbage should be relegated to the dump Heb
This trash can’t hold a candle to my Philips pronto.";"2019-03-10T12:50:50-07:00";"https://itunes.apple.com/us/review?id=626853860&type=Purple%20Software";"626853860";74;"en";"NEGATIVE"
320;3727613480;"Biglee34";"https://itunes.apple.com/us/reviews/id33952372";"5.5.1";1;"Forever in sync";"I’ve had great success with harmony remotes in the past but I just bought the hub and after trying forever to get it to sync with my Internet finally got that to happen but now for the past day and a half all its been doing is checking for changes and syncing itself on the mobile app
 it has great potential but this part just stinks I can’t use it at all";"2019-02-03T00:31:52-07:00";"https://itunes.apple.com/us/review?id=626853860&type=Purple%20Software";"626853860";72;"en";"POSITIVE"
321;2042756010;"Austin Abrams";"https://itunes.apple.com/us/reviews/id148531601";"5.3.3";2;"Okay functionality, glitches when updating";"The current version of the app requires you to update the firmware of the hub before you can edit activities. I’ve tried a dozen times and the update gets stuck at 25% every time. Hopefully they fix this bug or the application is completely useless.";"2017-12-30T18:36:58-07:00";"https://itunes.apple.com/us/review?id=626853860&type=Purple%20Software";"626853860";45;"en";"NEGATIVE"
322;2812824505;"Megavolt";"https://itunes.apple.com/us/reviews/id31594335";"5.4.1";5;"Nicely done";"Tons of options, you can add your own sequences to keys, have devices automatically power on and off at a certain time.

Device setups can be synced to the cloud.";"2018-07-01T07:32:01-07:00";"https://itunes.apple.com/us/review?id=626853860&type=Purple%20Software";"626853860";30;"en";"POSITIVE"
323;2127881483;"Conorpro";"https://itunes.apple.com/us/reviews/id119194964";"5.3.3";1;"Let down...";"I thought this would be great as me and the harmony product line have a great history together, but every time you enter the app, the WiFi has to connect to the hub, and mine (maybe it’s just me personally) can never find the hub on the network, so I can never choose what to control or fine tune things. I always loved Logitech Harmony, but I’m just totally let down by this product.";"2018-01-25T23:01:14-07:00";"https://itunes.apple.com/us/review?id=626853860&type=Purple%20Software";"626853860";74;"en";"POSITIVE"
324;2113381407;"Furi241";"https://itunes.apple.com/us/reviews/id34761946";"5.3.3";5;"Could not be happier";"Got rid of my expensive Control 4 system and now have full control over my home entertainment and wall switches, fireplace, etc";"2018-01-21T17:55:41-07:00";"https://itunes.apple.com/us/review?id=626853860&type=Purple%20Software";"626853860";22;"en";"POSITIVE"
325;1855810059;"hellrazer99";"https://itunes.apple.com/us/reviews/id363573803";"5.2.2";2;"Very very hard";"It should be one star but it works well after you figure it out. It took me four hours to set this up. The instructions are useless. I almost sent it back out of anger but after you get it to work its like being in the future. If you are gonna use this prepare yourself to be super annoyed and waste a ton of time on it.";"2017-10-17T13:16:35-07:00";"https://itunes.apple.com/us/review?id=626853860&type=Purple%20Software";"626853860";68;"en";"NEGATIVE"
326;6514720572;"MattF876";"https://itunes.apple.com/us/reviews/id25728329";"5.7.7";2;"Apple Watch app?";"What a lost opportunity for an Apple Watch companion app. 

Otherwise, this app is mediocre. All the frequently used commands for a function reside on different screens within the activity. Would be nice to be able to customize what controls I want on which screen.";"2020-10-08T13:40:56-07:00";"https://itunes.apple.com/us/review?id=626853860&type=Purple%20Software";"626853860";45;"en";"POSITIVE"
327;1806321282;"Duke_Nukem";"https://itunes.apple.com/us/reviews/id25583700";"5.2.2";1;"Crap. State of the Art? NO!";"Wasted nearly an hour already with this junk. Just trying to connect everything on wifi. Hey, Logitech, it's 2017! We have multiple SSID's in our homes now, different names for 2.5 vs 5 frequencies for control devices versus streaming devices that need the extra throughput. If this is the best product in the market then I need to set up a competing business asap to take your market share. $300? Wow.";"2017-09-23T17:25:17-07:00";"https://itunes.apple.com/us/review?id=626853860&type=Purple%20Software";"626853860";71;"en";"POSITIVE"
328;8140501366;"StellarWiid";"https://itunes.apple.com/us/reviews/id201404864";"5.7.11";1;"This app was coded by morons";"Everything about this app is trash. If you add commands to a start or end sequence, the stupid app will randomly delete previous commands you added. It’s so frustrating. I used to love Harmony, and Logitech products in general but the company has gone way down hill. Avoid Logitech at all costs. Don’t buy any of their products, they’re all trash now.";"2021-12-17T11:16:38-07:00";"https://itunes.apple.com/us/review?id=626853860&type=Purple%20Software";"626853860";62;"en";"NEGATIVE"
329;7770924558;"phuckahff";"https://itunes.apple.com/us/reviews/id369534538";"5.7.10";1;"Horrible-10 stars";"If you like wasting half the day trying to get IOS to find your piece of …. Hub only to find out that once it’s found by resetting every setting for the 1,000 time and than once you finally get to the device set up part and than disconnect again by all means by a harmony product other wise do not";"2021-09-04T10:23:19-07:00";"https://itunes.apple.com/us/review?id=626853860&type=Purple%20Software";"626853860";61;"en";"POSITIVE"
330;7544151969;"zerocrossing";"https://itunes.apple.com/us/reviews/id33869254";"5.7.9";1;"It used to work.";"Worked well for years, but then started acting up. The remote kept working well, so I never dug into what was wrong. When I got a new TV I had to add it and that’s when I found that basically the Hub and phone software no longer work. No matter how many times I reset it and reset my network, I can never get it to work. More e-waste. Yay.";"2021-07-05T21:07:53-07:00";"https://itunes.apple.com/us/review?id=626853860&type=Purple%20Software";"626853860";70;"en";"POSITIVE"
331;7127988841;"Texanplayer";"https://itunes.apple.com/us/reviews/id200165896";"5.7.7";1;"Help! Help!Help! Anyone";"Cannot create activities for Firestick or Roku.  
Devices individually work fine.  I can control individual devices using the app no issues.  As soon I try to create activities will not recognize either Roku or Firestick.   Yes! Did all listed action of sync with bluetooth , plug and unplug, reinstall, stood over my head and nothing works. 

***********************
I love the hub and works great. Except it’s time to update user friendliness of the app. example: I have three hubs and navigations between  is so outdated feels like dial up days. 

Setup hub and devices  are like using punch cards I saw in museums. 

Hard to believe Logitech is so far behind times";"2021-03-21T07:54:19-07:00";"https://itunes.apple.com/us/review?id=626853860&type=Purple%20Software";"626853860";112;"en";"POSITIVE"
332;4771330136;"mom_of_3_kids";"https://itunes.apple.com/us/reviews/id235571278";"5.7";2;"Horrible app, wasted so much time!";"1. Works once and gets stuck on ""Starting Activity"". After waiting for long time, then restart the app, then: ""Downloading Configuration"".

1. Integration with Alexa is horrible! The moment you change something in Harmony, need to kill and re-install the skill.

I am giving up! Returning Harmony device and deleting the app! :(";"2019-09-13T13:27:01-07:00";"https://itunes.apple.com/us/review?id=626853860&type=Purple%20Software";"626853860";53;"en";"NEGATIVE"
333;4335542534;"pjschwartz";"https://itunes.apple.com/us/reviews/id32455900";"5.6.2";3;"Mixed Bag";"Finally figured out how to customize the app layouts for each activity.  Unfortunately, it doesn’t appear that the button layout can be customized for devices. 

Also, I can’t get a sequence to run which runs perfectly when initiated from the remote.";"2019-06-18T11:39:01-07:00";"https://itunes.apple.com/us/review?id=626853860&type=Purple%20Software";"626853860";41;"en";"POSITIVE"
334;3084056776;"blind_access";"https://itunes.apple.com/us/reviews/id166230671";"5.4.2";1;"Not Accessible For Blind Consumers!!!!";"This app is not accessible for blind consumers. If you are blind, you will need assistance. You can create account and add the hub. The screen to add devices is a joke. Voice over doesn't interact with buttons. There's a window that pops up with no way to close. This prevents you from moving to next screen. 
This app is shameful for a company like Logitech. Not giving blind customers equal access in 2018 is just sad.";"2018-08-18T18:17:09-07:00";"https://itunes.apple.com/us/review?id=626853860&type=Purple%20Software";"626853860";77;"en";"NEGATIVE"
335;1955756429;"Mflanagan81";"https://itunes.apple.com/us/reviews/id17017827";"5.3.2";4;"Updated";"Generally pretty good. Had issues recently when moving homes and changing out some devices. 

Suggestion: make it easier to swap devices. Ie replace old device and associated activities with new device.";"2017-11-28T12:24:22-07:00";"https://itunes.apple.com/us/review?id=626853860&type=Purple%20Software";"626853860";31;"en";"POSITIVE"
336;5925487729;"MonacoProd";"https://itunes.apple.com/us/reviews/id34183165";"5.7.4";1;"For the amount of money we spend...";"on this product...it completely blows.  Horribly unstable.  App crashes constantly.   “Support” recommends you buy more parts to make the other supposedly slightly-less-sucky parts work marginally better...good business model.  When it catches up to you I’ll be one of the first to buy your competitor’s product.";"2020-05-09T17:23:02-07:00";"https://itunes.apple.com/us/review?id=626853860&type=Purple%20Software";"626853860";45;"en";"NEGATIVE"
337;5466869339;"Buzzsaw";"https://itunes.apple.com/us/reviews/id208690423";"5.7.2";1;"App is trash";"I don, understand how any serious company can see the ratings of its app as low as this is and does nothing to improve it. Fix the software please and the interface for iOS on the hub. The app keeps crashing every-time I attempt to setup and connect.

How do you expect to sell more of these remotes if the support is not working. The app is trash.";"2020-01-30T08:55:01-07:00";"https://itunes.apple.com/us/review?id=626853860&type=Purple%20Software";"626853860";68;"en";"POSITIVE"
338;5348958414;"activereader";"https://itunes.apple.com/us/reviews/id40355890";"5.7.1";1;"Negligence and Incompetence";"This app is extremely poorly designed. As one example: if you mis-enter a password to access your account, you cannot renter it: it gets stuck in a loop. Even deleting and reinstalling the app did not help. What kind of developer and quality control would allow this level of incompetence? Logitech apparently.";"2020-01-01T17:13:20-07:00";"https://itunes.apple.com/us/review?id=626853860&type=Purple%20Software";"626853860";52;"en";"NEGATIVE"
339;2229783549;"dp421685";"https://itunes.apple.com/us/reviews/id10802375";"5.3.3";2;"Works great, when it works";"Works great when it actually connects to WiFi. Ive been trying to edit some activities and whenever I do so, the app prompts me to be on the same WiFi as the hub, which i am. The odd thing is I can sync to the hub so not sure what the issue is. I’ve tried unplugging both the hub and router and still no avail.";"2018-02-20T13:44:40-07:00";"https://itunes.apple.com/us/review?id=626853860&type=Purple%20Software";"626853860";65;"en";"NEGATIVE"
340;4042488242;"Echo.Delta";"https://itunes.apple.com/us/reviews/id117376531";"5.6";1;"Clunky and outdated";"Tried a Harmony remote many years ago and gave up on it. Recently bought a harmony hub/remote combo because it was on sale and should have returned it. Countless are the times I’ve almost hurled the thing at the wall. And as for the app; fire the genius that decided to put the volume up and volume down on two separate pages. Seriously, what were you thinking?";"2019-04-21T09:20:54-07:00";"https://itunes.apple.com/us/review?id=626853860&type=Purple%20Software";"626853860";67;"en";"POSITIVE"
341;3815020538;"Ellipsis17";"https://itunes.apple.com/us/reviews/id13075230";"5.6";1;"Another Failed Installation of a Logitech Product";"Typical junk product that is probably trouble free for certain configurations, but as soon as your configuration is a bit different, or your initial install fails, it becomes paralized.  I’ve had more than one Logitech product with the same issue.  Guess that makes me the dope for wasting my money and exposing myself to all the frustration. Pity. I won’t drink the kool-aid again.";"2019-02-25T16:05:49-07:00";"https://itunes.apple.com/us/review?id=626853860&type=Purple%20Software";"626853860";64;"en";"NEGATIVE"
342;6022291240;"Jlap77";"https://itunes.apple.com/us/reviews/id220179940";"5.7.5";3;"Frustrating, but ultimately able to program my devices";"Was ultimately able to program my remote, but the app crashed numerous times. Please work on the wizard with a control group.";"2020-06-01T08:36:08-07:00";"https://itunes.apple.com/us/review?id=626853860&type=Purple%20Software";"626853860";22;"en";"POSITIVE"
343;1918232090;"VWrampe";"https://itunes.apple.com/us/reviews/id106015981";"5.3.1";1;"Can’t log into my account! Impossible";"No matter what I try it’s absurd I’ve changed my eMail address long time ago with Logitech but it still uses the previous address 
Calling is impossible there is NO !!!!!
support 
I fought very much that these people care about helping there customers
Only one remedy left, boycott there products!!!!! I surely will not by another item from these people";"2017-11-13T07:24:44-07:00";"https://itunes.apple.com/us/review?id=626853860&type=Purple%20Software";"626853860";61;"en";"NEGATIVE"
344;7700868604;"ChrisLLR2831";"https://itunes.apple.com/us/reviews/id41417697";"5.7.9";1;"Stopped working";"It just stopped working. Deleted the app. Tried to set it back up. I logged in with my harmony account (Logitech) and it tells me I have settings available for restore. I hit restore. It ultimately just takes me to a new set up screen where it instructs me to plug my hub in and all that. Never does anything beyond that. This company is trash.";"2021-08-16T15:16:27-07:00";"https://itunes.apple.com/us/review?id=626853860&type=Purple%20Software";"626853860";66;"en";"POSITIVE"
345;3498646145;"MiltonWaddamsStapler";"https://itunes.apple.com/us/reviews/id239345809";"5.4.4";1;"Don’t Do It!";"Wow, guys. I haven’t run into a product this bad since the 80’s. This would be my third logitech and by far the most technically advanced. And yet, the mapping is so much more limited than it should be that even my simple little setup is too much for it. You guys are trying to make everything too simple nowadays and you’re actually handcuffing folks who can map / program.";"2018-12-05T21:25:21-07:00";"https://itunes.apple.com/us/review?id=626853860&type=Purple%20Software";"626853860";70;"en";"NEGATIVE"
346;3217987766;"Aldous12346";"https://itunes.apple.com/us/reviews/id28920664";"5.4.4";3;"Needs Siri Shortcut support";"Fairly poor UI. Frankly I rarely use it due to the poor user experience, but it would be greatly improved just by the addition of Siri shortcuts. Would allow much easier user customizable voice control and iPhone/ HomePod compatibility.";"2018-09-22T08:58:32-07:00";"https://itunes.apple.com/us/review?id=626853860&type=Purple%20Software";"626853860";39;"en";"POSITIVE"
347;3210248997;"Tortri_";"https://itunes.apple.com/us/reviews/id27574080";"5.4.4";4;"Needs iOS 12 Shortcuts so Siri can turn on activities.";"Alexa is starting to be stupid lately so I’ve been using Siri lately.  Only this and nest hasn’t been added to Siri support until now now that we can make shortcuts.";"2018-09-20T07:16:45-07:00";"https://itunes.apple.com/us/review?id=626853860&type=Purple%20Software";"626853860";31;"en";"NEGATIVE"
348;2673320297;"learn2breathedv";"https://itunes.apple.com/us/reviews/id21952508";"5.4.1";4;"Almost there";"I love being able to control my tv with my phone but I wish the widgets were snappier to respond. It takes more effort to get to the app than it should for the purpose it’s serving.";"2018-06-10T14:51:07-07:00";"https://itunes.apple.com/us/review?id=626853860&type=Purple%20Software";"626853860";37;"en";"POSITIVE"
349;5282019283;"Matresjka";"https://itunes.apple.com/us/reviews/id170965880";"5.7.1";1;"Stay away!!!";"We just got it. While the set up process was pretty straight forward, i had to log in into it and it does not take my password. Ok, fine. I reset it, and it’s not taking it again. Ok. Tried creating anew account. Same thing. It’s not taking my password. Tried resetting and it’s still not taking it. So disappointed.";"2019-12-16T21:02:32-07:00";"https://itunes.apple.com/us/review?id=626853860&type=Purple%20Software";"626853860";60;"en";"POSITIVE"
350;7249053042;"Bbbbfan";"https://itunes.apple.com/us/reviews/id142387268";"5.7.9";2;"Bad updates";"This would have a higher rating however, a recent update no longer allows the app to control the Hub unless they are paired to the same wifi. Before, the app could be over cellular without wifi. Stupid restriction.";"2021-04-21T17:35:28-07:00";"https://itunes.apple.com/us/review?id=626853860&type=Purple%20Software";"626853860";38;"en";"POSITIVE"
351;2004774449;"snakechaser";"https://itunes.apple.com/us/reviews/id280622939";"5.3.3";1;"Tedious";"The app is quite tedious. You must scroll through pages and pages to do simple tasks. The technology is nice, I.e., being able to control so many devices with my iPhone, but the app itself can be time consuming and even difficult in the beginning of its use. Hopefully the developers will make an update which is more user friendly.";"2017-12-17T14:13:32-07:00";"https://itunes.apple.com/us/review?id=626853860&type=Purple%20Software";"626853860";60;"en";"POSITIVE"
352;5277922144;"Tasha_T";"https://itunes.apple.com/us/reviews/id35171805";"5.7.1";1;"Garbage";"Worst experience I’ve had in some time. Very frustrating. Nice sleek design, but it just doesn’t work.

Brand new Sony TV, Denon receiver and DirecTV — won’t connect. Now, it won’t even connect to my iPhone. No support links.

This should be simple. Giving up ... taking it back. Will definitely think twice before buying another Logitech product.";"2019-12-15T18:23:49-07:00";"https://itunes.apple.com/us/review?id=626853860&type=Purple%20Software";"626853860";58;"en";"POSITIVE"
353;3126723518;"miken256";"https://itunes.apple.com/us/reviews/id652276199";"5.4.2";1;"App has stopped working";"This app was never the best, but at least it was a fall back when the batteries die on my remote.  But now it has completely ceased to function, it just brings up a modal screen saying “hub requires firmware update” that can’t be dismissed.  However my hub is running the most recent firmware.  So this app has basically rendered itself useless.  Major QA issue with Logitech";"2018-08-28T18:12:27-07:00";"https://itunes.apple.com/us/review?id=626853860&type=Purple%20Software";"626853860";67;"en";"NEGATIVE"
354;2206718858;"Bluscreened";"https://itunes.apple.com/us/reviews/id203157761";"5.3.3";2;"Why does it always lose connection?";"I hit the app, turn on my activity, then once it's on, it immediately loses connection and I can't even bring up the guide for my TV. I gotta yank the power and reboot it. The thing will work perfect for a few days then have issues again. Crap product.";"2018-02-14T03:49:10-07:00";"https://itunes.apple.com/us/review?id=626853860&type=Purple%20Software";"626853860";50;"en";"NEGATIVE"
355;7205484263;"BrendiFlor";"https://itunes.apple.com/us/reviews/id145613348";"5.7.9";1;"Update hangs at 27%";"I’ve been having issues with my Harmony Hub. It constantly loses connection and just blinks red. I’ve never had any issues for the first year and now  it stops working. So I decided to reset to factory settings and now when going through the installation process in the app it just freezes at 27%.";"2021-04-10T02:47:37-07:00";"https://itunes.apple.com/us/review?id=626853860&type=Purple%20Software";"626853860";54;"en";"NEGATIVE"
356;5517872483;"sweaverj";"https://itunes.apple.com/us/reviews/id38456574";"5.7.2";1;"App is not able to connect to Hub.";"I keep getting an error “E:2014” whenever I try to Add/Edit Devices. I have restarted the app, as it suggests, on multiple occasions - that has not worked. I have also deleted the app from my phone and downloaded again from App Store - also has not resolved the issue. Please fix!!!";"2020-02-11T09:27:54-07:00";"https://itunes.apple.com/us/review?id=626853860&type=Purple%20Software";"626853860";52;"en";"NEGATIVE"
357;5423160106;"Meowgler";"https://itunes.apple.com/us/reviews/id673476313";"5.7.1";4;"What’s with the negative reviews?";"I’ve been using Harmony Hubs for about 5 years. There’s simply no better alternative for hands free control of multiple entertainment centers in a home.";"2020-01-19T05:36:49-07:00";"https://itunes.apple.com/us/review?id=626853860&type=Purple%20Software";"626853860";25;"en";"POSITIVE"
358;5272219600;"csh0514";"https://itunes.apple.com/us/reviews/id86487470";"5.7.1";1;"Cannot change wrong password.";"I entered the wrong password, and the screen to enter a new password is hidden behind a login screen... tapping Retry sends the wrong password again and tapping Ok just drops me back at the home screen. 
Uninstalling the app doesn’t remove the password that I entered and thanks to OSX Catalina the laptop app no longer works either. 

Yay";"2019-12-14T07:51:07-07:00";"https://itunes.apple.com/us/review?id=626853860&type=Purple%20Software";"626853860";60;"en";"NEUTRAL"
359;2608323576;"Phillysdon04";"https://itunes.apple.com/us/reviews/id349456959";"5.4";1;"Could be better";"It's so hard to program simple commands. Both the Google Home and Alexa needs better integration to run commands regardless what activity you're in. On the phone this need a better customizable widget to control multiple devices. The app also needs better customization to control multiple devices on one page.";"2018-05-28T08:12:44-07:00";"https://itunes.apple.com/us/review?id=626853860&type=Purple%20Software";"626853860";50;"en";"POSITIVE"
360;2425785616;"Ironman Johnson";"https://itunes.apple.com/us/reviews/id85119669";"5.4";1;"Bug in Version 5.4 Don’t Update!!";"The past version or two, I have had an issue where the app would stop sending the signal to the hub. The only way I’ve found to fix it is to delete the app and reinstall it. This is unacceptable. Logitech, you need to get this fixed. As a paying customer, I feel like I’m being screwed out of the money I spent on this hub.";"2018-04-15T06:24:53-07:00";"https://itunes.apple.com/us/review?id=626853860&type=Purple%20Software";"626853860";66;"en";"NEGATIVE"
