"";"id";"userName";"userUrl";"version";"score";"title";"text";"updated";"url";"app";"wordCount";"language";"sentiment"
66;1989618988;"Fxerman";"https://itunes.apple.com/us/reviews/id213114830";"5.3.3";5;"Love it!";"I purchased a new Harmony hub with remote since I have used the Harmony One for years with success. This app ties it all together and makes setup far easier than the old method of plugging your remote into a PC to program it. Took me about 10 minutes to set it up and it copied all my previous remote settings to the new one with ease. The app is easy to navigate and covers all the bases for tweaking your setups. I paired it with Alexa and now have voice control for using the entertainment system. Keep up the good work Logitech!";"2017-12-11T20:14:45-07:00";"https://itunes.apple.com/us/review?id=626853860&type=Purple%20Software";"626853860";103;"en";"POSITIVE"
67;3464722006;"elimoon8";"https://itunes.apple.com/us/reviews/id138850785";"5.4.4";1;"Terribly buggy app";"I don’t use harmony to control entertainment devices and mainly purchased it to replace the remotes for fans, etc. I have spent time repeatedly trying to teach Harmony commands from my remotes, but despite it showing that it has successfully learned the command, commands fail to execute...or a device will turn on properly and never turn off again (despite the original remote using the same button for on/off) and none of the other commands will work. Somehow my Dyson fan has also gotten into a state where turning it off in the app is the only way to turn it on...and turning it on turns it off.

I work in tech and the fact that an app can be this buggy makes me question Logitech’s QA process and commitment to this device.";"2018-11-26T19:18:02-07:00";"https://itunes.apple.com/us/review?id=626853860&type=Purple%20Software";"626853860";132;"en";"POSITIVE"
68;1918114492;"M. Deitsch";"https://itunes.apple.com/us/reviews/id410243689";"5.3.1";2;"Terribly long transition lag time and doesn’t work with new Dish Network upgraded system";"Not a bad product overall but the lag time for the remote to open an activity just gets longer and longer with every update. The lag time (1 minute) is also terrible when the app refreshes itself and you have to reopen your activity from the main menu. It is beyond annoying and this issues is making me want to find another option that is not Logitech.

Update: 

Our Dish Network system was updated to the newest setup, Hopper w/ Sling 3 and several Joey 2 units. The Harmony Hub no longer recognizes Joey units with this system setup. Emailed MyHarmony and waiting for a reply as to this issue.";"2017-11-13T06:19:05-07:00";"https://itunes.apple.com/us/review?id=626853860&type=Purple%20Software";"626853860";110;"en";"NEGATIVE"
69;4403070721;"Tiger user";"https://itunes.apple.com/us/reviews/id42290814";"5.6.2";1;"Seems illegal to make one agree to privacy terms that Logitech doesn’t make available";"I really don’t know why I’m forced to create an “account” with Logitech. Not only is one forced to create this so-called account; but in the process, one must agree to their privacy terms and conditions. 
Interested in reading what you’re actually legally agreeing to? Sorry! If you click on the link for the privacy agreement, all you get is an empty Logitech page!
Come on Logitech! At least have your (probably outsourced) programmers verify that the links in your app actually work! And stop bending over for your marketing department! Your customers have already paid for your hardware, you really don’t really need to also profit off of their personal information!";"2019-07-02T18:01:31-07:00";"https://itunes.apple.com/us/review?id=626853860&type=Purple%20Software";"626853860";112;"en";"POSITIVE"
70;6218495156;"ShorinSean";"https://itunes.apple.com/us/reviews/id38785239";"5.7.5";2;"Great concept- turgid in action";"I have a Harmony One remote that’s probably 20 years old, and it just keeps on going and going. It even looks pretty new – just fantastic. 
While waiting for my second replacement battery for this remote, I’m trying to use the Harmony software and hub. It’s incredibly frustrating:  slow, inefficient (do you really have to check the hub’s firmware every 90 seconds?  Do you really have to go out to the Harmony site every time you wish to edit an activity? I’m not even getting into the UI problems. 
I gave up. I am using the individual remotes, and will wait for my Harmony One replacement battery to arrive.";"2020-07-19T19:12:36-07:00";"https://itunes.apple.com/us/review?id=626853860&type=Purple%20Software";"626853860";110;"en";"POSITIVE"
71;2718110545;"Medic man91";"https://itunes.apple.com/us/reviews/id296927931";"5.4.1";2;"Does not work";"When the app works it is great. However, 90% of the time it doesn’t. My husband and I got the harmony a few months ago and it connects our tv, surround sound, and cable boxes which we love. It makes it so convenient except for the fact that my app will not connect to the harmony hub but once a day... If I’m lucky. They are on the same connection. My husbands app will work while mine doesn’t, or via versa. The same goes for the app on our iPad. It has made it more of an inconvenience to use because of the fact that it never works. We will be returning ours and I recommend others do the same or don’t buy it. From what I’ve read this is not an isolated incident.";"2018-06-18T05:38:09-07:00";"https://itunes.apple.com/us/review?id=626853860&type=Purple%20Software";"626853860";134;"en";"POSITIVE"
72;1962930930;"Brellic";"https://itunes.apple.com/us/reviews/id226633036";"5.3.2";1;"Worst iPhone app used";"The app is not built with the user in mind and was just to get every function to the user with the least amount of coding... the app should allow you to customize a page and put all objects you normally use on 1 page like a portal page, no matter what equipment you use.  I should not need to turn on my device on page 3 and go to page 4 to turn up volume.  The buttons only take up 1/2 the screen with a large black area not used.  The harmony widget should also be customizable...scripts should not lock the equipment you selected in the wizard and you should be able to delete them.  Should be able to duplicate commands easy but can’t when creating scripts.   The app needs a complete rewrite.";"2017-12-01T11:31:18-07:00";"https://itunes.apple.com/us/review?id=626853860&type=Purple%20Software";"626853860";134;"en";"POSITIVE"
73;6005689129;"RCL4";"https://itunes.apple.com/us/reviews/id36424085";"5.7.5";5;"The Best Universal Remote";"I just got a Harmony Elite and it is the best programmable universal remote.  This app made set up incredibly easy.  It found my receivers, my television and my Apple TV’s and set them up to be controlled over the WiFi network, which a much superior technology than it or Bluetooth.  I have some very obscure equipment, and the software knew how to set them up automatically.  The app also lets me customize the remote buttons so that I have exactly the setup that I want.";"2020-05-28T09:50:10-07:00";"https://itunes.apple.com/us/review?id=626853860&type=Purple%20Software";"626853860";86;"en";"POSITIVE"
74;4879658847;"eduardo7delgado";"https://itunes.apple.com/us/reviews/id176701035";"5.7";2;"Problematic but still useful";"While this app doesn’t do anything specifically well, it does usually do the job and serves its purpose for my needs. My biggest gripe right now is how little it’s been updated in terms of features and design. It’s almost the same as it was 2 years ago. One big problem I have with it currently is the lack of support for iOS 13 and it’s dark mode both in app and in widgets. It’s frustrating to see such a capable product not have the right support and software to keep it exciting and well made as time goes on. Please update the design, make it more practical and please please bring dark mode.";"2019-10-03T13:52:30-07:00";"https://itunes.apple.com/us/review?id=626853860&type=Purple%20Software";"626853860";114;"en";"POSITIVE"
75;8145715041;"Moderate Liberal Extrordinaire";"https://itunes.apple.com/us/reviews/id544997178";"5.7.11";4;"Default Hub issues with Harmony App";"I control six harmony hub remotes, at two different homes.  The problem is that the app always opens to my living room hub at my vacation home.  I have no idea how this was set or how to change it.  My other apple devices show a list of available hubs to control when I open the app, but my daily driver iPhone 8 automatically goes to the living room hub without any input from me. If anyone else has had this issue, and fixed it, please point me to the solution.   Thanks.";"2021-12-18T22:44:07-07:00";"https://itunes.apple.com/us/review?id=626853860&type=Purple%20Software";"626853860";92;"en";"POSITIVE"
76;3219250438;"ZTKI";"https://itunes.apple.com/us/reviews/id404410300";"5.4.4";3;"Good. Could be great easily.";"Don’t give me wrong. This is a great backup for when your remote is charging on the dock, or in the hands of somebody with undesirable show selection tastes. The two glaring shortcomings could be easily fixed. The app should open up and mimic what your physical remote’s screen looks like. Everything comes up with a generic kit of lackluster commands. The second would be the integration of the newly released Siri Shortcuts capability brought by iOS 12. Would be great to adjust the volume, change channels, or shut everything down via Siri when your hands are full. 

Come on Logitech. Take it from good to great.";"2018-09-22T17:44:55-07:00";"https://itunes.apple.com/us/review?id=626853860&type=Purple%20Software";"626853860";107;"en";"POSITIVE"
77;2399464469;"LIBeaches2011";"https://itunes.apple.com/us/reviews/id149184135";"5.3.3";1;"Expensive remote with limited device support";"Don’t buy this remote if you have a lot of devices.  The Harmony remote and hub limit you to _8_ devices as of the time of this post.  When you pay hundreds of dollars for a remote control - having small hard coded limit like that is frustrating to say the least.  I have 10 devices that all take remote input that connect into the television.  

The UI for making changes to existing activities when acquiring new devices like game consoles for the kids is not intuitive.  Instead of having an  action labeled edit activity, you need to go into Hub Setup (something that you would do when you first set up the device...).  Poor word choice on Logitech’s part.";"2018-04-08T12:56:02-07:00";"https://itunes.apple.com/us/review?id=626853860&type=Purple%20Software";"626853860";120;"en";"NEUTRAL"
78;2047810745;"The Su1tan";"https://itunes.apple.com/us/reviews/id36322486";"5.3.3";5;"Works well";"This app works surprisingly well. 

I’ve had harmony remotes for years, although in the past the remotes themselves had to be programmed over a USB cable via a painful process. The newer design with a programmable hub is so much better. It’s quick and easy to tweak configurations right from the couch when you want to. 

There are many little details which seem well thought out like incorporating the iPhone volume buttons and exposing some controls by force touching the app icon.";"2018-01-01T10:58:13-07:00";"https://itunes.apple.com/us/review?id=626853860&type=Purple%20Software";"626853860";82;"en";"POSITIVE"
79;7211898774;"EyeamTim";"https://itunes.apple.com/us/reviews/id36221470";"5.7.9";5;"The best consumer solution, I’ve tried them all";"Once you program everything in, which takes some time to do it right. For example. You need to program your start sequence to have the Apple TV to select “home” so your Apple TV turns on with everything else. But once you’ve got it dialed in this is an amazing app and a fantastic all in one solution. Thank you for continuing to support us Logitech!! So sad to see you closing this chapter.";"2021-04-11T15:47:58-07:00";"https://itunes.apple.com/us/review?id=626853860&type=Purple%20Software";"626853860";74;"en";"POSITIVE"
80;6727623051;"phantomdragon78";"https://itunes.apple.com/us/reviews/id28311752";"5.7.7";5;"Great and easy to use!";"I don’t understand all the poor reviews. This app does everything it states it does flawlessly. 

I’ve been using harmony remotes for over 15 years and the technology has come a long way. Setting it up on a mobile device is easier and convenient. Gone are the days of plugging your remote directly to your PC (the option is still there if you prefer it). 

Logitech is still the king of remotes!";"2020-12-07T08:24:41-07:00";"https://itunes.apple.com/us/review?id=626853860&type=Purple%20Software";"626853860";72;"en";"POSITIVE"
81;3527713867;"CaptBlumeRetired";"https://itunes.apple.com/us/reviews/id148947922";"5.5";1;"Set up issues";"The set up started just fine. I got all the devises logged in and each tested. They all worked individually just fine. Then I set up the watch tv group. It failed. I tried to go back and test each again and check everything again. Problem is, there is no go back. The app then forces you to start all over again. So all that saved data for all my devices is lost. I started over and put in the same email information etc. and it told me to enter a different one, that one has been used. Additionally the set up doesn’t tell you that an email is going to be sent for my verification, (which I didn’t do), so it expired. I’m going to delete the app and start all over again.";"2018-12-13T16:17:32-07:00";"https://itunes.apple.com/us/review?id=626853860&type=Purple%20Software";"626853860";134;"en";"NEGATIVE"
82;3407834540;"aguamaned";"https://itunes.apple.com/us/reviews/id33809824";"5.4.4";4;"Needs Apple Siri and HomeKit Support";"I own the Harmony Elite and Hub, and I have to say that voice activation is the sweetest thing since apple pie was invented. The only thing better would be to add HomeKit support so that Hub activities can be integrated and used in smart home automations and logic. 

Logitech can go 2 ways for this.

1) The Harmony control app could be updated to use the new Siri Shortcuts in iOS 12. This would add Siri voice activation support. Check out how Phillips Hue has done this in their app. 

2) The Harmony Hub could be made fully HomeKit compatible through a firmware update. This would add both Siri voice activation support and smart home logic support via HomeKit. Imagine the possibilities if we could use Harmony activities in automated smart home rules. 

The Harmony Hub already has Alexa and Google Assistant voice activation support. The only major virtual assistant that is missing is Siri. Please add her to the Logitech line.";"2018-11-11T16:14:38-07:00";"https://itunes.apple.com/us/review?id=626853860&type=Purple%20Software";"626853860";163;"en";"POSITIVE"
83;2270143060;"WinterC15";"https://itunes.apple.com/us/reviews/id203414301";"5.3.3";4;"Good tool for a great product";"I have been using Harmony remotes for at least 10 years. The only issue that I consistently have with this application is the reliability of connection to my hubs. Whenever I have to reset my home network, the app/hubs lose connection; therefore, I have to reconnect the within the app each time. This is annoying, but it is a small issue. Overall, the app is very intuitive. Setup is easy. 

My only request, although petty, would be to add a 45 minute sleep timer! The current timers are in 30 minute intervals.";"2018-03-04T05:50:42-07:00";"https://itunes.apple.com/us/review?id=626853860&type=Purple%20Software";"626853860";92;"en";"POSITIVE"
84;1888496209;"TimmyVR";"https://itunes.apple.com/us/reviews/id188306439";"5.3";4;"Good app.  Take control !";"I’m not sure why the low stars.  Maybe people new to setting up harmony remotes.  If you’ve set up the older remotes with the web or pc app you’ll love this.  Way better.  Much easier and reliable.  For those new to universal remotes this will take a bit to setup.  The app makes it as easy as possible but it will take some time with a complicated.  It took me about 2 hours to setup a new LG TV, firestick, Apple TV, Vizio soundbar system. about what I thought it would to get exactly like I wanted it.  Now that it’s done excellent control.  Love it";"2017-10-31T15:46:10-07:00";"https://itunes.apple.com/us/review?id=626853860&type=Purple%20Software";"626853860";106;"en";"POSITIVE"
85;7162388968;"Elthran";"https://itunes.apple.com/us/reviews/id86201862";"5.7.8";1;"Poor support for iOS";"Harmony would be great if it had better support for iOS, such as an Apple Watch app for turning on an activity, using Widgets in iOS 14 for quick controls.  The old widget system broke (kept saying connect to Harmony) and an uninstall/reinstall would fix it only for a week or two before it would break again.  Updates to the app are few and far between with very few new features.  The app itself suffers from noticeable lag from time to time, such as not reflecting the status of an activity when you first boot it up.  There’s also no PS5 support, a device that has been out for 5 months, despite having PS4 support.";"2021-03-30T06:28:19-07:00";"https://itunes.apple.com/us/review?id=626853860&type=Purple%20Software";"626853860";115;"en";"POSITIVE"
86;3713061480;"apphap";"https://itunes.apple.com/us/reviews/id24161546";"5.5.1";1;"Clunky and broken";"I’ve been using this app for a couple of years. Takes forever to set up or edit actions mainly because the app freezes, crashes, or just won’t respond. For example, I’m trying to edit a start activity to add a delay. I’m able to add the delay, but by default it puts it at the bottom of the list (last item in the sequence). And I can’t for the life of me move it to where I want it. Every time I’ve tried, it either locks up and crashes the app, or it moves back the second I let go of the item. I’ve tried on both my iPad and iPhone, and they both behave the same. I’m so frustrated, I’m going to look for a new remote with a better interface. Ridiculous.";"2019-01-30T08:04:55-07:00";"https://itunes.apple.com/us/review?id=626853860&type=Purple%20Software";"626853860";133;"en";"NEGATIVE"
87;5889645722;"Meredith617";"https://itunes.apple.com/us/reviews/id86315054";"5.7.4";2;"Works, but could be so much better";"I guess I’ll start by saying, it works. I can control my hub and thus my tv with this app. I like the option to use my phone rather than a remote.

That is where the positivity ends. 1st, I find it very frustrating that there is no way to enter an activity without powering on the activity. This is a problem if I say start with the remote but then want to quickly use my phone because the remote is out of reach. I end up having to go into a device directly which is annoying. This is also annoying with the physical remote but I can cover the top with my hand to get it where I want.

2nd, this is just frankly annoying to use. There is a ton of wasted space on the screen and no way I have found to customize it. Toggling between screens is unnecessary work.

Harmony makes such good stuff, it is weird to me how bad this app is. I think they really do not intend for people to use it.";"2020-05-01T11:02:14-07:00";"https://itunes.apple.com/us/review?id=626853860&type=Purple%20Software";"626853860";180;"en";"NEGATIVE"
88;3741958873;"12rview34";"https://itunes.apple.com/us/reviews/id188083650";"5.5.1";1;"Activity fails";"The app works fine...if you are already in an activity. 
When I click an activity that has to turn on or off my tv, nothing happens. When I attempt to toggle power from the help feature, still nothing happens. It very rarely powers on the surround sound. The only thing that it does is turn on my fire stick. Unfortunately, one out of three is bad. 
This is the only way that I am supposed to get to synchronize all of my devices within this activity. 
If I want to turn on or off the tv, or if I want to make sure my surround sound is functioning I have to use other remotes. This completely negates the reason to use the harmony remote. So if I can’t, then what’s the point?";"2019-02-06T21:44:17-07:00";"https://itunes.apple.com/us/review?id=626853860&type=Purple%20Software";"626853860";132;"en";"NEUTRAL"
89;7712527875;"mac_jedi";"https://itunes.apple.com/us/reviews/id42824804";"5.7.9";1;"Logitech Should Be Embarrassed";"This app is so bad considering it comes from a company like Logitech. I don’t know what’s happened to them the last few years regarding support software development. I have been using their remotes and mice for years and have for the most part have always had a great user experience. But over the last few years they’ve really gone to $#!+. Nothing ever seems to work seamlessly like it used to, everything is a struggle. Getting thing to see each, getting them to connect, getting them to work as advertised. Think they need some major changes at the top of their organization before it’s too late.";"2021-08-19T17:34:05-07:00";"https://itunes.apple.com/us/review?id=626853860&type=Purple%20Software";"626853860";107;"en";"POSITIVE"
90;6051248800;"kmcorbett";"https://itunes.apple.com/us/reviews/id16607012";"5.7.5";1;"Harmony hub users with Mac OS Catalina are forced to use the app to sync";"Logitech support docs point hub users on Catalina to the Harmony app to do everything - including for example, login to your account and change email address. More importantly, only the app can sync the hub with an updated configuration.

Generally it’s a low quality app with a lot of usability problems. But the real problem is forcing users to use an app because Logitech can’t be bothered to keep a couple of Mac OS developers on the payroll. 

I’ve always looked to Logitech for high quality hardware; their software has always been mediocre. Now apparently their users’ software requirements are no concern to them whatsoever.";"2020-06-08T08:35:55-07:00";"https://itunes.apple.com/us/review?id=626853860&type=Purple%20Software";"626853860";106;"en";"NEGATIVE"
91;5993706068;"kevin.hb";"https://itunes.apple.com/us/reviews/id156754814";"5.7.5";5;"Flexibility is the key";"Having spent many years in the custom software business I can say that one of the toughest considerations is how much flexibility should be made available to the end user. The philosophy in designing this app was clearly to offer a LOT of flexibility at the expense of simplicity. I personally like tinkering around with software like this because it allows me to have exactly the experience I want once I’ve got it all customized.";"2020-05-25T15:28:29-07:00";"https://itunes.apple.com/us/review?id=626853860&type=Purple%20Software";"626853860";75;"en";"POSITIVE"
92;6983195527;"jmw-01";"https://itunes.apple.com/us/reviews/id676924458";"5.7.7";2;"It’s unfortunate Logi is the only choice";"Logitech seem to be the only ones to offer anything in the space of customer programmable remote controls.  There is so much potential to have an amazing product, the HW seems to be top notch, but the software is just pathetic.  Bugs, crashes, and poor user experience in the app (same with the desktop app).  As one example, try to edit an existing activity that does not have an input selection step...  no way to add it!  Need to add a whole new activity.  I reluctantly buy Logi products because there is no competition unless you go professional.";"2021-02-11T16:10:03-07:00";"https://itunes.apple.com/us/review?id=626853860&type=Purple%20Software";"626853860";98;"en";"NEGATIVE"
93;4444311419;"dave-t1972";"https://itunes.apple.com/us/reviews/id27001512";"5.6.2";1;"Worst device and app";"I never write reviews and normally keep my comments to myself but this time is an exception. This app is complete garbage and did not work. First I could not get the hub connected to my network and followed all of the trouble shooting tips. Once I did get it connected after an hour and about 5 hub resets I was able to start loading in my av gear. Once I got my av hear all setup nothing was considerably turning on and off. I tried placing the hub in my cabinet on top of my cabinet under my cabinet nothing worked. The ir blaster did nothing either. Then after I got everything up the app kept saying looking for  changes until I had to unplug the hub place it back In the box and return it.";"2019-07-11T11:54:46-07:00";"https://itunes.apple.com/us/review?id=626853860&type=Purple%20Software";"626853860";137;"en";"NEGATIVE"
94;1974338965;"RasMac98";"https://itunes.apple.com/us/reviews/id346836278";"5.3.2";1;"By far the WORST setup I've run in a while......";"This is the 2nd Harmony remote I've had to configure. Horrible. I just bough the $300+Elite remote, and nothing is connecting amongst the Hub, remote, mobile app, etc. It takes an hour or 2 of troubleshooting before I literally see a glimmer of a detection. Started updating the firmware in the mobile app...AND THAT EVEN FROZE! Once you get past all this, it's alright, but I am solely referring to my older remote, as I decided to write this truly disappointing review while nothing is being detected (1.5hrs now). It's definitely the company/products, as I've experienced the same crappy setup experience on two very different remotes (three, if you count in the Harmony Hub). Setiously, i am extremely annoyed....";"2017-12-05T23:58:13-07:00";"https://itunes.apple.com/us/review?id=626853860&type=Purple%20Software";"626853860";119;"en";"NEGATIVE"
