"";"id";"userName";"userUrl";"version";"score";"title";"text";"updated";"url";"app";"wordCount";"language";"sentiment"
317;6644488788;"Lintly";"https://itunes.apple.com/us/reviews/id19624261";"4.5.0";1;"The app is terrible";"I love the lights and when the app works, it is great. The problem is, the app is terrible. I set 3 lights as a room. I then favorite them. Now they show up on my watch. I click the room to turn on, only 2 of the lights come on. I go to the widget on my phone, does the same. I open the app and do the same and it works fine.";"2020-11-14T07:10:50-07:00";"https://itunes.apple.com/us/review?id=657758311&type=Purple%20Software";"657758311";74;"en";"POSITIVE"
318;5573052639;"EternalNig";"https://itunes.apple.com/us/reviews/id633388793";"4.0.0";5;"Amazing with most recent update.";"Amazing features and amazing bulbs. Working even better with the new app update on iPhone 8 Plus.";"2020-02-23T22:59:07-07:00";"https://itunes.apple.com/us/review?id=657758311&type=Purple%20Software";"657758311";17;"en";"POSITIVE"
319;6177639038;"vjhwebjhbejhvbwejkv";"https://itunes.apple.com/us/reviews/id36563672";"4.2.0";2;"Ruined user experience with update 4";"You can no longer access themes for a group from the group. You need to navigate out of the group you’re controlling to control it. Very stupid UI. It’s like they didn’t test it because I see old and young people struggle with this garbage UI.";"2020-07-09T10:51:21-07:00";"https://itunes.apple.com/us/review?id=657758311&type=Purple%20Software";"657758311";46;"en";"NEGATIVE"
320;5930126984;"rdmilstein";"https://itunes.apple.com/us/reviews/id111393126";"4.2.0";1;"Update messed everything up";"Please update your app again, as it messed up everything. The app cannot find the lights. Restarted phone, rebooted WiFi, switched all lights on and off. Nothing works. This product has been ok, not reliable at all and definitely the worst when it comes to setup.";"2020-05-10T20:53:32-07:00";"https://itunes.apple.com/us/review?id=657758311&type=Purple%20Software";"657758311";46;"en";"NEGATIVE"
321;5806092771;"travis951";"https://itunes.apple.com/us/reviews/id352277079";"4.1.0";1;"Awful Redesign";"The new redesign is absolutely terrible. What used to be simple and intuitive is now a complicated labyrinth maze of menus. That goes without mentioning the issues I have with the app talking to the lights which never happened with the previous iterations. Seriously considering switching to a competitor if LIFX doesn’t get their platform together in the near future.";"2020-04-13T08:43:15-07:00";"https://itunes.apple.com/us/review?id=657758311&type=Purple%20Software";"657758311";60;"en";"NEGATIVE"
322;5548672173;"kmt5069";"https://itunes.apple.com/us/reviews/id165712204";"4.0.0";2;"New update is extremely hard to use";"The new update is extremely hard to use. 
They did a complete overhaul and now I can’t figure out how to use it. I should be able to tap the scene and adjust and save as needed but I don’t have access to the light controls.";"2020-02-18T08:27:37-07:00";"https://itunes.apple.com/us/review?id=657758311&type=Purple%20Software";"657758311";46;"en";"POSITIVE"
323;7953179916;"MoWitJ";"https://itunes.apple.com/us/reviews/id407000058";"4.10.2";2;"Hopelessly buggy, should be removed from App Store";"Even on a 300Mbps WIFI router (while using the 2.4 ghz band), the app can’t stay connected to my LiFx strip and is most often hopelessly slow to respond (eg brightness slider doesn’t dim the lights or takes minutes to dim) and frequently gets disconnected";"2021-10-25T10:41:49-07:00";"https://itunes.apple.com/us/review?id=657758311&type=Purple%20Software";"657758311";45;"en";"NEGATIVE"
324;6067878832;"jdhendnfhdhenrnsjd";"https://itunes.apple.com/us/reviews/id28894872";"4.2.0";1;"They had to work to make an app this terrible";"This is an app for a light, simple right? yet it’s so confusing and convoluted to set up and get to work that I basically avoid it.... (unless I power cycle my Beam and have to reset it).

The animations on the light do not work with the app in the background. It’s been broken since the update to the new UI.";"2020-06-12T11:46:40-07:00";"https://itunes.apple.com/us/review?id=657758311&type=Purple%20Software";"657758311";62;"en";"NEGATIVE"
325;5969828303;"Verycherryblue";"https://itunes.apple.com/us/reviews/id120655965";"4.2.0";1;"Returned in 24 hours";"Worked initially then lost connection and Alexa would no longer recognize. After exhausting all possible reset scenarios, it went back, especially given the exorbitant cost. I also found the app to be infuriating as you can’t even delete an installed device in order to reinstall.";"2020-05-20T04:26:52-07:00";"https://itunes.apple.com/us/review?id=657758311&type=Purple%20Software";"657758311";45;"en";"NEGATIVE"
326;5652771883;"custome r";"https://itunes.apple.com/us/reviews/id249324124";"4.0.0";1;"Terrible product";"after app was changed non of my lights work they all lost connectivity and will not connect  $100s of dollars spent that no longer function properly . Don't waste your money and if you did already return it back while you can still get a refund for the bulbs. Terrible product";"2020-03-12T19:44:59-07:00";"https://itunes.apple.com/us/review?id=657758311&type=Purple%20Software";"657758311";51;"en";"NEGATIVE"
327;5617698728;"241duke";"https://itunes.apple.com/us/reviews/id25830385";"4.0.0";2;"I just don’t get it";"The redesigned app is so annoying and confusing. It’s too complicated. I don’t like the useless images of the room drawings. I can’t select multiple lights from different rooms in the schedule. And, Siri no longer recognizes my light names. I now have to say the room and the light name. Grrr.";"2020-03-04T19:47:09-07:00";"https://itunes.apple.com/us/review?id=657758311&type=Purple%20Software";"657758311";52;"en";"NEGATIVE"
328;6650872661;"CASTRO, Jr";"https://itunes.apple.com/us/reviews/id101483306";"4.5.0";5;"Works with Alexa after update";"So, I had to update my review. After the latest firmware Alexa was able to detect my light and all is well now. Yay";"2020-11-15T23:30:38-07:00";"https://itunes.apple.com/us/review?id=657758311&type=Purple%20Software";"657758311";24;"en";"POSITIVE"
329;5546906059;"Renn911";"https://itunes.apple.com/us/reviews/id238078653";"4.0.0";1;"Why?";"App designers need to know when to stop.  This new update is horrible.  It may make programming a single bulb, with a simple schedule, easier to program but following the logic to edit or create anything more complicated requires a more effort.  How about including a legacy mode?. You can still devote an entire tab on ads.";"2020-02-17T23:45:01-07:00";"https://itunes.apple.com/us/review?id=657758311&type=Purple%20Software";"657758311";57;"en";"POSITIVE"
330;5543637144;"Gngrasso";"https://itunes.apple.com/us/reviews/id18722309";"4.0.0";2;"What the ?";"Sorry I bought these lights. They should come with a technician that comes out to your house to set them up for you. App makes zero sense to me. I would be willing to delete all the scenes and rooms I have tried to set up and start over, but even that is elusive.";"2020-02-17T05:27:59-07:00";"https://itunes.apple.com/us/review?id=657758311&type=Purple%20Software";"657758311";54;"en";"NEUTRAL"
331;7986592874;"Juanchoh83";"https://itunes.apple.com/us/reviews/id209277916";"4.10.2";1;"App is no intuitive at all";"Extremely difficult tu setup the products. I have more than 2 hours trying to setup an unrecognizable LIFX color bulb. The app is anything but easy to understand. There’s no way to delete a product, only going into the “LIFX cloud” but that’s not part of any instruction. It’s very disappointing. That’s why everybody has the Phillip hue.";"2021-11-03T20:47:31-07:00";"https://itunes.apple.com/us/review?id=657758311&type=Purple%20Software";"657758311";58;"en";"NEGATIVE"
332;7581500645;"Ez dream";"https://itunes.apple.com/us/reviews/id389343434";"4.10.0";1;"App doesn’t work";"I do not use HomeKit. The LIFX app gets stuck on the Preparing Device screen. If you run setup several times over the course of a few hours, it eventually works. But it’s not worth the effort. When they work, the lights are great. But I’m returning the ones that I couldn’t get set up. Too much money for too much frustration.";"2021-07-15T20:14:06-07:00";"https://itunes.apple.com/us/review?id=657758311&type=Purple%20Software";"657758311";62;"en";"NEUTRAL"
333;6086317976;"Razorback28";"https://itunes.apple.com/us/reviews/id139405223";"4.2.0";2;"Tragically Poor Redesign";"The redesign of the app is impossible to understand. The previous design was an intuitive piece of art. I gave it 2 stars only because the general function still works, even if takes an hour to find what you need";"2020-06-17T01:12:24-07:00";"https://itunes.apple.com/us/review?id=657758311&type=Purple%20Software";"657758311";40;"en";"NEUTRAL"
334;5611955137;"kevmeister89";"https://itunes.apple.com/us/reviews/id163652022";"4.0.0";1;"Super buggy after update";"Since the update, the app takes the liberty of creating 10 different schedules for every one that I make. My light now turns on randomly through the day and it’s impossible to remove the schedule since it just re-creates itself after I have deleted it.";"2020-03-03T12:07:32-07:00";"https://itunes.apple.com/us/review?id=657758311&type=Purple%20Software";"657758311";45;"en";"POSITIVE"
335;5545540309;"tossyourwords";"https://itunes.apple.com/us/reviews/id162785940";"4.0.0";1;"Why?????";"Seriously, LIFX, what were you thinking? This app is awful!! Don’t you have a UX designer on staff? I’m not opposed to updating the old app, but you completely failed your users with this one. Can’t wait to see an update that makes this app usable again. I’m seriously tempted to sell my hundreds of dollars worth of your bulbs and switch to Hue.";"2020-02-17T16:27:17-07:00";"https://itunes.apple.com/us/review?id=657758311&type=Purple%20Software";"657758311";64;"en";"NEGATIVE"
336;8029929116;"alexmross";"https://itunes.apple.com/us/reviews/id1234817148";"4.10.3";1;"Need the customer service’s attention";"The lights are great. But the most resent updates have made my lights unusable. The app asks you enable LAN with a pop up, I did. It asks you again and sends you to settings. Then nothing the app just spins. I have tried this multiple time and have redownloaded the app. Currently I can only unplug and plug in my lights.";"2021-11-16T04:44:01-07:00";"https://itunes.apple.com/us/review?id=657758311&type=Purple%20Software";"657758311";62;"en";"NEUTRAL"
337;7675168569;"Bomar85";"https://itunes.apple.com/us/reviews/id24816160";"4.10.1";2;"Love the bulbs - Absolutely hate the app.";"Maybe it’s just me - but the UI of this app is so convoluted & confusing. I have 2 bulbs & setting up one seems to mess the settings of the other - can’t find the settings for the night vision etc.. love the actual bulbs though & their functionality.";"2021-08-09T20:36:05-07:00";"https://itunes.apple.com/us/review?id=657758311&type=Purple%20Software";"657758311";50;"en";"POSITIVE"
338;6948891393;"Tbk801";"https://itunes.apple.com/us/reviews/id139407402";"4.6.2";2;"Still not recommended";"Glitchy and unresponsive only some of the time now pertaining to sending commands to the lights. Last week, all lights could not be connected to, until I took the bulbs out and reinserted them. Nothing else and that resolved it, which was strange";"2021-02-03T06:15:26-07:00";"https://itunes.apple.com/us/review?id=657758311&type=Purple%20Software";"657758311";43;"en";"NEUTRAL"
339;6920521717;"Jupiter 6k";"https://itunes.apple.com/us/reviews/id1119007729";"4.6.2";1;"Worst software I have EVER seen";"I have had the displeasure of using this bulb and it’s abysmal software for awhile now. I am just blown away with how difficult this bulb is to set up. It just won’t connect. I’ve spent way to much time researching how to properly set up and fix this issue but it will not pair. PLEASE save yourself a headache and purchase a different brand.";"2021-01-27T10:22:40-07:00";"https://itunes.apple.com/us/review?id=657758311&type=Purple%20Software";"657758311";65;"en";"NEGATIVE"
340;6539149917;"Candace From VA";"https://itunes.apple.com/us/reviews/id182152093";"4.4.2";1;"Horrible App And Customer Service Form";"I keep getting an error message when I try to register so that I can set up my app. Then I filled out the long customer service form only for it not to be submitted. I will never buy this brand again.  Finally got registered but the light stopped working with the app";"2020-10-15T15:40:10-07:00";"https://itunes.apple.com/us/review?id=657758311&type=Purple%20Software";"657758311";53;"en";"NEGATIVE"
341;5822503735;"Creets";"https://itunes.apple.com/us/reviews/id22099146";"4.1.0";1;"Worst app ever";"Can’t connect to either of my two LIFX bulbs. One is visible but won’t complete setup (just hangs when trying to setup after connecting to it and then going back in the app). Other light isn’t recognized by the app. I didn’t think there could be an experience worse than Smart Things but this has proven me wrong.";"2020-04-16T18:54:13-07:00";"https://itunes.apple.com/us/review?id=657758311&type=Purple%20Software";"657758311";58;"en";"NEGATIVE"
342;5649040998;"Marcospsanches";"https://itunes.apple.com/us/reviews/id16427465";"4.0.0";1;"Hate the new app";"Everything was fine. The app was simple and easy to navigate. Now it’s a mess!! Can’t find anything need scroll down to find a light and sometimes I turn it on or off unintentionally. I wish they at least give us the option to switch back to the old style app. This new one is ridículos!";"2020-03-12T00:05:46-07:00";"https://itunes.apple.com/us/review?id=657758311&type=Purple%20Software";"657758311";56;"en";"POSITIVE"
343;5546375972;"Tt3322";"https://itunes.apple.com/us/reviews/id16847780";"4.0.0";1;"Broke like me in college";"After the most recent app update, the schedules I had set up stopped working and the app rarely connects with the bulb...which are really the two reasons I opted for a smart bulb. There was no change in bulb location or Wi-Fi, just a new app. Since the update, my smart bulb has been perpetually dumb and disconnected. Again, like me in college.";"2020-02-17T20:59:25-07:00";"https://itunes.apple.com/us/review?id=657758311&type=Purple%20Software";"657758311";63;"en";"POSITIVE"
344;7440186326;"Niloc87";"https://itunes.apple.com/us/reviews/id165217702";"4.8.2";1;"DO NOT BUY THE COLOR CHANGING LIGHTBULB";"Bought this light bulb to give my room some color but once i turn it off its still lit! And there are times i wake up in the middle of the night its even brighter than ever i had to turn it on and off and its still dimly lit and theres no way around it and the company isnt doing any updates to the bulb or the firmware its a nightmare!!";"2021-06-08T01:19:42-07:00";"https://itunes.apple.com/us/review?id=657758311&type=Purple%20Software";"657758311";72;"en";"POSITIVE"
345;8038973142;"morganstar2013";"https://itunes.apple.com/us/reviews/id1114112716";"4.10.3";5;"Apps okay... I love the bulbs";"I love my Lifx mini bulbs. I’m planning on ordering more. But the App doesn’t fully integrate with Goggle Home.. you can’t program patterns or fun things.";"2021-11-18T19:54:47-07:00";"https://itunes.apple.com/us/review?id=657758311&type=Purple%20Software";"657758311";27;"en";"POSITIVE"
346;5748155191;"Cargohoo";"https://itunes.apple.com/us/reviews/id6064440";"4.1.0";1;"It Disconnects For No Reason";"It took me an hour to get this app to recognize the light. Finally was able to connect and control the bulb, and I have no idea what made it finally work. 30 seconds later, it disconnected and won’t connect again. This review isn’t just for this app, but for the Lifx bulb too. Big waste of money.";"2020-04-01T16:43:01-07:00";"https://itunes.apple.com/us/review?id=657758311&type=Purple%20Software";"657758311";58;"en";"NEGATIVE"
347;5733570185;"dog gone lost!";"https://itunes.apple.com/us/reviews/id113638979";"4.0.0";1;"Redesign misses the mark!";"I have used LIFX for many years, but this last redesign is baffling. 

Why not focus on useful items like being able to set custom or flexible on/off times other than the 30 minute intervals when you chose either sunset or sunrise as your anchor. Having a random time setting that could be activated within specific time boundaries would be useful for simulating activity in the home. 

Having now tried to use this app for several weeks, this still does not make sense why LIFX changed the layout and structure.

Thumbs down on this “innovation”!";"2020-03-29T19:25:39-07:00";"https://itunes.apple.com/us/review?id=657758311&type=Purple%20Software";"657758311";95;"en";"POSITIVE"
348;5553171152;"DoctorBoz";"https://itunes.apple.com/us/reviews/id115635589";"4.0.0";1;"OMG what did you guys do, you RUINED THE APP";"This has to be the worst update of any app EVER! I have over 200 LIFX lights and I’m about to sell every single one and change to Phillips HUE just cuz the app update is that horrible! Omg! Was someone on drugs when they made this App revision. I have zero control of this individual lights, it’s so badly designed it takes hours to figure it out! OMG!";"2020-02-19T09:46:45-07:00";"https://itunes.apple.com/us/review?id=657758311&type=Purple%20Software";"657758311";69;"en";"NEGATIVE"
349;5545479149;"SAMHchs";"https://itunes.apple.com/us/reviews/id49776651";"4.0.0";1;"Bring back the old app!";"These lights are by far the best smart lights on the market. We have one in every lamp possible and have been huge fans of LIFX bulbs since they hit the market 5/6 years ago. The new app is terribly over complicated. PLEASE bring back the old app!! We are far too invested in the hardware to jump ship to another bulb.";"2020-02-17T16:02:55-07:00";"https://itunes.apple.com/us/review?id=657758311&type=Purple%20Software";"657758311";62;"en";"POSITIVE"
350;6656252527;"Rose is a savage";"https://itunes.apple.com/us/reviews/id1127659830";"4.4.2";4;"Would recommend";"It’s a pretty awesome and simple to use and you could  even buy their lights and other stuff on the app.";"2020-11-17T10:05:52-07:00";"https://itunes.apple.com/us/review?id=657758311&type=Purple%20Software";"657758311";21;"en";"POSITIVE"
351;6093915130;"user2345789";"https://itunes.apple.com/us/reviews/id1081117283";"4.2.0";4;"Great app!";"I love this app! Would definitely recommend it. It’s so fun and handy. Although I did run into some problems still one of my favorite apps!";"2020-06-18T18:42:37-07:00";"https://itunes.apple.com/us/review?id=657758311&type=Purple%20Software";"657758311";26;"en";"POSITIVE"
352;6650074470;"DWTL4668H";"https://itunes.apple.com/us/reviews/id214867837";"4.4.2";2;"Light Bulb";"Bought light bulb supposed to be easy set up with Alexa.. not true. Had many issues setting up and stops working for no apparent reason... had to set up again and again and again and again......... do not recommend";"2020-11-15T17:11:34-07:00";"https://itunes.apple.com/us/review?id=657758311&type=Purple%20Software";"657758311";39;"en";"NEGATIVE"
353;6469767672;"SpeakCT";"https://itunes.apple.com/us/reviews/id35239224";"4.4.2";5;"Five stars";"Have 5 LIFX bulbs - all were easy to setup with HomeKit and have worked perfectly.  I use IOS home app primarily but need the LIFX app for firmware updates";"2020-09-26T00:58:19-07:00";"https://itunes.apple.com/us/review?id=657758311&type=Purple%20Software";"657758311";30;"en";"POSITIVE"
354;5695689613;"unobirdben";"https://itunes.apple.com/us/reviews/id1147879609";"4.0.0";1;"Update is a joke";"The old one was simple and effective, just turn on and adjust lights and you’re done. The new interface is bogged down with useless menus and features that seem to hide what you’re actually looking for. After spending 30ish dollars on a lightbulb you’d think using it wouldn’t feel like a chore.";"2020-03-22T02:19:10-07:00";"https://itunes.apple.com/us/review?id=657758311&type=Purple%20Software";"657758311";52;"en";"POSITIVE"
355;5670642515;"pleaseupdatelifx";"https://itunes.apple.com/us/reviews/id308273856";"4.0.0";1;"LIFX messed up.";"Y’all make great lights for a big price, I paid the price for the good product and enjoyed it for a while. Now I just want to throw them away with this new update on the app. Please fix it so I don’t have to change to philips hue and just eat the cost. It’s so buggy I’m not going to bother with trying to explain the problems.";"2020-03-16T19:02:31-07:00";"https://itunes.apple.com/us/review?id=657758311&type=Purple%20Software";"657758311";68;"en";"POSITIVE"
356;6511647207;"Moto27";"https://itunes.apple.com/us/reviews/id42953054";"4.4.2";1;"Lights keep disconnecting now";"Either an app update or the iOS update (or something else) is now causing these lights to constantly disconnect. Haven’t had much problems in the past, but what ever changed is terrible. Lights haven’t changed, WiFi/network hasn’t changed...must be something on their side.";"2020-10-07T16:08:01-07:00";"https://itunes.apple.com/us/review?id=657758311&type=Purple%20Software";"657758311";43;"en";"NEGATIVE"
357;5895003420;"Da hom";"https://itunes.apple.com/us/reviews/id281773979";"4.1.0";1;"Stay clear of these";"The connectivity is the worst!!!  I actually had to buy a plug with on/off for it since the app and it’s connectivity is dogsh!t. Also i bought cheap Chinese lights that has way better app integration and connection than this one!! Cool products but bad app/app support. YOU'RE better off with hue or crapy Chinese lights trust me";"2020-05-02T16:14:49-07:00";"https://itunes.apple.com/us/review?id=657758311&type=Purple%20Software";"657758311";58;"en";"POSITIVE"
358;5792521936;"bmorr3409";"https://itunes.apple.com/us/reviews/id103426422";"4.1.0";1;"Terrible App";"This new app automatically downloaded and I lost half my lights.  Tried to add the lights again but app won’t show the lights. The lights connect to my WiFi but the app won’t find them.  They really made this app hard to work with.  Not intuitive at all. Put the old app back on!! At least it worked!";"2020-04-10T12:46:46-07:00";"https://itunes.apple.com/us/review?id=657758311&type=Purple%20Software";"657758311";58;"en";"NEGATIVE"
359;5554971631;"Crapsoftware";"https://itunes.apple.com/us/reviews/id207569115";"4.0.0";1;"Avoid!";"This app just ruined my light setup.  At least 4 lights no longer work and my groups are all messed up.  I had groups and routines setup but they have all changed with the latest update and I can no longer edit to correct.  Safe yourself the money and aggravation and avoid this debacle.";"2020-02-19T21:05:52-07:00";"https://itunes.apple.com/us/review?id=657758311&type=Purple%20Software";"657758311";54;"en";"NEGATIVE"
360;8048701558;"Lawman20005";"https://itunes.apple.com/us/reviews/id185236905";"4.10.3";1;"Worst app ever!!!";"The app works but is unreliable and for the love of god who was the person who designed this cr..!!!!!? Confusing, 0 intuitive all things mixed without any logic. I would rate this negative if i could! Thanks god i can use Home Assistant or other apps to control it, even house from Apple wich is really bad is better than this app.";"2021-11-21T10:56:25-07:00";"https://itunes.apple.com/us/review?id=657758311&type=Purple%20Software";"657758311";63;"en";"POSITIVE"
361;6828395038;"..J..D..";"https://itunes.apple.com/us/reviews/id396312047";"4.6.1";5;"LIFX Bulb A19";"Highly recommended. Works as advertised and the app is simple, attractive, and functional. Great for zoom sessions with friends or other events.";"2021-01-03T19:45:02-07:00";"https://itunes.apple.com/us/review?id=657758311&type=Purple%20Software";"657758311";22;"en";"POSITIVE"
362;5908429870;"Hollywood_ODU";"https://itunes.apple.com/us/reviews/id116977201";"4.1.0";2;"Bad User Interface";"Lots of cool things you can do with these lights but the redesigned user interface is not very user friendly or intuitive. I’m not saying the previous UI didn’t need improving, but this was not a step in the right direction.";"2020-05-05T19:44:24-07:00";"https://itunes.apple.com/us/review?id=657758311&type=Purple%20Software";"657758311";41;"en";"POSITIVE"
363;8110049691;"Mark Allan";"https://itunes.apple.com/us/reviews/id41126648";"4.10.3";1;"Zero star app update";"Honestly cannot believe you have continued to use this crappy redesigned app. The old way was way more user-friendly. Now you want to add apple home to the set up process? My device has been left on iCloud syncing forever now. Even after resetting my phone. Unbelievable.";"2021-12-08T18:57:56-07:00";"https://itunes.apple.com/us/review?id=657758311&type=Purple%20Software";"657758311";47;"en";"NEUTRAL"
364;7883175682;"pearl23jam";"https://itunes.apple.com/us/reviews/id677954891";"4.10.2";5;"Great product";"The app is easy to use and the lights behind my tv look amazing";"2021-10-05T21:54:21-07:00";"https://itunes.apple.com/us/review?id=657758311&type=Purple%20Software";"657758311";14;"en";"POSITIVE"
365;6606498395;"AaronBinmovintav";"https://itunes.apple.com/us/reviews/id1225581548";"4.4.2";5;"But other then that it’s good";"It’s be saying light off and I can’t change the color";"2020-11-03T18:06:07-07:00";"https://itunes.apple.com/us/review?id=657758311&type=Purple%20Software";"657758311";11;"en";"NEUTRAL"
366;6272771461;"wizard.wow";"https://itunes.apple.com/us/reviews/id544990022";"4.3.1";1;"Gave it a 2nd chance and it disappointed";"My first Lifx light i made some mistakes and turnt off my switch sometimes but this one i did everything right and it still breaks, the app doesn’t work and the lights glitch out half of the time, fix your product or update your garbage app.";"2020-08-02T16:15:20-07:00";"https://itunes.apple.com/us/review?id=657758311&type=Purple%20Software";"657758311";46;"en";"NEGATIVE"
