"";"id";"userName";"userUrl";"version";"score";"title";"text";"updated";"url";"app";"wordCount";"language";"sentiment"
75;5833397413;"picklesrocky";"https://itunes.apple.com/us/reviews/id222110839";"4.1.0";2;"Bring back old app!";"The lights them selves are great, I have 7 lights and they were working great for the past two years. However the app was updated and significantly changed and ever since then I have had connectivity issues with none of the lights or half of the lights showing up. Also the new app looks cooler but seems more cumbersome to do the same things it previously did. If they could either fix the issues or bring back the old app it would be a 5/5 but right now this is very frustrating as they took a huge step back.";"2020-04-19T01:36:57-07:00";"https://itunes.apple.com/us/review?id=657758311&type=Purple%20Software";"657758311";99;"en";"POSITIVE"
76;5604697996;"Overwatch's SCOTTIE PIMPIN";"https://itunes.apple.com/us/reviews/id1066550071";"4.0.0";2;"Ummm...";"So I bought the Lifx mini and was so excited to get home and just really relax with music and colors changing along with it until i realized that the app will not let me have what i want. This is such a tragic story..why does the lightbulb have a wifi connection but wont connect bluetooth? why does the light bulb connect to homekit but not for its own app?? it’s so baffling how bad this light bulb or the app is im not sure because the help guides to really help or guide either. The only reason I left two stars is because i needed to change a regular light bulb so at least the bright white will help me see.";"2020-03-01T21:29:33-07:00";"https://itunes.apple.com/us/review?id=657758311&type=Purple%20Software";"657758311";122;"en";"POSITIVE"
77;7529443256;"joe_king12";"https://itunes.apple.com/us/reviews/id339254447";"4.9.0";2;"great, when it works";"whenever I can use the app it’s amazing, I love my one bathroom light that I have and would 100% recommend it, however the app has a glitch for me where it force quits directly after I open it so i’ve been stuck turning my light on and off the old fashioned way and have been limited to only one color. My only work around has been to delete and redownload the app when this problem starts happening, but that’s kind of a hassle. If this problem wasn’t occurring for me this would definitely be a 4-5star product";"2021-07-01T21:37:27-07:00";"https://itunes.apple.com/us/review?id=657758311&type=Purple%20Software";"657758311";98;"en";"POSITIVE"
78;5930386492;"AlexxaaG";"https://itunes.apple.com/us/reviews/id1078529262";"4.2.0";1;"I wouldnt buy if they decide to keep the app the way it is now.";"Sure this app looks easier to use in a sense, but what happened to be able to customize the whole strip to more than just one color like the ones you offer on the “preset” i loved being able to customize my vibe with several colors. If i knew that this new app would only let you set to one color. I definitely would not buy this. But since ive had them since when the app was more customizable im screwed. I wish there was an option to switch back to the old app. I was planning to buy more strips but now i dont think i want too.";"2020-05-10T22:43:18-07:00";"https://itunes.apple.com/us/review?id=657758311&type=Purple%20Software";"657758311";109;"en";"POSITIVE"
79;5734265720;"ladh_v";"https://itunes.apple.com/us/reviews/id415941883";"4.0.0";2;"Confused???";"I see a lot of bad reviews about the update for this app. I didn’t have a problem...until now. I also saw one other person seem to have to the same issue as me and that is that my light doesn’t show up in the app??? It only says that my light has gone dark. I thought it was something I did since I just moved locations. But the app only works if I turn my lamp off and back on. And even after that it isn’t guaranteed to stay. I’ve reset the lamp and done everything I could. So I’m just confused. Is this really cause of the apps new update??";"2020-03-29T23:09:35-07:00";"https://itunes.apple.com/us/review?id=657758311&type=Purple%20Software";"657758311";112;"en";"NEGATIVE"
80;7411647891;"JD9090";"https://itunes.apple.com/us/reviews/id32361999";"4.8.2";1;"Difficult to Use";"I never write reviews, but must say that since this app was updated last year it’s made things way more confusing.  I can’t paint the lightstrips like I used to, the effects don’t work like they used to and I’m stuck with basically off and on.  I can change the solid colors but it used to do so many animations, and now none of those work.  Makes me wish I bought a light strip from different company.   Not to mention the strips are constantly disconnecting from my wifi when nothing else in the same area ever does and they are a pain to get connected every time.";"2021-05-31T17:36:31-07:00";"https://itunes.apple.com/us/review?id=657758311&type=Purple%20Software";"657758311";107;"en";"POSITIVE"
81;5578351913;"cactakla";"https://itunes.apple.com/us/reviews/id34128417";"4.0.0";3;"New version issues";"*updated*

New app remains confusing and focuses on features for the multi-unit home. Interface is not intuitive. More stars for multi-unit home, fewer stars for fewer units.

Pro: the schedule feature allows more than the day to dusk feature. You can turn lights on and off as many times as you like. On and off in the morning, on at night, then dim, then off. Feature I’ve wanted for a while. You can also set it to turn on all lights at once, and turn them off at different times. Takes time to set it up, but in the end, it’s a better addition. 4 of 5 stars- interface could be more intuitive.

Con: still has issues connecting to, and controlling, lights. So find lights never turned off or never turned on. But it’s random. 2 of 5 stars - basic functionality that needs to work.";"2020-02-25T04:24:47-07:00";"https://itunes.apple.com/us/review?id=657758311&type=Purple%20Software";"657758311";146;"en";"POSITIVE"
82;6267049685;"darlpo";"https://itunes.apple.com/us/reviews/id42563335";"4.3.1";1;"App version 4.3.1";"The app is so complicated. The former version was simple. I have had the updated version for I think maybe 2 months but it seems like 2 years. My lights are all messed up now. You have to search through screens to perform BASIC functions. I used to enjoy using the functionality of the lights, but no more. I don’t do anything now but turn them on and off, in addition to regretting that I spent so much money on them. It is cheaper and easier to just purchase a remote on off switch for each of your lights. Plus Internet problems will no longer impact the lights. Really.";"2020-08-01T04:57:20-07:00";"https://itunes.apple.com/us/review?id=657758311&type=Purple%20Software";"657758311";109;"en";"NEGATIVE"
83;6828664441;"Jaimer829";"https://itunes.apple.com/us/reviews/id411004152";"4.6.1";4;"Great app interface.";"The app has a beautiful user interface. The only complaints I have are that it does not stay connected to Apple home. I am also unable to see favorite lights on my Apple Watch which will not sync with the app. If the watch feature could be looked at that would be awesome. The lights themselves though are amazing I will definitely be purchasing more beams in the future.";"2021-01-03T21:45:23-07:00";"https://itunes.apple.com/us/review?id=657758311&type=Purple%20Software";"657758311";69;"en";"POSITIVE"
84;7272056058;"atourvil";"https://itunes.apple.com/us/reviews/id207663282";"4.8.1";2;"Great when the app actually works";"The lightbulb itself is great, and we really enjoy the ability to customize (by room, color, brightness, etc). However our biggest problem is with the app: we have excellent wifi and randomly the app will say the light has “gone dark” — but 9 times out of 10, the app is “loading” for multiple minutes and fails to connect to the light. It’s happening so frequently now that we’d prefer to find another smart light — too pricey to deal with the frustration of the app issues.";"2021-04-27T20:06:06-07:00";"https://itunes.apple.com/us/review?id=657758311&type=Purple%20Software";"657758311";87;"en";"POSITIVE"
85;7367653848;"BostonBruins155";"https://itunes.apple.com/us/reviews/id1249683749";"4.8.2";1;"No live customer service or tech help & bad app";"I’ve tried contacting Apple, Xfinity, and Lifx’s Customer service. Both Apple and Xfinity have found that it’s an issue with the app. I can pair my Lifx lights to HomeKit but then it says that there are no lights found in my network. I just paired it so how is this an issue. Then apple fails because it relies on the app, so this falls back on the app again. I need technical support. I am not happy with the service I am receiving as it has been more than 5 hours since I sent the form and 3 hours since I receive an automatic email. Haven’t even got one real person from Lifx.";"2021-05-20T16:05:06-07:00";"https://itunes.apple.com/us/review?id=657758311&type=Purple%20Software";"657758311";114;"en";"NEGATIVE"
86;5955568233;"rocheka";"https://itunes.apple.com/us/reviews/id469527396";"4.2.0";3;"Great product, but most recent app overhaul is not intuitive";"Love the LIFX product and my bulbs and strips are excellent. Was previously satisfied with the corresponding app. However the most recent overhaul of the app makes features much less intuitive. Everything is harder to find and isn’t as easy to operate as it was previously. I’m having a lot of issues with getting effects to work as they used to. Hoping this can be reconciled in future releases, as I do not love this latest app version...";"2020-05-16T20:15:01-07:00";"https://itunes.apple.com/us/review?id=657758311&type=Purple%20Software";"657758311";78;"en";"POSITIVE"
87;6529195593;"LightLover93";"https://itunes.apple.com/us/reviews/id8731632";"4.4.2";5;"All about that WiFi and patience";"Honestly took me a couple tries to get my WiFi configured correctly - you need a 2.4 configuration. I needed to reset both sets of light strips I bought a couple times and I still can’t get the firmware to update on one strip but the lights are absolutely beautiful and I love the app. Very cool building in  prebuilt light “scenes” on schedules to wake me up or to switch on in the evening.";"2020-10-12T18:35:43-07:00";"https://itunes.apple.com/us/review?id=657758311&type=Purple%20Software";"657758311";75;"en";"POSITIVE"
88;7852211215;"electricgrapes";"https://itunes.apple.com/us/reviews/id793990063";"4.10.1";1;"Do not recommend";"TLDR AT BOTTOM

Bought the color changing one with 3 36” strips. All of them worked individually, but when plugged into each other only the strip connected to the power cord lit up. I thought it might be an error on my end so I looked to support and there was nothing related to my problem so I tried to go further and in the end, supports last option was to “contact the seller” so I just returned it. Lastly the app was confusing in itself. Trying to make my own light pattern was a chore. Definitely not worth the $60 I payed for it. 

TLDR: Faulty lights, poor customer service, confusing app, overpriced";"2021-09-27T16:26:20-07:00";"https://itunes.apple.com/us/review?id=657758311&type=Purple%20Software";"657758311";114;"en";"NEGATIVE"
89;5727068721;"gangelici";"https://itunes.apple.com/us/reviews/id614772721";"4.0.0";1;"Disappointed";"I remember when I first got these lights a year ago, I loved them, the app was easy to use, customization was so fun and smooth. And now it’s just....Garbage. I reinstalled these lights about 4 weeks ago and the first week or so i had no problems. Now no matter what I do, whether i restart my WiFi, redownload the app, etc I cant access the lights. It just says I’ve gone dark. Unfortunately I have to pull the plug on these lights and switch to Hue or something. Hopefully y’all can get it together and maybe if I hear a friend get them and say it’s better I’ll maybe reconsider. Good luck.";"2020-03-28T10:46:01-07:00";"https://itunes.apple.com/us/review?id=657758311&type=Purple%20Software";"657758311";114;"en";"POSITIVE"
90;5608932637;"Bucksinoh";"https://itunes.apple.com/us/reviews/id11314183";"4.0.0";1;"How is it this bad?";"3 days in a row, 3 different ways I’ve been unable to control the lights from LIFX that I decided to spend money on. Day 1 - lights show up but simply don’t respond and require unplugging.  Day 2 - lights only show a shadow in the app in the place they would normally show up. Day 3 I can turn the lights off and on from the app but colors don’t respond... Come on. This isn’t a review from someone who doesn’t know what they’re doing. I have a mesh network with a solid network connection. There’s no way the lights should be locking up as well as the app failing In so many ways. Come on.";"2020-03-02T20:20:58-07:00";"https://itunes.apple.com/us/review?id=657758311&type=Purple%20Software";"657758311";118;"en";"NEGATIVE"
91;5576688613;"Tdrh53";"https://itunes.apple.com/us/reviews/id173597650";"4.0.0";2;"Updated app UI is terrible";"This new UI is god awful. You can’t reach buttons you regularly use with one hand, but the useless buttons are easily accessible at the bottom of the screen. 

They have removed so many features from the app but added “super cool” room images that a generic graphic arts student could doodle in 30 minutes. 

If I can’t have full functionality of the items I purchased because of a terrible app update, then these 20 bulbs and 60 feet of z-strip will be in the next garage sale for some poor sap to buy.";"2020-02-24T19:30:35-07:00";"https://itunes.apple.com/us/review?id=657758311&type=Purple%20Software";"657758311";94;"en";"NEGATIVE"
92;6967708941;"V_A_2_2";"https://itunes.apple.com/us/reviews/id599464492";"4.6.2";5;"Best of the best so far!";"I’ve been experimenting with many different smart lights as I build my “smart home”. These are the best, hands done. The lights are incredible, colors have amazing saturation, colors are brights and full, the app is amazing - some may say it has some flaws, maybe I’m not too picky with the tech part of it because i haven’t found any - highly recommend!!";"2021-02-07T18:55:23-07:00";"https://itunes.apple.com/us/review?id=657758311&type=Purple%20Software";"657758311";64;"en";"POSITIVE"
93;5694338669;"Danny Kx";"https://itunes.apple.com/us/reviews/id398989885";"4.0.0";5;"The new version seems to work like a charm!";"The older version had issues in properly guiding folks to connect to the lightbulb 💡, but when I last tried it, the interface looked different and I was able to connect super easily, in fact I was shocked that they improved the experience so much... 

Also works with Hotspot!";"2020-03-21T18:32:40-07:00";"https://itunes.apple.com/us/review?id=657758311&type=Purple%20Software";"657758311";49;"en";"POSITIVE"
94;7192674843;"TrentMcgrents";"https://itunes.apple.com/us/reviews/id1079385108";"4.7.2";2;"What a mess";"After having tons of trouble getting the lights to work and reading reviews stating that the latest app update was giving others trouble I though I was doomed. But I got it to work.

I kept getting an error when trying to connect the lights in the app. Finally I uninstalled everything and made a new account. From there I “forgot” all other WiFi networks on my iPhone. I *think* that my phone was disconnecting from the bulb WiFi during setup and connecting to my other WiFi.

Good luck. What a mess...";"2021-04-06T20:31:56-07:00";"https://itunes.apple.com/us/review?id=657758311&type=Purple%20Software";"657758311";92;"en";"NEGATIVE"
95;6808192697;"JJacqueeM";"https://itunes.apple.com/us/reviews/id1109875346";"4.6.1";3;"Kees disconnecting";"I am not sure if it is my internet or the lightbulb itself but I think it’s the lightbulb because every other device connected to my internet never disconnect. Ever. I keep connecting and setting it up but after two days tops it disconnects and says it’s not connected to cloud and Alexa can’t manage it anymore. It works great WHEN it does work but I’m having to restart the setting up process every two days it’s becoming annoying.";"2020-12-29T13:57:18-07:00";"https://itunes.apple.com/us/review?id=657758311&type=Purple%20Software";"657758311";79;"en";"POSITIVE"
96;6199502555;"Kaylinmaa";"https://itunes.apple.com/us/reviews/id322912665";"4.3.0";1;"App is Unusable";"The app was great before, but ever since the update, I dread every time I have to open the app. It’s difficult to find anything - even figuring out where to go to change the color of the lights is practically impossible. My lights are constantly flickering off and I have to reset them constantly because they won’t stay connected. I typically only adjust the lights using my Google Home app because at least that way I can see what I’m doing. Huge disappointment, especially with how great the app used to be. If you’re looking for smart lights, I’d steer clear of LIFX.";"2020-07-14T22:38:04-07:00";"https://itunes.apple.com/us/review?id=657758311&type=Purple%20Software";"657758311";104;"en";"POSITIVE"
97;5954613751;"thankyouforwhatyoudo";"https://itunes.apple.com/us/reviews/id1098872147";"4.2.0";3;"FIX THIS";"Ever since I got the lights 2 years ago they always default to 3500k and when I change it to 8000k it stays for about 3 light switches then switches back to 3500k. 
I’m on iPhone 6 but even with the desktop app it does this. 
LIFX has did right by me for sending me a replacement light when mine broke so 3 stars for that service. I’ll make this 5 stars once this annoying problem gets resolved but they redesigned the app so it seems like they care about the customers.";"2020-05-16T14:43:28-07:00";"https://itunes.apple.com/us/review?id=657758311&type=Purple%20Software";"657758311";92;"en";"NEGATIVE"
98;7229668907;"CapnYos";"https://itunes.apple.com/us/reviews/id33745627";"4.8.1";1;"Don’t get an ulcer-no customer support";"I purchased a LOT of this companies bulbs and they are expensive. When we sold a vacation home and tried to use them on another network-no soap and the app interface on less than user friendly.

I have spent the last week and a half 2-finger texting Library of Congress size files of info to these Jaspers and no response.

Admittedly I am a 62 year old curmudgeon who hates typing. I asked to get a call to clear this up and it would take less that 5 minutes. In exchange for money and loyalty, you have to jump through hoops and stress out. The children who run companies today hide behind technology to avoid providing actual customer service and speaking to a fellow human being. Oh yeah-now they can add COVID as an excuse not to do their jobs.

The products are now $80 incandescent bulbs. Should have gone to Wal-Mart and spent a quarter.

Look elsewhere.

So endeth the rant!";"2021-04-16T12:47:22-07:00";"https://itunes.apple.com/us/review?id=657758311&type=Purple%20Software";"657758311";162;"en";"NEGATIVE"
99;5674990899;"Mike McGarry";"https://itunes.apple.com/us/reviews/id37845506";"4.0.0";1;"Broken since update";"Ever since the recent update I’ve had issues where my I have to tap my lights several times in app to turn them on. Sometimes only 1 light turns on in a group. Effects such as flicker not working like it used to and have to constantly pick a light or group to use it on. Sometimes 1 light will get the effect. If I am using Alexa to turn lights on or off there’s about a 15 second delay and not all lights respond either. That used to be pretty much instantaneous. I have updated all lights to the latest firmware and still have issues now.";"2020-03-17T18:16:25-07:00";"https://itunes.apple.com/us/review?id=657758311&type=Purple%20Software";"657758311";107;"en";"NEGATIVE"
100;7479236508;"OneNOnlySev";"https://itunes.apple.com/us/reviews/id161171862";"4.9.0";4;"Nice";"Overall, I like them quite a bit. I use them with an Echo system.

There are some crucial features missing, IMO. You cannot automate effects with a Scene, or really do anything with a scene except adjust to a static color. Crazy. The lights definitely have MUCH more potential than the app allows.

I don‘t need Christmas-light-programming level stuff, but at least be able to turn on a scene where the lights have a pattern instead of just set to 1 theme/color statically.

Also, the Echo LIFX Skill is just as limited if not more so, which means there is not nearly as much as you can do with pure voice commands via Routine setup as through the app.

Still love the lights, but all the software is way behind.";"2021-06-18T10:24:02-07:00";"https://itunes.apple.com/us/review?id=657758311&type=Purple%20Software";"657758311";130;"en";"POSITIVE"
101;6094312146;"Gokuvsichigo";"https://itunes.apple.com/us/reviews/id41688996";"4.2.0";5;"The more the better";"I used to be on the fence about the updated app layout but after spending more time with the app(and adding more lights) I recognize that it feels like I have more control over scenes and animation of the lights. I got four extra lights after moving and my apartment is so much more expressive now that I have 6. I’d buy more.";"2020-06-18T21:07:33-07:00";"https://itunes.apple.com/us/review?id=657758311&type=Purple%20Software";"657758311";63;"en";"POSITIVE"
102;5586454129;"gabeof300";"https://itunes.apple.com/us/reviews/id457745602";"4.0.0";1;"New Update is Awful";"Bring back the old version, app is super unresponsive, widgets don’t work properly, there’s a MASSIVE delay from when I press the button and the lights turning on, I’m talking at least a minute or two sometimes. I’ve been thinking of changing brands now that my lights are very unresponsive and are very frustrating to use. Just fix the app. Or don’t release an update that’s gonna break everything. If things go back to how they used to be then I’ll give it 5 stars. The User interface is garbage and just a terrible app now. Don’t recommend at this moment. 1/10";"2020-02-27T00:53:40-07:00";"https://itunes.apple.com/us/review?id=657758311&type=Purple%20Software";"657758311";102;"en";"NEGATIVE"
103;5586451098;"KrisArkade";"https://itunes.apple.com/us/reviews/id43033320";"4.0.0";5;"Love the options!";"I myself welcome the new update to the app. I love having the widget options and a quick way to turn groups of lights on and off.

I have outfitted my entire condo with over 35 LIFX bulbs and Z strips and I haven’t had a single issue with any of them and they’ve been running solid well over 3 years now. 

Very happy with the update!! Thank you!";"2020-02-27T00:52:49-07:00";"https://itunes.apple.com/us/review?id=657758311&type=Purple%20Software";"657758311";69;"en";"POSITIVE"
104;7214504941;"D";"https://itunes.apple.com/us/reviews/id138603636";"4.7.2";1;"Good light but Good grief this app";"Recently purchased these lights. Love them. Works great with apple home kit. 

The app on the other hand is not user friendly at all. For some reason, when setting up a light and selecting a location it seems to just create a new location. I have 3 lights each I have added, thinking I’m adding to the existing “home” location it creates a new location. I tried multiple ways to add the lights to one single location and it doesn’t work. Now I’m stuck with 3 home locations and no way to delete any of the duplicates.";"2021-04-12T09:09:48-07:00";"https://itunes.apple.com/us/review?id=657758311&type=Purple%20Software";"657758311";97;"en";"POSITIVE"
105;6491070012;"LincPosty";"https://itunes.apple.com/us/reviews/id114453814";"4.4.2";1;"Useless";"I have tried twice to order products from this company.  Since the beginning of 2020, practically all of their products have been out of stock.  My two attempts at ordering were when products we're shown to be available.  Not so.  Both my attempts at ordering were thwarted by ”unfortunate system errors” even though the web site indicates that all systems are functioning normally.   The orders we're then cancelled and money returned but that isn’t the point.  The company apparently doesn't service everyone equally, so don’t even bother.";"2020-10-01T23:16:29-07:00";"https://itunes.apple.com/us/review?id=657758311&type=Purple%20Software";"657758311";87;"en";"NEGATIVE"
106;6065584724;"msof";"https://itunes.apple.com/us/reviews/id36801292";"4.2.0";1;"Worst update ever";"The new app is unusable. No consistent user interface, for example, clicking on a room (at the top) brings up a different pop up than clicking on a favorite (right below). Short clicks and long clicks do different things. Everything became much more complicated. But the new app bombards you with ads instead. The main objective of the update seems to be to sell you additional light bulbs at every turn.

My family is refusing to use this. We will be expanding our use of Philips Hue in the house and will discontinue the use of Lifx. This is stupid!";"2020-06-11T22:07:55-07:00";"https://itunes.apple.com/us/review?id=657758311&type=Purple%20Software";"657758311";100;"en";"NEGATIVE"
