"";"id";"userName";"userUrl";"version";"score";"title";"text";"updated";"url";"app";"wordCount";"language";"sentiment"
180;6597923065;"Mooshu20020";"https://itunes.apple.com/us/reviews/id1224847321";"4.4.2";1;"Connection";"This app is horrible. I got it connected the first time but it wouldn’t allow me to change the color. Then it kept disconnecting with the WiFi. After restarting it, I cant even connect back to the light bulb. I see it on the list, press it, then it won’t let me skip the Apple home part. Won’t even connect to my Alexa. Horrible purchase. If they actually worked out this app, it could compete with Phillips hue or something. Good company, bad choices.";"2020-11-01T08:32:03-07:00";"https://itunes.apple.com/us/review?id=657758311&type=Purple%20Software";"657758311";84;"en";"NEGATIVE"
181;5548549295;"Scdftrdfbjjhgg";"https://itunes.apple.com/us/reviews/id210800481";"4.0.0";1;"New App is a Step Backwards";"I have a house full of LIFX lights including top end elements like LIFX Tile.  I’ve always been an enthusiastic fan and supporter of LIFX.

I downloaded the new app and for the first time ever, I’m experiencing multiple connectivity issues with my lights.  Lights are dropping offline frequently.  Lights frequently do not respond to color, scene or annimation changes.

In addition, the new UI for me provides an inferior experience.  Actions take more taps on the screen,  functions I frequently used are buried under multiple windows now, no part of this software upgrade seems to have improved my interactions with my light set.

LIFX had a good app.  At least for me personally, this version is a disappointing regression.  

If you haven’t upgraded,  consider not going there.";"2020-02-18T07:47:23-07:00";"https://itunes.apple.com/us/review?id=657758311&type=Purple%20Software";"657758311";128;"en";"POSITIVE"
182;7259418355;"Joe 1953";"https://itunes.apple.com/us/reviews/id103208363";"4.8.1";3;"Communicating with Device";"Got stuck on communicating with Device and it wouldn’t connect with my phone. After digging for help. I found that turning off cell service helps. And it did. No where in the app was this stated. I advise that it gets added as a solution when connecting to WiFi. Because I was waiting forever.";"2021-04-24T10:35:59-07:00";"https://itunes.apple.com/us/review?id=657758311&type=Purple%20Software";"657758311";54;"en";"POSITIVE"
183;6065496851;"Ebright82_";"https://itunes.apple.com/us/reviews/id122641019";"4.2.0";3;"New arrangement is confusing";"I can see rooms. I can see rooms have multiple lights. But I can’t get to control only one of the lights in bedroom.

I am sure individual controls are *somewhere*. Not usable. 3 stars are for the overall light quality, app gets a 0.

EDIT: turns out if a light is “unreachable” the individual controls turn to a stop sign. But the room control stays normal. In my case both light had gone unreachable, so no controls for that room.

Suggestion: Instead of a giant drawing of each room, I would make the control easier to understand. Redundantly showing name of the room and a big drawing is a waste of screen.";"2020-06-11T21:28:08-07:00";"https://itunes.apple.com/us/review?id=657758311&type=Purple%20Software";"657758311";113;"en";"NEGATIVE"
184;5782682892;"JadMcdad";"https://itunes.apple.com/us/reviews/id1079853082";"4.1.0";1;"Hot 2 lights that I can not connect";"I got 2 A19 lights that are not connecting. The older app version had a lot of issues but it always connected the new lights. This is the first time I try to use the new app update to install new lights. I gotta say it's a complete failure,the lights are not connecting no matter what I try. I tried restarting my ph9be and the wifi network but in vain. Can lifx at least built on the user experience,I mean they have a great product but not so great app.";"2020-04-08T14:05:16-07:00";"https://itunes.apple.com/us/review?id=657758311&type=Purple%20Software";"657758311";90;"en";"NEGATIVE"
185;5629187596;"Washed shots";"https://itunes.apple.com/us/reviews/id206358565";"4.0.0";3;"Disappointed With the New App";"Honestly, the LIFX lights are incredible. The app? Pretty bad.. the old app wasn’t great, but at least it was more straightforward and had more functionality than this app. It seems like there was very little user research done on this new app, because the ux is pretty bad. Please fix this! Please add back in the functionality to “paint” my own custom themes.";"2020-03-07T09:17:37-07:00";"https://itunes.apple.com/us/review?id=657758311&type=Purple%20Software";"657758311";64;"en";"POSITIVE"
186;7719753391;"DooLy1073";"https://itunes.apple.com/us/reviews/id391205664";"4.10.1";3;"Great lights but plagued with connectivity issues";"Setting up issues and connection drops  all the time. Always a fear of wether it will work or not the moment I ask Alexa to turn on the lights...for the price....go with philips hue (which I also have, and it's lightyears ahead of user friendliness and connectivity prowess) if you are not concerned with lumen output.";"2021-08-21T16:18:09-07:00";"https://itunes.apple.com/us/review?id=657758311&type=Purple%20Software";"657758311";56;"en";"NEGATIVE"
187;7592519895;"THOMASCMONEY";"https://itunes.apple.com/us/reviews/id38386257";"4.10.1";1;"HomeKit Nonsense";"I have around 20 bulbs and have never had an issue until now… I can’t set these bulbs up directly through the app without HomeKit.  Well I use Alexa as my hub and use IOS as my phone.  It’s a nightmare! I’ve tried the 15min nonsense they say to do to get around HomeKit and all the other tricks they say, nothing works.  Why would you change this?  You go through support and the basically tell you too bad!  This needs to be resolved!!!";"2021-07-18T19:08:21-07:00";"https://itunes.apple.com/us/review?id=657758311&type=Purple%20Software";"657758311";84;"en";"NEGATIVE"
188;7920078689;"NaeeNaee0420";"https://itunes.apple.com/us/reviews/id1045072547";"4.10.2";2;"Nice but confusing";"My problem isn’t with the lights, but I believe the app (feel free to correct me if I’m wrong). I keep having trouble connecting my light strips to the app itself, meanwhile they connect to my HomeKit just fine!

I’ve followed all the prompts and instructions on the website and the manual from the box but haven’t had any luck. Not sure if anyone has also had this issue.";"2021-10-16T01:15:32-07:00";"https://itunes.apple.com/us/review?id=657758311&type=Purple%20Software";"657758311";69;"en";"NEGATIVE"
189;7874446016;"Mav 40";"https://itunes.apple.com/us/reviews/id32005895";"4.10.2";1;"Garbage";"If you ever change your wifi network plan on tossing this bulb in the trash. You will not be able to delete your device or set it up as a new device or change the wifi settings the bulb uses to connect, the factory reset doesn’t actually reset the bulb and you’ll be left with a regular old bulb, and the crappy app that no longer works. Don’t waste your money. I’ve bought $8 bulbs that work flawlessly. Avoid.";"2021-10-03T13:46:56-07:00";"https://itunes.apple.com/us/review?id=657758311&type=Purple%20Software";"657758311";79;"en";"NEGATIVE"
190;7257119765;"Evan Lewis";"https://itunes.apple.com/us/reviews/id42770754";"4.8.1";2;"Hope LIFX doesn’t lose the smart home war because of their app.";"The bulbs are great and I love having everything be consistent as far as functionality across my lights. But man, the app is falling way behind. The UX is not intuitive. The icons are super weird. I keep waiting for a Home Screen widget but there’s no sign of one. You guys have a great product. But it might be time to get some outside help with your app.";"2021-04-23T20:56:27-07:00";"https://itunes.apple.com/us/review?id=657758311&type=Purple%20Software";"657758311";69;"en";"POSITIVE"
191;8007503242;"Garcia Aces";"https://itunes.apple.com/us/reviews/id142574870";"4.10.2";5;"Best wifi bulbs";"If you are trying to set the mood or if you don’t have a third hand while carrying your child. These bulbs are for you. With your voice go from bright settings too dim in a second. Love these bulbs.";"2021-11-09T20:18:16-07:00";"https://itunes.apple.com/us/review?id=657758311&type=Purple%20Software";"657758311";40;"en";"POSITIVE"
192;5873861916;"WorldWideWes";"https://itunes.apple.com/us/reviews/id126278442";"4.1.0";1;"Uh Does It Work";"I bought my first LIFX bulbs in 2016. They worked until the new app upgrade. They don’t seem to connect now and are basically dumb bulbs at this point. Not great. Not sure if it’s a coincidence on the timing or the app upgrade, but it makes me sad. I want to order more, but my confidence in the product does not encouraging. I have bought 5 bulbs from LIFX and am not planning on adding others till this sorts itself out. Debating going another direction.";"2020-04-27T23:03:03-07:00";"https://itunes.apple.com/us/review?id=657758311&type=Purple%20Software";"657758311";86;"en";"NEGATIVE"
193;5749481122;"ADesignType";"https://itunes.apple.com/us/reviews/id25726428";"4.1.0";1;"Updated app is painful! Switching to Hue!";"This update has been a disaster to the point we took several of our bulbs out so we could have controllable light! Unfortunately we own  11 lights, but all are on eBay now. After several life sucking sessions of trying to get back to what we had and liked before the “update” we give up. Life’s too short to spend this kind of time crawling out of a hole you didn’t dig.

Good product. Horrible software. BYE!";"2020-04-01T23:20:30-07:00";"https://itunes.apple.com/us/review?id=657758311&type=Purple%20Software";"657758311";77;"en";"NEGATIVE"
194;5631418966;"Sven Jobenson";"https://itunes.apple.com/us/reviews/id29305538";"4.0.0";1;"Please revert to the previous version of the App";"The new version of app is terrible. Very difficult to use and lost functionality of a favorite feature - color painting. Please listen to reviews and return the to the old version until your team figures out how to deliver an updated more user friendly product. In the meantime, at least give me back the functionality that drove my decision to purchase this instead of Phillips.";"2020-03-07T22:15:35-07:00";"https://itunes.apple.com/us/review?id=657758311&type=Purple%20Software";"657758311";66;"en";"POSITIVE"
195;5608893031;"skinnybones2013";"https://itunes.apple.com/us/reviews/id41789606";"4.0.0";5;"Watch app.";"UPDATE 
—————
I restarted my watch and phone and it’s working fine now.

I like what they did to the app, except not watch watch app that I used daily almost NEVER works. I like the color picker and the slider. But it’s useless if I doesn’t work.";"2020-03-02T20:07:44-07:00";"https://itunes.apple.com/us/review?id=657758311&type=Purple%20Software";"657758311";48;"en";"NEGATIVE"
196;5515728030;"flashpirate";"https://itunes.apple.com/us/reviews/id26463524";"4.0.0";5;"Wonderful and unexpected new app design";"Extremely impressed. A unique and smart design, very well executed, snappy and feels great to use, and feels very native for iOS. Also love the new widgets. Completely breathes new lifx into my experience. And nearly bug free! (URL for HomeKit docs 404s.) Thank you!!!";"2020-02-10T22:48:37-07:00";"https://itunes.apple.com/us/review?id=657758311&type=Purple%20Software";"657758311";45;"en";"POSITIVE"
197;6571332066;"The_Disgruntled_Playa";"https://itunes.apple.com/us/reviews/id1149545060";"4.4.2";1;"Light sets to 1% after closing app/ Won’t detect new light";"Not sure what changes were made to the app in the last couple months but I every time I close the app and reopen it, it sets my like back down to 1%. 

In addition, it *WILL NOT* detect my new LIFX mini. For the life of me I cannot get it to connect. I got my first light to connect no problem and consider myself very tech-savvy but still, no luck connecting the new light. It’s honestly incredibly frustrating.";"2020-10-24T22:01:31-07:00";"https://itunes.apple.com/us/review?id=657758311&type=Purple%20Software";"657758311";80;"en";"POSITIVE"
198;5989446219;"Arcadering";"https://itunes.apple.com/us/reviews/id442467197";"4.2.0";1;"It won’t stop flashing rainbow";"My new led lights are flashing rainbow, I’ve never had this issue before, my old ones messed up, and I’ve spent two hours trying to fix it, if I plug it in and out 5 times it won’t restart, the new update is very confusing and I just don’t exactly like it, it’s hard to control and this light is at 100% brightness and it really hurts my eyes, it won’t go down at all, I need help with this led light, it’s really messed up.";"2020-05-24T15:08:55-07:00";"https://itunes.apple.com/us/review?id=657758311&type=Purple%20Software";"657758311";86;"en";"NEGATIVE"
199;5873388322;"DD1757";"https://itunes.apple.com/us/reviews/id24496904";"4.1.0";1;"What happened";"I really dislike the new version of the app.  I understand people don’t like change and it takes time to get used to it, but I still can’t make sense of how to manage these lights.  I fumble around the app and eventually get what i need however I interact with it a lot less now.  To make matters worse ever since the new UI was launched my lights have been disconnecting from the network.  Very frustrating.";"2020-04-27T20:13:29-07:00";"https://itunes.apple.com/us/review?id=657758311&type=Purple%20Software";"657758311";77;"en";"NEGATIVE"
200;7899349101;"larepete";"https://itunes.apple.com/us/reviews/id633491347";"4.10.2";4;"Apple Watch app now freezes";"Ever since the recent iOS update, Lifx on my watch freezes every time I try to use it. Deleted and reinstalled, same thing. That feature was about half of the reason I have the bulbs. 
Developer, please fix.";"2021-10-10T07:47:20-07:00";"https://itunes.apple.com/us/review?id=657758311&type=Purple%20Software";"657758311";38;"en";"POSITIVE"
201;6057316134;"Ozzie159";"https://itunes.apple.com/us/reviews/id592488918";"4.2.0";3;"It’s cool but has troubles.";"Lights and everything is cool and great, has great customization with everything but some light flicker randomly, or don’t full shut off, it will have a very light green and dim light on even though on the app the light is turned off. I had a light completely disconnect on me and I had to restart all of my lights to connect.";"2020-06-09T21:18:29-07:00";"https://itunes.apple.com/us/review?id=657758311&type=Purple%20Software";"657758311";62;"en";"POSITIVE"
202;5546279032;"Alec.L";"https://itunes.apple.com/us/reviews/id380287484";"4.0.0";5;"They figured it out.";"Before this new update I liked the app but didn’t love it. Long story short it felt so one sided. After this new control in the update they made me feel more in control. Y’all figured it out. 🥦";"2020-02-17T20:28:22-07:00";"https://itunes.apple.com/us/review?id=657758311&type=Purple%20Software";"657758311";39;"en";"POSITIVE"
203;5541898387;"WolfLady74";"https://itunes.apple.com/us/reviews/id22647482";"4.0.0";2;"Love the bulb, hate the new app design";"I love these bulbs. I had all of them set perfectly and now the app has completely changed. For some reason two of my lights are grouped that weren’t grouped before. I can’t get to one of them to fix the settings. The new design of the app is the absolute opposite of user friendly and it’s annoying. I can’t get anything to work right.";"2020-02-16T20:51:00-07:00";"https://itunes.apple.com/us/review?id=657758311&type=Purple%20Software";"657758311";65;"en";"POSITIVE"
204;6663837214;"Gnarly bro!";"https://itunes.apple.com/us/reviews/id149486156";"4.5.0";4;"BUG 🐛";"Lights: 1 LIFX BR30 serial d073d522e1c8
Issue: Home integration with Siri and schedules. Siri mistakenly says the light is turned off when it’s not. 

The light works great but Siri won’t turn the light off if a schedule exists. I have an off at 11pm and on at 7am schedule. When it’s time to leave the house Siri will not turn the light off but say she did. 

The way to reset this is to ask Siri to turn the light on even if it’s still on, then ask her to turn it off to have her actually turn it off. 

Is this a legacy flaw? Are the new bulbs not experiencing this?";"2020-11-19T12:52:24-07:00";"https://itunes.apple.com/us/review?id=657758311&type=Purple%20Software";"657758311";113;"en";"POSITIVE"
205;6750736976;"SarieMouse724";"https://itunes.apple.com/us/reviews/id259540002";"4.6.0";5;"One of my best purchases";"Incredibly happy with the purchase of my LIFX light strip and very pleased with the app! So happy with the customization options and the ability to save as scenes with unique names! Thank you LIFX team and please keep up the great work!!";"2020-12-13T17:49:02-07:00";"https://itunes.apple.com/us/review?id=657758311&type=Purple%20Software";"657758311";43;"en";"POSITIVE"
206;6653767144;"154london";"https://itunes.apple.com/us/reviews/id248359463";"4.4.2";1;"Cannot get these to work correctly.";"I have spent a lot of time trying to make these work. I have a lightbulb that is supposed to hook up to Alexa. It took a while just to get it to turn on and off, but once I accomplish that I was unable to have Alexa operated. Now, three days after it was working, it is failing to respond as just a light that I could turn on by way of my phone. Very disappointed in the complexityAnd dependability.";"2020-11-16T17:59:09-07:00";"https://itunes.apple.com/us/review?id=657758311&type=Purple%20Software";"657758311";81;"en";"NEGATIVE"
207;7879607234;"Broba.Fette";"https://itunes.apple.com/us/reviews/id363136664";"4.10.2";1;"Literally unusable";"Connected the light, which was a complete hassle because they haven’t updated the instructions to fit the new app structure so you just have to figure it out yourself.
But it finally says light connected successfully but still never shows up in the app. I can turn it on and off with the HomeKit app, but that’s it.
I overpaid for a fancy light that changes colors, but can’t actually change the colors.

Fun";"2021-10-04T22:40:13-07:00";"https://itunes.apple.com/us/review?id=657758311&type=Purple%20Software";"657758311";74;"en";"POSITIVE"
208;6601083177;"pburtchaell";"https://itunes.apple.com/us/reviews/id216059667";"4.4.2";4;"Love the lights, app could be more simple";"First off, these lights are awesome and I love the smart home support & integrations. I’m able to use it with Siri and Google Assistant, which is great. The app is nice, but I feel like it could be more simple — there’s a lot of tabs & options. Is there a way to simplify it?";"2020-11-02T06:21:04-07:00";"https://itunes.apple.com/us/review?id=657758311&type=Purple%20Software";"657758311";56;"en";"POSITIVE"
209;6921018311;"StevenWhoPlaysGames";"https://itunes.apple.com/us/reviews/id456089069";"4.6.2";4;"Good App, Some Headaches";"I recently learned you cannot set up light bulbs while connected to a vpn. If you are having setup issues, make sure you are not on a vpn. Initially pairing the lightbulbs can be very annoying but the product itself is high quality";"2021-01-27T13:24:26-07:00";"https://itunes.apple.com/us/review?id=657758311&type=Purple%20Software";"657758311";43;"en";"NEGATIVE"
210;5518322363;"4FEB291";"https://itunes.apple.com/us/reviews/id26768738";"4.0.0";5;"Great update!";"I have several of these bulbs distributed around my house and an LED strip for my office lighting. This new 4.0 version is much cleaner looking and easier to use. No problems upgrading. Works well on both my iPad and iPhone.";"2020-02-11T12:22:45-07:00";"https://itunes.apple.com/us/review?id=657758311&type=Purple%20Software";"657758311";41;"en";"POSITIVE"
211;5517364986;"Veryous";"https://itunes.apple.com/us/reviews/id37316378";"4.0.0";1;"Change isn’t always good";"Too much moving and swiping now. I have to click and swipe way more to make my home respond the same. 

Is there I can switch back to the classic design? I can’t imagine a new user finding this intuitive more so than the old version. I can’t and I’ve had these lights for years. 

Removed app auto updates on my other devices so they don’t have to get this update.";"2020-02-11T06:53:27-07:00";"https://itunes.apple.com/us/review?id=657758311&type=Purple%20Software";"657758311";71;"en";"NEUTRAL"
212;6971561213;"LadyLisaKittyMomma";"https://itunes.apple.com/us/reviews/id448370854";"4.6.2";5;"I Love This!!!";"I Love all the different color shades & multiple kinds of ways to work ur lights - I wish this kind of technology had been around when I was growing up in the Disco era instead of having to use big o disco balls😊";"2021-02-08T17:49:16-07:00";"https://itunes.apple.com/us/review?id=657758311&type=Purple%20Software";"657758311";44;"en";"POSITIVE"
213;6673802123;"i git";"https://itunes.apple.com/us/reviews/id492258100";"4.5.0";1;"No HomeKit support";"My lights no longer work with HomeKit I’ve tried absolutely everything from resetting the lights to my home network. They’re on wifi and work fine with the app but won’t pair to HomeKit. Like the rest of my smart devices. I’ve got 4 of these lights and considering switching to something else. What a waste. I can’t even set them up properly to enjoy my full smart home experience. How disappointing..........";"2020-11-22T06:47:22-07:00";"https://itunes.apple.com/us/review?id=657758311&type=Purple%20Software";"657758311";71;"en";"POSITIVE"
214;6615711513;"SerenityH2018";"https://itunes.apple.com/us/reviews/id646619190";"4.4.2";1;"Do not buy";"I just got this yesterday and it was working just fine. This morning i tried to turn on the lights while i listened to music but the app was blank. I tried connecting to wifi and it just says no connection. Tried adding it to my home app it wont find it. Im so upset WASTE OF MONEY !!! $75 gone ! Normally this happens after you've had it for a while i just got mines YESTERDAY night hasn't even been a full 24 hours.";"2020-11-06T09:24:18-07:00";"https://itunes.apple.com/us/review?id=657758311&type=Purple%20Software";"657758311";85;"en";"NEGATIVE"
215;7182336628;"Ujdjeaujsji„";"https://itunes.apple.com/us/reviews/id144393038";"4.7.2";3;"Quality is slipping";"These were THE best option on the market for a while. However recently, the app quality seems to be slipping.

For instance:

In schedules, it now takes me a solid two attempts to save changes. The first time around doesn’t take so I have to perform the same steps again.

Also, that’s a lot of personal data collection. Probably be changing this review until some of those are changed to “data not linked to you.” I understand the app functionality parts but advertising and analytics... come on, anonymize that like it’s 2021.";"2021-04-04T04:14:01-07:00";"https://itunes.apple.com/us/review?id=657758311&type=Purple%20Software";"657758311";92;"en";"POSITIVE"
216;7092982392;"CiabattaLoav";"https://itunes.apple.com/us/reviews/id1223053159";"4.7.1";5;"Major upgrade to my home";"App needs a lil more work for some bugs, but still 5 stars for the quality overall, one of my favorite purchases";"2021-03-11T19:32:02-07:00";"https://itunes.apple.com/us/review?id=657758311&type=Purple%20Software";"657758311";22;"en";"POSITIVE"
217;5951665798;"xman36582";"https://itunes.apple.com/us/reviews/id902722239";"4.2.0";4;"Visualizer problems";"How can I get the visualizer to work and go with the beat of the music because right now it’s not accurate it flashes on its own when nothing is playing too. But every thing else it good👍🏽 but LIFX how can I fix this problem";"2020-05-15T22:33:03-07:00";"https://itunes.apple.com/us/review?id=657758311&type=Purple%20Software";"657758311";46;"en";"NEGATIVE"
218;6593621974;"Fierce Jonesy";"https://itunes.apple.com/us/reviews/id40837561";"4.4.2";2;"What happened?";"I was an early adopter of LIFX and have happily purchased more than a dozen bulbs. The new App UI is ridiculously complicated now. It’s not at all intuitive and makes what was once a great experience time consuming and frustrating. I hope they listen to the many saying the same thing and revert to the more user friendly interface.";"2020-10-31T05:52:29-07:00";"https://itunes.apple.com/us/review?id=657758311&type=Purple%20Software";"657758311";60;"en";"POSITIVE"
219;6056809362;"ayden phare";"https://itunes.apple.com/us/reviews/id609926987";"4.2.0";5;"App has a few flaws";"This app is amazing but it also has its flaws for example sometimes it doesn’t wanna connect to the internet or the light, but other than that I love the app!";"2020-06-09T18:04:16-07:00";"https://itunes.apple.com/us/review?id=657758311&type=Purple%20Software";"657758311";31;"en";"POSITIVE"
220;7551868344;"Riley Xscobar";"https://itunes.apple.com/us/reviews/id85964602";"4.10.0";4;"Fine for me";"I’ve had them a while and they still work. My only issue is the Apple Watch app no longer has my lights even though I have favorites setup. Tried reinstalling and unselecting and reselecting with no success";"2021-07-07T21:44:15-07:00";"https://itunes.apple.com/us/review?id=657758311&type=Purple%20Software";"657758311";37;"en";"NEGATIVE"
221;5727708553;"FreqFlyAlex";"https://itunes.apple.com/us/reviews/id482387083";"4.0.0";1;"Garbage";"The old app made connections fast intuitive and effortless. Not the case with this version, I am trying to add another four mini’s to my home and it does NOT connect. On the several dozen functional builds I have there is constant disconnects. Support from Lifx is non existent. Should have gone with Phillips and most like will trash all this garbage from Lifx soon. Don’t support this company they don’t support the consumer who purchases their product.";"2020-03-28T13:56:08-07:00";"https://itunes.apple.com/us/review?id=657758311&type=Purple%20Software";"657758311";78;"en";"POSITIVE"
