"";"id";"userName";"userUrl";"version";"score";"title";"text";"updated";"url";"app";"wordCount";"language";"sentiment"
218;6745624412;"DarkOmega147";"https://itunes.apple.com/us/reviews/id349120108";"2011.1117.2218";5;"Could be better";"If you didn’t experience the previous update then you might think this update is good and I agree it’s a good update but I can’t give it more than 2 stars considering that the reason it’s easier to navigate and use is because they removed stuff instead of actually working with what they had and making it more efficient. On the previous update you could see your achievements, search for games and see the prices, ect. Hopefully they’ll implement these features back in a future update but until then 2 stars is the best I can do considering what we had before.";"2020-12-12T08:27:24-07:00";"https://itunes.apple.com/us/review?id=736179781&type=Purple%20Software";"736179781";102;"en";"POSITIVE"
219;6946520657;"Corporal Destroyer";"https://itunes.apple.com/us/reviews/id908226615";"2012.1207.2321";1;"Glitch";"This glitch makes the app completely unusable.
Upon opening the app a pop up appears asking for a password connected to my phone number, i thought this was weird since my account isn’t set up to a number but rather an email, so i put in a password that i think may be correct and the pop up disappears and then reappears, I mustve used the right password because when i tried entering it again I mistyped and it said the password was incorrect, so i tried entering it in again. The same thing happened where the pop up closed and then opened again. So i tried using the email that is actually linked to my account and still, it would disappear and them immediately pop back up. I am very frustrated with this app because no matter how many times i enter the correct password, it just doesn’t work.";"2021-02-02T16:18:40-07:00";"https://itunes.apple.com/us/review?id=736179781&type=Purple%20Software";"736179781";150;"en";"NEGATIVE"
220;6746783215;"triptiiv";"https://itunes.apple.com/us/reviews/id35455076";"2011.1117.2218";1;"Why even have this app anymore?";"I never write reviews. Literally might be my first review ever of a product. This app used to be really good......It has become basically pointless. 
You used to be able to see clips that friends made in a refreshable feed. This was my favorite feature of this app(feature removed)

You used to be able to join a party and hear everyone without problem (now buggy including losing connection to party, and members voices cutting in and out constantly)

You used to be able to send messages to recent players. Very helpful when wanting to team up with someone quickly before a new game starts (feature removed unless you start a message first on Xbox live, then continue it on the app)

You used to be able to quickly view and delete captures to free space for new captures (now takes multiple times of “deleting” before the capture actually deletes)

Just a really, reallyyyy disappointing update. It absolutely feels like the Microsoft team was told to downgrade the app software to free up server space and spend less money. I see absolutely no reason they would make these changes other than to save money, which is extremely disappointing seeing as how we all pay a monthly fee to use Xbox live.......";"2020-12-12T15:47:06-07:00";"https://itunes.apple.com/us/review?id=736179781&type=Purple%20Software";"736179781";210;"en";"POSITIVE"
221;6556543458;"Aleccc420";"https://itunes.apple.com/us/reviews/id699494094";"2009.1009.1918";5;"Writing this review after the remote update";"The update was pretty great! It make the menu and overall app feel a lot cleaner and easier to manage. Also the remote play is cool but not the best. I know it’s beta, but for feedback purposes I would like to point out the Audio is glitchy all the time and it stutters and occasionally but the audio is the real problem. I know it’s the app because on my laptop I can stream it mostly fine and not too many bugs. One thing to counter this is to set different quality options because I have a good 5G network but it isn’t top notch or anything. Overall very good and yea.";"2020-10-20T15:24:29-07:00";"https://itunes.apple.com/us/review?id=736179781&type=Purple%20Software";"736179781";113;"en";"POSITIVE"
222;6580441524;"Annoyed Buy You";"https://itunes.apple.com/us/reviews/id1095013596";"2009.1009.1918";3;"Please return the old way of changing profile pictures";"So basically as the my title says please return the old way of changing profile pictures there was nothing with it i enjoyed having the ability to change my pfp from my phone instead of having to look up a 1800x1800 picture of a character to make as my pfp as someone who changes they’re pfp frequently this is honestly an issue for me and i’m honestly half unsatisfied with this new update because nothing really has changed except for the mobile playing and i don’t even use it so honestly this was more of a downgrade then an upgrade for me so please return the pfp changing on the xbox app and i’ll change my review to a 5 star thank you and have a nice day";"2020-10-27T12:23:41-07:00";"https://itunes.apple.com/us/review?id=736179781&type=Purple%20Software";"736179781";128;"en";"POSITIVE"
223;5726580837;"BUDDER MAN 06";"https://itunes.apple.com/us/reviews/id460693881";"2002.302.1532";3;"bug i have with this app";"First of all Microsoft. I LOVE this app. I can manage me and my sisters accounts on the go. My sister is relatively young so I am in control of both of our accounts. Off topic. But here is my main issue with this app   I am trying to set a custom gamer pic for myself. And for about 3 days now. It’s been saying that it can’t upload the image. And my account hasn’t received any information on a suspension or ban from custom gamerpics. So that’s not the issue. But one day when I was changing it. It just stopped working and I haven’t been able to do it for about 3 days. Is anybody else having this issue? And is it just a bug with the app. I already tried uninstalling and reinstalling. That didn’t do it. Please help me with this issue. Thanks";"2020-03-28T08:35:24-07:00";"https://itunes.apple.com/us/review?id=736179781&type=Purple%20Software";"736179781";147;"en";"POSITIVE"
224;6624612212;"Random Chan";"https://itunes.apple.com/us/reviews/id953944444";"2009.1009.1918";3;"Please fix the new update";"So- the xbox app has always been an app that ive LOVED since i first got it, me and my friends wouod get out of school start up a party and game for HOURS! I still love calling people on xbox so often, but the new update removed the feature for changing your pfp, which is disappointing for me because changing my profile picture has been something that i do exteemely often and enjoy, it gives me something to do, scrolling on pinterest for whatever profile i wanna use next, but now thats a joy taken from me and im stuck with a profile picture that i wish i chose more wisely setting. Im clearly not the only one who wshes they could still change it, please please please bring this back in the next update!";"2020-11-08T19:49:51-07:00";"https://itunes.apple.com/us/review?id=736179781&type=Purple%20Software";"736179781";136;"en";"POSITIVE"
225;6160569467;"bad kenny fly";"https://itunes.apple.com/us/reviews/id1051150156";"2005.512.2137";1;"Nails on a Chalkboard";"This app is terrible and I only ever have problems with it. It’s slow, buggy, and never seems to be working 100%. Half the time I go to uploaded Captures, my vids and pics aren’t there. Then when they finally show up, I can’t watch them cause it says not available, try again later. Trying to download a video is just as bad. There I get met with “something went wrong, we can’t share this right now”. The frustrating part is that it’s Xbox’s app for Xbox’s console. When the dumb console finally decides to record a whole minute’s worth of video like it is supposed to, instead of 5 or 6 seconds worth, it then has problems trimming the video. When that is finally finished, it then uploads to the Cloud just fine, but then it’s a pain to download it to the phone. Just one painful, frustrating experience after another.";"2020-07-05T07:35:22-07:00";"https://itunes.apple.com/us/review?id=736179781&type=Purple%20Software";"736179781";152;"en";"NEGATIVE"
226;5825782179;"Tornadoes36098";"https://itunes.apple.com/us/reviews/id1158145804";"2003.326.129";3;"It is ok";"I got this app because my headset wouldn’t work and I had nothing to use for a Xbox party. It works great but either it crashes when I try to start a Xbox party or even when I’m in a party it crashes. Also, I have changed my profile picture many times because I can’t figure out what I want really want it to be but I’m finally getting tired of the one I have now so I keep trying and trying to change it but everything says, “Sorry, we can’t upload this picture right now. Try again later or do a different picture.” And it really ticks me off! Please Microsoft or Xbox if you read this please acknowledge this and try to fix these things and make it better! Other than those issues I have, this is a great app!!";"2020-04-17T10:44:21-07:00";"https://itunes.apple.com/us/review?id=736179781&type=Purple%20Software";"736179781";142;"en";"POSITIVE"
227;1877366624;"curtisthefox";"https://itunes.apple.com/us/reviews/id34941516";"1710.1012.0348";3;"Not Bad, but the Most Useful Function is Buried";"I think that the remote is the most useful function of the app. However, if your Xbox is not already on, you have to go through the menu and tap 5 or 6 options to turn on the Xbox. I think it would be very useful to provide an option to have the remote be right in the menu or on the home screen and be able to power on the Xbox in 1 or 2 taps. Also, as another reviewer has said, the remote is super finicky. Sometimes it just refuses to see the Xbox. Nothing has changed about my network. WiFi is on. Xbox is wired to the router. Just won’t see it. And, no matter what you do, restart the phone, restart the Xbox, kill the app half a dozen times, it just won’t connect. Anyway, an improved remote would make the app much more useful.";"2017-10-26T17:26:35-07:00";"https://itunes.apple.com/us/review?id=736179781&type=Purple%20Software";"736179781";149;"en";"POSITIVE"
228;7006511209;"ck8483";"https://itunes.apple.com/us/reviews/id1050719041";"2102.209.2113";1;"New update is horrible";"I used to love this app for talking to my friends, and being able to use my xbox features from my phone. The new update that was implemented takes away all of those things. First off, whenever I log into the app and start it, it ALWAYS says “please reconnect” and you can’t even fix it not matter how many times I try, so it’s useless. Other times when I try to use it, it just crashes and restarts my whole phone. Please make the app useable again, also you can’t change things about your profile like you used to be able too. I miss being able to change my profile picture in 20 seconds rather then having to download an app on my xbox, and all that other nonsense. I don’t even care at this point. I have supported Xbox since the 360 came out. On the path it’s on right now, it’s not looking good.";"2021-02-17T11:27:32-07:00";"https://itunes.apple.com/us/review?id=736179781&type=Purple%20Software";"736179781";157;"en";"POSITIVE"
229;6776824369;"Yimsya";"https://itunes.apple.com/us/reviews/id1225763923";"2012.1207.2321";1;"What was this update?";"I was reading a lot of the reviews that came recently and me and a lot of other people are sharing the same opinion this new update has it been a complete disaster firstly no matter what device you’re on this app has a consistency to crash. Also when it comes to the captures the time it takes for a cashier to come on the app is staggering and more of the captures that do load have some weird glitch with them where they won’t load in a matter how many minutes or seconds you have your capture settings on it only be 1 to 12 seconds long I don’t know how this glitch came to be I only know it came with the new update. The only bonus I will give this new update is the formatting it’s a bit better but still confusing. 

I know there’s a pandemic going on please fix this or referred to the way it was.";"2020-12-20T23:47:14-07:00";"https://itunes.apple.com/us/review?id=736179781&type=Purple%20Software";"736179781";162;"en";"POSITIVE"
230;6685734786;"Thumper1960";"https://itunes.apple.com/us/reviews/id103868539";"2011.1117.2218";1;"New Update is HORRIBLE!!!";"The app used to be amazing. The new update however, is terrible. So laggy and I cannot stress enough just how slow the app and pressing things has become. Pressing the ‘A’ on the mobile remote is ridiculous. You have to hit right on the labeled A rather than just clicking in the middle somewhere near the A. Clicking the ‘B’ button is super annoying. You no longer can swipe backwards, you have to manually click the B and red area rather than swiping back. Don’t even get me started on the keyboard feature.... does not work AT ALL. Will not turn on my Xbox the way it used to with the old app update.... very frustrating. This app seriously has gone downhill and I no longer will use it nor support it until an update comes out that majorly improves all of the issues that everyone has been and are voicing concern about.";"2020-11-25T15:00:01-07:00";"https://itunes.apple.com/us/review?id=736179781&type=Purple%20Software";"736179781";154;"en";"NEGATIVE"
231;6664557010;"jjjjmmfndjdj";"https://itunes.apple.com/us/reviews/id823023896";"2009.1009.1918";4;"I can’t create or join party’s";"Ever since the new update the app has been good for a while now but today for some reason I can’t join or create a party every time I try to create one it would just say joining then kick me out for no reason I really don’t get what xbox is doing with this update but it is ridiculous I know it’s not my phone I tried restarting my phone deleting the app three times and switching my accounts and it still does the same thing even with a different account I don’t know if this is a bug for today only but if it is then it probably won’t happen again but if it does something needs to be change about this new update";"2020-11-19T17:59:24-07:00";"https://itunes.apple.com/us/review?id=736179781&type=Purple%20Software";"736179781";126;"en";"POSITIVE"
232;8021048894;"realm craft player";"https://itunes.apple.com/us/reviews/id980919950";"2110.1026.2232";5;"Good but Sending pictures does not work";"This good I liked it better before all the updates but it’s getting back to how it was but one big problem 
I keep trying to send pictures but they either take for ever to load or don’t send at all and I’ve tried on 3 different devices and when I try to do stuff on my phone the app keeps crashing It’s not my internet because everything else is working fine, I’ve even tried sending with my data turned so I know there’s internet but the results are the same and it’s always been like that since I got the app. Please fix.";"2021-11-13T14:54:51-07:00";"https://itunes.apple.com/us/review?id=736179781&type=Purple%20Software";"736179781";104;"en";"POSITIVE"
233;5984687210;"Due die";"https://itunes.apple.com/us/reviews/id267941604";"2005.512.2137";4;"Bugs. Especially the ones I hate";"So there is this one VERY annoying bug where it says everyone is offline even though your friends are online which it makes me very angered and the “all offline bug” gets worse because it won’t even let you join party’s 

Another bug there is, it’s the bug where it says you should get friends because Xbox is better with friends 
So first of all, You can’t join party’s. And second of all you can’t even see what game your friend is playing so you don’t know what game to play with them and third of all you can’t even talk with them and if you don’t have a third-party texting app you can’t talk with friends at all.";"2020-05-23T11:32:31-07:00";"https://itunes.apple.com/us/review?id=736179781&type=Purple%20Software";"736179781";119;"en";"POSITIVE"
234;5567135348;"DanTheSecurityMan";"https://itunes.apple.com/us/reviews/id822770717";"2001.123.1027";4;"Good but buggy";"One major bug that I’m experiencing on the latest software and latest iPhone firmware is when I’m in a party in the app, more than half the time I can’t hear what the party members are saying, the circle around their name expands but I cannot hear them. I know this is a limitation of the app because I tested it, I had someone in a room in a house on the app and another person in a different room on the Xbox talking and I could hear their voice from the other room but the app does not play the audio. This happens every minute or so rendering the chat feature from the app useless. I tried deleting and reinstalling the app but no dice. Please look into this issue. Thanks";"2020-02-22T13:33:32-07:00";"https://itunes.apple.com/us/review?id=736179781&type=Purple%20Software";"736179781";132;"en";"NEGATIVE"
235;6815038988;"Christopher M. Coley";"https://itunes.apple.com/us/reviews/id449223552";"2012.1207.2321";1;"Take a look at your reviews";"Ever since the last big update to the app your reviews have gotten worse and worse, that should tell you something. Now im not here to grind your gears and im sure nobody will ever see this but its still a problem and i want to make it known. Certain people arent just on Xbox for entertainment and fun, some of us are here to make a career and spend a lot of time making that career work. So if i cant get clips downloaded from your app onto my phone so that i can make videos and produce content then i have a big problem. Now, i know a lot of your community arent like me and arent like my friends and co workers but a companies job is to do there absolute best for every aspect of their community. Stop letting your minds go to “Oh we are Microsoft, we are big and beautiful” and actually do some work like you used too. Thank you.";"2020-12-31T09:50:10-07:00";"https://itunes.apple.com/us/review?id=736179781&type=Purple%20Software";"736179781";167;"en";"POSITIVE"
236;6571557512;"EbonyRaptor";"https://itunes.apple.com/us/reviews/id1210767723";"2009.1009.1918";2;"The new update";"They put out a new update on the app and it made everything look sleeker and just nice to look through. But the reason I’m rating this so low is the fact that you can’t change your gamer picture. The whole reason that I even had the Xbox app was so I could have the ability to change my gamerpic to something custom, and they got rid of that (hopefully just for now). Not only did they get rid of the ability to change your gamerpic to something custom they even made so you can’t change anything about your account; can’t change your gamerpic, your bio, and your location. I don’t know why they would get rid of the ability of having the freedom of making you account appealing, but all I can do is hope that they fix this problem.";"2020-10-24T23:52:44-07:00";"https://itunes.apple.com/us/review?id=736179781&type=Purple%20Software";"736179781";141;"en";"POSITIVE"
237;3527304436;"Ryanrobb2013";"https://itunes.apple.com/us/reviews/id449785090";"1810.1205.1548";4;"Xbox App";"Love the app. Great to see who is on and when. Also great to pop in via party chat to say what’s up to friends at work. Can be a bit buggy at times but the last update seems to have fixed most of the “clunky” feeling; the app flows better now. The one thing I’ve wished that they would change since I downloaded the app ages ago is the friends list. If games have a long title, you can’t see what activity they’re doing. “Call of Duty: Black Ops 4 playing....” playing what? Multiplayer? Zombies? Blackout? Sometimes I just check to see what my friends are doing so I know if I should hop on. Maybe implement a section when I click on a friend to show, again, what they’re doing currently. Great, useful app nonetheless.";"2018-12-13T13:19:42-07:00";"https://itunes.apple.com/us/review?id=736179781&type=Purple%20Software";"736179781";137;"en";"POSITIVE"
238;7311454801;"Roman Stigger";"https://itunes.apple.com/us/reviews/id927618629";"2104.415.637";5;"I don’t like the new Xbox app";"I fell in love with the old one because I can do a lot at the sametime. Creating a club, invite to a party, edit a clip, change your gamerpic and gamertag. When I updated the Xbox app, all of it was gone and it made things hard for me. Create a club was removed, editing a clip is harder to do now and I can’t change my gamerpic or gamertag so I uninstalled the app completely and haven’t touched it every since. Until we get the old Xbox app back, I will never download another Xbox app until it’s either fixed or you can bring those things back on the new Xbox app and maybe I will think about it.";"2021-05-08T00:23:06-07:00";"https://itunes.apple.com/us/review?id=736179781&type=Purple%20Software";"736179781";121;"en";"POSITIVE"
239;7023346760;"trifialsngair";"https://itunes.apple.com/us/reviews/id952563786";"2102.209.2113";5;"Very easy to use😌";"I’ve been using this app for less than a year and to be honest it’s great. I was able to text without problem and move around the app using the party. It shows everything and I even had the ability to play from my Xbox on the road which I definitely like that it’s good for when I don’t feel like taking my console with me. And it’s so much easier to change my pfp to one I preferred without a problem. I even like having the ability to use the controls on here if I don’t feel like turning on my controller. This app is very helpful and it’s not glitchy either.🙂👏🏾";"2021-02-21T17:18:28-07:00";"https://itunes.apple.com/us/review?id=736179781&type=Purple%20Software";"736179781";113;"en";"POSITIVE"
240;6621254064;"nuggetboy355467";"https://itunes.apple.com/us/reviews/id959846383";"2009.1009.1918";5;"I don’t think anyone likes this update.....";"Just from looking at all the reviews of the app, it’s all about how bad the update is. I don’t like this update either so please just change it back to the previous version. Also the thing I hate about this is that I can’t change my profile picture nor my gamer tag. I’m starting to hate this app. And I have already did the stupid “change your online gamer tag” or what ever it was called and it didn’t work and if I try doing it the second time I’ll have to pay. So once again, change your app back to normal don’t mess with it, thanks 👎";"2020-11-07T21:45:50-07:00";"https://itunes.apple.com/us/review?id=736179781&type=Purple%20Software";"736179781";109;"en";"NEGATIVE"
241;6812324712;"DubForce";"https://itunes.apple.com/us/reviews/id997192204";"2012.1207.2321";3;"Trash since last update";"App used to be good before last update. Before you could view all the clips that you or your friends recorded from Xbox. Now there are no clips and you have to go on to your Xbox to view clips. With messages you sometimes won’t receive a notification if someone sent you a message. I’ve had a couple of my friends have the same issue. Last the party chat system glitches sometimes to where you can’t hear people talking even though you can see them talking. The app just randomly cuts out people talking then it will randomly start working again and the cycle will continue. Never had any issues before the last update. It’s just been terrible since.";"2020-12-30T16:30:55-07:00";"https://itunes.apple.com/us/review?id=736179781&type=Purple%20Software";"736179781";119;"en";"POSITIVE"
242;5515122664;"mjz277";"https://itunes.apple.com/us/reviews/id165956056";"2001.123.1027";4;"Good - Could be Great - review focused on friends search and suggestions";"Hard to find friends or search for certain people. Does not pull up enough friend suggestions. In the beginning I had a lot of friend suggestion from all around but now when I go to suggestions, it takes me to a blank page. Then when I re-tap friends there are only a few from someone else’s friends list. Please fix this. It is hard to search for well-known gamer-tags to friend request or just old friends I used to play with. I was able to see Major Nelson when I didn’t have any friends now it’s just the same old folks from one of my friends list of friends 🤷🏻";"2020-02-10T19:31:48-07:00";"https://itunes.apple.com/us/review?id=736179781&type=Purple%20Software";"736179781";110;"en";"POSITIVE"
243;6565284702;"l1lelephant";"https://itunes.apple.com/us/reviews/id488526840";"2009.1009.1918";1;"LFG???";"Completely disregarded one of the core features on the mobile app in the Oct 20th 2020 update. One of the main things I used on this app is the “Looking for Group” feature. I have met over 100 xbox friends through this one small feature, and its what really kept me with microsoft gang. 

I am on PC so I have to use the overlay windows 10 provides, which is fine for parties and communicating with fellow players, but its almost impossible to use the LFG, and im unsure if it thats because it only shows fellow PC players posts or what the exact problem is. Anyways, the mobile app made it so much easier to find a group, I would just use my phone while I sat in a loading screen and find 2-3 more players to play with, but since the removal of the LFG on the mobile app, I've been unable to find new players which really draws from my gaming experience.";"2020-10-23T05:37:29-07:00";"https://itunes.apple.com/us/review?id=736179781&type=Purple%20Software";"736179781";165;"en";"POSITIVE"
