"";"id";"userName";"userUrl";"version";"score";"title";"text";"updated";"url";"app";"wordCount";"language";"sentiment"
350;8007520931;"awepotato";"https://itunes.apple.com/us/reviews/id1337089541";"2110.1026.2232";5;"Remote play on this device";"Ok that is the best thing ever you can play games on your phone that is supposed to be on console as long as you an Xbox controller or mouse and keyboard but the main problem is that I have an iPhone 13 and in warzone I lag a lot a lot a lot and I thought of trying to change the graphics but I can’t if I don’t run I get 60fps but running is essential the same goes to apex but apex is a lot smoother but I do get a little bit of frame drops here and there thank you for this app and the ability to do this please fix the warzone fps";"2021-11-09T20:26:08-07:00";"https://itunes.apple.com/us/review?id=736179781&type=Purple%20Software";"736179781";117;"en";"POSITIVE"
351;7315033874;"-0^";"https://itunes.apple.com/us/reviews/id8877944";"2104.415.637";5;"FIX THE PARTY CHAT";"While using this app I’ve run into the problem that when ever I try to join my friends partys the app crashes, you can’t open up party’s after that for a couple of days and this can happen multiple time even after uninstalling and restarting your device. Not to mention when ever your trying to talk to someone through normal chats the person will appear as being offline even though they are online. The only things this app is good for is the way it Organizes your clips and your pictures  
MICROSOFT FIX YOUR APP";"2021-05-08T17:12:21-07:00";"https://itunes.apple.com/us/review?id=736179781&type=Purple%20Software";"736179781";95;"en";"POSITIVE"
352;5684562604;"Thebestappreview";"https://itunes.apple.com/us/reviews/id779423993";"2002.302.1532";5;"Nice app to contact and play with friends";"I love this app because I can play with my friends easily and also I like the app’s layout some problems I have with the app is that one, when I try to make it so everyone doesn’t see my name on Xbox, it says, “Sorry we can’t save your changes right now.” Another problem i have with the app is that I can’t see comments on people’s post and it says “Something went wrong please try again later.” I would really like this issues to be fixed but other than that I think this is a great app.";"2020-03-19T18:26:32-07:00";"https://itunes.apple.com/us/review?id=736179781&type=Purple%20Software";"736179781";99;"en";"POSITIVE"
353;6774475771;"Phillip250";"https://itunes.apple.com/us/reviews/id100813115";"2012.1207.2321";3;"Good but not great";"Beautiful app and really nice UI. But what happened to some of the features??
1) friends comparing is gone. I loved being able to compare my games to my friends and see how many hours I have spent on a game compared to them. Or at least let me see my library and give me stats and achievements ive unlocked for the games!
2) The store. Holy moly its bad. What happened? Where it go? Now I have to search and try to find the game. Cant gift a game. Cant see trailers. No prices on anything. No sales alerts. No sale section. No top games. Whats going on?! Are you guys trying to sell games? All you guys have a is a small selection on the bottom of the home screen. Not great.
3) Messages are great. Love the new chat. The new library section is cool to see all the games but again, why no stats or showing any achievements with this info? Captures are great and easy to use to download. 
The profile button is boring and literally offers nothing. 

Come on guys! Update the app with all the features again! People actually use this app alot!";"2020-12-20T07:14:38-07:00";"https://itunes.apple.com/us/review?id=736179781&type=Purple%20Software";"736179781";200;"en";"POSITIVE"
354;6675190406;"Left 4 Portal 2";"https://itunes.apple.com/us/reviews/id203190598";"2009.1009.1918";4;"The most recent update is absolutely terrible.";"Title really says it all. No longer able to browse the store, Activity Feed, Looking For Groups, inability to send photos, remote on homepage, look up other people, and my biggest complaint of them all, the removal of profile editing and custom gamerpics from your phone. The only way around this is to search up images on their horrible web browser, and even still they HAVE to be 1080 x 1080, or you can’t use the picture.

But what does the update add? A shiny new animation upon opening the app.

This is the worst update this app has had.";"2020-11-22T15:27:00-07:00";"https://itunes.apple.com/us/review?id=736179781&type=Purple%20Software";"736179781";100;"en";"NEGATIVE"
355;6663267575;"(/o-o)/";"https://itunes.apple.com/us/reviews/id1142364267";"2009.1009.1918";3;"Disappointed";"First of all, the new algorithm is overrated. The loading screen is incredibly slow and hard to access. Second, you can’t tell if a person has removed you in the friends slot. We need to see a message labeled you+89 or etc. to specifically know who added you and who removed you. Third, it is LEGITIMATELY IMPOSSIBLE TO FIND ANY CUSTOMIZATION SETTINGS. Look Xbox we know money is the only thing in your interest but this is ridiculous. This app is hard to work with, confusing, and lacking many of the things that made it a good gaming platform.  Please improve these features or you may as well lose the attention of your users. Try harder next time.";"2020-11-19T09:09:21-07:00";"https://itunes.apple.com/us/review?id=736179781&type=Purple%20Software";"736179781";118;"en";"POSITIVE"
356;6562926997;"TheShadowKnight // TSK YT";"https://itunes.apple.com/us/reviews/id882289301";"2009.1009.1918";4;"Upgrade? More so a downgrade";"Ok the new app update released a few days ago, and since they gave it an upgrade you’d think it’d be better, but my goodness it is awful. Lots of things are bad now. 1: The clubs option is no longer there. 2: You cant send pictures anymore. 3: You barely can customize your profile. 4: The only notifications you can see are friend requests and captures. PLEASE add these back, it’s just a downgrade. And if you do, let me view the other channels in a club, this was absent before and after the update. And just a bug fix: If I try to view a clip the whole app just freezes.";"2020-10-22T11:43:44-07:00";"https://itunes.apple.com/us/review?id=736179781&type=Purple%20Software";"736179781";113;"en";"POSITIVE"
357;4086110677;"Spoiled032604";"https://itunes.apple.com/us/reviews/id1003952527";"1904.0427.1910";5;"Bug!!!";"I love the app overall, but it has an bug. I no longer have a mic so I use the Xbox app to be in parties. But when I join I can’t turn my phone off and stay in the party or I can’t use the app on speaker just audio. I have to stay with my phone on then try to use it while my face is inviting people or I’m pressing buttons I don’t mean to press. Now after I’m using it for about an hour it will do fine with me Turing it off. Now the speaker just never works no matter what I do. I have never had these issues in the past and I hope you will find the bugs and fix them. Thank You!";"2019-05-01T10:06:51-07:00";"https://itunes.apple.com/us/review?id=736179781&type=Purple%20Software";"736179781";130;"en";"POSITIVE"
358;5518760433;"Dr. Redskin";"https://itunes.apple.com/us/reviews/id665261566";"2001.123.1027";4;"Love it but...";"This app is super useful and I use the remote all the time in times like maybe my controller died or I’m watching Netflix and my controller is across the room and it asks if I’m still there I just use the remote. Recently my headset broke so I talk to my friends through the app as well. Here’s the but. I’m talking to my friends making call outs during a game only to find that I’m talking to myself. The app is crashing every 5-10 minutes and it gets annoying having to rejoin every time especially since is so buggy when it come to parties. Love this app and would love to have this problem fixed.";"2020-02-11T15:42:50-07:00";"https://itunes.apple.com/us/review?id=736179781&type=Purple%20Software";"736179781";117;"en";"POSITIVE"
359;5040073874;"Lil_Angie😝";"https://itunes.apple.com/us/reviews/id1082694556";"1909.1002.1459";4;"Good app";"It’s a good app. Most of the time it works without problems. But sometime it has this bug where I’ll open the app and I’ll text something to a friend and then exit the app and few minuets later comeback and the text and no response will be there. Same with if I text something and reload the page it won’t be there. My connection is fine. But other than simple bugs it’s a great app. It’s easy to use and it’s good for texting friends and checking what’s going on. I’d rate the app 4 and a half stars. I’ve had to delete and redone load it multiple times so it would work and stop glitching.";"2019-10-28T03:25:26-07:00";"https://itunes.apple.com/us/review?id=736179781&type=Purple%20Software";"736179781";117;"en";"POSITIVE"
360;4704583028;"Video girl24344";"https://itunes.apple.com/us/reviews/id287968123";"1906.625.1605";3;"Good When It’s Actually Working";"I downloaded the Xbox app a few months ago and was extremely satisfied up until about a month ago. I started having an issue where when I would open the app I would just be met with a white screen and a buffering circle. I solved the problem by deleting and re-downloading the app, but after a about a week, it went back to buffering. When I could actually get in the app, I would have a lot of issues. The main issue was where by screen would begin blinking black and then after a little bit the app would crash. Overall, I think the app is 5 stars but due to the amount of bugs and glitches, it is definitely only three.";"2019-08-31T12:53:38-07:00";"https://itunes.apple.com/us/review?id=736179781&type=Purple%20Software";"736179781";123;"en";"POSITIVE"
361;7262477573;"Call Of Duty Start";"https://itunes.apple.com/us/reviews/id1087388013";"2104.415.637";5;"5 Starts Just Add This";"I Would Like To Say This App Is Great It Helps Me Send My Clips To My Friends And It Has Everything I Rate It A 5 Stars But....I Want To Be Able To Buy Call Of Duty Points And Other Stuff On Other Games...For Example Let’s Say You Get A 25$ Apple Gift Card But You Wanted To Get A 25$ Xbox Gift Card So If This Was On Xbox App Where You Can Buy Things With The Apple Gift Card This Would Still Be Ok and If You Still Wanted Something On Your Phone You Could Still Get It.... I Really Hope Y’all Take This Into Consideration But Like I Said A Great App Just Maybe Add This And Your App Would Be Wonderful. Thank You";"2021-04-25T06:37:39-07:00";"https://itunes.apple.com/us/review?id=736179781&type=Purple%20Software";"736179781";128;"en";"POSITIVE"
362;2442877428;"Rereviewviewerer";"https://itunes.apple.com/us/reviews/id524776900";"1803.0308.0312";4;"Good but I would suggest some things";"I like using this app to check on Xbox related things while I am not at my Xbox, however I feel like there are 2 things missing. 
1. You can’t download your videos. I want to be able to do this because then I can use a different video editing app to edit my captures but I can’t. This feature is on the computer app, so why couldn’t it be here?
2. You can’t use it as a controller. In the Xbox 360 smartglass app, you could use your device as a controller in some games and apps. However you can’t do this on the Xbox app. This would be a great feature to have.
If you read this all the way, thanks! You’re awesome.";"2018-04-19T17:02:28-07:00";"https://itunes.apple.com/us/review?id=736179781&type=Purple%20Software";"736179781";125;"en";"POSITIVE"
363;6760650494;"HCGreene";"https://itunes.apple.com/us/reviews/id163312808";"2012.1207.2321";5;"This app is ruined! - Update- thank you for adding ability to send images back!!!";"Xbox why did you have to screw up and ruin a perfectly good app? It is a useless piece of garbage now! You can’t send photos to friends, our activity feed layout is so bad. I am so curious as to why you ruined it so badly. Just awful! I hope you rethink the changes, I went online to see what the community felt and I found all the same complaints as mine :-(

Updated - thank you so much for adding the ability to send images in our messages again!!! :-)";"2020-12-16T13:03:01-07:00";"https://itunes.apple.com/us/review?id=736179781&type=Purple%20Software";"736179781";92;"en";"NEGATIVE"
364;6988532783;"Jrocc23";"https://itunes.apple.com/us/reviews/id115122469";"2102.209.2113";2;"What has happened to this app?";"I used to love this app to be in parties but for months now it’s been horrible being in parties because people’s audio will cut out for awhile in the middle of a conversation. 

I’ve been waiting for months for an update to come out and it becomes fixed. Multiple updates came and the issue still persist. I know it’s not just me because it happens to other people I know and I see in these reviews others are having the same issues. Please fix this issue.

Before you could use AirPods to counter the issue but now rather you use AirPods or wired headphones, some people will cut out and you’ll see their bubble moving as their talking. Cannot believe this still isn’t fixed.";"2021-02-13T01:31:02-07:00";"https://itunes.apple.com/us/review?id=736179781&type=Purple%20Software";"736179781";125;"en";"NEUTRAL"
365;6808360806;"Awsome ELIJAH N";"https://itunes.apple.com/us/reviews/id955721981";"2012.1207.2321";3;"Ok ok ok fix this Xbox";"Welp I used my mic in a party with my friends and after 2-4 secs my mic would not work and it would stop talking even though my mic still worked Xbox app would not let the audio go through. Additionally, Xbox chat is annoying because I will type something and press the send button twice because I didn’t load but then it sends two or more messages of the same thing. While you have sort of fixed this by deleting one if it is the same thing I still thing you should work on it more. In total the app works pretty dang well besides some little glitches and let downs. This is a good app but please work on it more please
- Alpha";"2020-12-29T15:09:04-07:00";"https://itunes.apple.com/us/review?id=736179781&type=Purple%20Software";"736179781";126;"en";"POSITIVE"
366;6775233310;"nickkkname24";"https://itunes.apple.com/us/reviews/id1046424890";"2012.1207.2321";1;"Why just why ?";"This app used to be awesome no bugs at all and features we once had have been lost for example changing the profile pic through the app is no longer a thing and the user interface is extremely confusing other bugs like the activity feed glitching out and uploading videos to the mobile app hours after they have been uploaded on the consoles activity feed is really annoying especially when you want to have a pic or a clip on your phone when it’s not able to be accessed do to the bugs in the app itself I don’t understand why you would try to fix something that didn’t need to be fixed and don’t even try remote play on apple devices no matter if you have good connection or not it never works for me";"2020-12-20T11:38:15-07:00";"https://itunes.apple.com/us/review?id=736179781&type=Purple%20Software";"736179781";136;"en";"POSITIVE"
367;6670555774;"Mr. Woman Man";"https://itunes.apple.com/us/reviews/id1201128359";"2009.1009.1918";5;"Wouldn’t recommend if your trying to change your icon";"Ok so first of all id rate it a 3/5 stars because I had the Xbox app before it updated and it was amazing! I was free to change my icon and name whenever I wanted and it was the best. Then they updated it and made it really glitchy, not to mention party’s and chats often break now, and they worked amazingly in the past before they updated it. It’s just really annoying now so I wouldn’t recommend it if your trying to change your icon, name, color, or trying to talk in party’s.";"2020-11-21T09:09:36-07:00";"https://itunes.apple.com/us/review?id=736179781&type=Purple%20Software";"736179781";95;"en";"POSITIVE"
368;1949053115;"Rarod1114";"https://itunes.apple.com/us/reviews/id379204391";"1711.1114.1819";5;"Some bugs but good overall (and suggestion)";"I don’t know if these bugs came with the new update but whenever I sign into the app it has no activity feed won’t show achievements, my clubs/freinds, my recordings or anything and almost all the tabs in the app are responsive they just don’t load up so I can’t see what is going on if I’m on my phone using the app. Also I would love to be able to edit my avatar like you could with the 360 app other than that it’s really good and with the next update I bet that bugs will be fixed and everything will be normal again!";"2017-11-25T17:17:53-07:00";"https://itunes.apple.com/us/review?id=736179781&type=Purple%20Software";"736179781";105;"en";"POSITIVE"
369;6555786520;"12345fort57";"https://itunes.apple.com/us/reviews/id916295529";"2009.1009.1918";1;"Profile Pictures";"Although I love that you can play Xbox on mobile now, I have a few issues with the update. You can not change your profile picture to a custom from your photos. I’m a picky guy so when it comes to profiles on Xbox I’m always changing it. But with the new update you cannot upload a custom profile. Right now you are stuck with the custom profile you have in use. Xbox needs to fix this immediately because the fact that we can’t change our profiles is just a complete injustice. Custom profiles are Xbox player’s main way of expressing themselves, so now that they removed the option is a complete insult to the Xbox community. Please fix this because this is an issue that I’ve seen a lot of people complaining about today. FIX ASAP!";"2020-10-20T10:27:05-07:00";"https://itunes.apple.com/us/review?id=736179781&type=Purple%20Software";"736179781";137;"en";"NEGATIVE"
370;2696381537;"Man of Ghodt";"https://itunes.apple.com/us/reviews/id489802600";"1805.0601.0329";4;"Appear online/offline";"I like this app a lot. I myself don’t have a mic, so I use the party chat, and I like it a lot. One suggestion, and the reason why it’s a 4 star is because you can’t appear online/offline. There has been a countless amount of times when I have wanted to appear offline or online, but I would have to get online and have my friends see I’m on. All I want to do is play games by myself and watch mixer without disturbance, but I can’t do it without the ability to appear online/offline on the app. I hope you take this into consideration, and hopefully I can see this in maybe the next few updates thanks for reading:)";"2018-06-14T19:46:21-07:00";"https://itunes.apple.com/us/review?id=736179781&type=Purple%20Software";"736179781";122;"en";"POSITIVE"
371;7500878670;"Bendo44198";"https://itunes.apple.com/us/reviews/id619788567";"2106.611.205";5;"Xbox Series X";"I grew up gaming but when I was 12yrs old and I got the the Gen 1 Xbox console and I was in love. Halo was the most magical game on the planet at that time the memories of hooking everyone's huge bricks up with 4 100ft Ethernet cords. Nostalgia but I guess I went crazy a decade ago and switched to PlayStation and not going to lie I enjoyed it ""at the time"" I only missed Halo. Now I'm absolutely positively in love thank you Xbox/Microsoft  my green flame has been reignited and it will not be extinguished again. The Xbox Series X is a work of art and hands down the best console in the world you did great continue the AMAZING work.";"2021-06-24T07:20:29-07:00";"https://itunes.apple.com/us/review?id=736179781&type=Purple%20Software";"736179781";125;"en";"POSITIVE"
372;1781464215;"Frankellyo";"https://itunes.apple.com/us/reviews/id539537411";"1708.0829.1041";5;"Great app";"Every time I'm at work, school, party, and I want to get distracted I can rely on the app to do so, weather it is to see a previously recorded clip and show it to my friends, or just to see what my friends on Xbox are doing before I get to my actual Xbox. I can read messages right from my phone and reply much quicker. This app is awesome. Also, did I mention that you can use this app as a remote control, so I don't even have to use the Xbox controller to watch Netflix or tv. This app goes above and beyond your expectations. Is even better on your laptop(you can join parties on your laptop. Amazing)";"2017-09-08T23:29:33-07:00";"https://itunes.apple.com/us/review?id=736179781&type=Purple%20Software";"736179781";121;"en";"POSITIVE"
373;7022709794;"Hdnlhv";"https://itunes.apple.com/us/reviews/id352634069";"2102.209.2113";2;"Party Chat Does Not Work";"The party chat system in this app does not work. I don’t know why nobody talks about this, but it’s an extremely huge problem. This problem has happened with everyone I know, not just me.

When in party chat on the Xbox app, you can only hear about 1/3 of the things that your friends say. You’ll see their ring light up, but no sound will come out. They will be talking, but it won’t come through. You can only hear about 1/3 of what people say in party chat. For some reason, wearing Bluetooth headphones solves this problem. Wearing Bluetooth headphones has also solved the issue for my friends. However, I’d much rather have the party chat work without having to wear in my airpods. Please fix this.";"2021-02-21T12:48:18-07:00";"https://itunes.apple.com/us/review?id=736179781&type=Purple%20Software";"736179781";129;"en";"POSITIVE"
374;5832158368;"Califonia_Walnut";"https://itunes.apple.com/us/reviews/id1001521740";"2003.326.129";1;"Piece of garbage";"This is probably one of the worst apps I’ve ever used anytime I use it always says all of my friends are offline and I have to refresh the app 20 times for it to finally realize I have 70 friends online and not only that whenever my friends are in a party in won’t give me the option to join unless I wait for 10 minutes or I reset the app another 20 times to get it to work and then when the option to join the party pops up it almost always gives me an error and guess what I have to reset the app again this whole process takes around 15 minutes and it also constantly crashes when I’m in a party I don’t recommend this app to anyone use an actually reliable app like discoed that isn’t as garbage as the Xbox app";"2020-04-18T18:49:45-07:00";"https://itunes.apple.com/us/review?id=736179781&type=Purple%20Software";"736179781";147;"en";"POSITIVE"
375;5761581093;"Slayerskill";"https://itunes.apple.com/us/reviews/id209488812";"2003.326.129";1;"They don’t listen...";"I’ve had this app for 2 years, since the beginning of smart glass, and i’ve never seen an app fall apart this hard. Nothing works on this app anymore, you can’t change anything on your profile because that will give you an error message now saying “try again later”, if you have an iphone, good luck being able to hear anyone you’re in party with. What surprised me the most about this app is that everything broken with it, used to work months ago with no faults. You can easily tell that microsoft hasn’t tried to fix anything in over 6 months. I have too many games on the Xbox One to switch now but im waiting till next gen systems come out and I will never be touching xbox again. Thanks microsoft. I’m not the only one";"2020-04-04T07:30:00-07:00";"https://itunes.apple.com/us/review?id=736179781&type=Purple%20Software";"736179781";138;"en";"POSITIVE"
376;3137033087;"Mp2much";"https://itunes.apple.com/us/reviews/id480947019";"1805.0618.0325";2;"Update";"My Xbox recently arrived from storage in Korea where I was stationed last I am currently updating on all my games since it has been in storage for almost 2 months now and for some reason pub G updated it’s stuck at 90% and normally once it reaches 39% it says the game is ready to start but for some reason it wouldn’t allow me to start playing at all I hate solo play and the option to Tappi to try to get into a server is not available to me I figured maybe it’s because it’s only at the 3940% as to why I didn’t do it, so I decided to wait until the percentage got higher. It is now currently at 98% and not going any further is been stuck in 98 for almost 30 minutes and still I do not have the option to select, or hit a to try to insert a server";"2018-08-31T05:38:38-07:00";"https://itunes.apple.com/us/review?id=736179781&type=Purple%20Software";"736179781";157;"en";"NEGATIVE"
377;2569662007;"Forte;)";"https://itunes.apple.com/us/reviews/id494961932";"1804.0504.1724";4;"Fix voice chat glitch.";"Weird glitch happened to me the other day. So I had my phone in my pocket, and all of the sudden I heard someone speaking I was like what the heck? Then I saw that I was suddenly in a group / voice party with a bunch of people. Without even looking at my phone, opening up the screen. I had to uninstall and cancel notifications due to this, but I have reinstalled it, but closed down notifications. It’s pretty awkward for your friends to listen to you when you don’t know that they’re listening to you, but other than that, it’s a cool app. Lastly, please make it available so you can join someone’s party on the phone.";"2018-05-19T12:32:02-07:00";"https://itunes.apple.com/us/review?id=736179781&type=Purple%20Software";"736179781";119;"en";"POSITIVE"
378;6638995503;"Supernova2503";"https://itunes.apple.com/us/reviews/id842166748";"2009.1009.1918";5;"Fix it";"This app before was nice, but it just got a whole lot worse. I really don't have very many complaints but just these two really ticked me off. First of all, why did you take away the ability to change your profile picture from this app, and second, why can you not join parties. The only way that you can join your friends is from an invite, and half the time that doesn't work for me. Please fix these two problem s and your app will be worth more than 50 million stupid little stars.";"2020-11-12T19:41:15-07:00";"https://itunes.apple.com/us/review?id=736179781&type=Purple%20Software";"736179781";95;"en";"NEGATIVE"
