"";"id";"userName";"userUrl";"version";"score";"title";"text";"updated";"url";"app";"wordCount";"language";"sentiment"
97;6654419666;"blockgav";"https://itunes.apple.com/us/reviews/id252629120";"2009.1009.1918";1;"Lol you axed achievements?";"Why? Literally the only reason why I used the app—so I can check achievements in the fly.  Now I can’t. Surely Microsoft would have collected usage data with the previous app and determined that the achievements functionality was something of a primary use for the Xbox app...oh wait maybe not.

Maybe working from home isn’t a productive model after with the Microsoft team that worked on this app, considering this is the full release of a Microsoft application, effectively synonymous with the release of the new Xbox....how disappointing 

I think it’s also important to note that letting us know “What’s new” isn’t a very good distraction from all the features that were taken away, the features we grew accustomed to using, and the features that gave us a reason to open the Xbox app in the first place. 

My opinion- bring back the old app. Host this one with a separate name, maybe slap a (Beta) flag on there to let us know how incomplete it is. Don’t advertise this as a fully functional application. It’s just flat out disrespectful to the customers, and worse it’s creating a bottleneck in a system where we used to seamlessly and successfully interact with our Xbox profiles and social elements, but now are now left to our own devices.

Let me know when this is fixed. And let me know if you all need any help. I’d be glad to offer more tips. I’m genuinely concerned and disappointed, and I hope y’all are okay.";"2020-11-16T22:53:58-07:00";"https://itunes.apple.com/us/review?id=736179781&type=Purple%20Software";"736179781";251;"en";"POSITIVE"
98;6584254511;"Tessalynnn";"https://itunes.apple.com/us/reviews/id120424167";"2009.1009.1918";2;"Bring back old version";"First off along with what someone else said this app would be better if they switched it to the old version. I use this app to talk to my friends and can not look at other people’s profiles with out my voice being cut off, and no one in the party chat can even hear me any more. I also have to note that in the old version I was able to control the auto output and can no longer do that. There will be times when I am using my AirPods and unless I open the AirPod case; the app won’t pick up my headset connection. There are also times where I’ll be talking and can see my icon lighting up and others but they can’t hear me and I can’t hear them, wether that be through the phone or anything else. Just all around a very messy app, if something isn’t broken stop trying to fix it!! That is all I have to say, and usually I don’t rate apps, but this one has reached my breaking point.";"2020-10-28T14:08:32-07:00";"https://itunes.apple.com/us/review?id=736179781&type=Purple%20Software";"736179781";180;"en";"NEGATIVE"
99;5830805285;"NateNation";"https://itunes.apple.com/us/reviews/id107801782";"2003.326.129";1;"Lots of bugs and missing basic features";"Viewing video captures is super slow and sharing them is very buggy. Sharing works correctly maybe 25% of the time, all other times the app throws up an error.
Wish I could trim video clips in the app.
The Recent Players search doesn't work at all, so when I meet people I have a hard time finding them to send a friend request. Even if I know their gamertag, the Recent Players search can't find them! Unacceptable.
The store in the app is terrible: hard to find what you want and harder to buy it. Don't you want my money, Microsoft?
Microsoft: PLEASE fix this app. Please make it do the normal, standard things players want to do. I don't care about ""Trending"" in my feed, until you fix the social functionality of the app this app is NOT a social network so stop pretending it is. I don't care about a ""Welcome"" tab because I've been with you for 12 years. Let me find new friends! Let me share my proudest moments and edit them! Let me BUY THINGS FROM YOU. Please.";"2020-04-18T11:33:33-07:00";"https://itunes.apple.com/us/review?id=736179781&type=Purple%20Software";"736179781";183;"en";"POSITIVE"
100;5911303048;"InfiniteFire&Ice";"https://itunes.apple.com/us/reviews/id762021923";"2003.326.129";5;"It’s great but a few things";"Ok, I LOVE this app.  It’s a great way to chat with other people, find out what games ya’ll like, it’s just really fun.     Although, there are a few like, bugs that almost ruin it for me.  The clubs, I can make clubs, but I can only do the description.    If I try changing the icon for it, it won’t work, same for the background.    And if I try to add games I like, it just crashes.    I can change the color and add descriptions to them, but that’s it.    It’d really be nice if it were fixed lol.       Also one suggestion, for the profile, I guess I get a little tired of just the background colors.    I feel like it be cooler if we had more colors, or could use photos from the camera.       Thank you for making such a great app thoughhhh~~";"2020-05-06T11:23:18-07:00";"https://itunes.apple.com/us/review?id=736179781&type=Purple%20Software";"736179781";144;"en";"POSITIVE"
101;6593219842;"Hammock Shark";"https://itunes.apple.com/us/reviews/id496532579";"2009.1009.1918";1;"No Gamerpic Customization";"Although others are addressing this, I want to give more awareness to this as well. Ever since the new Xbox App update, completely revamping the app, I can’t help but notice and am annoyed by the fact that the profile customization (gamerpic, sending photos in chats, etc.) is nowhere to be seen on the app. The app loads slower compared to the older version, which is strange, and the screen always warps itself whenever the device is rotated, forcing me to close the app and restart it. My main concern, however, is on the fact that you aren’t able to customize your profile picture/gamerpic anymore. I’ve tried looking over for a solution, and I found nothing. It feels as if the freedom of speech and expression has been taken away, because other than this, there’s not really any other way to express yourself. Despite no answer so far, I really hope that this issue can be resolved sooner than later, so I can change my gamer picture.";"2020-10-31T03:21:08-07:00";"https://itunes.apple.com/us/review?id=736179781&type=Purple%20Software";"736179781";167;"en";"POSITIVE"
102;8122570342;"xx_kethan_xx";"https://itunes.apple.com/us/reviews/id1132550105";"2111.1122.1929";4;"Great quality (but has some issues)";"I’ve used the Xbox app for over a year now and I have to say it is very good. Not only is the party chat quality high on most phones, but the app allows people who don’t want to buy $100 gaming headsets to have a decent quality mic. The only other option for basically free is the Xbox Kinect which is very flawed, has clipping issues, and captures almost everything including your game volume. I really enjoy the Xbox app, however there is a major glitch that is affecting the way I use it. Many times, I will create an Xbox party, only for my mic to strangely stop working. The other players will then say disconnected. I have good internet and the issue has been happening on three different phones. If this one glitch can be patched,  I will change my rating to 5 stars :)";"2021-12-12T06:53:44-07:00";"https://itunes.apple.com/us/review?id=736179781&type=Purple%20Software";"736179781";148;"en";"POSITIVE"
103;6836508005;"EvanHarrel";"https://itunes.apple.com/us/reviews/id428731778";"2012.1207.2321";4;"Good app, just slow sometimes";"Had to write a good review since the most recent reviews aren’t positive. I like the new changes and the updates since the new style of the app, love being able to pre-download games on my xbox series x. Clips are insanely easy to find, share and/or download, not sure what some of these people are talking about. Xbox party chat is also designed for xbox not a phone and connection is probably peoples problems with the apps party chat, used it once to test it. Really clean style just sometimes when launching the app and clicking tabs the animations are slow or are a second late, Im using an iPhone 8 so it is running surprisingly well otherwise. Good app with very few improvements needed. Works great with the new systems and app UI matches the consoles and eases your daily xbox experience.";"2021-01-05T22:19:46-07:00";"https://itunes.apple.com/us/review?id=736179781&type=Purple%20Software";"736179781";144;"en";"POSITIVE"
104;6707159002;"Kirito123028";"https://itunes.apple.com/us/reviews/id937045396";"2011.1117.2218";1;"Very bad login glitch";"I’ve used this app for years now, almost ever since it came out. I used it for a mic since I didn’t have one at the time but that’s besides the point. The point is at one point I changed my Microsoft account password and got on the app only to be met with a login screen asking for my password, I try logging in and once I hit enter it loads a little and asks me for it again, repeat the process and same thing happens, no matter how many times I enter it it’ll just send me right back to the password. If I restart the app and retry same thing happens, hard restart my phone and same thing happens, wait a day try again and the same thing happens, I try canceling the login and it just sends me right back to the password screen anyway, it has locked the app into a perpetual state of asking for my password effectively making the app more of a detriment than a tool and from what I hear it’s now a buggy mess so I guess I was one of the lucky ones.";"2020-12-01T13:09:21-07:00";"https://itunes.apple.com/us/review?id=736179781&type=Purple%20Software";"736179781";194;"en";"POSITIVE"
105;6583429241;"DJ BANZAI";"https://itunes.apple.com/us/reviews/id129890300";"2009.1009.1918";4;"What have you done to my app????";"The latest update took away too much from the past version, it needs to be brought back. Current version is an absolute disaster, unable to like and comment on a live feed post section that doesn’t exist on this version and there’s no option to look up clubs, achievements can’t be seen at all. When messaging, there’s an option to unblock when I’ve never blocked them in the first place. Unless you can put all the functionality from the past version on the the current, return my app back to the past version ASAP. I can’t imagine how many of my Xbox friends are gonna be upset because of this joke of an update that didn’t even take me a full minute to to see what’s wrong with it. Change. It. Back. Developers, only you can fix this.";"2020-10-28T08:55:05-07:00";"https://itunes.apple.com/us/review?id=736179781&type=Purple%20Software";"736179781";138;"en";"NEGATIVE"
106;6163358229;"Connorbossdude";"https://itunes.apple.com/us/reviews/id293326294";"2005.512.2137";1;"Too Many Bugs. Fix your app Microsoft";"The app used to be fine with only minor bugs but after the most recent update there have been too many bugs that make the app unbearable to use. When you are in a party occasion all party audio will cut out anywhere from 10 seconds to 10 minutes. Xbox parties crash frequently. Mic and party audio will stop working if you watch a clip while in a party. App crashes randomly every now and then. Clips skip frames while playing. VERY LONG delay when receiving invitations (you get an invitation almost immediate on an Xbox but on this app it takes several minutes). Xbox party audio sometimes gets extremely loud or quiet without even changing the volume on your device.  Difficult to accept invitations while using the application. App often crashes when accepting party invitations. I really don’t understand how Microsoft, a company that makes over $100 BILLION a year, can’t even make a simple app work properly. 
Terrible application";"2020-07-06T01:45:24-07:00";"https://itunes.apple.com/us/review?id=736179781&type=Purple%20Software";"736179781";161;"en";"POSITIVE"
107;6620318770;"Xtr0m";"https://itunes.apple.com/us/reviews/id110701162";"2009.1009.1918";2;"New Update Very Disappointing";"The latest update to the Xbox app brought a lot of cool new features and changed the user interface. One function that me and my family use regularly has really suffered from this update - the remote control function (formerly SmartGlass). 

Occasionally, when using the remote function the app will freeze and soon after it will crash. Even more frustrating, is the loss of responsiveness when using this feature. The old app did a great job being responsive and registering button taps and swipes. The new app regularly doesn’t register different inputs and when it does there is a clunky, noticeable lag before the console reflects the input. On top of that, the new UI now takes 2 buttons to get to the remote control when previously it was just one. Admittedly, that’s a pretty minor thing to complain about. But why change the app, just to make the user experience worse?";"2020-11-07T15:04:05-07:00";"https://itunes.apple.com/us/review?id=736179781&type=Purple%20Software";"736179781";152;"en";"NEGATIVE"
108;6559049955;"SoftwareEngineer";"https://itunes.apple.com/us/reviews/id27468203";"2009.1009.1918";1;"Dropped Clubs? And other imprtant features?";"The October 2020 update has given a complete facelift to the app, and appears to no longer provide a way to find and interact with Clubs. It also removed a number of other useful features, including ability to send pictures.

I came here as a result of Sony gutting Community (same as Clubs on Xbox) voice party chats in last week’s 8.00 update. I got this app to see if I might want to get a modern Xbox instead of a PS5. My daily routine for a long time, now, on a PS4, involved beginning a Community party chat as I began my day with friends and new aquaintances. With this app, I was beginning to explore Clubs and to make friends on Xbox. This app update stopped me cold, in my tracks.

You’re each (Xbox and Playstation) moving in what feels to be an oppressive direction, by removing functionality and restricting freedoms. Now, I neither want a PS5, nor a modern Xbox. I may look into solving this problem for myself and many others like me, independent of either platform.";"2020-10-21T09:07:07-07:00";"https://itunes.apple.com/us/review?id=736179781&type=Purple%20Software";"736179781";181;"en";"POSITIVE"
109;7742270181;"Emma_Rocks1Sun";"https://itunes.apple.com/us/reviews/id1157104904";"2108.825.2222";5;"It’s okay- 😬";"So I love 💝 this app and the updates and it’s awesome you can talk to your friends ✨ without a mic and chat with them and change your profile/pic ! But one thing that does bug me a lot is that you can’t change your bio and that really annoys me bc there’s a lot that I would like to change on my bio 😢 but I can’t bc every time I try to it doesn’t let me and it used to let me like without the actual Xbox but now when I log on it doesn’t let me change it at all. I’m not trying to be rude or anything but all I’m saying is just to fix that please bc If you did I would come back on here and change my rating and give a 5 star ⭐️ ! And I swear I’m not lying like I really would ! But just please fix that ! Have a nice day !! Bye bye 😜✌🏻";"2021-08-27T17:18:25-07:00";"https://itunes.apple.com/us/review?id=736179781&type=Purple%20Software";"736179781";168;"en";"POSITIVE"
110;5643523314;"shinjinbukai305";"https://itunes.apple.com/us/reviews/id734399766";"2001.123.1027";1;"I’m highly disgusted with Microsoft";"So I am logged onto my account on the Xbox app which is awesome! However, why can’t I log onto my new Xbox one with the same name? I created an alternative email since I no longer have the phone number to the account, ( I was 6 when I got the account on the original Xbox 360) now I set the alternative email in February on the 10th; I now have to wait 30 day till the 11th of March. Not bad, I just have to wait a day to access my account right? Wrong! I again have to wait an additional 30 days to get back onto my account. I’ve called Microsoft support and tried to explain this to them; they tell me that they cannot do anything even though I’m logged onto the name on my phone and Xbox 360 and have 100% access. Microsoft can’t do anything because of the system, why not? I’ve spent over $1,000 of my earnings on that name and now I can’t get back onto it. Outrageous. In my opinion you’d be better off getting a wii or gameboy. Horrible app and horrible “systems”";"2020-03-10T17:25:26-07:00";"https://itunes.apple.com/us/review?id=736179781&type=Purple%20Software";"736179781";193;"en";"POSITIVE"
111;6570663825;"Ashton H.-R.";"https://itunes.apple.com/us/reviews/id540327518";"2009.1009.1918";2;"It’s okay, but kinda useless now";"I’ve had this app for over a year it it was not the best but I didn’t have a mic for my controller so using the party on my phone was nice (besides all the bugs that can with it); however, with this recent update, the app feels more useless than ever. Sometime I’d just use it to see who was on before starting up my xbox, but now it’s hard to see because rather than the usual set up ( like on the actual xbox where the order does online fav, online friends, offline fav, offline friends) it has the favs all clustered regardless if they’re online or not. Also it lost the the feature to upload your profile picture from the app. That was literally half of the reason I even had it anymore. So with this update it definitely looks nicer, works better (just overall less buggy), but lost a lot of its tools and I honestly wanna delete it off my phone it’s so crap.";"2020-10-24T17:02:48-07:00";"https://itunes.apple.com/us/review?id=736179781&type=Purple%20Software";"736179781";169;"en";"POSITIVE"
112;6706362060;"TheLonely_1";"https://itunes.apple.com/us/reviews/id1195721259";"2011.1117.2218";5;"Where is it";"The new update, it’s not exactly terrible like what some people are saying in their reviews, it’s just that the app took away some features that everyone liked, but one thing they took away that I was disappointed to see gone was not seeing my achievements and comparing it to my friends whenever my Xbox wasn’t on. Maybe I’m just dumb and it was right in front of me and I didn’t see it, but if that’s not the case then Microsoft needs to change that because, yeah even though my complaint isn’t the biggest problem in the world, there are a few more problems that I can say, but the thing is it’s the small things that people like that you took away and Microsoft should do something about it.";"2020-12-01T08:07:11-07:00";"https://itunes.apple.com/us/review?id=736179781&type=Purple%20Software";"736179781";131;"en";"NEGATIVE"
113;5261717552;"Tiffany's Sexy Lover";"https://itunes.apple.com/us/reviews/id25547169";"1911.1121.1243";5;"The best system out there";"Xbox has the best games. Very smooth Online game play. You can’t compare the other console to Xbox, why you ask, The social community is the best, link up with online friends to play multiple player or play duels on campaign mode. Even if you rather play solo, the graphics are amazing, and there are so many different game to choose from, even the throwbacks from XBOX 360. I really like meeting new friends with common interest in gaming. You won’t find another game console that has such easy way to manage your accounts, or settings, personalize your Xbox main screens to fit what you like, and how you want to play. XBOX success is that they listen to there customers, and not just give customers what they thing they want.";"2019-12-11T18:51:02-07:00";"https://itunes.apple.com/us/review?id=736179781&type=Purple%20Software";"736179781";131;"en";"POSITIVE"
114;6519363250;"DumbMovie!!!!";"https://itunes.apple.com/us/reviews/id355331114";"2006.624.124";2;"Was Better Previously";"This app used to super good, especially when it brought the party feature, but times have changed. I find it annoying that I need to use earbuds to actually hear the party without it cutting in and out. It also disconnects half of the time and the servers aren’t good for the app. ANOTHER VERY annoying problem is the notifications. I receive an invite and don’t want to join that party, but every time I open the app. It forces me into that party and makes it awkward. Fix the notification ISSUE. Last problem is being able to sign into multiple accounts. It used to be easy to access before and switch between accounts, but now you have to go through a long process of signing in and out. Please bring back old features, fix the party, and notification issue especially. I am sick of accidentally joining the wrong party, just trying to use the app.";"2020-10-09T23:08:00-07:00";"https://itunes.apple.com/us/review?id=736179781&type=Purple%20Software";"736179781";156;"en";"POSITIVE"
115;3603649701;"James2277";"https://itunes.apple.com/us/reviews/id218739785";"1810.1205.1548";5;"Nearly a perfect app!";"I’ve read many reviews about people having bug/glitch issues, and I can say I’ve never, even since before Xbox One came out, had issues running this app on my iPhone 6. The only thing I would make an adjustment to, is purchasing Xbox 360 backward compatible games. For those that don’t know, we can’t do it through the app. I love to constantly look through Games with Gold (when I’m away from my Xbox, such as at work) every week and on the reset days (1st and 16th of every month) to see what’s free/discounted, and I just wish that I could buy and start downloads for the Xbox 360 games without always needing to go to Xbox’s website. Besides that, again I love this app and I’ve been using it for about 4 years now. Keep up the good work Microsoft!";"2019-01-02T06:36:27-07:00";"https://itunes.apple.com/us/review?id=736179781&type=Purple%20Software";"736179781";142;"en";"POSITIVE"
116;3631623291;"aarondeleys";"https://itunes.apple.com/us/reviews/id465197879";"1810.1205.1548";1;"Horrible performance";"Terrible app. If you’re using your phone as a mic with this app, prepare to be extremely annoyed and frustrated constantly. When in an Xbox Live party, I cannot go a full day without the app crashing at least 5 different times. Doesn’t matter if you’re not using any other apps and all other apps are closed, it will still crash. If you want to rejoin the party, you’ll need to fully quit the app and restarted it... several times. Sometimes i will have to close the app and restart it 4 times or more just for it to let me rejoin the party I was in before it crashed. The app doesn’t sync your party to the Xbox, so on the Xbox menu it says you’re not in a party. This is frustrating when you accidentally invite someone to a party instead of a game on the console, because it will make you leave the party on the app and place you in a party by yourself on the console. You’d think with the billions of dollars Microsoft has they’d be able to design an app that’s at least mediocre";"2019-01-09T15:15:52-07:00";"https://itunes.apple.com/us/review?id=736179781&type=Purple%20Software";"736179781";191;"en";"NEGATIVE"
117;3065974987;"Bigpuppyman";"https://itunes.apple.com/us/reviews/id34112329";"1805.0618.0325";4;"Necessary, useful, and important app";"Microsoft’s Xbox “Smartglass” app for the Xbox One is an incredible addition to any Xbox owner’s media management collection. The app can be used to control most functions on the Xbox, similar to the Apple remote app for the Apple TV. The app also displays information about specific content while it’s playing, as well as social information regarding your Friends’ online statuses. 

While this app is a useful and convenient tool for managing and running apps on your console, the user interface, while clean, runs slowly. The menu transition animations feel weighted, and seem to hold quick and learned app maneuvers back. I wish that the developers would either quicken the transition animations back-and-forth, or add a toggle to remove the feature all together. 

Besides that, the app is great and should be an addition to any Xbox One owner.";"2018-08-14T21:22:56-07:00";"https://itunes.apple.com/us/review?id=736179781&type=Purple%20Software";"736179781";140;"en";"POSITIVE"
118;1834144445;"Coolbear9754";"https://itunes.apple.com/us/reviews/id106071663";"1708.0829.1041";1;"Very dissatisfied.";"At first everything seemed fine with the app, until it kept denying my email when I tried to sign in. I was using the same email address I used with every other device. I triple-checked to see if it was the right one, and it was. Yet the app still would not take my email. In fact, I even made a new email to see if it would let me in. And even after that, it still wouldn’t work. I was looking forward to using this app. Perhaps a bug? Glitch? This really frustrates me. I made sure that I was using the correct email, and yet it would still not verify my email. Very dissatisfied with this app. Not to mention that one of the largest gaming companies worldwide created it. I was expecting a smooth flawless app that I could use to manage my Xbox account. And it wouldn’t even let me sign in.

I know I’m not the only one having this issue. I bet others are as frustrated as me. Microsoft, please fix this error. Or at least respond to my review for instructions. Thank you for your time.";"2017-10-07T19:19:53-07:00";"https://itunes.apple.com/us/review?id=736179781&type=Purple%20Software";"736179781";193;"en";"NEGATIVE"
