"";"id";"userName";"userUrl";"version";"score";"title";"text";"updated";"url";"app";"wordCount";"language";"sentiment"
95;1907128840;"Hawkeye886";"https://itunes.apple.com/us/reviews/id127496760";"3.8";1;"IOS 11";"It is not supported by IOS 11";"2017-11-08T15:53:14-07:00";"https://itunes.apple.com/us/review?id=787203434&type=Purple%20Software";"787203434";7;"en";"NEGATIVE"
96;1847060443;"Dubble_E";"https://itunes.apple.com/us/reviews/id33271140";"3.7";2;"Vera needs to get it together";"The app for the controllers Vera sells is a weak link I. Their product line. The app should be a well built and simple to use interface for managing whatever you are automating in your home. The app is clumsy and ugly to navigate which makes it frustrating to deal with. Maybe ,are the default screen when it loads a dashboard that doesn't look like circa 1996 website? How about a screen with obvious but not overly stated buttons to switch modes and an info icon for each mode that you can tap to  get to deeper settings in the modes? The scene configuration is ok but still a little clumsy. Sadly I'd say that the app version of the scene configuration tools is better than the web UI version. That's not saying much. Vera needs to work on the whole scene logic set up anyhow but that's outside the scope of the app review. Anyhow, this app is pretty weak but it gets the job done if you can bear some frustrations with ugly UIs and non-intuitive layout. It's probably a hit with hipsters who are into vintage stuff with its ancient UI and all.";"2017-10-13T17:16:14-07:00";"https://itunes.apple.com/us/review?id=787203434&type=Purple%20Software";"787203434";196;"en";"NEGATIVE"
97;997183388;"bblack07";"https://itunes.apple.com/us/reviews/id85558355";"1.0";1;"Piece of crap";"I have never written a review for an app for as long as I have existed, but I will say that this app is the absolute biggest piece of crap I have ever had the displeasure of using. I have a vera lite at this point to do one job and one job only, unlock my Yale deadbolt on my front door. The when I was using ui4 it worked ok, but was sketchy at best, but after upgrading to UI6 and this god foresaken app it won't even load the lock on the app when I am staring at it in ui6 on a computer connected to the network. The couple times I got it to show up it didn't respond, never reported correctly so I never knew if the lock was locked or unlocked and in most cases just failed to operate at all. This was after spending over an hour with one of the nice ladies at tech support remotely controlling my computer just to get the vera to sync with the lock again. I am seriously about to throw the veralite in the trash and delete this app from my phone so I can get something that works. Vera is only good for building an unreliable and generally crippled home automation system.";"2014-05-22T17:58:34-07:00";"https://itunes.apple.com/us/review?id=787203434&type=Purple%20Software";"787203434";216;"en";"POSITIVE"
98;1513284654;"michaeljf";"https://itunes.apple.com/us/reviews/id42658253";"3.2";4;"Great for basics";"Overall the app does what it claims to do.  That said, it does have some issues as well as limitations. As an example, Alerts seems to only inform you when a door lock (Kwikset in my case) goes to the locked state.  Unfortunately I am really only concerned with be notified when it is unlocked.  The fact that it natively only supports a few camera brands makes it a little less valuable too. 

Another problem I see is that when you attempt to change the state of a device (e.g. unlocked to locked) the app seems to show a spinning progress indicator that never stops unless you exit and reenter the app. 

So if you are ok with minor buggy behavior and a few limitations, this is a decent  app.";"2017-01-01T06:26:11-07:00";"https://itunes.apple.com/us/review?id=787203434&type=Purple%20Software";"787203434";130;"en";"POSITIVE"
99;1060419304;"VanitaVanilla";"https://itunes.apple.com/us/reviews/id36243587";"2.1.3";5;"Micasa Vera3 & Get Vera Home Auto/Sec";"This is my first version of this APP and our first use of the MiCasa Vera 3 controller. After taking some time to understand some of these items this system works flawlessly! This has been a lot of fun installing, not done yet because of the ability to expand as you go but I can see where this system would be the very best value.  Depending on who manufactures the sensors as some act as repeaters so you can expand the distance that the system operates. Draw out on paper what you want to do then go about doing it smartly!  I would recommend this system over all others since you do not have to break the bank to get the system started.";"2014-09-07T04:34:58-07:00";"https://itunes.apple.com/us/review?id=787203434&type=Purple%20Software";"787203434";123;"en";"POSITIVE"
100;1293744023;"PileHigherAndDeeper";"https://itunes.apple.com/us/reviews/id480728628";"2.2";3;"Not ready for prime time";"Neither app nor the actual home automation system is ready for release. It is a very poorly executed engineering concept. Whole vera ecosystem is at development phase and definitely not a release candidate. My app shows that my system setup is not complete. While I have completed my setup 3years back. It takes nearly 1 min to load the app. Ideally, I would prefer the app loads quickly and keeps on updating the values in background. So, as J said, it is just a suboptimal, proof of concept system which needs patience and technical expertise to operate. However, this is the most versatile HA system in the market.";"2015-11-29T22:32:38-07:00";"https://itunes.apple.com/us/review?id=787203434&type=Purple%20Software";"787203434";108;"en";"POSITIVE"
101;1038590945;"ebobulous";"https://itunes.apple.com/us/reviews/id31409630";"2.0";2;"Improving, still needs work";"2.0 fixes the need to log in every 24 hours for me. Big improvement, I'll give another star for that!

However, now door locks are broken for me with the update.

Have not re-tried setting password, so no idea if complexity is still enforced.

Thermostat (trane) now appears better - can see temp adjustment controls clearly. However, on auto cool/heat, the temp is completely wrong.

Small progress, but progress nonetheless.

 
Old 1/5 star review below:
***********************************
I’ve been a user since UI4, I was currently using UI5 before upgrading to UI6 to use this app.

Huge mistake. Previously, I used iVera - which is a great app. After upgrading to UI6, I am forced to only use this app.

My big problems with this app are:
• This app and new UI6 require arbitrary complexity. Please do not enforce this - require min length, not special and caps/numbers. I would like to use long sentences as password.
• App requires re-login every 24h or less. Old system kept username/password for a month. When users need to access the systems once or twice a day, this requires entering a password almost every time.

Hope this app gets better, or iVera updates to support UI6/UI7.
***********************************";"2014-08-01T00:22:15-07:00";"https://itunes.apple.com/us/review?id=787203434&type=Purple%20Software";"787203434";204;"en";"POSITIVE"
102;1381456404;"hax0rmort";"https://itunes.apple.com/us/reviews/id100613442";"2.4";4;"VeraPlus + VeraLite Home controllers";"My current controller is the Plus. This app really works well and consistently for my family and I.  There is almost a perfect (100%) response rate when using on either local or through the remote relay.  

If you are a power user, I recommend signing up with Vera devs to beta test as you will receive access through TestFlight app.  They keep it current and are extremely responsive to input/issues.  Devs are dedicated and are willing to work with the user.  Lot of  small issues/requests to work out with the firmware for the new controller as well as the app, but it just works for basic device control.  Reliable.";"2016-05-20T07:33:12-07:00";"https://itunes.apple.com/us/review?id=787203434&type=Purple%20Software";"787203434";109;"en";"POSITIVE"
103;1430111578;"Rtannerm3";"https://itunes.apple.com/us/reviews/id30619058";"3.0";4;"Crashes Consistently";"If you haven't yet upgraded to 2.2, I would definitely hold off. The app locks up without fail. I have restarted phone, rebooted Veralite, restarted app at least 20 times. Using an iPhone 6 Plus in case it matters, I will definitely update this review after the issue is resolved. 

Looking forward to geofencing, and the DSC Alarm module looks more polished from the favorites screen. I did try to arm my alarm and it actually froze my alarm keypad so hopefully that is part of the same problem. Now nothing responds within the app.

Update 8/9/16:

Been using the app for several months now with huge success. Most issues have been fixed for me, logging in is as fast as can be expected now with the help of Touch ID. I have an occasional hiccup but usually it's the veralite's issue. 

I see some very recent reviews of people have similar problems that I had long ago and wonder if I am just lucky. Using the same iPhone 6 Plus with around 50 z wave devices on Veralite.";"2016-08-09T18:18:39-07:00";"https://itunes.apple.com/us/review?id=787203434&type=Purple%20Software";"787203434";179;"en";"POSITIVE"
104;1221898003;"ekimsknird";"https://itunes.apple.com/us/reviews/id37644497";"2.2";1;"Major Security Risk to the U.S.";"Popular VeraLite runs notifications through its own servers, taking 20+ minutes (if ever) to get a notification via text.  Check the forums.  The fix? Buy a plugin.  Seriously that's the fix.  Supposedly from Texas.  The Vera software product is built in Hong Kong with Romanian offices.  To get notifications with the Vera Alerts plugin you have to enter your SMTP server/user/pass.  Gmail doesn't work.  All in clear text through the MiCasa servers and btw they can login and see your setup.  And as for the iOS app, long delay and gripe message at every load that you haven't given continuous access to your GPS location.  While waiting, if you jump back to the home screen when waiting to load, it freezes up.  Sketchy stuff, looking to move to a U.S. based product like Indigo.";"2015-07-03T22:28:25-07:00";"https://itunes.apple.com/us/review?id=787203434&type=Purple%20Software";"787203434";134;"en";"POSITIVE"
105;1635790243;"Zenak";"https://itunes.apple.com/us/reviews/id113509676";"3.5";4;"Clunky, but works. Alexa support? Huh?";"It's clunky to get it to sync with devices. Doing a door knob install might want to sync the door knob BEFORE you install it (unless you have a 50ft cat5 to bring the device closer to the door later). The latest version of the app states Alexa supported, but the Alexa skills search menu has nothing matching ""Vera"". All in all the controller is a decent value for the price. Getting better with age, but by the time it gets going better there are newer devices coming out all the time that are a bit more intuitive to use. Been using this now three years with my Vera.";"2017-06-06T17:06:42-07:00";"https://itunes.apple.com/us/review?id=787203434&type=Purple%20Software";"787203434";109;"en";"POSITIVE"
106;1201620905;"PCR4YOU";"https://itunes.apple.com/us/reviews/id118881488";"2.2";4;"Great app and system";"I use the Vera system to make my home a smart tech home as well as a security system.  Even though this app and system is great and all that one would need to setup a smart home as well as a great security system, it does take some tech knowledge to make it work just perfect.  Vera tech support is great and very helpful.  The software setup and engineering of the program needs some more fine tuning as well as a more user friendly approach.  I would recommend this system to anyone that needs to setup a smart home that does not want to be paying some company monthly fees.";"2015-05-23T12:30:33-07:00";"https://itunes.apple.com/us/review?id=787203434&type=Purple%20Software";"787203434";111;"en";"POSITIVE"
107;1580696219;"Brandon098";"https://itunes.apple.com/us/reviews/id295797248";"3.4";1;"Needs work";"This app is just ok.  It does what it needs to do but does it very poorly. 

My biggest complaint is the app is just slow. When you launch it your forced to wait for it to update. Your devices are hard to find and you have to navigate menus to find things (honestly it would be better and faster if they were in one big master list sorted alphabetically then what they currently have). When I launch the app I have a clear goal in mind (e.g turning a fan on) and they certainly do not make that process easy. Bottom line is that when I'm in bed it's simple to just get out of bed and turn the fan on with the physical switch than it is to use the app which shouldn't be the case. 

The other problem is when you turn a switch on, it immediately switches off, and then a short time later switches back on - in other words they are waiting for confirmation from the controller before they show the desired state of your switch. 

All of this tells me they are more interested in releasing new products than they are in making their app a first class experience.";"2017-04-04T11:13:04-07:00";"https://itunes.apple.com/us/review?id=787203434&type=Purple%20Software";"787203434";206;"en";"POSITIVE"
108;1040357595;"PhuongVo";"https://itunes.apple.com/us/reviews/id142870389";"2.1";4;"Nice recent update";"I just updated version 2.1 and tested my front door. It works! Thanks for quick fix. It would be helpful if the app has a tab for all devices that are ""On"".

I just test my front door lock and it does not work. I have to change 3 stars since it breaks one of the features. Please fix it.

The UI looks nice. Old features work properly after download. Support more features such as adding a room, not sure how good yet. Will test it on the way using. Finally for awhile we have a new update. It a lot of better than previous version!";"2014-08-03T23:17:51-07:00";"https://itunes.apple.com/us/review?id=787203434&type=Purple%20Software";"787203434";106;"en";"POSITIVE"
109;1083783885;"abulkhil";"https://itunes.apple.com/us/reviews/id105243781";"2.1.3";3;"Improvement but not quite there yet";"Definitely an improvement from the previous version. Can't get rid of instructions, Needs better flow, not fully optimized to take advantage of the iPhone could be done better. Smoother than the previous version but still clunky seems something lacking on the backend. Not very user-friendly especially when adding more devices/sensors. Overall it's a great help but need some modifications and some cosmetic touches.";"2014-10-20T23:32:13-07:00";"https://itunes.apple.com/us/review?id=787203434&type=Purple%20Software";"787203434";63;"en";"POSITIVE"
110;1025823766;"Blueclone";"https://itunes.apple.com/us/reviews/id238902608";"1.0";1;"Unstable and Time Consuming";"The Vera lite is a decent controller with good support however it requires “support” when it should need it.  This is not a set and forget, between this App, Veralite and the UI updates, you really never know when things are going to work.  We had all the issues that most are complaining of.
Recently, the APP stopped working completely. We logged out and back in like we usually have to do but after a few days called back into tech support.  They were Aware of the issue that will be fixed in the next APP update.  So for now, the app is going to be broke for at least a few months.

Support stated that don’t provide updates for when things break or will become available again, so “you have to just keep trying and once it’s fixed you’ll be able to log in”.

The beta testing this company does obviously isn’t working and the app is too unstable to use even when it’s up.  They really need to focus on stability and usability instead of focusing on a fancy splash screen that is useless.";"2014-07-10T12:20:32-07:00";"https://itunes.apple.com/us/review?id=787203434&type=Purple%20Software";"787203434";186;"en";"NEGATIVE"
111;1112719276;"Mjsamaan";"https://itunes.apple.com/us/reviews/id146575039";"2.1.3";1;"Unstable";"I was having trouble getting two dimmers connected to my vera lite. Had tried removing and the connecting, but no response on the vera during pairing. So I decided to upgrade from UI5 to UI7, hoping it would solve a couple other issues I've had as well.

Upgrade was smooth, but still no luck getting dimmers paired. So I bit the bullet and reset the vera to start from scratch. Now, the two that couldn't connect before are on, but 3 other devices won't pair. In addition, once I got my lock connected, this app crashes about 10 seconds after opening. I'm going back to UI5 and the other app.";"2014-12-13T12:01:36-07:00";"https://itunes.apple.com/us/review?id=787203434&type=Purple%20Software";"787203434";110;"en";"POSITIVE"
112;1304169218;"Cxzy";"https://itunes.apple.com/us/reviews/id138770544";"2.4";3;"Apple Watch Let Down";"The new app layout is an incremental improvement on the previous version with the added use of Touch ID. What lets this release down is the watch app. You can't control anything from it and it's limited to setting your home/away Etc. status. I've already removed it from my watch layout. Come on Vera you should be able to control devices from it like you can with veramate.";"2015-12-21T17:50:22-07:00";"https://itunes.apple.com/us/review?id=787203434&type=Purple%20Software";"787203434";68;"en";"POSITIVE"
113;1126303623;"billnvalley";"https://itunes.apple.com/us/reviews/id31369438";"2.2";1;"Terrible upgrade";"This upgrade is
Absolutely the worst! The
Software will not load and the interface has not been corrected to fix the short comings from the last revision . The only improvement is a change to the icon on iPhone . I wish I could use the original  iPhone app from three years ago. It may not have been flashy but at least it worked. A lot of time making changes that has rendered the vera lite system horribly buggy and unreliable. Please get some software QC people on your staff. I am sick of wasting my time debugging your products.";"2015-01-07T17:05:27-07:00";"https://itunes.apple.com/us/review?id=787203434&type=Purple%20Software";"787203434";100;"en";"NEGATIVE"
114;1118340940;"Counciltuckian";"https://itunes.apple.com/us/reviews/id17642311";"2.1.3";1;"Slow freezing death";"Pretty much describes the state of this company and the functionality if this app.  Slow to connect or to make changes.  Freezes often when trying to edit modes. And frequently misfires when scrolling through the list of devices including unlocking my front door and turning off lights.  

UI7 is a leap ahead of where it used to be and that is horribly sad because it still makes me want to throw it out the window weekly. Having said that, I am almost at a stable state with my Vera Lite. Almost.  Wouldn't purchase again though.";"2014-12-23T22:34:50-07:00";"https://itunes.apple.com/us/review?id=787203434&type=Purple%20Software";"787203434";95;"en";"NEGATIVE"
115;1135685093;"justsomeguyfromsomeplace";"https://itunes.apple.com/us/reviews/id117487577";"2.2";1;"Fire whomever is responsible for this release";"This release has made known unto me new horizons of ineptitude in iOS app development! The only thing it does reliably or quickly is lock up and crash.  

There was clearly no QA involved in this release, unless the QA team is comprised of poorly trained chimpanzees.  The developers responsible this release should either be ashamed of themselves for replacing a much more stable and useful release with this deadlock-prone, slow, horribly  unresponsive, and utterly useless  excuse for an app.

Please don't ruin a good thing by releasing apps that make your otherwise powerful home automation system look like a bad joke being played upon the people endeavoring to use it.  

This is an unnecessary embarrassment that has been left lingering for far too long. 

Please get your house in order so I can start controlling mine again.

Sincerely,
Everyone who has a Vera and an iPhone";"2015-01-24T21:36:06-07:00";"https://itunes.apple.com/us/review?id=787203434&type=Purple%20Software";"787203434";147;"en";"POSITIVE"
116;1150706971;"jconleymo";"https://itunes.apple.com/us/reviews/id41674514";"2.2";2;"Slow & Only Portrait Orientation in iPad";"I was really excited to get this up and running. But it is very slow and the iPad orientation is only Portrait which is awkward in a stand.  Mostly disappointing is the slowness.  I have only had one day so not aware of any crashing yet. For home control this is a very good option but I would think it would run faster bing an established product.  I am setting this up as a beta test for my business. Not sure I would recommend it to my clients at this point.";"2015-02-16T09:10:40-07:00";"https://itunes.apple.com/us/review?id=787203434&type=Purple%20Software";"787203434";91;"en";"POSITIVE"
117;1126693856;"asggold";"https://itunes.apple.com/us/reviews/id36347237";"2.2";3;"Good start but MANY bugs.";"I am glad they did an update to fix a few of the cosmetic errors but seem to have missed the major bugs. Apparently, no matter what you set the main router to, everything shows in Celsius.  Even more confusing is that it is not really Celsius but Fahrenheit with a ""C"". Also, can't set your Scenes correctly from the phone. MUST be set on the router to work (only about 80% of the time do they actually work).";"2015-01-08T12:12:51-07:00";"https://itunes.apple.com/us/review?id=787203434&type=Purple%20Software";"787203434";79;"en";"NEGATIVE"
118;1140533838;"nicknamegeo";"https://itunes.apple.com/us/reviews/id113346413";"2.2";5;"I've been with Vera for at least 2 years...";"The couple of times that I had question Vera tech support was ALWAYS there to solve it.  I suppose that if you totally don't want to have to think at all tech support would probably log on to your system with you and do everything for you!";"2015-02-02T08:06:05-07:00";"https://itunes.apple.com/us/review?id=787203434&type=Purple%20Software";"787203434";47;"en";"POSITIVE"
119;1058524155;"Maxyz";"https://itunes.apple.com/us/reviews/id25922593";"2.1.3";3;"An overall improvement. Still needs work";"This has better user interface and more features, but somethings still don't work properly. For instance, in My Modes, you can only change what each mode does for the first 10 devices and nothing after that.

Update: the new version still takes A WHILE to connect and crashes frequently.";"2014-09-03T13:25:25-07:00";"https://itunes.apple.com/us/review?id=787203434&type=Purple%20Software";"787203434";49;"en";"POSITIVE"
120;1598400688;"Tricia CL";"https://itunes.apple.com/us/reviews/id413250223";"3.4";1;"Update crashes";"Guys really you seem to be going backwards on the progress... App crashes and we can't even get anything to pull up through the web browser.. This app used to be low maintenance on the consumer end, the last few updates have been causing more issues and more resets on our end.  In response to the development team. We gave up on Vera totally in our household. And mind you this product was not geared toward the casual user but towards people that at least have some knowledge of how electronics and programming work...";"2017-04-26T15:56:43-07:00";"https://itunes.apple.com/us/review?id=787203434&type=Purple%20Software";"787203434";94;"en";"POSITIVE"
121;1127916301;"Itfarmer";"https://itunes.apple.com/us/reviews/id145077927";"2.2";1;"Horrible update!!!! Mediocre to Useless";"Absolutely useless with this recent update. Tap 'Away' to set my alarm only to find Vera switches back to 'Home'. - Repeatedly!!!!!!!!
Turn off lights only switches the app's button to off. Lights are shown 'Off' at 100% bright. 
'Turn all lights off/on' only switches the app's button ms on/off. Does nothing for any of the actual lights it's supposed to be controlling. 
Lights and appliances randomly turning on and off. 
Thermostat NEVER changes based on Vera. Only changes by manually adjusting thermostat - even though Vera reports 'command sent successfully'.";"2015-01-10T19:19:54-07:00";"https://itunes.apple.com/us/review?id=787203434&type=Purple%20Software";"787203434";91;"en";"POSITIVE"
122;1168967023;"DJGoodies";"https://itunes.apple.com/us/reviews/id100869368";"2.2";5;"Been great as of mid 2014";"Since the app update last year this apps been working pretty great. Those have issues may want to confirm that your hubs firmware is up to date now too. Using Schlage door locks, linear garage door opener and a couple light switches and overall happy with how it all works-and no monthly fee!";"2015-03-16T11:37:21-07:00";"https://itunes.apple.com/us/review?id=787203434&type=Purple%20Software";"787203434";53;"en";"POSITIVE"
123;1137455667;"mactechnian.org";"https://itunes.apple.com/us/reviews/id158701042";"2.2";4;"So far the best one out there for Vera";"I have tried several others although this could have more features it works and works consistently where the other apps have been a nightmare to setup and some just stop working where this is easy to setup and has worked consistently and dependably since I installed my VersLite";"2015-01-28T04:06:12-07:00";"https://itunes.apple.com/us/review?id=787203434&type=Purple%20Software";"787203434";48;"en";"POSITIVE"
124;1148606449;"Ptg322";"https://itunes.apple.com/us/reviews/id101284123";"2.2";1;"Unreliable, slow and too busy";"This app is unreliable, and very slow on start up. There is no iPad app in landscape mode. Mobile App needs to be a condensed version of the web app, this is too busy and constantly hit lights on while scrolling to find room and light you want. Vera 3 constantly needs re booting and regularly loses devices.  Need to log out or reboot 3 out of 5 devices added.  Scenes do not always run. Tech support is non responsive to emails and online support is confusing, incomplete and hard to navigate.";"2015-02-14T12:47:42-07:00";"https://itunes.apple.com/us/review?id=787203434&type=Purple%20Software";"787203434";92;"en";"POSITIVE"
