"";"id";"userName";"userUrl";"version";"score";"title";"text";"updated";"url";"app";"wordCount";"language";"sentiment"
220;1473468240;"jrabakker";"https://itunes.apple.com/us/reviews/id11446174";"3.1";1;"Geofence. When?!?!";"Been waiting and waiting and waiting on the updated version where the geofence actually switches the system from 'home' to 'away'. It properly provides notifications, but zero actual action. Come on Vera, get your act together.";"2016-10-26T14:19:14-07:00";"https://itunes.apple.com/us/review?id=787203434&type=Purple%20Software";"787203434";36;"en";"NEUTRAL"
221;1598899063;"Rondl74";"https://itunes.apple.com/us/reviews/id18905873";"3.4";1;"Poor.";"It's just hard to know where to start.  On the occaisions where it works, it's not bad.  But some much of the time, it's just either hung or ""thinking"".  
And it truth - it may not be the iOS at fault completely.  The web interface to the Vera 3 controller (UI7) isn't much better.";"2017-04-27T04:14:30-07:00";"https://itunes.apple.com/us/review?id=787203434&type=Purple%20Software";"787203434";54;"en";"NEGATIVE"
222;1068317651;"Darren D74";"https://itunes.apple.com/us/reviews/id407315097";"2.1.3";2;"Vera lite control of Trane 400BB";"The app cannot fully control the Trane 400BB thermostats I can only read the temperature and not alter them up or down. I can only control the vera lite system through a desktop web interface a fix will be great!";"2014-09-21T19:13:47-07:00";"https://itunes.apple.com/us/review?id=787203434&type=Purple%20Software";"787203434";40;"en";"POSITIVE"
223;1063706532;"Rgtk";"https://itunes.apple.com/us/reviews/id31870789";"2.1.3";2;"Very buggy, limited usefulness";"Like the other reviewer mentioned, dashboard is useless and a joke.  Trying to see a larger view of the cameras never works, just says ""loading"" but never does.  Developers, are you listening?";"2014-09-13T08:40:55-07:00";"https://itunes.apple.com/us/review?id=787203434&type=Purple%20Software";"787203434";32;"en";"POSITIVE"
224;1062261769;"Mjfender";"https://itunes.apple.com/us/reviews/id121902700";"2.1.3";2;"Help me";"Still needs some help. Works for a while and then bombs. Takes a call to customer support to get back on track. This doesn't work so well when the system is 1300 miles away.";"2014-09-10T18:30:59-07:00";"https://itunes.apple.com/us/review?id=787203434&type=Purple%20Software";"787203434";34;"en";"POSITIVE"
225;966716615;"CraigCraig74";"https://itunes.apple.com/us/reviews/id4817141";"1.0";1;"Loses Vera unit constantly";"Every few days the app can no longer find my Vera unit and I have to delete and reinstall the app in order for it to show up again. Pretty much useless until this is fixed.  Hope someone is working on this.";"2014-03-27T21:44:00-07:00";"https://itunes.apple.com/us/review?id=787203434&type=Purple%20Software";"787203434";42;"en";"POSITIVE"
226;1128923638;"NeeditBad!";"https://itunes.apple.com/us/reviews/id346792201";"2.2";2;"Very slow...";"I have only written a couple app reviews - but I really need this app to work!  I have ""banked"" on the z-wave product line - and Vera runs it all.  Please fix the speed issues.  I do like the geofencing capability, but have not used it yet.";"2015-01-12T16:05:58-07:00";"https://itunes.apple.com/us/review?id=787203434&type=Purple%20Software";"787203434";48;"en";"POSITIVE"
227;1635030431;"CougsFan04";"https://itunes.apple.com/us/reviews/id42882603";"3.5";2;"Schedules no longer work";"After the last two updates, my schedules no longer work. I've tried everything. Very frustrating. Please fix ASAP.";"2017-06-05T22:04:05-07:00";"https://itunes.apple.com/us/review?id=787203434&type=Purple%20Software";"787203434";18;"en";"NEGATIVE"
228;1063023625;"SolarDell";"https://itunes.apple.com/us/reviews/id33076973";"2.1.3";2;"Mostly does not work when you need it";"The older version of the app worked just fine, this improvement is not an improvement.";"2014-09-12T05:07:55-07:00";"https://itunes.apple.com/us/review?id=787203434&type=Purple%20Software";"787203434";15;"en";"POSITIVE"
229;1304427111;"TBMN";"https://itunes.apple.com/us/reviews/id31760540";"2.4";1;"Watch app?  Doesn't work at all far as I can tell.";"For the life of me I can't figure out what if anything you can do with watch app?  Would be nice if you could do something useful, like turn on lights or unlock doors.  Near as I can tell it's pretty much just viewer for alerts. Lame";"2015-12-22T05:53:03-07:00";"https://itunes.apple.com/us/review?id=787203434&type=Purple%20Software";"787203434";47;"en";"POSITIVE"
230;1375137328;"Hotkey";"https://itunes.apple.com/us/reviews/id5096471";"2.4";1;"It WIll Cost YOu Dearly";"Every time I start the app, it would automatically sets my thermostat to 90. I just walked in to yet another household sauna. 

And the Geo Fencing was quirky at first but it hasn't worked at all since before Christmas. 

Save yourself the bother. Look for a better alternative.";"2016-05-07T17:20:42-07:00";"https://itunes.apple.com/us/review?id=787203434&type=Purple%20Software";"787203434";49;"en";"POSITIVE"
231;1129536453;"Techie-";"https://itunes.apple.com/us/reviews/id85609448";"2.2";1;"Wow, Just Terrible";"I am regretting telling friends to get a Vera now. This upgrade is horrible, constantly crashes, and makes me want to switch to something who has a staff that doesn't have a constant negative attitude about upcoming technology like Apple's built in home automation tools.";"2015-01-13T18:20:29-07:00";"https://itunes.apple.com/us/review?id=787203434&type=Purple%20Software";"787203434";45;"en";"NEGATIVE"
233;1131458035;"RKhanuja";"https://itunes.apple.com/us/reviews/id85962891";"2.2";1;"Horrible upgrade there QA is a joke";"Constant crashes.. Not able to use it..So many basic things are not working. Seems this app was released without QA. Even developer probably didn't test what they wrote. Don't install this it is junk";"2015-01-17T07:02:06-07:00";"https://itunes.apple.com/us/review?id=787203434&type=Purple%20Software";"787203434";34;"en";"NEUTRAL"
234;949204209;"theduma";"https://itunes.apple.com/us/reviews/id224696636";"1.0";2;"Ui6?";"Not sure i the problem is ui6, but my other apps won't recognize this.  Other than that, the camera screen is not set up for a PTz camera. Hopefully they fix soon";"2014-02-23T19:26:37-07:00";"https://itunes.apple.com/us/review?id=787203434&type=Purple%20Software";"787203434";32;"en";"POSITIVE"
235;1067057055;"Tylermagne";"https://itunes.apple.com/us/reviews/id15103931";"2.1.3";1;"Terrible";"Was far more reliable and easier to use 6 months ago. Since then, it has turned for the worse and makes me regret using this system. Too bad I can't get my money back on the controller and all of the pieces.";"2014-09-19T17:36:22-07:00";"https://itunes.apple.com/us/review?id=787203434&type=Purple%20Software";"787203434";42;"en";"NEGATIVE"
236;1518240488;"Mo Zhang";"https://itunes.apple.com/us/reviews/id86363509";"3.3";1;"They want way too much information";"Why the hell do I have to provide my cell phone number, cellphone carrier, street address, and name to be able to use this product. If I knew this, I wouldn't buy vera at the beginning.";"2017-01-08T19:27:19-07:00";"https://itunes.apple.com/us/review?id=787203434&type=Purple%20Software";"787203434";36;"en";"NEGATIVE"
237;1426704595;"ChristianRiley";"https://itunes.apple.com/us/reviews/id27717973";"3.0";1;"Can't login";"Now it just says ""Login failed.  Please try again!""  

Vera has been somewhat reliable in the past, but the last year or so their updates and improvements have been anything but.";"2016-08-04T13:19:43-07:00";"https://itunes.apple.com/us/review?id=787203434&type=Purple%20Software";"787203434";31;"en";"POSITIVE"
238;1284132818;"eljst";"https://itunes.apple.com/us/reviews/id33040386";"2.2";1;"Barely functional";"App takes 15+ seconds to fully launch and then frequently freezes before being able to input a command to the system. Pretty much useless.";"2015-11-08T23:55:36-07:00";"https://itunes.apple.com/us/review?id=787203434&type=Purple%20Software";"787203434";24;"en";"POSITIVE"
239;1019464493;"C.13";"https://itunes.apple.com/us/reviews/id135196695";"1.0";1;"Software is crap";"Product is awesome, however I cannot even turn on or off my ac thermostats, also only displayed in celsius Can't change to Fahrenheit.  Along with other issues.  They really need to fix these simple issues.";"2014-06-29T20:39:37-07:00";"https://itunes.apple.com/us/review?id=787203434&type=Purple%20Software";"787203434";35;"en";"POSITIVE"
240;1134997236;"Lotus2424";"https://itunes.apple.com/us/reviews/id276043860";"2.2";2;"Horrible interface and wait times";"Works, but slow to connect, slow to respond.";"2015-01-23T17:18:49-07:00";"https://itunes.apple.com/us/review?id=787203434&type=Purple%20Software";"787203434";8;"en";"NEUTRAL"
241;1215718024;"Du.ma.50617927";"https://itunes.apple.com/us/reviews/id107683583";"2.2";2;"Slow and inconvenient";"Takes 10 secs to dim light on first startup, other apps are instant..
Home screen also too busy, make it simple and convenient please..";"2015-06-21T08:47:25-07:00";"https://itunes.apple.com/us/review?id=787203434&type=Purple%20Software";"787203434";24;"en";"POSITIVE"
242;1124781731;"S9601694";"https://itunes.apple.com/us/reviews/id118584479";"2.1.3";2;"Used to work fine..";"This app WAS great for activating scenes from the couch or wherever. Now it does nothing but crash.. I haven't been able to open it for a while.";"2015-01-04T16:37:01-07:00";"https://itunes.apple.com/us/review?id=787203434&type=Purple%20Software";"787203434";28;"en";"POSITIVE"
243;1168484934;"BCS Customer";"https://itunes.apple.com/us/reviews/id267000195";"2.2";1;"Thank you for your patience...";"App takes forever to load!! It's annoying when you want to run scenes, etc... You get the ""Thank you for your patience..."", but I only have so much patience!! Please do something about this!";"2015-03-15T12:22:02-07:00";"https://itunes.apple.com/us/review?id=787203434&type=Purple%20Software";"787203434";34;"en";"POSITIVE"
244;1112591892;"ChipsterGuy";"https://itunes.apple.com/us/reviews/id40569114";"2.1.3";5;"Nice App";"Works just fine. No problems here.";"2014-12-13T07:17:02-07:00";"https://itunes.apple.com/us/review?id=787203434&type=Purple%20Software";"787203434";6;"en";"POSITIVE"
245;1513048357;"Chrisx11";"https://itunes.apple.com/us/reviews/id186564277";"3.2";1;"Cannot launch the app anymore after upgrade";"The new version 3.2 has serious problem. Crashes after login, completely unusable.";"2016-12-31T22:14:39-07:00";"https://itunes.apple.com/us/review?id=787203434&type=Purple%20Software";"787203434";12;"en";"NEGATIVE"
246;1243570198;"R0okey";"https://itunes.apple.com/us/reviews/id180341837";"2.2";1;"Vera mobile app";"I really wanted to app to work but it's just not stable. Push notifications don't work. The app constantly is freezing. This app needs to get higher priority from Vera and get all the bugs out.";"2015-08-15T09:32:29-07:00";"https://itunes.apple.com/us/review?id=787203434&type=Purple%20Software";"787203434";36;"en";"NEGATIVE"
247;1131403883;"ixos";"https://itunes.apple.com/us/reviews/id107458909";"2.2";1;"Sloooooow";"Often this has to be killed and restarted to work.. Then it takes forever to connect. Takes another forever to effect commands. Sometimes (often) it's fa aster for me to go upstairs and use a computer.";"2015-01-17T05:19:11-07:00";"https://itunes.apple.com/us/review?id=787203434&type=Purple%20Software";"787203434";36;"en";"NEGATIVE"
248;1712358261;"GJCrawford";"https://itunes.apple.com/us/reviews/id113350285";"3.6";1;"Use A Different App";"Such such an annoying app to begin with...then they decide to add pop up ads promoting their products and service.  Shame I have to use a third party app to use their hardware without a hassle.";"2017-08-04T01:17:37-07:00";"https://itunes.apple.com/us/review?id=787203434&type=Purple%20Software";"787203434";36;"en";"NEGATIVE"
249;1202651267;"Crisnofear";"https://itunes.apple.com/us/reviews/id185701711";"2.2";1;"Slooow bugs";"Takes long time to open the app. When you create or change a scene configuration, most of the time it doesn't save it. The geofence doesn't work most of the time too..";"2015-05-25T15:44:30-07:00";"https://itunes.apple.com/us/review?id=787203434&type=Purple%20Software";"787203434";32;"en";"NEGATIVE"
250;938637794;"Narster";"https://itunes.apple.com/us/reviews/id107663032";"1.0";3;"I can login but,";"I can login but, it shows temperature in Celsius. I would like to change it to Fahrenheit. The thermostat is showing the temperature in Fahrenheit.";"2014-02-07T07:02:26-07:00";"https://itunes.apple.com/us/review?id=787203434&type=Purple%20Software";"787203434";25;"en";"POSITIVE"
251;1114741260;"Arcusjim";"https://itunes.apple.com/us/reviews/id230828013";"2.1.3";1;"Keeps blowing up";"Since I moved to a 6plus application will load then shows no devices then blows up and go away. Reset phone and reloaded app but same results. Also Vera ui7  is very unstable and should have not been released.";"2014-12-17T05:43:52-07:00";"https://itunes.apple.com/us/review?id=787203434&type=Purple%20Software";"787203434";39;"en";"NEGATIVE"
252;1099300734;"Jhos88";"https://itunes.apple.com/us/reviews/id134503039";"2.1.3";1;"Junk";"This is junk. I upgraded to Vera 1.7 and lost half my functionality. Interface stinks. iPhone app no longer works. I can restore factory defaults and start over again...way to go development team!";"2014-11-18T18:43:31-07:00";"https://itunes.apple.com/us/review?id=787203434&type=Purple%20Software";"787203434";33;"en";"NEGATIVE"
253;1284276036;"SamsocaI";"https://itunes.apple.com/us/reviews/id387145161";"2.2";1;"Inferior in many ways";"It is slower than the older app.
It does not show all devices available.
Dashboard shows climate temperature in Celcius when it should be Fahrenheit.
Older app allowed input of desired temperature. New app only allows +/-1 degree.";"2015-11-09T07:36:04-07:00";"https://itunes.apple.com/us/review?id=787203434&type=Purple%20Software";"787203434";38;"en";"POSITIVE"
254;1034487714;"Ford3113";"https://itunes.apple.com/us/reviews/id48862659";"2.0";3;"Lock does not work from App";"Tried to lock/unlock my Kwikset lock and does not work from the App. Layout is nicer.";"2014-07-24T21:15:57-07:00";"https://itunes.apple.com/us/review?id=787203434&type=Purple%20Software";"787203434";16;"en";"POSITIVE"
255;1158285104;"garretn";"https://itunes.apple.com/us/reviews/id29261810";"2.2";2;"Thermostats Don't Adjust";"Make adjustments and they appear to take but the heat never adjust.  Very slow to load app. Looks good but bugs need to be fixed. Shows Celsius temp no adjustment";"2015-02-25T06:20:02-07:00";"https://itunes.apple.com/us/review?id=787203434&type=Purple%20Software";"787203434";30;"en";"POSITIVE"
256;1132884357;"60DeviceGuy";"https://itunes.apple.com/us/reviews/id415141028";"2.2";1;"horrible device";"none of there units, wether its vera2 vera lite, or vera3, non of them can  handle more then 50 devices, there customer support will keep upgrading you (and charge you for it) to the next higher model, but its just a proven fact that no matter how you add them, you network becomes unstable around 50 or more devices thats the limit, so try something esls if you have more then 50 zwave devices.";"2015-01-19T17:49:36-07:00";"https://itunes.apple.com/us/review?id=787203434&type=Purple%20Software";"787203434";74;"en";"NEGATIVE"
257;1124876174;"jeremy480";"https://itunes.apple.com/us/reviews/id7031636";"2.1.3";1;"Slow response";"App takes a long time to load, often freezes and I cannot view my camera in full screen.";"2015-01-04T20:46:50-07:00";"https://itunes.apple.com/us/review?id=787203434&type=Purple%20Software";"787203434";18;"en";"NEUTRAL"
258;1219234874;"Xyzzy plugh";"https://itunes.apple.com/us/reviews/id178342883";"2.2";3;"Decent";"Annoying quirks like long load time. C incorrect for temperature. A true iPad app would be a lot more useful.";"2015-06-28T11:44:07-07:00";"https://itunes.apple.com/us/review?id=787203434&type=Purple%20Software";"787203434";20;"en";"POSITIVE"
259;1084146068;"Jewelz2017";"https://itunes.apple.com/us/reviews/id87639580";"2.1.3";3;"Needs immediate facelift";"User Interface looks outdated and unreliable. Would look for alternatives...";"2014-10-21T16:54:34-07:00";"https://itunes.apple.com/us/review?id=787203434&type=Purple%20Software";"787203434";10;"en";"NEUTRAL"
260;963793781;"Hotopic88";"https://itunes.apple.com/us/reviews/id25287954";"1.0";1;"Nothing but trouble";"This app is trouble every since I downloaded it. I have to constantly login and logout of the app because it doesn't see my unit. So sorry I ever downloaded it and upgraded my firmware.";"2014-03-22T05:45:54-07:00";"https://itunes.apple.com/us/review?id=787203434&type=Purple%20Software";"787203434";35;"en";"NEGATIVE"
261;1431888799;"Miguelromero1&";"https://itunes.apple.com/us/reviews/id420385465";"3.0";1;"Can't log in";"I have not been able to log in to the vera system either through my mac (wether i use safari or google chrome).  NOW I cant even log in to it with my iphone. So basically I HAVE A DEVICE THAT IS USELESS TO ME BECAUSE I CANT ACCESS IT.";"2016-08-12T17:24:42-07:00";"https://itunes.apple.com/us/review?id=787203434&type=Purple%20Software";"787203434";50;"en";"NEGATIVE"
262;1163335642;"videoguymike";"https://itunes.apple.com/us/reviews/id100137283";"2.2";1;"Chat even login using UI7";"I would love to try this app. I can't even login to the app. :( fail!
Their other vera app has many bugs and freezes all the time. Please update and fix this app.";"2015-03-04T13:50:25-07:00";"https://itunes.apple.com/us/review?id=787203434&type=Purple%20Software";"787203434";34;"en";"POSITIVE"
263;928961746;"tracker_oz";"https://itunes.apple.com/us/reviews/id8851257";"1.0";1;"Can’t log in";"I would like to review this app, but it won’t even let me log in. I have an account and have checked the credentials several times. 

Please fix!";"2014-01-21T15:47:09-07:00";"https://itunes.apple.com/us/review?id=787203434&type=Purple%20Software";"787203434";28;"en";"POSITIVE"
264;1286624440;"Jaypup";"https://itunes.apple.com/us/reviews/id106650062";"2.2";1;"Unable to even login";"I'm using Veramate and others just fine with my Vera3 unit. Even reset my password on the site, still cannot login using this app.";"2015-11-14T11:54:34-07:00";"https://itunes.apple.com/us/review?id=787203434&type=Purple%20Software";"787203434";24;"en";"POSITIVE"
265;1257301762;"Fairly Incredible";"https://itunes.apple.com/us/reviews/id26425126";"2.2";2;"Doesn't even support iPhone 6";"Everything looks blurry in this app.";"2015-09-14T00:00:31-07:00";"https://itunes.apple.com/us/review?id=787203434&type=Purple%20Software";"787203434";6;"en";"NEGATIVE"
266;1033869567;"Jenni b case";"https://itunes.apple.com/us/reviews/id315610419";"2.0";2;"Door lock doesn't work.";"The door lock feature doesn't work with my iPhone.";"2014-07-23T18:39:37-07:00";"https://itunes.apple.com/us/review?id=787203434&type=Purple%20Software";"787203434";9;"en";"NEUTRAL"
267;923423367;"Pawsoutst4324";"https://itunes.apple.com/us/reviews/id101420156";"1.0";2;"Bugged";"It will not let me login it gives me an error and before you ask yes I have an account";"2014-01-10T18:12:33-07:00";"https://itunes.apple.com/us/review?id=787203434&type=Purple%20Software";"787203434";20;"en";"NEUTRAL"
268;1165247817;"Crazy-Cactus";"https://itunes.apple.com/us/reviews/id35050951";"2.2";1;"Hangs constantly";"The product was a good idea. It has a very poor implementation. I wish I could get my money back.... Hangs constantly, it is essentially worthless. Buyer beware";"2015-03-08T07:50:09-07:00";"https://itunes.apple.com/us/review?id=787203434&type=Purple%20Software";"787203434";28;"en";"NEGATIVE"
269;1435981464;"SmoochiesBoss";"https://itunes.apple.com/us/reviews/id42534664";"3.0";1;"Won't even load";"Past versions of this app have been passably acceptable, but this newest one won't even load to get me to the sign in screen.";"2016-08-19T23:08:17-07:00";"https://itunes.apple.com/us/review?id=787203434&type=Purple%20Software";"787203434";24;"en";"POSITIVE"
270;1187019775;"SpaceGrey";"https://itunes.apple.com/us/reviews/id28104381";"2.2";1;"Frustrating and useless";"Using this is like running up a greased slide. One bug after another - impossible to get anything accomplished.";"2015-04-23T14:58:01-07:00";"https://itunes.apple.com/us/review?id=787203434&type=Purple%20Software";"787203434";19;"en";"POSITIVE"
271;1130413275;"Big Lynxy";"https://itunes.apple.com/us/reviews/id43533910";"2.2";1;"Thermostats don't work from favorite menu";"Problem with thermostat temperature update, only if I go rooms, not work from fav. menu. Very slow, not reliable, shows wrong temperature";"2015-01-15T08:10:30-07:00";"https://itunes.apple.com/us/review?id=787203434&type=Purple%20Software";"787203434";22;"en";"NEGATIVE"
272;1071395554;"FIVEfingersFIVE";"https://itunes.apple.com/us/reviews/id43105725";"2.1.3";2;"Rudimentary at best";"Awful. The whole going from a vera2 which worked to a vera 3 which virtually nothing transferred is a joke.  This system is not for the feint of heart.";"2014-09-27T18:11:10-07:00";"https://itunes.apple.com/us/review?id=787203434&type=Purple%20Software";"787203434";29;"en";"POSITIVE"
273;1126348109;"Redemily";"https://itunes.apple.com/us/reviews/id27607377";"2.2";1;"Keeps crashing";"The latest update crashes and won't let me log in or keep me logged in. Fix it please!";"2015-01-07T19:08:54-07:00";"https://itunes.apple.com/us/review?id=787203434&type=Purple%20Software";"787203434";18;"en";"POSITIVE"
274;1261460942;"Mattdoesnthaveanickname";"https://itunes.apple.com/us/reviews/id13586486";"2.2";2;"Works well";"Crashes a lot in io9. Lacks Touch ID to access the app. It's slow and freezes";"2015-09-22T19:09:07-07:00";"https://itunes.apple.com/us/review?id=787203434&type=Purple%20Software";"787203434";16;"en";"NEUTRAL"
275;1055958019;"Biggest Bopper";"https://itunes.apple.com/us/reviews/id101245137";"2.1.2";5;"Brilliant";"This App is Brilliant- can't wait to finish the install!
Flood protection, crime detection and prevention, HAVAC, lighting, and monitoring my BMW I3";"2014-08-29T22:31:12-07:00";"https://itunes.apple.com/us/review?id=787203434&type=Purple%20Software";"787203434";23;"en";"POSITIVE"
276;1286096218;"Fieldmedic";"https://itunes.apple.com/us/reviews/id167316332";"2.2";1;"User UNfriendly";"This was written rather poorly. It's difficult to do much of anything in this app.

I guess I shouldn't complain because it's free. I got exactly what I paid for.";"2015-11-13T09:33:31-07:00";"https://itunes.apple.com/us/review?id=787203434&type=Purple%20Software";"787203434";30;"en";"POSITIVE"
277;1855047925;"Jacob Khan";"https://itunes.apple.com/us/reviews/id43931182";"3.7";1;"Problem with I watch app after update";"The new iOS and I watch update messed up veras app. It keeps crashing on the watch";"2017-10-17T05:38:25-07:00";"https://itunes.apple.com/us/review?id=787203434&type=Purple%20Software";"787203434";17;"en";"NEGATIVE"
278;1522429224;"Sailorboy63";"https://itunes.apple.com/us/reviews/id129522910";"3.3";1;"Don't bother getting this app";"This is one of the worst app's I have ever come across. It's hard for me to understand why apple let this a app get through.";"2017-01-14T21:11:49-07:00";"https://itunes.apple.com/us/review?id=787203434&type=Purple%20Software";"787203434";26;"en";"NEGATIVE"
279;1316062856;"Yukongold25";"https://itunes.apple.com/us/reviews/id22217327";"2.4";2;"Lost dimming function";"Like the app hate the last update. I cannot dim any of devices!!";"2016-01-13T16:50:43-07:00";"https://itunes.apple.com/us/review?id=787203434&type=Purple%20Software";"787203434";13;"en";"NEGATIVE"
280;1171463058;"vbchrisj";"https://itunes.apple.com/us/reviews/id39039459";"2.2";1;"Is it supposed to work??";"I can't even log on! I've installed and uninstalled a number of times, but still nothing.";"2015-03-21T17:12:16-07:00";"https://itunes.apple.com/us/review?id=787203434&type=Purple%20Software";"787203434";16;"en";"POSITIVE"
281;1059625896;"GrandpaFlavors";"https://itunes.apple.com/us/reviews/id109029091";"2.1.3";5;"Great App for home automation";"Love the product and the app";"2014-09-05T19:52:05-07:00";"https://itunes.apple.com/us/review?id=787203434&type=Purple%20Software";"787203434";6;"en";"POSITIVE"
282;1567170326;"bolkboy7";"https://itunes.apple.com/us/reviews/id37102033";"3.4";1;"App will not work with latest update.";"Usually this app works great but the update a couple days ago now won't let the app load.";"2017-03-18T07:04:01-07:00";"https://itunes.apple.com/us/review?id=787203434&type=Purple%20Software";"787203434";18;"en";"POSITIVE"
283;1058929809;"MIStateCJ";"https://itunes.apple.com/us/reviews/id105337973";"2.1.3";1;"Total Garbage";"I love my Vera, but hate the new UI7 and this new app. I will be going back to UI5 today and rebuilding the scenes and devices I lost when I upgraded. Come on guys, step up in the automation game, or throw on the towel!!";"2014-09-04T09:19:10-07:00";"https://itunes.apple.com/us/review?id=787203434&type=Purple%20Software";"787203434";46;"en";"NEGATIVE"
284;1844055967;"Found missing info";"https://itunes.apple.com/us/reviews/id27609206";"3.7";1;"App crashes";"Attempted to open app via fingerprint or pin with app crashing - doesn’t open back to home screen. Ios 11.0.3 on iPhone 7.";"2017-10-12T08:37:17-07:00";"https://itunes.apple.com/us/review?id=787203434&type=Purple%20Software";"787203434";23;"en";"NEUTRAL"
285;1571096523;"cozmogeek";"https://itunes.apple.com/us/reviews/id102772710";"3.4";1;"Totally unstable";"Since the last update I can't even get the app to open without crashing.  Please fix it!";"2017-03-23T16:27:32-07:00";"https://itunes.apple.com/us/review?id=787203434&type=Purple%20Software";"787203434";17;"en";"NEGATIVE"
