"";"id";"userName";"userUrl";"version";"score";"title";"text";"updated";"url";"app";"wordCount";"language";"sentiment"
168;1223155191;"Nerdren";"https://itunes.apple.com/us/reviews/id34742356";"2.2";2;"Buggy & Weak Interface";"The graphics are pretty clean, but the interface too closely resembles the browser interface, and is clunky for phones.  It might be okay for iPads; I'm not sure.  (The browser interface is adequate--for PCs with decent screens.)

I've very seldom seen something as buggy coming from the Apple Store.";"2015-07-06T11:23:48-07:00";"https://itunes.apple.com/us/review?id=787203434&type=Purple%20Software";"787203434";49;"en";"POSITIVE"
169;1097793226;"Shawn_KY";"https://itunes.apple.com/us/reviews/id125376348";"2.1.3";3;"Meh";"It has some nice features and perhaps might get there one day. Maybe it would be better if they bought out Vera Mate and combined the two.  Thermostat control flaky. Try changing and it automatically sets the temperature to 90C. (I have settings set to F to begin with.) UI7 has been average at best... So is this app.";"2014-11-15T21:04:08-07:00";"https://itunes.apple.com/us/review?id=787203434&type=Purple%20Software";"787203434";59;"en";"POSITIVE"
170;1132255422;"mc1home";"https://itunes.apple.com/us/reviews/id29080945";"2.2";4;"Seems to be fixed";"This upgrade at first would crash or not connect. Seems like there has a fix made and it works good for me no problems.";"2015-01-18T14:11:06-07:00";"https://itunes.apple.com/us/review?id=787203434&type=Purple%20Software";"787203434";24;"en";"POSITIVE"
171;1106966391;"whowman";"https://itunes.apple.com/us/reviews/id190822243";"2.1.3";5;"App works very well";"Great little app and works as advertised.

I love being able to see the status of my house when I am halfway across the planet.";"2014-12-02T13:17:39-07:00";"https://itunes.apple.com/us/review?id=787203434&type=Purple%20Software";"787203434";25;"en";"POSITIVE"
172;1146614335;"Brett.H.Howell";"https://itunes.apple.com/us/reviews/id85693334";"2.2";3;"Simplify and make faster";"The app works but the update slowed login times to the point that it makes it less convenient that working items manually. Please hear my concerns and refocus the app of doing the required essentials well and quickly.";"2015-02-12T17:51:29-07:00";"https://itunes.apple.com/us/review?id=787203434&type=Purple%20Software";"787203434";38;"en";"POSITIVE"
173;1211621291;"Jeremy S";"https://itunes.apple.com/us/reviews/id31629242";"2.2";1;"Freezes / crashes often";"The app will lock up and become unresponsive often.  I resorted to loading the web UI and saving as a bookmark on the home screen.  This also has the advantage of being able to change advanced settings which is not exposed in the mobile app for some reason.";"2015-06-13T03:11:59-07:00";"https://itunes.apple.com/us/review?id=787203434&type=Purple%20Software";"787203434";48;"en";"POSITIVE"
174;1110644503;"Mr Vaz";"https://itunes.apple.com/us/reviews/id140841993";"2.1.3";3;"It's adequate, but can use improvements!";"After a few tries, I finally got it to schedule one light switch. May be its me being spoiled by Apple easy interface methodology, but the UI on this app remind me of old days when programming on mainframe computers.";"2014-12-09T14:29:02-07:00";"https://itunes.apple.com/us/review?id=787203434&type=Purple%20Software";"787203434";40;"en";"POSITIVE"
175;1128952092;"OkeyMor57";"https://itunes.apple.com/us/reviews/id112708677";"2.2";1;"I Regret Updating My firmware to U17";"For several weeks I have debated with myself whether to update or not, finally today I did and regret it.
It cannot log on to my device so the only control I have is via the web and on an iPad, whether using Safari, Chrome or Mercury, it just crashes.

I lost the ability to set temperature range on my thermostat that I could on U15.";"2015-01-12T17:27:46-07:00";"https://itunes.apple.com/us/review?id=787203434&type=Purple%20Software";"787203434";66;"en";"NEGATIVE"
176;1066891518;"Sbidwell";"https://itunes.apple.com/us/reviews/id26032684";"2.1.3";1;"Man this is bad!";"I really thought vera was going to be a good home automation solution, but if this app and the new UI7 is an indication of what this company is doing I suggest you run away from their products as fast as you can. I'm ditching my Vera lite and moving on. The new UI7 no longer works reliably with even the simplest of task such as turning on my driveway lights at sunset, and the mobile app is a complete joke. My Vera lite is going on eBay.";"2014-09-19T09:42:11-07:00";"https://itunes.apple.com/us/review?id=787203434&type=Purple%20Software";"787203434";88;"en";"POSITIVE"
177;1155751523;"Jeffliang";"https://itunes.apple.com/us/reviews/id38999229";"2.2";2;"Forever to load";"Takes 10-15 seconds to connect AFTER the app has loaded even when I'm at home. I expect it to connect through the local network. What's the point?  I could've already walked towards the light switch and turned off lights in that time frame.";"2015-02-21T18:16:58-07:00";"https://itunes.apple.com/us/review?id=787203434&type=Purple%20Software";"787203434";43;"en";"NEUTRAL"
178;933905131;"KF6DLQ";"https://itunes.apple.com/us/reviews/id14465768";"1.0";5;"Work wonderfully!";"You guys need a UI6 vera account. The UI5 accounts won't work. Works great and love the app, but you need the new version for vera first and use the new account you have to create for UI6.";"2014-01-30T18:05:04-07:00";"https://itunes.apple.com/us/review?id=787203434&type=Purple%20Software";"787203434";38;"en";"POSITIVE"
179;1130087587;"tccmn glad";"https://itunes.apple.com/us/reviews/id431745673";"2.2";2;"A step backwards";"The previous version worked better. This version forces me to log back in each time I exit the app.  The previous version kept me logged in.  It also spins for quite a while after log in thanking me for my patience which is annoying.";"2015-01-14T18:17:55-07:00";"https://itunes.apple.com/us/review?id=787203434&type=Purple%20Software";"787203434";44;"en";"POSITIVE"
180;1062502636;"Jasonkhonlaw";"https://itunes.apple.com/us/reviews/id185853463";"2.1.3";2;"Buggy, can't connect regularly";"Kind of works, but pretty buggy.  The dashboard is worthless as it always says I have no devices, lights, or security devices installed, even though I have several.

The worst is that it doesn't connect a good portion of the time, which makes it useless.";"2014-09-11T05:53:24-07:00";"https://itunes.apple.com/us/review?id=787203434&type=Purple%20Software";"787203434";45;"en";"NEGATIVE"
181;966593692;"jkuskowski";"https://itunes.apple.com/us/reviews/id103728897";"1.0";2;"Works great after you can get logged in!";"I really like this app once you are able to get connected.  It worked for a while, then all of a sudden to get connected I had to logout then back in. Which is very annoying!!!  Hopefully this bug gets fixed soon.";"2014-03-27T16:12:53-07:00";"https://itunes.apple.com/us/review?id=787203434&type=Purple%20Software";"787203434";42;"en";"POSITIVE"
182;1060689872;"ZeeJae";"https://itunes.apple.com/us/reviews/id246921468";"2.1.3";1;"Vera is not a reliable home automation system";"Although it's very flexible, reliability is a real issue. Software version control is real issue for this company. Support is only email and nonexistent over weekend. God forbid , if their servers go down on Friday evening, you literally cannot control anything device in your house using this device. Be prepared to have a backup plan.";"2014-09-07T14:40:45-07:00";"https://itunes.apple.com/us/review?id=787203434&type=Purple%20Software";"787203434";56;"en";"POSITIVE"
183;1630446688;"wjparris";"https://itunes.apple.com/us/reviews/id86179642";"3.5";2;"Now with pop-up advertising!";"Now contains pop-up ads for their products that get in your way while loading the app. You have to exit the ad before using their application. Just go get HomeWave or another app that doesn't have ads.";"2017-06-01T05:12:44-07:00";"https://itunes.apple.com/us/review?id=787203434&type=Purple%20Software";"787203434";37;"en";"NEUTRAL"
184;1573447317;"Hatter81";"https://itunes.apple.com/us/reviews/id126882018";"3.4";1;"App crashing";"So every few days I have to delete and reinstall the app because something seems to be getting corrupted and forces the app to crash during launch. Phone restarts, and other trouble shooting checks do nothing. Please find the data leak and update so that we can use this app regularly again.";"2017-03-26T18:02:39-07:00";"https://itunes.apple.com/us/review?id=787203434&type=Purple%20Software";"787203434";52;"en";"NEGATIVE"
185;1215950600;"MB-Denver";"https://itunes.apple.com/us/reviews/id10328644";"2.2";4;"Better than the old one";"I moved to the new edge from an older vera3.  The UI is much better.  Yes, I agree there are bugs, but I think it is much better.  

I wish startup was faster.";"2015-06-21T20:25:56-07:00";"https://itunes.apple.com/us/review?id=787203434&type=Purple%20Software";"787203434";33;"en";"POSITIVE"
186;1135499955;"TechnologyTalisman";"https://itunes.apple.com/us/reviews/id17291545";"2.2";5;"Works well";"I use this to control z wave devices connected to my Vera at home. Works great whether I'm on home wireless or cellular network data connection.";"2015-01-24T12:58:20-07:00";"https://itunes.apple.com/us/review?id=787203434&type=Purple%20Software";"787203434";26;"en";"POSITIVE"
187;1140747432;"Frustrated user 100026";"https://itunes.apple.com/us/reviews/id140954628";"2.2";1;"I wish I could give this app zero stars.";"Sure this app looks pretty, but functionally it's awful, especially for an app that you use to control simple things like lights in your home. Nothing is more frustrating then opening the app and waiting up till a minute before you can turn on your living room lights.";"2015-02-02T18:20:35-07:00";"https://itunes.apple.com/us/review?id=787203434&type=Purple%20Software";"787203434";48;"en";"POSITIVE"
188;1132911606;"Ralphsson1";"https://itunes.apple.com/us/reviews/id244768974";"2.2";1;"Horrible Update";"New proximity feature is worthless; does not appear to work. App takes significantly longer to be ready to do anything--requiring tens of seconds standing there waiting for ""Thank you for your patience"" to go away so you can set ""Away"" or ""Home"" when you are leaving or coming home. Please fix these!";"2015-01-19T19:01:55-07:00";"https://itunes.apple.com/us/review?id=787203434&type=Purple%20Software";"787203434";52;"en";"POSITIVE"
189;1744214978;"Isthisnicknmaetakentoo4132";"https://itunes.apple.com/us/reviews/id29035685";"3.6";1;"An ad? Really?!";"Probably the dumbest decision I have seen in the history of apps (and I have seen a lot).
No way to get rid of the ad.  An encroachment on my personal space because this is not just any other app but my home controller. Really feels like I don't have control at all and makes me almost paranoid about what they can do to my house.";"2017-08-23T22:34:08-07:00";"https://itunes.apple.com/us/review?id=787203434&type=Purple%20Software";"787203434";66;"en";"NEUTRAL"
190;1348351813;"CandyLineup";"https://itunes.apple.com/us/reviews/id345112612";"2.4";1;"Can't login with known working user name!";"I can login with my user name and password on the website but this app acts like I put in an incorrect password or something. ""Login failed... Please try again"", it repeatedly says. I had stuck with the old app but that has now stopped working unless I am home so I have renewed interest in this app.";"2016-03-15T11:41:45-07:00";"https://itunes.apple.com/us/review?id=787203434&type=Purple%20Software";"787203434";58;"en";"POSITIVE"
191;1180893675;"Dazzlingk";"https://itunes.apple.com/us/reviews/id146927753";"2.2";1;"Worthless";"This app is so bad is crashes every few minutes.  Worse, it mistakes my initial swipe to initiate a scroll with am actual command powering or switching a device without desiring to do so. Just trying to scroll the screen up or down can unintentionally open a garage door, turn off a thermostat or flood light, etc. Terrible!";"2015-04-10T15:56:10-07:00";"https://itunes.apple.com/us/review?id=787203434&type=Purple%20Software";"787203434";58;"en";"NEGATIVE"
192;1124038053;"Zombie...";"https://itunes.apple.com/us/reviews/id148848689";"2.1.3";2;"Good to have on mobile, but needs work";"Nice app to have mobile, but things like temperature settings needs work.  It's show C when everything is operating in F. It doesn't show the electrical utilization info like in the web interface. It is nice to have on mobile though.";"2015-01-03T09:02:23-07:00";"https://itunes.apple.com/us/review?id=787203434&type=Purple%20Software";"787203434";41;"en";"POSITIVE"
193;1042631469;"SoCal Jay";"https://itunes.apple.com/us/reviews/id14434891";"2.1";5;"Finally Arriving ...";"Had a lot of negative experiences with old UI.  Under this new UI7 version many of the bugs have finally been addressed.   

This is getting much closer to the experience expected for consumer-level adoption.  

Only recommend a more formal and simple way to report on bugs and enhancement requests.  

I commend the move forward.  Thank you.";"2014-08-07T21:55:38-07:00";"https://itunes.apple.com/us/review?id=787203434&type=Purple%20Software";"787203434";56;"en";"POSITIVE"
194;1241210555;"Dthedba";"https://itunes.apple.com/us/reviews/id179069956";"2.2";4;"Cool app";"While it takes a bit of work to get the security set up (and easier to do on the pic for that particular), the app works well for monitoring. 

All in all very pleased.";"2015-08-10T20:29:36-07:00";"https://itunes.apple.com/us/review?id=787203434&type=Purple%20Software";"787203434";34;"en";"POSITIVE"
195;1135956309;"My name is Don";"https://itunes.apple.com/us/reviews/id38998397";"2.2";1;"Slow to connect";"Slow to connect. 6 seconds on average. 
I called support for them to act surprised (they must not read the reviews) 
The operator said February may see a update that might fix this issue. Slow response in my option. Back to wink. Too bad as I have much better rules with this system.";"2015-01-25T09:33:10-07:00";"https://itunes.apple.com/us/review?id=787203434&type=Purple%20Software";"787203434";53;"en";"POSITIVE"
196;1055026458;"Trekfrk";"https://itunes.apple.com/us/reviews/id335026348";"2.1.2";2;"Too soon";"Much cleaner interface than the old one but not as reliable. Doesn't connect all the time and often shows no devices. Response time seems slower and sometimes freezes. Can't wait for update.";"2014-08-28T07:02:08-07:00";"https://itunes.apple.com/us/review?id=787203434&type=Purple%20Software";"787203434";32;"en";"NEGATIVE"
197;1127003418;"WishIstayedwithUI5";"https://itunes.apple.com/us/reviews/id102768020";"2.2";1;"Don’t do it !";"Decided to upgrade after almost 2 years to UI7, worst decision ever.  UI7 is super buggy and ultra slow response times when it does work.  This mobile app looks cool but locks up after a few seconds, rendering my system useless.  If your Vera3 is working ok with an older version, stay with that, this isn’t ready yet.";"2015-01-09T04:11:42-07:00";"https://itunes.apple.com/us/review?id=787203434&type=Purple%20Software";"787203434";58;"en";"POSITIVE"
198;1089416084;"JerryK";"https://itunes.apple.com/us/reviews/id40205776";"2.1.3";1;"Nice looking interface, too bad it doesn't work";"Even more buggy than UI6. I need to go back to UI5, at least on my devices worked under that. Most of my devices don't work under UI7. Total garbage. I'd even be willing to pay a small monthly fee if it would help them hire programmers that knew what they were doing";"2014-10-31T13:43:17-07:00";"https://itunes.apple.com/us/review?id=787203434&type=Purple%20Software";"787203434";53;"en";"POSITIVE"
199;1299259886;"pshoover";"https://itunes.apple.com/us/reviews/id40217948";"2.2";4;"Works as designed.";"A little slow but does the trick. App does not have all features of the web but works perfect.";"2015-12-11T16:52:48-07:00";"https://itunes.apple.com/us/review?id=787203434&type=Purple%20Software";"787203434";19;"en";"POSITIVE"
200;1142266827;"Chezeit";"https://itunes.apple.com/us/reviews/id135287745";"2.2";3;"Improvement";"Definitely better then the previous version. Worth the effort. Looking forward to more improvements.";"2015-02-05T16:30:02-07:00";"https://itunes.apple.com/us/review?id=787203434&type=Purple%20Software";"787203434";14;"en";"POSITIVE"
201;1147515271;"DblJBird";"https://itunes.apple.com/us/reviews/id109864389";"2.2";1;"Pointless";"Incredibly slow load & refresh time. Bulky, slow and next to impossible to navigate. 

I've been with Vera since close to their inception. One thing they can never seem to get down is their interface, which is in my opinion, absolutely as important as its reliability. 

You scroll endlessly through menus and devices scrambling to find what you want. My wife and daughters wouldn't even give it a chance. 

If you're reading this and are searching, try VeraMate. At this point, it's the best thing out there for the Vera community.";"2015-02-13T14:00:24-07:00";"https://itunes.apple.com/us/review?id=787203434&type=Purple%20Software";"787203434";91;"en";"POSITIVE"
202;1567285071;"Brijam";"https://itunes.apple.com/us/reviews/id42906783";"3.4";5;"Great!";"Thanks for the update, now I can add/delete pin codes from the app. That's exactly what I have been waiting for. 👍🏼";"2017-03-18T10:19:08-07:00";"https://itunes.apple.com/us/review?id=787203434&type=Purple%20Software";"787203434";22;"en";"POSITIVE"
203;1126725545;"Engzr016";"https://itunes.apple.com/us/reviews/id39651224";"2.2";1;"Horrible Update";"The only good that came out of this update was the new icon. Otherwise, it loves to crash whenever you try to do something. Oh, and it takes forever to load, so much so that it's actually quicker to grab my laptop and sign in on the web to control my system.";"2015-01-08T13:56:32-07:00";"https://itunes.apple.com/us/review?id=787203434&type=Purple%20Software";"787203434";52;"en";"POSITIVE"
204;1580060918;"30hen801";"https://itunes.apple.com/us/reviews/id384447275";"3.4";4;"App unstable";"Constantly crashes. Have to log in through the web site.";"2017-04-03T19:04:09-07:00";"https://itunes.apple.com/us/review?id=787203434&type=Purple%20Software";"787203434";10;"en";"NEUTRAL"
205;1213671211;"JSY33";"https://itunes.apple.com/us/reviews/id255013110";"2.2";4;"Awesome";"I really like the easy and big interface this app has, very easy to see my devices and no problem navigating thru the app.";"2015-06-17T06:34:19-07:00";"https://itunes.apple.com/us/review?id=787203434&type=Purple%20Software";"787203434";24;"en";"POSITIVE"
206;1129959985;"Kazakaz";"https://itunes.apple.com/us/reviews/id19188751";"2.2";1;"Geofencing!";"I was excited for this update to finally be able to change scenes based on my location. Too bad it doesn't work consistently. When I'm sitting at home it randomly switches to away and my motion sensors trip. When I leave home, it doesn't know I left and keeps the mode in Home.";"2015-01-14T12:15:05-07:00";"https://itunes.apple.com/us/review?id=787203434&type=Purple%20Software";"787203434";53;"en";"NEGATIVE"
207;988787449;"mch7";"https://itunes.apple.com/us/reviews/id26911920";"1.0";2;"Needs work!";"I agree with many of the people here. It constantly loses the unit and a refresh does not work. You have to logout and log back in. Not at all convenient.  Please fix!  Will rate higher once problem is fixed!";"2014-05-06T14:52:27-07:00";"https://itunes.apple.com/us/review?id=787203434&type=Purple%20Software";"787203434";40;"en";"NEGATIVE"
208;1234371559;"jboze_qt";"https://itunes.apple.com/us/reviews/id26003426";"2.2";1;"Wow, shockingly bad";"I really like the vera home automation system, but this mobile app is just terrible and kills the experience. It usually takes 15 seconds or so to connect to the Vera system. That alone is a dealbreaker. I'm going to try some third-party apps in hopes of finding something more responsive and stable.";"2015-07-28T04:03:22-07:00";"https://itunes.apple.com/us/review?id=787203434&type=Purple%20Software";"787203434";53;"en";"NEUTRAL"
209;946012894;"SINBIN RUGBY";"https://itunes.apple.com/us/reviews/id29274869";"1.0";3;"One big request";"PLEASE get rid of the splash screen every time I go back to the app. Other than that it seems to be working well.";"2014-02-18T11:41:05-07:00";"https://itunes.apple.com/us/review?id=787203434&type=Purple%20Software";"787203434";24;"en";"POSITIVE"
210;1134865419;"Linderballs";"https://itunes.apple.com/us/reviews/id30577265";"2.2";5;"So far so good";"App works great for me. I only have two devices on my network but so far it's been great!";"2015-01-23T10:49:23-07:00";"https://itunes.apple.com/us/review?id=787203434&type=Purple%20Software";"787203434";19;"en";"POSITIVE"
211;1128894680;"NaeemInSJ";"https://itunes.apple.com/us/reviews/id237267044";"2.2";2;"Why not test before releasing?";"Every firmware or app release has basic issues that points to no testing (or poor testing) conducted by you guys.

 I am willing to test for you if you like.

In this update annoying welcome message is gone and has been replaced with geo location not configured message.

App and Veralite is constantly loosing password, I have reset passwords 3 times by now.
Horrible as usuall !!!!
It will get better but please learn from previous releases  and do not repeat them";"2015-01-12T14:38:32-07:00";"https://itunes.apple.com/us/review?id=787203434&type=Purple%20Software";"787203434";82;"en";"POSITIVE"
212;1505626928;"Ohhhhnoooo";"https://itunes.apple.com/us/reviews/id540341961";"3.2";1;"Don't do upgrade";"Since performing the upgrade I am not able to open the app. It crashes instantly. I emailed for support and they replied quickly asking for more information-which I provided. Now I have not heard back for over 5 hours. Do not install this version!";"2016-12-20T10:29:39-07:00";"https://itunes.apple.com/us/review?id=787203434&type=Purple%20Software";"787203434";44;"en";"POSITIVE"
213;1245953371;"NE1BUTYOO";"https://itunes.apple.com/us/reviews/id42787765";"2.2";1;"So buggy and unreliable";"The app really hampers the reliability of the entire system.  Currently, it shows my home being 80 degrees and set at 165 degrees.  Celsius!?! The overall latency of the Vera app and the entire system means that it will likely be replaced in my home soon if these glitches aren't addressed quickly.";"2015-08-20T06:59:38-07:00";"https://itunes.apple.com/us/review?id=787203434&type=Purple%20Software";"787203434";52;"en";"NEUTRAL"
214;1210802573;"taylorkt32";"https://itunes.apple.com/us/reviews/id42635298";"2.2";1;"Terrible";"I upgraded, so I thought lol, from UI5 to UI7 back in Dec 2014. UI7 was too buggy for me. Things which worked just fine in UI5, no longer work in UI7. Too many problems to list here. Plus, the problems have all been documented by other users. Stay away from this product from this vendor. PERIOD";"2015-06-11T10:26:04-07:00";"https://itunes.apple.com/us/review?id=787203434&type=Purple%20Software";"787203434";57;"en";"NEGATIVE"
215;1129729161;"Bbbilll63582752";"https://itunes.apple.com/us/reviews/id32754633";"2.2";1;"Not ready for market... Run from this";"App does not stream video from camera. 
App does not always connect to the controller. 
App does not always execute commands thou it says I did. 
Had to return non working components... Weeks later replacements have not arrived. 
Spent hours with tech support with little results. They seem to know little more than I do about the system. 
Regular software updates show the lack of readiness. 
The vistacam often stops responding and must be power-cycled to reset it (not a good thing for a remote security system).";"2015-01-14T02:56:56-07:00";"https://itunes.apple.com/us/review?id=787203434&type=Purple%20Software";"787203434";87;"en";"POSITIVE"
216;1304038551;"BillyBoJangles";"https://itunes.apple.com/us/reviews/id101089308";"2.4";5;"So much better";"This update is so much better. Thank you!";"2015-12-21T11:08:45-07:00";"https://itunes.apple.com/us/review?id=787203434&type=Purple%20Software";"787203434";8;"en";"POSITIVE"
217;1202200829;"FrankFlorida";"https://itunes.apple.com/us/reviews/id179586012";"2.2";1;"Useless bad";"I followed exactly the instruction but it did not work, took minutes to login and start, but showed that I had no devices, 2nd start the app froze complete, I gave up after 15 minutes of trying. On my PC it all is working well but this iPhone app is totally useless.";"2015-05-24T16:25:14-07:00";"https://itunes.apple.com/us/review?id=787203434&type=Purple%20Software";"787203434";52;"en";"NEGATIVE"
218;1290075820;"Mr. Joefield";"https://itunes.apple.com/us/reviews/id114133558";"2.2";2;"Wish it was better!";"Apps works sometime, temps are shown as Celsius but the numbers are actually Fahrenheit.  Also a little slow to process commands even when home on the same network..";"2015-11-22T03:32:58-07:00";"https://itunes.apple.com/us/review?id=787203434&type=Purple%20Software";"787203434";28;"en";"NEUTRAL"
219;1108469407;"ncraigg";"https://itunes.apple.com/us/reviews/id110996951";"2.1.3";1;"Unresponsive";"It's not often that I take the time to write a review.  I only bother if the app is really good, or really bad.  This one is really bad.  Something simple like flipping on a light right many, many attempts.  The slider just doesn't respond. Spend the $5.99 on HomeWave.  It does exactly what I ask it to, every time.";"2014-12-05T15:49:35-07:00";"https://itunes.apple.com/us/review?id=787203434&type=Purple%20Software";"787203434";60;"en";"NEGATIVE"
