"";"id";"userName";"userUrl";"version";"score";"title";"text";"updated";"url";"app";"wordCount";"language";"sentiment"
74;1465723066;"Meh367864";"https://itunes.apple.com/us/reviews/id159801185";"2.5.1";1;"Waste of money";"If you bought it for the music sync, like I did, prepare to be disappointed. First of all, it only works with songs downloaded to your device--no streaming. Secondly, the music sync feature is more annoying than interesting. It has poor bpm detection and you can't customize how it responds to music. You have to pick from a few equally crappy presets.";"2016-10-12T18:37:51-07:00";"https://itunes.apple.com/us/review?id=805898839&type=Purple%20Software";"805898839";62;"en";"NEGATIVE"
75;997715701;"KaySaRe";"https://itunes.apple.com/us/reviews/id333252642";"1.1";2;"Doesn't sync";"It isn't syncing with my three light bulb. I tried one at a time. I am using an ipad I just purchased last year. I am so excited to finally receive the lights but am sad after waiting so long they aren't working. My bluetooth is on and the light is powered up. Please fix and I will update rating. Thank you.";"2014-05-23T18:18:49-07:00";"https://itunes.apple.com/us/review?id=805898839&type=Purple%20Software";"805898839";62;"en";"POSITIVE"
76;1250581558;"Amitkudtarkar";"https://itunes.apple.com/us/reviews/id340552841";"2.1";5;"Awesome stuff";"This new version of the app has a pretty handy shake feature so I can just shake my phone for on/off. They also added some cool themes for the music sync and it looks pretty sweet!";"2015-08-30T00:11:09-07:00";"https://itunes.apple.com/us/review?id=805898839&type=Purple%20Software";"805898839";36;"en";"POSITIVE"
77;1299242938;"Muzuklvr";"https://itunes.apple.com/us/reviews/id108834640";"2.3.1";3;"Great bulb, but…";"The quality of the bulb is great and the ability to color correct is fantastic! The app however, needs help. Bulbs come in and out of connectivity and control is very inconsistent. Hoping the next version of the app and firmware improve the overall experience.";"2015-12-11T15:55:48-07:00";"https://itunes.apple.com/us/review?id=805898839&type=Purple%20Software";"805898839";45;"en";"POSITIVE"
78;1494113345;"Allspice1";"https://itunes.apple.com/us/reviews/id446086467";"2.5.1";1;"App is very out of date";"I just bought these yesterday and the lights themselves are wonderful, but the app to control them hasn't even been updated for iPhone 6 screens yet...
The app is also designed rather poorly and is difficult to use. Not worth the money for the bulbs if the only way to control them is through this horrible app";"2016-12-01T08:06:33-07:00";"https://itunes.apple.com/us/review?id=805898839&type=Purple%20Software";"805898839";57;"en";"NEGATIVE"
79;1251325363;"Yuvalp";"https://itunes.apple.com/us/reviews/id43395077";"2.1";5;"Great product";"Ilumi is really well done. Simple, easy to use and very powerful. I have 2 installed in my bedroom in one group and it's very fun to use.

The smaller one is bright enough for regular bedroom.";"2015-08-31T13:07:08-07:00";"https://itunes.apple.com/us/review?id=805898839&type=Purple%20Software";"805898839";37;"en";"POSITIVE"
80;1529812052;"Ericc123";"https://itunes.apple.com/us/reviews/id134984504";"2.5.1";2;"The light bulbs are NOT as advertised";"Their ad clearly shows the torch light feature and data features yet the bulbs and app aren't capable of doing them. Ilumi's response was they are making their advertised features their top priority for future updates.";"2017-01-24T17:10:56-07:00";"https://itunes.apple.com/us/review?id=805898839&type=Purple%20Software";"805898839";36;"en";"POSITIVE"
81;1187552721;"JoeyChronik";"https://itunes.apple.com/us/reviews/id276976656";"1.9";1;"App is still bad, bulb is still finnicky";"Today I downloaded the new firmware update and app update. It is becoming the norm now that when I update I lose functionality. 
I can no longer turn my bulb off, I had to literally unplug my light fixture. 

I was excited to see the torch experience added to the app, a feature promised since launch and advertised on ilumi's website, but it is unintuitive and also doesn't work... I didn't even bother with the other two. 

I can't recommend this product to anyone unfortunately. The light itself is really cool and the colors are great, but it means nothing if I can't control it.";"2015-04-24T18:14:15-07:00";"https://itunes.apple.com/us/review?id=805898839&type=Purple%20Software";"805898839";105;"en";"POSITIVE"
82;1341637093;"Add me! quynh1128";"https://itunes.apple.com/us/reviews/id121044697";"2.4";1;"This APP";"The light bulb is great. The app? Terrible! Ill shake my phone and the light bulbs wont turn on! If the lights are on and i shake to turn them off, they wont turn off!!!! I have to close and reopen the app in order to actually get the app to work with the lights. Some of the schedules dont even work sometimes. The app is frustrating and hard to navigate and use. Terrible.";"2016-03-02T09:51:33-07:00";"https://itunes.apple.com/us/review?id=805898839&type=Purple%20Software";"805898839";74;"en";"NEGATIVE"
83;1259078106;"Omerta1988";"https://itunes.apple.com/us/reviews/id470390774";"2.1.1";5;"Outstanding";"Ilumi lighting bulb is so far best thing I've tried. It's really awesome and app is magic. I'm looking forward for next version (hope I'll be beta tester) 😄";"2015-09-17T23:54:08-07:00";"https://itunes.apple.com/us/review?id=805898839&type=Purple%20Software";"805898839";29;"en";"POSITIVE"
84;1355100688;"Misc_user_name";"https://itunes.apple.com/us/reviews/id22377726";"2.5.1";5;"Outdated app but effective";"Love the lights. App is still pretty outdated but this updated helps. Been using their beta for their new app and it's got a much better UI.";"2016-03-28T15:55:13-07:00";"https://itunes.apple.com/us/review?id=805898839&type=Purple%20Software";"805898839";27;"en";"POSITIVE"
85;1515546922;"Failburdy";"https://itunes.apple.com/us/reviews/id144346137";"2.5.1";4;"Few issues";"Im not updating to the new one, my ilumi had errors but i reset it and no problems. I only have one to control though :0";"2017-01-04T19:29:40-07:00";"https://itunes.apple.com/us/review?id=805898839&type=Purple%20Software";"805898839";26;"en";"POSITIVE"
86;1336123152;"SubParSauce";"https://itunes.apple.com/us/reviews/id493228846";"2.4";1;"A great light bulb😀...";"...if you like overpriced LED bulbs with a broken app system then you my friend are in luck. The Ilumi smart(I guess)bulb comes with a phone app that is more broke than Kanye West.  

My favorite part was showing my roommates how I could possibly justify buying such an expensive lightbulb and seeing them rolling on the floor, gasping for breath from laughing so hard at the broken app, thanks Ilumi!";"2016-02-20T14:29:26-07:00";"https://itunes.apple.com/us/review?id=805898839&type=Purple%20Software";"805898839";71;"en";"POSITIVE"
87;1472955431;"Ron 309";"https://itunes.apple.com/us/reviews/id218965628";"2.5.1";3;"Was good.";"Was working beautifully on my iPhone 6S plus. Bought an iPhone 7 Plus. Now I cannot get it to work at all. So not sure.  
Don't like the way the music has to be downloaded on order for it to work.";"2016-10-25T16:51:36-07:00";"https://itunes.apple.com/us/review?id=805898839&type=Purple%20Software";"805898839";41;"en";"POSITIVE"
88;1294089496;"Zixxer10r";"https://itunes.apple.com/us/reviews/id43441537";"2.3.1";1;"Ya know if I could just ...";"...leave the house and return to having control of my lights...that would be great. 

You got a lot of work to do to appease your Kickstarter supporters who helped fund your business. I hope this new app you're teasing to be released in the ""winter"" includes stability and connection protocols because as of right now, I have $50 paperweights.";"2015-11-30T17:39:03-07:00";"https://itunes.apple.com/us/review?id=805898839&type=Purple%20Software";"805898839";59;"en";"POSITIVE"
89;1074279474;"PandreaG";"https://itunes.apple.com/us/reviews/id173873111";"1.5";5;"Great lights!";"There are a few bugs ( ie glitches) every once in a while, but overall these are the best light bulbs I've ever  owned! I love the dance party function.";"2014-10-03T05:08:28-07:00";"https://itunes.apple.com/us/review?id=805898839&type=Purple%20Software";"805898839";30;"en";"POSITIVE"
90;1522147881;"Zhcatt";"https://itunes.apple.com/us/reviews/id139528956";"2.5.1";1;"Disappointing";"My first one was easy quick set up, so I ordered 2 more. These just won't connect and the help solution is quite involved. It requires resetting too much on my phone. My phone is updated and just fine. The problem is not my phone. Also, the new app doesn't work for me at all.";"2017-01-14T10:55:58-07:00";"https://itunes.apple.com/us/review?id=805898839&type=Purple%20Software";"805898839";55;"en";"POSITIVE"
91;1173332516;"Mya2346798654";"https://itunes.apple.com/us/reviews/id375566861";"1.8";5;"LOVE IT";"Very helpful for when I go to bed and I don't want to get up to turn the light off😂. Anyway It works perfectly, I love all the colors.";"2015-03-25T19:03:46-07:00";"https://itunes.apple.com/us/review?id=805898839&type=Purple%20Software";"805898839";29;"en";"POSITIVE"
92;1298388188;"clepard";"https://itunes.apple.com/us/reviews/id37764513";"2.3.1";1;"Oh my dear";"These things are bloody awful. I can't find a setting that is pleasing to the eye, even if I do, good luck getting them to save the settings. The app is not at all intuitive and doesn't appear to save anything even after suggesting it has. About once a week I need to reset and a re-add each bulb individually (all 10).";"2015-12-09T18:49:39-07:00";"https://itunes.apple.com/us/review?id=805898839&type=Purple%20Software";"805898839";62;"en";"POSITIVE"
93;1371439409;"chris_howard_91";"https://itunes.apple.com/us/reviews/id43054581";"2.5.1";2;"One month in and...";"When I first bought this light bulb, it was discovered that a new revamped app would be made available in April. However, that's simply not the case anymore, not if it is already May. I have waited for a month. I love this smart bulb. Where's app 2.0?";"2016-04-30T15:36:09-07:00";"https://itunes.apple.com/us/review?id=805898839&type=Purple%20Software";"805898839";48;"en";"POSITIVE"
94;1325692014;"JDawgy72";"https://itunes.apple.com/us/reviews/id203818295";"2.3.1";2;"App needs a lot of refinement";"Truly hard to evaluate the bulb hardware due to the app being clunky to use. Though without a solid controlling app, the bulbs aren't worth much. The manufacturer should hire a solid software developer with a proven track-record.";"2016-01-31T11:46:27-07:00";"https://itunes.apple.com/us/review?id=805898839&type=Purple%20Software";"805898839";38;"en";"POSITIVE"
95;1414940601;"Ssssshobhitgupta";"https://itunes.apple.com/us/reviews/id515238952";"2.5.1";5;"Smart Led outdoor bulb with Bluetooth";"Its so cool with great variation of colors!!! I really recommend this to turn not only your house but also patio into a romantic night into a party!!! 
This is awesome!!!";"2016-07-18T16:32:16-07:00";"https://itunes.apple.com/us/review?id=805898839&type=Purple%20Software";"805898839";31;"en";"POSITIVE"
96;1379285978;"Snazzyberry";"https://itunes.apple.com/us/reviews/id187284190";"2.5.1";1;"Thomas Edison !";"Would Mr Edison be happy with this App ? All I want to do is have my ilumi bulb on random outside with a glass of wine !!! But No, I need an App degree to work this. Life is hard enough without a Light bulb trying to bring me down. It's a Bulb people ! Just give me a simple on or off & Random. Now my bulb is stuck on Red ! No I'm not a pimp.... Please change your App for this old soul.";"2016-05-15T17:50:49-07:00";"https://itunes.apple.com/us/review?id=805898839&type=Purple%20Software";"805898839";87;"en";"NEGATIVE"
97;1342266980;"maysunbloo";"https://itunes.apple.com/us/reviews/id257928602";"2.4";4;"Nice";"app is great
cant wait for the cool makeover
i hope that it comes with a widget extention for quick access to turn on n turn off the light";"2016-03-03T16:06:36-07:00";"https://itunes.apple.com/us/review?id=805898839&type=Purple%20Software";"805898839";29;"en";"POSITIVE"
98;1040099097;"HAHAHACOOLER";"https://itunes.apple.com/us/reviews/id218310003";"1.3";5;"BEST LIGHTS EVER";"this is the best lighting system
LED lights u could ever buy its so cool and amazing change the mood to whatever color your feeling the color is amazing!!! and its just really cool";"2014-08-03T11:53:39-07:00";"https://itunes.apple.com/us/review?id=805898839&type=Purple%20Software";"805898839";34;"en";"POSITIVE"
99;1339713799;"Miotch!";"https://itunes.apple.com/us/reviews/id34034789";"2.4";1;"Beware of the firmware update";"Unlike others, I had a pleasant experience with my units until I applied a firmware update. Now I have $120 worth of paperweights :( these lights have a terrible UI, and aren't practical for daily use. If I were the people in charge of programming these, I wouldn't be able to sleep.";"2016-02-27T15:09:35-07:00";"https://itunes.apple.com/us/review?id=805898839&type=Purple%20Software";"805898839";52;"en";"NEGATIVE"
100;1294067794;"rsaeks";"https://itunes.apple.com/us/reviews/id14068197";"2.3.1";2;"Crash prone";"Having a lot of issues with the app where it crashes every time the phone display turns off when it is the active app. Hoping the update this winter helps.";"2015-11-30T16:24:56-07:00";"https://itunes.apple.com/us/review?id=805898839&type=Purple%20Software";"805898839";30;"en";"POSITIVE"
101;1085805952;"Swanny4real";"https://itunes.apple.com/us/reviews/id321265803";"1.6";1;"Do not update";"This app crashes constantly and does not keep Bluetooth connection.  Very frustrating as this is otherwise a good product. Without a useful app to control just makes it another very expensive light bulb.  Please fix immediately!!!!";"2014-10-24T20:22:36-07:00";"https://itunes.apple.com/us/review?id=805898839&type=Purple%20Software";"805898839";36;"en";"NEGATIVE"
102;1322822280;"zackie";"https://itunes.apple.com/us/reviews/id28163688";"2.3.1";2;"Stopped using the bulbs until app is updated.";"The UX of the app is really problematic. The bulbs are built well but are almost unusable with the app in its current state. I am hoping this will be fixed in the update.";"2016-01-26T10:26:24-07:00";"https://itunes.apple.com/us/review?id=805898839&type=Purple%20Software";"805898839";34;"en";"POSITIVE"
103;1048925913;"Einfll";"https://itunes.apple.com/us/reviews/id105948253";"1.4";4;"Good start";"The connection process is easy and the app works well.  Looking forward to what will come.";"2014-08-18T08:24:22-07:00";"https://itunes.apple.com/us/review?id=805898839&type=Purple%20Software";"805898839";16;"en";"POSITIVE"
104;1296294490;"Obvslyurnotagolfer";"https://itunes.apple.com/us/reviews/id131848838";"2.3.1";1;"App embarrassment";"The people at Ilumi ought to be embarrassed about this app. It's utterly useless. 

Between my wife and I we can never connect to the bulbs, and when it seems like I'm actually connected I am unable turn them off or on. We've resorted back to using the normal light switch, awesome.";"2015-12-05T07:55:08-07:00";"https://itunes.apple.com/us/review?id=805898839&type=Purple%20Software";"805898839";52;"en";"POSITIVE"
105;1294408386;"johelpadilla";"https://itunes.apple.com/us/reviews/id41998335";"2.3.1";5;"Light converted to Fun";"Very smooth functionality, very impressive with it. I liked so much.";"2015-12-01T09:52:42-07:00";"https://itunes.apple.com/us/review?id=805898839&type=Purple%20Software";"805898839";11;"en";"POSITIVE"
106;1382580336;"Pplpp pplpp";"https://itunes.apple.com/us/reviews/id377471869";"2.5.1";3;"PLEASE MAKE BETTER";"other apps have pull down widgets and you guys need it too! Also re design the app!!! It looks like my son could make it. Otherwise great product!";"2016-05-22T10:52:25-07:00";"https://itunes.apple.com/us/review?id=805898839&type=Purple%20Software";"805898839";28;"en";"POSITIVE"
107;1531869310;"Breanaspapi";"https://itunes.apple.com/us/reviews/id70042878";"2.5.2";1;"Get rid of the load screen!";"Would be nice to open the app and control my lights but every single time you open the app you get to see ""The New Ilumi App"" screen until you dismiss it. It's been ""new"" for weeks now. Go.  Away.  Screen.";"2017-01-27T14:53:15-07:00";"https://itunes.apple.com/us/review?id=805898839&type=Purple%20Software";"805898839";41;"en";"POSITIVE"
108;1494189625;"Gingersnap3396";"https://itunes.apple.com/us/reviews/id30377026";"2.5.1";1;"Terrible App and Product";"The new app and the old app won't connect to my bulb. I've tried all methods of troubleshooting and nothing works. I'd review the features of the app if I could get it to connect. I won't be buying anymore bulbs from this company.";"2016-12-01T11:53:47-07:00";"https://itunes.apple.com/us/review?id=805898839&type=Purple%20Software";"805898839";44;"en";"POSITIVE"
109;1209144554;"Jaymal10";"https://itunes.apple.com/us/reviews/id101229349";"1.9";4;"Adding Apple watch";"If you could add a apple watch light on and off function it would be awesome.";"2015-06-08T11:33:53-07:00";"https://itunes.apple.com/us/review?id=805898839&type=Purple%20Software";"805898839";16;"en";"POSITIVE"
110;1531156033;"Christopher4620";"https://itunes.apple.com/us/reviews/id132881006";"2.5.2";1;"Disappointed...";"Really love my bulbs, but this app is making you guys look bad. If I have to be opening and closing, resetting, and clicking a bunch of time for something to work, I might as well just get up and turn on my light.";"2017-01-26T13:14:26-07:00";"https://itunes.apple.com/us/review?id=805898839&type=Purple%20Software";"805898839";44;"en";"NEGATIVE"
111;1253092754;"Ca$h Is King";"https://itunes.apple.com/us/reviews/id41088650";"2.1";1;"Awful!";"You buy a $100 Bluetooth lightbulb and then find out the app doesn't work, turning your lightbulb into just a standard white fluorescent.

I bought this to be used at our professional haunted house because I loved the ability to control and pace with music.

Unfortunately the app crashes every time it's used. If you 'kill' it because it fails, you can't reopen it unless you delete and redownload!

What a tremendous waste of my money!";"2015-09-04T11:08:55-07:00";"https://itunes.apple.com/us/review?id=805898839&type=Purple%20Software";"805898839";76;"en";"NEGATIVE"
112;1340349632;"DrBaritone";"https://itunes.apple.com/us/reviews/id35042427";"2.4";1;"Crappy confusing app and not enough options.";"App always shuts down for no reason. No easy options for random changes and programming to keep it interesting. I'll probably take the bulb back.";"2016-02-28T19:20:52-07:00";"https://itunes.apple.com/us/review?id=805898839&type=Purple%20Software";"805898839";25;"en";"NEUTRAL"
113;1367821064;"Mr.Burns @";"https://itunes.apple.com/us/reviews/id41020677";"2.5.1";2;"Update😞";"Red now looks orange after the latest update. Not happy with change in tint in several colors. Please fix or go back to old color scheme.";"2016-04-23T16:31:36-07:00";"https://itunes.apple.com/us/review?id=805898839&type=Purple%20Software";"805898839";26;"en";"NEGATIVE"
114;1294664215;"LucasB33";"https://itunes.apple.com/us/reviews/id132782840";"2.3.1";1;"Terrible app";"First they make the initial buyers wait two months longer than promised. Then they don't even have an updated app to go with it. This app is terrible. The music sync is a joke. It just flashes the light regardless of the beat of the music.";"2015-12-02T00:10:18-07:00";"https://itunes.apple.com/us/review?id=805898839&type=Purple%20Software";"805898839";46;"en";"POSITIVE"
115;1342867522;"iJohnnyQ.";"https://itunes.apple.com/us/reviews/id334606847";"2.4";4;"Most Kool";"Had no problems installing. Very user friendly app and just plain cool. I like it. It like having a swinging shin dig!";"2016-03-04T19:13:47-07:00";"https://itunes.apple.com/us/review?id=805898839&type=Purple%20Software";"805898839";22;"en";"POSITIVE"
116;1288038500;"A.Haghi";"https://itunes.apple.com/us/reviews/id114621694";"2.3.1";4;"Many ways to improve";"Please make ilumi HomeKit capable so we can use Siri to turn it on/off.";"2015-11-17T15:47:24-07:00";"https://itunes.apple.com/us/review?id=805898839&type=Purple%20Software";"805898839";14;"en";"POSITIVE"
117;1530890835;"Sccss4evr";"https://itunes.apple.com/us/reviews/id538527634";"2.5.2";1;"Latest ""update"" fail";"They just ""updated"" the older app and now it doesn't detect any of my ilumi bulbs. The newer app never could detect them so I had to use the old one. Now I don't have any app to control the bulbs. Get me an app that works for god's sake.";"2017-01-26T04:40:43-07:00";"https://itunes.apple.com/us/review?id=805898839&type=Purple%20Software";"805898839";50;"en";"NEUTRAL"
118;1254505991;"Isabelle Riddles";"https://itunes.apple.com/us/reviews/id162122296";"2.1";1;"glitch";"when i first got the app it worked fine but right when i closed it, it just stopped working. PLEASE FIX THE GLITCHES!! If it wasnt for all the glitches i would give it five starts but because of how bad they are i give it one.";"2015-09-07T12:35:25-07:00";"https://itunes.apple.com/us/review?id=805898839&type=Purple%20Software";"805898839";47;"en";"NEGATIVE"
119;1121358888;"voc627";"https://itunes.apple.com/us/reviews/id428968052";"1.8";2;"Unstable";"Needs various bugs to be ironed out. Even more important; it needs support for multiple music applications such as Pandora and Google Play Music.";"2014-12-29T13:41:52-07:00";"https://itunes.apple.com/us/review?id=805898839&type=Purple%20Software";"805898839";24;"en";"POSITIVE"
120;1257207678;"hooshwha";"https://itunes.apple.com/us/reviews/id37860400";"2.1.1";2;"Works about 10% of the time";"The UI is spotty too, features buried, no network troubleshooting. Not worth the time to keep fighting it. I'm out.";"2015-09-13T18:17:42-07:00";"https://itunes.apple.com/us/review?id=805898839&type=Purple%20Software";"805898839";20;"en";"NEGATIVE"
121;1254719574;"Anirudh777";"https://itunes.apple.com/us/reviews/id215644732";"2.1";1;"Worthless. POJ";"Trust the other reviews on here, he positive reviews must me incentivized. Worthless for pice of junk for $100. Waste of time and energy. Will be returning it tomorrow!!! I will also call the corporate office of this store to spare others of the agony. 
Do your homework this is pure junk.";"2015-09-08T01:35:46-07:00";"https://itunes.apple.com/us/review?id=805898839&type=Purple%20Software";"805898839";52;"en";"POSITIVE"
122;1379603196;"Mahyar mahyar";"https://itunes.apple.com/us/reviews/id361643338";"2.5.1";1;"Good bulb and app but buggy";"The recent updates have broken every single feature besides manually turning it on and off. Almost useless now.";"2016-05-16T08:52:49-07:00";"https://itunes.apple.com/us/review?id=805898839&type=Purple%20Software";"805898839";18;"en";"NEGATIVE"
123;1178002539;"Debbien98";"https://itunes.apple.com/us/reviews/id32694175";"1.8";1;"Great concept, too aggravating to use";"This light has become the bane of my existence.  Nothing works easily or right on it. Wish I had never wasted my money.  A lot of work to do on this still.";"2015-04-04T18:20:11-07:00";"https://itunes.apple.com/us/review?id=805898839&type=Purple%20Software";"805898839";32;"en";"POSITIVE"
124;1532166208;"SnowmanT";"https://itunes.apple.com/us/reviews/id24140921";"2.5.2";1;"Return your bulbs before it's too late";"I've been a user since they first hit the market thanks to a geek friend.

I will not ever suggest anyone buy one. Buy a Hue from GE, or any competitive product really.

This last update has rendered the app useless while the 'new app' can't connect to my bulbs.

Great, now I'm stuck with two light bulbs that cost $80 a piece and I can only use them as if they came from IKEA.";"2017-01-28T02:23:32-07:00";"https://itunes.apple.com/us/review?id=805898839&type=Purple%20Software";"805898839";75;"en";"POSITIVE"
125;1408603326;"Jettison04";"https://itunes.apple.com/us/reviews/id128466208";"2.5.1";1;"Trash";"I have tried two bulbs and many different sockets and the result is that the lights are pieces of junk. Manual reset if the bulbs does not work. This is a joke and should be reported to the BBB but I've wasted enough time on this.";"2016-07-09T15:32:12-07:00";"https://itunes.apple.com/us/review?id=805898839&type=Purple%20Software";"805898839";46;"en";"NEGATIVE"
126;1365452604;"DavidCada";"https://itunes.apple.com/us/reviews/id33921529";"2.5.1";1;"App almost never works";"The first version of this app was better than it is now.  Ilumi doesn't appear, scenes don't work correctly and can't even reset bulbs to troubleshoot.  Terrible!!";"2016-04-18T16:00:41-07:00";"https://itunes.apple.com/us/review?id=805898839&type=Purple%20Software";"805898839";27;"en";"POSITIVE"
127;1107951832;"thecatdad";"https://itunes.apple.com/us/reviews/id31211275";"1.8";1;"Well, that was a waste...";"Got the bulbs, downloaded the app. Screwed them in and got a green and then red light and then nothing. Tried bulb two, got a white light and nothing. They don't even turn on, won't pair. Nothing. Fix?";"2014-12-04T14:20:18-07:00";"https://itunes.apple.com/us/review?id=805898839&type=Purple%20Software";"805898839";38;"en";"NEGATIVE"
128;1263816848;"curlybill57";"https://itunes.apple.com/us/reviews/id87439174";"2.2.1";1;"Latest version is junk";"My illumi app worked perfectly until a recent update. All my custom settings were lost and it won't connect to the bulbs. PLEASE FIX THIS!!";"2015-09-27T19:10:50-07:00";"https://itunes.apple.com/us/review?id=805898839&type=Purple%20Software";"805898839";25;"en";"POSITIVE"
129;1050030988;"Xxxxruff";"https://itunes.apple.com/us/reviews/id27190263";"1.4";1;"Won't work anymore";"I updated and now it doesn't work anymore! Please let me use the previous version as I had no problems.";"2014-08-20T06:18:55-07:00";"https://itunes.apple.com/us/review?id=805898839&type=Purple%20Software";"805898839";20;"en";"POSITIVE"
