"";"id";"userName";"userUrl";"version";"score";"title";"text";"updated";"url";"app";"wordCount";"language";"sentiment"
37;1050331440;"pproav";"https://itunes.apple.com/us/reviews/id17154126";"1.4";2;"Not ready for prime time";"I waited six months for my Ilumi after production delays- ok, That happens sometimes. Now  I have my bulb, But the app is not ready. I could not register on my device, and ended up having to register on my desktop and then return to my device. Now the app keeps crashing.  I have the recommended device, with the recommended OS , But the app has issues. I am really hoping that an app update will correct this. But it definitely seems that this was pushed hard to market Before it was really ready.";"2014-08-20T19:13:19-07:00";"https://itunes.apple.com/us/review?id=805898839&type=Purple%20Software";"805898839";94;"en";"POSITIVE"
38;1345973370;"joeythagreat";"https://itunes.apple.com/us/reviews/id8954623";"2.5";1;"It's ""lights out"" for ilumi";"The design of the bulb is nothing short of amazing .. It has beautiful colors .. Easy install and it's a conversation starter for sure ..... Until they ask ""how does it work?"" I am EMBARASSED to show them the app because it constantly crashes; not user friendly and HORRIBLE!!!! I feel like this company just said ""screw it we got on shark tank and we are going to make a ton of money lets just do D+ work on this app and reap the benefits"". You people should be ashamed of yourselves . How smart are you to create such a unique lightbulb and change the game of energy efficient lighting , but dumber than a box of rocks to create an app for it ?? If there was an option for NEGATIVE stars I would give it .... This is one expensive lightbulb !! Goodbye ilumi and hello PHILLIPS HUE";"2016-03-10T19:29:44-07:00";"https://itunes.apple.com/us/review?id=805898839&type=Purple%20Software";"805898839";152;"en";"NEGATIVE"
39;1383541070;"Lenny the Lightbulb";"https://itunes.apple.com/us/reviews/id167123812";"2.5.1";1;"Just Awful";"I write this review mostly to encourage the company to finally release its new app (which was promised last week) or at least provide transparency as to why it's still unavailable after myriad delays.

As previous reviews have indicated, the current app is a clunky, barely-functional mess that unreliably completes its most basic, essential task: turning the lights on and off. 90% of attempts to do so end with only some of the bulbs responding, requiring multiple retries to achieve the desired result. Bulbs regularly lose connection when turned on and off at the switch, prompting a laborious repairing process.

The other ""experiences"" are somewhat-to-mostly broken. The ""Circadian"" setting functions correctly until the final hour when it gets mysteriously brighter. The ""Rise & Shine"" feature ceased to work after a recent firmware update. I've never reliably been able to use the ""Music Sync"" or ""Torch"" modes.

It's a start up and probably a very small team, but if they want to compete against the big boys in this space (Philips, LIFX, etc.), they need to try harder.";"2016-05-24T12:45:50-07:00";"https://itunes.apple.com/us/review?id=805898839&type=Purple%20Software";"805898839";177;"en";"POSITIVE"
40;1130515220;"mgbellaire";"https://itunes.apple.com/us/reviews/id257374413";"1.8";3;"Buggy, but has potential";"The developers did a pretty good job of making sure MVP (Minimum Viable Product) features are available and can be used. I've used every feature of the app, and they work together with the bulbs just fine. The only bugs I've found are with connectivity, and that may be Apple's fault for the bulbs being unable to remain connected after the app is not in focus on my phone.

All together, I think they did a *good enough* job at their first pass. Some design improvements and improved connectivity would make this a much better app. Keep it up guys!";"2015-01-15T13:18:56-07:00";"https://itunes.apple.com/us/review?id=805898839&type=Purple%20Software";"805898839";100;"en";"POSITIVE"
41;1397397269;"To being or";"https://itunes.apple.com/us/reviews/id290068354";"2.5.1";1;"Ilimi review";"This product does not follow instructions when I'm using the app. In addition, the shake feature is useless because it's so sensitive you can't use your phone without affecting the bulb.  I certainly like the idea of this product. When I was using only one bulb it seemed to work OK. After I installed the fifth bulb four of the previously installed bulbs began being disobedient to the instructions I'm giving it on the app.  One of the bulbs will turn off but then it turns back on again of its own accord. Other bulbs will not turn off or be the color I am requesting. I hope you fix all the stuff because I would like to have a bulb that works the way it supposed to. It's a nice idea.";"2016-06-20T00:42:39-07:00";"https://itunes.apple.com/us/review?id=805898839&type=Purple%20Software";"805898839";132;"en";"POSITIVE"
42;1533839536;"Droid, no more!";"https://itunes.apple.com/us/reviews/id207932271";"2.5.2";1;"Is there less than one star";"New update lost 3d touch function on iPhone, and now or takes forever to even open the app. The music sync won't load my music, and I often open the app to see all of my ilumi missing. Not sure what happened, but this is a joke..
I purchased my first ilumi from their kickstarter and I can honestly say the app has gotten worse.  Worse still is the fact that great improvements like 3d touch (iOS only), all on, and user sharing features only worked for a short time.  I had not updated the app until this week because I purchased more bulbs. Big mistake!  Wish I would have stick with a bulb that works with nest.";"2017-01-30T16:26:19-07:00";"https://itunes.apple.com/us/review?id=805898839&type=Purple%20Software";"805898839";118;"en";"POSITIVE"
43;1391632700;"Kyle2310";"https://itunes.apple.com/us/reviews/id34647124";"2.5.1";1;"App said it would be fully available in May";"New app was promised to solve all my problems. Sounded too good to be true and it was. All their marketing in stores already shows the new app. The website up until recently said the app was coming in May. Now it's changed to say beta testing. Had to contact support again. They finally offered up giving me access to the beta, but only since I was a backer on Kickstarter. Told me they sent info about it in March. So, I guess sorry to people that bought the light with false advertising showing the new app already ready and available? Since you're not backers, you can't have what you bought fair and square!";"2016-06-09T09:56:14-07:00";"https://itunes.apple.com/us/review?id=805898839&type=Purple%20Software";"805898839";114;"en";"POSITIVE"
44;1300323948;"kieranmi";"https://itunes.apple.com/us/reviews/id20724448";"2.3.1";5;"Excellent bulb, fantastic customer support";"I had used the original Ilumi bulb for over a year when my new Ilumi was delivered via Kickstarter. The new bulb is a huge improvement on the old one, the warm white light looks just like an incandescent bulb. The app is the weakest part of the Ilumi story, it's functional but basic. I hear a new app is in the works, and I'm looking forward to trying it out - but until then I'm very happy with my Ilumi, and their customer support is first rate.";"2015-12-13T20:03:11-07:00";"https://itunes.apple.com/us/review?id=805898839&type=Purple%20Software";"805898839";88;"en";"POSITIVE"
45;1412955623;"Nick294882761894003873";"https://itunes.apple.com/us/reviews/id23703520";"2.5.1";1;"Features do not work...";"Buy Phillips hue lights. Save the trouble. The bulbs do alright in theory, but do not function as advertised. The music function only allows me to play 2 of my 1,000+ songs, the ""rise and shine"" schedule feature simply does not work, and also the ""torch"" feature where you supposedly are able to come close and they turn on and walk away to turn off doesn't work. My lights never turn off. Even after tinkering with the range and walking significant distance away. Basically all these bulbs did for me was change colors when I wanted them to and turn on and off. If that is all you are looking for, by all means.";"2016-07-15T22:09:20-07:00";"https://itunes.apple.com/us/review?id=805898839&type=Purple%20Software";"805898839";114;"en";"POSITIVE"
46;1331093832;"Deathor918472";"https://itunes.apple.com/us/reviews/id487265545";"2.4";1;"Frustrating";"This isn't compatible with HomeKit so Siri can't control the lights. 3D Touch to turn the lights on and off quickly doesn't work at all. Torch isn't reliable. The light will come on and off randomly when ""experiences"" are turned on. So I've turned off all of the features that I bought this bulb for, and now use it like any other lightbulb, occasionally opening the app to dim the light in the evening. Very disappointed. I was told by customer service that they were working on an update to the app to fix these things and add functionality for Siri to work, but I don't think that will ever happen, as that was 3 months ago. 🙁";"2016-02-10T18:51:54-07:00";"https://itunes.apple.com/us/review?id=805898839&type=Purple%20Software";"805898839";118;"en";"NEGATIVE"
47;1389737195;"Dr.Drewjm";"https://itunes.apple.com/us/reviews/id133675385";"2.5.1";4;"Don't know what everyone is talking about?";"I have read numerous bad reviews about these lights and the app used to control them. So far with my experience, it has been nothing but pleasurable! There are some minor annoyances with the app but not bad enough to make me regret purchasing them. Being able to turn my light off with out having to get out of bed is worth it in itself. That and the light alarm are my favorite features. Look forward to more!";"2016-06-05T22:12:37-07:00";"https://itunes.apple.com/us/review?id=805898839&type=Purple%20Software";"805898839";78;"en";"NEGATIVE"
48;1381229146;"LydiaBishop";"https://itunes.apple.com/us/reviews/id266808519";"2.5.1";4;"Smooth color shift";"I love everything about this bulb. I havent had a single issue with the settings or connectivity. The app is straight forward and easy to use. I really just hope that the bulbs app will get a feature that creates a smooth color shift setting. The demo in the store had the colors slowly changing to show variety of hue so i assumed the app would have that function as well. Please add a color reel feature!!!";"2016-05-19T21:12:01-07:00";"https://itunes.apple.com/us/review?id=805898839&type=Purple%20Software";"805898839";77;"en";"POSITIVE"
49;1056332461;"K. Patrick";"https://itunes.apple.com/us/reviews/id27471269";"1.5";4;"Good App, but looking forward to improvements!";"The App to control the bulbs is great, but I am sure there will be some improvements made… especially with additional experiences, as right now there are only two.  Also, it would be nice if it was not so easy to change the lighting scenes.  I’ve sent some feedback for these requests.  Keep up the great work and much success.  I am planning to buy more bulbs in the future.";"2014-08-30T12:13:56-07:00";"https://itunes.apple.com/us/review?id=805898839&type=Purple%20Software";"805898839";70;"en";"POSITIVE"
50;1291792665;"Terismi";"https://itunes.apple.com/us/reviews/id138883043";"2.3.1";2;"Slightly more reliable than magic";"This app needs a lot of work. I am constantly losing and replacing illumis in the app. Whether the app actually works and operates the illumis or whether the experiences come on and all illumis chosen actually participate seem to be factors set by unknown gods. It's great when it does work. Also would love it if circadian could be set for sleep wake cycles as well as actual daylight hours for those of us who do shift work";"2015-11-25T22:57:58-07:00";"https://itunes.apple.com/us/review?id=805898839&type=Purple%20Software";"805898839";79;"en";"POSITIVE"
51;1379788369;"bojo34";"https://itunes.apple.com/us/reviews/id161838657";"2.5.1";3;"It's good has its problems";"I just bought it a little bit ago and for the most part it's works great, but the only problem is with the music sync, it only allows me to use my purchased music, I use Apple Music and have many of my favorite artist downloaded but it won't allow me to listen to them, instead I am stuck listening to music that my younger, more annoying self listened to which is not why I bought this bulb";"2016-05-16T19:41:29-07:00";"https://itunes.apple.com/us/review?id=805898839&type=Purple%20Software";"805898839";78;"en";"NEGATIVE"
52;1337809332;"Heymarlin";"https://itunes.apple.com/us/reviews/id311181379";"2.4";1;"Cant Imagine how bad the  previous version was";"My first experience with Ilumi. Absolutely mind  boggling and frustratting. Like others have stated, I  can no longer pair my bulbs with the app. Every time i’ve turned these  bulbs on, there’s a problem, and its not the same problem each time. It changes, sometimes several times a day. This app is  worthless. The bulbs display some beautiful light, but how helpful is that when the app doesn’t do anything. Great job guys!! Now take this crap back and refund my $$ so i can buy some philips hue bulbs, They have an app that actually works!!";"2016-02-23T22:38:59-07:00";"https://itunes.apple.com/us/review?id=805898839&type=Purple%20Software";"805898839";97;"en";"POSITIVE"
53;1196456193;"StinkySlinky";"https://itunes.apple.com/us/reviews/id41439406";"1.9";4;"Nice Update!";"Really enjoying the update. Torch is super convenient and I use Circadian cycle by default now-- I rarely use my own scenes. I would agree with other comments about the musical lights function-- lights need to pulsate to music not to an arbitrary default tempo, otherwise what's the point?

I think the app can use a fresher/iOS-esque UI though; Feels and looks very outdated. Would have been 5-star rating otherwise.";"2015-05-12T17:25:11-07:00";"https://itunes.apple.com/us/review?id=805898839&type=Purple%20Software";"805898839";70;"en";"POSITIVE"
54;1416681927;"FreeCyber";"https://itunes.apple.com/us/reviews/id17240371";"2.5.1";1;"Failed to deliver";"The app is much less functional than the previous version. While they offer directions to migrate bulbs from the old app to the new one, it did not work for me. 
Still no integration with Smart Home products or Echo despite promises that they would be included with this version.  
The one bulb I did add to this new interface is very difficult to control properly. 
Seriously considering dumping the whole lot and going with another smart bulb that actually delivers what they are promising.";"2016-07-21T03:27:20-07:00";"https://itunes.apple.com/us/review?id=805898839&type=Purple%20Software";"805898839";85;"en";"NEGATIVE"
55;1299670122;"cmschwartz59";"https://itunes.apple.com/us/reviews/id30134018";"2.3.1";1;"Worst app ever";"I created an account on the ileum website so I could control the lights from both our phones but I cannot login to the app. I keep getting “invalid login credentials.” The user interface of this app is a joke. It takes me a good twenty minutes to try to set up a simple scene. Oh, and when you have to change the clocks, the app is too dumb to recognize that so the lights turn on at the old time. I have deleted the app and repaired the lights so many times I am thinking of going back to regular analog timers.";"2015-12-12T12:02:19-07:00";"https://itunes.apple.com/us/review?id=805898839&type=Purple%20Software";"805898839";103;"en";"POSITIVE"
56;1531973911;"Tinderterrible";"https://itunes.apple.com/us/reviews/id30856028";"2.5.2";4;"So far so good";"I see a lot of negative reviews on all ilumi apps but personally I haven't had any issues- works just as advertised and there is no interruption or interference with the Bluetooth connection... the app is a little clunky and could be arranged better but other than that I am so far happy with this bulb";"2017-01-27T19:21:36-07:00";"https://itunes.apple.com/us/review?id=805898839&type=Purple%20Software";"805898839";56;"en";"POSITIVE"
57;1295867301;"J@DC";"https://itunes.apple.com/us/reviews/id16513535";"2.3.1";1;"Terrible App and missing many features";"I use the Hue system at my house and love it, so wanted a smart lighting setup for my office at work. IT did not want me to connect the Hue system on the network so I went with Ilumi because it works on Bluetooth.

The lights themselves are fine, but the number of features and ease of use of the app is laughable. Unless you absolutely need lights controlled by Bluetooth there are many many better smart light options out there (and many for a lower price).";"2015-12-04T13:33:36-07:00";"https://itunes.apple.com/us/review?id=805898839&type=Purple%20Software";"805898839";88;"en";"POSITIVE"
58;1295458840;"Jraptor2000";"https://itunes.apple.com/us/reviews/id207914879";"2.3.1";2;"Great bulb, app needs work";"Waited a long time for this bulb and finally got it, packaging and bulb quality seem great. The app leaves much to be desired. Wish music sync was better. Seems almost as if it is just set at a fixed bpm of random light flashes depending on the mode you choose. The music sync feature was the sole reason I purchased this lamp.";"2015-12-03T17:59:31-07:00";"https://itunes.apple.com/us/review?id=805898839&type=Purple%20Software";"805898839";63;"en";"POSITIVE"
59;1001578878;"Katbd";"https://itunes.apple.com/us/reviews/id33906624";"1.2";5;"Just wonderful!";"This is the most amazing system. I was so excited to receive my bulb in the mail. Controlling the ilumi bulb is easy with this app and it is simply awesome. There are so many colors to choose from! I must buy more. As an artist you can tell my excitement.";"2014-05-30T14:06:54-07:00";"https://itunes.apple.com/us/review?id=805898839&type=Purple%20Software";"805898839";51;"en";"POSITIVE"
60;1188881654;"@nipples";"https://itunes.apple.com/us/reviews/id209104073";"1.9";4;"Turn on and off bulb 4 times to reset";"I like the new update, the torch feature is very cool and now I don't have to reach across my bed to turn off my lamp when I go to class. would still like to see more features like mood lighting that slowly changes colors";"2015-04-27T08:49:38-07:00";"https://itunes.apple.com/us/review?id=805898839&type=Purple%20Software";"805898839";45;"en";"POSITIVE"
61;1039319663;"Shooter 9";"https://itunes.apple.com/us/reviews/id49010942";"1.3";4;"Nice";"My lights finally arrived and they are great. With two I was able to completely transform my tv room.

I hope future upgrades allow for syncing with streaming music or even better user the mic of the phone so you can have your home stereo sync to the lights.";"2014-08-02T05:37:35-07:00";"https://itunes.apple.com/us/review?id=805898839&type=Purple%20Software";"805898839";49;"en";"POSITIVE"
62;1249940264;"PupToy";"https://itunes.apple.com/us/reviews/id37660782";"2.1";5;"Great product, so many configurations";"The products does exactly what they say it will. Highly configurable and lots of useful features. Works in most any fixture. Looking forward to the new style of bulbs too. Help/support is awesome and timely as well.";"2015-08-28T16:05:30-07:00";"https://itunes.apple.com/us/review?id=805898839&type=Purple%20Software";"805898839";37;"en";"POSITIVE"
63;1472076730;"Primpimono";"https://itunes.apple.com/us/reviews/id24642896";"2.5.1";1;"Promises but doesn't deliver";"App is always buggy. Have to press scene settings 10+ times for the bulbs to respond. You look like an idiot fumbling with your phone while sitting in the dark when you should really just use the light switch like sane people. 

They keep promising Alexa integration, but still can't deliver. But I have a feeling when they finally have it, it will be just as buggy and frustrating as this app. 

Save your money and go with a competing light. This one only causes frustration.

Updated to lower to one star. If you've already purchased Ilumi, I feel really bad for you. They haven't updated for months and it continually loses Bluetooth connection with iOS 10 and iPhone 7.";"2016-10-23T23:09:15-07:00";"https://itunes.apple.com/us/review?id=805898839&type=Purple%20Software";"805898839";120;"en";"NEGATIVE"
64;1293564664;"sharbeens";"https://itunes.apple.com/us/reviews/id113792775";"2.3.1";1;"A great bulb with let down by its key element (this app)";"If your aim is to sell this bulb it needs quality that is expected seeing the ilumi box and the bulb. But nothing close to expectation is brought to me the very moment I use this app. I've read version 3.0 is going to have a major change in the UI.
But if this was your first app turned out to be I'm hesitant about version 3.0

As for the bulb I would recommend it as long as the
App holds a promise for the future.";"2015-11-29T13:02:50-07:00";"https://itunes.apple.com/us/review?id=805898839&type=Purple%20Software";"805898839";86;"en";"POSITIVE"
65;1446731009;"";"https://itunes.apple.com/us/reviews/id85397217";"2.5.1";1;"So sick of people launching things that don't work!!";"I bought these lights so I could set a schedule because I am out of town a lot and I wanted to have my lights turn on at night when I'm gone. When I touch anything regarding a schedule on this glitched out asshat of an app it crashes. Keep trying guys.... Then maybe AFTER you figure out what you are doing you can charge 150+dollars for 2 frkn light bulbs!!!!!!! Seriously????";"2016-09-08T21:31:37-07:00";"https://itunes.apple.com/us/review?id=805898839&type=Purple%20Software";"805898839";72;"en";"NEGATIVE"
66;1358227162;"June87p";"https://itunes.apple.com/us/reviews/id365789025";"2.5.1";3;"Ok app but.....";"If this app had the option to place a on/off switch in my today section when I scroll down I would rate it 5 stars. I rather have that option then the faulty shake option that is a hit and miss when it comes to working properly.";"2016-04-03T19:11:48-07:00";"https://itunes.apple.com/us/review?id=805898839&type=Purple%20Software";"805898839";47;"en";"NEGATIVE"
67;1072011005;"Craig-dallas2436";"https://itunes.apple.com/us/reviews/id15844119";"1.5";5;"Outstanding";"Outstanding product; outstanding experience. Soft light at night to send you towards sleep and a warm glow in the morning to ease into the waking hours. Very easy to install and to control.";"2014-09-28T19:25:33-07:00";"https://itunes.apple.com/us/review?id=805898839&type=Purple%20Software";"805898839";33;"en";"POSITIVE"
68;1532628157;"Artation";"https://itunes.apple.com/us/reviews/id156283620";"2.5.2";1;"Now on lockdown?";"So the latest update locks the app at a splash screen that directs the user to the new app, which is INFERIOR and has all the best functionality missing? Really, ilumi? Please, at least give those of us who backed you on Kickstarter the option to continue to use the product in the way it was advertised, rather than removing features that were the major selling points for no reason!";"2017-01-28T19:16:57-07:00";"https://itunes.apple.com/us/review?id=805898839&type=Purple%20Software";"805898839";70;"en";"POSITIVE"
69;1411395850;"Dr. X'r";"https://itunes.apple.com/us/reviews/id404796500";"2.5.1";5;"Good interface! Not sure why other ratings are like that.";"Good interface! Not sure why other ratings are like that. It works very smooth, very responsive.";"2016-07-13T20:27:14-07:00";"https://itunes.apple.com/us/review?id=805898839&type=Purple%20Software";"805898839";16;"en";"POSITIVE"
70;1305748726;"Pen Names";"https://itunes.apple.com/us/reviews/id19802727";"2.3.1";1;"Horrible — Don’t Buy";"The bulbs may or may not be any good.  But you’ll never know because the app that controls them is terrible.  Non-functioning, terrible navigation, no context, just doesn’t work.  Here’s a suggestion: buy a regular LED light bulb and when you want it to be blue hold your breath until it is. Sure, you’ll wind up on the floor, but it will still be a better experience than using this app to try to do it.";"2015-12-24T20:10:52-07:00";"https://itunes.apple.com/us/review?id=805898839&type=Purple%20Software";"805898839";76;"en";"NEGATIVE"
71;1292519291;"Curlyhairzelda";"https://itunes.apple.com/us/reviews/id244129857";"2.3.1";3;"Love the light bulbs but........";"This app is not easy or intuitive to use. For example, I wanted to set up a timer. It took me two nights to finally get it right. Why scenes and experiences? How about straight forward on/off, timer, I'm home, ...........???? I've recommended the light bulbs to friends but have told them the app needs help.";"2015-11-27T13:25:07-07:00";"https://itunes.apple.com/us/review?id=805898839&type=Purple%20Software";"805898839";56;"en";"POSITIVE"
72;1298408257;"CarreraGT13";"https://itunes.apple.com/us/reviews/id253163512";"2.3.1";4;"Apple Music Issue";"The app works well except for the music sync. It lets you sync songs you have purchased from the iTunes Store, but not songs added to playlists or downloaded from Apple Music. Please fix this!";"2015-12-09T19:56:05-07:00";"https://itunes.apple.com/us/review?id=805898839&type=Purple%20Software";"805898839";35;"en";"POSITIVE"
73;997117178;"MTNclimber 2014";"https://itunes.apple.com/us/reviews/id208697325";"1.1";5;"Awesome interface!";"Saw this on shark tank. Awesome product that transforms any living space into an atmospheric delight. Bulbs are a little pricey up front but should last a decade or so. App is user friendly and definitely recommend it.";"2014-05-22T14:29:12-07:00";"https://itunes.apple.com/us/review?id=805898839&type=Purple%20Software";"805898839";38;"en";"POSITIVE"
