"";"id";"userName";"userUrl";"version";"score";"title";"text";"updated";"url";"app";"wordCount";"language";"sentiment"
130;1341318971;"RBW Desk iMac";"https://itunes.apple.com/us/reviews/id40232359";"2.4";1;"Terrible";"This app is overdue for a major rework refresh.  It barely turns the lights on let alone provides any kind of creative use or control.  The colors are great the app, not so much.";"2016-03-01T19:30:25-07:00";"https://itunes.apple.com/us/review?id=805898839&type=Purple%20Software";"805898839";34;"en";"POSITIVE"
131;1267384549;"Yahoo Monkey";"https://itunes.apple.com/us/reviews/id43073800";"2.2.1";1;"100% crash on firmware update";"Every time I select update, the app crashes. I have an iPhone 6s. Never had this problem on previous versions.";"2015-10-05T08:31:16-07:00";"https://itunes.apple.com/us/review?id=805898839&type=Purple%20Software";"805898839";20;"en";"NEGATIVE"
132;1306276826;"Brandont72";"https://itunes.apple.com/us/reviews/id450720803";"2.3.1";2;"Illumi app problems.";"The lights would be great, if their was an actual working app for it. Just fix the app so people can enjoy their bulb, please.";"2015-12-25T21:43:49-07:00";"https://itunes.apple.com/us/review?id=805898839&type=Purple%20Software";"805898839";25;"en";"POSITIVE"
133;1537295890;"RickOnEarth";"https://itunes.apple.com/us/reviews/id42126140";"2.5.2";1;"HUGE SCAM";"This product doesn't work. It won't even connect. Read past reviews. So many people with the same issues";"2017-02-04T14:29:08-07:00";"https://itunes.apple.com/us/review?id=805898839&type=Purple%20Software";"805898839";18;"en";"NEUTRAL"
134;1365990956;"Kidcorbin";"https://itunes.apple.com/us/reviews/id234437579";"2.5.1";1;"App doesn't work anymore";"I can't even connect to my bulb I'm always turning it off manually. They really need to hurry up with that new app";"2016-04-19T22:20:35-07:00";"https://itunes.apple.com/us/review?id=805898839&type=Purple%20Software";"805898839";23;"en";"NEUTRAL"
135;1219904831;"Mdwcap";"https://itunes.apple.com/us/reviews/id140608901";"1.9";1;"Bad design good bulb";"Why can't you program the light to come on at the same setting each time.  It is so bright and blue it defeats the whole purpose of programming a light for the evening.";"2015-06-29T21:34:34-07:00";"https://itunes.apple.com/us/review?id=805898839&type=Purple%20Software";"805898839";33;"en";"POSITIVE"
136;1235635869;"Stevette609";"https://itunes.apple.com/us/reviews/id213206825";"1.9";1;"So far no good";"Confusing so just bright white light except when it's turned on and it shows what can do but doesn't.";"2015-07-30T16:23:26-07:00";"https://itunes.apple.com/us/review?id=805898839&type=Purple%20Software";"805898839";19;"en";"POSITIVE"
137;1517215377;"JChristoff";"https://itunes.apple.com/us/reviews/id3091610";"2.5.1";1;"App Won't Connect";"App will not connect to my current bulbs. Tried deleting and re downloading the app twice. App needs work.";"2017-01-07T06:45:52-07:00";"https://itunes.apple.com/us/review?id=805898839&type=Purple%20Software";"805898839";19;"en";"NEUTRAL"
138;1382619240;"DJ LGFRESH";"https://itunes.apple.com/us/reviews/id42136619";"2.5.1";3;"Wheres the new update?";"I remember they were updating the app in April it's now late May....";"2016-05-22T13:00:33-07:00";"https://itunes.apple.com/us/review?id=805898839&type=Purple%20Software";"805898839";13;"en";"NEUTRAL"
139;1086987644;"deman22";"https://itunes.apple.com/us/reviews/id40800327";"1.6";1;"Junk";"Not only do they have false advertising, but this is the biggest waste of money in the world! It does not work!!";"2014-10-26T21:30:47-07:00";"https://itunes.apple.com/us/review?id=805898839&type=Purple%20Software";"805898839";22;"en";"NEGATIVE"
141;1272666619;"J29127";"https://itunes.apple.com/us/reviews/id259087037";"2.2.1";1;"With new update cannot connect";"Previous sw version worked new update cannot connect";"2015-10-16T12:28:54-07:00";"https://itunes.apple.com/us/review?id=805898839&type=Purple%20Software";"805898839";8;"en";"NEUTRAL"
142;1367918076;"gotexaslonghorns";"https://itunes.apple.com/us/reviews/id28941242";"2.5.1";1;"Terrible still";"Keeps crashing. Music sync is terrible. App keeps crashing.";"2016-04-23T21:07:11-07:00";"https://itunes.apple.com/us/review?id=805898839&type=Purple%20Software";"805898839";9;"en";"NEGATIVE"
143;1338736903;"Tomasz Mlynarski";"https://itunes.apple.com/us/reviews/id204253176";"2.4";1;"Bad";"By far the worse app I ever had to use. Nothing works right. Waste of money, buy a different brand.";"2016-02-25T19:04:48-07:00";"https://itunes.apple.com/us/review?id=805898839&type=Purple%20Software";"805898839";20;"en";"NEGATIVE"
144;1053507875;"Djcuefew";"https://itunes.apple.com/us/reviews/id365127320";"1.4";1;"Light never turns off";"After turning switch to 'off' the light dims to green. It never fully turns off";"2014-08-25T19:24:13-07:00";"https://itunes.apple.com/us/review?id=805898839&type=Purple%20Software";"805898839";15;"en";"NEUTRAL"
145;1337764572;"Cgc3027";"https://itunes.apple.com/us/reviews/id187908140";"2.4";1;"Don't even buy the bulb";"App crashes, features do not work right, and it's like I just spent $70 for a normal lightbulb.";"2016-02-23T20:13:36-07:00";"https://itunes.apple.com/us/review?id=805898839&type=Purple%20Software";"805898839";18;"en";"POSITIVE"
146;1279301825;"Crimson gator";"https://itunes.apple.com/us/reviews/id291336095";"2.2.1";1;"Stinks";"Constantly will not sync with my two bulbs. Frustrating to no end.";"2015-10-29T23:07:35-07:00";"https://itunes.apple.com/us/review?id=805898839&type=Purple%20Software";"805898839";12;"en";"NEGATIVE"
147;1357929510;"D0420C";"https://itunes.apple.com/us/reviews/id400163446";"2.5.1";4;"🙃😒🤔";"Percentage for dimness.
More options for 'EVERYTHING'

#AlsoRandomCrashing 
#ReceivedBulbYesterday";"2016-04-03T05:46:09-07:00";"https://itunes.apple.com/us/review?id=805898839&type=Purple%20Software";"805898839";9;"en";"NEUTRAL"
148;1273825020;"V714";"https://itunes.apple.com/us/reviews/id154826023";"2.2.1";1;"The worst app ever";"I will return the light bulb because of this app so expensive and it doesn't work like spect totally garbage..";"2015-10-18T18:04:39-07:00";"https://itunes.apple.com/us/review?id=805898839&type=Purple%20Software";"805898839";20;"en";"NEGATIVE"
149;1252064205;"Davopavo";"https://itunes.apple.com/us/reviews/id173202283";"2.1";1;"Zero f'ing stars!!";"Don't buy a super expensive piece of crap ilumi bulb. The app doesn't even OPEN a second time. I want my money back";"2015-09-02T05:59:25-07:00";"https://itunes.apple.com/us/review?id=805898839&type=Purple%20Software";"805898839";23;"en";"NEGATIVE"
150;1322159019;"jodyash";"https://itunes.apple.com/us/reviews/id9399164";"2.3.1";2;"Crummy app";"I have to re-install it every 4-5 days.";"2016-01-25T05:09:29-07:00";"https://itunes.apple.com/us/review?id=805898839&type=Purple%20Software";"805898839";8;"en";"NEUTRAL"
151;1405632346;"Senican";"https://itunes.apple.com/us/reviews/id453941854";"2.5.1";2;"False adverting.";"This app does not support Schedule time setup as stated on the box.";"2016-07-04T21:16:36-07:00";"https://itunes.apple.com/us/review?id=805898839&type=Purple%20Software";"805898839";13;"en";"NEGATIVE"
152;1404540399;"Dann123";"https://itunes.apple.com/us/reviews/id36637501";"2.5.1";1;"Terrible";"Won't transfer old bulb data and unreliable.";"2016-07-03T00:15:46-07:00";"https://itunes.apple.com/us/review?id=805898839&type=Purple%20Software";"805898839";7;"en";"NEUTRAL"
153;1299757865;"Merango";"https://itunes.apple.com/us/reviews/id10112172";"2.3.1";5;"Gorgeous colors from bulb!!! Unmatched, period!";"I purchased two of the second-generation bulbs; one Edison, and one par, and after attempting to download the app on my iPad-even though it's an iPhone only app - I was very discouraged to read that everyone has had so much trouble with the app that I changed my mind and decided to return the bulbs.  Plus, I couldn't get the app to work on my iPad Air 2 at all and it just said a new app is coming.

Suddenly I remembered why I purchased the bulbs in the first place, which was because of the display, and the display didn't have an app.  So for the heck of it, I decided to try the Edison bulb.  I then downloaded the app on my iPhone 6plus.

Yes, the app is extremely rudimentary, but a couple years ago the app would've been considered awesome as hell.  So I decided to be patient.  Immediately the bulb connected to the app. I didn't have to do any sort of search or anything.

The colors of blue are marvelous!!! I can't find any bulb on the market that emits this color of blue!!! 

Then I started using the app to change the colors, and I found yellows and oranges that I've never found on other bulbs on the market either - this includes the Hue bulbs.  

I work in the film industry, and these bulbs are just exquisite, and I can see a vast use for them on film sets. Hear that iLumi?!?  Yes, read my email to ya'll!

The bulb is heavy and well-built, and I'm hoping that it will last a very long time. So if you really like a vast array of colors, you will love this bulb. There's no doubt in my mind. You just have to fiddle around with the app to get the color you want, but you will get the color that you want!  That's what's amazing about this bulb.  I actually matched the bulb color of blue to the color of blue on my wall, and I absolutely couldn't believe it. Color correcting a bulb to match the color on the wall? That's really unheard of.

So before you change your mind about getting this bulb because of the app, try the bulb first. Play with the colors. I haven't tried any other feature on the app, but at this point I don't need to. I'm already crazy about this bulb, and if a new app is ever developed, then that will just be a bonus.";"2015-12-12T16:53:47-07:00";"https://itunes.apple.com/us/review?id=805898839&type=Purple%20Software";"805898839";421;"en";"POSITIVE"
154;1103059752;"Fireryan";"https://itunes.apple.com/us/reviews/id20217120";"1.8";1;"Uggg";"Turned my $80 lightbulb into a $3. 

Still waiting on call back from support";"2014-11-25T10:10:48-07:00";"https://itunes.apple.com/us/review?id=805898839&type=Purple%20Software";"805898839";14;"en";"POSITIVE"
155;1245352706;"Trage56";"https://itunes.apple.com/us/reviews/id37535688";"2.0";1;"Stopped working";"I can't connect to my bulb anymore.";"2015-08-19T02:23:10-07:00";"https://itunes.apple.com/us/review?id=805898839&type=Purple%20Software";"805898839";7;"en";"NEUTRAL"
156;1365602855;"Chadleit";"https://itunes.apple.com/us/reviews/id493535931";"2.5.1";2;"Buggy & low budget app";"Love the functionality of the bulb and what it's capable of. I personally own 7, but the app makes them feel almost worthless. Now with the music feature, awesome idea but lacks the major support of LARGE third-party apps like Spotify and Pandora. Next is the overall performance of the app, I've noticed that sometimes the bulbs fail to communicate with what I'm trying to control within the app. For example, when I swipe all off, only five bulbs will turn off in my bathroom and bedroom. You just have to swipe again to turn them all on again, then hope that when you swipe all off again, they will actually all turn off. It's inconveniences like these that make the Philips HUE bulb worth the extra penny for a more worthy app that contains less bugs AND more functionality. Hope to see an update soon!";"2016-04-19T01:00:17-07:00";"https://itunes.apple.com/us/review?id=805898839&type=Purple%20Software";"805898839";146;"en";"POSITIVE"
157;1303731115;"danthemanbaker";"https://itunes.apple.com/us/reviews/id223574517";"2.3.1";4;"A bright review";"Unlike other reviewers, I have had a nearly flawless experience with the app. I purchased 14 bulbs from ilumi's most recent Kickstarter campaign. They all synced up immediately without difficulty.
    I struggled at first with the interface of the app but quickly found solutions after reading ilumi's FAQ page and doing some quick google searching. For example: initially, whenever I turned my light switch off and back on again some of the bulbs on that circuit would revert back to a different color than what they were just on. I thought this was a problem with the hardware or software, but I found out how to set a ""default"" color for each bulb. In playing with my settings when I first got my bulbs, I had unknowingly set different defaults for many bulbs. Fixing the default colors fixed my headaches. 
    Pros:
    I use the sunrise feature as an alarm and it works great. 
    Scenes work very well and I can immediately change the mood of my whole house by pushing one preset. 
     I contacted customer service when I increased the number of bulbs on my order, they were extremely fast in replying and very helpful.
     Lights are easily grouped and renaming bulbs makes it easy to maintain specific control.
     Showing them off is fun, I made my whole family jealous.
    Cons:
     Sometimes bulbs can be sluggish to sync when changing multiple bulbs at once.
     Music app is difficult to figure out, I have trouble selecting a specific song to play,and making a playlist is seemingly not possible now. (Although it looks freaking cool when it does work)
     Bulbs do not dim on a dimmer switch. 100% power is needed for their connectivity, they are only dimmable from the app. (Luckily I knew this before I ordered them, otherwise it would have been a big letdown)

Despite these cons I highly recommend the bulbs and this app to control them. I believe a new, updated app is in the works as they mentioned in their Kickstarter campaign.";"2015-12-20T20:53:35-07:00";"https://itunes.apple.com/us/review?id=805898839&type=Purple%20Software";"805898839";336;"en";"POSITIVE"
158;1530674765;"MashaT22";"https://itunes.apple.com/us/reviews/id44047985";"2.5.1";1;"Discontinuing?!";"I am awarding 1-star because I don't agree that this first app should be pulled from the App Store. I find it odd that this original ilumi app is being discontinued being that the newer app has major issues with connectivity, stability, UI, and the overall UX. When you look at all of the recent reviews for the newer app, it becomes clear that there's a widespread problem that is not sporadic. This app has had its problems as well, but at least its been generally possible to control the bulbs and set timers most of the time. The new app is completely useless to mostly everyone, but at least this one somewhat works -- not ideal, but somewhat is better than useless. I don't think it's the right time to force people to a completely non-functioning app when this one still works enough for many people to keep using their bulbs in some fashion via an app.

I think it would help if ilumi would start a user beta testing group. Oftentimes it's difficult to identify hardware and/or software problems outside of a company's building without having real world use-cases from which to obtain data, bug reports, general feedback, etc. Perhaps some experienced beta testers, under more realistic conditions (i.e. your customer's homes, offices, etc.), can provide crucial feedback that the team evidently needs to develop the app your ilumi supporters clearly deserve. I personally have 19 years of hardware/software beta experience and would happily volunteer to help test via TestFlight (or a similar iOS beta platform), and I'm sure others would do the same if you were to ask. I backed your most recent campaign for the light strips and happened to inherit the standard bulbs brand new in the boxes from my brother (who backed the first campaign) when he decided to adopt another bulb platform while waiting to receive his ilumi rewards. There are lots of people who believe in this company and want to help, so please consider it everyone's thoughts.

Personally, I think it makes sense to scrap the newer app that's apparently unusable, leave this old app alone for now albeit its limits, and then start working on developing a totally brand new app from scratch. Your hardware is quite nice, but us early adopters are sadly not getting our money's worth with all these app issues. It's such a shame that your app development doesn't seem to be working out. Whatever the issues, please explain the details more clearly via Kickstarter updates and know that we still support you -- but it's getting difficult for many people to stay patient when the product just hasn't been working because of several failed app development attempts (I'm admittedly far too patient, lol). If I can help with beta testing or anything else, please send me a DM on Twitter (@MashaT22) or a private message through Kickstarter.";"2017-01-25T21:53:26-07:00";"https://itunes.apple.com/us/review?id=805898839&type=Purple%20Software";"805898839";482;"en";"POSITIVE"
160;1340286677;"ButtaBabyy";"https://itunes.apple.com/us/reviews/id155025242";"2.4";1;"Blah😒";"App doesn't sync and keeps crashing.";"2016-02-28T15:57:20-07:00";"https://itunes.apple.com/us/review?id=805898839&type=Purple%20Software";"805898839";6;"en";"NEUTRAL"
162;1298365044;"brentanhorn";"https://itunes.apple.com/us/reviews/id29584585";"2.3.1";1;"Nice Hardware Abysmal Software";"Software update please!! My house is haunted with possessed ""smart bulbs.""";"2015-12-09T17:25:08-07:00";"https://itunes.apple.com/us/review?id=805898839&type=Purple%20Software";"805898839";11;"en";"POSITIVE"
163;1278853035;"glindner";"https://itunes.apple.com/us/reviews/id39189193";"2.2.1";1;"Embarrassing";"How can the hardware be SO good and the software be SO terrible?!?";"2015-10-29T01:48:16-07:00";"https://itunes.apple.com/us/review?id=805898839&type=Purple%20Software";"805898839";13;"en";"NEGATIVE"
165;1252838480;"ebayby";"https://itunes.apple.com/us/reviews/id287119922";"2.1";1;"junk!";"won't work on iphone 6.";"2015-09-03T22:50:18-07:00";"https://itunes.apple.com/us/review?id=805898839&type=Purple%20Software";"805898839";5;"en";"NEUTRAL"
166;3469788371;"Hashasaur";"https://itunes.apple.com/us/reviews/id131139928";"2.5.3";1;"For those who’s app keep on crashing, read this!";"You need to update the bulb’s firmware. If the new ilumi app doesn’t detect your bulb, you definitely need to update the bulb’s firmware. The iPhone app keeps crashing but if you have an Android, use that app. Use the app with same icon as this on android. Update the firmware with android, make sure to disconnect it from the Android. Then download the new ilumi app on your iPhone and try to connect. It worked for me. 

Still giving 1 star because of the trouble. 

Before edit: Can’t even update firmware.. app closes within few seconds. If it asks you to enable location, ALWAYS PRESS NO. Your data are being sold to others, for advertisement purposes.";"2018-11-28T04:44:31-07:00";"https://itunes.apple.com/us/review?id=805898839&type=Purple%20Software";"805898839";117;"en";"POSITIVE"
167;3317175794;"captfalc0";"https://itunes.apple.com/us/reviews/id922498323";"2.5.3";1;"Does NOT work on iPhone";"App does NOT work on iPhone, love the ilumi lightbulb. It's super bright and long lasting (4yrs now). But the app crashes constantly if you're using an iPhone. Works great on android lol.";"2018-10-18T15:46:48-07:00";"https://itunes.apple.com/us/review?id=805898839&type=Purple%20Software";"805898839";33;"en";"POSITIVE"
168;2989797847;"kcastillojr";"https://itunes.apple.com/us/reviews/id40711660";"2.5.3";1;"Garbage";"Easily the worst app on my device. Gives notifications of firmware updates and crashes every 15 seconds. Since my lights cannot receive the updates I’m left with lights that I have no control over, some flash randomly, some go yellow, others white. Launch app-crash. I’ve tried every piece of advice given that I can find. Pretty much a waste of 140.00. 

Garbage.";"2018-07-29T20:51:09-07:00";"https://itunes.apple.com/us/review?id=805898839&type=Purple%20Software";"805898839";62;"en";"NEGATIVE"
169;2518517250;"brittani1284";"https://itunes.apple.com/us/reviews/id649689664";"2.5.3";1;"What is wrong with this app????";"I just downloaded the app for my new bulb I just bought at Best Buy and have already decided I’m taking it back tomorrow. Every time I open the app it says that there is a firmware update, so I click yes to update but then it says it can’t connect, when I did finally get it to connect it started downloading and then just kicked me out  in the middle of the update!!! Now every time I reopen the app it only gives me a few seconds before it kicks me out again!!!! I am so disappointed and mad right now, guess I will just go with the Phillips Hue, I didn’t want to have to purchase the hub so I went with the Llumi, but I’m pretty sure purchasing the Hub is well worth it if it cancels out all this crap!!!";"2018-05-07T20:37:02-07:00";"https://itunes.apple.com/us/review?id=805898839&type=Purple%20Software";"805898839";144;"en";"NEGATIVE"
170;1531703063;"JumiUser";"https://itunes.apple.com/us/reviews/id155914702";"2.4";3;"DO NOT UPDATE";"The latest update on 1/25/2017 makes the app useless. It no longer connects to the light bulb. Fix it!";"2017-01-27T07:46:45-07:00";"https://itunes.apple.com/us/review?id=805898839&type=Purple%20Software";"805898839";19;"en";"NEGATIVE"
171;1499710338;"Liquidthunder";"https://itunes.apple.com/us/reviews/id8170256";"2.5.1";1;"App no longer works and what possesed they to release a new app with the same name as the old one?";"How stupid can they be? Both the ""New"" app and the old App have the same name. The new app is completey worthless also. Support for the new app tells you to run the old app for some features, well, neither app works at all! What a shame. I spent $50.00 on a worthless bulb. Mark Cuban,I want my money back. Best Buy, I want my money back.";"2016-12-10T20:05:01-07:00";"https://itunes.apple.com/us/review?id=805898839&type=Purple%20Software";"805898839";68;"en";"NEGATIVE"
172;1418329136;"simu_ro";"https://itunes.apple.com/us/reviews/id13748567";"2.5.1";1;"STILL HUGE PROBLEM WITH THIS VERSION ALSO!";"My review for the previous version unfortunately its not changed.😡
Please fix this guys a.s.a.p.

""I'll come with a ⭐️⭐️⭐️⭐️⭐️ review as soon as you guys gonna fix the huge bug this latest version have which is the fact that now the app it's useless for me. I use an iPhone 6S Plus, up to date firmware and I am using:
ilumi ML3001W PAR30 Color Tunable LED Smartbulb, Large, Arctic White for which I paid $106.24 from Amazon with taxes included on February 2015
but the problem is that the app simply won't connect to the bulb anymore and my account lost all the previous custom settings that I had.
Please fix this a.s.a.p. ""thank you.""
P.S. Thankfully the bulb remained at the color and intensity that I like for my bedroom but other than that it's just like all the other bulbs since I can't connect the app to it and gotta use the wall switch to turn it ON and OFF.
I lost the count of the updates you guys did and same huge problem. grrrrr😡 Do you even read the whole reviews? Coz the $$ I'm pretty sure you got them all!!!";"2016-07-23T05:48:51-07:00";"https://itunes.apple.com/us/review?id=805898839&type=Purple%20Software";"805898839";195;"en";"POSITIVE"
173;1390791311;"GHOSTSINTOKYO";"https://itunes.apple.com/us/reviews/id85875563";"2.5.1";5;"Love ilumi!";"So I was able to connect my ilumi right away. I was having fun changing the colors in my room. I love that you can dim the light.
The app has plenty of options to choose from. So many colors! 

Now as for music sync. Can you please allow us to sync our music from services like Spotify or Pandora? 

I don't have any music saved on my iPhone. It's the only reason I purchased the bulb was for that music beat feature. Please take this into consideration! :)";"2016-06-07T23:00:16-07:00";"https://itunes.apple.com/us/review?id=805898839&type=Purple%20Software";"805898839";89;"en";"POSITIVE"
174;1371541340;"Cboone84";"https://itunes.apple.com/us/reviews/id122259441";"2.5.1";4;"New app!!";"I really enjoy the bulbs and the the color that they produce.  The current app is inconsistent and buggy.  I have been waiting for the new app but it appears that it will not launch in April as ilumi has been saying.  The build also need  integration with HomeKit, Amazon echo, and smart things.  Once this happens, these bulbs will be amazing.";"2016-04-30T20:12:13-07:00";"https://itunes.apple.com/us/review?id=805898839&type=Purple%20Software";"805898839";62;"en";"POSITIVE"
175;1369108189;"Wigily";"https://itunes.apple.com/us/reviews/id195681209";"2.5.1";4;"Awesome room to grow.";"I love my Uluru bulb. I pirchased mine at Best Buy because I wanted to be able to return it but I've had it for a bout a week now and I love it. I can control my light from my phone and set different light colors from the touch of a button it's awesome. But there is some room for improvement. Just like other apps that have alarm features they tend not to work all the time. I got the sunrise effective to work once and it was nice. Also the Maurice feature would be much better if it actually went with the beat instead of going to a preset. That's my biggest complaint. But other than that the app works great.";"2016-04-26T05:58:15-07:00";"https://itunes.apple.com/us/review?id=805898839&type=Purple%20Software";"805898839";123;"en";"POSITIVE"
176;1345001024;"Luisag97";"https://itunes.apple.com/us/reviews/id373837278";"2.4";2;"Crashes";"Well it crashes while in music mode, which is the only way to strobe the lights, which is a bummer. Id like to be able to use Spotify or at least stream music from Apple Music. Please for the love of god make it strobe without attaching to music.";"2016-03-08T19:00:00-07:00";"https://itunes.apple.com/us/review?id=805898839&type=Purple%20Software";"805898839";49;"en";"POSITIVE"
