"";"id";"userName";"userUrl";"version";"score";"title";"text";"updated";"url";"app";"wordCount";"language";"sentiment"
0;2467560338;"Aeiou247";"https://itunes.apple.com/us/reviews/id147909556";"1.442.220";4;"Great looking and sounding products, but the app needs 1 thing";"I have the 5 in my bedroom and also two 3’s and the sub grouped as a 2.1 system in my garage and they all sound amazing!  I’ll admit I had my doubts at first to the spotty/connectivity issues I had. I decided to upgrade my WiFi network to a whole house Eero Pro 3 router system and haven’t had a problem since. As others have said, most if not all negative reviews probably stem from a poor WiFi network. It’s nice that you can hardwire the devices to completely eliminate that from ever being an issue. If there is one thing I could ask for though, it would be an easier access to the EQ and sub level settings while playing music. As recordings and sources vary, I find myself having to navigate excessive steps to make a minor adjustment to the sub level.  PLEASE add an independent sub level (for grouped devices like my 2.1 system) at the music page!";"2018-04-25T13:18:42-07:00";"https://itunes.apple.com/us/review?id=843129434&type=Purple%20Software";"843129434";162;"en";"POSITIVE"
1;1997098826;"Nitrodamus";"https://itunes.apple.com/us/reviews/id28067455";"1.430.180";1;"Heos App is horrible!!";"This is the worst music app ever.  I have two HEOS 1 Series 2 speakers with go packs that look and sound amazing when they work.  The problem is the app.  Everytime I use them I have to go into the app and find the devices and reconnect them to Bluetooth.  The app will  come up and say ""searching for devices"" but won't find them, even if I am standing right next to them until I do it multiple times.  Then I have to go back into Bluetooth and connect to the devices all over again.  If you then try linking the two devices to play together which they call ""pairing the devices"" it takes multiple tries as well.  I have to toggle back and forth between Bluetooth trying to connect and the HEOS app trying to pair until they finally work. This takes a minimum of 10 minutes and has to be done everytime you use them.  The app doesn't remember anything you have done before and the devices constantly lose Bluetooth connection.   The app is also very basic with no real features at all.
 I have had these for over a year praying for the day that Denon would try to save their reputation by updating this app with a new awesome version.   NOT!!  Very disappointed in Denon that they don't care enough to put a decent app out there to run an otherwise awesome product.  They look good, sound great and the go pack is phenomenal.  How could they package this together with such and archaid grade school level app?  Go figure?";"2017-12-14T18:02:44-07:00";"https://itunes.apple.com/us/review?id=843129434&type=Purple%20Software";"843129434";265;"en";"POSITIVE"
2;7953820899;"jbh2phd";"https://itunes.apple.com/us/reviews/id33951269";"2.1.562";3;"App has issues with Denon Home product line (in my case, a mixture of Home250 and Home350 speakers)";"Issue 1: poor user interface (UI). This looks like an app that development engineers hacked up to get the system working. UI organization is horrible with many redundancies and non-intuitive paths to what you want to accomplish. I can live with issue 1, but … Issue 2: some units will not upgrade firmware to latest version. They “think” they’re updated but they’re not. As a result, units have different firmware revisions, which breaks your ability to group speakers to, for example, get them all playing the same music.  After about 48 hours, the culprit speakers do update to latest firmware, but there’s no apparent way to control this other than leaving it up to the auto update feature and waiting until it does its thing in the background. 
Issue 3:  I’m sure it’s a big challenge to make the app interface well with all the music streaming services out there. The app doesn’t allow for search in Pandora, which is a major pain. The app also doesn’t show or give access to any content on my iPhone.";"2021-10-25T15:28:26-07:00";"https://itunes.apple.com/us/review?id=843129434&type=Purple%20Software";"843129434";177;"en";"POSITIVE"
3;3446870796;"geojunkie in OKC";"https://itunes.apple.com/us/reviews/id221473093";"1.481.130";5;"Heos in new Marantz AV preamp is fantastic";"I have been an audio and home theatre enthusiast for many decades.  We also have a wired whole house sound system. We added the streaming music source to it via a PC with a remote control PC app and streaming has become our main source. The problem is that using the remote app for the PC with security log ins and navigating the various music sources was really clunky and inconvenient.  I ended up being the only one who understood it well.  HEOS in the new Marantz home threatre preamp has changed everything for the better. The audio quality is far superior.  The variety and easy access to streaming sources is amazingly comprehensive. Control is super easy and intuitive.  Our local radio stations streaming feeds allow us to enjoy local programming with the same ease. The Home theatre sources are all available as well. My wife and children love being able to use it as well as I can. I can’t tell you how much of a game changer this has been.  We love HEOS.  Note: We do have strong WiFi everywhere.";"2018-11-22T03:57:34-07:00";"https://itunes.apple.com/us/review?id=843129434&type=Purple%20Software";"843129434";182;"en";"POSITIVE"
4;5493725695;"Rshide";"https://itunes.apple.com/us/reviews/id10791255";"1.544.150";5;"Wired Center Channel";"I have had this for about six months now and absolutely love it. I built a new house and spent allot of time researching what I would put in. My wife was insistent that we not have speaker enclosures visible so i needed to support in wall and in ceiling speakers. After some research I quickly discovered that heos was the only system that supported a wired center channel. I was nervous considering so many negative reviews of the app. After using it for six months I can honestly say I have no idea what the negative reviews are talkinG about. The app is intuitive. There are 3 steps 1) select what you are controlling, where you can easily combine zones to create a multi zone sync. 2) select your source, which can be any streaming service or any input on any of your physical devices and 3) control, volume, pause, skip. One thing that took a bit to find was how to expand the volume control so you can set individual zone volume. It is right under the master volume.";"2020-02-05T21:17:40-07:00";"https://itunes.apple.com/us/review?id=843129434&type=Purple%20Software";"843129434";181;"en";"POSITIVE"
5;4033664434;"WAEMario";"https://itunes.apple.com/us/reviews/id599103088";"1.505.130";1;"WORST...APP...EVER....IN THE HISTORY OF APPS";"Selected Denon over Sonos because the speakers have a lot of ways to connect music. All supposed experts reviews I read wrote that the Sonos speakers sounded better specially in large spaces. My space is not that big and I already had a Denon receiver so it made sense that I would just buy HEOS speakers to pair them along. Have a HEOS 1, 2, and 7. When the speakers emit sound they are great. Rich and profound sound comes out of them. The problem, and I’ve should have listen to the different blogs on the internet is the App. I feel like I am back at 1989 trying endlessly for any basic computer application to work. It’s insane the amount of time to pair the speakers, the countless times speakers do not appear, the countless times the speakers do not pair. I have probably one of the best internet connections ever but that’s not it. Unfortunately, Denon has applied all of their research and resources into sound quality but have not figure out that is 2019 when it comes to connectivity and wireless applications. If you want a one off speaker that sounds great, HEOS are excellent, if you want a cohesive sound system all over your house, don’t make the same mistake I did. This is not the system you want.";"2019-04-19T10:49:20-07:00";"https://itunes.apple.com/us/review?id=843129434&type=Purple%20Software";"843129434";223;"en";"POSITIVE"
6;5351853063;"glpdrum";"https://itunes.apple.com/us/reviews/id336143420";"1.520.320";5;"What am I missing?";"The people that rate this app poorly must be holding their mouth wrong or something. It puts everything you want in one location to witch you can control everything. As those who have it know Airplay is almost better than money and I put HEOS right by it. Instead of going to the network pc (Windows) and pushing music to my AVR I can grab it with this app. I have total access to my wav files on the flash drive and can make a queue or play track by track whatever I want. If there’s a music source connected to the network or online it will find it on its own and access it. Those of you who are having problems finding something you know is on the network turn that device off and back on again and HEOS will find it. Be patient and learn the app and you’ll love it.";"2020-01-02T09:08:33-07:00";"https://itunes.apple.com/us/review?id=843129434&type=Purple%20Software";"843129434";153;"en";"POSITIVE"
7;2335721297;"Samindalnac";"https://itunes.apple.com/us/reviews/id32407810";"1.442.220";4;"I’m a Systems Architect and Audiophile";"Half of the people reviewing this application are complaining about Bluetooth while the Heos devices are primarily WiFi speakers and that is how this application communicates. The other half are complaining about issues which are clearly caused by poor WiFi coverage and connectivity within their homes. 

Is this app aesthetically pleasing? No, and that’s a shame, but it is for the most part functional. For those speaking to issues with individual receivers and zone configuration try ensuring your firmware is up to date. I’m not saying that fixes everything, but give it a shot";"2018-03-22T20:03:10-07:00";"https://itunes.apple.com/us/review?id=843129434&type=Purple%20Software";"843129434";94;"en";"POSITIVE"
8;5406287458;"MysticNord";"https://itunes.apple.com/us/reviews/id116079649";"1.520.320";3;"Wonky";"Well, when it works it’s great. I’ve a Denon HEOS AVR and the app works with that each and every time, maybe because it’s hardwired to my network. I also have two HEOS 3 HS2 speakers (which sound amazing) stereo paired in the kitchen, and with them, the app is just plain finicky, but they are WiFi connected to my network. The connection is solid so I doubt that it’s a connection issue that sometimes causes various problems, such as dropping a speaker, failure to play from one of the in app streaming providers after having connected to the service, and in the case of my wife’s app, random crashes. This is after having deleted and reinstalled the app, reconnecting and configuring the speakers, resetting the app controller and standing on one foot while swinging my black-cat-mojo-bone in a brown paper bag over my head. Anyway, I look forward to future updates resolving these issues, and when that happens, it will be a five star app.";"2020-01-15T03:39:36-07:00";"https://itunes.apple.com/us/review?id=843129434&type=Purple%20Software";"843129434";166;"en";"NEGATIVE"
9;3375893791;"BirchwoodBill";"https://itunes.apple.com/us/reviews/id6161886";"1.481.130";5;"Good sound, requires a good connection";"I have 2 HEOS 1 and 3 HEOS Amps connected to Boston acoustics speakers.  Have owned them for 2-3 years.  The app works in coordinating the sound.   The biggest problem has been with intermittent WiFi.  On the heos 1 speakers they sometime just drop off the network and fail to reconnect.   I have to remove the battery base and the power cord then reconnect the power.   Then the speakers come back online.   So the firmware in the speakers probably needs to be reviewed so they reconnect to the WiFi better.  I hope they add a sleep timer to the firmware so the speakers turn off after streaming.   However you can just play an album or a play list.
2019-nov-03 
Upgrading the mesh network and the internet gateway has helped the connection problem.   I have also moved all the connections from a managed switch to an unmanaged switch.";"2018-11-03T04:58:25-07:00";"https://itunes.apple.com/us/review?id=843129434&type=Purple%20Software";"843129434";147;"en";"NEGATIVE"
10;6154254611;"utachi";"https://itunes.apple.com/us/reviews/id33767397";"1.562.200";2;"HEOS flaws to control the ND8006-PM8006 pair";"HEOS miss one important opportunity: making the duo PM/ND8006 operate as one integrated device. I explain: while you can turn both devices on using the HEOS app, you cannot do that in one click. That’s a shame. The switch to turn the amp (PM8006) on is almost hidden in the “music” session of the app! Also, because of that, when you connect Alexa to HEOS, you cannot turn the streamer and the amp with one command. That’s frustrating, it seems an easy fix. Marantz, please fix that and let us enjoy the full integration of our wonderful audio system (PM+ND) with simple voice or app commands.
Update: I need to add that this is a highly unstable app. It crashes often and is often left “hanging” without connection. When is Denon/Marantz going to finally pay attention to the app????? I hate to have exceptional sound and horrible user experience.";"2020-07-03T16:28:00-07:00";"https://itunes.apple.com/us/review?id=843129434&type=Purple%20Software";"843129434";149;"en";"NEGATIVE"
11;5476268576;"hijacks your system";"https://itunes.apple.com/us/reviews/id12878525";"1.544.150";1;"Hijacks the whole system";"It’s great when it works but often hijacks the whole system and intermittently kills the sound when just watching TV.  It also switches randomly to other inputs. We know this is the culprit as when we delete the app (off all devices which is annoying) and sign out completely and sign back in..it seems to work. My husband has nostalgia for the brand as it was his first stereo and he thinks the sound is nice. But to come out with an app to compete without being functional is irresponsible. There is nothing worse than having company over, music on and your stereo decides it has other plans. Or watching a movie and it decides its will switch to a different input. I went to the App Store to make sure we weren’t missing an update. Sadly over and over not the case. I am not one for reviews but hope you can use this to get the resources needed to fix these major glitches.";"2020-02-01T15:15:00-07:00";"https://itunes.apple.com/us/review?id=843129434&type=Purple%20Software";"843129434";165;"en";"NEGATIVE"
12;6800810343;"MunchieRun";"https://itunes.apple.com/us/reviews/id32083563";"1.583.161";5;"Near 5* Can’t Have EVERYTHING";"Near totally satisfied. After reading reviews, hope that others will check network connections before submitting negative reviews as this app is amazing considering it works with so many different platforms involved. 

I began utilizing it after setting up my Denon home theater 9.2 system. It would be great as mentioned in other reviews to have a more fluid avenue to adjust even just the bass and treble but the menu for channel adjustment would be a dream. 

Overall the apps they’ve made available to us are beyond my level of acceptance (especially because they’re FREE) and doesn’t make me question buying the other one they offer for my setup.";"2020-12-27T14:05:42-07:00";"https://itunes.apple.com/us/review?id=843129434&type=Purple%20Software";"843129434";109;"en";"POSITIVE"
13;3769821947;"Stephchern";"https://itunes.apple.com/us/reviews/id305458238";"1.493.170";2;"HEOS App Needs a Major Upgrade.";"We built a new house and did built in speakers in several rooms including surround sound in our basement rec room and outdoor speakers for the pool. I do like the quality of the speakers, but the app needs a major overhaul. 

The app is tricky to learn, it took quiet awhile for me to catch on to. My husband pretty much refuses to use it. Also, with the last update the app keeps trying to update the speakers, which was just done not long ago. I keep hitting “update tonight” but it overrides my choice and tries to “update now” anyway. Our internet is not the greatest so this is super annoying and prevents me from getting to use the system when I want!

Every time I see there is a HEOS app update I hope that it’s a major one. Hopefully it happens sooner than later. We have a $6,000 audio system that should have came with an app that is much better quality than it is.";"2019-02-14T11:30:22-07:00";"https://itunes.apple.com/us/review?id=843129434&type=Purple%20Software";"843129434";169;"en";"POSITIVE"
14;5304512470;"HS2012";"https://itunes.apple.com/us/reviews/id150035015";"1.520.320";3;"Wasted potential";"HEOS has/had so much potential from design and hardware point of view. However, software support is seriously lacking. On a paper, HEOS has HiRes support, various input options including Bluetooth, aux in, USB, airplay etc, extensive lineup with AVRs, many standard support DTS etc.

However, no Roon support, no Apple Music, AirPlay didn’t get added to expensive Heosbar nor on second gen HEOS speakers.

Denon is now releasing Denon home series and therefore trying to get into smart speaker market. This is a great move from hardware perspective to add another device on their extensive line up. But they seem to be always years after SONOS. 

The biggest issue and trend here is; however, the lack of support on existing customers from software stand point of view. App has looked the same despite all the negativity its receiving on online reviews. Even now still no support on major stream service like Apple Music.

I believe Sonos devices retain relative values because each device sees upgrade via software and firmware. Please make App better, more professional looking and easier navigation, and most importantly speed up software update process e.g. Apple Music Support.";"2019-12-22T05:24:13-07:00";"https://itunes.apple.com/us/review?id=843129434&type=Purple%20Software";"843129434";191;"en";"POSITIVE"
15;7482691274;"dario argento907";"https://itunes.apple.com/us/reviews/id33644594";"1.583.490";2;"Just okay.";"The functionality of choosing which speakers and system works great, and it’s nice to have one app that gets your streaming services all in one place...BUT, in this day and age it is simply unacceptable to have such a poor interface. The search functionality of Tidal is so freaking bad they should be ashamed of themselves. If you don’t spell the name of the artist or song perfectly, the search won’t recognize what you’re looking for. In this day and age that is just completely unacceptable. That technology is almost 30 years old at this point and HEOS couldn’t bother to put it in their app. Also the way the song queue works is a mess. It’s great to use the app from your phone to control your system but the HEOS app is a mess. Had I known how lame it was I might have chosen a different receiver. HEOS needs";"2021-06-19T08:40:24-07:00";"https://itunes.apple.com/us/review?id=843129434&type=Purple%20Software";"843129434";152;"en";"NEGATIVE"
16;5529710355;"BUBearsFan";"https://itunes.apple.com/us/reviews/id490932247";"1.544.150";1;"Doesn’t touch Sonos";"Don’t waste your money! I owned a Sonos system and now invested in the latest HEOS Home with playbar, sub, 4 150’s and a 250 for a total of 3 rooms. Setup via the app is terrible!! Setup with Sonos is 1000 times easier and everything just works. Good luck tuning the home entertainment room for surround sound. Speakers drop. TV input drops. Sometimes no sound from a room even though blue light is on. Difficulty getting sound from all rooms when grouping. No it’s not the WIFI. No it’s not the size of the apartment which is 80m2. App is not intuitive at all!! Doesn’t work with Apple Music. The place where I bought it says Denon is coming with an app update in May. That’s 3 months from now and based on previous reviews with same/similar problems, I expect no solutions. Will probably return today and replace with Sonos. Because Sonos works and Sonos is supported.";"2020-02-14T03:19:26-07:00";"https://itunes.apple.com/us/review?id=843129434&type=Purple%20Software";"843129434";158;"en";"NEGATIVE"
17;6997923560;"Fchixon";"https://itunes.apple.com/us/reviews/id16245269";"1.583.431";2;"Clunky awkward login and control";"This app is medium and clunky. I find that it keeps trying to play stuff and my Marantz receivers(1 and 2 year old models) keep trying to play tracks after I have paused them and switched to a different input (cable etc). It takes a few tries and settles down. 
Navigating a larger collection of music on my server is tedious and has yet another way of selecting favorites and playlists. 
Playing higher resolution music is nice but there is not much info if it can’t play a format other than skipping the tracks and sometime giving me message. Some formats won’t play on this app but play fine when played directly on the device. 
You cannot manage much on the receivers since it only looks at a subset of features on them. 
Sometimes it finds the receivers, other times it is searching for them. 
Since there is no web log in it is very hard to find your password and it’s unclear what benefit I get from logging in to the system. 

It can be made into a nice app, but it is primitive and unintegratrd at this time. Since the company owns all of the receivers they should be much more tightly integrated that they are. 

Sonos is a good model to copy.";"2021-02-15T09:08:15-07:00";"https://itunes.apple.com/us/review?id=843129434&type=Purple%20Software";"843129434";215;"en";"POSITIVE"
18;6256545817;"Josh Karp";"https://itunes.apple.com/us/reviews/id39596845";"1.562.280";2;"App is horrible";"I’ve had my HEOS bar for a couple of years now. For some reason, despite having a flawless home MESH network, the HEOS bar and subwoofer have trouble staying connected to each other and the network. And the app is so archaic that it really is no help at all. In order to fix the problem you have to physically plug your phone into the sound bar and do a bunch of steps that seems very Y2K. 

Last night, about 8 hours after the app updated, the HEOS bar started flashing yellow/green and woke us up. I’m assuming this was a software update but now, once again, the app can’t find the speaker! My god is 2020. This stuff should JUST WORK!

All in all I would avoid this App and Denon in general. Try Sonos or BlueSound or anything else....";"2020-07-29T12:14:54-07:00";"https://itunes.apple.com/us/review?id=843129434&type=Purple%20Software";"843129434";141;"en";"NEGATIVE"
19;5419385557;"Mikethe3";"https://itunes.apple.com/us/reviews/id107688545";"1.520.320";3;"Half baked";"The HEOS setup basically works, but has several flaws. Despite having Bluetooth, I am required to hook my mobile device up to the HEOS speaker using a custom cable. Guess I better not ever loose that or I won’t be able to set my speaker up again. Secondly, the app wants to name the HEOS devices by room name. For those of us who have other smart devices, a basic room name isn’t specific enough, and conflicts when trying to pair with the Alexa skill. I have several smart plugs already grouped under “Living Room.” What I need is to name my receiver “Receiver” and my remote speakers “Speaker 1,” “Speaker 2,” etc. The app should give us the ability to customize the names.";"2020-01-18T07:26:32-07:00";"https://itunes.apple.com/us/review?id=843129434&type=Purple%20Software";"843129434";124;"en";"POSITIVE"
20;3226832305;"Ghetdjc";"https://itunes.apple.com/us/reviews/id102234290";"1.466.240";5;"Have to have a solid network";"The app and the HEOS system in general work great and the sound quality is superior to that of sonos. That being said, you must have a rock solid network for this to work reliably. No network extenders that plug into the wall, no dual router setups, no service provider routers. You need consistent internet service, a solid router and wired access points if you home is  large. Also, hardwiring your HEOS devices is the way to go unless it's not possible. If you have a router that does 5g and 2.4g but uses the same name for both (eg ATT) it will cause problems like “searching for devices”.";"2018-09-24T18:51:01-07:00";"https://itunes.apple.com/us/review?id=843129434&type=Purple%20Software";"843129434";109;"en";"POSITIVE"
21;5457062950;"mjmjmkjjmmkiim";"https://itunes.apple.com/us/reviews/id307922889";"1.544.150";2;"Marantz7011 w HEOS app recent problem";"Since the latest update, my Marantz will literally turn on without guidance and HEOS will play music online.  This just started happening, it’s the most confusing and haunting thing all at the same time.. Imagine walking into your home with your music on when no one is home... This morning at 5am once again it decided to just switch on, wonderful timing.. This has happened 4 times in the last week, no clue, however I have narrowed it down to something within this application.  Please work on an update HEOS to fix this! I’ve been using this application and the Marantz app for the last 3 years with livable issues, this is not one of them.";"2020-01-27T19:45:29-07:00";"https://itunes.apple.com/us/review?id=843129434&type=Purple%20Software";"843129434";116;"en";"POSITIVE"
