"";"id";"userName";"userUrl";"version";"score";"title";"text";"updated";"url";"app";"wordCount";"language";"sentiment"
175;3463965954;"Archetart";"https://itunes.apple.com/us/reviews/id144767156";"1.481.130";2;"The imprecision is baffling";"Denon is known for precision audio. The idea that they could produce such an app is baffling. Two main gripes:

1. Volume control – the slider is imprecise. Simple toggle up/down added to the slider would allow more precise control of individual and grouped speakers

2. Why must one be on the same wifi network as the speakers for control? My thermostat allows me control from anywhere. My lights do the same thing. Why is my audio so special that one can’t even get into the app without being on the same network as the speakers?

Audio quality out of these speakers is great. This app is horrendous.";"2018-11-26T14:02:36-07:00";"https://itunes.apple.com/us/review?id=843129434&type=Purple%20Software";"843129434";108;"en";"POSITIVE"
176;2216232980;"stevenandpeter";"https://itunes.apple.com/us/reviews/id164236165";"1.442.190";4;"Master volume gone";"What happened to the master volume control. Now I have to turn down each speaker individually? Ridiculous to remove an often used feature.";"2018-02-16T16:32:29-07:00";"https://itunes.apple.com/us/review?id=843129434&type=Purple%20Software";"843129434";23;"en";"NEGATIVE"
177;4409598040;"ccritzer";"https://itunes.apple.com/us/reviews/id184769462";"1.505.130";4;"HEOS VS Sonos";"Much better sound quality with amplifier.  Not as intuitive in user interface.  Really wish it also had connectivity with Apple Music.  Bit clunky between interfaces and challenged by backward compatibility.";"2019-07-04T06:13:12-07:00";"https://itunes.apple.com/us/review?id=843129434&type=Purple%20Software";"843129434";30;"en";"POSITIVE"
178;8028344685;"rag1979";"https://itunes.apple.com/us/reviews/id32417069";"2.1.680";1;"Russell";"The app is horrible!  Only thing worse than the app is the tech support.  I am getting some more speakers for around the house.  It is going to be Sonos.  Heos maybe hi-Res, but what good is it if it doesn’t work.  At least Sonos is noted for its outstanding app.  It may not be hi-res, but at least it works.  I wanted music at dinner.  No luck, so I turned on the music channel.  Don’t think Denon tech really cares.";"2021-11-15T16:57:12-07:00";"https://itunes.apple.com/us/review?id=843129434&type=Purple%20Software";"843129434";81;"en";"POSITIVE"
179;7874298797;"CrewMFjones";"https://itunes.apple.com/us/reviews/id205921237";"2.1.561";3;"the last update messed it up.";"Glitch glitch since latest update with the dark/light mode.  Used to be easy and great now it’s like we just went back in time.  Disappointing.";"2021-10-03T12:44:21-07:00";"https://itunes.apple.com/us/review?id=843129434&type=Purple%20Software";"843129434";25;"en";"POSITIVE"
180;5753737615;"BWG-PG";"https://itunes.apple.com/us/reviews/id19193373";"1.544.240";1;"Will this app ever get their (profanity of your choice) together?";"When it works it’s great.  I have SiriusXM on my phone and have no problem signing in and listening to their app.  When I go to HEOS and try to listen to SXM there they tell me it’s the wrong user information.  It’s not the wrong user information.  It’s always something.
Additional.  IT IS STILL S%^%$!";"2020-04-02T19:29:26-07:00";"https://itunes.apple.com/us/review?id=843129434&type=Purple%20Software";"843129434";56;"en";"POSITIVE"
181;8087744344;"Luciaskillia";"https://itunes.apple.com/us/reviews/id306646357";"2.1.680";3;"I can only see from the letter “A” to the letter “M”";"I thought the text size might be affecting it, but I can’t find it in settings. My husband sees up to the letter “R”. Beats us?? Maybe a bug, hopefully it gets fixed. Otherwise I’d give it 5 Stars!!! Please fix!!";"2021-12-02T10:33:50-07:00";"https://itunes.apple.com/us/review?id=843129434&type=Purple%20Software";"843129434";41;"en";"POSITIVE"
182;7879540205;"Maronfan";"https://itunes.apple.com/us/reviews/id19288962";"2.1.561";1;"Dumpster fire";"Newest app update is a complete dumpster fire and song stop a minute in with our Marantz system. Doesn’t even have ability to have playlists with more than 300 songs in newest update. Not that it matters since doesn’t play anyway.

Either bring your tech up to 2017, or I’m switching to Sonos soon. What a mess.";"2021-10-04T22:11:04-07:00";"https://itunes.apple.com/us/review?id=843129434&type=Purple%20Software";"843129434";57;"en";"NEGATIVE"
183;6190696215;"Hydrant34";"https://itunes.apple.com/us/reviews/id109462126";"1.562.200";1;"Alexa skill does not support Sirius XM radio";"It’s crazy that there would be a music service that is not supported. Even though you can connect your XM in the app and command to play.  The Alexa HEOS skill still does not support XM. I have been waiting almost a year before writing this review. Update after update, it is not delivered yet.  HEOS would be a five star app if this was fixed!";"2020-07-12T15:28:06-07:00";"https://itunes.apple.com/us/review?id=843129434&type=Purple%20Software";"843129434";66;"en";"NEGATIVE"
184;7744214416;"jdb-texas";"https://itunes.apple.com/us/reviews/id34412991";"1.583.490";2;"Wasted potential";"The HEOS app is just kind of a mess. Clunky, very dated user interface, meager features. May have been OK in 2009 or so. Using it with a nice Marantz music streamer and the hardware quality is light years ahead of the mediocre app experience. I think Denon can and should do much better for their customers.";"2021-08-28T05:54:27-07:00";"https://itunes.apple.com/us/review?id=843129434&type=Purple%20Software";"843129434";57;"en";"POSITIVE"
185;5665101116;"mcneil181";"https://itunes.apple.com/us/reviews/id383016066";"1.544.240";1;"Terrible App";"Do NOT purchase HEOS / Dennon speakers! The app used to operate them is absolutely terrible. Even as I’m writing this the music I was listening to just decided to stop for no reason. Connectivity issues, music not playing etc is a common theme. Again, if you’re looking to purchase speakers do NOT buy Heos / Dennon. Heos / Dennon, get your business together and fix this app.";"2020-03-15T11:19:30-07:00";"https://itunes.apple.com/us/review?id=843129434&type=Purple%20Software";"843129434";68;"en";"NEGATIVE"
186;7715787542;"kevjs";"https://itunes.apple.com/us/reviews/id11334309";"1.583.490";5;"This app works just fine";"I don’t necessarily like using 2 apps to do different things but both this HEOS and the Denon AVR-Remote app together work great.";"2021-08-20T13:57:48-07:00";"https://itunes.apple.com/us/review?id=843129434&type=Purple%20Software";"843129434";23;"en";"POSITIVE"
187;3546855573;"Hccucdhchcxyc";"https://itunes.apple.com/us/reviews/id415483575";"1.481.160";2;"PLEASE FIX";"-Unable to connect after 1 song
-after song finishes, it shuffles like crazy 
-cannot fast forward or rewind songs (little red bar to forward/rewind disappears 95% of the time)
-cannot select desired song because it selects random songs from list. Pressing one song and gives error then plays a different song. 
-keeps trying to connect to Tidal over and over. After it connects, after 1 song it gives another error trying to connect again. 
-During music playback, it goes to a full screen heos logo saying “obtaining IP Address “
Etc...";"2018-12-18T18:57:46-07:00";"https://itunes.apple.com/us/review?id=843129434&type=Purple%20Software";"843129434";91;"en";"NEGATIVE"
188;7878638682;"picklesjackson";"https://itunes.apple.com/us/reviews/id184046626";"2.1.561";1;"Sarita";"New app version is unusable, constantly asks you if you want to use Alexa. App glitches out sometime during the first song being played. If you have the old version do not update till this glitch is fixed. App was poor to begin with, but this issue makes it non functional";"2021-10-04T16:11:27-07:00";"https://itunes.apple.com/us/review?id=843129434&type=Purple%20Software";"843129434";51;"en";"NEGATIVE"
189;8092393211;"firebladeharsha";"https://itunes.apple.com/us/reviews/id113888408";"2.1.680";5;"Perfect companion for the AVR";"Perfect companion to the Denon app. UX could be little more intuitive but once you know where things are, they work well.";"2021-12-03T18:53:05-07:00";"https://itunes.apple.com/us/review?id=843129434&type=Purple%20Software";"843129434";22;"en";"POSITIVE"
190;4837589069;"QB Cats Fan";"https://itunes.apple.com/us/reviews/id472207536";"1.520.200";3;"Not a smooth set up";"The app and set up process is not that smooth. Be prepared to spend more time than you think and if you have an iPhone make sure you have the single adapter ready as you probably will not set up without it.";"2019-09-25T14:39:04-07:00";"https://itunes.apple.com/us/review?id=843129434&type=Purple%20Software";"843129434";42;"en";"POSITIVE"
191;2246214664;"BBM5020";"https://itunes.apple.com/us/reviews/id35855014";"1.442.190";1;"New Update";"I love the app in general but the update lacks the ability to adjust the volume for all the rooms at the same time. I have 12 different rooms and I really enjoyed the ability to turn them all down at the same time if needed. Now you must go in and adjust the volume in each room individually. The master volume control option was very useful.";"2018-02-25T07:01:10-07:00";"https://itunes.apple.com/us/review?id=843129434&type=Purple%20Software";"843129434";67;"en";"POSITIVE"
192;2002240392;"Drikanna";"https://itunes.apple.com/us/reviews/id26032103";"1.430.180";1;"Cannot find device";"Cannot connect to my Marantz AV receiver after this weeks update.  Seems like the app forgot my devices.  Tried to add it again, and it wants me to find a 3.5mm audio cable and connect my phone to the “HEOS audio jack in back” (which isn’t readily accessible).  It shouldn’t be this hard, since both my phone and AV receiver are still on the same WiFi network.";"2017-12-16T16:16:04-07:00";"https://itunes.apple.com/us/review?id=843129434&type=Purple%20Software";"843129434";67;"en";"POSITIVE"
193;3118537453;"HomesoundD";"https://itunes.apple.com/us/reviews/id18040987";"1.466.200";2;"Great sound terrible app";"We purchased a new home that had HEOS system built into it. The sound is great but the app is terrible. Every streaming service you use isn’t the same in the Heos app. You are better off buying a receiver you can connect to wirelessly or through blue tooth that streams directly from your streaming app or music.";"2018-08-26T18:21:10-07:00";"https://itunes.apple.com/us/review?id=843129434&type=Purple%20Software";"843129434";58;"en";"POSITIVE"
194;7945951862;"Palomar Skies";"https://itunes.apple.com/us/reviews/id31846706";"2.1.562";1;"Broken & Useless";"App was updated in September which rendered it useless for playing my music files,  It was supposedly fixed with the October update, but it now “plays” on my iOS devices, but no sound comes out of the system. It is very annoying that they broke a system that used to work.";"2021-10-23T09:56:15-07:00";"https://itunes.apple.com/us/review?id=843129434&type=Purple%20Software";"843129434";51;"en";"NEGATIVE"
195;7621957622;"TheVeu";"https://itunes.apple.com/us/reviews/id85266530";"1.583.490";1;"Unreliable on a LAN";"The app routinely cannot find my Marantz, even when running MDNS and bonjour services. The vendor needs to invest in mobile app bug fixing and support. 1-star/F foe rhis product. Will have to buy a new receiver technology in the future solely due to poor apps support and presumably planned obsolesce. Do not buy from this vendor. 30-40 yrs ago they were a good amp mfg, but not in this day in age";"2021-07-26T18:24:49-07:00";"https://itunes.apple.com/us/review?id=843129434&type=Purple%20Software";"843129434";73;"en";"POSITIVE"
196;5311174426;"Seluraved";"https://itunes.apple.com/us/reviews/id20702941";"1.520.320";1;"This app is horrible";"Don’t get it. Nothing works. The interface is garbage. It is extremely difficult to understand how the sound bar interacts with the surround sound speakers. Every time i want to watch a movie it takes 30 minutes to set everything up. Avoid at all costs!";"2019-12-23T19:12:23-07:00";"https://itunes.apple.com/us/review?id=843129434&type=Purple%20Software";"843129434";45;"en";"NEGATIVE"
197;7907984960;"Krispyc";"https://itunes.apple.com/us/reviews/id18373771";"2.1.561";2;"Poor Connectivity Continuity";"Nice new visuals in the update, but does now it NOT play well with other apps. I’d rather have the old visuals. The connectivity is WORSE. The minute I open another app while listening to music on my IPhone it shuts off. Please fix this problem ASAP!";"2021-10-12T15:45:14-07:00";"https://itunes.apple.com/us/review?id=843129434&type=Purple%20Software";"843129434";47;"en";"NEGATIVE"
198;2700380596;"StevenLehmann";"https://itunes.apple.com/us/reviews/id37095339";"1.454.230";1;"Please bring back Master Volume control";"I have 11 HEOS speakers throughout my home and 90% of the time they are providing whole-home ‘background music’. No longer can I raise or lower the complete group as a whole. I need to individually select each room and adjust the volume, then go to the next room, and the next....

Are you going to remove the ‘master’ volume control on your AV Receivers too?  Maybe just put 7+ little volume controls on the front. One for each of the mains and surrounds and subs and Atmos, etc. See how THAT would go over!

Really a dumb move.

6/18
Thanks for the update and bringing the Master Volume control back to the HEOS app. MUCH NICER!";"2018-06-15T09:29:24-07:00";"https://itunes.apple.com/us/review?id=843129434&type=Purple%20Software";"843129434";117;"en";"NEGATIVE"
199;7873801768;"Ad66de";"https://itunes.apple.com/us/reviews/id210650203";"2.1.561";2;"Horrible update";"After auto update it just doesn’t work. Terrible. Keeps cutting off mid song. When does play a pop up says cat play media…when it is playing.  WiFi is robust and phone is new and updated.";"2021-10-03T09:44:36-07:00";"https://itunes.apple.com/us/review?id=843129434&type=Purple%20Software";"843129434";35;"en";"POSITIVE"
200;5494026090;"JC&ER";"https://itunes.apple.com/us/reviews/id168609403";"1.544.150";4;"4 out of 5";"I love that I can play pandora. I really wish I could view the previous song if I missed the artist.";"2020-02-05T23:02:48-07:00";"https://itunes.apple.com/us/review?id=843129434&type=Purple%20Software";"843129434";21;"en";"POSITIVE"
201;6398106019;"Ornot Majestic";"https://itunes.apple.com/us/reviews/id11712828";"1.562.280";2;"Good, when it works";"Crashes multiple times per use.  Every update it gets worse.  Sometime I have to exit out of app or even reinstall to get it to connect.  It’s a frustrating experience about 70% of the time.  When it works, it’s great!";"2020-09-05T08:04:12-07:00";"https://itunes.apple.com/us/review?id=843129434&type=Purple%20Software";"843129434";40;"en";"NEGATIVE"
202;6375931927;"Searobot";"https://itunes.apple.com/us/reviews/id853597150";"1.562.280";5;"Very enjoyable app";"I use it with my Denon X6500H and it work very good.
Amazing music quality and use friendly.
I enjoyed it a lot.
Thank you.";"2020-08-29T20:22:44-07:00";"https://itunes.apple.com/us/review?id=843129434&type=Purple%20Software";"843129434";25;"en";"POSITIVE"
203;5733842730;"Lentaculum";"https://itunes.apple.com/us/reviews/id26038753";"1.544.240";5;"I’m loving it...";"But I would like to be able to download like I using the pandora app.  Everything else is great!";"2020-03-29T20:47:58-07:00";"https://itunes.apple.com/us/review?id=843129434&type=Purple%20Software";"843129434";19;"en";"POSITIVE"
204;3100831853;"NotSoSimplisafe";"https://itunes.apple.com/us/reviews/id472570067";"1.466.200";1;"Usually doesn’t work...";"App will usually attempt to open/load, but will just crash each time.  I have to restart the whole phone in order to get it working. However, when it does work, it starts immediately playing some Tennessee sports channel from TuneIn radio...I’ve never used TuneIn, never listened to sports radio, and have nothing to do with Tennessee.";"2018-08-22T15:31:12-07:00";"https://itunes.apple.com/us/review?id=843129434&type=Purple%20Software";"843129434";56;"en";"NEGATIVE"
205;3046930014;"One dad's review";"https://itunes.apple.com/us/reviews/id10448533";"1.466.200";1;"Great sound, intolerable interface";"The app only connects with my phone/Ipad about half the time. 
Sometimes no music, other times I can’t control my music. 
This app has dementia, I never know if it is going to work or not. 
Denon should start from scratch and rewrite this app. 
The sound is wonderful, but I could never recommend it because the controls are undependable.";"2018-08-10T15:57:27-07:00";"https://itunes.apple.com/us/review?id=843129434&type=Purple%20Software";"843129434";60;"en";"NEGATIVE"
206;2301053047;"Acro66";"https://itunes.apple.com/us/reviews/id112981895";"1.442.220";3;"Bring back master volume";"After updating I found out that the master volume slider is gone. You have to select in menu what slider to use. 
Want and need a master volume one slider that rules them all. 
Possible to go back to earlier version?

Much appreciated.";"2018-03-13T01:45:56-07:00";"https://itunes.apple.com/us/review?id=843129434&type=Purple%20Software";"843129434";43;"en";"POSITIVE"
207;1917049430;"Fish man 22";"https://itunes.apple.com/us/reviews/id21857608";"1.421.150";1;"No longer plays SiriusXM";"This app is extremely unstable.  In the past week, it no longer recognizes SiriusXM.  At first I thought it was my iPad, but I have the same issue with the iPhone.  It worked fine until a week ago.  I reset the account Info and relogged into SiriusXM with no luck. I checked my account and it plays fine thru the SiriusXM app, just not thru Heos.  Please fix this bug.......";"2017-11-12T19:05:08-07:00";"https://itunes.apple.com/us/review?id=843129434&type=Purple%20Software";"843129434";70;"en";"NEGATIVE"
208;6015342763;"Enriquebras";"https://itunes.apple.com/us/reviews/id539671251";"1.544.240";3;"Mixed review";"Works very well for me only down fall is I can’t use it with apple music . I hope they can work that out or add the feature in . But other than that no complaints";"2020-05-30T16:10:06-07:00";"https://itunes.apple.com/us/review?id=843129434&type=Purple%20Software";"843129434";36;"en";"POSITIVE"
209;5848738104;"JRutttTheFirst";"https://itunes.apple.com/us/reviews/id26898830";"1.544.240";2;"Speakers are great, app is terrible";"Love the actual HEOS Speakers but the HEOS app is glitchy and hardly ever works. Volume always goes up and down on its own. Also doesn’t allow groupings s of home speakers to stay online. Constantly re-syncing speakers. Very frustrating for how expensive the speakers were.";"2020-04-22T08:51:34-07:00";"https://itunes.apple.com/us/review?id=843129434&type=Purple%20Software";"843129434";46;"en";"NEGATIVE"
210;5694574613;"M@thTeacher";"https://itunes.apple.com/us/reviews/id4098646";"1.544.240";5;"Hey it works and it’s free";"I now have two Marantz setups and my single iPhone app lets me send two streams of Tidal and/or Pandora or my Iranian religious music over them";"2020-03-21T19:50:01-07:00";"https://itunes.apple.com/us/review?id=843129434&type=Purple%20Software";"843129434";27;"en";"NEUTRAL"
211;7907511384;"kevin devin";"https://itunes.apple.com/us/reviews/id246411639";"2.1.561";2;"Buggy";"It just doesn’t work all that well. My receiver is hardwired to LAN and it still takes forever to recognize. The TuneIn feature doesn’t seem to work sometimes. It’s just not as intuitive and smooth as the Yamaha app.";"2021-10-12T11:59:52-07:00";"https://itunes.apple.com/us/review?id=843129434&type=Purple%20Software";"843129434";39;"en";"POSITIVE"
212;7893355289;"swtrps";"https://itunes.apple.com/us/reviews/id34362325";"2.1.561";1;"Awful";"This app is awful for numerous reasons which reflects extremely poorly on denon products in general considering the requirement to use HEOS.  If it were a matter of a choice between using my iTunes app or the HEOS app to control music it’d be one thing. Unfortunately you are required to use HEOS and it’s functionality is finicky at best.";"2021-10-08T17:23:01-07:00";"https://itunes.apple.com/us/review?id=843129434&type=Purple%20Software";"843129434";60;"en";"NEUTRAL"
213;7187229961;"disatified customer 1001";"https://itunes.apple.com/us/reviews/id34464898";"1.583.490";1;"not Working";"Hasn’t worked since last update, ridiculous.  Worked great for two years and then nothing, same message every time that “HEOS unable to play music from this source at this time.  Try again later”
No answer to my emails from support either.";"2021-04-05T09:40:48-07:00";"https://itunes.apple.com/us/review?id=843129434&type=Purple%20Software";"843129434";41;"en";"POSITIVE"
214;4068822678;"cheezeskrice";"https://itunes.apple.com/us/reviews/id28843118";"1.505.130";1;"Absolute Junk";"App has never worked correctly! Continuously needs maintenance and generally never works. Developers go back and start over. The user should not have to battle the app every time it’s used. Other media apps used have no trouble with network identity. Heos however does. Drops network can’t find it even when  a few inches from AVR.";"2019-04-27T13:41:14-07:00";"https://itunes.apple.com/us/review?id=843129434&type=Purple%20Software";"843129434";56;"en";"POSITIVE"
215;2158113696;"fatspatula";"https://itunes.apple.com/us/reviews/id85254277";"1.430.180";1;"Great speakers, Horrible App";"Demon really needs to fire their App development team or whoever made it. It is very frustrating, music cuts in and out, sometimes certain speakers won’t play music, Etc. It’s just a buggy app, sometimes it works fine and other times I spend 10-15 futzing around with and then all of a sudden they start working. But the speakers do sound great.";"2018-02-02T06:08:35-07:00";"https://itunes.apple.com/us/review?id=843129434&type=Purple%20Software";"843129434";62;"en";"POSITIVE"
216;5479909158;"takennickename";"https://itunes.apple.com/us/reviews/id255724871";"1.544.150";5;"Forgets who I am";"Only complaint is I always have to re enter my password";"2020-02-02T11:00:53-07:00";"https://itunes.apple.com/us/review?id=843129434&type=Purple%20Software";"843129434";11;"en";"NEGATIVE"
217;4760031027;"ArJunaBug";"https://itunes.apple.com/us/reviews/id41558722";"1.520.145";1;"Apps are not Denon’s forté";"Denon might make a decent AVR, but they have obviously not seen the value and producing quality apps. This app and the Denon AVR app seem like afterthought and a conglomeration of disparate thoughts they’ve had across the years. Denon needs to seriously start over with their apps and try to build in some intelligence and ease-of-use, not to mention they need to be much faster.";"2019-09-11T00:49:38-07:00";"https://itunes.apple.com/us/review?id=843129434&type=Purple%20Software";"843129434";66;"en";"POSITIVE"
218;2038693636;"Young768";"https://itunes.apple.com/us/reviews/id24469214";"1.430.180";1;"Horrible Connectivity";"The app itself is not the worst out there, but the random connection problems are horrible. I have 5 HEOS speakers in my house and Each time I open the app you can never count on which speakers will show up.  I checked my network and I can see all the speakers on my network, it is an app problem.  So far Denon has not been very much help.";"2017-12-29T09:50:36-07:00";"https://itunes.apple.com/us/review?id=843129434&type=Purple%20Software";"843129434";69;"en";"NEGATIVE"
219;1994804614;"Racer 1027";"https://itunes.apple.com/us/reviews/id335162886";"1.430.160";1;"New update extremely unreliable.";"The new version only allows one change before becoming unresponsive or crashing. For example, you can open the app and choose a station to stream. But when you want to change the station or turn it off, the app won’t accept any input. You have to close the app and reopen it.";"2017-12-13T20:14:02-07:00";"https://itunes.apple.com/us/review?id=843129434&type=Purple%20Software";"843129434";52;"en";"POSITIVE"
220;7407976411;"Then1354";"https://itunes.apple.com/us/reviews/id34180263";"1.583.490";2;"Great when it works";"But it doesn’t work very often when you group speakers together. I’m $1500 into speakers for this system and thoroughly disappointed. I hope the system improves over time, it is a great concept but just poor execution.";"2021-05-30T18:08:49-07:00";"https://itunes.apple.com/us/review?id=843129434&type=Purple%20Software";"843129434";37;"en";"POSITIVE"
221;6983086420;"diskdehaan";"https://itunes.apple.com/us/reviews/id762649500";"1.583.431";2;"Sound";"You can very easily damage your speakers with the sound bar in the app. Increase volume very dramatically with small sound bar adjustment. Do not leave this app open as even a minor touch may send a huge increase in volume.";"2021-02-11T15:23:52-07:00";"https://itunes.apple.com/us/review?id=843129434&type=Purple%20Software";"843129434";41;"en";"POSITIVE"
222;4688765331;"amodxb";"https://itunes.apple.com/us/reviews/id121439201";"1.520.140";5;"Device not found";"The app is unable to find the device. Needs a major overhaul!";"2019-08-28T23:46:46-07:00";"https://itunes.apple.com/us/review?id=843129434&type=Purple%20Software";"843129434";12;"en";"NEUTRAL"
