"";"id";"userName";"userUrl";"version";"score";"title";"text";"updated";"url";"app";"wordCount";"language";"sentiment"
51;7967156425;"Silence117 gogogo";"https://itunes.apple.com/us/reviews/id122575036";"2.1.562";1;"Impossible to use, update turned my speakers to door stoppers";"I was forced to try to disconnect and reconnect my speakers to the HEOS app. It is currently impossible to connect HEOS 5 speakers to the app even though they are apparently connected to the internet. I have tried deleting and reinstalling the app and have reset the speakers multiple times without success. The speakers show a steady blue light indicating they’re connected to the internet but the app won’t recognize them. I’ve basically got a pair of door stoppers that are not usable for anything else. They sounded great when the app actually worked.";"2021-10-29T11:26:03-07:00";"https://itunes.apple.com/us/review?id=843129434&type=Purple%20Software";"843129434";95;"en";"POSITIVE"
52;6898607881;"Perfect for travelers";"https://itunes.apple.com/us/reviews/id311852235";"1.583.161";1;"Worst App on my Phone";"Do not recommend this at all. The absolute worst app on my phone. Loses connection to my phone even though it is supposed to be playing my Pandora music, the HEOS constantly never finds my device, the HEOS app even has a limit on the amount of Pandora playlists listed in their app. Another frustrating thing is that in mid play of any given song it will just skip to the next. I’ve opened tickets with both HEOS and Pandora and this is a HEOS issue. Worthless. Do not buy Denon products thinking you will get something decent with their app as a bypass to Sonos.";"2021-01-21T20:35:05-07:00";"https://itunes.apple.com/us/review?id=843129434&type=Purple%20Software";"843129434";106;"en";"NEGATIVE"
53;2503252927;"gtmil44";"https://itunes.apple.com/us/reviews/id37776726";"1.442.220";5;"Horrible over WiFi.";"I’ve had the HEOS sound bar hard wired for months and love it.  Bought a HEOS 3 for the kitchen, connected it to my WiFi, router is 25 ft away in the office, and needed to reconnect it almost every time I used it.  I bought a $20 WiFi range extender just to connect the HEOS 3 with a Ethernet cable and works perfectly now.  Never drops and no longer need to reconnect each time.  App is great - when connected via Ethernet.";"2018-05-04T03:36:19-07:00";"https://itunes.apple.com/us/review?id=843129434&type=Purple%20Software";"843129434";83;"en";"POSITIVE"
54;1930711336;"SharkBites";"https://itunes.apple.com/us/reviews/id19480437";"1.421.150";1;"Why Two Apps???";"Again, this is mind-bogglingly complicated for something that should be really simple. I don't need another streaming option. I don't need two apps. I just want to listen to online radio, stream music from my phone and watch TV/movies using the same services that I'm used to from Apple, Chromecast, etc. It should be really easy to design ONE app that my grandmother can figure out how to use. And the UX is just appalling. If you have UX people responsible for this mess, fire them all! It's as if you needed to cram every possibility under the sun into this without thinking about how 99.9% of your users are going to use it. Simplify!!!!";"2017-11-18T11:37:52-07:00";"https://itunes.apple.com/us/review?id=843129434&type=Purple%20Software";"843129434";115;"en";"NEGATIVE"
55;5664887831;"SurferSteven";"https://itunes.apple.com/us/reviews/id156795325";"1.544.240";2;"New App Update not working";"This is a mediocre App and was working OK until today with the latest update.  Now I can’t even access my account.  I tried to create a new account and the app would not let me access the location selection page.  One should not need an account to use the features of this app.  It isn’t possible to select radio stations without an account.  The developers aren’t doing a good job when checking if the system is working after updates.";"2020-03-15T10:11:22-07:00";"https://itunes.apple.com/us/review?id=843129434&type=Purple%20Software";"843129434";80;"en";"POSITIVE"
56;3871100426;"Fllman";"https://itunes.apple.com/us/reviews/id31136484";"1.493.170";1;"Worst App I Ever Used";"This app is the most horrible I ever used. I have over 100 iOS apps, and am very tech friendly, but this app is so non-intuitive and confusing it seems like it was devolved by middle school students with a $300 budget. I still can’t figure out how to use all my speakers or select just some. Also, speakers would not connect while using the app; the only way to connect was manually with the actual wireless router. I hope Denon actually invests in improving this horrible app and makes an update. If I would have known the app was so bad, I would have considered Pioneer or Yamaha products instead.";"2019-03-11T17:17:42-07:00";"https://itunes.apple.com/us/review?id=843129434&type=Purple%20Software";"843129434";111;"en";"NEGATIVE"
57;3175951050;"Porschefile";"https://itunes.apple.com/us/reviews/id39362302";"1.466.240";5;"Not sure what all the complaints are about! 😀";"Works great for me. Just connected my new Denon AVR S740H to my WiFi network and the app automatically connected to it. Allows you to play various streaming services and control basic things like volume and skipping songs. Could it be better? Of course! But is it fully functional unlike all the complaints in other reviews? Yes!";"2018-09-10T14:41:24-07:00";"https://itunes.apple.com/us/review?id=843129434&type=Purple%20Software";"843129434";57;"en";"POSITIVE"
58;2368011344;"tmpafford";"https://itunes.apple.com/us/reviews/id264920781";"1.442.220";2;"Bring back the old version!";"The updated app is horrible. Groups don’t work anymore. We are constantly having to unpair and repair zones to get them to play together. The old app had one volume control for the group. You could adjust the volume in each zone individually, but there was one master control. Now you now have to adjust every single zone individually if you want to turn up the sound. It’s a huge pain. I have no idea why they changed something that was working perfectly. Please roll back the app to the old controls!!";"2018-03-31T09:08:02-07:00";"https://itunes.apple.com/us/review?id=843129434&type=Purple%20Software";"843129434";92;"en";"POSITIVE"
59;8112571063;"Blatxch";"https://itunes.apple.com/us/reviews/id191109514";"2.1.680";3;"Needs an update badly";"There are quite a few functionality issues or user interface issues that I would like addressed, such as not having a home screen widget of some sort to start and stop the music from the lock screen, also I wish my Denon home AV receiver would recognize the streaming service Account user information right from the app because to try to enter it on the unit is horrendous!";"2021-12-09T12:01:21-07:00";"https://itunes.apple.com/us/review?id=843129434&type=Purple%20Software";"843129434";68;"en";"NEGATIVE"
60;7904431125;"A customer for way too long...";"https://itunes.apple.com/us/reviews/id9762672";"2.1.561";1;"What did you guys do??";"App was working great until the update. My app connects to the network according to the blue steady light. App says go to rooms, click rooms and it takes you back to setup.  If there was a way to manually enter in a wireless network that would be great, however if you can’t get the app to recognize the network there is no way to enter.  Audio cable doesn’t work nor the Ethernet cable    What a waist of time and effort.  For the amount of money you charge for your appliances one would think it was truly plug and play.   If you want to know more please do not hesitate to contact me.   I will certainly give you some advice on how to program your app.  At this point it’s going on the dead shelf and I’m buying something that works, I doubt it will be from anything that Sound United owns. That being:
Marantz
Bowers and Wilkins
Definitive Technology
Classe
Denon
Polk
HEOS
Boston Acoustics";"2021-10-11T16:54:18-07:00";"https://itunes.apple.com/us/review?id=843129434&type=Purple%20Software";"843129434";166;"en";"POSITIVE"
61;5240799088;"Sws1967";"https://itunes.apple.com/us/reviews/id348830379";"1.520.320";1;"Works about 20% of the time after 5 years of upgrades!";"I’ve had HEOS units for about 5 years now along with this painful app, which is the only way to operate them.  You would think that over 5 years someone could figure out how to make this simple app reliable, but ...nope. 

This is the least reliable app I use.  It fails to work more often than it actually works.  I have found various work arounds such as pulling a room out and dropping it back in and skipping songs until it finally connects - this is no longer acceptable.";"2019-12-06T08:42:16-07:00";"https://itunes.apple.com/us/review?id=843129434&type=Purple%20Software";"843129434";90;"en";"NEGATIVE"
62;3930757428;"Moken403";"https://itunes.apple.com/us/reviews/id42903769";"1.493.170";1;"HEOS app ruins great products";"My HEOS speakers are wonderful when they work. The HEOS app requires constant maintenance to keep everything working. 
Speakers refuse to group together sometimes and randomly ungroup. The HEOS AVR will randomly decide I no longer need a subwoofer so I have to turn subwoofer on and off in the app and sometimes reset the whole receiver to make it work again. 
The app needs the ability to use different volume settings for different inputs. Ideal game settings are different than TV, Movies etc. Having to constantly make adjustments because the app doesn’t store any settings ruins otherwise great products.";"2019-03-26T15:59:49-07:00";"https://itunes.apple.com/us/review?id=843129434&type=Purple%20Software";"843129434";100;"en";"POSITIVE"
63;6745534207;"davidbassett";"https://itunes.apple.com/us/reviews/id19706480";"1.583.161";5;"Better than Sonos";"I put up with compatibility issues between my Sonos system and my Mac components forever. If there was the slightest glitch in Wi-Fi, Sonos was unable to find my music on my Mac or iPhone. All I was able to play consistently was SiriusXM. This system, however, gets along perfectly with my iPhone, Mac, Wi-Fi and Bluetooth. Love it!";"2020-12-12T08:00:10-07:00";"https://itunes.apple.com/us/review?id=843129434&type=Purple%20Software";"843129434";59;"en";"POSITIVE"
64;2865987265;"xxnfxx";"https://itunes.apple.com/us/reviews/id41094757";"1.454.280";5;"Probably one of the best app for marantz.";"This app is amazing and the sound it produces through my marantz sr8012 and sr7012. Just amazing. I have tried other DACs but nothing comes close to this when you play music through HEOS. Super super high quality and huge difference as if you are playing super high def res tracks. Just amazing. I’m really happy with this. Don’t use AirPlay. That will reduce the sound quality.";"2018-07-08T13:53:57-07:00";"https://itunes.apple.com/us/review?id=843129434&type=Purple%20Software";"843129434";67;"en";"POSITIVE"
65;7141311844;"Ray in Key West";"https://itunes.apple.com/us/reviews/id261041302";"1.583.490";4;"Glad the refresh bug is fixed";"After 5 years of loving Heos, I was ready to rip it out and replace it with Sonos when we had to live with the refresh issue for over a month when none of our devices really knew what was playing. It’s working like a charm now. Happy again. Thanks folks.

PS only 4 stars because I hate the Denon home speakers. Bring back the Heos series.";"2021-03-24T19:06:28-07:00";"https://itunes.apple.com/us/review?id=843129434&type=Purple%20Software";"843129434";67;"en";"POSITIVE"
66;6855600473;"NoVA audiophile";"https://itunes.apple.com/us/reviews/id565125446";"1.583.161";4;"Heos in Marantz ND 8006";"Just installed the app and syncd with Network CD player. Initially not able to install, not intuitive, got the impression that a receiver or amp required but somehow was able to complete install. So far seems to work as intended. Nice controller allowing to switch between music sources quickly. Hard to find podcasts on TuneIn app, no search function that I’ m aware of or is not intuitive.";"2021-01-10T19:56:21-07:00";"https://itunes.apple.com/us/review?id=843129434&type=Purple%20Software";"843129434";68;"en";"POSITIVE"
67;7034440056;"Rocktdg";"https://itunes.apple.com/us/reviews/id32489541";"1.583.490";4;"Denon AVR-X3700H";"I’m using HEOS to play music to wired speakers and the AVR is connected to my network via wifi. The only sources I really use at this point are a connected USB hard drive (WAV and FLAC files) and Tidal. The app is pretty basic but sounds really good and I haven’t had any problems with it. If you could fast forward and rewind or it had a better user interface, I’d probably give it 5 stars.";"2021-02-24T14:10:15-07:00";"https://itunes.apple.com/us/review?id=843129434&type=Purple%20Software";"843129434";77;"en";"POSITIVE"
68;3738250146;"J wattsamillion";"https://itunes.apple.com/us/reviews/id209359823";"1.493.170";2;"When it works. Its good";"Heres my problem. I’m using the brand universal remote. It controlled the sound bar value for 2 months. Then the IR wont read. We go back to TV for a month or so and magically one day the IR in sound bar reads again. I replaced 3 remotes and 2 sound bars. Same issue. Works on and off. Only way to control volume is with app all of the time. My kids dont have access to cell phone or tablets. So the blazing TV at 6:30am is not fun. Previous update made it work a bit longer. But in time, stopped reading again.";"2019-02-05T20:38:20-07:00";"https://itunes.apple.com/us/review?id=843129434&type=Purple%20Software";"843129434";103;"en";"NEGATIVE"
69;7640318517;"006 half";"https://itunes.apple.com/us/reviews/id15931263";"1.583.490";1;"Utterly rubbishy app";"This app is just junk. FeaTures appear snd disappear each time I turn on. This app is also linked to the denon app. I got both when I bought a decent $1000 denon amp. When the amp works it’s sublime but mostly when I want to listen to music, I just end up spending time trying to get these two crap apps to do even the simplest things. The most frustrating waste of money ever. I work In Software development abd this app just wasn’t tested at all - junk. Avoid at all costs if you are slightly depressed- it will finish you off.";"2021-07-31T13:59:22-07:00";"https://itunes.apple.com/us/review?id=843129434&type=Purple%20Software";"843129434";104;"en";"NEGATIVE"
70;5651736030;"PianoPusher";"https://itunes.apple.com/us/reviews/id113547102";"1.544.240";2;"Version Blah and 2020";"The app was just updated in 2020 and continues as an afterthought by Denon.  Ugly as ever, dumb navigation, and the inability to remember your last few searches.   

I use it with the HEOS 3 speaker and it allows the speaker to play music.  It will be interesting to see if the new line of products negates the need for this dumb app.... 

Finally as a side note, this is an opportunity to remind ourselves that technology is designed to have a defined useful short life. Support Doesn’t last for even a decade any longer.";"2020-03-12T13:52:19-07:00";"https://itunes.apple.com/us/review?id=843129434&type=Purple%20Software";"843129434";95;"en";"NEGATIVE"
71;5339760329;"Branetraveler";"https://itunes.apple.com/us/reviews/id597625501";"1.520.320";5;"Good Selections";"Morning tradition is to start up the espresso machine and choose a station or album, depending on my mood, to play throughout the house. The fidelity is ok for background music and helps set the background for the day.  The app is easy to use and navigate and I can navigate through Alexa from anywhere in my house.";"2019-12-30T11:04:24-07:00";"https://itunes.apple.com/us/review?id=843129434&type=Purple%20Software";"843129434";58;"en";"POSITIVE"
72;7922195735;"Rugg - Boston";"https://itunes.apple.com/us/reviews/id122085164";"2.1.562";1;"Leaves much to be desired";"This app just leaves a LOT to be desired. I’ve been a HEOS user for a few years now… Denon user for longer. This app has always left pockets of “why can’t it do this??”. Amps and speakers… why do we need a separate app as a Denon remote? Can’t use your phone as an Audessey setup device? Some applications have the amp very far from speakers…

Lately, the basics have been an issue. Combining rooms and playing music that’s stored on my iPhone never seem to work. Honestly…. I wish I had gone Sonos. Growing tired of HEOS lack of functionality";"2021-10-16T13:34:42-07:00";"https://itunes.apple.com/us/review?id=843129434&type=Purple%20Software";"843129434";102;"en";"POSITIVE"
73;7295130374;"Jdog122797";"https://itunes.apple.com/us/reviews/id370194029";"1.583.490";4;"Huge Fan of the HEOS Platform but...";"So I’m a huge fan of the HEOS Platform, I’ve installed it in my 3 of my family’s homes including my own. Each home has between 4 & 8 HEOS devices. 

I’ve been complaining about 1 thing since the first HEOS purchase in 2017... I pay for unlimited Skips on Pandora and the HEOS Application doesn’t honor this feature. 

They claim it’s Pandora’s fault and Pandora claims it’s Denons fault. 

Either way if this issue was resolved it would be the best in home music solution I’ve used. 

D&M Holdings, please get this resolved with Pandora as it affects users and several clients I’ve installed this solution in for work greatly. 

Thanks";"2021-05-03T17:58:18-07:00";"https://itunes.apple.com/us/review?id=843129434&type=Purple%20Software";"843129434";112;"en";"POSITIVE"
74;7874445827;"parot161";"https://itunes.apple.com/us/reviews/id3766996";"2.1.561";2;"Yikes!";"Great app as far as functionality goes (great Airplay 2, can control multiple Marantz units, etc.). But the color scheme of the newest update (updated about September 2021), is horrible!  If you love black and white (lots and lots of white), with a tiny bit of red thrown in, then this update is for you.  Otherwise, please please switch back to the old color scheme.  At least change the all white background to something else.  Then I’ll gladly give it five stars.  Thank you.";"2021-10-03T13:46:52-07:00";"https://itunes.apple.com/us/review?id=843129434&type=Purple%20Software";"843129434";84;"en";"POSITIVE"
75;3939770952;"Roseatrockies";"https://itunes.apple.com/us/reviews/id103627604";"1.493.170";1;"Can’t connect after changed WiFi network";"This speaker sounds amazing when it works.  We have had for years with limited problems until recently I changed our WiFi router and now it will not connect.  The problem is that is has to be on the same network as my phone but the app will not let me update my HEOS network.  Troubleshooting article says simply “go to network” but there is no option on the app under settings to do that.  Please help, we have been without a decent speaker for 3 weeks now and have tried everything.";"2019-03-28T21:39:48-07:00";"https://itunes.apple.com/us/review?id=843129434&type=Purple%20Software";"843129434";91;"en";"POSITIVE"
76;5692808118;"verdun8791";"https://itunes.apple.com/us/reviews/id31064411";"1.544.240";2;"So far, kind of buggy...";"Sounds great when it’a working, but twice in two weeks it just cut off and said it was unable to stream from (insert multiple streaming sources here).  The first time was because of an update that they didn’t warn anyone about - completely screwed my automation server up.  Second time (i.e., currently), it just shut off again.  Internet is working for every other device.  Neither phone app or server will work.  Sigh.";"2020-03-21T10:31:32-07:00";"https://itunes.apple.com/us/review?id=843129434&type=Purple%20Software";"843129434";72;"en";"NEGATIVE"
77;7479914089;"Mesparzame";"https://itunes.apple.com/us/reviews/id114688854";"1.583.490";1;"Heos App";"This has got to be the worst piece of crap app I have ever down loaded. I have two Heos speakers, 3 & 1. I can never get them to be setup via the app. The speakers are of great quality and sound. If only the app get get fixed. I have wasted so much time trying to get the speakers setup. I keep getting “cannot find device” message. 

I tried submitting an issue ticket via their app but even that was a problem… giving me a server error and ticket could not be delivered. They should remove this app from the App Store as it is worthless.";"2021-06-18T15:03:42-07:00";"https://itunes.apple.com/us/review?id=843129434&type=Purple%20Software";"843129434";108;"en";"NEGATIVE"
78;3215329197;"Mr5150";"https://itunes.apple.com/us/reviews/id19473122";"1.466.240";5;"FANTASTIC!";"Works way BETTER than expected. I’m using  it with my Denin in AVR-X 4400 H. I’m not using with Bluetooth at all. Only over Wi-Fi.  I have total control over all four zones in my house. I couldn’t ask for anything more. It’s capable of doing so many things, sometimes I do forget how to access certain components such as surroundsound mode or playlists. But overall 5+";"2018-09-21T17:28:29-07:00";"https://itunes.apple.com/us/review?id=843129434&type=Purple%20Software";"843129434";67;"en";"POSITIVE"
79;7678224126;"ian33333333333333333";"https://itunes.apple.com/us/reviews/id299751200";"1.583.490";3;"Room for growth";"Yes this allows me to turn on my receiver and perform extremely basic music controls. Good start, but no signs of improvement have been made.

This app needs to turn into a virtual remote for our Denon receivers! It would allow much quicker navigation. Trying to rest my HEOS password with the slow Denon remote was BRUTAL, phone control would make everything easier. 

You also must allow for deeper remote integration with smart devices. It’s not enough that I can turn it on and change the volume with voice command. I need to be able to change source and sound settings through voice as well. Please put some more development into this app with great potential!

Thanks,
Ian";"2021-08-10T14:46:24-07:00";"https://itunes.apple.com/us/review?id=843129434&type=Purple%20Software";"843129434";118;"en";"POSITIVE"
80;7874687066;"opera and classical music fan";"https://itunes.apple.com/us/reviews/id968448184";"2.1.561";2;"Updated app has bugs";"The HEOS app was recently upgraded on my iPhone but when i direct it to play an album from my Music folder on the phone it plays only the first track and then won’t play another track until i restart the app.  This was something it did without difficulty before the upgrade. Without this it is impossible to play an opera or album stored on your iPhone and needs to be fixed.";"2021-10-03T15:39:51-07:00";"https://itunes.apple.com/us/review?id=843129434&type=Purple%20Software";"843129434";72;"en";"POSITIVE"
81;7921421331;"Valarin1";"https://itunes.apple.com/us/reviews/id22859934";"2.1.562";1;"Very disappointed";"I have had nothing but problems with this app and my Denon HEOS AVR over the last couple years since I bought it.  Recently I spent several days wiping and reconfiguring everything and it worked perfectly. I even purchased a dedicated 5ghz WAP just for this system which worked flawlessly, but with the latest app/system updates once again the AVR is constantly flaky, rebooting itself, and disconnecting from speakers, and I’ve made no new changes.  I hate this system";"2021-10-16T08:43:08-07:00";"https://itunes.apple.com/us/review?id=843129434&type=Purple%20Software";"843129434";79;"en";"POSITIVE"
82;7863047255;"ashokt";"https://itunes.apple.com/us/reviews/id8444157";"2.1.561";5;"Much improved look!";"As a Denon dealer this refresh helps a lot!  Fixes app appearance complaints and other issues my clients have had when comparing to Sonos and other available options.  Much improved user interface, thank you!";"2021-09-30T14:56:34-07:00";"https://itunes.apple.com/us/review?id=843129434&type=Purple%20Software";"843129434";34;"en";"POSITIVE"
83;2624177936;"wkcienal";"https://itunes.apple.com/us/reviews/id22638966";"1.454.230";4;"HEOS app not bad";"It took some getting used to. But the app has worked well.  Especially once you setup every speaker and download the new firmware for all your devices. Once that was done the app has worked smoothly. Also Denon has updated the app substantially in the past year. It works with each device and has a full set of controls of my Denon receiver. .... which is very nice.";"2018-05-31T18:32:54-07:00";"https://itunes.apple.com/us/review?id=843129434&type=Purple%20Software";"843129434";68;"en";"POSITIVE"
84;2608652155;"slorente85";"https://itunes.apple.com/us/reviews/id282530813";"1.442.220";4;"Minor but Huge Improvements in last release";"The app seems to not stall or temporarily lose connectivity as much in the latest release. Also, now there is a “master” volume for combined zones where it adjusts the volume for all of them relatively...similar to Sonos. The app is getting much better and I think I actually prefer it to Sonos (at least the last version I used).";"2018-05-28T09:42:48-07:00";"https://itunes.apple.com/us/review?id=843129434&type=Purple%20Software";"843129434";60;"en";"POSITIVE"
85;7875030126;"Baseballjk10";"https://itunes.apple.com/us/reviews/id4790891";"2.1.561";4;"Update issue";"I am also having issues using HEOS with my Denon receiver.  When I stream music through my iTunes through the app the second I start doing something else HEOS stops the streaming music.  Never did it before but now that it’s updated I can’t get through a full song with it stopping.";"2021-10-03T18:14:58-07:00";"https://itunes.apple.com/us/review?id=843129434&type=Purple%20Software";"843129434";52;"en";"NEGATIVE"
