"";"id";"userName";"userUrl";"version";"score";"title";"text";"updated";"url";"app";"wordCount";"language";"sentiment"
333;5762804685;"Carpenter Carl";"https://itunes.apple.com/us/reviews/id386777470";"1.544.240";4;"Enjoy it!";"I really like the way that the song are grouped by genre. They do a good job with that!";"2020-04-04T12:53:48-07:00";"https://itunes.apple.com/us/review?id=843129434&type=Purple%20Software";"843129434";19;"en";"POSITIVE"
334;5664550172;"Henry Sewell";"https://itunes.apple.com/us/reviews/id40535205";"1.544.240";1;"Stopped working";"This suddenly would not let access streaming sites this am.   Now it will not let me log back in.   No guidance on the web site.   They need to fix this ASAP";"2020-03-15T08:30:16-07:00";"https://itunes.apple.com/us/review?id=843129434&type=Purple%20Software";"843129434";31;"en";"NEGATIVE"
336;4467441719;"KrisCo34321";"https://itunes.apple.com/us/reviews/id138185541";"1.505.130";1;"AVRX6500H Streaming interruption";"On a service like Sirius XM the stream will stop and I must exit HEOS and return to start streaming again.  This is unacceptable even if there is an internet interruption undetectable by all other devices.  The software should be smart enough to resume the stream. Ridiculous!";"2019-07-15T17:07:31-07:00";"https://itunes.apple.com/us/review?id=843129434&type=Purple%20Software";"843129434";47;"en";"NEGATIVE"
337;3944582799;"WendysFrostyCarlos";"https://itunes.apple.com/us/reviews/id8554845";"1.493.170";5;"The HEOS app works like a charm!";"Follow the instructions provided and everything works like it should.";"2019-03-29T21:21:51-07:00";"https://itunes.apple.com/us/review?id=843129434&type=Purple%20Software";"843129434";10;"en";"POSITIVE"
338;2941456504;"Bellorusha";"https://itunes.apple.com/us/reviews/id42424956";"1.454.280";5;"All fixed.";"Good job. Finally volume is fixed";"2018-07-20T16:12:00-07:00";"https://itunes.apple.com/us/review?id=843129434&type=Purple%20Software";"843129434";6;"en";"POSITIVE"
339;7816023867;"Timberscotch";"https://itunes.apple.com/us/reviews/id213896997";"1.583.490";1;"Bad";"Heos just stops communicating every couple days.  Amp is wired to network.  No error, no nothing, have to do a restart every couple days.  Please fix this app, Marantz has a status rating that is declining due to this app.";"2021-09-17T09:10:39-07:00";"https://itunes.apple.com/us/review?id=843129434&type=Purple%20Software";"843129434";40;"en";"POSITIVE"
340;5673387339;"MAF iOS";"https://itunes.apple.com/us/reviews/id1145300557";"1.544.240";1;"Latest update broke device grouping";"Grouping HEOS devices allows them all to play the same thing. The latest update ungrouped all of my rooms and any attempt to regroup them with the Marantz SR-7011 results in a “Rooms could not be grouped” error.";"2020-03-17T08:58:26-07:00";"https://itunes.apple.com/us/review?id=843129434&type=Purple%20Software";"843129434";38;"en";"POSITIVE"
341;2804646436;"butc0023";"https://itunes.apple.com/us/reviews/id575353462";"1.454.230";1;"Terrible app";"Agree with others that this app is horrendous. Difficult to pair devices, and once you do it randomly stops working and you have to repair. Would not have purchased Denon speakers had I know how terrible this product would be.";"2018-06-30T07:10:31-07:00";"https://itunes.apple.com/us/review?id=843129434&type=Purple%20Software";"843129434";40;"en";"NEGATIVE"
342;1926651611;"Dennis 215";"https://itunes.apple.com/us/reviews/id31537614";"1.421.150";1;"Don’t even bother";"This is the worst app in the history of apps. For an app to control an amp with only a volume control this is so lacking it is laughable. Yes there are a bass and treble slider but that’s about it. You can change inputs but try renaming them. No room eq sweep? Or even a power toggle. I sent my HEOS AVR and speakers back.";"2017-11-16T20:03:54-07:00";"https://itunes.apple.com/us/review?id=843129434&type=Purple%20Software";"843129434";66;"en";"NEGATIVE"
343;8120487936;"dl-reviews";"https://itunes.apple.com/us/reviews/id245958421";"2.1.680";1;"Will not connect to wifi";"Loved this app when it worked. Unfortunately it will no longer connect to our wifi. Very sad.";"2021-12-11T17:29:08-07:00";"https://itunes.apple.com/us/review?id=843129434&type=Purple%20Software";"843129434";17;"en";"NEGATIVE"
344;7899566155;"Stop spam calls";"https://itunes.apple.com/us/reviews/id656919904";"2.1.561";1;"App is crap";"The audio hardware produces some of the best sound that I’ve ever heard. 
The app constantly crashes and you’re lucky to hear two songs in a row from an album. 
By somebody else’s system; not Heos.";"2021-10-10T08:55:13-07:00";"https://itunes.apple.com/us/review?id=843129434&type=Purple%20Software";"843129434";36;"en";"POSITIVE"
345;7461694939;"sohyco";"https://itunes.apple.com/us/reviews/id28379467";"1.583.490";2;"Stability issues";"Seems to crash or not even connect a lot.";"2021-06-13T16:19:50-07:00";"https://itunes.apple.com/us/review?id=843129434&type=Purple%20Software";"843129434";9;"en";"NEGATIVE"
346;5693285425;"Rt128";"https://itunes.apple.com/us/reviews/id39519614";"1.544.240";1;"This app ruins HEOS products";"This app is terrible - it crashes the heos system all the time seemingly randomly and after a year has not gotten any better. This ruins the whole heos product experience and demon should be ashamed.";"2020-03-21T12:51:45-07:00";"https://itunes.apple.com/us/review?id=843129434&type=Purple%20Software";"843129434";36;"en";"NEGATIVE"
347;8062247963;"No to Heos";"https://itunes.apple.com/us/reviews/id104114378";"2.1.680";1;"Buggy extremely frustrating.";"Devices are quality but software is so bad it defies description.  One star only because no lower score";"2021-11-25T09:06:15-07:00";"https://itunes.apple.com/us/review?id=843129434&type=Purple%20Software";"843129434";18;"en";"NEGATIVE"
348;7882405930;"Cmmiles";"https://itunes.apple.com/us/reviews/id222496000";"2.1.561";5;"Works Great. As it should";"The latest update is slick. Love using using my Denon AVR.";"2021-10-05T16:24:04-07:00";"https://itunes.apple.com/us/review?id=843129434&type=Purple%20Software";"843129434";11;"en";"POSITIVE"
349;5934101384;"485Gman";"https://itunes.apple.com/us/reviews/id400527741";"1.544.240";2;"App keeps loosing connection";"App keeps loosing connection and have to constantly keep manually reconnecting it. Very poor especially for a $2000 system!";"2020-05-11T20:10:26-07:00";"https://itunes.apple.com/us/review?id=843129434&type=Purple%20Software";"843129434";19;"en";"NEGATIVE"
350;8109649266;"Bdjskofhzhxhz";"https://itunes.apple.com/us/reviews/id555512887";"2.1.680";4;"Works great";"But app seems to interfere with incoming phone calls.";"2021-12-08T16:02:22-07:00";"https://itunes.apple.com/us/review?id=843129434&type=Purple%20Software";"843129434";9;"en";"NEUTRAL"
351;5633958559;"Mik Reklaw";"https://itunes.apple.com/us/reviews/id184458384";"1.544.150";3;"When it works . . .";"When it works, it’s great. Sometimes it fails to load.";"2020-03-08T12:14:53-07:00";"https://itunes.apple.com/us/review?id=843129434&type=Purple%20Software";"843129434";10;"en";"POSITIVE"
352;4310922166;"Lib25geo";"https://itunes.apple.com/us/reviews/id274123134";"1.505.130";2;"App updates awful";"When it works it’s great, but with every update I have to set the thing up again.  Why, I haven’t had to do that for five years on other apps!";"2019-06-13T12:56:47-07:00";"https://itunes.apple.com/us/review?id=843129434&type=Purple%20Software";"843129434";30;"en";"POSITIVE"
353;2509655338;"Love2RunNBike";"https://itunes.apple.com/us/reviews/id37998714";"1.442.220";1;"Sound quality great; app not. Consider Sonos.";"Sound quality is good. App is hard to navigate - they need clearer bottom row icons for what does what.  I like the sound quality and range of speakers better than Sonos but if Denon doesn’t figure out the app I may trade my stuff in.";"2018-05-05T16:41:06-07:00";"https://itunes.apple.com/us/review?id=843129434&type=Purple%20Software";"843129434";46;"en";"POSITIVE"
354;1940885341;"Meli Mel Mel";"https://itunes.apple.com/us/reviews/id265826080";"1.430.160";1;"App Keeps Crashing";"The app will not stay open and continues to crash and close out. Unable to play music or load up the speakers on the app. I believe with the recent software update, it doesn’t seem to be compatible with the HEOS app. Please update.";"2017-11-22T12:05:43-07:00";"https://itunes.apple.com/us/review?id=843129434&type=Purple%20Software";"843129434";44;"en";"POSITIVE"
355;8044417570;"Boomer8965";"https://itunes.apple.com/us/reviews/id30362579";"2.1.680";4;"Nicely designed but…";"It takes a awhile to learn its ins and outs.";"2021-11-20T07:46:51-07:00";"https://itunes.apple.com/us/review?id=843129434&type=Purple%20Software";"843129434";10;"en";"NEUTRAL"
356;5664906899;"JItri";"https://itunes.apple.com/us/reviews/id31440552";"1.544.240";1;"Latest update broke the app";"None of our devices connect or can play music to this $4000+ system after the latest update, fix it!!!";"2020-03-15T10:16:28-07:00";"https://itunes.apple.com/us/review?id=843129434&type=Purple%20Software";"843129434";19;"en";"POSITIVE"
357;5353963212;"B Spoon";"https://itunes.apple.com/us/reviews/id379487008";"1.520.320";5;"Great App";"Multi purpose app for music, podcast, workouts etc.  I love it!";"2020-01-02T21:36:01-07:00";"https://itunes.apple.com/us/review?id=843129434&type=Purple%20Software";"843129434";11;"en";"POSITIVE"
358;3256107293;"bgvfdty";"https://itunes.apple.com/us/reviews/id37008263";"1.466.240";2;"So so";"Always have to reconnect, sometimes it recognizes my devices and sometimes it doesn’t. Overall kind of a pain and frustrating.";"2018-10-02T10:03:26-07:00";"https://itunes.apple.com/us/review?id=843129434&type=Purple%20Software";"843129434";20;"en";"NEGATIVE"
359;2914232121;"GuyDewald";"https://itunes.apple.com/us/reviews/id792663933";"1.454.280";1;"God awful";"These are top of the line speakers and very expensive...but the app is so awful that it makes the whole process so infuriating that I can barely stand to even write this review. If I could return these speakers I would avoid at all costs.";"2018-07-15T16:18:06-07:00";"https://itunes.apple.com/us/review?id=843129434&type=Purple%20Software";"843129434";45;"en";"NEGATIVE"
360;2828834518;"extrafurious";"https://itunes.apple.com/us/reviews/id168173825";"1.454.280";1;"Worst app ever";"After fighting with this app for over a year, I am so close to throwing away everything Denon or HEOS that I own. How can a serious audio manufacturer ignore such fundamental issues with the interface? They aren’t paying attention or simply don’t care.";"2018-07-03T09:16:34-07:00";"https://itunes.apple.com/us/review?id=843129434&type=Purple%20Software";"843129434";44;"en";"NEGATIVE"
361;2288326224;"Studio45Music";"https://itunes.apple.com/us/reviews/id42738948";"1.442.220";1;"Useless";"I’m unable to get the app to work anymore, it crashes every time I try to use it, I have yet to be able to stream Apple Music, and I cannot connect to my local Wi-Fi network to stream music from my phone now... useless";"2018-03-09T11:12:14-07:00";"https://itunes.apple.com/us/review?id=843129434&type=Purple%20Software";"843129434";45;"en";"NEGATIVE"
362;1976503666;"The IdolM@aster";"https://itunes.apple.com/us/reviews/id7505841";"1.430.160";1;"Horrible app-fire the designers!";"I just want to enable echo control but to do that i need a heos account. But to get an account i need to use this app. But to get to settings in the app to make an account i have to register a heos device i dont want/need to use with this app. Total crap.";"2017-12-06T20:18:12-07:00";"https://itunes.apple.com/us/review?id=843129434&type=Purple%20Software";"843129434";56;"en";"NEGATIVE"
363;8086989914;"no more nicknames all taken";"https://itunes.apple.com/us/reviews/id337995095";"2.1.680";1;"Volume control is awful.";"Going from 0 to 1 might as well be 0 to 7.  Also half the time I turn on the volume jumps to 30 and blares. This system stinks";"2021-12-02T06:00:39-07:00";"https://itunes.apple.com/us/review?id=843129434&type=Purple%20Software";"843129434";29;"en";"NEUTRAL"
364;5268713227;"Mnichols70";"https://itunes.apple.com/us/reviews/id21279664";"1.520.320";1;"Needs Major Redesign";"Unfortunately this app looks like it was hacked in just a couple weeks.  Solid apps should begin by defining requirements understand their systems they’re integrating with.  Such a great opportunity lost.";"2019-12-13T11:46:30-07:00";"https://itunes.apple.com/us/review?id=843129434&type=Purple%20Software";"843129434";31;"en";"POSITIVE"
365;4058564535;"23island";"https://itunes.apple.com/us/reviews/id16389662";"1.505.130";2;"Good speakers with a a clunky app";"Love the sound of these speakers, the app is terrible in my opinion. I can’t even skip forward or back when listening to podcasts.";"2019-04-25T07:19:31-07:00";"https://itunes.apple.com/us/review?id=843129434&type=Purple%20Software";"843129434";24;"en";"POSITIVE"
366;3725740809;"HestiaZ";"https://itunes.apple.com/us/reviews/id344074859";"1.481.160";3;"The worst app";"Doesn’t work ok!!!!!
Can not connect WiFi sometime but have to use the internet cable to connect my router and Heos...

Improve your app and firmware!";"2019-02-02T12:47:46-07:00";"https://itunes.apple.com/us/review?id=843129434&type=Purple%20Software";"843129434";26;"en";"POSITIVE"
367;2319701223;"Ryan0662";"https://itunes.apple.com/us/reviews/id38455482";"1.442.220";2;"Disappointed";"Not easy to use. Doesn’t seem to support Pandora Premium which is extremely annoying. Clunky with two identical Denon HEOS receivers in the house. Expected more from Denon.";"2018-03-18T07:10:08-07:00";"https://itunes.apple.com/us/review?id=843129434&type=Purple%20Software";"843129434";28;"en";"NEGATIVE"
368;1893075823;"Desperate4thisapp";"https://itunes.apple.com/us/reviews/id137168610";"1.421.150";3;"Airplay Shuffle!";"This app is not without its cons!

The “This Phone” AirPlay music player can’t seem to shuffle past my A-B songs. Fix this!

Can’t search songs in Prime Music!";"2017-11-02T16:39:36-07:00";"https://itunes.apple.com/us/review?id=843129434&type=Purple%20Software";"843129434";29;"en";"NEUTRAL"
369;8122467403;"Fhampsten";"https://itunes.apple.com/us/reviews/id23399546";"2.1.680";3;"Needs Apple";"If this could work with Apple Music it would be 5 stars";"2021-12-12T06:21:27-07:00";"https://itunes.apple.com/us/review?id=843129434&type=Purple%20Software";"843129434";12;"en";"NEUTRAL"
370;7898968286;"Cycle2slow";"https://itunes.apple.com/us/reviews/id30341775";"2.1.561";1;"Update is horrible";"New update will not play Apple Music from IPhone. Can not join speakers over airplay, absolutely useless. Can not recommend using Denon for wireless speakers if you use an iPhone.";"2021-10-10T05:50:21-07:00";"https://itunes.apple.com/us/review?id=843129434&type=Purple%20Software";"843129434";30;"en";"NEGATIVE"
371;4521939075;"moo moo mooooooooo";"https://itunes.apple.com/us/reviews/id561436741";"1.505.130";1;"can’t connect to apple music";"Overall all i’ve had is a bad experience. The device will not connect to apple music which it what I use to listen to music. Would rate zero stars if it was an option.";"2019-07-26T13:54:37-07:00";"https://itunes.apple.com/us/review?id=843129434&type=Purple%20Software";"843129434";34;"en";"NEGATIVE"
372;2708058680;"Catbash";"https://itunes.apple.com/us/reviews/id39792353";"1.454.230";1;"Junk";"What a hunk of junk! I did the app update and speaker update! Now I have no the speaker doesn’t work! I can’t even usb in! Denon you would figure that with as much as people pay for your speakers. You would atleast keep a good update and app! Neither here.....";"2018-06-16T15:26:52-07:00";"https://itunes.apple.com/us/review?id=843129434&type=Purple%20Software";"843129434";51;"en";"POSITIVE"
373;2083159708;"FGDCGroup";"https://itunes.apple.com/us/reviews/id19721481";"1.430.180";3;"Pandora Premium features";"Please enhance app so I can play my playlist vs just station from pandora. Should be a simple enhancement.  

Thanks.";"2018-01-12T16:32:12-07:00";"https://itunes.apple.com/us/review?id=843129434&type=Purple%20Software";"843129434";20;"en";"POSITIVE"
374;5250297144;"Maximooooochicago";"https://itunes.apple.com/us/reviews/id195432258";"1.520.320";4;"Almost happy";"Why doesn’t work with iTunes????  That’s BS";"2019-12-08T16:31:45-07:00";"https://itunes.apple.com/us/review?id=843129434&type=Purple%20Software";"843129434";7;"en";"NEUTRAL"
375;5250769507;"kcbark1";"https://itunes.apple.com/us/reviews/id287095134";"1.520.320";5;"Sounds great with Klipsch RP 9.2.2 Denon";"Easy control.  Seamless to work with.  Auro 3D setting sounds great.";"2019-12-08T19:47:33-07:00";"https://itunes.apple.com/us/review?id=843129434&type=Purple%20Software";"843129434";11;"en";"POSITIVE"
376;3734254117;"Capitán Ron";"https://itunes.apple.com/us/reviews/id35138325";"1.481.160";2;"Receiver reset";"While running this app I have had to reset receiver to get back to other functions. Regular remote doesn’t even work until reset.";"2019-02-04T17:37:03-07:00";"https://itunes.apple.com/us/review?id=843129434&type=Purple%20Software";"843129434";23;"en";"NEUTRAL"
377;2365100047;"Heavy user 59";"https://itunes.apple.com/us/reviews/id7386451";"1.442.220";1;"Worst app and WORST customer (lack of) service";"If you have a problem they can arrange a call between Tuesday and Friday during a 4 hour block of time.  Seriously?

App continuously crashes.  This makes the speakers expensive paper weights.";"2018-03-30T15:20:55-07:00";"https://itunes.apple.com/us/review?id=843129434&type=Purple%20Software";"843129434";32;"en";"NEGATIVE"
378;7948660980;"John__B_B";"https://itunes.apple.com/us/reviews/id288290695";"2.1.562";1;"Doesn’t work with Alexa";"Despite the supposed Alexa integration, the app will not work with my Denon AVR-S750. Get “unable to play music” over and over, handing the app and the receiver. 

Denon should be ashamed of themselves. You sell a receiver that supposedly works with Alexa and it simply doesn’t. 

Get this fixed, because the Alexa integration is useless. 

Did any engineer at Denon try this? If you did, why did you release this garbage app?";"2021-10-24T04:45:38-07:00";"https://itunes.apple.com/us/review?id=843129434&type=Purple%20Software";"843129434";73;"en";"NEGATIVE"
379;7402514609;"fnghnjkggjm";"https://itunes.apple.com/us/reviews/id643714339";"1.583.490";1;"Horrible";"Never connects. Have to reset the system and each individual system about every week.  Don’t waste your money.";"2021-05-29T07:40:14-07:00";"https://itunes.apple.com/us/review?id=843129434&type=Purple%20Software";"843129434";18;"en";"NEGATIVE"
381;3736273129;"WhatBart";"https://itunes.apple.com/us/reviews/id230803085";"1.481.160";2;"Unresponsive";"This app is awful.  It gets stuck in any programming routine that is required.  I have had to delete and reload multiple times.  Demon needs to redo this pile of junk.";"2019-02-05T06:50:52-07:00";"https://itunes.apple.com/us/review?id=843129434&type=Purple%20Software";"843129434";31;"en";"NEGATIVE"
382;3596626375;"JaceMace";"https://itunes.apple.com/us/reviews/id157154220";"1.481.160";1;"Always losing connection";"I’m not sure I can add more to what others have already said. The app continues to lose connection with my receiver no matter how far or close I am to it. It’s very spotty. This app needs to be updated.";"2018-12-31T10:58:40-07:00";"https://itunes.apple.com/us/review?id=843129434&type=Purple%20Software";"843129434";41;"en";"NEGATIVE"
383;5580309663;"mrls2787";"https://itunes.apple.com/us/reviews/id1138216293";"1.544.150";1;"Not working";"I been trying to make it work but it’s stock on Pandora on 1 station and it’s not even playing anything can somebody help me to fix this thanks";"2020-02-25T15:33:23-07:00";"https://itunes.apple.com/us/review?id=843129434&type=Purple%20Software";"843129434";29;"en";"POSITIVE"
385;5074988908;"thyfudubdh";"https://itunes.apple.com/us/reviews/id123893560";"1.520.200";1;"Upgrade now";"Honestly one of the worst apps I’ve ever used. How is is it not possible to control your WiFi connection through the app?  Fix please, this is ridicules.";"2019-11-02T17:40:40-07:00";"https://itunes.apple.com/us/review?id=843129434&type=Purple%20Software";"843129434";28;"en";"NEGATIVE"
386;8134674414;"Juwce";"https://itunes.apple.com/us/reviews/id100579898";"2.1.680";3;"Randomly logs me out";"Randomly freezes and logs me out of all my accounts";"2021-12-15T19:22:43-07:00";"https://itunes.apple.com/us/review?id=843129434&type=Purple%20Software";"843129434";10;"en";"NEUTRAL"
387;6472547215;"Tigerdizzy";"https://itunes.apple.com/us/reviews/id102046319";"1.562.280";2;"App keeps crashing. iPhone 11.";"Can’t keep the app open for more than a couple min. Also, doesn’t support Apple Music.";"2020-09-26T19:02:03-07:00";"https://itunes.apple.com/us/review?id=843129434&type=Purple%20Software";"843129434";16;"en";"POSITIVE"
388;3741742476;"Gilforeman";"https://itunes.apple.com/us/reviews/id132758812";"1.493.170";3;"Alarm clock feature";"Surely adding an alarm clock feature and sleep timer isn't a stretch. Please do so.";"2019-02-06T20:11:33-07:00";"https://itunes.apple.com/us/review?id=843129434&type=Purple%20Software";"843129434";15;"en";"NEGATIVE"
389;2023533633;"BDSouthAustin";"https://itunes.apple.com/us/reviews/id483917390";"1.430.180";2;"New Version Crashes";"It appears after the latest update, I can’t even get the ap to load. It just crashes. Very frustrating! Great speaker, garbage ap.";"2017-12-24T06:47:25-07:00";"https://itunes.apple.com/us/review?id=843129434&type=Purple%20Software";"843129434";23;"en";"POSITIVE"
390;3026978008;"MUVWUN";"https://itunes.apple.com/us/reviews/id181582401";"1.454.280";1;"Constant crashing";"Software constantly crashing in iOS, it’s unusable!

Also, how can I have no network connection in my Matantz receiver but the connection diagnostic says connection OK

The hardware sounds great but the software is regrettably terrible.";"2018-08-06T12:02:01-07:00";"https://itunes.apple.com/us/review?id=843129434&type=Purple%20Software";"843129434";36;"en";"POSITIVE"
391;1868032327;"Kali1906";"https://itunes.apple.com/us/reviews/id121201944";"1.421.150";2;"Not good";"The app is good when working... which is not often. Crashes frequently and may not start at all at times. Do better Denon.";"2017-10-22T18:44:13-07:00";"https://itunes.apple.com/us/review?id=843129434&type=Purple%20Software";"843129434";23;"en";"POSITIVE"
392;7573044988;"SA7700";"https://itunes.apple.com/us/reviews/id149823008";"1.583.490";1;"Amazed";"Amazed and confused how this equipment and app get such good reviews. My finding is that this app and heos speakers are unreliable at best. Continually disconnects and is spotty.  EVERY other electronic app and elec. devise in the house works as advertised accept these.  Lots of disappointment with Heos.";"2021-07-13T14:05:26-07:00";"https://itunes.apple.com/us/review?id=843129434&type=Purple%20Software";"843129434";50;"en";"POSITIVE"
393;7051437000;"feverish";"https://itunes.apple.com/us/reviews/id28772518";"1.583.490";1;"Doesn’t work with Denon AVR receiver";"New receiver, upon set up, all the app says to do is read the manual, which only tells you to download the app and follow the setup instructions. Huge disappointment.";"2021-02-28T21:14:27-07:00";"https://itunes.apple.com/us/review?id=843129434&type=Purple%20Software";"843129434";30;"en";"NEGATIVE"
394;3956348497;"miss-u-heos";"https://itunes.apple.com/us/reviews/id997851495";"1.493.170";1;"No longer works with my Denon AVR4300";"Used to work and I loved it. This latest version no longer finds my Denon AVR4300.  Doesn’t even go into a searching mode. Please release a version that still supports my device.";"2019-04-01T09:26:50-07:00";"https://itunes.apple.com/us/review?id=843129434&type=Purple%20Software";"843129434";32;"en";"POSITIVE"
395;3829741980;"Catamount1980";"https://itunes.apple.com/us/reviews/id31262770";"1.493.170";1;"The App blows";"The speakers are awesome but are difficult to pair - and won’t with iTunes- so the most popular phone and music are not available to play unless you buy them and then play. 

Thanks to blue tooth they are used 24-7";"2019-03-01T13:30:20-07:00";"https://itunes.apple.com/us/review?id=843129434&type=Purple%20Software";"843129434";41;"en";"POSITIVE"
396;3213440559;"Matt987654321hdjddjxdbd";"https://itunes.apple.com/us/reviews/id240128542";"1.466.240";1;"Crash";"The latest version crashes every time I use it.  I even deleted it and downloaded it again and I can’t make it past the setup now button press.  Do they have any QA at all?";"2018-09-21T05:25:17-07:00";"https://itunes.apple.com/us/review?id=843129434&type=Purple%20Software";"843129434";35;"en";"NEUTRAL"
397;2264261988;"Red bull racing #1";"https://itunes.apple.com/us/reviews/id287870996";"1.442.220";1;"No Marantz support";"Used to work with my 2k Marantz av receiver but not anymore. Asking me to connect a cable from my iPad to the back of my heos device.  Really it’s 1983 all of a sudden?! can’t set this up over Wi-Fi? Was gonna get the heos amp for my speakers in the kitchen but not anymore";"2018-03-02T15:16:32-07:00";"https://itunes.apple.com/us/review?id=843129434&type=Purple%20Software";"843129434";56;"en";"NEUTRAL"
398;8039801507;"DrSchuster";"https://itunes.apple.com/us/reviews/id31255408";"2.1.680";1;"Won’t play music";"It had issues before the last update but now I can’t get it to play at all";"2021-11-19T02:29:00-07:00";"https://itunes.apple.com/us/review?id=843129434&type=Purple%20Software";"843129434";17;"en";"POSITIVE"
