"";"id";"userName";"userUrl";"version";"score";"title";"text";"updated";"url";"app";"wordCount";"language";"sentiment"
51;1249703303;"::MD::";"https://itunes.apple.com/us/reviews/id360802324";"3.1.9";4;"Botton position";"I add a IR remote but I can't change the botton position's.";"2015-08-28T04:14:47-07:00";"https://itunes.apple.com/us/review?id=859140969&type=Purple%20Software";"859140969";12;"en";"NEUTRAL"
52;1165975044;"Orbosphere";"https://itunes.apple.com/us/reviews/id16072175";"3.1.4";3;"works, but instructions are poor";"difficult to get everything configured, but works well once it is set up";"2015-03-09T21:17:41-07:00";"https://itunes.apple.com/us/review?id=859140969&type=Purple%20Software";"859140969";13;"en";"POSITIVE"
53;1260506265;"Vish46";"https://itunes.apple.com/us/reviews/id435118557";"3.1.9";1;"Unable to configure. Useless app";"No use .... App not even connecting to internet. I am returning your product please update the app to support iPhone 6 with lOS 9";"2015-09-20T18:29:20-07:00";"https://itunes.apple.com/us/review?id=859140969&type=Purple%20Software";"859140969";25;"en";"POSITIVE"
54;1199885987;"HokieFan#1";"https://itunes.apple.com/us/reviews/id241549895";"3.1.8";1;"Can't configure to S20";"This bug fix still doesn't fix the configuration bug";"2015-05-19T20:25:10-07:00";"https://itunes.apple.com/us/review?id=859140969&type=Purple%20Software";"859140969";9;"en";"NEUTRAL"
56;1146306428;"Jensá";"https://itunes.apple.com/us/reviews/id142689492";"3.1.4";4;"Widget plez";"Please make a widget for this!";"2015-02-12T09:27:03-07:00";"https://itunes.apple.com/us/review?id=859140969&type=Purple%20Software";"859140969";6;"en";"POSITIVE"
57;1463175008;"Ohyayer";"https://itunes.apple.com/us/reviews/id151128204";"3.3";1;"Please fix app";"I was about to return this since there was no app support but then the app magically appeared at the app store and now the timer function as well as the device location is not working properly.  I dont understand why they still sell this if the app is malfunctioning.  Please fix the problems or i will file a complaint at amazon for selling defective products.";"2016-10-08T05:31:55-07:00";"https://itunes.apple.com/us/review?id=859140969&type=Purple%20Software";"859140969";66;"en";"NEGATIVE"
59;1321201442;"Mar??????";"https://itunes.apple.com/us/reviews/id41051798";"3.3";4;"Good Overall- has improved a lot since March 2015";"I have over 28 Orvibo wifi sockets in my home, and office. This app controls all of them on one app and with multiple phones. 

I first used this app in March 2015. There was very little directions, as most was written in Chinese. After playing around with the different functions, I have uncovered how to use most all of the advanced functions, and the basic functions. Now (1/2016) they have made many improvements to the app, and to the instructions.  

The biggest help I uncovered was that you need to be sure your Router /modem allow as many WIFI connections as you have devices, meaning, if you have 3 wifi laptops, and 3 smartphones, and add 5 wifi sockets,  you need to have a router/modem that allows 11 wifi devices to connect to it... Or you will get frustrated when the time comes that you want to use all your devices!!  Something will be left looking for a slot to connect, if your router/modem only allows for 10 devices (as most devices from your internet service providers allow either 5 or 10 devices max to connect!! 

The next thing is to be sure your phone/iPad is connected to the same wifi as your Orvibo/wiwo app and devices were set up on!! Other wise, you will get a frustrating notice saying you must be on local network, OR your devices are not online.

If you have a good router/modem, and follow the above suggestions, these wifi sockets are the best thing since the invention of chocolate!! 

The app has improved, and you have to trust that the updates are necessary, because most updates are described in Chinese. Since I can't read Chinese, I don't know what improvements they are making, but ultimately they have improved the effectiveness of the app or the devices. 

I love these devices, and rely on them to help increase my energy savings and security. I can turn off any lights not needed from anywhere.  I have a teenager, so that is important.";"2016-01-23T11:54:42-07:00";"https://itunes.apple.com/us/review?id=859140969&type=Purple%20Software";"859140969";337;"en";"POSITIVE"
