"";"id";"userName";"userUrl";"version";"score";"title";"text";"updated";"url";"app";"wordCount";"language";"sentiment"
0;1424583392;"Ram RS";"https://itunes.apple.com/us/reviews/id475474976";"3.3";2;"Problem with this version: doesn't work";"This software has never been worthy of a 5 star rating, but it does what it is supposed to do, albeit with glitches. 

But now, it no longer does its job either. It does not allow any device to be controlled if you're not connected to the same Wi-Fi network. This is bad, because that's the ONE thing this app and the Wi-Fi switch are supposed to do.";"2016-08-01T16:29:20-07:00";"https://itunes.apple.com/us/review?id=859140969&type=Purple%20Software";"859140969";68;"en";"NEGATIVE"
1;1299033634;"Aeromistle";"https://itunes.apple.com/us/reviews/id149776131";"3.3";1;"The app needs major improvements!!";"The device works alright, both locally and remotely. But the app is freaking stupidly designed by someone who lives in 90s Nokia time. Adding a routinely schedule is exhaustingly hard. 1) The number dial looks like iOS dial but does not support inertia scrolling. Meaning it moves 3 steps max when you try to set it from 00 to 30. You need to do this 3 times for the hour, the minute and the second. 
And 2) annoyingly, you are not allowed to set up a duration! Instead you have to set an ""on"" action first and then a separate ""off"" action!!! For every single freaking schedule! 
Worse, 3) you are not allowed to copy and paste schedules, so meaningless repetitive works is the only way to go.
It's apparent that the company knew nothing about usability. They don't even care to use apple's ready-made components to make a no-brained timer app. In conclusion, this app is big disgrace and it ruins an otherwise great product.";"2015-12-11T05:01:35-07:00";"https://itunes.apple.com/us/review?id=859140969&type=Purple%20Software";"859140969";166;"en";"NEGATIVE"
2;1703028924;"Joyryde";"https://itunes.apple.com/us/reviews/id43759971";"3.3";5;"The other reviews are fake.";"I own multiple homes and have a half-dozen Belkin Wemo devises in one of them. I bought a bunch of them for a second home only to find out that Wemo never invented any way to use them in more than one home, so the Wemo app cannot control any of my lights in my second home. 

To resolve this issue, I replaced them all with these Wiwo switches. The setup was dramatically easier, and faster. The responsiveness of this app is 10 times faster than the Wemo app, and this app has worked flawlessly since day one for me. I can turn my lights on and off whether I am on WIFI or my regular cell service. 

The other reviews are clearly fake because while writing this, I turned off my WIFI and switched the light in the other room on and off six times. Their response is instant. FAR FAR faster than the Wemo devices in my other home. 

Not to mention, the WIWO products are HALF the price as the Wemo and they look better and are smaller!";"2017-07-28T23:40:13-07:00";"https://itunes.apple.com/us/review?id=859140969&type=Purple%20Software";"859140969";181;"en";"POSITIVE"
3;1533225872;"Non-Factor";"https://itunes.apple.com/us/reviews/id24044017";"3.3";3;"Could use some updates";"The app works pretty well, responsive 90% of the time. Sometimes I have to unplug the device before it will turn on after switching it on on the app. My biggest request for change is they should add an Apple Watch component. It would be much more convenient if I could turn on my lights from my watch than only from my phone. Sometimes I don't always have my phone. 

Also, they should utilize the pressure touch component of the newer iPhones. It would be nice if you could turn on/off lights quickly from the app icon instead of having to open it";"2017-01-29T16:55:47-07:00";"https://itunes.apple.com/us/review?id=859140969&type=Purple%20Software";"859140969";103;"en";"POSITIVE"
4;1397822462;"Dr. Kool Aid";"https://itunes.apple.com/us/reviews/id26503521";"3.3";4;"It works but...";"It does work for me but it has a big flaw in the software that could be easily fixed.

When you open the app it displays the last known status as the current status which is often misleading as I have timers to turn off at regular times.  So it shows on when it's off.  Then if you toggle it, there is no way to know the status.

They should change it to show a question mark for the status or yellow until it does a current status check and then update the display.";"2016-06-20T21:20:13-07:00";"https://itunes.apple.com/us/review?id=859140969&type=Purple%20Software";"859140969";94;"en";"NEGATIVE"
5;1486739176;"This is a load of crock";"https://itunes.apple.com/us/reviews/id3754181";"3.3";1;"How is this still not fixed???";"I have had this app and your smart outlet for over a year. And still you haven't fixed the time. How on earth do you have a product that people specifically buy in order to set timers for when to turn something on or off, and you always are at least one hour off, regardless of the daylight savings time setting.  This is ridiculous. You can't just use the time that is on the phone? Or you don't know how daylight savings works? Or you have the time zones wrong? And in this whole time I have had your app, you have NEVER HAD AN UPDATE!!! 
Come on. How are you not embarrassed that you haven't made such a simple, basic fix? 
What a disappointment.";"2016-11-18T07:18:01-07:00";"https://itunes.apple.com/us/review?id=859140969&type=Purple%20Software";"859140969";125;"en";"NEGATIVE"
6;1349968329;"NeOApollo";"https://itunes.apple.com/us/reviews/id239333104";"3.3";4;"Works pretty well, minor problems";"The time sync seems has a little bit problem when we start using light saving time in March. No matter how I trying to sync it it's still delay the operation for 1hr. Except that, the app is working pretty well. I don't know why some of people are trying to give out a so bias rating score, criticizing about scrolling issue and others. So narrow minded and ignorant. I have no complain with that, it's simple, easy and intuitive without fancy appearance.";"2016-03-18T20:53:20-07:00";"https://itunes.apple.com/us/review?id=859140969&type=Purple%20Software";"859140969";83;"en";"NEUTRAL"
7;4982661619;"App store keeps canceling me";"https://itunes.apple.com/us/reviews/id289900613";"3.3";1;"Extremely buggy, no support";"The hardware works quite well. I have had the devices at home for years, and they have been working flawlessly. The huge problem is with the software, which is completely unacceptable. There is no way to figure out what is going on when you go from screen to screen, The connection between software and hardware is erratic, and the automatic operation may go from on to off for no apparent reason. Unfortunately there has been no software update ever since I bought the devices, and I have had seven of them at home. Not recommended.";"2019-10-19T22:56:56-07:00";"https://itunes.apple.com/us/review?id=859140969&type=Purple%20Software";"859140969";95;"en";"NEGATIVE"
8;1286764089;"Mikeare";"https://itunes.apple.com/us/reviews/id165877840";"3.3";5;"Does his job";"I have all the products (s20 socket,  allone and switches) and im very satisfied. The response is super super fast either wifi 3g or 4g .. As i talk with them (very polite people) before one week they build new server in europe so everything has change to the best!!! 

Good work people! But please fix a little ui of the app you can do it more modern! You are the best!";"2015-11-14T19:18:27-07:00";"https://itunes.apple.com/us/review?id=859140969&type=Purple%20Software";"859140969";72;"en";"POSITIVE"
9;1295749261;"Tubbyp003";"https://itunes.apple.com/us/reviews/id137151722";"3.3";5;"Super Great Product!!! A+++";"There is no other product that I would recommend, This is all you need works perfectly and half the price of others!!! The only thing the app needs added to it is notifications when devices are turned on or off would be great!!";"2015-12-04T07:37:54-07:00";"https://itunes.apple.com/us/review?id=859140969&type=Purple%20Software";"859140969";43;"en";"POSITIVE"
10;1364114938;"Digital version";"https://itunes.apple.com/us/reviews/id432021461";"3.3";2;"Mostly works";"Needs some help. Setting a schedule when the app can't get the time correct (daylight savings doesn't seem to work and everything is in military time). Randomly turns off for no reason. Support was not helpful and simply stopped answering emails. The device didn't work at my office with a hardworking firewall.";"2016-04-15T19:54:55-07:00";"https://itunes.apple.com/us/review?id=859140969&type=Purple%20Software";"859140969";52;"en";"NEGATIVE"
11;1406074247;"DENE2216";"https://itunes.apple.com/us/reviews/id281134471";"3.3";1;"USELESS Paperweight";"Every other wireless device I have connected in my home works. Not this thing. Spent literally hours setting and resetting to no avail, it refuses to connect to my WiFi. Have never experienced any sort of problem as this with a wireless device. I even disconnected almost all of my other wireless devices thinking maybe I had too many connected. If it can't connect with only 3 other devices running, then this unit is the problem. AVOID !!";"2016-07-05T15:13:05-07:00";"https://itunes.apple.com/us/review?id=859140969&type=Purple%20Software";"859140969";78;"en";"NEGATIVE"
12;2147427864;"Ob3Knobe";"https://itunes.apple.com/us/reviews/id666415112";"3.3";1;"Not a fake review";"It worked fine for about a year and now I can't set the timers. The app tells me I can only do it in local mode but there's nothing in their manual about this, and no apparent controls in the app to change this. And no way to contact them. The other switch I had went bad in about six months, so it seems that they're all junk. Going back to the old fashioned manual timer.";"2018-01-30T16:41:46-07:00";"https://itunes.apple.com/us/review?id=859140969&type=Purple%20Software";"859140969";76;"en";"NEGATIVE"
13;6650265140;"Atwater512";"https://itunes.apple.com/us/reviews/id195805222";"3.3";1;"Poorly Designed App";"This software is poorly designed.  I had a problem with it to set the timer properly because it did not recognize my time zone.  Just from today, the timer stopped working completely.  When I click on the timer the app closes by itself.  I have no choice but to get rid of it now.";"2020-11-15T18:34:55-07:00";"https://itunes.apple.com/us/review?id=859140969&type=Purple%20Software";"859140969";54;"en";"NEGATIVE"
14;7840986038;"maseww22";"https://itunes.apple.com/us/reviews/id37610511";"3.3";2;"Works";"Works to turn lights on and off. The app crashes when trying to use the timer and/or count feature.";"2021-09-24T11:12:34-07:00";"https://itunes.apple.com/us/review?id=859140969&type=Purple%20Software";"859140969";19;"en";"NEUTRAL"
15;6835311912;"mdresselhaus";"https://itunes.apple.com/us/reviews/id35927694";"3.3";1;"Does not work at all";"When I first bought my device a few years ago, it worked poorly, with many bugs requiring me to reconfigure it a few times. It was frustrating so I swapped to more reliable brands, but I needed another smart outlet so I gave this another try and I cannot get it to successfully configure at all now.";"2021-01-05T14:24:50-07:00";"https://itunes.apple.com/us/review?id=859140969&type=Purple%20Software";"859140969";57;"en";"POSITIVE"
16;1309792400;"Wmwb2015";"https://itunes.apple.com/us/reviews/id422423289";"3.3";3;"Randomly Turns off";"Haven't used remotely, but in house, the outlet loose power, app still show on, turn it to off, then on again in app, and stay on for awhile, but then will shut off again, no timers or schedule set, just off and on.";"2016-01-01T18:01:20-07:00";"https://itunes.apple.com/us/review?id=859140969&type=Purple%20Software";"859140969";43;"en";"NEGATIVE"
17;1779383001;"jfigaro";"https://itunes.apple.com/us/reviews/id103552021";"3.3";1;"Poor UI";"Surprisingly decent navigation. Primary gripe is with the rotary input/select. It's hand built and it's terrible. Really difficult to choose a number, and buggy. Has a habit of clutching out if release between numbers and either resetting to zero or choosing a random number. It needs to be replaced with the standard iOS input.";"2017-09-07T17:35:37-07:00";"https://itunes.apple.com/us/review?id=859140969&type=Purple%20Software";"859140969";54;"en";"NEUTRAL"
18;1269838910;"jetsite";"https://itunes.apple.com/us/reviews/id112034714";"3.3";2;"Device is good, app isnt";"Please add more functions for this app, more buttons, add Viore TV, alternate position buttons...";"2015-10-10T17:00:37-07:00";"https://itunes.apple.com/us/review?id=859140969&type=Purple%20Software";"859140969";15;"en";"POSITIVE"
19;1583579333;"iPhone App Rating Guide 2014";"https://itunes.apple.com/us/reviews/id338903622";"3.3";1;"Most frustrating item/appliance in my entire home!";"App is horrible! You must be connected to WiFi to control the devices and oftentimes it does not recognize the devise or just times out and gives up. I would return my unit if I could.";"2017-04-08T00:32:22-07:00";"https://itunes.apple.com/us/review?id=859140969&type=Purple%20Software";"859140969";36;"en";"NEGATIVE"
20;7729335837;"Cadethenderson";"https://itunes.apple.com/us/reviews/id152677492";"3.3";3;"Excellent device";"Excellent device but app not user friendly enough. Please upgrade app. I do scripting so if u need advice am available.";"2021-08-24T07:19:26-07:00";"https://itunes.apple.com/us/review?id=859140969&type=Purple%20Software";"859140969";21;"en";"POSITIVE"
21;1361111634;"4x4jeepguy";"https://itunes.apple.com/us/reviews/id285547136";"3.3";1;"App and product are worthless";"Bought a single outlet to try as my wife would forget to unplug devices when we left the house. Wasted the better part of an afternoon trying to get the app and plug to even communicate to no avail. Avoid";"2016-04-09T17:04:18-07:00";"https://itunes.apple.com/us/review?id=859140969&type=Purple%20Software";"859140969";40;"en";"NEGATIVE"
22;3635320691;"unhappy device user";"https://itunes.apple.com/us/reviews/id962276618";"3.3";1;"Remote control no longer working";"The device used to work remotely from anywhere using iPhone three years ago, since then the device works only on local network.";"2019-01-10T15:09:20-07:00";"https://itunes.apple.com/us/review?id=859140969&type=Purple%20Software";"859140969";22;"en";"NEUTRAL"
23;1506443886;"Tammy stinks";"https://itunes.apple.com/us/reviews/id172287934";"3.3";1;"Junk.  I brought 3 and am sending the pieces of junk and I'm this app back";"Terrible Terrible Terrible.  Every complaint I've read is spot on.  What a piece of junk and the English is terrible in the instructions.   #sending back";"2016-12-21T19:10:07-07:00";"https://itunes.apple.com/us/review?id=859140969&type=Purple%20Software";"859140969";25;"en";"NEGATIVE"
24;1265542904;"A.Pool";"https://itunes.apple.com/us/reviews/id150603465";"3.3";3;"App";"Its work ok on local wifi, but away or far from the s20 don't work, from Internet or other wifi!!";"2015-10-01T15:33:03-07:00";"https://itunes.apple.com/us/review?id=859140969&type=Purple%20Software";"859140969";20;"en";"POSITIVE"
25;7526257476;"Sbn19921";"https://itunes.apple.com/us/reviews/id382572992";"3.3";1;"This application has too many bug’s";"This application is not working well and it’s need major bug fixes. 
It doesn’t work welll";"2021-07-01T02:07:12-07:00";"https://itunes.apple.com/us/review?id=859140969&type=Purple%20Software";"859140969";16;"en";"NEGATIVE"
26;6837085985;"timbatec";"https://itunes.apple.com/us/reviews/id105426719";"3.3";1;"Timer doesn’t work";"Timer doesn’t work in iOS 14.3 on iPhone Cs Max, app just crashes upon trying to set timer or count down (connected on wifi, locally).";"2021-01-06T02:21:27-07:00";"https://itunes.apple.com/us/review?id=859140969&type=Purple%20Software";"859140969";25;"en";"NEUTRAL"
27;1361626885;"Abilio Silva";"https://itunes.apple.com/us/reviews/id217515862";"3.3";1;"1 star is too much";"Completely waste of time and money, poor app, doesn't work with new devices, even a simple tv controller seems to be too much for this app handle. Very disappointed.";"2016-04-10T14:26:55-07:00";"https://itunes.apple.com/us/review?id=859140969&type=Purple%20Software";"859140969";29;"en";"NEGATIVE"
28;1437360483;"DimaKoren";"https://itunes.apple.com/us/reviews/id43319885";"3.3";4;"Needed feature";"Needed an Apple Watch capability. And minor fixes with the app.";"2016-08-22T07:24:35-07:00";"https://itunes.apple.com/us/review?id=859140969&type=Purple%20Software";"859140969";11;"en";"NEUTRAL"
29;1335609790;"fred dunkle";"https://itunes.apple.com/us/reviews/id158576230";"3.3";1;"Crash";"Keeps crashing saying error occurred, please restart now. Restarted over and over. Makes this completely useless.";"2016-02-19T17:05:17-07:00";"https://itunes.apple.com/us/review?id=859140969&type=Purple%20Software";"859140969";16;"en";"NEGATIVE"
30;1951396737;"BethT68";"https://itunes.apple.com/us/reviews/id140333269";"3.3";1;"Horrible app!";"The last updates for this app were two years ago!!! Now I have two smart timers that don’t work. Thanks for nothing.....";"2017-11-26T16:07:39-07:00";"https://itunes.apple.com/us/review?id=859140969&type=Purple%20Software";"859140969";22;"en";"POSITIVE"
31;1279135794;"Kzguns";"https://itunes.apple.com/us/reviews/id3988331";"3.3";1;"Works 1 out of 20 attempts";"Seriously this thing times out at least 19 out of 20 attempts. Please get this fixed as it's pretty much worthless";"2015-10-29T14:16:10-07:00";"https://itunes.apple.com/us/review?id=859140969&type=Purple%20Software";"859140969";21;"en";"POSITIVE"
32;6711407866;"VoVo-Yo";"https://itunes.apple.com/us/reviews/id204269077";"3.3";1;"App crashes";"Can’t create a schedule or a timer.  Click on + and app crashes.";"2020-12-02T18:35:46-07:00";"https://itunes.apple.com/us/review?id=859140969&type=Purple%20Software";"859140969";13;"en";"POSITIVE"
33;1274547178;"Remote6387";"https://itunes.apple.com/us/reviews/id263385082";"3.3";1;"Unreliable";"Only works when connected locally. Does not work when using 4G or wifi. Useless";"2015-10-20T08:00:10-07:00";"https://itunes.apple.com/us/review?id=859140969&type=Purple%20Software";"859140969";14;"en";"NEGATIVE"
34;1407386141;"whatsthehaps";"https://itunes.apple.com/us/reviews/id43807180";"3.3";1;"Waste of time";"Does not connect with my wifi. This is a useless product.";"2016-07-07T19:31:24-07:00";"https://itunes.apple.com/us/review?id=859140969&type=Purple%20Software";"859140969";11;"en";"NEGATIVE"
35;6598749469;"Muzahmia";"https://itunes.apple.com/us/reviews/id464614232";"3.3";1;"Very disappointed";"Lost control always says Timeout, lost connection with plugs";"2020-11-01T13:28:06-07:00";"https://itunes.apple.com/us/review?id=859140969&type=Purple%20Software";"859140969";9;"en";"NEGATIVE"
36;1407357587;"Nathankaylan";"https://itunes.apple.com/us/reviews/id189791119";"3.3";1;"Hard to setup!";"Setup is hard. Many many try. Event don't work at all. CountDown sometime work.";"2016-07-07T18:24:40-07:00";"https://itunes.apple.com/us/review?id=859140969&type=Purple%20Software";"859140969";14;"en";"NEGATIVE"
37;1472462413;"Dzonim";"https://itunes.apple.com/us/reviews/id302028729";"3.3";3;"cannot add ir appliances to AllOne?";"please update

please add widget for ios for turn on/off orvibo s20";"2016-10-24T16:58:46-07:00";"https://itunes.apple.com/us/review?id=859140969&type=Purple%20Software";"859140969";12;"en";"POSITIVE"
38;1431615241;"RadarNC";"https://itunes.apple.com/us/reviews/id39426000";"3.3";1;"Weak product, weak app";"Pathetic app. Poorly written. An 8 year old could have done better. Garbage in, garbage out.";"2016-08-12T05:09:10-07:00";"https://itunes.apple.com/us/review?id=859140969&type=Purple%20Software";"859140969";16;"en";"NEGATIVE"
39;1212006278;"Wk5981";"https://itunes.apple.com/us/reviews/id8671026";"3.1.8";2;"Not fully ready";"Yes you my configure it for a simple operation without too much of a problem, even though sometimes even that may be frustrating. However, trying to get the timer or countdown to work is a different proposition - it pretty much never works I'm getting some stupid error messages like available only in locomote or something else that is absolutely not clear. So if you want to be able to just remotely turn it on or off you might be satisfied with it, otherwise - not fully ready for the show yet and maybe it's just a software.";"2015-06-13T20:28:42-07:00";"https://itunes.apple.com/us/review?id=859140969&type=Purple%20Software";"859140969";98;"en";"NEGATIVE"
40;1278614051;"Adrlh";"https://itunes.apple.com/us/reviews/id226672868";"3.3";1;"Garbage !!!!";"Don't work over LTE or 3G. Only says CONTROL TIMEOUT. Don't your time downloading this app. And I think nobody cares fix it.";"2015-10-28T12:51:55-07:00";"https://itunes.apple.com/us/review?id=859140969&type=Purple%20Software";"859140969";23;"en";"POSITIVE"
41;1131566716;"Andrew Bonham";"https://itunes.apple.com/us/reviews/id178590126";"3.1.3";2;"Not compatible with iOS8";"Purchased S20 socket and attempted initial setup using app on my IPhone 6 running iOS8 without success.  The app was unable to locate the S20 on the network.  

I then attempted the same method using an old 3rd generation iPod Touch running iOS 6 and it connected without any problems.

Developer please update this app to work with iOS8>.  At present I have to dust off my old iPod touch if I need to make any changes to the S20 socket timer which is far from ideal all because the app doesn't work with my iPhone 6 running iOS8.";"2015-01-17T10:50:26-07:00";"https://itunes.apple.com/us/review?id=859140969&type=Purple%20Software";"859140969";99;"en";"POSITIVE"
42;1215819330;"Roma.NYC";"https://itunes.apple.com/us/reviews/id85267115";"3.1.8";2;"Works only through wifi";"Works well when controlling through home wifi network. When it's using 4g lte, works some of the time, like 1/5 times";"2015-06-21T13:34:13-07:00";"https://itunes.apple.com/us/review?id=859140969&type=Purple%20Software";"859140969";21;"en";"POSITIVE"
43;1176504481;"iPod_user in 94574";"https://itunes.apple.com/us/reviews/id12895069";"3.1.4";5;"Easy to setup, works fine";"I'm using the app and wifi switch to control a 1 1/4 HP motor (975W).  It works perfectly and it was easy to set up. I like the built-in timer function as well.";"2015-04-01T17:44:51-07:00";"https://itunes.apple.com/us/review?id=859140969&type=Purple%20Software";"859140969";33;"en";"POSITIVE"
44;1191252353;"rogwk";"https://itunes.apple.com/us/reviews/id38660523";"3.1.6";3;"time zone problem";"This version is supposed to correct a time setting glitch. It doesn't. The time zones are off by an hour and the daylight savings switch does not correct the error. Other than that, no significant issues.";"2015-05-02T07:36:32-07:00";"https://itunes.apple.com/us/review?id=859140969&type=Purple%20Software";"859140969";36;"en";"POSITIVE"
45;1160669338;"Mask.Miami";"https://itunes.apple.com/us/reviews/id49485284";"3.1.4";3;"Hardware is good but app too limited";"I installed the system quite easily but was quite unhappy with the iPhone app. 
The remote controls on the phone are very limited
It would be good to have more configurable buttons in each category
The graphics of the remotes are boring and not useful 
I used the TV design to configure my receiver but with only 2 custom buttons, I could not record important functions like change input etc...
So yes, the product seems to work correctly but the app needs much more work";"2015-02-28T15:03:27-07:00";"https://itunes.apple.com/us/review?id=859140969&type=Purple%20Software";"859140969";85;"en";"NEUTRAL"
46;1217379008;"Oc_trav";"https://itunes.apple.com/us/reviews/id37383232";"3.1.8";4;"Works!";"Works iphone 6 iOS 8.3. Local and remote. Have to try a second time remotely sometimes... Other then that, it works great for my window air conditioner!";"2015-06-24T17:28:00-07:00";"https://itunes.apple.com/us/review?id=859140969&type=Purple%20Software";"859140969";27;"en";"POSITIVE"
47;1209944217;"Christiantavares";"https://itunes.apple.com/us/reviews/id166006765";"3.1.8";3;"Last update problems with 4G";"The last update crash 3G and 4G access. Only works with local mode (Wi-Fi). Please, fix this. I restart  and re-configure S20, but dont work no 4G mode.";"2015-06-09T17:37:22-07:00";"https://itunes.apple.com/us/review?id=859140969&type=Purple%20Software";"859140969";28;"en";"POSITIVE"
48;1190292925;"Abu almuether";"https://itunes.apple.com/us/reviews/id132742166";"3.1.5";1;"Not Compatible with IOS 8";"I purchased two S20 and tried to configure them with my IPhone 6S running iOS 8 without any luck. Kindly update the app to support ios8";"2015-04-30T09:01:08-07:00";"https://itunes.apple.com/us/review?id=859140969&type=Purple%20Software";"859140969";26;"en";"NEGATIVE"
49;1118553235;"Jascdk";"https://itunes.apple.com/us/reviews/id232638895";"3.1.3";4;"App";"Great app - does what it is supposed to do;) But - please write in english for the Update notes!!!!";"2014-12-24T08:19:21-07:00";"https://itunes.apple.com/us/review?id=859140969&type=Purple%20Software";"859140969";20;"en";"POSITIVE"
50;2441590777;"Burr the Conqueror";"https://itunes.apple.com/us/reviews/id390960092";"3.3";2;"Updates? Still secure?";"I think these work relatively well, though I wish they were Amazon Alexa or SmartThings compatible, or even IFTTT. But the the fact there haven’t been any updates in like 2 years makes me gravely concerned about the security of the devices and my network. Hard to imagine the security was so strong that the S20 outlet and WiWo app, unlike pretty much everything else on the internet, hasn’t needed any updates to shore up its software in over 2 years.";"2018-04-19T09:10:43-07:00";"https://itunes.apple.com/us/review?id=859140969&type=Purple%20Software";"859140969";81;"en";"POSITIVE"
