"";"id";"userName";"userUrl";"version";"score";"title";"text";"updated";"url";"app";"wordCount";"language";"sentiment"
0;5167049222;"jpspyro";"https://itunes.apple.com/us/reviews/id29910979";5.8;2;"Asks for “Always Allow” location";"Why does this app need location always, or location at all? Lame update.

Otherwise works, slow over LTE as expected. Very brutish User Interface could use some love. Editing settings is cumbersome and annoying.";"2019-11-18T20:24:42-07:00";"https://itunes.apple.com/us/review?id=918066994&type=Purple%20Software";"918066994";34;"en";"NEGATIVE"
1;6866522566;"Consumer Woman";"https://itunes.apple.com/us/reviews/id446111750";5.9;1;"Zero stars.  Needs location all the time!  None of your business";"This app worked fairly well for a couple years however,  over the last year or so you were unable to view your camera if you were not at home(which defeats the purpose of a security camera.  They also now require your location AT ALL TIMES and they need to have access to all devices on your home network!  The product will not work unless you give them these accesses.  Ridiculous! In this time in the world I am not giving out my personal information for anybodyAnd Samsung does not need this kind of information at all and for any reason. It went in the garbage!!! I also changed my router name and pass phrase.  I will never purchase another Samsung product again whether a washing machine,  TV, or camera. There is no reason for you to need this kind of information in order to use your app, no matter what your bogus reason is stated on the location portion of app.  Shame on you trying to get American information!";"2021-01-13T15:25:14-07:00";"https://itunes.apple.com/us/review?id=918066994&type=Purple%20Software";"918066994";169;"en";"NEGATIVE"
2;4641451585;"JBowlingKnox";"https://itunes.apple.com/us/reviews/id25380734";5.7;5;"Great system!  Took a while to get here.";"I have been using this app and the Panasonic system for quite a while with both the cheap cameras that come with the HNB600 hub and the newer Homehawk KX HNC800. The cheap cameras aren’t much to speak of but the Homehawks are great. 

The app has given me fits. The network configuration has been challenging but with the latest update everything is working great with really no configuration. I have removed all port forwarding and it is working fine. 

The system is quick to alert you when a sensor alarms. The sensors all take batteries so you have to periodically change them out but it isn’t too frequently. 

After the last update I am very pleased. 

It would be really nice if the developers made an Apple Watch app that could just change the arm state of the system. I have the disarm key fob but an Apple Watch app would be more convenient. 

Also it would be nice if there was a way to make the hub chirp or beep when a door is open in the at home alarm state. That way I could know if my kids went out the door without having an alarm.";"2019-08-19T05:44:03-07:00";"https://itunes.apple.com/us/review?id=918066994&type=Purple%20Software";"918066994";199;"en";"POSITIVE"
3;2109856649;"Miggy Flo";"https://itunes.apple.com/us/reviews/id108048720";5.0;1;"Useless";"If I can give it negative stars, I would. Most useless app I have on my iPhone. I bought 5 cameras and a water sensor last year. I was so happy with their products that I’ve told friends and family about how awesome this system was. Worked flawless and wonderfully until they updated. First, LTE connection stopped working and only home WiFi worked, which defeats the whole purpose of having this. Then now even the WiFi connection stopped working. Not only did I throw the cameras in the garbage since Panasonic can’t even be bothered to respond to emails, much less fix this useless app and hardware; I now vow to never buy ANY Panasonic products ever again and have told many friends and acquaintances to stay away.";"2018-01-20T18:01:37-07:00";"https://itunes.apple.com/us/review?id=918066994&type=Purple%20Software";"918066994";128;"en";"POSITIVE"
4;2621393326;"Waugh2000";"https://itunes.apple.com/us/reviews/id36511646";5.5;5;"Works flawlessly for the last 10 Months";"I’ve used this system for about 3 years.  As you can see from reviews there’s been many ups and downs with the app.  For me, for the last 10 months, the system has worked flawlessly.  I have a complicated setup that I’ve enjoyed adding devices to.  The software updates for the app seem to happen monthly so Panasonic is actively still very much supporting this system.";"2018-05-31T04:54:37-07:00";"https://itunes.apple.com/us/review?id=918066994&type=Purple%20Software";"918066994";66;"en";"POSITIVE"
5;4833931613;"Rajeshn";"https://itunes.apple.com/us/reviews/id43227191";5.8;4;"Much improved";"It monitors the home without having to rely on other companies. Easy to install and operate. Has become reliable over time and rarely has any false alarms. I wish it would show the battery level in the peripherals and warn us in a timely manner to replace. 2 times when I was away the battery failed and alarms went off.
Also, an announcement option when a door window opening when unarmed may be a good option.
Thanks";"2019-09-24T17:53:54-07:00";"https://itunes.apple.com/us/review?id=918066994&type=Purple%20Software";"918066994";77;"en";"POSITIVE"
6;5096815211;"Grizzley50";"https://itunes.apple.com/us/reviews/id846417561";5.8;5;"Love it!!! Oldie but goodie";"This system and app anit for everybody.  Only the sexy people can handle it.  Got a new WiFi router had to give the hub the new network and password.  And it’s humming along just like a song. It remembers the cameras.  Just google how to reset the hub.  Wait for the color changes on the LED and it walk you through the setup.  Had this system for over 5yrs.  Outdoors.  Hardy cameras.  Bueno bye.";"2019-11-06T21:06:46-07:00";"https://itunes.apple.com/us/review?id=918066994&type=Purple%20Software";"918066994";74;"en";"POSITIVE"
7;2506001022;"Gun Six";"https://itunes.apple.com/us/reviews/id44046325";5.3;5;"Excellent clarity";"Very nice HD view, works perfectly so far. Motion sensor is very accurate, drove to gas station and connected via LTE it took about 30 seconds but connected fine. Very happy with this app, very user friendly no wondering what to click to change this or that. Easy to navigate. If it continues to work well I will definitely buy a 2nd one";"2018-05-04T19:34:34-07:00";"https://itunes.apple.com/us/review?id=918066994&type=Purple%20Software";"918066994";63;"en";"POSITIVE"
8;2253415409;"Moapapp";"https://itunes.apple.com/us/reviews/id506748842";5.2;4;"Finally seems to be working";"When it works, its amazing. When the app doesn’t work, it’s very frustrating. Lately the app seems to be working, both on WiFi and on cell service, for both my IPad Air 2 and iPhone SE, which are both on ios11.  If the app breaks in the future, I’ll lower my rating, but at the moment everything seems to be working fine.";"2018-02-27T11:03:54-07:00";"https://itunes.apple.com/us/review?id=918066994&type=Purple%20Software";"918066994";62;"en";"POSITIVE"
9;4819251923;"Virella1959";"https://itunes.apple.com/us/reviews/id14354036";5.8;1;"Horrible and useless";"99% of the time is down, don't buy Panasonic their system is so  useless and tech support is even worst. They charge customers for their useless and helpless tech support.
Money waisted on the Panasonic wireless camera system, they just don't have the technology to make work.
I'm just turn off with Panasonic junk.
On top of that their system is one the one the worst when a comes to setup if you lucky to get them to work.
My cameras are 10 feet away and still no signal 99% of the time.
The app doesn't work either, just garbage all the way around.
You can’t not view your cameras away from home either, are you kidding me Panasonic with horrible system.
I done buying Panasonic, eventually Panasonic will be out business for building products that are so horrible when you compare to others brands.";"2019-09-21T12:21:14-07:00";"https://itunes.apple.com/us/review?id=918066994&type=Purple%20Software";"918066994";145;"en";"NEGATIVE"
10;6781787837;"Chofrins";"https://itunes.apple.com/us/reviews/id294072289";5.9;5;"Good camera.";"I’ve had this camera for over a year, and it stills works great. Sometimes there are connection issues with updated phone software or bad router connectivity, but it is usually resolved.";"2020-12-22T08:35:54-07:00";"https://itunes.apple.com/us/review?id=918066994&type=Purple%20Software";"918066994";31;"en";"POSITIVE"
11;3732768448;"Bolu's";"https://itunes.apple.com/us/reviews/id149726523";5.6;1;"No updates in 8 months";"Panasonic really dropped the ball on this one . This system is not even 2 years old and they stop selling the hardware and haven’t backed up theirs products in all of this months. If you bought this system pretty much will be junk any moment now. Is out of the market and Panasonic doesn’t care for the customers that bought their products . It wasn’t a cheap system to use only for couple months. Stay away from Panasonic . No support from their part.";"2019-02-04T07:11:34-07:00";"https://itunes.apple.com/us/review?id=918066994&type=Purple%20Software";"918066994";85;"en";"POSITIVE"
12;2655587217;"Naut2";"https://itunes.apple.com/us/reviews/id284987668";5.5;1;"LTE connection broken after iOS 10.3.3";"Remote connection with LTE has been broken after iOS 10.3.3 and is still not fixed in iOS 11.0.3. The app is useless as I cannot get any notifications or turn on/off alarms. Could you please fix it? I am a T-Mobile user and do not know if the issue is service provider dependent.

Updated on 6/7/18
I understand that T-Mobile on iPhone only supports IPv6 connection on LTE. This app only supports IPv4 that is why it doesn’t work. This app needs changes to support IPv6.";"2018-06-07T05:27:36-07:00";"https://itunes.apple.com/us/review?id=918066994&type=Purple%20Software";"918066994";86;"en";"POSITIVE"
13;3343401211;"jess836484";"https://itunes.apple.com/us/reviews/id175835632";5.6;1;"App doesn’t work";"Everything worked great for the first couple of months. I was able to view my cameras from the app. But then it stopped working (app buttons don’t respond except for the button that takes you to their store to buy more products... go figure). I can’t get a hold of them for help. The worst customer service. Panasonic, if you read these reviews, please let your customers know how to get a hold of you when the app stops working. Thank you.";"2018-10-25T14:10:53-07:00";"https://itunes.apple.com/us/review?id=918066994&type=Purple%20Software";"918066994";82;"en";"POSITIVE"
14;2419264490;"drnimrod";"https://itunes.apple.com/us/reviews/id42719106";5.3;4;"Takes about 3 minutes for the main menu to work";"When launching the app into the main screen, there's a ""Please wait..."" message with a spinning circle. This takes about 3 minutes to finally give me a communication error pop up and then I can access my cameras. 

If I need to go into settings and then back out to the menu, the whole ""Please wait..."" scenario happens again. 

Every single time I have to go back to the main menu, I wait 3 minutes.  It's quite ridiculous.

Edit: Updated the hub firmware and now everything is much quicker.";"2018-04-13T15:54:14-07:00";"https://itunes.apple.com/us/review?id=918066994&type=Purple%20Software";"918066994";89;"en";"NEGATIVE"
15;3244237860;"MTB-29";"https://itunes.apple.com/us/reviews/id196092142";5.6;5;"Great solution";"I love my connected home system. It allows me to monitor the exterior of my home, garage door, entry doors, windows and turn on and off light with out a monthly fee.

I am disappointed that it appears that Panasonic is discontinuing marketing this product in the US.";"2018-09-29T08:52:08-07:00";"https://itunes.apple.com/us/review?id=918066994&type=Purple%20Software";"918066994";48;"en";"POSITIVE"
16;3599478061;"C5 Vette Girl";"https://itunes.apple.com/us/reviews/id216736376";5.6;1;"Home Network System";"Model KX-HN600. This is THE worst money trap ever! My husband bought me this home security system for Christmas, but we have not been able to connect this to my mobile device or set the system up, period. We followed all the steps and are told “hub not found” even though the lights indicate a connection.
If you are reading reviews in consideration of purchasing this system....don’t. Your hard earned money will be wasted.";"2019-01-01T05:26:12-07:00";"https://itunes.apple.com/us/review?id=918066994&type=Purple%20Software";"918066994";74;"en";"NEGATIVE"
17;4054349303;"Gas Hawg 55";"https://itunes.apple.com/us/reviews/id176090875";5.6;3;"Where’s the sound????";"Used this app successfully for over 3 years now. All of a sudden there’s no 2 way audio. I can hear what the camera is seeing but I cannot talk to anyone at the camera end. I’ve looked at settings but there’s no longer a button for access to microphone. ???";"2019-04-24T07:18:51-07:00";"https://itunes.apple.com/us/review?id=918066994&type=Purple%20Software";"918066994";51;"en";"NEGATIVE"
18;2828707692;"conceptR";"https://itunes.apple.com/us/reviews/id155839062";5.6;3;"Arming error";"I'm now getting an error that says I can't change the arm mode remotely. It is also saying that the device is in use when my phone is the only device that has access to the hub. I've tried logging out and back in with the same error.";"2018-07-03T08:51:28-07:00";"https://itunes.apple.com/us/review?id=918066994&type=Purple%20Software";"918066994";48;"en";"NEGATIVE"
19;2688442471;"Dumpemout2000";"https://itunes.apple.com/us/reviews/id288756252";5.5;1;"newest update still doesn't work on cellular";"It has been 10 months and still doesn’t work. The app requires me to be on a wifi network (any WiFi network, home or public) to connect to my hub. When I go on celular data (3G, 4G, LTE), it throws an error to check my connection. I have checked my settings and allowed cellular data access to the app and still no luck. Please fix.";"2018-06-13T09:44:33-07:00";"https://itunes.apple.com/us/review?id=918066994&type=Purple%20Software";"918066994";66;"en";"NEGATIVE"
20;1904715280;"LEELO64";"https://itunes.apple.com/us/reviews/id85158148";4.8;3;"Non home connection is broken";"Wont connect over lte or wifi out of the home, please fix. LTE is ATT
Update( i actually re installed the app and it works a lot better now. Still glitchy but at least it works. Hopes that helps some of you with the same Issue)";"2017-11-07T15:07:37-07:00";"https://itunes.apple.com/us/review?id=918066994&type=Purple%20Software";"918066994";46;"en";"POSITIVE"
21;2793931805;"Alexjai123";"https://itunes.apple.com/us/reviews/id569288558";5.6;2;"It really needs to change";"It is so ugly and slow. They need to improve it and change the face of app. It isn’t user friendly. I couldn’t find some of other products to add to my system. I mean some add on products are not available . 
Hurry up guys. This is 2018 and we need better service";"2018-06-29T00:14:40-07:00";"https://itunes.apple.com/us/review?id=918066994&type=Purple%20Software";"918066994";54;"en";"POSITIVE"
22;3829016658;"Ken4846";"https://itunes.apple.com/us/reviews/id246822321";5.6;1;"One star is over-rated";"The camera itself, is very good but not of much use if you can’t access it. The connection gets lost daily and not because of a weak house internet. Access from iPad says not found. You reset, it works, an hour later, camera not found again. Save your money for a more reliable unit. Too bad....I always places great trust in Panasonic quality.";"2019-03-01T09:09:36-07:00";"https://itunes.apple.com/us/review?id=918066994&type=Purple%20Software";"918066994";63;"en";"POSITIVE"
23;2561321570;"phillippjohn";"https://itunes.apple.com/us/reviews/id689048560";5.3;3;"iPhone upgrade";"I had It working good really liked it. But now I upgraded my iPhone and now it doesn’t send me notifications when the alarm goes off. So now I am just thinking on getting a different system. Too bad because they had a good thing going.";"2018-05-17T18:49:15-07:00";"https://itunes.apple.com/us/review?id=918066994&type=Purple%20Software";"918066994";46;"en";"NEGATIVE"
24;5391224611;"Burrow0424";"https://itunes.apple.com/us/reviews/id150881140";5.9;1;"Zero stars";"This is the most useless device. You pay $300 for a baby monitor with a home system only to find out the app doesn’t work. What’s the point? Your better off throwing this in the river, it would be more efficient floating down the river than attached to a wall taking up space doing NOTHING! Don’t buy this- buyer be warned!";"2020-01-11T12:46:57-07:00";"https://itunes.apple.com/us/review?id=918066994&type=Purple%20Software";"918066994";61;"en";"POSITIVE"
25;2026524448;"fistsoffiore";"https://itunes.apple.com/us/reviews/id34970709";4.9;1;"What happened to this app???";"This used to allow me to connect when not on WiFi and on my LTE. That stopped. Now it’s not even me allowing me to connect on my home WiFi. I’ve deregistered from the hub even and reconnected and have the same issue. The support online is garbage too. Please fix this! You’re not a small company and need to step up the support Panasonic.";"2017-12-25T08:37:27-07:00";"https://itunes.apple.com/us/review?id=918066994&type=Purple%20Software";"918066994";65;"en";"POSITIVE"
26;2263284726;"SickMarky";"https://itunes.apple.com/us/reviews/id32819507";5.3;4;"Update for iPhone X";"I haven't had that many problems!! I would like to know if you are coming out with support for the iPhone X soon?? Also will we be getting Alexa support in the states??";"2018-03-02T08:25:53-07:00";"https://itunes.apple.com/us/review?id=918066994&type=Purple%20Software";"918066994";33;"en";"POSITIVE"
27;6725643726;"crosslessly";"https://itunes.apple.com/us/reviews/id173771464";5.9;5;"A great home security app without monthly fee";"A great home security system with real time remote access and without monthly fee.";"2020-12-06T19:08:42-07:00";"https://itunes.apple.com/us/review?id=918066994&type=Purple%20Software";"918066994";14;"en";"POSITIVE"
28;4913681225;"Mkybx21";"https://itunes.apple.com/us/reviews/id137575896";5.8;1;"Horrible";"This app is absolute garbage, might get lucky and actually connect to the hub after 30 minutes of trying (even if you’re standing right next to it). Does not matter if your WiFi signal is strong or cell service has full bars, it’s the same issue every day.";"2019-10-09T06:48:08-07:00";"https://itunes.apple.com/us/review?id=918066994&type=Purple%20Software";"918066994";48;"en";"POSITIVE"
29;2116464443;"Apps evaluation";"https://itunes.apple.com/us/reviews/id166123410";5.1;1;"Not connecting on lte connection";"Will not connect outside Home network & app crashes, fix the issue please

Updated - even after updating their app 
It will still not connect through lte connection, so I am returning camera back & buying something better";"2018-01-22T16:06:39-07:00";"https://itunes.apple.com/us/review?id=918066994&type=Purple%20Software";"918066994";38;"en";"POSITIVE"
30;4503100666;"dichek;728;";"https://itunes.apple.com/us/reviews/id994236948";5.7;1;"TERRIBLE";"It was working perfectly fine at first then all of a sudden I had been logged out and I had to do it all over again but this time it said that the device has been already registered so I couldn’t get into it can you add some sort of login option?";"2019-07-22T13:28:05-07:00";"https://itunes.apple.com/us/review?id=918066994&type=Purple%20Software";"918066994";52;"en";"POSITIVE"
31;3901704697;"nicenonny";"https://itunes.apple.com/us/reviews/id277780319";5.6;1;"Need to ask permission for microphone";"We used this same security system about a year ago and had no problems. We hooked it up again and the app doesn’t even request permission to use microphone rendering the feature useless. An update must have screwed this up.";"2019-03-19T14:45:29-07:00";"https://itunes.apple.com/us/review?id=918066994&type=Purple%20Software";"918066994";40;"en";"NEGATIVE"
32;2395678410;"hudojni4kata";"https://itunes.apple.com/us/reviews/id376263520";5.3;1;"Does not work outside of home wifi";"I am only able to view the cameras when at home, connected ti my home wifi. It does not work with other wifis or through my cell service. Useless since the whole purpose is remote viewing. I guess I will be returning them to costco.";"2018-04-07T13:44:37-07:00";"https://itunes.apple.com/us/review?id=918066994&type=Purple%20Software";"918066994";45;"en";"NEGATIVE"
33;5371366128;"larybirtk";"https://itunes.apple.com/us/reviews/id549782136";5.9;1;"Now requires location always";"You can’t even use the app now without enabling location information at all times. Worked fine without before. This is silly. It should not be rehired.";"2020-01-07T01:07:29-07:00";"https://itunes.apple.com/us/review?id=918066994&type=Purple%20Software";"918066994";26;"en";"POSITIVE"
34;5929449402;"JohnnyHoang";"https://itunes.apple.com/us/reviews/id44036047";5.9;1;"Why the system need to access my location 24/7?";"Why the system need to access my location 24/7. I selected allow to access my location while I’m using the app but it doesn’t work";"2020-05-10T16:53:22-07:00";"https://itunes.apple.com/us/review?id=918066994&type=Purple%20Software";"918066994";25;"en";"POSITIVE"
35;1811854279;"millionmilion";"https://itunes.apple.com/us/reviews/id150017897";4.7;3;"Please fix bug";"Every time I open the app, it causes black screen on my iPhone 6s+ camera. My iOS version is 10.3.3. Would be very happy to give 5stars once the bug is fixed.";"2017-09-26T17:42:46-07:00";"https://itunes.apple.com/us/review?id=918066994&type=Purple%20Software";"918066994";32;"en";"POSITIVE"
36;2079817530;"jkrwc";"https://itunes.apple.com/us/reviews/id16660870";5.0;1;"Remote access still broken in 5.0";"Remote access from cellular connection used to work. Was hopeful the 5.0 update would fix this but no such luck.  My router doesn’t have uPNP so proceeded with using static IP and port forwarding exactly as the user guide suggests. Really disappointed in Panasonic... Judging by other reviews I am not alone";"2018-01-11T15:36:09-07:00";"https://itunes.apple.com/us/review?id=918066994&type=Purple%20Software";"918066994";52;"en";"NEGATIVE"
37;2080619774;"SorrythatIupdatedtheapp";"https://itunes.apple.com/us/reviews/id549263583";5.0;1;"Doesn’t work over LTE";"Tried a reinstall as another reviewer suggested but still didn’t work. App immediately closes when trying to access the camera over LTE or non-home WiFi. Only works when your on the same WiFi as the camera.";"2018-01-11T21:37:59-07:00";"https://itunes.apple.com/us/review?id=918066994&type=Purple%20Software";"918066994";36;"en";"NEUTRAL"
38;6200982628;"RA_AI";"https://itunes.apple.com/us/reviews/id471759306";5.9;1;"Suspicious app!";"Why does it need to access my location while I am not using the app?
If they don’t fix it I’ll delete it and trash the cameras. I will never get Panasonic again, their technology is 20 years behind others.";"2020-07-15T07:03:18-07:00";"https://itunes.apple.com/us/review?id=918066994&type=Purple%20Software";"918066994";40;"en";"NEUTRAL"
39;2591462949;"no_2u";"https://itunes.apple.com/us/reviews/id46220772";5.3;1;"App didn't connect camera to Wifi";"Had to return my new Panasonic KX-HN1003 camera because Setup in this app wouldn't connect the camera to my WiFi network.  Gave up after trying a second router.  I don't know if it's Apple or Pathetic app's fault but I'm keeping the iPhone and returning the camera.";"2018-05-24T15:48:43-07:00";"https://itunes.apple.com/us/review?id=918066994&type=Purple%20Software";"918066994";47;"en";"NEGATIVE"
40;5276985331;"hdfyjng";"https://itunes.apple.com/us/reviews/id36250921";5.9;1;"Requires full time location access";"After a recent update the app now requires full access to your location all the time, not just when using the app.";"2019-12-15T12:11:14-07:00";"https://itunes.apple.com/us/review?id=918066994&type=Purple%20Software";"918066994";22;"en";"NEUTRAL"
41;2251199411;"Kuttenz";"https://itunes.apple.com/us/reviews/id549239655";5.2;5;"Great product";"I have been using this app for a year now. I love it";"2018-02-26T19:26:36-07:00";"https://itunes.apple.com/us/review?id=918066994&type=Purple%20Software";"918066994";13;"en";"POSITIVE"
42;5285920002;"Lb18c";"https://itunes.apple.com/us/reviews/id143670559";5.9;1;"Ask for location all the time";"The app is asking for full time location now. I guess they want to sell location data. Will not use anymore.";"2019-12-17T22:17:02-07:00";"https://itunes.apple.com/us/review?id=918066994&type=Purple%20Software";"918066994";21;"en";"POSITIVE"
43;1918582272;"Mymarch";"https://itunes.apple.com/us/reviews/id21543149";4.8;1;"Connection Issues. VERY SLOW TO CONNECT";"VERY SLOW to connect to hub and camera. Why does it take a minute or longer for connection?

Since the beginning it has been slow but even slower on IOS11.";"2017-11-13T10:46:45-07:00";"https://itunes.apple.com/us/review?id=918066994&type=Purple%20Software";"918066994";30;"en";"NEUTRAL"
44;2268400101;"Peterdy";"https://itunes.apple.com/us/reviews/id438480098";5.3;1;"Useless";"LTE connection does not work which makes security system useless.

2/3/18 update: version 5.3 did not fix the issue. Remote connection works on WiFi ONLY - when on LTE - still useless!";"2018-03-03T18:29:21-07:00";"https://itunes.apple.com/us/review?id=918066994&type=Purple%20Software";"918066994";32;"en";"NEGATIVE"
45;1957701427;"Mrspapi";"https://itunes.apple.com/us/reviews/id39079956";4.9;1;"Incredibly Slow";"Takes forever to connect via app - particularly if you aren’t connected to the same WiFi as the camera and are using LTE.";"2017-11-29T08:02:53-07:00";"https://itunes.apple.com/us/review?id=918066994&type=Purple%20Software";"918066994";23;"en";"NEUTRAL"
