"";"id";"userName";"userUrl";"version";"score";"title";"text";"updated";"url";"app";"wordCount";"language";"sentiment"
100;1923443948;"VTabs";"https://itunes.apple.com/us/reviews/id181265642";4.8;2;"Recent update 10/2017 made it worse";"Noticed app would close on its own whenever i tried to open it with my phone not in wifi range and just using cell service.
It wasn’t like that before the update 2 weeks ago";"2017-11-15T12:45:13-07:00";"https://itunes.apple.com/us/review?id=918066994&type=Purple%20Software";"918066994";35;"en";"POSITIVE"
101;1322345834;"Ronger923";"https://itunes.apple.com/us/reviews/id147690942";2.9;1;"Worst !";"It always froze and not working most of the time.";"2016-01-25T13:50:59-07:00";"https://itunes.apple.com/us/review?id=918066994&type=Purple%20Software";"918066994";10;"en";"NEUTRAL"
102;1451867314;"Dj Pengster";"https://itunes.apple.com/us/reviews/id8524278";3.5;1;"Does not work for iOS 10";"Does not work for iOS 10. Please fix.";"2016-09-18T08:19:21-07:00";"https://itunes.apple.com/us/review?id=918066994&type=Purple%20Software";"918066994";8;"en";"POSITIVE"
103;1390220519;"nope.pdf";"https://itunes.apple.com/us/reviews/id21333519";3.2;1;"Worst app ever";"Nice looking hardware. The software just flat out does not work most of the time.";"2016-06-06T21:13:29-07:00";"https://itunes.apple.com/us/review?id=918066994&type=Purple%20Software";"918066994";15;"en";"POSITIVE"
105;1318600633;"Nth tee";"https://itunes.apple.com/us/reviews/id257075932";2.8;1;"Worst app";"Worst app ever, never connects when you're out side.";"2016-01-18T13:11:57-07:00";"https://itunes.apple.com/us/review?id=918066994&type=Purple%20Software";"918066994";9;"en";"NEGATIVE"
106;1459274737;"Java0087";"https://itunes.apple.com/us/reviews/id486732314";3.7;1;"bad stuff";"too slow. easy breakdown. not recommend at all";"2016-10-01T14:24:05-07:00";"https://itunes.apple.com/us/review?id=918066994&type=Purple%20Software";"918066994";8;"en";"POSITIVE"
109;5522249948;"AskEric";"https://itunes.apple.com/us/reviews/id32389374";5.9;1;"Recent update requires Location all the time!!";"I like this app until the most recent update. The app now requires location to Be “Always on”.  This is ridiculous and unnecessary. The app has worked well for years without this.  At least allow me to use the “white using app” option for location.  By making be do this the app runs down my battery and is tracking me all the time!  So in an effort to get security I have to give up my personal security (location)?!?!? This is against Apple’s code of conduct.  PLEASE DO THE RIGHT THING DEVELOPERS AND GO BACK TO THE location option of “only while using app”.  If you do this I will change my review and continue using the product. But in till then thumbs down!  👎👎";"2020-02-12T09:14:16-07:00";"https://itunes.apple.com/us/review?id=918066994&type=Purple%20Software";"918066994";125;"en";"POSITIVE"
110;5332186794;"NC Living";"https://itunes.apple.com/us/reviews/id149023668";5.9;1;"Breaches Apple’s code of conduct";"After the last update, the app will not work with a location setting of “while using”, it now requires “always allow” to be selected!  

This makes no sense and does not meet Apple’s code of conduct.  

PANASONIC, DO THE RIGHT THING AND GO BACK TO WHILE USING!";"2019-12-28T14:48:35-07:00";"https://itunes.apple.com/us/review?id=918066994&type=Purple%20Software";"918066994";47;"en";"NEGATIVE"
111;2225423357;"Yarano";"https://itunes.apple.com/us/reviews/id109551110";5.1;4;"Not as bad as people are saying";"I get why people 1 Star this, it was working one way and then changed and everyone had a hard time connecting. I had the same issues. The thing is- people need to investigate issues before complaining about them, because 9 times out of 10, you’ll find the fix for it. But instead of just complaining, I did a little research and found that they modified the way the app works, and you need some changes made on your router. These changes were necessary for better security and performance, not just to screw with people. Once that’s done, everything was fast and smooth sailing for me. 

For those too lazy to look:

1. Set your hub to a static IP address. 
2. Forward ports 62000-63000 on your router to the static IP you assigned to your hub. 
3. Enable UPnP on your router if it is not already. 

Once I made these changes, I can access the app without issues from my home WiFi and on LTE from my cell when away from my home.";"2018-02-19T06:49:16-07:00";"https://itunes.apple.com/us/review?id=918066994&type=Purple%20Software";"918066994";175;"en";"POSITIVE"
112;1965550950;"BobaFettie";"https://itunes.apple.com/us/reviews/id164859380";4.9;1;"Garbage";"This is hands down the dumbest smart device I’ve ever used.  I have successfully installed nest, Phillips Hue, chamberlain myq smart products throughout my home. This Panasonic hub and especially the app are a joke.  The app spins for over a minute each time I open it... and each time I switch screens within it, always ending with an error code... then after the minutes of waiting for the error, I can use the app... just don’t switch screens.  It’s junk... spent hours working with it, reinstalling it... JUNK.";"2017-12-02T12:18:51-07:00";"https://itunes.apple.com/us/review?id=918066994&type=Purple%20Software";"918066994";89;"en";"POSITIVE"
113;1881323936;"Applebox";"https://itunes.apple.com/us/reviews/id33851438";4.8;1;"It was great when it worked.";"Second review update:
No remote of any kind via iOS on T-Mobile via 4G or LTE. Works fine via android. 

I've updated this review to reflect software and firmware changes. 

The companion app for the Panasonic Home Monitor hardware is decent. Remotely connecting to the system is an exercise in patience as all connections route through their cloud but it has improved greatly over the past few months. 

The programming logic has improved greatly over the original version. Now, multiple layers of scenarios can be enabled.

The app continues to lack persistence. It will always return to the home page and restart the linking process. There should be a way for it to stay direct connected for short period of time and to remember where you left off.";"2017-10-28T09:43:19-07:00";"https://itunes.apple.com/us/review?id=918066994&type=Purple%20Software";"918066994";128;"en";"POSITIVE"
114;1805543532;"Vzw2att";"https://itunes.apple.com/us/reviews/id22885217";4.7;1;"Still will not connect over cellular";"With each update I've been hoping this is one that will fix the cellular issue. Sad to report that the update today 7/31/2017, it is still unable to connect through cellular connection. Even at home on wifi, I'd have to fiddle with it by closing and reopening several times before it will connect. I really can't understand why Panasonic is unable to solve this major issue after many updates. 

I also have this app on an Android device and it has neither of these issues.

App no longer opens on iOS 11. 

Version 4.7 update ***still*** unable to connect via LTE. What’s worse is with iOS 11, the app won’t even open when connected to Wi-Fi. The strange thing is I still get alerts when it detects motion, but the app just closes itself when I open it. If I disconnect from Wi-Fi, the app will open but will not connect via LTE. 

It is a completely useless product as it is right now.";"2017-09-23T06:52:17-07:00";"https://itunes.apple.com/us/review?id=918066994&type=Purple%20Software";"918066994";164;"en";"NEGATIVE"
115;1811655722;"Faister";"https://itunes.apple.com/us/reviews/id35450278";4.7;3;"Pls fix app for iOS11";"Since I'd updated my iPhone to iOS 11 I can't see the camera view across all my cameras. Same thing on my wife's iPhone on iOS 11. camera view only worked on my old Android phone. Please fix it asap. Thanks";"2017-09-26T14:48:59-07:00";"https://itunes.apple.com/us/review?id=918066994&type=Purple%20Software";"918066994";41;"en";"POSITIVE"
116;1687811308;"Oommen";"https://itunes.apple.com/us/reviews/id121178377";4.4;1;"App not working";"After updating the iPhone app is not able to connect remotely. Android app works well and connect remotely.";"2017-07-18T12:20:44-07:00";"https://itunes.apple.com/us/review?id=918066994&type=Purple%20Software";"918066994";18;"en";"POSITIVE"
117;1360157496;"Feh2";"https://itunes.apple.com/us/reviews/id494422123";3.0;1;"na";"This system, consisting of cameras (both indoor and outdoor), along with the other accessories will work fine provided I’m connected to my home wifi.  Once I go out of range and onto data then the problems start.  I usually have to close and open the app between 4 to 15 times before it will come up.  If you get a trip alarm, it could take you up to fifteen minutes to see the camera.  I say fifteen minutes because that is the point I flatly gave up.

You must invest in a hand set because it speaks what was tripped where the phone only beeps and you have to read it.  The handset must stay within the hub range though.  

The point I became really upset with the system is when I went to enter a sixth door sensor.  When I went to register it, it picked up the identity of a certain sensor already registered.  When it tripped, the handset (operating on the hub) correctly stated which sensor it was.  My Iphone on the other hand, said something else.  I deregistered them and reregistered them and always the same.  I called Panasonic about it and they had me reset the hub at least twice, meaning I had to redo all my set up work.  The Panasonic tech has not been able to resolve my issue.  He said he would look further into it and get back to me.  He did call back but was still unable to resolve the problem and said he would do more research and call back.  I have not heard back from the tech support, so I am returning the sixth sensor.  They say the app will take up to 50 devices, but I have only been able to get 5 to work.

I tried reregistering one last time.  The handset spoke the wrong sensor and my Iphone said yet another.  The app does NOT SYNC with the hub!   That was the last straw, I am sending it back and not adding over five sensors.

Like I said, if you use this for inside the home security, you should be fine.  If you want to access from away, then you will be very disappointed in the system.  I have well over $500 spent and I really wish I would have gone a different system.  If it worked the way they said it should, it would be great.  I would highly recommend NOT investing in this system at least until they get some of the bugs worked out.

One last thing to add here.  If a device doesn’t work right, you have to send it to their warehouse in Texas at YOUR own expense.  Make sure to test it fully so it can be returned within the thirty days or so of purchase so you can return it to the vendor.";"2016-04-07T21:14:52-07:00";"https://itunes.apple.com/us/review?id=918066994&type=Purple%20Software";"918066994";475;"en";"POSITIVE"
118;1591051153;"glmccready";"https://itunes.apple.com/us/reviews/id144398062";4.3;3;"Finally...but..iOS update..,";"Not working. AGAIN after last iOS update.....4-17-2017
This quirky app finally, after 1 1/2 years is usable.  Before it would take forever to connect, and often fail, making it nearly worthless, esp remotely.    Now it connects fast and with much more success.  Went from 2 to 4 stars!!";"2017-04-17T06:00:12-07:00";"https://itunes.apple.com/us/review?id=918066994&type=Purple%20Software";"918066994";48;"en";"NEGATIVE"
