"";"id";"userName";"userUrl";"version";"score";"title";"text";"updated";"url";"app";"wordCount";"language";"sentiment"
46;2983851231;"mrstriggins1960";"https://itunes.apple.com/us/reviews/id218065702";5.6;1;"Terrible cameras and no customer support";"I wish I had opened the cameras before my warranty expired- the app is useless- finally got it hooked up and now the hub and cameras won’t connect.  I’m so disappointed";"2018-07-28T12:10:13-07:00";"https://itunes.apple.com/us/review?id=918066994&type=Purple%20Software";"918066994";31;"en";"NEGATIVE"
47;1844993804;"Craig Alan";"https://itunes.apple.com/us/reviews/id188207847";4.7;1;"Please fix bug for ios11";"Motion notifications come through fine over wireless or work WiFi, but I cannot connect to the hub unless I’m on the same wireless network.";"2017-10-12T19:34:33-07:00";"https://itunes.apple.com/us/review?id=918066994&type=Purple%20Software";"918066994";24;"en";"POSITIVE"
48;6064952442;"EWF7";"https://itunes.apple.com/us/reviews/id105927400";5.9;1;"Stopped working ever since iOS 13.5";"iOS 13.5 broke the app. Waiting for an update. Right now it’s useless.";"2020-06-11T17:43:39-07:00";"https://itunes.apple.com/us/review?id=918066994&type=Purple%20Software";"918066994";13;"en";"NEGATIVE"
49;2375915797;"Dallas morning";"https://itunes.apple.com/us/reviews/id369980264";5.3;1;"Does not work on T-Mobile";"Can’t connect through T-Mobile. Works fine on AT&T.";"2018-04-02T12:35:53-07:00";"https://itunes.apple.com/us/review?id=918066994&type=Purple%20Software";"918066994";8;"en";"POSITIVE"
50;2637075270;"Danieltri30";"https://itunes.apple.com/us/reviews/id100423016";5.5;2;"IPhone X app please";"I like the app but it’s not optimized for iPhone X. Please update.";"2018-06-03T10:44:53-07:00";"https://itunes.apple.com/us/review?id=918066994&type=Purple%20Software";"918066994";13;"en";"POSITIVE"
51;1870652168;"hclinde";"https://itunes.apple.com/us/reviews/id449589722";4.7;1;"Does not work over Cell Phone LTE";"Cannot use my cell phone to access the HuB.  Complete waste of money.";"2017-10-23T20:25:44-07:00";"https://itunes.apple.com/us/review?id=918066994&type=Purple%20Software";"918066994";13;"en";"NEGATIVE"
52;2123714026;"Frenz610";"https://itunes.apple.com/us/reviews/id130994224";5.1;1;"Please fix the app.!!!!!";"The Lte data plan does not work!!! Why?!? You guys need to update on the latest update for the app!!";"2018-01-24T19:16:00-07:00";"https://itunes.apple.com/us/review?id=918066994&type=Purple%20Software";"918066994";20;"en";"NEUTRAL"
53;4096171834;"mygearshop";"https://itunes.apple.com/us/reviews/id288039498";5.6;1;"Worst. Don’t buy";"Doesn’t work period

App just sits there.  Can open cameras 

Total waste of money";"2019-05-03T14:54:10-07:00";"https://itunes.apple.com/us/review?id=918066994&type=Purple%20Software";"918066994";14;"en";"NEGATIVE"
54;4517762041;"anil.s16";"https://itunes.apple.com/us/reviews/id113563596";5.7;1;"App is broken.";"App is broken. Getting E5-06 error when trying to configure Wi-Fi.";"2019-07-25T19:22:38-07:00";"https://itunes.apple.com/us/review?id=918066994&type=Purple%20Software";"918066994";11;"en";"NEGATIVE"
55;1653868364;"JustBob4Now";"https://itunes.apple.com/us/reviews/id102349772";4.3;2;"I could cook on my phone when it's running";"Better than nothing and meets most of my needs, but when it's running and I am monitoring my cameras my iPhone gets so hot I could fry an egg on it. I can watch the battery drain in real time. Given that I can watch HD video in other apps without it scorching my hand and battery bleeding away, there should be some way to make this app less hungry for CPU and battery.";"2017-06-22T15:22:40-07:00";"https://itunes.apple.com/us/review?id=918066994&type=Purple%20Software";"918066994";74;"en";"POSITIVE"
56;2160775806;"AGFan#1";"https://itunes.apple.com/us/reviews/id243040518";5.1;1;"Bad app support";"Not working with cellular LTE. No help from customer service!";"2018-02-02T21:41:57-07:00";"https://itunes.apple.com/us/review?id=918066994&type=Purple%20Software";"918066994";10;"en";"NEGATIVE"
57;2332587720;"mr boooo app";"https://itunes.apple.com/us/reviews/id213904501";5.3;1;"Negative star";"This is not working Panasonic don’t help, don’t buy this cámaras";"2018-03-21T22:46:01-07:00";"https://itunes.apple.com/us/review?id=918066994&type=Purple%20Software";"918066994";11;"en";"POSITIVE"
58;4092957588;"fruitea.v";"https://itunes.apple.com/us/reviews/id133895074";5.6;1;"Cabbage";"Waste money! Do not buy it!";"2019-05-02T23:09:51-07:00";"https://itunes.apple.com/us/review?id=918066994&type=Purple%20Software";"918066994";6;"en";"NEGATIVE"
59;1436513158;"Nikhilsamkumar";"https://itunes.apple.com/us/reviews/id519920690";3.5;1;"Unable to receive notifications for motion detection alerts.";"App bought on US app store does not post notifications

I have bought Panasonic Home monitoring security system from US back to India.

Model : KX-HN6002

I created a new Apple id to download the 'Home Network' app to access the US app store.

I successfully setup the cameras and I am able to view my cameras remotely in my office.

I have a problem - As claimed by Panasonic and other users the system does not send notification/alerts to iPhone when we have motion detection in the outdoor cameras. But, I am not receiving any notifications/alerts in my iPhone (IOS 9.3.4).

I have executed all the necessary actions required to get the notifications.

Panasonic FAQs/communities/forums does not offer any technical help with regards to this problem.

Currently, I have logged into US apple id account in my iTunes just to make sure I don't miss the notifications from the Home monitoring system - but this did not help.
I was going through a thread If you're not getting Apple push notifications - Apple Support .... !!

Do you think I need to setup the TCP ports in my router ??

Or Is it due to my apple id (USA) and my iPhone (bought in India) I am not receiving the notifications ?

Wat could be done from Apple to resolve this issue ??

Thanks for reading my lengthy thread.";"2016-08-20T21:00:28-07:00";"https://itunes.apple.com/us/review?id=918066994&type=Purple%20Software";"918066994";230;"en";"POSITIVE"
60;1199881067;"Lucky to gave this app";"https://itunes.apple.com/us/reviews/id155760783";2.0;5;"This is awesome!";"No joke, this system is great!  I'm a skeptical person about stuff like this, but I must say this works!  Too fun controllability and options. Panasonic thought through the setup and control work flow. 
I dont want to over sell but I'm very impressed about how well the hub based management system works. 
I spent a few hundred on the home security hardware options and I'm so happy, wife too!  I like all of the mobile control options. 
Enough said. After your first camera you will only want to add more to your control. 
Denverite";"2015-05-19T20:09:50-07:00";"https://itunes.apple.com/us/review?id=918066994&type=Purple%20Software";"918066994";95;"en";"POSITIVE"
61;1194487140;"Ipad_Upad";"https://itunes.apple.com/us/reviews/id108303245";2.0;5;"It still needs work. UPDATE!";"All of the issues from my previous review have been fixed. Smart Control can have multible devices start cameras and power outlets. They can be enabled/disabled by any combination of Arm home, Arm away, or Disarmed. I recieved a firmware update today and once it completed all of the fixes worked and the app's UI now makes sense. The Wifi and Cellular connections work great. Notifications work like they should. Apparantly there is now a Siren and Water detector available, but I don't see it online yet. Very pleased.";"2015-05-08T21:38:28-07:00";"https://itunes.apple.com/us/review?id=918066994&type=Purple%20Software";"918066994";89;"en";"POSITIVE"
62;1352881796;"cgbeer";"https://itunes.apple.com/us/reviews/id74028622";3.0;4;"Love the product, App still needs more love";"Overall, for what it is, it's great.  Security, home automation, etc... All in one.  The biggest complaint I have is figuring out what the badge notifications I get are for and how to remove them as I hate seeing them after I read all alerts, and 2 figuring out all it can do is a bit overwhelming.  However, once you figure it out its great";"2016-03-24T11:26:02-07:00";"https://itunes.apple.com/us/review?id=918066994&type=Purple%20Software";"918066994";65;"en";"POSITIVE"
63;1380109388;"Jsgddmr4562";"https://itunes.apple.com/us/reviews/id124827725";3.2;3;"Minor adjustments would make this great!";"In general I'm pretty pleased. I setup the home network with 4 cams and some leak detection devices.

There is 1 flaw - when setting the record, i would like to record for 10-15 minutes but get a 10 second preview without having to download the entire video to my phone for monitoring. I would like to have high sensitivity and allow quick deletion of false motion activation.

Cameras are not HD- and i knew that going into this, works well for my need - i do however wish i didn't need to download entire videos to review. 2 simple solutions - allow a preview (10 sec would do it) or allow multiple recordings lomg and short.

Overall a decent system with an obvious defect in usage gui.";"2016-05-17T10:50:12-07:00";"https://itunes.apple.com/us/review?id=918066994&type=Purple%20Software";"918066994";128;"en";"POSITIVE"
64;1383038248;"andregao";"https://itunes.apple.com/us/reviews/id240004055";3.2;3;"difficult to view footage";"The camera recording list does NOT have any preview or thumbnail pictures so it's really difficult to go through the footage quickly because for each recording you'll have to spend at least 30secs downloading the video file before you can watch it. It'll take forever if you need to find something without knowing the exact time stamp.";"2016-05-23T10:42:15-07:00";"https://itunes.apple.com/us/review?id=918066994&type=Purple%20Software";"918066994";57;"en";"NEGATIVE"
65;1457604699;"DK LA";"https://itunes.apple.com/us/reviews/id192404235";3.6;1;"NOT SO SMART - SIMPLY DOESN'T WORK";"I bought this system right when iOS 10 was just released. 

Upon trying to download the software to setup the system, it warned me that this app wont work with the new iOS. So for 10 days, this system stayed in the box. 

Then they released the updated app on Sep 23. I tried to do the setup and it failed to setup. I tried different wireless device to see if it will somehow work with it and I got the same results. 

If you read a lot of negative reviews, its simply because the app doesn't work. Sadly this means THIS SYSTEM WONT WORK AT ALL. SMART SYSTEM that doesn't work is NOT VERY SMART INDEED. 

I hope Panasonic read this and start taking their customers seriously by making an app that actually works and reliable. Especially on home security systems.";"2016-09-28T21:13:38-07:00";"https://itunes.apple.com/us/review?id=918066994&type=Purple%20Software";"918066994";142;"en";"NEGATIVE"
66;1514587572;"Quit peeps!";"https://itunes.apple.com/us/reviews/id44062834";4.0;2;"Slow connection";"The app works ok, but it takes forever to connect to the wifi network! Every time you log in it has to find the wifi connection, which sometimes it doesn't.  When you want to use a security camera you don't want to wait... It would be great if it didn't have that issue!";"2017-01-03T06:45:32-07:00";"https://itunes.apple.com/us/review?id=918066994&type=Purple%20Software";"918066994";53;"en";"POSITIVE"
67;1571269984;"DAT2000";"https://itunes.apple.com/us/reviews/id42239982";4.2;1;"Needs a fix right away (Update 3/24)";"As someone before me mentioned, this app is sloooww. Being that it uses sd cards for storage, I don't that would ever change.
I must say, this whole system is totally worthless. There is a huge security risk. The system does not record if it looses internet access. Why is this the case? The cameras don't use wifi to communicate with the hub. On top of that, You don't get notified to let you know the system isn't recording.";"2017-03-23T21:59:55-07:00";"https://itunes.apple.com/us/review?id=918066994&type=Purple%20Software";"918066994";79;"en";"NEGATIVE"
68;1334980629;"Nmdlr2";"https://itunes.apple.com/us/reviews/id163451147";2.7;3;"Video recording time is too short.";"I would like the option to be able to record for more than 15 minutes. I would also like to be able to log in faster. The app takes too long and I can't disarm fast enough to get the alarm to stop ringing.";"2016-02-18T10:06:54-07:00";"https://itunes.apple.com/us/review?id=918066994&type=Purple%20Software";"918066994";44;"en";"POSITIVE"
69;1258501517;"deviouspanda";"https://itunes.apple.com/us/reviews/id24772172";2.4;2;"WARNING - video streaming doesn't work in iOS9";"App is okay in iOS 8 but streaming video from the camera no longer works after upgrading to iOS 9.

Needs an update quickly otherwise it looses important security functionality.";"2015-09-16T19:15:27-07:00";"https://itunes.apple.com/us/review?id=918066994&type=Purple%20Software";"918066994";30;"en";"POSITIVE"
70;1492532700;"رائد الملا";"https://itunes.apple.com/us/reviews/id86482467";3.7;1;"Application is slow";"Very few updates, no server support and requires a static IP address. The hub also freezes a lot and need a reset. So if ur traveling it becomes useless. Unless you hook another hub to be able to switch off and on the main hub!!! This really needs a major update. Am using another brand for my baby monitor and its flawless to bad I invested a lot in Panasonic smart home equipments. I really need to replace it all.";"2016-11-28T11:54:18-07:00";"https://itunes.apple.com/us/review?id=918066994&type=Purple%20Software";"918066994";80;"en";"NEGATIVE"
71;1341240422;"guy23452";"https://itunes.apple.com/us/reviews/id18569218";2.9;4;"surprisingly good";"This was pretty easy set up works good nice feature such as intercom app runs in background but can be stopped via settings 

con :has no hdmi or tv plug so you have to run app to see the camera not that big of a deal.";"2016-03-01T15:23:50-07:00";"https://itunes.apple.com/us/review?id=918066994&type=Purple%20Software";"918066994";46;"en";"POSITIVE"
72;1651337142;"Working miku";"https://itunes.apple.com/us/reviews/id267590855";4.3;1;"Cannot connect with lte for remote viewing";"Before I could be at the park and see who is inside my house. Fast forward to 2 days later after I updated, the camera would give me a connection error and now I am stuck with a camera that can be only seen in my house. Get your app together pansysonic.";"2017-06-20T11:52:02-07:00";"https://itunes.apple.com/us/review?id=918066994&type=Purple%20Software";"918066994";52;"en";"NEGATIVE"
73;1464922594;"Lkobra";"https://itunes.apple.com/us/reviews/id39434400";3.7;3;"Decent functionality needs work";"Overall it works, but lacks in ease of use. Smart control and notifications are limited to only a couple parameters. It really needs a lock screen widget for arm/disarm.";"2016-10-11T06:34:58-07:00";"https://itunes.apple.com/us/review?id=918066994&type=Purple%20Software";"918066994";29;"en";"POSITIVE"
74;1455597751;"Cutch61";"https://itunes.apple.com/us/reviews/id235347250";3.6;3;"Ok";"When it works it's great. Half the time when i open the app it opens to the main page and won't do anything. The app is the only way to control the system. Please fix so it's more reliable.";"2016-09-25T04:15:16-07:00";"https://itunes.apple.com/us/review?id=918066994&type=Purple%20Software";"918066994";39;"en";"POSITIVE"
75;1503758370;"Rhumba Jones";"https://itunes.apple.com/us/reviews/id224894067";3.8;3;"Quirky now";"Talking through the camera used to be a cool feature, but doesn't work now.  Kind of important for a camera you want to talk with someone at your door before you answer it.";"2016-12-17T13:27:41-07:00";"https://itunes.apple.com/us/review?id=918066994&type=Purple%20Software";"918066994";33;"en";"POSITIVE"
76;1505748840;"shingoodan";"https://itunes.apple.com/us/reviews/id38627134";3.8;1;"Remote Access Stopped Working.";"Remote access function on the cell network stopped working after upgrading my phone and using iOS 10.

Called customer service 10 times to get to the right department, then tech support just read me through the the trouble shooting off the manual which I tried already.

Basically no one can help to solve this problem.  No point of having home monitoring system when you can't access while you are away.

Very disappointing.  Recommend getting other brands.";"2016-12-20T16:47:23-07:00";"https://itunes.apple.com/us/review?id=918066994&type=Purple%20Software";"918066994";76;"en";"NEGATIVE"
77;1224388788;"big bad wolf 888";"https://itunes.apple.com/us/reviews/id24204118";2.1;1;"Stopped working";"Stopped working after update. You need to have the option of turning off the lights on the camera at night to stop the reflection. Option to turn off motion sensor when you disarm system. Option to flip image upside down when hanging camera upside down.";"2015-07-08T22:50:59-07:00";"https://itunes.apple.com/us/review?id=918066994&type=Purple%20Software";"918066994";45;"en";"NEGATIVE"
78;1454772123;"Telugu boyz";"https://itunes.apple.com/us/reviews/id42725837";3.6;2;"Unreliable";"For a smart security home app, I expect reliability and nimble response. I'm amazed why Panasonic didn't get that. Hope there will be improvements. Hope Panasonic pays attention to reviews and does something about it.";"2016-09-23T18:54:38-07:00";"https://itunes.apple.com/us/review?id=918066994&type=Purple%20Software";"918066994";35;"en";"POSITIVE"
79;1510744102;"j123431";"https://itunes.apple.com/us/reviews/id311706481";4.0;1;"Not working on iOS 10.2";"Remote access stop working after iOS 10.2 update. Been waiting for this update for weeks, finally saw the update this morning. However, still not working. Hope this problem get solved soon.";"2016-12-28T05:36:38-07:00";"https://itunes.apple.com/us/review?id=918066994&type=Purple%20Software";"918066994";31;"en";"NEGATIVE"
80;1376193536;"Gamer.gamecenter";"https://itunes.apple.com/us/reviews/id481681801";3.2;1;"Does not work";"1 star because it barely functions correctly. Other times it stays on the loading screen, nothing is selectable, voicemails can't be deleted... Horrible. I wish I could return my Panasonic cameras. I do not recommend anyone to buy any Panasonic product that relies on this app.";"2016-05-09T18:59:58-07:00";"https://itunes.apple.com/us/review?id=918066994&type=Purple%20Software";"918066994";46;"en";"POSITIVE"
81;1351602465;"Fyhock";"https://itunes.apple.com/us/reviews/id302191759";3.0;1;"Update";"Usually never have a problem with this app but since the new iPhone update whenever I go to click on the camera to view why the sensor is going off it says ""device is in use"" even though no one else has the app open.";"2016-03-22T00:40:36-07:00";"https://itunes.apple.com/us/review?id=918066994&type=Purple%20Software";"918066994";45;"en";"NEGATIVE"
82;1297333059;"David Kritck";"https://itunes.apple.com/us/reviews/id180000028";2.8;1;"access from 4G, LTE, strong wifi does not work";"When I try to access camera from out side of home network, it does not work at all. I always getting “Connection unsuccessful” error, even though I have strong wifi connection or LTE. This is useless….";"2015-12-07T08:45:40-07:00";"https://itunes.apple.com/us/review?id=918066994&type=Purple%20Software";"918066994";36;"en";"POSITIVE"
83;1292607745;"Chuck 352";"https://itunes.apple.com/us/reviews/id133618635";2.7;3;"Only one Hub can be accessed";"Please update the app so that more than one Hub/System can be monitored. Why put that kind of limitation into the app? If someone wants to get another system they can't monitor it.";"2015-11-27T18:02:51-07:00";"https://itunes.apple.com/us/review?id=918066994&type=Purple%20Software";"918066994";33;"en";"NEUTRAL"
84;1313467428;"m_ruiz14";"https://itunes.apple.com/us/reviews/id19590804";2.8;1;"Takes forever to connect";"I am experience a problem when i get an alert and after the app opens It take 30-40 second to connect to my system to clear the alert. It has so much more potential but falls short.";"2016-01-08T18:52:25-07:00";"https://itunes.apple.com/us/review?id=918066994&type=Purple%20Software";"918066994";37;"en";"POSITIVE"
85;1352343762;"Cmartino88";"https://itunes.apple.com/us/reviews/id197292166";3.0;1;"New update is horrible";"Since the new update their is now an extra step to get to my smart plug... Oh and I can't connect to my alarm system and control it away from home anymore! Also hate that the home phone comes through my cellphone";"2016-03-23T11:24:49-07:00";"https://itunes.apple.com/us/review?id=918066994&type=Purple%20Software";"918066994";42;"en";"NEGATIVE"
86;1530401291;"Dannypl44";"https://itunes.apple.com/us/reviews/id226829594";4.1;1;"Worst support ever";"Good luck getting support for this system. Online chat directs you to call support. Support has you go through an automated circle hell. Then it hangs up.
Recommend buying a better camera system with better video quality.";"2017-01-25T10:52:06-07:00";"https://itunes.apple.com/us/review?id=918066994&type=Purple%20Software";"918066994";37;"en";"POSITIVE"
87;1629864810;"Hotrob637";"https://itunes.apple.com/us/reviews/id230565490";4.3;1;"App won't work on LTE after iOS 10.3 update";"App won't work on LTE after 10.3 update. This system is useless at this point. I've notified Panasonic a few months ago and still no fix at this point. Very disappointed.";"2017-05-31T16:45:47-07:00";"https://itunes.apple.com/us/review?id=918066994&type=Purple%20Software";"918066994";31;"en";"NEGATIVE"
88;1454503783;"spudlingly";"https://itunes.apple.com/us/reviews/id35608159";3.6;1;"Update broke remote access";"After spending a full day getting Remote access working, and having it working for me for several weeks, I love this update and now cannot get my remote access. Great job, idiots.";"2016-09-23T06:35:51-07:00";"https://itunes.apple.com/us/review?id=918066994&type=Purple%20Software";"918066994";32;"en";"POSITIVE"
89;1743090165;"gksultan";"https://itunes.apple.com/us/reviews/id42910318";4.6;1;"After updated";"Panasonic Please fix .still does not work remotely using cellular connection on iOS 10.3 and up spend lot of money and time waiting to u to fix.";"2017-08-23T13:10:32-07:00";"https://itunes.apple.com/us/review?id=918066994&type=Purple%20Software";"918066994";27;"en";"POSITIVE"
90;1519905846;"dbpiano";"https://itunes.apple.com/us/reviews/id41528853";4.0;3;"Needs improvement";"The app works okay. It would be nice if it's updated to fit the new iPhone screen sizes.";"2017-01-11T06:48:02-07:00";"https://itunes.apple.com/us/review?id=918066994&type=Purple%20Software";"918066994";18;"en";"POSITIVE"
91;1321970350;"noClue223";"https://itunes.apple.com/us/reviews/id16011801";2.9;1;"Battery drain";"The app runs constantly in the background and drains battery to a point that the phone turns off! Surprisingly Poor quality app form a company like Panasonic. Was there any QA done with the app?";"2016-01-24T20:27:58-07:00";"https://itunes.apple.com/us/review?id=918066994&type=Purple%20Software";"918066994";35;"en";"POSITIVE"
92;1310872903;"reachAlok";"https://itunes.apple.com/us/reviews/id140477950";2.8;1;"Good quality product but connection unsuccessful";"C'mon Panasonic- don't lose customers due to this App not allowing us to connect back to home monitoring. These reviews can turnaround if you fix this NOW!";"2016-01-03T16:46:25-07:00";"https://itunes.apple.com/us/review?id=918066994&type=Purple%20Software";"918066994";27;"en";"POSITIVE"
93;1524380256;"Tina Becker2";"https://itunes.apple.com/us/reviews/id177108811";4.1;1;"Broken in iOS 10.2";"Could not access remotely using cell network connection (3G, 4G, LTE). Only works with wifi. Please fix it.";"2017-01-17T10:32:28-07:00";"https://itunes.apple.com/us/review?id=918066994&type=Purple%20Software";"918066994";18;"en";"POSITIVE"
94;1520328386;"Xyz9901";"https://itunes.apple.com/us/reviews/id149231940";4.1;1;"Remote monitor does not work in 10.2";"Remote monitor (using cellphone signal, LTE, 4g etc) does not work in 10.2. 

Wifi works though.";"2017-01-11T22:51:30-07:00";"https://itunes.apple.com/us/review?id=918066994&type=Purple%20Software";"918066994";16;"en";"NEUTRAL"
95;1763320096;"campbellandy";"https://itunes.apple.com/us/reviews/id42679481";4.5;1;"""Please Wait...""";"""Please wait"" on every page in the app makes arming and disarming the alarm a slow, tedious process.";"2017-08-31T01:05:29-07:00";"https://itunes.apple.com/us/review?id=918066994&type=Purple%20Software";"918066994";18;"en";"NEUTRAL"
96;1462219865;"Rikins bro-in-law";"https://itunes.apple.com/us/reviews/id213347549";3.7;1;"Don't upgrade to IOS 10!";"Was working fine until I updated my 5s to OS 10";"2016-10-06T12:18:43-07:00";"https://itunes.apple.com/us/review?id=918066994&type=Purple%20Software";"918066994";11;"en";"POSITIVE"
97;1451424965;"HHLLZOO";"https://itunes.apple.com/us/reviews/id217083894";3.5;3;"Mr";"The app does not work with iOS10 yet. Can you please update for iOS 10 ASAP ? Thanks";"2016-09-17T15:17:41-07:00";"https://itunes.apple.com/us/review?id=918066994&type=Purple%20Software";"918066994";18;"en";"POSITIVE"
98;1526507091;"Poor jay";"https://itunes.apple.com/us/reviews/id280288819";4.1;1;"Useless";"Remote connect doesn't work! Please fix asap!!";"2017-01-20T06:03:00-07:00";"https://itunes.apple.com/us/review?id=918066994&type=Purple%20Software";"918066994";7;"en";"NEGATIVE"
99;1452964005;"lavalavalaval";"https://itunes.apple.com/us/reviews/id525591330";3.5;3;"does not work with ios 10";"does not work with ios 10，please fix";"2016-09-20T08:22:27-07:00";"https://itunes.apple.com/us/review?id=918066994&type=Purple%20Software";"918066994";7;"en";"NEUTRAL"
