"";"id";"userName";"userUrl";"version";"score";"title";"text";"updated";"url";"app";"wordCount";"language";"sentiment"
65;4022423470;"hrmac787";"https://itunes.apple.com/us/reviews/id902288329";"2.7.3";1;"0 stars! DO NOT BUY!";"This doesn’t deserve 1 star! This thing is great when it works which is very rare! The app crashes, it won’t connect or says no connection. The trouble shooting doesn’t work, to put it simply just don’t buy this, our poor baby was crying her eyes out for God only knows how long and I never knew because the monitor just stopped working in the middle of the night! Worst product and app I’ve ever had!!";"2019-04-16T20:48:55-07:00";"https://itunes.apple.com/us/review?id=936015067&type=Purple%20Software";"936015067";76;"en";"NEGATIVE"
66;5451309229;"syedimranhasan";"https://itunes.apple.com/us/reviews/id271557229";"2.8.1";1;"Live Feed on iOS & Apple TV app doesn't work";"The app is suppoosed to provide a live feed to you when you are in your wifi network or outside, but this app only works within wifi network. The live feed hasn't even once loaded for me outside my home. Hence it fails as a security camera

The tvOS app doesn't even launch hence they can't even advertise this to work on Apple TV yet they continue to do so. 

Very unhappy with this purchase. Didn't expect such a product from a reputed company like Nokia

And after couple of months of use it has stopped working and won’t pair again. No support provided by Nokia, no responses to emails";"2020-01-26T07:06:35-07:00";"https://itunes.apple.com/us/review?id=936015067&type=Purple%20Software";"936015067";110;"en";"NEGATIVE"
67;4569709956;"zacgor";"https://itunes.apple.com/us/reviews/id209306211";"2.8.0";1;"Worst product and app possible";"Unfortunately I did not read all the negative reviews before I bought this expensive paperweight           
The video never loads and the only way to get it to work for a couple of hours is to physically be present to unplug/plug the cam but it kind of defeats the purpose...
The app is outdated and the user experience is horrific and they completely dropped supporting the tv app 
It is a complete waste of money";"2019-08-04T14:31:39-07:00";"https://itunes.apple.com/us/review?id=936015067&type=Purple%20Software";"936015067";74;"en";"NEGATIVE"
68;4916265896;"127Comment";"https://itunes.apple.com/us/reviews/id187052721";"2.8.1";1;"Won’t work";"I had this camera for three years without issue now all of a sudden the app won’t open and I can’t use the camera. There is nothing wrong with the camera it’s the program and app that is poorly designed. You guys need to fix the application. Otherwise there is no reason for customers to purchase your camera if the app doesn’t work.";"2019-10-09T20:02:19-07:00";"https://itunes.apple.com/us/review?id=936015067&type=Purple%20Software";"936015067";63;"en";"POSITIVE"
69;1257148332;"Rosie Z";"https://itunes.apple.com/us/reviews/id27653188";"2.0.1";5;"So Far, So Good";"I bought this to keep an eye on my Mom, she lives alone and is almost 90. It works very good! I'm not sure if I'm going to do the monthly fee thing? Although it looks very good. Just figured I can video from my iPad.";"2015-09-13T14:37:46-07:00";"https://itunes.apple.com/us/review?id=936015067&type=Purple%20Software";"936015067";46;"en";"POSITIVE"
70;6982790105;"D Ferrari Wilson";"https://itunes.apple.com/us/reviews/id29468111";"2.8.1";5;"Please Bring back a camera";"Really need y’all to do a new camera.  

The air quality made your camera a step above for sure.";"2021-02-11T13:17:38-07:00";"https://itunes.apple.com/us/review?id=936015067&type=Purple%20Software";"936015067";19;"en";"POSITIVE"
71;6550252481;"Mauri From Mars";"https://itunes.apple.com/us/reviews/id260045773";"2.8.1";1;"Everything faulty";"No support no updates. The app no longer works properly. Takes forever to load the IR setting has just given out and makes nighttime viewing impossible. It’s used as a nightlight now... that is of course if I’m able to connect to it. Btw I have best internet and hardware in my home. To bad there isn’t a 0 star setting. Fail!";"2020-10-18T21:03:15-07:00";"https://itunes.apple.com/us/review?id=936015067&type=Purple%20Software";"936015067";62;"en";"NEGATIVE"
72;4378093383;"Founder 12345";"https://itunes.apple.com/us/reviews/id162695950";"2.8.0";1;"Worst app don’t BUY";"It constantly crashes and never loads the screen! It’s a waste of money to buy this monitor if the app associates with it blows!! Bought and started you using in July of last year and almost a year later it still never works right. I have restarted the camera and uninstalled the app and reinstalled and nothing fixes it or helps! If I could rate Lowe than a star I would.";"2019-06-27T12:08:09-07:00";"https://itunes.apple.com/us/review?id=936015067&type=Purple%20Software";"936015067";71;"en";"POSITIVE"
73;1590946852;"Smgoodman";"https://itunes.apple.com/us/reviews/id46257711";"2.5.0";1;"Sound issues";"Camera is great, and for the most part -- love the app design. However, twice in 3 weeks use, the app has stopped playing sound -- and we've woken up to our baby crying so loud, we finally hear her downstairs. It's a horrible feeling to then look at the video, and realize she's been awake and crying for 30+ minutes, when we can usually here the slightest sound on the monitor.";"2017-04-17T03:16:59-07:00";"https://itunes.apple.com/us/review?id=936015067&type=Purple%20Software";"936015067";72;"en";"POSITIVE"
74;1422908798;"GantzBoy71";"https://itunes.apple.com/us/reviews/id517029529";"2.4.0";2;"design flaw";"the ability to see streaming data must be controlled centrally because a July 30th outage affected many cameras from streaming video. 

i personally spent hours trying to determine what was going wrong. i cannot reccomend this product without a detailed explanation of why the products are centrally controlled and what processes there are to prevent future outages.";"2016-07-30T12:28:20-07:00";"https://itunes.apple.com/us/review?id=936015067&type=Purple%20Software";"936015067";57;"en";"NEGATIVE"
75;1385226012;"App. Crash";"https://itunes.apple.com/us/reviews/id32934722";"2.4.0";1;"Won't connect";"I have had many problems with the Home staying connected, and have returned the unit for a new one two different times. I have been thru all the steps to many times to believe it's my error I am getting pretty good at the set up though. 

If it would
Work it would be a good product.
If I had this purchase to do over again I would not have wasted my money.";"2016-05-28T00:42:46-07:00";"https://itunes.apple.com/us/review?id=936015067&type=Purple%20Software";"936015067";73;"en";"POSITIVE"
76;2761629208;"xxplumcrazeexx";"https://itunes.apple.com/us/reviews/id85936124";"2.7.3";1;"Doesn’t work";"Since the update I can’t connect. What good is it if it don’t work. Waste of money. Worked fine until the update. Guess they want you to buy a new camera. Not gonna happen. Will never buy another one of this brand.

Why doesn’t the app give me the option to connect by Ethernet anymore. That’s what the support suggests but I can’t do it if the option isn’t there!!!!!";"2018-06-24T12:09:51-07:00";"https://itunes.apple.com/us/review?id=936015067&type=Purple%20Software";"936015067";70;"en";"POSITIVE"
77;1187298716;"jpguido";"https://itunes.apple.com/us/reviews/id24917174";"1.4.0";2;"Won't connect";"It seems that after the app and firmware were updated, my unit will not connect.  I've went through the whole setup process again with it connected via Bluetooth, still won't connect.  May have to return this product if this doesn't get fixed soon.";"2015-04-24T05:48:17-07:00";"https://itunes.apple.com/us/review?id=936015067&type=Purple%20Software";"936015067";43;"en";"NEUTRAL"
78;4621151599;"Kenner9917";"https://itunes.apple.com/us/reviews/id22879636";"2.8.0";1;"Glitchy after latest iOS update";"Since I updated my iPhone yesterday, when I open the Home Cam app, it either doesn’t load at all, presenting only a blank page, or it loads, but shows me the last image that was on the camera before the update - a still of my babysitter. The sound seems to be working, just not the camera.";"2019-08-15T11:36:16-07:00";"https://itunes.apple.com/us/review?id=936015067&type=Purple%20Software";"936015067";57;"en";"NEUTRAL"
79;2513133298;"Atomz";"https://itunes.apple.com/us/reviews/id21540544";"2.7.3";1;"Nokia Ruined This Product";"This was a good to great cam and baby monitor app when I originally bought it (under Withings), but now the app fails constantly and won’t run unless the app is open. The Apple TV app no longer even opens. Nokia has completely failed to update anything of value, but they made sure to slap their awful branding on everything and ruined what was a decent product.";"2018-05-06T12:00:07-07:00";"https://itunes.apple.com/us/review?id=936015067&type=Purple%20Software";"936015067";67;"en";"NEGATIVE"
80;1219846290;"motownpda";"https://itunes.apple.com/us/reviews/id29060358";"1.5.0";3;"Okay what went wrong?";"Great product with lots of potential. However the bugs! Today- 'can't find wifi'; tomorrow 'device not connected' and a heap of technical flaws. I still remain impressed when it works. Just fix the bugs, period.";"2015-06-29T18:44:16-07:00";"https://itunes.apple.com/us/review?id=936015067&type=Purple%20Software";"936015067";35;"en";"POSITIVE"
81;1349494118;"Rocker000";"https://itunes.apple.com/us/reviews/id27462185";"2.4.0";2;"Don't update";"Was working fine until the latest update. Now my phone can't find the withings camera. Tried to reset to factory default as per manual to no avail. Sent email to their support and have not heard back till now. The camera just keep flashing orange and now totally useless.";"2016-03-17T21:46:34-07:00";"https://itunes.apple.com/us/review?id=936015067&type=Purple%20Software";"936015067";49;"en";"NEGATIVE"
82;1211573453;"Andrea E. Smith";"https://itunes.apple.com/us/reviews/id233419359";"1.4.2";1;"1.4.2 is awful";"I was FINALLY happy with your product after our purchase last December after the April update. It had stopped crashing and I wasn't sneaking into my daughters room to restart it. Your bug free Summer update has been a HUGE DISAPPOINTMENT as it is going blank and 'loading' multiple times per day. I'm at a point where I just want a refund and to go get a reliable video baby monitor.";"2015-06-13T01:02:36-07:00";"https://itunes.apple.com/us/review?id=936015067&type=Purple%20Software";"936015067";71;"en";"POSITIVE"
83;3509183288;"Hoosierben";"https://itunes.apple.com/us/reviews/id43081922";"2.7.3";3;"New User Dec ‘18";"Hope we have continuing updates and support for this product and app.. Currently having a “Loading” issue with Live view. Trying via Remove and reinstall to fix... if I can reinstall, no Blue blinking base light. Now trying delete app and reinstall.";"2018-12-08T13:48:13-07:00";"https://itunes.apple.com/us/review?id=936015067&type=Purple%20Software";"936015067";42;"en";"POSITIVE"
84;1168912277;"nporiti";"https://itunes.apple.com/us/reviews/id38332928";"1.3.0";1;"Terrible app";"Cameras works fine however, this app is terrible. Wait 5 minutes for video feed to load. Always has audio feedback when away from camera. 24 hour playback has more instances of ""offline"" then when online which makes 24hour playback completely useless. No other wireless devices on my network have issues. ie weemo, nest , Apple TV, hue.";"2015-03-16T09:17:33-07:00";"https://itunes.apple.com/us/review?id=936015067&type=Purple%20Software";"936015067";57;"en";"NEGATIVE"
85;1408146410;"Garrett Graves";"https://itunes.apple.com/us/reviews/id277954431";"2.4.0";1;"Just awful";"I have hung with this hunk of garbage for way longer than I should've. I don't think the company would have the guts to give me my money back but I feel like I was straight up swindled. I will never buy a product with the Withings name attached again. Despite consistent, scathing reviews this video camera is still not even functional. Just awful.";"2016-07-08T23:06:34-07:00";"https://itunes.apple.com/us/review?id=936015067&type=Purple%20Software";"936015067";64;"en";"POSITIVE"
86;1383454349;"L17qwert";"https://itunes.apple.com/us/reviews/id26954218";"2.4.0";1;"Sound has problems!";"I've owned my unit for about 6 months and for at least 4 of the months the sound has been static and a clicking noise.  Can't get it to stop.  I've reset the unit multiple times at the request of Withings customer support with no luck.  I recommend you purchase a different brand camera.   It's unfortunate, but they haven't mastered this yet.";"2016-05-24T08:23:49-07:00";"https://itunes.apple.com/us/review?id=936015067&type=Purple%20Software";"936015067";62;"en";"NEGATIVE"
87;1264109106;"Advokid42o";"https://itunes.apple.com/us/reviews/id344583484";"2.0.1";1;"Latest update is bad, I want my money back.";"With the latest update they copied drop cam. 

Before the recent update the camera would take about five pictures a second when motion or noise was detected and save them in the timeline. Now it just records the entire day and plays it back so fast it's useless. 

If I wanted to drop cam I would've bought one.";"2015-09-28T11:04:39-07:00";"https://itunes.apple.com/us/review?id=936015067&type=Purple%20Software";"936015067";58;"en";"NEGATIVE"
88;3612565871;"anjcons";"https://itunes.apple.com/us/reviews/id473036594";"2.7.3";1;"Reset???";"This was bought as a gift. They live in IA I live in Illinois we set it up in Ia after buying it to make it works.  I took it home to Illinois and it won’t connect to our WiFi there   Is there a reset button or something to do so I can use it in my own home   Other wise it will not get used and a waste if money. Quick start guide doesn’t tell me much";"2019-01-04T13:43:24-07:00";"https://itunes.apple.com/us/review?id=936015067&type=Purple%20Software";"936015067";78;"en";"POSITIVE"
89;1680554339;"AnnGAlt";"https://itunes.apple.com/us/reviews/id18236835";"2.7.1";1;"Garbage";"This monitor has given me trouble since I bought it in March. Last night the app stopped working at some point and has been ""Loading"" the picture since at least 3 am. I know the camera is working because I can watch the last 24 hours but this feels dangerous with an infant to have a monitor that doesn't work. I'm so mad.";"2017-07-13T03:24:19-07:00";"https://itunes.apple.com/us/review?id=936015067&type=Purple%20Software";"936015067";63;"en";"NEGATIVE"
90;1353060485;"Maybe_tomorrow";"https://itunes.apple.com/us/reviews/id192966527";"2.4.0";1;"Terrible. Completely regret buying this.";"At first, the camera was unreliable. Now, I can't even pair the camera with this app. I keep getting an error saying that this device cannot be paired so the camera just endlessly pulses blue. I would give up all the other features like the air quality, hd, and whatever else just to get a reliable video feed!!";"2016-03-24T20:20:05-07:00";"https://itunes.apple.com/us/review?id=936015067&type=Purple%20Software";"936015067";58;"en";"NEGATIVE"
91;1352372740;"DumboNY";"https://itunes.apple.com/us/reviews/id167656700";"2.4.0";2;"Last update terrible!";"Was working fine until the last update.  Now the device can't be reached or takes several minutes load.  When it does load, the sound has a lot of interference now.";"2016-03-23T13:01:13-07:00";"https://itunes.apple.com/us/review?id=936015067&type=Purple%20Software";"936015067";30;"en";"POSITIVE"
92;4781817347;"Antonio Tramber";"https://itunes.apple.com/us/reviews/id32447266";"2.8.1";1;"Updates Destroy It";"Why is it that each time there is an update the app just crashes and crashes? They have to know about this problem by now. Not sure why they can’t fix it. Not sure how long it will take them to fix it this time. I wish that it were optional to update it or not!";"2019-09-14T22:19:43-07:00";"https://itunes.apple.com/us/review?id=936015067&type=Purple%20Software";"936015067";56;"en";"NEGATIVE"
93;4354437324;"ct323i";"https://itunes.apple.com/us/reviews/id12884675";"2.8.0";1;"Crashing every time";"Truly awful app, I will never buy another Nokia or Withings product ever again! This latest update made it impossible to open the app without it crashing after 10 seconds. I deleted it and reinstalled the app on my iPhone XS Max I just get a gray screen now. Not even seeing any video anymore. Awful!";"2019-06-22T13:06:41-07:00";"https://itunes.apple.com/us/review?id=936015067&type=Purple%20Software";"936015067";56;"en";"NEGATIVE"
94;1675776378;"annannanniee";"https://itunes.apple.com/us/reviews/id11679738";"2.7.1";1;"The worst";"This app is the absolute worst. I keep having to deleted and reinstall to make it work. I'm actually just bought the camera today, but I'm already going to return it before I even get to use it through the night. If it doesn't work while baby is awake if definitely isn't going to work at night.";"2017-07-09T14:11:38-07:00";"https://itunes.apple.com/us/review?id=936015067&type=Purple%20Software";"936015067";57;"en";"POSITIVE"
95;4798281780;"@mteuzi";"https://itunes.apple.com/us/reviews/id530064437";"2.8.1";1;"Most Unstable App";"The app crashes repeatedly. After the latest update it won't open at all. Where is the QA process, Nokia? In previous builds, if the app opened, I was lucky if the software responded to any commands at all. Literally the worst software I've used on iPhone over the last three years — and that's how long I've had iPhone.";"2019-09-17T21:11:49-07:00";"https://itunes.apple.com/us/review?id=936015067&type=Purple%20Software";"936015067";59;"en";"NEGATIVE"
96;1633792860;"Cyclone Chris";"https://itunes.apple.com/us/reviews/id35643681";"2.6.0";1;"Horrible video quality";"The video is extremely pixelated on my iPad and iPhone. The Apple TV app does not have any audio. The lullaby feature shuts off intermittently after a few seconds, and there have been times where the audio on the app would stop in the middle of the night. This is a huge safety concern.";"2017-06-04T17:52:48-07:00";"https://itunes.apple.com/us/review?id=936015067&type=Purple%20Software";"936015067";54;"en";"POSITIVE"
97;1337067212;"Bashik";"https://itunes.apple.com/us/reviews/id31879438";"2.3.0";3;"Lullaby function doesn't work";"Lullaby stop playing after random amount of seconds. Software needs to be improved as well as the customer service/support.";"2016-02-22T08:00:48-07:00";"https://itunes.apple.com/us/review?id=936015067&type=Purple%20Software";"936015067";19;"en";"POSITIVE"
98;2147200486;"Juiceboxharry";"https://itunes.apple.com/us/reviews/id185006271";"2.7.3";1;"DO NOT BUY THE NOKIA HOME";"We bought this on a recommendation online and it has been nothing but hot garbage. It constantly fails to load a video stream of our baby’s room which is unnerving as a new parent. Totally inconsistent, totally unacceptable. Nokia also derailed the plans for the Home to become compatible with Apple’ secure HomeKit. I wish I could return this thing.";"2018-01-30T14:54:15-07:00";"https://itunes.apple.com/us/review?id=936015067&type=Purple%20Software";"936015067";60;"en";"NEGATIVE"
99;4979123666;"Nickname------";"https://itunes.apple.com/us/reviews/id43050578";"2.8.1";1;"Landfill substance";"Apple needs to remove this app from the store, it crashes on every launch. Sorry for everyone who bought this camera, (me included), this is expensive plastic with electronics to be put in the landfill. Can’t believe it is still being sold since it is dead on arrival.";"2019-10-19T13:35:33-07:00";"https://itunes.apple.com/us/review?id=936015067&type=Purple%20Software";"936015067";48;"en";"NEGATIVE"
100;1195945798;"BigDB1";"https://itunes.apple.com/us/reviews/id23046811";"1.4.0";2;"Continues to be buggy";"Have had for 2 months. Update disabled on unit. Other unit works intermittently after update. When working, these show excellent detail. But, the company is unreliable enough not to recommend them for the time being.";"2015-05-11T15:27:19-07:00";"https://itunes.apple.com/us/review?id=936015067&type=Purple%20Software";"936015067";35;"en";"NEGATIVE"
101;1996361247;"djkts2600f";"https://itunes.apple.com/us/reviews/id85111004";"2.7.3";1;"Stopped working";"The Apple TV app hasn’t worked since ios11 update and now my phone hasn’t worked since the last update. I bought this for the fact that worked over all iOS platforms and come to find out it doesn’t work on any. Very disappointed. Waste of money.";"2017-12-14T10:28:05-07:00";"https://itunes.apple.com/us/review?id=936015067&type=Purple%20Software";"936015067";46;"en";"NEGATIVE"
102;1373914965;"Thecongregator";"https://itunes.apple.com/us/reviews/id100182575";"2.4.0";1;"Unreliable MOTION DETECTION";"Motion detection in this camera should even be an advertised feature. It's totally unreliable! People passing in front of the camera literally taking all the frame and even though nothing is detected! Doesn't have the ability to select a portion of the frame to specifically get the motion detection from. Frustrating!";"2016-05-05T08:14:40-07:00";"https://itunes.apple.com/us/review?id=936015067&type=Purple%20Software";"936015067";51;"en";"NEGATIVE"
103;1357556014;"TimmyDee51";"https://itunes.apple.com/us/reviews/id30355769";"2.4.0";1;"Drops connection all the time";"I'm not sure which to blame—the app update or the new firmware—but fault definitely lies with the Withings engineers or product managers who released these updates. While before we were able to connect to the camera pretty reliably, now it's 50-50. Kind of defeats the purpose of the device.";"2016-04-02T12:04:42-07:00";"https://itunes.apple.com/us/review?id=936015067&type=Purple%20Software";"936015067";49;"en";"NEGATIVE"
104;1319683124;"MSR23456";"https://itunes.apple.com/us/reviews/id436579439";"2.2.1";1;"Terrible customer support";"Couldn't get the device to pair with my phone. Tried contacting customer support who were AWFUL. Only communicate by email and at one stage I waited 2 days for a response as they were guiding me through step by step troubleshooting. 

Gave up after about 4 hours trying to troubleshoot. Am returning it.";"2016-01-20T19:00:42-07:00";"https://itunes.apple.com/us/review?id=936015067&type=Purple%20Software";"936015067";53;"en";"POSITIVE"
105;1390232032;"MBugsy";"https://itunes.apple.com/us/reviews/id110081054";"2.4.0";1;"Frustrating. Doesn't connect to device";"After struggling for hours, I'm giving up. This is so frustrating, the withings app can't see the withings device. Everything else (like my phone) finds the device no problem, but the app cannot detect it and therefore I cannot use it. I want a refund.";"2016-06-06T21:47:12-07:00";"https://itunes.apple.com/us/review?id=936015067&type=Purple%20Software";"936015067";45;"en";"POSITIVE"
106;3556728836;"Jai Brown";"https://itunes.apple.com/us/reviews/id100657966";"2.7.3";2;"Major Update Needed";"For me personally, the app has a hard time connecting to the cameras live view. Most times it just sits in think mode. My camera is hard wired & I have pretty decent internet service. Please get this corrected sooner than later.";"2018-12-21T12:08:47-07:00";"https://itunes.apple.com/us/review?id=936015067&type=Purple%20Software";"936015067";42;"en";"POSITIVE"
107;6556023712;"Hemmi1jh";"https://itunes.apple.com/us/reviews/id29347513";"2.8.1";1;"Useless in iOS 14";"Ever since I updated to iOS 14, the camera just constantly is in a state of loading. This was a reliable camera; however with no updates in a year says the company has given up on support for the app.";"2020-10-20T11:46:01-07:00";"https://itunes.apple.com/us/review?id=936015067&type=Purple%20Software";"936015067";40;"en";"POSITIVE"
108;4370701611;"autwea";"https://itunes.apple.com/us/reviews/id1039617775";"2.8.0";2;"Disappointed";"When functioning properly this home camera is very handy. I’m sad to say more often then not it glitches out. The app crashes, sound does not play, camera lags etc.";"2019-06-25T22:26:44-07:00";"https://itunes.apple.com/us/review?id=936015067&type=Purple%20Software";"936015067";30;"en";"NEGATIVE"
109;2042100968;"babybopmath";"https://itunes.apple.com/us/reviews/id34635337";"2.7.3";1;"Can’t get the Home unit to connect after the first time connecting";"I first bought this item when it was called Withings Home.  It worked great until it was taken over by Nokia.  They even sent me a new unit, but after it makes the connection for the first time it won’t connect again.  😡😕";"2017-12-30T13:00:40-07:00";"https://itunes.apple.com/us/review?id=936015067&type=Purple%20Software";"936015067";43;"en";"NEGATIVE"
110;1237947355;"momo2008";"https://itunes.apple.com/us/reviews/id35023467";"1.5.0";1;"Terrible camera!!!";"I had for a couple of months and only worked twice!!!
Never find the camera, even know it list the camera on search all the time.
Software is so buggy!!!
Should have continue buying more Dropcam, have 5 and not disappointed like this one.";"2015-08-04T08:54:07-07:00";"https://itunes.apple.com/us/review?id=936015067&type=Purple%20Software";"936015067";44;"en";"POSITIVE"
111;2903575449;"Jordeng12345";"https://itunes.apple.com/us/reviews/id257702052";"2.7.3";1;"Baby monitor fail";"This is the WORST monitor! You’re better off getting up and checking on your child because by time you’re done checking, nursing, burping, and changing your kid... you’d still be waiting for the live view. The monitor sucked when it was Withings and it’s just as horrible now that it’s Nokia.";"2018-07-13T20:28:10-07:00";"https://itunes.apple.com/us/review?id=936015067&type=Purple%20Software";"936015067";51;"en";"NEGATIVE"
