"";"id";"userName";"userUrl";"version";"score";"title";"text";"updated";"url";"app";"wordCount";"language";"sentiment"
27;1357693113;"stephbain";"https://itunes.apple.com/us/reviews/id35613115";"2.4.0";1;"Not a reliable video baby monitor";"I've been using this as my baby monitor for a month now and it's super unreliable to the point where it's useless. The camera drops wifi constantly and when it does seem to be ""online"" the app never picks up the feed and just stays in a loading state so I'm unable to see what's going on in my baby's room. Also, the song feature of the baby monitor plays a song for about a minute and then just stops. I've never managed to get more than 60 seconds of music to come out it even if I set it to 20 minutes. Overall I'm regretting buying this as my baby monitor and have stopped using it.";"2016-04-02T19:13:57-07:00";"https://itunes.apple.com/us/review?id=936015067&type=Purple%20Software";"936015067";117;"en";"NEGATIVE"
28;1183483211;"Echols85";"https://itunes.apple.com/us/reviews/id38200075";"1.3.1";2;"So many bugs";"The camera itself is fine it seems, but the app is so buggy it makes the experience really frustrating. Once you get into full screen for video preview, it is sometimes difficult or impossible to get out without restarting the app. Notifications have not proved to be useful as the thresholds don't seem to be set properly. Not nearly as reliable as we would like for sure.";"2015-04-16T03:44:22-07:00";"https://itunes.apple.com/us/review?id=936015067&type=Purple%20Software";"936015067";67;"en";"POSITIVE"
29;1199434510;"Dyno998";"https://itunes.apple.com/us/reviews/id41853627";"1.4.0";1;"Can't get past setup :/";"Just bought the withings home video camera. Got home all excited to set it up... Bluetooth worked and paired ok. Setup then let's me do a quick setup to wifi. After that was done it takes me to a page that says configuration with ""next"" on it. It won't let me tap it. Instead it seems like the screen just hits next for me. Which is fine except I can NEVER get past this step. I've done a factory reset, reinstalled the app, done it all and all I can think of is its a software issue. I'll give the benefit of the doubt to the developers and see if they fix this the next couple of days, but if not I'll be returning it.";"2015-05-18T20:09:13-07:00";"https://itunes.apple.com/us/review?id=936015067&type=Purple%20Software";"936015067";125;"en";"POSITIVE"
30;2372253302;"hackasaurusrex";"https://itunes.apple.com/us/reviews/id30980655";"2.7.3";1;"Garbage. Do not buy, do not download.";"It’s been over a year since the live streaming worked. That’s a core feature which doesn’t exist, and there are a hundred reviews of the app which specifically mention this. 

Loading video from alerts only works about half of the time for me. Reading other reviews, it looks like I’m lucky it even loads that often. 

If live video doesn’t work and recorded video rarely does, what exactly is the point of the camera? Just to place somewhere conspicuous and hope that scares people into behaving? I can buy a fake camera which will do the same thing for a lot less.";"2018-04-01T13:01:30-07:00";"https://itunes.apple.com/us/review?id=936015067&type=Purple%20Software";"936015067";102;"en";"POSITIVE"
31;1348316333;"Feenjean87";"https://itunes.apple.com/us/reviews/id14958519";"2.4.0";5;"Keeps getting better";"I've had the Withings home for almost a year now. When starting out it was a little glitchy. Each update has made it more reliable. They have finally came out with an automation schedule where the camera can shut itself off or change itself to do not disturb. Love this feature!!";"2016-03-15T09:47:38-07:00";"https://itunes.apple.com/us/review?id=936015067&type=Purple%20Software";"936015067";51;"en";"NEGATIVE"
32;4223141691;"townmoron";"https://itunes.apple.com/us/reviews/id37806274";"2.8.0";1;"Amazing new update = dead app";"The app updated and gave me a notification for the “awesome new features.” As far as I can tell, the new features were less access to saved videos and a far worse interface (read: nearly impossible) for reviewing video. It constantly jumps back to the beginning and has no fine adjustment. Basically worthless. However, this problem seems minor in comparison to the newest feature, which is “crash on open, app useless.” It’s true what all the reviews say, each update just brings a worse experience. Bummer.";"2019-05-27T22:19:38-07:00";"https://itunes.apple.com/us/review?id=936015067&type=Purple%20Software";"936015067";86;"en";"NEGATIVE"
33;3730259329;"lionmaster3000";"https://itunes.apple.com/us/reviews/id106781514";"2.7.3";1;"Worst app ever for camera";"I gotten this camera for my new born in 2016 and over the years this app has not improved at all when comes to stability and features. I have a Apple TV and not once been able to use feature to see camera on my Apple TV. The app on iPhone is not at its best work and can be improved in many ways along with the Apple Watch app as well and never seen a update in over a year it is now time to get busy cuz this camera I must say is probably my worst investment on buying my first home camera when it was meant to watch my daughter.....";"2019-02-03T15:18:10-07:00";"https://itunes.apple.com/us/review?id=936015067&type=Purple%20Software";"936015067";113;"en";"NEGATIVE"
34;2323343342;"AzureGray";"https://itunes.apple.com/us/reviews/id450855108";"2.7.3";5;"Great App";"I love this app. It’s extremely user friendly and the video is crystal clear. I read all the reviews  first and decided against purchasing the Withings Home cam months ago but when I saw it on clearance I figured it was worth the try and so happy I did!! I will purchase more; even at original price and have recommended it to family and friends.";"2018-03-19T07:29:19-07:00";"https://itunes.apple.com/us/review?id=936015067&type=Purple%20Software";"936015067";65;"en";"POSITIVE"
35;1422522755;"scudco";"https://itunes.apple.com/us/reviews/id13951696";"2.4.0";1;"Always a hassle";"The camera constantly crashes making it endlessly flash orange. My son eventually wakes up confused why something in his room is flashing bright orange at him. Meanwhile, I've been asleep unsure if he's been calling out. The app doesn't even have an alarm letting me know the camera has crashed or can't be reached.

When it works it's great, but it fails so often for a product where reliability is probably the most important thing that it might as well not exist.

They should not advertise this as a baby monitor because it breaks far too often to be usable as one.";"2016-07-29T22:21:15-07:00";"https://itunes.apple.com/us/review?id=936015067&type=Purple%20Software";"936015067";102;"en";"POSITIVE"
36;1395949929;"dchoward1977";"https://itunes.apple.com/us/reviews/id21591300";"2.4.0";1;"Absolute garbage.";"This is, without a doubt, the worst device I've had the displeasure of using in years. A year ago, it worked pretty well. Slow to load, but reliable. Then they started ""upgrading"" and adding new ""features"". This resulting in constant disconnects and reboots. Support was useless, blaming the power supply (which eventually DID die).  This thing is completely worthless for its intended purpose, as a baby monitor. You will NEVER be able to rely on it to work when you need it to. A shame. It's nicely designed, but the execution is simply atrocious. I will NEVER PURCHASE ANOTHER WITHINGS DEVICE AGAIN.";"2016-06-17T08:01:14-07:00";"https://itunes.apple.com/us/review?id=936015067&type=Purple%20Software";"936015067";102;"en";"NEGATIVE"
37;1253954387;"WillGibsonLoL";"https://itunes.apple.com/us/reviews/id100845907";"2.0";5;"Great app";"This little camera has great resolution. The zoom feature is very nice with auto enhance when zoomed. I really like the air quality sensor. On more than one occasion I received a notification about poor air quality and immediately check the camera to see what was going on while I was away from home.";"2015-09-06T07:07:48-07:00";"https://itunes.apple.com/us/review?id=936015067&type=Purple%20Software";"936015067";54;"en";"POSITIVE"
38;4617897624;"Bassphil";"https://itunes.apple.com/us/reviews/id26184989";"2.8.0";1;"Wow, what a waste";"Seems like decent hardware, but the app is incredibly buggy! I’ve tried everything- relogging in to my account, restarting my iPhone, reinstalling the app, turning off various things like cellular data, wifi, Bluetooth, etc.... All of this on a brand new iPhone XR and a solid home network.  

I believe that I have tried every permutation of possibilities to get this horrible app to stabilize to no avail. It decides when it’s going to work and how long it wants to work, then flakes out. Really Nokia? In 2019? I’d cut it some slack if it was 2002, but there is no excuse now.";"2019-08-14T20:50:11-07:00";"https://itunes.apple.com/us/review?id=936015067&type=Purple%20Software";"936015067";104;"en";"NEGATIVE"
39;1562357681;"iSiloh";"https://itunes.apple.com/us/reviews/id275026682";"2.5.0";1;"Latest update broke everything";"The new streaming engine promised to make streaming smoother. Did you achieve that by reducing the quality? 
Video and audio quality dropped significantly. The camera is frequantly disconnecting. Hell it even started blinking staying disconnected for 4 hours and I had to pair it again. Air quality is no longer available. Lullabies are interrupted every 2 minutes for a few seconds and almost never reach the end of the timer. Even the white noise is no longer a white noise... 

Terrible update.";"2017-03-11T10:59:31-07:00";"https://itunes.apple.com/us/review?id=936015067&type=Purple%20Software";"936015067";82;"en";"NEGATIVE"
40;1358799452;"Jonny V N";"https://itunes.apple.com/us/reviews/id190775448";"2.4.0";1;"Camera makes this repetitive noise when no noise is present";"In general this is a good app with reasonable support for event logging. These are the problems:
1) camera occasionally hunts and I need to restart it (HW problem)
2) constant click sounds when no noise is present - makes it useless if you want to listen in and see if there is any noise
3) night vision is not good - just checked my home and I can't see a thing, it's totally black
4) motion detection is very susceptible to light contrast changes - not sure if this would be the same with similar products";"2016-04-05T01:00:47-07:00";"https://itunes.apple.com/us/review?id=936015067&type=Purple%20Software";"936015067";97;"en";"NEGATIVE"
41;1285679006;"Dlwalter";"https://itunes.apple.com/us/reviews/id11577013";"2.2";3;"Decent, but buggy and missing features.";"Generally the app is ok but it needs a bit of work. A mute button for starters.  I've also had the microphone button get stuck on and had to hard close the app to fix it. The lullaby is buggy and tends to stutter/buffer as well. 

Since they are marketing this as a baby monitor it needs a direct wifi / no internet mode. I can rely on this if my internet connection drops out.";"2015-11-12T11:57:39-07:00";"https://itunes.apple.com/us/review?id=936015067&type=Purple%20Software";"936015067";75;"en";"NEGATIVE"
42;3023052994;"Knightime5";"https://itunes.apple.com/us/reviews/id34770878";"2.7.3";1;"Wish I could give 0 stars";"To call this app “garbage” would be an insult to garbage. It used to work fine before when it was under Withings. Subsequent updates have left the app unresponsive. Many times, we are trying to just turn on the sound effects, but have to load/kill the app several times to get it to respond. These are critical seconds when our baby is on the verge of falling back asleep or waking up. Do yourself a favor and don’t get this product or use the app.";"2018-08-05T17:55:44-07:00";"https://itunes.apple.com/us/review?id=936015067&type=Purple%20Software";"936015067";85;"en";"NEGATIVE"
43;1976128974;"Boodlidoodliboo";"https://itunes.apple.com/us/reviews/id15763246";"2.7.3";1;"Waste of money";"This camera is one of the more expensive options out there and it’s a complete waste of money! The live video rarely loads, and it often have issues to connect to the WiFi, yet its able to record things if I go back to look at video footage from the past 24h, so it is clearly connected. Not to mention you then have to pay extra if you actually want to see normal speed good quality video. Would give this -100 stars if I could.";"2017-12-06T17:02:43-07:00";"https://itunes.apple.com/us/review?id=936015067&type=Purple%20Software";"936015067";85;"en";"POSITIVE"
44;1356137655;"Joshua Shifrin";"https://itunes.apple.com/us/reviews/id25589002";"2.4.0";1;"Poor Connectivity";"I really want to love this app & product but it continuously lets me down. I use the Withings primarily as a baby monitor. We have fast & I mean fast, internet but this thing cuts out often and displays a ""loading screen"" for AGES. When I use the word 'often' I mean at least 2-3 times in a 40 minute window. I keep hoping the next update will solve these connectivity issues. This isn't user error either, both my husband and myself are very tech savvy, app needs TLC. Wouldn't recommend.";"2016-03-30T19:26:42-07:00";"https://itunes.apple.com/us/review?id=936015067&type=Purple%20Software";"936015067";92;"en";"POSITIVE"
45;1254067917;"Aviles Fam";"https://itunes.apple.com/us/reviews/id206856812";"2.0";5;"Withings camera";"Our old camera was broken into two pieces by our twin toddlers so we had to buy a new one. The image is so clear, I love it! I'm not to crazy about how the camera looks. I think that they could've done a better job designing it but it functions fine.";"2015-09-06T12:03:34-07:00";"https://itunes.apple.com/us/review?id=936015067&type=Purple%20Software";"936015067";52;"en";"POSITIVE"
46;1354049608;"unhappyhomelife";"https://itunes.apple.com/us/reviews/id428989729";"2.4.0";1;"Home product is a waste of money";"The company only provide support via email. Since the March firmware update my two cameras have stopped working the company has decided to blame a hardware failure for the problems I'm having. Before the firmware update the devices were difficult to use as firmware updates would come periodically and the only way to get the device back online was to be in front of the device with a Bluetooth connection. Save your money do not purchase this product.";"2016-03-26T14:35:43-07:00";"https://itunes.apple.com/us/review?id=936015067&type=Purple%20Software";"936015067";78;"en";"NEGATIVE"
47;1171141255;"S4x1";"https://itunes.apple.com/us/reviews/id182014746";"1.3.0";5;"Great Update";"We just had our 3rd baby, and this is the perfect IP cam.   We didn't want a dropcam in the baby room, but the design of Home works and the air quality feature and nightlight are appreciated.

Setup took about two minutes including an OTA update, then started working immediately.

The 24 rewind feature is very cool, and night vision is much better than our old baby monitor.

The diary feature makes it easy to review and find  events.

HD quality is excellent, with a wide view and minimal fisheye.

We'll likely add a 2nd unit for peace of mind in other parts of the house.";"2015-03-21T04:00:37-07:00";"https://itunes.apple.com/us/review?id=936015067&type=Purple%20Software";"936015067";106;"en";"POSITIVE"
48;3559755536;"Duhkatt";"https://itunes.apple.com/us/reviews/id35607438";"2.7.3";1;"Poor quality";"The app crashes constantly on my iPhone  X while on WiFi. The Nokia server constantly times out and doesn’t load the video feed. The video will not load if on 4G LTR. Nokia stopped supporting the app but still sells the device. Nokia, either support the device or stop the sales, that concept is really messed up and I’m abandoning you as a company as a result. This is a baby monitor health app, better get it right and support it... not just dust off your ha Dsp and walk away after maki g the sale.. fawkers";"2018-12-22T06:43:04-07:00";"https://itunes.apple.com/us/review?id=936015067&type=Purple%20Software";"936015067";97;"en";"POSITIVE"
49;1377618637;"Budfox888";"https://itunes.apple.com/us/reviews/id160405301";"2.4.0";5;"Works as it should";"I was really worried when I saw all the bad reviews this app had here (I only saw them when I got the app after I received the camera) but I have to say, I had zero issues with the camera in the 2 months we have been using it.";"2016-05-12T13:31:45-07:00";"https://itunes.apple.com/us/review?id=936015067&type=Purple%20Software";"936015067";50;"en";"NEGATIVE"
50;1560066595;"sgthalka";"https://itunes.apple.com/us/reviews/id35520029";"2.5.0";2;"Avoid latest update";"Monitor has worked great for past 8-9 months. Latest app update severely degrades video and audio quality -- noticeably choppy, laggy on what was previously a great connection. Monitor also routinely cuts off or shuts down overnight, so we wake up to the shouts of our baby down the hall but nothing on the monitor each morning.";"2017-03-08T05:16:25-07:00";"https://itunes.apple.com/us/review?id=936015067&type=Purple%20Software";"936015067";57;"en";"POSITIVE"
51;4879641346;"SS-";"https://itunes.apple.com/us/reviews/id11981169";"2.8.1";1;"Sooo bad!!!";"For whatever reason my fiancé doesn’t see much of a problem with it but he also doesn’t use it as much as I do. 
First it was glitchy- I have really good internet so that’s not the case.
Then the live feed wouldn’t ever update but the movement snippets it would record. 
Now whenever I try to open it just closes immediately, I I can’t even get into the app. I really hope y’all figure it out soon because it looks like you have a lot of unhappy customers.";"2019-10-03T13:47:27-07:00";"https://itunes.apple.com/us/review?id=936015067&type=Purple%20Software";"936015067";89;"en";"POSITIVE"
52;3091758628;"St.Peter 61010";"https://itunes.apple.com/us/reviews/id111310789";"2.7.3";1;"Failure to connect";"I have spent my money on 4 of the Nokia cameras.. i pay about $20 a month for better quality. But for whatever reason my app will not connect to my cameras most of the time. Doesn’t matter if I’m connected to WiFi or have full service. They just sit there loading. These are the sole monitors i have for my child and my home. I love the quality of the picture... but that’s it. I’m so upset. I don’t feel safe having my son sleep in his room without a dependable monitor.";"2018-08-20T11:09:44-07:00";"https://itunes.apple.com/us/review?id=936015067&type=Purple%20Software";"936015067";93;"en";"POSITIVE"
53;1264970597;"Svatne";"https://itunes.apple.com/us/reviews/id121993831";"2.0.1";5;"Home security cam";"We bought two old theses for our two houses so that we can see if anything is out of order at the other one.
They were very easy to set up, and work well.
We have recommended them to friends.";"2015-09-30T09:46:26-07:00";"https://itunes.apple.com/us/review?id=936015067&type=Purple%20Software";"936015067";40;"en";"POSITIVE"
54;1672493855;"T$Mills";"https://itunes.apple.com/us/reviews/id11673986";"2.7.1";1;"Nokia Ruined It";"Since the Nokia acquisition of Withings, this app has been rendered useless. As a baby monitor, we rely on the cameras ability to play sound while we sleep, do house chores, etc. EVERY NIGHT: the camera loses connection, and we wake to our baby screaming in the other room. Had the camera worked as advertised, we would have heard his whimpers and complaints sooner. 

Shame on you Nokia. Buyer beware, this app (and product subsequently) is a waste of your money.";"2017-07-07T03:01:11-07:00";"https://itunes.apple.com/us/review?id=936015067&type=Purple%20Software";"936015067";81;"en";"NEGATIVE"
55;1282511815;"dork08";"https://itunes.apple.com/us/reviews/id85842370";"2.1";1;"Crappy security";"Don't waste your money on this crappy camera and software!!!!! It totally unreliable. It doesn't alert you when the camera is down esp during the update. It constantly keep telling tht it not connect to wifi or power but it is. I've had it for almost a year now n wish I can take it back within 14 days if I knew it going to be this bad. Now it being used as a night light since all I can see is the orange glow 24/7.";"2015-11-05T17:47:28-07:00";"https://itunes.apple.com/us/review?id=936015067&type=Purple%20Software";"936015067";86;"en";"NEGATIVE"
56;1173371640;"Magan318";"https://itunes.apple.com/us/reviews/id15374671";"1.3.1";1;"Irritated and wanting to return";"Device either constantly gives me a blank screen stating ""withings home is in privacy mode"" with no obvious explanation for this.  And now after an update when it does have a visual, the screen clicks and goes blank, then after a few seconds reappears... Then goes blank again, and repeat. Also when I attempt to connect my Bluetooth, it does not recognize any device for which I can connect.";"2015-03-25T21:03:55-07:00";"https://itunes.apple.com/us/review?id=936015067&type=Purple%20Software";"936015067";69;"en";"NEGATIVE"
57;1422497298;"Mom 🙂";"https://itunes.apple.com/us/reviews/id209474618";"2.4.0";5;"Great camera";"Everything about it is great it does everything good picture quality great night vision great sound quality great I have no complaints app very easy to use set up super easy and it's free no real Subscription needed";"2016-07-29T21:24:53-07:00";"https://itunes.apple.com/us/review?id=936015067&type=Purple%20Software";"936015067";38;"en";"POSITIVE"
58;1651690630;"jsid99";"https://itunes.apple.com/us/reviews/id38607245";"2.7.1";5;"Works fine as previous";"It kept crashing with the update. I deleted and reinstalled the app. Now it works same as before with no crashing.";"2017-06-20T19:58:13-07:00";"https://itunes.apple.com/us/review?id=936015067&type=Purple%20Software";"936015067";21;"en";"NEGATIVE"
59;1294107003;"Encino745";"https://itunes.apple.com/us/reviews/id145762219";"2.2";1;"Completely down.  Horrible";"This camera worked  for a couple of months.  Since the update about a month ago, it has been horrible.  It is completely down at this point.  My iPhone states to ""check the Wifi connection"".  Of course, nothing wrong with the connection, the app and camera is a piece of crap.  One of our iPhones can't even find the camera on WiFi.  Withings and Apple should be ashamed.";"2015-11-30T18:35:05-07:00";"https://itunes.apple.com/us/review?id=936015067&type=Purple%20Software";"936015067";67;"en";"NEGATIVE"
60;4948077989;"Les S";"https://itunes.apple.com/us/reviews/id37192013";"2.8.1";3;"Works FANTASTIC SECURITY FEATURE!!!!!!";"The app has this FANTASTIC SECURITY FEATURE where you have to delete the app after some random amount of time and install it again otherwise you app crashes and you can’t log in!!! A feature that is truly ahead of its time and has user ease of use as a top priority!!!! Highly recommend!!!";"2019-10-14T14:00:36-07:00";"https://itunes.apple.com/us/review?id=936015067&type=Purple%20Software";"936015067";54;"en";"POSITIVE"
61;4942367253;"MobileAppsGuru";"https://itunes.apple.com/us/reviews/id86622671";"2.8.1";1;"Please fix this terrible app!";"I literally have to delete and reinstall this app every other day because it'll randomly start crashing in boot and nothing except reinstalling will recover it. It's always been a crappy app but now that Withings bought it back from Nokia it's almost unusable. PLEASE fix this so my Home Cam is more than a dumb paperweight! It really can't be that complicated given how little the app needs to do.";"2019-10-13T14:06:38-07:00";"https://itunes.apple.com/us/review?id=936015067&type=Purple%20Software";"936015067";71;"en";"NEGATIVE"
62;4184488356;"Leehitchen";"https://itunes.apple.com/us/reviews/id153966267";"2.8.0";1;"App crashes every time";"When we first bought it a year ago it was great. Over time, it has declined. As of now, the app just constantly crashes and turns itself off during the night so you won’t hear your child, never mind seeing them. I’ve tried turning it on and off, the phone too, deleting and reinstalling the app, all to no avail. Very disappointing. Just won’t work. Waste of money.";"2019-05-20T23:27:49-07:00";"https://itunes.apple.com/us/review?id=936015067&type=Purple%20Software";"936015067";68;"en";"NEGATIVE"
63;2077252716;"rocketdutch";"https://itunes.apple.com/us/reviews/id119544773";"2.7.3";1;"Just bought one from Target";"I thought why not. On sale for $89. Easy set up and plug in. Downloaded application no problem. Then hit a hard stop. Application can’t find the device. Application expects blinking blue. Device blinks orange. Hours on the internet trying to set up. Nokia or Withings site does not address the issue. I feel like a just wasted my money on a useless home security camera. Maybe the application will get fixed.";"2018-01-10T19:55:59-07:00";"https://itunes.apple.com/us/review?id=936015067&type=Purple%20Software";"936015067";72;"en";"POSITIVE"
64;1217240545;"Macan2345";"https://itunes.apple.com/us/reviews/id149295617";"1.5.0";1;"Don't buy!";"Selling something that simply does not work is fraudulent. The CEO should be arrested. You don't go to market with something that does not function. It's legally, ethically and morally wrong. CEO, do you sleep at night? There are countless other bad reviews but these guys purport to update their app to get rid of them. There were ten negative comments a week ago. Watch, there will be an ""update"" soon and I'll have to repost this comment again.";"2015-06-24T10:13:38-07:00";"https://itunes.apple.com/us/review?id=936015067&type=Purple%20Software";"936015067";79;"en";"NEGATIVE"
