"";"id";"userName";"userUrl";"version";"score";"title";"text";"updated";"url";"app";"wordCount";"language";"sentiment"
0;1346506064;"Sosososodope";"https://itunes.apple.com/us/reviews/id40312273";"2.4.0";2;"Completely unreliable so far";"I've owned the Home and used its app for four days now, and everyday the livestream has cut out or the Home has shut off completely, multiple times. The last update seemingly did nothing to improve this. I'm on a fast wifi connection, with no outages in that room.

I can't only hope the next one significantly improves the reliability of this app and device, but at this rate, I'll be returning it before I find out.

Two stars because when it does work as expected, it's a great product and system. Unfortunately, that's far too infrequently.";"2016-03-11T20:41:52-07:00";"https://itunes.apple.com/us/review?id=936015067&type=Purple%20Software";"936015067";97;"en";"POSITIVE"
1;7298736240;"Nadie55";"https://itunes.apple.com/us/reviews/id363950723";"3.0.0";1;"of the worst";"the camera works for a very short time and is disposable. the support does not change it or give you a solution I was a user who bought the device It just came on the market and they never gave me a solution and like other users the software does not work, I have the team in Spain 2 years ago and I never found a technical service. do not buy is a scam";"2021-05-04T15:43:16-07:00";"https://itunes.apple.com/us/review?id=936015067&type=Purple%20Software";"936015067";74;"en";"POSITIVE"
2;7502648891;"whd4";"https://itunes.apple.com/us/reviews/id119300004";"3.0.0";1;"Quite frankly the worst app";"I wish, like many others I could rate this app a negative star. They tried to update it and it’s possibly worse than before. The live view reverts to older images and so features like turning on the music or lights is not an option in addition to not being able to monitor your child.";"2021-06-24T19:00:40-07:00";"https://itunes.apple.com/us/review?id=936015067&type=Purple%20Software";"936015067";55;"en";"NEUTRAL"
3;7430665573;"Stumpgrip";"https://itunes.apple.com/us/reviews/id156942482";"3.0.0";1;"Use ANY other product";"Both the hardware and the app are horrendous. Aside from the fact that the camera works sometimes, I’d say both the hardware and the app border on not even being functional.";"2021-06-05T12:34:06-07:00";"https://itunes.apple.com/us/review?id=936015067&type=Purple%20Software";"936015067";31;"en";"NEGATIVE"
4;7726249132;"Umut Akparlar";"https://itunes.apple.com/us/reviews/id173580809";"3.0.0";1;"HomeKit feature request";"HomeKit integration needed if possible";"2021-08-23T10:35:26-07:00";"https://itunes.apple.com/us/review?id=936015067&type=Purple%20Software";"936015067";5;"en";"NEUTRAL"
5;4935698546;"darkangel916";"https://itunes.apple.com/us/reviews/id87213210";"2.8.1";1;"Very Frustrated";"I was a fan of Nokia before because they used to make good and durable phones so when I was shopping for a camera for my daughter’s nursery at Babies R Us and I saw this Nokia home camera on the shelf I didn’t even have a second thought on buying it. I was so excited to start using it but I was extremely disappointed and frustrated! The video quality is crap. And no it’s not my internet connection because it’s working perfectly fine on all our other wifi devices. The app keeps shutting down so we have to keep resetting the device almost everyday. I like that this home camera has white noise because my daughter can’t sleep without white noise. I always set the white noise nonstop whenever I put my daughter down for a nap or to bed at night. Since the app keeps shutting down the white noise goes too and guess who wakes up everytime the white noise turns off? My daughter! Sometimes the app stays on but the white noise turns off by itself even though I set it nonstop. Sometimes it turns on by itself I guess when it reboots I don’t know. Sadly, I can’t return this and get a refund since it was a final sale from Babies R Us when they were closing down last year. I don’t know if it’s the device or the app but they need to fix it because the device is not worth a penny! Please don’t buy this piece of crap unless Nokia or Withings fix the issues! Waste of money!";"2019-10-12T19:16:59-07:00";"https://itunes.apple.com/us/review?id=936015067&type=Purple%20Software";"936015067";267;"en";"NEGATIVE"
6;1254412371;"Bald Wally";"https://itunes.apple.com/us/reviews/id109360433";"2.0.1";4;"Works well";"We have used the app and cams for home security and together they do a decent job of capturing motion and sound. Recent firmware and app improvements have improved ease of use and options. High marks for can appearance, size and a crisp wide angle lens which significantly exceeds the visual range and clarity of competing stationary cam products we have used. Plus the subtle and aesthetically pleasing camera housing prevents our home from looking like some type of NSA observation outpost to arriving guests which is also important! The cams are little pricy at first glance, but the added visual scope allowed us to reduce the number needed from 4 to just 2 which wound up saving us around $100. Would really like to see user-initiated realtime video recording added to the current snapshot option, and a simultaneous live multi-cam option, as well as a multi-frame desktop application that could be used for viewing on a regular Mac laptop.";"2015-09-07T08:13:07-07:00";"https://itunes.apple.com/us/review?id=936015067&type=Purple%20Software";"936015067";160;"en";"POSITIVE"
7;2935473528;"Tayeast12";"https://itunes.apple.com/us/reviews/id194799995";"2.7.3";3;"App crashed in the middle of the night";"This is/was the only monitor we were using for our 5 month old baby. We moved him to his own room last night and set it up in there. Before I went to bed I turned on the app, put it in baby monitor mode and turned up the volume. He doesn’t sleep through the night. Around 2 am I woke up out of habit and thought wow, he’s sleeping well. I checked the app just to take a peak at him and while the camera was still running in his room the app had crashed, and he had been crying for an hour and I could not hear him! I was horrified. As this camera was marketed as a baby monitor and the app crashes in the middle of the night!! I checked my phone to make sure it had not restarted but it took my fingerprint right away (I have an iPhone so if it reboots it will not accept Touch ID). I am so disappointed in this app. How can I trust it now?";"2018-07-19T10:30:02-07:00";"https://itunes.apple.com/us/review?id=936015067&type=Purple%20Software";"936015067";177;"en";"NEGATIVE"
8;4020949517;"princessozma";"https://itunes.apple.com/us/reviews/id38920244";"2.7.3";1;"Update Review - Glitchy glitchy glitchy";"Since the newest IOS update the camera, sound, etc are just glitchy and not functioning. Video quality is also extra grainy. Nokia needs to fix this. 

When I first reviewed this I was frustrated because it took a bunch of reboots to get it working. After that first week or so, it started working really well & have had few problems since. The image quality, lights, & noise machine are great! I also like the 24 hr replay. The look is sleek & easy to adjust. It’s easy to turn on and off with the app too. I would love to see a rewind though: sometimes I hear a noise, grab my phone, and my son looks fast asleep. I’d like to see the 10 seconds or so before that. HUGE note to future users: if you don’t shut off cellular for the app, it gobbles up data like crazy. I only use on a WiFi connection now. Cellular data would pick up if there was a weak signal before & I burned through data so fast. Otherwise, really happy!";"2019-04-16T11:06:16-07:00";"https://itunes.apple.com/us/review?id=936015067&type=Purple%20Software";"936015067";180;"en";"POSITIVE"
9;4980894808;"walani4414";"https://itunes.apple.com/us/reviews/id46095459";"2.8.1";1;"Terrible product support";"I think withings/Nokia (whoever the heck owns it now idk) just gave up on this product. The app usually takes a long time to update to get it to work after a major iOS update. It’s now been almost a month since iOS 13 was released, and I still can’t even open the app without it crashing because it hasn’t been updated yet, which is absolutely inexcusable for a security camera that costs $200. Makes the product basically worthless, not even considering the fact it’s always disconnecting and I’ll have to do a manual hard reset to get it back up and running again (which involves a tedious process of u plugging and replugging the unit in multiple times). I tried to give this product hope but I’m just gonna give up and accept the fact I wasted $200 on this and buy a security camera from another company. Get your crap together withings; your scales are great but your security camera is trash town and is a scam.";"2019-10-19T18:10:37-07:00";"https://itunes.apple.com/us/review?id=936015067&type=Purple%20Software";"936015067";169;"en";"POSITIVE"
10;1226252409;"Anniemomster";"https://itunes.apple.com/us/reviews/id221300885";"1.4.0";5;"I love this";"I just opened the box and downloaded the app... It took me through all steps and I am set up, ready to go, up and running! Bought this for new baby but it's also great for seeing my kids in another room or even watching my dog and home during the days.
I have iPhone 5, latest software. Maybe that's where some are having problems. I had none whatsoever! This thing is awesome!
Update: When I went to the hospital to have the baby I was able to watch my kids at home from the hospital on the camera and am now using it as a baby monitor. I love the lullibys ta-boot!
The only thing I've noticed wrong is ""feedback"" if I get close with my iphone if the ap is on and running... other then that.... I'm very Happy! Smooth sailing!!!!  This is great!";"2015-07-12T12:16:51-07:00";"https://itunes.apple.com/us/review?id=936015067&type=Purple%20Software";"936015067";146;"en";"POSITIVE"
11;1142280522;"Jfjfhvhjd88";"https://itunes.apple.com/us/reviews/id302750190";"1.2.0";3;"Beta Tester";"Out of the box, I'd recommend Dropcam for a far more seamless experience but I'm crossing my fingers that Withings comes through on fixing the bugs and adding features. I've disabled audio notifications, nearly useless when it triggers nearly at random while I'm out of the house. Movement detection is just as sensitive, passing clouds and changes in outdoor daylight set off notifications as well. Short videos captured to the diary are a neat feature but only if there's some way to record video to local/cloud storage - which won't  be available until March. Otherwise, the diary only captures a frames of a few seconds which isn't useful on its own. I'd love to see an update where notifications are disabled on proximity to a device, a bit tiring having my phone alert me to walking around the house. Looking forward to seeing updates.";"2015-02-05T17:07:16-07:00";"https://itunes.apple.com/us/review?id=936015067&type=Purple%20Software";"936015067";144;"en";"POSITIVE"
12;4025403892;"danza23";"https://itunes.apple.com/us/reviews/id40570320";"2.7.3";1;"DO NOT BUY THIS PRODUCT, can I rate it 0?";"This may be the first review I’ve ever written but it’s only because this useless product has compelled me to warn other consumers to not waste time or money or valued patience on this so-called product. It’s a baby monitor so inherently the expectation that it will be fairly easy to use and a safe method to look after your infants or children. The app crashes constantly and the video feed is always “loading”. Delete app, reinstall, log in log out, triple checking all WiFi router and modem connections, unplug device, checking IP speeds and connections and even employing my IT specialist brother-in-law are all fruitless endeavors and methods to attempt to make this piece of junk work. We can’t even get past the login page. The only saving grace is that it was a gift from our registry and we didn’t waste money on it but unfortunately someone we know did. Time to buy another monitor and warn others about this useless device.";"2019-04-17T12:50:37-07:00";"https://itunes.apple.com/us/review?id=936015067&type=Purple%20Software";"936015067";164;"en";"POSITIVE"
13;1254797302;"GordonGriswold";"https://itunes.apple.com/us/reviews/id24426940";"2.0.1";5;"Fantastic Camera & Software";"I started using this camera and software about three or four months ago. I'm really impressed with the many improvements that they continue to make and the overall performance that it provides. The camera image and sound is truly impressive! Thing I could suggest that during playback of the video if there was an option to play it slower during a segment of the video. Overall I am extremely happy with my purchase I would recommend it to anybody who is looking for a good camera with sound as a monitoring system in your home or business...";"2015-09-08T05:59:59-07:00";"https://itunes.apple.com/us/review?id=936015067&type=Purple%20Software";"936015067";97;"en";"POSITIVE"
14;1554808274;"waldon";"https://itunes.apple.com/us/reviews/id39366348";"2.5.0";5;"FINALLY fixed the orange light blinking";"The Withings Home is the best monitor we've ever had, EXCEPT for the occasional connectivity issues, which would cause the monitor to blink orange. This always woke our child up. Terrible idea for a baby monitor.

This update finally allows you to turn off the orange light blinking. Everything about the Withings Home was spectacular except for this feature. The picture is fantastic; the app well-designed; the video recording was flawless; the lullaby and audio and night light; the VOC detection. Everything. Now we can finally use it for what we've been wanting to use it for.";"2017-02-28T19:49:39-07:00";"https://itunes.apple.com/us/review?id=936015067&type=Purple%20Software";"936015067";97;"en";"POSITIVE"
15;1207859673;"Fitzbo";"https://itunes.apple.com/us/reviews/id38043381";"1.4.2";1;"Complete Crap!";"So I got the hard sell at the Apple Store because they no longer carry drop cam. The sales person said this is the best camera on the market. Since I use everything apple I figure it should be great! WRONG!

This is a crap product worked for 2 days and now won't work no customer service at all and since I travel a lot ( which is why I wanted a camera) I won't be back in time to bring this piece of crap back to the Apple Store for a refund!

Do yourself a favor stay far away from anything with this company product are made like crap they work (no really) like crap and no customer service. Ok Withthings you got $200 out of me but never again. When will companies wake up that when you burn customers they don't come back and write these kinda of reviews. 

This is junk stay away! You have been warned otherwise make your donation.

UPDATE

So after almost a week the top notch customer service rep emails me and ask if it could be my wifi or router. REALLY after reading all the prior review this seems to be a general theme work but then disconnects. The idiot customer service rep the never responds to my answer I'm sure next month they may get to responding. All I can say is DROPCAM DROPCAM DROPCAM.";"2015-06-05T20:57:37-07:00";"https://itunes.apple.com/us/review?id=936015067&type=Purple%20Software";"936015067";234;"en";"NEGATIVE"
16;2345916548;"Mizmuscy";"https://itunes.apple.com/us/reviews/id39413251";"2.7.3";4;"Almost perfect";"We really love this monitor and user friendliness of the app. There have been a couple of times it has stopped working and customer service has been great with helping reset it. The only downfall is that I can’t simultaneously use this app and run another app with an audio feature. For example, my iPhone X alarm doesn’t work when I have the Nokia Home app running (which is all the time), or I can’t catch up on Marco Polo video messages while my baby naps, or simply play any videos I’ve recorded if my Nokia Home app is running. I would change my rating to a 5 star if this was fixed.";"2018-03-25T11:46:10-07:00";"https://itunes.apple.com/us/review?id=936015067&type=Purple%20Software";"936015067";113;"en";"POSITIVE"
17;1342505203;"Concerned New Parent";"https://itunes.apple.com/us/reviews/id21254643";"2.3.0";1;"Warning - UNRELIABLE!!!";"DO NOT purchase this product as a baby monitor!!! I cannot stress this enough!! It is completely UNRELIABLE! I am up at 5 AM and angry because for the 5th time this week it is not working. It says check the power and wifi connection, both of which are definitely working, it is just this product that is so terrible! On top of that, when it doesn't work, the unit glows orange on and off, so now I can't see my baby, and there is a bright orange glow in his room. The only way to make it stop is to sneak in his room and unplug it, and last time I tried that he woke up...
This is an absolutely terrible product and I want to warn all new parents out there. Do not use this as a baby monitor, unless you don't really care about monitoring your baby because it fails so often!!";"2016-03-04T03:29:33-07:00";"https://itunes.apple.com/us/review?id=936015067&type=Purple%20Software";"936015067";155;"en";"NEGATIVE"
18;3429660264;"fearlessexplorer";"https://itunes.apple.com/us/reviews/id106455784";"2.7.3";1;"Waste of time & money!!!";"App is unable to connect to the Home Cam. I’ve only had the device for about four months. Uninstall reinstall of app was of no help. Made the mistake of disassociating the camera from the app, as when I try to reassociate the camera will not go into blinking blue mode.  The camera flashes green like it’s connected to my network, but the app does not recognize it’s connected to the network and wants to reinstall the camera which is impossible because it never goes into the blue blinking mode.
Back in the late 1990s and early 2000‘s I worked for a major telecommunications company and swore by Nokia products. They were hands-down the best cell phones against any other manufacturer, including Motorola. What the hell happened to Nokia!";"2018-11-17T13:42:52-07:00";"https://itunes.apple.com/us/review?id=936015067&type=Purple%20Software";"936015067";129;"en";"NEGATIVE"
19;1248152805;"kroll1979";"https://itunes.apple.com/us/reviews/id128024801";"2.0";5;"Loved it";"I would rate right now as 2 stars after the last update the camera is not working well!
It turned of by itself throughout the night and we were using as a baby monitor! Baby walk up moved and started to cry allowed, screaming and the app didn't notified us! I traveled left on and no notification yet and my father in law makes noise in the house so I know it should be sending notifications! If it doesn't work till the end of this week we are considering returning this. Which brakes my heart cause I love whithings";"2015-08-24T19:23:33-07:00";"https://itunes.apple.com/us/review?id=936015067&type=Purple%20Software";"936015067";99;"en";"POSITIVE"
20;1291901526;"D-Party";"https://itunes.apple.com/us/reviews/id28570456";"2.2";1;"Huge Disappointment";"I bought this device with high hopes of a great security system. Not only is the software buggy, but the device itself randomly cuts out. The time lapse is always saying ""No Pictures"" and when I get a notification, I can't view what it was. Even the live video is laggy with night vision not knowing when to activate. I have really good wifi and this thing loses connection often requiring me to unplug the device and plug it back in. It will also make weird clicking noises that would also require me to unplug the device. Even when the time lapse was working, it would miss key moments and movement if someone were to go outside. My advice would be to stay away from this product.";"2015-11-26T04:59:48-07:00";"https://itunes.apple.com/us/review?id=936015067&type=Purple%20Software";"936015067";127;"en";"POSITIVE"
21;5184655292;"Chayah";"https://itunes.apple.com/us/reviews/id31943282";"2.8.1";1;"No longer works";"So this was all fine and dandy when I first got this, in 2015. I was going through a divorce from an abusive man against whom I had an order of protection, but had my suspicions he was getting into my home when I wasn’t around. (I was right!) I would’ve praised this app highly at the time. It worked great and kept me safe. 

Now it’s 2019 and the app flat up doesn’t work. You can’t even open it. This renders the camera completely useless. 

I just got a notification from my smart lock that someone just entered my home! Is it my ex?!?! Who knows! Could be! I tried to launch the app but it just crashes. What crap.";"2019-11-22T20:38:50-07:00";"https://itunes.apple.com/us/review?id=936015067&type=Purple%20Software";"936015067";121;"en";"POSITIVE"
22;1365904582;"stevenleevan";"https://itunes.apple.com/us/reviews/id133506210";"2.4.0";1;"Frustrating.";"I really want this to be a complete solution for baby monitoring and home security but it is completely unreliable and fails at doing anything. I have ended up spending hours trying to get this to work properly and it never seems to work right or for long. I attempted resets and basic troubleshooting tirelessly.  This machine would be amazing if it worked and I do not understand why it will not. I've contacted Withings support and provided feedback but have received no responses from the company and of course I can not return the device now, though I should have. Another complaint is that you can only have baby sounds for a maximum of 60 minutes.";"2016-04-19T17:46:57-07:00";"https://itunes.apple.com/us/review?id=936015067&type=Purple%20Software";"936015067";117;"en";"POSITIVE"
23;1674957213;"squarefish_";"https://itunes.apple.com/us/reviews/id25608719";"2.7.1";4;"Almost as good as it used to be";"I've had a Withings Home Cam for a few years. It's almost always worked well. There have been a few hiccups but about the same as other wifi cameras I have used. Since Nokia took over I find night-vision is worse and there is a longer delay (3-4s) between what is happening live and when I hear it through the app.  Overall still good cameras and I do use them as baby cams too. I would get another but only if they support HomeKit.";"2017-07-08T23:05:20-07:00";"https://itunes.apple.com/us/review?id=936015067&type=Purple%20Software";"936015067";84;"en";"POSITIVE"
24;4407513233;"savsark";"https://itunes.apple.com/us/reviews/id177506627";"2.8.0";1;"Never works";"I had zero issues for the first couple months  of the app back in May 18’ but now it NEVER works. App was updated recently and it’s worse than before!!! I hate that I bought a $150 baby monitor and I can never see or hear my kid. Don’t buy Nokia products. Don’t download this app. It’s a waste and listen to the reviews. And if your wondering my WiFi is great so it’s not a connectivity issue.

UPDATE: I got it to work every couple days after my last review and then again another POINTLESS update that now causes the app to not even open anymore. I’m so sick of this app. Why bother putting out an update that’s going to make it worse every time?";"2019-07-03T19:07:01-07:00";"https://itunes.apple.com/us/review?id=936015067&type=Purple%20Software";"936015067";127;"en";"NEGATIVE"
25;3505091397;"BrunerMA";"https://itunes.apple.com/us/reviews/id42092903";"2.7.3";1;"So disappointed in what was initially advertised vs what it has become";"Over Black Friday shopping, I purchased multiple (5) cameras for our home, recalling the initial advertisements when the cameras were first released about HomeKit compatibility. They arrived today...

I set up one, then realized the HomeKit support originally advertised was never delivered. (That’s on me for not checking recent specs)

Then I did more reading, found the tvOS app had been deprecated. So now I have five cameras that don’t integrate with the rest of my home appliances. Needless to say, I’ve initiated my return and am shipping them all back, less than an hour after receiving them. 

I read Withings is back to its own company vs a subsidiary of Nokia. I really love your scales, and was hopeful about these cameras. 

I hope now that the company is run by an original founder, you put an emphasis on implementing HomeKit functionality. It’s only software now, no dedicated security chip required. I’d purchase them again if you did...";"2018-12-07T13:21:28-07:00";"https://itunes.apple.com/us/review?id=936015067&type=Purple%20Software";"936015067";159;"en";"POSITIVE"
26;4479788763;"ijmen2017";"https://itunes.apple.com/us/reviews/id85072240";"2.8.0";5;"Good device";"I use the Nokia Home Security device to monitor dogs while away and the air quality, using the app. It works perfect, can listen and talk to them. Also, can see when air becomes polluted, like when applying air freshener or other chemicals or too much dust (very rare). If I want privacy just turn camera off by rotating the ring over the camera and it just monitors air quality. Great app on my iPhone.";"2019-07-18T05:36:09-07:00";"https://itunes.apple.com/us/review?id=936015067&type=Purple%20Software";"936015067";75;"en";"POSITIVE"
