"";"id";"userName";"userUrl";"version";"score";"title";"text";"updated";"url";"app";"wordCount";"language";"sentiment"
170;1353004663;"Gullah07";"https://itunes.apple.com/us/reviews/id127338084";"2.4.0";1;"Stop Working!";"After the last update, the device stopped working. My phone can not find the device when it is right next to camera. It only flashes orange now.";"2016-03-24T17:53:28-07:00";"https://itunes.apple.com/us/review?id=936015067&type=Purple%20Software";"936015067";27;"en";"NEGATIVE"
171;1595369972;"blueclouds191";"https://itunes.apple.com/us/reviews/id8087625";"2.5.0";1;"Not worth the money";"For the price of this baby monitor, it would be nice if it could show something other than ""loading."" Definitely need lots of updates.";"2017-04-22T19:30:54-07:00";"https://itunes.apple.com/us/review?id=936015067&type=Purple%20Software";"936015067";24;"en";"POSITIVE"
172;1554663471;"BusinessExec";"https://itunes.apple.com/us/reviews/id156787674";"2.5.0";1;"Sound is terrible and Video Cuts Out";"Just updated to the new app and thought things would be better. The app blanks out saying it is loading and the audio sounds terrible.";"2017-02-28T13:37:57-07:00";"https://itunes.apple.com/us/review?id=936015067&type=Purple%20Software";"936015067";25;"en";"NEGATIVE"
173;4593554459;"drtric";"https://itunes.apple.com/us/reviews/id462411719";"2.8.0";1;"Dead";"It’s probably safe to say these cameras won’t be working once iOS 13 is out to the public. You think withings is going to update the app to make it work? I wouldn’t bet on it.";"2019-08-09T17:45:06-07:00";"https://itunes.apple.com/us/review?id=936015067&type=Purple%20Software";"936015067";36;"en";"POSITIVE"
174;4952388850;"stacieaguilera713";"https://itunes.apple.com/us/reviews/id323016699";"2.8.1";1;"Wall won’t open.";"I have been using this app for a few years. For the last few months, app closes the second I open it. Disappointing.";"2019-10-15T13:28:44-07:00";"https://itunes.apple.com/us/review?id=936015067&type=Purple%20Software";"936015067";23;"en";"NEGATIVE"
176;4860599674;"AmrRostom";"https://itunes.apple.com/us/reviews/id47681543";"2.8.1";1;"App crashing";"Have not been able to launch the app since iOS 13 update. Extremely frustrating!!";"2019-09-29T09:17:37-07:00";"https://itunes.apple.com/us/review?id=936015067&type=Purple%20Software";"936015067";14;"en";"NEGATIVE"
177;3755677010;"AvidFeedConsumer";"https://itunes.apple.com/us/reviews/id202210008";"2.7.3";1;"Cloud Service Offline";"My Withings Home stopped recording Audio and Video about a month ago. I haven’t gotten any errors in the app, just black screen recordings that have inaccessible media.";"2019-02-10T15:04:48-07:00";"https://itunes.apple.com/us/review?id=936015067&type=Purple%20Software";"936015067";28;"en";"NEGATIVE"
178;1262785401;"Foual SF";"https://itunes.apple.com/us/reviews/id201205371";"2.0.1";1;"Cannot stay connected more than few hours unlike my Nest Cams";"... Sent a support request 10 days ago: no answer. Very bad experience so far, too bad the product could be great.";"2015-09-25T17:58:21-07:00";"https://itunes.apple.com/us/review?id=936015067&type=Purple%20Software";"936015067";22;"en";"NEGATIVE"
179;1175622303;"Ordóñez";"https://itunes.apple.com/us/reviews/id43701396";"1.3.1";1;"Do not install";"This update didn't help with my Home constantly dropping connection, instead it made it worst, don't install, the new additions are not worth it if you have to unplug-plug all the time.";"2015-03-30T19:01:20-07:00";"https://itunes.apple.com/us/review?id=936015067&type=Purple%20Software";"936015067";32;"en";"NEGATIVE"
180;1276090325;"LazySD";"https://itunes.apple.com/us/reviews/id266769081";"2.1";1;"Whitings whithout stability";"This bug fix is the biggest bug.
I must to restart camera every 20min.
Definitely you don't know to sync software with a camera and this is an amateur device!";"2015-10-23T17:15:23-07:00";"https://itunes.apple.com/us/review?id=936015067&type=Purple%20Software";"936015067";30;"en";"POSITIVE"
181;1289821512;"Disapinterest";"https://itunes.apple.com/us/reviews/id162858627";"2.2";1;"No image";"The Withings home is a terrible contraption! I installed it and reinstalled it hoping to fix the problem but no such luck. It won't give motion alerts and the snap shots are blank. I'd give it negative stars if I could.";"2015-11-21T14:47:22-07:00";"https://itunes.apple.com/us/review?id=936015067&type=Purple%20Software";"936015067";41;"en";"NEGATIVE"
182;1449567682;"prssvicky55";"https://itunes.apple.com/us/reviews/id86870738";"2.4.0";3;"It can be better";"Please have a HomeKit adaptor!!! I like this camera a lot but its getting behind times if its not HomeKit compatible";"2016-09-14T06:13:05-07:00";"https://itunes.apple.com/us/review?id=936015067&type=Purple%20Software";"936015067";21;"en";"POSITIVE"
183;1235776288;"scottroberts33";"https://itunes.apple.com/us/reviews/id102392362";"1.5.0";1;"Useless";"Do not buy this product. It constantly needs rebooting, and finally, after 4 weeks, completely failed.";"2015-07-30T22:53:01-07:00";"https://itunes.apple.com/us/review?id=936015067&type=Purple%20Software";"936015067";16;"en";"NEGATIVE"
184;4911392966;"Arty_arts";"https://itunes.apple.com/us/reviews/id104177279";"2.8.1";1;"Crashes";"I’m waiting on an update to update my review I would given this app a 5 star before the recent update for now it will stay at 1";"2019-10-08T18:43:56-07:00";"https://itunes.apple.com/us/review?id=936015067&type=Purple%20Software";"936015067";28;"en";"NEUTRAL"
185;1207990486;"buenavistagrp";"https://itunes.apple.com/us/reviews/id85177337";"1.4.2";1;"Expensive";"Awful. It freezes every few minutes. Loses connection with the network.";"2015-06-06T03:40:32-07:00";"https://itunes.apple.com/us/review?id=936015067&type=Purple%20Software";"936015067";11;"en";"NEGATIVE"
186;2492305374;"Myri Taylor";"https://itunes.apple.com/us/reviews/id602750761";"2.7.3";1;"Doesn’t work anymore";"I used to use it all them time for my little girl, but it doesn’t work at all anymore, doesn’t let me log in or anything.";"2018-05-01T07:54:47-07:00";"https://itunes.apple.com/us/review?id=936015067&type=Purple%20Software";"936015067";26;"en";"NEUTRAL"
187;1422875690;"PJCzzzz";"https://itunes.apple.com/us/reviews/id123221168";"2.4.0";1;"Unreliable and frustrating";"Connection drops for no good reason and I have to spend an hour trying to coax it to connect again.";"2016-07-30T10:43:51-07:00";"https://itunes.apple.com/us/review?id=936015067&type=Purple%20Software";"936015067";20;"en";"NEGATIVE"
188;5084723342;"KBDBKBLBRB";"https://itunes.apple.com/us/reviews/id176683742";"2.8.1";1;"Awful";"App constantly crashes.  Unreliable and very frustrating.  Never works.";"2019-11-04T05:20:59-07:00";"https://itunes.apple.com/us/review?id=936015067&type=Purple%20Software";"936015067";9;"en";"NEGATIVE"
189;3256104651;"Jmccarthy22";"https://itunes.apple.com/us/reviews/id39850788";"2.7.3";1;"Horrible";"App is terrible. TV app won’t even load. Can’t get the live feed half of the time. Do not buy this! I wish I could leave less than a star.";"2018-10-02T10:02:24-07:00";"https://itunes.apple.com/us/review?id=936015067&type=Purple%20Software";"936015067";30;"en";"NEGATIVE"
190;4933555714;"cookingwithwood";"https://itunes.apple.com/us/reviews/id42102163";"2.8.1";1;"Broken";"Literally have to delete and reinstall the app just to watch a live feed. Withings at it again with the killer app updates";"2019-10-12T12:51:20-07:00";"https://itunes.apple.com/us/review?id=936015067&type=Purple%20Software";"936015067";23;"en";"NEGATIVE"
191;2493323479;"a hill";"https://itunes.apple.com/us/reviews/id21784640";"2.7.3";1;"iPhone app/Apple TV needs update";"iPhone app and Apple TV app needs an update (it’s still showing as Withings and hasn’t been updated on over a year or more).

No iPhone X ratio or Face ID or any updates.";"2018-05-01T13:52:15-07:00";"https://itunes.apple.com/us/review?id=936015067&type=Purple%20Software";"936015067";34;"en";"NEGATIVE"
192;1504475286;"Sparky The Space Cat";"https://itunes.apple.com/us/reviews/id42949932";"2.4.0";1;"Shockingly bad.";"Over a year now of restarting, tweaking cables, dead power supply, dropouts, bad app design. What a waste of money. 
I really can't understand how hard it must be to make a camera work.";"2016-12-18T16:37:57-07:00";"https://itunes.apple.com/us/review?id=936015067&type=Purple%20Software";"936015067";34;"en";"NEGATIVE"
193;1358109243;"gordonross";"https://itunes.apple.com/us/reviews/id36239192";"2.4.0";1;"Completely unreliable";"Beat your head against the wall it will be more fun then trying to keep this camera online.";"2016-04-03T12:52:44-07:00";"https://itunes.apple.com/us/review?id=936015067&type=Purple%20Software";"936015067";18;"en";"POSITIVE"
195;4584118965;"Amandasthewalrus";"https://itunes.apple.com/us/reviews/id149049953";"2.8.0";1;"Useless. Not safe to use as a baby monitor.";"We regret buying this to use as a baby monitor. It’s totally unreliable and miserable to use. Terrible product and even worse app.";"2019-08-07T19:09:12-07:00";"https://itunes.apple.com/us/review?id=936015067&type=Purple%20Software";"936015067";23;"en";"NEGATIVE"
196;2123514552;"FreddyFlibble";"https://itunes.apple.com/us/reviews/id33778453";"2.7.3";1;"Abysmal";"A nice pice of hardware let down by abysmal software. I’ve had this device for nearly three years and the software has been awful all along.";"2018-01-24T18:01:12-07:00";"https://itunes.apple.com/us/review?id=936015067&type=Purple%20Software";"936015067";26;"en";"NEGATIVE"
197;4962811279;"supernitin";"https://itunes.apple.com/us/reviews/id36689397";"2.8.1";1;"Doesn’t even launch on iOS 13";"Before our was barely functional. Now out doors not function at all.";"2019-10-17T17:07:59-07:00";"https://itunes.apple.com/us/review?id=936015067&type=Purple%20Software";"936015067";12;"en";"NEUTRAL"
198;1143030758;"DeepCopy";"https://itunes.apple.com/us/reviews/id85607962";"1.2.0";3;"Not bad, but..";"Good design.
Wide angle.
Very low volume speaker.
Slow recognition.
No support web browser.";"2015-02-07T02:38:43-07:00";"https://itunes.apple.com/us/review?id=936015067&type=Purple%20Software";"936015067";14;"en";"NEGATIVE"
199;4074453104;"jennellejean";"https://itunes.apple.com/us/reviews/id654372827";"2.7.3";1;"Terrible";"Terrible app! The app is always turning off! So you can’t use it as a baby monitor as advertised because it’s completely unreliable.";"2019-04-28T18:52:02-07:00";"https://itunes.apple.com/us/review?id=936015067&type=Purple%20Software";"936015067";23;"en";"NEGATIVE"
200;1286305591;"DoubleMacchiato";"https://itunes.apple.com/us/reviews/id134802200";"2.2";2;"Latest release broke lullabies";"Lullabies are unusable in the latest release. They don't play.";"2015-11-13T21:16:16-07:00";"https://itunes.apple.com/us/review?id=936015067&type=Purple%20Software";"936015067";10;"en";"NEGATIVE"
201;1463867168;"KJRace3";"https://itunes.apple.com/us/reviews/id118205987";"2.4.0";1;"Aweful";"I don't understand how I can get charged $200 for an absolute piece of garbage. Quality is horrible first of all. Secondly you can't even connect to the thing once you leave the app. WASTE OF MONEY. DONT BUY THIS GARBAGE";"2016-10-09T08:21:20-07:00";"https://itunes.apple.com/us/review?id=936015067&type=Purple%20Software";"936015067";41;"en";"NEGATIVE"
202;2167051515;"theuglyduck25";"https://itunes.apple.com/us/reviews/id37495722";"2.7.3";1;"Nokia ruining Withings";"The camera is now unusable. You just see a blurry image and the word “loading”. I did a factory reset and it didn’t change.";"2018-02-04T08:57:25-07:00";"https://itunes.apple.com/us/review?id=936015067&type=Purple%20Software";"936015067";24;"en";"NEGATIVE"
203;4151965768;"Montxito";"https://itunes.apple.com/us/reviews/id172825358";"2.8.0";1;"Completely useless";"App crashes continuously on iOS 12.3 impossible to use. DON'T buy this product to use as baby monitor, totally unsafe";"2019-05-14T21:39:09-07:00";"https://itunes.apple.com/us/review?id=936015067&type=Purple%20Software";"936015067";20;"en";"NEUTRAL"
204;6786820100;"pushpalatha_v";"https://itunes.apple.com/us/reviews/id1239006233";"2.8.1";1;"Pavani95";"Hey I have given a low rating because it was not downloadable on my grandmother 's device
Can please improve the app";"2020-12-23T18:53:17-07:00";"https://itunes.apple.com/us/review?id=936015067&type=Purple%20Software";"936015067";22;"en";"POSITIVE"
205;1939498078;"LAMAstyle";"https://itunes.apple.com/us/reviews/id121315155";"2.7.2";1;"Nokia ruined it.";"The real-time camera does not work since the company changed to Nokia. It does not update. Nokia is bad. Never buy this camera. I am regretting too much.";"2017-11-22T00:26:07-07:00";"https://itunes.apple.com/us/review?id=936015067&type=Purple%20Software";"936015067";28;"en";"NEGATIVE"
206;1651585077;"mattl23";"https://itunes.apple.com/us/reviews/id9500747";"2.7.1";1;"Camera won't respond";"Garbage. Camera will not respond and trying to turn the baby monitor on or off";"2017-06-20T18:10:00-07:00";"https://itunes.apple.com/us/review?id=936015067&type=Purple%20Software";"936015067";15;"en";"NEUTRAL"
207;1237161110;"bomjig25";"https://itunes.apple.com/us/reviews/id164754484";"1.5.0";1;"Does nothing";"This product is the most useless item I have stumbled into purchasing. It does nothing right.";"2015-08-02T18:36:20-07:00";"https://itunes.apple.com/us/review?id=936015067&type=Purple%20Software";"936015067";16;"en";"NEGATIVE"
208;4905077013;"LAPenmen";"https://itunes.apple.com/us/reviews/id110527605";"2.8.1";1;"It stopped working";"It down now work any more on my iPhone. Just updated to the latest IOS";"2019-10-07T07:46:05-07:00";"https://itunes.apple.com/us/review?id=936015067&type=Purple%20Software";"936015067";15;"en";"NEUTRAL"
209;3298621275;"Jahcure1982";"https://itunes.apple.com/us/reviews/id542378076";"2.7.3";1;"Problem";"I can’t view my camera while am on the go only when am home";"2018-10-13T16:12:20-07:00";"https://itunes.apple.com/us/review?id=936015067&type=Purple%20Software";"936015067";14;"en";"NEUTRAL"
210;1375022322;"Andrew peer";"https://itunes.apple.com/us/reviews/id141675685";"2.4.0";1;"Fire the developers!";"The new update makes you unable to connect. Useless waste of time and money.";"2016-05-07T10:55:58-07:00";"https://itunes.apple.com/us/review?id=936015067&type=Purple%20Software";"936015067";14;"en";"NEGATIVE"
211;1172874899;"Finger360";"https://itunes.apple.com/us/reviews/id28503958";"1.3.1";1;"Frozen video";"Since the update my video shows just one frame and doesn't move.";"2015-03-24T17:20:41-07:00";"https://itunes.apple.com/us/review?id=936015067&type=Purple%20Software";"936015067";12;"en";"NEUTRAL"
212;1840545731;"shindekokoro";"https://itunes.apple.com/us/reviews/id115186556";"2.7.2";1;"Awful";"Does not work, constant crashes. Unable to even load app";"2017-10-10T19:10:29-07:00";"https://itunes.apple.com/us/review?id=936015067&type=Purple%20Software";"936015067";10;"en";"NEUTRAL"
213;4955894258;"Hliftds";"https://itunes.apple.com/us/reviews/id35964589";"2.8.1";1;"Keeps crashing on latest update";"Just see the splash screen.";"2019-10-16T08:04:12-07:00";"https://itunes.apple.com/us/review?id=936015067&type=Purple%20Software";"936015067";5;"en";"NEUTRAL"
214;1682568194;"Kaibre";"https://itunes.apple.com/us/reviews/id108408373";"2.7.1";1;"Worthless";"Can't connect device and the factory resets on the camera is not even working.  Do not buy the Nokia home";"2017-07-14T17:13:51-07:00";"https://itunes.apple.com/us/review?id=936015067&type=Purple%20Software";"936015067";20;"en";"NEUTRAL"
215;4893851947;"pipsqueecs";"https://itunes.apple.com/us/reviews/id37553205";"2.8.1";1;"Just crashes, can’t load";"After updating, I simply can’t start the app anymore. :(";"2019-10-05T13:35:34-07:00";"https://itunes.apple.com/us/review?id=936015067&type=Purple%20Software";"936015067";10;"en";"NEGATIVE"
216;2708231742;"GI MAN";"https://itunes.apple.com/us/reviews/id35162827";"2.7.3";1;"Garbage";"Camera drops off WiFi frequently. Totally useless. Plan to get another home camera.";"2018-06-16T16:18:07-07:00";"https://itunes.apple.com/us/review?id=936015067&type=Purple%20Software";"936015067";13;"en";"NEGATIVE"
217;1403541633;"Gregofokc";"https://itunes.apple.com/us/reviews/id136258086";"2.4.0";1;"Update messed it up";"Worked well before I updated it. Now won't connect. Please fix.";"2016-07-01T06:43:23-07:00";"https://itunes.apple.com/us/review?id=936015067&type=Purple%20Software";"936015067";11;"en";"NEUTRAL"
218;4792317721;"Charker22";"https://itunes.apple.com/us/reviews/id127737445";"2.8.1";1;"App crashes or freezes!";"2 years and I’m very frustrated! I need it for my child and it’s not dependable";"2019-09-16T11:17:25-07:00";"https://itunes.apple.com/us/review?id=936015067&type=Purple%20Software";"936015067";16;"en";"NEGATIVE"
219;4179874672;"Jrportman";"https://itunes.apple.com/us/reviews/id167486036";"2.8.0";1;"Jr";"This app crashes right in middle of use.   I try to reboot to no avail.  Please look into this ASAP this is s very good idea but sad it doesn’t work 🙁";"2019-05-20T02:21:27-07:00";"https://itunes.apple.com/us/review?id=936015067&type=Purple%20Software";"936015067";32;"en";"NEGATIVE"
220;1673295424;"sllyons57";"https://itunes.apple.com/us/reviews/id370284700";"2.7.1";1;"Piece of crap";"Product/ camera no longer works!  Avoid this product!  Run!";"2017-07-07T17:22:54-07:00";"https://itunes.apple.com/us/review?id=936015067&type=Purple%20Software";"936015067";9;"en";"NEGATIVE"
221;4879094117;"Unusable-88";"https://itunes.apple.com/us/reviews/id433055149";"2.8.1";1;"Unusable";"The app won’t even open on iOS. I’m giving up and buying a new camera...";"2019-10-03T11:10:39-07:00";"https://itunes.apple.com/us/review?id=936015067&type=Purple%20Software";"936015067";15;"en";"POSITIVE"
222;1556097596;"yestruthishard";"https://itunes.apple.com/us/reviews/id11061742";"2.5.0";1;"No Monitoring!";"BEWARE: This update removed the ability to change the monitoring mode or turn on the baby monitor.";"2017-03-02T16:14:54-07:00";"https://itunes.apple.com/us/review?id=936015067&type=Purple%20Software";"936015067";17;"en";"POSITIVE"
223;1553996521;"clink85";"https://itunes.apple.com/us/reviews/id85125127";"2.5.0";1;"Baby Monitor Mode Removed";"This ""update"" removes the ability to put the app into Baby Monitor mode, making it nearly useless.  DO NOT UPDATE!";"2017-02-27T15:32:28-07:00";"https://itunes.apple.com/us/review?id=936015067&type=Purple%20Software";"936015067";20;"en";"NEGATIVE"
224;2444120049;"m_a_c_h_o";"https://itunes.apple.com/us/reviews/id47684340";"2.7.3";2;"Please Optimize";"Apple released iPhone X almost 6 months ago but this App is not optimized yet!!";"2018-04-20T00:09:14-07:00";"https://itunes.apple.com/us/review?id=936015067&type=Purple%20Software";"936015067";15;"en";"NEGATIVE"
225;6936799385;"Rohit Prabhakar";"https://itunes.apple.com/us/reviews/id172241353";"2.8.1";1;"Nokia killed Withings";"Great company abd products gone bad since Nokia bought it. Suddenly from 5 to 0";"2021-01-31T07:48:56-07:00";"https://itunes.apple.com/us/review?id=936015067&type=Purple%20Software";"936015067";15;"en";"POSITIVE"
226;1560272661;"Ador@ble";"https://itunes.apple.com/us/reviews/id207865510";"2.5.0";1;"Worst update ever!!!";"Big delay when using the microphone in the app, video streaming is very slow. Do not update!";"2017-03-08T13:49:09-07:00";"https://itunes.apple.com/us/review?id=936015067&type=Purple%20Software";"936015067";17;"en";"NEGATIVE"
227;1549704045;"Imaaaaanhamaad";"https://itunes.apple.com/us/reviews/id435246771";"2.4.0";1;"DO NOT UPDATE";"After i update my cameras they didn't work any more this is not acceptable form a big company like withings 
I want a solution";"2017-02-21T20:30:40-07:00";"https://itunes.apple.com/us/review?id=936015067&type=Purple%20Software";"936015067";24;"en";"POSITIVE"
228;2024603593;"justinmthomas2003";"https://itunes.apple.com/us/reviews/id168171707";"2.7.3";1;"Big disappointment.";"Nice looking monitor, but terrible software. Doesn’t even work on Apple TV.

No wonder that no-good Monitor was on a big clearance at Target!";"2017-12-24T16:08:00-07:00";"https://itunes.apple.com/us/review?id=936015067&type=Purple%20Software";"936015067";24;"en";"NEGATIVE"
229;4787492729;"AdamAshby";"https://itunes.apple.com/us/reviews/id31660311";"2.8.1";1;"New update will not load on iOS 12.4.1";"iPhone XS Max will not load app even after device reboot.";"2019-09-15T15:46:00-07:00";"https://itunes.apple.com/us/review?id=936015067&type=Purple%20Software";"936015067";11;"en";"NEUTRAL"
230;2452278058;"Scooter2u";"https://itunes.apple.com/us/reviews/id133515396";"2.7.3";2;"Good cameras but glitchy software";"I have three cameras in my frail 85-year-old mom’s apartment so I can monitor her safety — especially during the hours when her paid caregivers are not present.  Glitchy software has me shopping for replacements.  Was really hoping that when Nokia bought out the original manufacturer, Whithings, things would improve fast. Have indeed seen some marginal improvements — but far fewer than I was hoping for. With each new app update I still have my fingers crossed (especially since these Whithings cameras cost twice as much as the competing models back when I first bought them at the Apple Store and then at Home Depot). 

PROS: Elegant camera design blends in gracefully with my mom’s decor and doesn’t make her feel like I have “spycams” everywhere.  Cameras are very easy to install and — in theory — very easy to monitor in my iphone.  Resolution, color, sound, and playback features are all quite useful. It’s great that you can add (and view) multiple cameras in multiple rooms. The nightvision, audio, air quality, and alert features all work just fine. 

CONS: My disappointment and frequent frustration are all due to the extemely glitchy and unreliable software.  Often when I first open the app the software says “your cameras are unavailable.”  Yet I have learned that simply rebooting the app once or twice usually fixes the problem. So, in fact, the cameras really ARE available...eventually. At other times only two out of three cameras function. But never the same two. 

Worst of all:  Even after all three cameras boot up the picture will often “freeze” for long periods of time completely. Sometimes switching to another camera “fixes” the freeze. But often not. Sometimes closing the app completely (ugh, yes, again) fixes this freeze problem too. And sometimes not. This is of course especially maddening if my mom’s health is especially fragile that night, such that I am truly relying on the camera system to monitor her every move carefully. 

FIXES:  Since I was a very “early adopter” I had to buy one more camera to replace the very first one I had purchased (which the company prior to Nokia, Whithings, flat out refused to replace). The darn thing just stopped working completely, and their tech help yielded no results even after many attempts. 

Next I upgraded the wifi speed in my mom’s hom thinking maybe that was the root of the problem. Now all other apps I run on my mom’s wifi — including streaming Netflix etc. — work flawlessly. But the darn Nokia cams Still Freeze Up or Fail to open at all just as frequently as ever. 

Then I decided maybe the download speed on my iphone and ipad at home was too slow. Yet here again I can stream whole movies on my iphone and ipad without any trouble at all — so why then are my (extremely expensive) Nokia Home Cams still freezing up and/or failing to connect on a regular basis?";"2018-04-21T20:49:14-07:00";"https://itunes.apple.com/us/review?id=936015067&type=Purple%20Software";"936015067";494;"en";"POSITIVE"
231;4906263213;"LoganSchmidt";"https://itunes.apple.com/us/reviews/id281571294";"2.8.1";1;"Doesn’t open";"Useless hardware since the app doesn’t open any more. On XS Max latest iOS.";"2019-10-07T13:53:15-07:00";"https://itunes.apple.com/us/review?id=936015067&type=Purple%20Software";"936015067";14;"en";"NEGATIVE"
232;1520193580;"EssJayEssNY";"https://itunes.apple.com/us/reviews/id38133881";"2.4.0";1;"Alpha";"Can't even consider this a beta product, its alpha at best. Absolute horrible execution, device consistently hangs, etc.";"2017-01-11T18:49:40-07:00";"https://itunes.apple.com/us/review?id=936015067&type=Purple%20Software";"936015067";18;"en";"POSITIVE"
233;2232583989;"NCS MA";"https://itunes.apple.com/us/reviews/id30419388";"2.7.3";1;"Junk";"Please don’t waste your money with this thing";"2018-02-21T09:34:55-07:00";"https://itunes.apple.com/us/review?id=936015067&type=Purple%20Software";"936015067";8;"en";"NEGATIVE"
234;1952696920;"G4Drive";"https://itunes.apple.com/us/reviews/id17121335";"2.7.2";1;"Horrible";"Can’t rely on it. Impossible to load the image";"2017-11-27T05:43:41-07:00";"https://itunes.apple.com/us/review?id=936015067&type=Purple%20Software";"936015067";9;"en";"NEUTRAL"
236;1265692557;"jawas are cool";"https://itunes.apple.com/us/reviews/id179423893";"2.0.1";1;"VOC doesn't work";"It shows me voc readings from 3 hours ago rather than live.  How is that helpful?";"2015-10-01T23:21:43-07:00";"https://itunes.apple.com/us/review?id=936015067&type=Purple%20Software";"936015067";16;"en";"POSITIVE"
237;4260449862;"TheBentleyCobb";"https://itunes.apple.com/us/reviews/id43274630";"2.8.0";1;"4 days now... off/on spotty.";"4days now the Home Cam just magically loses connection to WiFi... did this ASAP!";"2019-06-03T19:48:08-07:00";"https://itunes.apple.com/us/review?id=936015067&type=Purple%20Software";"936015067";14;"en";"NEGATIVE"
