"";"id";"userName";"userUrl";"version";"score";"title";"text";"updated";"url";"app";"wordCount";"language";"sentiment"
65;1557820633;"Joe62612";"https://itunes.apple.com/us/reviews/id210558957";"2.0.7";2;"Delayed notifications";"Works great when it works. Half the time it either have delayed notifications or completely missed triggers. Tried many times adjusting the motion sensors and going back and forth with tech support and still the same results. I even sent it back for a replacement and it still does the same thing. My wifi have strong signals with over 90mbps detected right at the light, so I know it's not my connection.

I wish the engineers can really work on those issues.
I more thing, I wish when I speak with someone over live recording that I it records my part of the conversation as well instead of just the person at the door. I would recommend this light to my friends and families but without the fixes I don't think I can do so currently. I hope Kuna is listening.";"2017-03-04T23:21:02-07:00";"https://itunes.apple.com/us/review?id=951258324&type=Purple%20Software";"951258324";141;"en";"POSITIVE"
66;2521878460;"owlowlowl";"https://itunes.apple.com/us/reviews/id41416134";"2.3.4";5;"Awesome";"I’ve had Kuna for a while now with no subscription. I just paid for the service and couldn’t be happier! So many times my camera would go off in the middle of the night and I would wait too long to look at it and would lose the video. Now, with the subscription I’m finally seeing all the things I was missing. Thank god no intruders but have seen lots of wildlife passing by my camera through the night. Definitely worth the purchase for peace of mind.
I did have some initial problems after the update but realized that it was my mistake and all I needed to do was log out and sign back in and everything was golden again!👍";"2018-05-08T17:57:25-07:00";"https://itunes.apple.com/us/review?id=951258324&type=Purple%20Software";"951258324";121;"en";"POSITIVE"
67;1531722202;"Krrtexxas";"https://itunes.apple.com/us/reviews/id39973679";"2.0.6";5;"Extremely Happy";"I love our Kuna porch light.  It gives us such peace of mind when we're out.  I love having both live view options, and video recordings.  I had a really good experience with Customer Service this past December when our beloved dog passed away.  We had spent hours her final morning in our front garden together and since our Kuna premium trial had ended, we didn't have any videos of the special moments.  Chris at Kuna received my request to help retrieve the videos and extended my trial another week.  I was able to retrieve the videos from my pup's last day and so many more.  I really appreciated his kindness during such a tough time.";"2017-01-27T08:22:50-07:00";"https://itunes.apple.com/us/review?id=951258324&type=Purple%20Software";"951258324";116;"en";"POSITIVE"
68;3507375192;"Slick6574";"https://itunes.apple.com/us/reviews/id285187732";"2.4.4";2;"Stylish but unreliable, to expensive for quality";"Had high hopes, easy install, but daily issues of camera detection turning off. Sometimes when greeting comes on it’s 2-3 greetings play at same time ( max headroom, for those old enough to know who that is) have uninstalled and reinstalled app, killed power to light to reset daily. Motion activation still works but no camera, try to watch playback it tells me still recording, this is 30 mins later. Before you ask according to the app I have excellent signal and the light is less than 5 feet from the router. Online and phone help is little to no help, they tell me to do the exact same things I have already tried. Randomly it will come on and work as it’s supposed to but not a reliable source for extra home security";"2018-12-08T03:32:20-07:00";"https://itunes.apple.com/us/review?id=951258324&type=Purple%20Software";"951258324";134;"en";"POSITIVE"
69;1557437516;"Chris freeman";"https://itunes.apple.com/us/reviews/id86834836";"2.0.8";2;"The camera is great but buyer BEWARE!";"I bought two Kuna camera lights and two companion lights. So at first I was super thrilled about these as they look good and can stay powered on all the time if needed. BUT, there's always a but. They make you pay to keep the motion detections recordings. Otherwise they don't let you keep the recording for longer then 2 days. Then I have a new iPhone 7 Plus and the videos recordings are not able to be downloaded to your phone. Then I tried to share the same video and guess what, can't email, text or post to FB because the format is not compatible. Super lame of them. I bet if I paid a subscription then they would be able to be saved. Buyers beware I can barely utilize this product without paying subscription fees.";"2017-03-04T09:24:48-07:00";"https://itunes.apple.com/us/review?id=951258324&type=Purple%20Software";"951258324";137;"en";"POSITIVE"
70;2291473500;"Ms Lola B";"https://itunes.apple.com/us/reviews/id135517308";"2.3.2";5;"Def Worth It!";"If I could give 10 stars, I would.  Just ordered my second one.  Yes, there were issues with the video pixelation but they contacted me and confirmed it was an issue with the modem channel.  So, I’m good. 

The clarity is amazing. The level of sensitivity is great also (pickup movement as close as the porch or as far as cars driving down my street). 

I’ve actually witnessed an attempted burglary of my home. Was able to give him a piece of my mind and sound the alarm from the camera. It made the perp scatter. I was later able to distribute the video to neighbors quickly to inform them to be on the lookout.  Perfect!";"2018-03-10T08:18:21-07:00";"https://itunes.apple.com/us/review?id=951258324&type=Purple%20Software";"951258324";116;"en";"POSITIVE"
71;6583279507;"Knowledge1913";"https://itunes.apple.com/us/reviews/id20904926";"2.7.2";3;"Needs iOS 14/iPhone 12 update?";"The camera has worked well for years, though it’s not good with the live feature and talking to someone. It doesn’t seem to capture live motion and conversation at the same time. There’s always a delay.  

What I notice now is that the live camera isn’t working at all. Only the sound is coming through, but if there’s someone actually in front of the camera, you can’t see them. I noticed this more after Apple updated the operating system. I’ve uninstalled and reinstalled the camera, socket, WiFi connection, and the app on my phone. I still cannot get the live video to work properly.";"2020-10-28T08:03:52-07:00";"https://itunes.apple.com/us/review?id=951258324&type=Purple%20Software";"951258324";104;"en";"NEGATIVE"
72;1562243354;"21charles";"https://itunes.apple.com/us/reviews/id266620344";"2.0.8";5;"This App Started Out GREAT, and Just Continues to Improve ! ! !";"A while ago a criminal was arrested & convicted of stealing our mail, (several packages), due directly to how well the KUNA system operated. 

The price is incredibly reasonable, especially considering everything it does, and how simple it is to operate. I was out of town, several states away, when a solicitor came to our front door.  Upon being alerted, I easily engaged them in a Back -n- Forth conversation.  As far as the solicitor knew I was inside my house, but to busy to come to the door.  ""BTW"",, I was also able to due this while in another country ! ! !";"2017-03-11T07:08:25-07:00";"https://itunes.apple.com/us/review?id=951258324&type=Purple%20Software";"951258324";104;"en";"NEGATIVE"
73;5553509102;"Goose3281";"https://itunes.apple.com/us/reviews/id203998206";"2.6.6";2;"Going Downhill";"I used to be a huge supporter of Kuna cameras, recommending them to any one who would listen.  Just can’t recommend them any more.  All my recorded videos, regardless of when they were recorded, freeze around the ten second mark on playback but play fine when downloaded. 
     Customer support could not resolve the issue and closed out my case with a “will get back to you”.   Issue continues months later with no one getting back to me.   
   Another complaint, you can NOT simply change your email in your account.  You have to jump through hoops to simply change your email unlike Kuna’s competitors that simplify this process.";"2020-02-19T12:07:03-07:00";"https://itunes.apple.com/us/review?id=951258324&type=Purple%20Software";"951258324";107;"en";"POSITIVE"
74;5953436240;"ComputerGod112";"https://itunes.apple.com/us/reviews/id30697505";"2.7.2";3;"Definitely agree kuna needs to integrate!";"I have several kuna & toucan video cameras. Very disappointed they have not evolved into smart home devices.
The new wireless toucan cameras use a new toucan app that does actually work with Alexa, but sadly, the app will not connect with my old kuna/toucan wired cameras. 
There is no firmware update to make the old toucans work with the new wireless toucans, so if I purchase a new camera they will be on two different apps! 
Why not upgrade the kuna app to integrate with smart homes and be able to see both old and new cameras in one app? 
I guess that makes too much sense. Why try to make your customers happy?...Very disappointing 😩";"2020-05-16T08:21:48-07:00";"https://itunes.apple.com/us/review?id=951258324&type=Purple%20Software";"951258324";117;"en";"NEGATIVE"
75;5967543459;"Buggghfjcj";"https://itunes.apple.com/us/reviews/id35052843";"2.7.2";1;"Really amazing, until it wasn’t...";"So our first Kuna light would not connect to anything. Company graciously replaced it and our second unit worked fine. Was a few times it didn’t seem to work correctly but nothing too bad. Then we upgraded our WiFi network and now the unit won’t work. However I don’t think it has anything to do with our connection. The Kuna used to pick up 3 other WiFi networks from neighbors but now it simply says “cant fetch WiFi networks” 

Customer support is usually a hard to understand Asian person and they simply tell you to email a photo of the problem.. then they do nothing. So now my expensive camera is simply a regular light. Would’ve been a 4-5 star product. Now it’s worthless.";"2020-05-19T15:36:55-07:00";"https://itunes.apple.com/us/review?id=951258324&type=Purple%20Software";"951258324";124;"en";"POSITIVE"
76;4188423605;"bunn3hh4x";"https://itunes.apple.com/us/reviews/id85553047";"2.5.2";2;"Needs Updating";"If you aren’t bothered by the constant offline/online messages then you’ll definitely be annoyed at how long it takes the app to load the video feed (both live and recording). Most of the time the person has left the porch by time the video loads and that is assuming there isn’t horrendous graphical anomalies which occur on the phone app (iPhone 6S and the XS) or on the iPad. Their customer service never return my emails or support requests sent through the app. When I first got the camera it worked great for like a month and two years later I was dumb enough to get another for my garage. Don’t waste your money and invest in a better home security camera setup or even a RING.";"2019-05-21T16:44:13-07:00";"https://itunes.apple.com/us/review?id=951258324&type=Purple%20Software";"951258324";127;"en";"POSITIVE"
77;4838314520;"Chris_Henley";"https://itunes.apple.com/us/reviews/id11412582";"2.6.3";1;"Not great";"purchased Kuna on June 13, 2017 (actually purchased three) and setup was easy. Worked great until I changed my WiFi SSID and that was it. Turns out the device uses the Bluetooth to connect first time to set up the WiFi connection. To my surprise, the Bluetooth stopped working and I was not able to communicate to the light to get the Wifi setup. Now I just have a really expensive light. Not sure when the Bluetooth stopped working but the warranty only covers the first 12 months. So I needed to make this discovery in the first twelve months or that was it. Called support and was told, ""sorry, you are past the twelve months and there is nothing we can do"". Really disappointed with the product and the support. I recommend the Ring at this point.";"2019-09-25T18:49:35-07:00";"https://itunes.apple.com/us/review?id=951258324&type=Purple%20Software";"951258324";138;"en";"POSITIVE"
78;2557860275;"Vartan the warior";"https://itunes.apple.com/us/reviews/id486877479";"2.3.4";3;"Mission impossible!!";"After having installed for over a month i have nothing but issues, it doesn’t detect 100%, the motion light is useless, the customer service is joke, they keep giving you the runaround in circles repeating the same thing over and over again, they blame your router, the speed, channels, when in reality it has nothing to do with detecting, the funny thing is i have other things that are connected to my WIFI and i have absolutely no issues, by the way my router is about two feet away from the lantern, they just don’t want to admit that their product has flows and don’t even want to bother fixing it either.";"2018-05-16T23:22:06-07:00";"https://itunes.apple.com/us/review?id=951258324&type=Purple%20Software";"951258324";112;"en";"NEGATIVE"
79;6195527776;"Why commericals";"https://itunes.apple.com/us/reviews/id246682895";"2.7.2";2;"The 2 hour free recording disappeared";"I heard the motion sound went on then I went to the camera recorded playback and found nothing. I am not sure why now even the 2 hour recordings are gone. Do we have to get premium to view video history even within the 2hr period? I was able to see the videos before when I first installed the light/camera 2 years ago. Not sure what happened lately. My ring is as able to capture the cat walking by but not Kuna. Kuna only made the alarm sound but didn’t record video. Please fix this.";"2020-07-13T22:30:52-07:00";"https://itunes.apple.com/us/review?id=951258324&type=Purple%20Software";"951258324";95;"en";"NEGATIVE"
80;2275856305;"Scootert123";"https://itunes.apple.com/us/reviews/id35742116";"2.3.2";3;"Works well for me but has some issues";"I have 4 cameras and 3 companion lights operating for over 2 years. There have been some growing pains with the updates have generally brought improvements. There are some continuing annoyances: 1) periodically 2 of the 3 companion lights disconnect from their parent camera. This requires a complete reset of the companions and re-pairing with the parent. 2) sometimes there is significant latency between when a person is in the field of view (6 to 10 feet from the camera) and they are detected.  I have adjusted the parameters but the results only differed slightly. 3) Kuna promised HomeKit integration years ago but this failed to happen. :-(";"2018-03-05T20:53:16-07:00";"https://itunes.apple.com/us/review?id=951258324&type=Purple%20Software";"951258324";108;"en";"NEGATIVE"
81;1937434765;"dwscoggins";"https://itunes.apple.com/us/reviews/id50016780";"2.2.3";5;"Working again";"The app was down for a couple of days but is back up again. The app itself is vey good. It allows you to view live and trigger recording, speak through the cameras speaker or trigger a siren. 

It allows you to control the sensitivity of the detection, receive alerts and view recordings. In addition you have complete control of the lights. It also loads quickly. 

Most of the bad reviews sound like WiFi issues. You can’t run IP Video on a slow network. I had to upgrade my speed and add an extender.";"2017-11-21T06:25:30-07:00";"https://itunes.apple.com/us/review?id=951258324&type=Purple%20Software";"951258324";94;"en";"POSITIVE"
82;1207251073;"Techgirl⌚️2015";"https://itunes.apple.com/us/reviews/id419237008";"1.1.7";5;"Pretty Smart!";"At first, my Kuna was sending me dozens of alerts on windy days (detected the trees moving). This was super annoying because I read that kuna was supposed to be ""smart"" and learn that it was a tree and not a person. Well, turns out you have to teach the kuna. after marking the clips as ""not a person"" the number of false alarm alerts went down. On a particularly windy day I didn't get a single alert. I walked in front of the kuna just to make sure it was actually on. Yep, kuna saw me as a person and had learned to ignore the trees! Pretty smart!";"2015-06-04T14:01:19-07:00";"https://itunes.apple.com/us/review?id=951258324&type=Purple%20Software";"951258324";109;"en";"POSITIVE"
83;1334972550;"Jimxyz123";"https://itunes.apple.com/us/reviews/id12176246";"1.2";1;"Unhappy user";"I have owned the Kuna motion sensor light for a month and find that it has many problems. First off there is quite a delay from the time someone approaches your door till you receive a notification that someone is there. Additionally, Sometimes it does not even signal that someone has approached your door. Often when you do get a signal that someone has approached your door you cannot view the camera to see who is there because you get a message that the camera is busy. If you try to view the film recorded by the camera while the camera is busy the film is not available. By the time you get use of the camera again the person has already gone and you have no idea who is there.";"2016-02-18T09:42:45-07:00";"https://itunes.apple.com/us/review?id=951258324&type=Purple%20Software";"951258324";131;"en";"NEGATIVE"
84;1261871250;"Navdeep34";"https://itunes.apple.com/us/reviews/id101726473";"1.1.13";4;"Great product, but needs better optimization";"This is a fantastic product and is much better than any other security camera available. The ability to monitor from anywhere  with motion makes it one of the most enthralling products available.

However, I have noticed that when someone is at the door, and I try to view on my device, it momentarily says camera is busy. It wouldn't matter if you are away from home but if you are at home, it is crucial to be able to see the visitor. 

Also, for people that have multiples kuna's, there should be an option for the motion notification to display the exact location. Right now it says ""someone is at the door""
And under that, it says the location, but it would be more convenient to have it as the main notification.

Other than that, this product works great.";"2015-09-23T16:44:50-07:00";"https://itunes.apple.com/us/review?id=951258324&type=Purple%20Software";"951258324";139;"en";"POSITIVE"
85;1692014948;"Jeffstoked";"https://itunes.apple.com/us/reviews/id18693125";"2.1.8";4;"Love the new Kuna AI";"I like how this picks up and notifies based on person or vehicle.  Looking forward to it getting smarter over time.  It would be great however if you could disable alerts for vehicles and keep enabled for persons, rather than bunching all alerts together.

By the time I'm able to open the app and start a manual recording, the 10 secs have passes so it doesn't catch the event.  Please have manual recordings grab 30 seconds before starting. I think this is enough time to get opened and start recording.";"2017-07-21T06:17:26-07:00";"https://itunes.apple.com/us/review?id=951258324&type=Purple%20Software";"951258324";90;"en";"POSITIVE"
86;1519860047;"J,hghj,cxC jghsKJFFSmn";"https://itunes.apple.com/us/reviews/id151573602";"2.0.5";5;"Love, love, love this";"I did actually use this once to answer the door. So convenient!  Love being able to see when packages are delivered, when the cat sitter arrives when we're traveling and when my husband last walked the dog. I love the possibility of answering the door with the prerecorded male voice. Other fun things you can do with this: check to see if it's raining at home when you're away and post a video of yourself on Facebook falling on the ice.";"2017-01-11T05:29:36-07:00";"https://itunes.apple.com/us/review?id=951258324&type=Purple%20Software";"951258324";81;"en";"POSITIVE"
87;2076286794;"Hector578284849";"https://itunes.apple.com/us/reviews/id168405641";"2.3.0";3;"Needs work and features";"I’ll start with the positive remark. This app works and alerts as needed and it very rarely does not work to the point of frustration. 
Now my criticism.
The load time from alert to full live feed needs to be sped up, I feel like people are sometimes walking away by the time I go live.
Needs casting options. It would be great if I could cast to my chromecast or Apple TV when I am waiting for a guest or service worker.
I may be a little out of place mentioning it here, but the Alexa skill does not alert on motion, I have mentioned that in the skill store.";"2018-01-10T11:57:06-07:00";"https://itunes.apple.com/us/review?id=951258324&type=Purple%20Software";"951258324";111;"en";"POSITIVE"
88;1358309590;"Ourdoc";"https://itunes.apple.com/us/reviews/id9981504";"1.2.1";4;"Great product needs improvement";"There needs to be a way to just turn on or off the light without using an app or waving your hands. They also could make an Apple Smartwatch app that would allow you to do just this. As it is now it's more difficult to normally control than a normal light.  You can't just flip the switch. 

Flipping the switch as normal light requires an entire new internet connection to be established so that is not the answer as the cam is wanted 24/7.";"2016-04-03T23:25:59-07:00";"https://itunes.apple.com/us/review?id=951258324&type=Purple%20Software";"951258324";85;"en";"NEGATIVE"
89;1355503753;"Frankenawesome";"https://itunes.apple.com/us/reviews/id43204052";"1.2.1";4;"Great so far.";"The app and the light fixture have been great to date. I've had it since 3/1/16. The only thing that bugs me is that the video playback is not always instant. That may just be a problem with my internet connection. The notifications are on point, as soon as someone is at my door I get notified but I can't see what's happening instantly, sometimes it takes a few try's. Hopping for improvements soon. But so far it's a great product that could get even better.";"2016-03-29T11:27:15-07:00";"https://itunes.apple.com/us/review?id=951258324&type=Purple%20Software";"951258324";86;"en";"POSITIVE"
90;5500588816;"Kicmich";"https://itunes.apple.com/us/reviews/id87615014";"2.6.6";2;"Great at first, but very buggy";"I’ve had 3 Kuna cameras for 1-2 years. They were great at first, but after about a year the oldest camera randomly stops recording motion and needs to be reset often. Sometimes the app wont load the videos even though I pay for the premium plan. None of the cameras capture motion reliably, even with the sensitivity very high. Lately the app shuts down whenever I try to switch between live streaming and videos.  The cameras and the app are too unreliable for the cost.";"2020-02-07T11:47:26-07:00";"https://itunes.apple.com/us/review?id=951258324&type=Purple%20Software";"951258324";85;"en";"NEUTRAL"
91;5043986648;"Danny r. A.";"https://itunes.apple.com/us/reviews/id85402276";"2.6.4";1;"Not worth it";"We purchased 4 camera lights. Immediately we had issues with 1 that would keep disconnecting and not show video. I contacted support and had to have it replaced TWICE then another camera started giving us issues but only like 1 every few months so we just deal with it. 

As far as for the motion”... someone could walk by the camera, break into your car, steal stuff before you even got a notification. 

You can’t depend on these cameras to actually “capture” something. They’re only good for being able to look at a live stream of your view when you want.";"2019-10-28T20:28:52-07:00";"https://itunes.apple.com/us/review?id=951258324&type=Purple%20Software";"951258324";101;"en";"POSITIVE"
92;1654014031;"Dunbeazy";"https://itunes.apple.com/us/reviews/id463903666";"2.1.6";1;"Cost effective but not so great";"If you want a little security and don't have big pockets then this is for you. It needs some work though as it is not what it seems. It misses motion often no matter the sensitivity level and alerts can be seconds to minutes. Example: I'm at work and on wifi and receive an alert that someone is at my door. I quickly open the app and click on the live camera. (A matter of 6seconds) Soon as the feed displayed, a car was already backing up. I watched the video it recorded and it was Jahova witnesses that stood at my door for prob 40 seconds. So this is what I mean by late alerts. I really can't complain though for the price.";"2017-06-22T18:45:19-07:00";"https://itunes.apple.com/us/review?id=951258324&type=Purple%20Software";"951258324";124;"en";"POSITIVE"
93;2460230866;"Bangkok9958";"https://itunes.apple.com/us/reviews/id573667704";"2.3.4";5;"This a great Device!";"Not sure why there’s negative feedback. Must be from all the non-technical folks. Installing and setting up this device was sooooo easy. Down load the app, enter in your credentials, and pair your phone with the device. That’s it, nothing more!  Great image. There is a second of latency but that’s normal for most camera systems. Image quality is good too! The app is easy to use. Great product!";"2018-04-23T19:00:07-07:00";"https://itunes.apple.com/us/review?id=951258324&type=Purple%20Software";"951258324";69;"en";"POSITIVE"
94;1926034795;"GGgreen122";"https://itunes.apple.com/us/reviews/id34065903";"2.2.3";3;"So close";"The app is decent for me, it notifies the second someone comes to the door, but by the time it’s done loading when I want to see the person, they are leaving (like the mailman for example). Also I do not know if this is possible in a software update but when I talk to someone it needs to be dual duplex, it shuts off audio so I can’t hear their response, that’s one of the purposes of the cameras so it should work properly. It still comes in handy for me but has some major inconveniences that need to addressed.";"2017-11-16T14:08:18-07:00";"https://itunes.apple.com/us/review?id=951258324&type=Purple%20Software";"951258324";101;"en";"POSITIVE"
