"";"id";"userName";"userUrl";"version";"score";"title";"text";"updated";"url";"app";"wordCount";"language";"sentiment"
134;5765955171;"SJ_1@1";"https://itunes.apple.com/us/reviews/id37759898";"2.7.2";1;"Very Disappointed";"I have 3 Kuna security light cameras. For the first year, I loved it. But then things got worse. Delayed movement notification which defeats the security purpose! 2 weeks ago, Kuna app got upgraded and now every time I open the app, it said no device found, and took a while for the monitor screen to come up. Then the app crashed after that. Useless piece of junk now! What was once a great product now it just a stupid light!";"2020-04-05T04:57:04-07:00";"https://itunes.apple.com/us/review?id=951258324&type=Purple%20Software";"951258324";81;"en";"NEGATIVE"
135;1252324793;"travisn";"https://itunes.apple.com/us/reviews/id39207764";"1.1.12";3;"Mostly functional but lacks smoothness";"Initial BLE setup of the light works well. However is confusing that if you want to change wifi settings to ""setup"" the same light again as if it were new.  Usability is fair but video is frequently lagging or distorted. Would be better if video went full screen when rotating iPhone otherwise it's very small.";"2015-09-02T20:07:47-07:00";"https://itunes.apple.com/us/review?id=951258324&type=Purple%20Software";"951258324";55;"en";"NEGATIVE"
136;4570835548;"cuzinhass";"https://itunes.apple.com/us/reviews/id129930175";"2.6.3";1;"Ring notifications better";"I thought having this camera permanently connected to a hard wire would mean the unit would t sleep and hence I could get notified quicker than ring. Boy am o wrong. Not only is ring faster a sending me a notification, it is also more reliable. Sometime no Kuna notification at all. And, with Ron you can customize the notification sound and even volume.
Thinking about retiring this and buying the ugly but functional ring spotlight.";"2019-08-04T20:09:29-07:00";"https://itunes.apple.com/us/review?id=951258324&type=Purple%20Software";"951258324";76;"en";"NEGATIVE"
137;1533059751;"apo81";"https://itunes.apple.com/us/reviews/id16719414";"2.0.6";5;"So far so good!!!";"Easy to install the light. It looks great. Easy to connect to the app and it is responsive so far. Good settings as of now. As it gets used I may find more. Also 2 hours of free viewing should be more like 24 hours of free viewing!";"2017-01-29T09:30:20-07:00";"https://itunes.apple.com/us/review?id=951258324&type=Purple%20Software";"951258324";48;"en";"POSITIVE"
138;5473069901;"millennial moms";"https://itunes.apple.com/us/reviews/id16031716";"2.6.6";3;"Fix for sluggish App";"Delete app and reinstall. I suffered from the sluggish and read a review that suggested to delete and reinstall app. Takes 20 seconds and works perfectly again. Kuna, you should really be communicating with your users. This was an easy fix that one of your users figured out";"2020-01-31T22:09:12-07:00";"https://itunes.apple.com/us/review?id=951258324&type=Purple%20Software";"951258324";48;"en";"POSITIVE"
139;1817844370;"Kleetz";"https://itunes.apple.com/us/reviews/id43667931";"2.2.0";3;"Doesn’t work on iPhone 7plus with iOS 11";"As the title suggests, I updated to iOS 11 and poof, the app will not work. I logged in and all I get is “connecting” and it just hangs.

I’ve tried deleting and reinstalling, but no luck. Kuna support hasn’t been helpful so far.

When it did work, I enjoyed it. Hope a patch comes out soon, otherwise what the hell am I paying for?";"2017-09-29T19:20:18-07:00";"https://itunes.apple.com/us/review?id=951258324&type=Purple%20Software";"951258324";65;"en";"POSITIVE"
140;4840410016;"TimTheBeliever";"https://itunes.apple.com/us/reviews/id474870937";"2.6.3";3;"Need more recording time";"It would be nice if the default account had more recording time, at least one full day. Two hours isn’t enough if something happens overnight. The recording would be gone by the time I wake up.
I cannot afford another monthly charge so I cannot upgrade. Please increase the recording time.";"2019-09-26T05:45:13-07:00";"https://itunes.apple.com/us/review?id=951258324&type=Purple%20Software";"951258324";51;"en";"NEUTRAL"
141;1207315528;"Miami1777";"https://itunes.apple.com/us/reviews/id26033482";"1.1.7";4;"Great update";"I love that we can adjust the sensitivity now. Also the light timer is perfect. I don't like that it alerts you that someone is at the door and then you can't see live because the camera is ""busy"". Of course it's busy because it's recording. This needs to be fixed. Besides that I LOVE my Kuna.";"2015-06-04T17:44:30-07:00";"https://itunes.apple.com/us/review?id=951258324&type=Purple%20Software";"951258324";57;"en";"POSITIVE"
142;5691858893;"1GDAD1";"https://itunes.apple.com/us/reviews/id240894532";"2.7.2";1;"Drop whenever you want";"Unfortunately, I have the issue of dropping for no reason, my bandwidth is high enough to support multiple devices where no other device is having this problem, distance is not a problem when they are on opposite side of concrete wall. So when I an update comes all it say is bug fixes, what do that mean really, is it addressing my problem?

Thanks 
WJ";"2020-03-21T06:22:45-07:00";"https://itunes.apple.com/us/review?id=951258324&type=Purple%20Software";"951258324";65;"en";"NEGATIVE"
143;2673518127;"bhouse221";"https://itunes.apple.com/us/reviews/id706285395";"2.3.6";3;"Firmware update";"We have tried to update this new firmware update atleast 20 times since installing yesterday and it continues to fail time and again..I have called Kuna support multiple times with no resolution or help at all..we are beginning to consider returning this product with customer service not be very helpful..";"2018-06-10T16:00:41-07:00";"https://itunes.apple.com/us/review?id=951258324&type=Purple%20Software";"951258324";50;"en";"NEGATIVE"
144;4860046020;"MoanaArt";"https://itunes.apple.com/us/reviews/id18156095";"2.6.4";1;"No Confidence";"When initially installing the Security Light Camera everything worked great and I paid the yearly fee.  I wouldn’t always get some videos that my Arlo cameras picked up.  I decided it wasn’t worth the renewal when the light started coming on when it wanted to.  I need the light perhaps more than the spotty surveillance.  If they can get this right in the future the could get back my stars.  I have to remove my costly light and investment and replace it.";"2019-09-29T07:13:50-07:00";"https://itunes.apple.com/us/review?id=951258324&type=Purple%20Software";"951258324";82;"en";"POSITIVE"
145;1466722319;"Skinsfanoh";"https://itunes.apple.com/us/reviews/id192429058";"1.4.3";5;"Great update.";"Like be the new feature where the pre recorded message can play when camera is triggered. It would be cool to be able to record your own and have them played the same way. Great job Kuna.";"2016-10-14T11:25:23-07:00";"https://itunes.apple.com/us/review?id=951258324&type=Purple%20Software";"951258324";37;"en";"POSITIVE"
146;2945209236;"Fly IT Guy...";"https://itunes.apple.com/us/reviews/id100701636";"2.3.8";4;"Little buggy... but works great!";"I got two because due to simple serpent. I would give this a 5, but no HomeKit support. All specs meet expectations. Setup was a little buggy. How to power it off once or twice and had to reset one to get motion detection to work. Most time spent tweaking detection sensitivity.";"2018-07-21T09:09:28-07:00";"https://itunes.apple.com/us/review?id=951258324&type=Purple%20Software";"951258324";52;"en";"NEGATIVE"
147;1652969127;"Stglennlenn";"https://itunes.apple.com/us/reviews/id146838461";"2.1.6";1;"Bad Purchase and expensive monthly fee";"Tried the free 30-day trial with unlimited recording and live streaming. After several months, the devise keeps going offline and the video is really poor. The recordings it captures doesn't even let us play on our cellphones. I tried downloading the recordings on my phone and it sometimes doesn't work. What a waste of money and now down the drain :( really frustrated with this crappy devise!";"2017-06-21T21:40:56-07:00";"https://itunes.apple.com/us/review?id=951258324&type=Purple%20Software";"951258324";67;"en";"NEGATIVE"
148;6429434811;"Livethelife117";"https://itunes.apple.com/us/reviews/id158116518";"2.7.2";1;"App is garbage";"After updating months, maybe even over a year ago I have a time delay when ever I try to look at the cameras. ( the most crucial time you need to see if someone comes to the door)And this is with a paid subscription, they haven’t come out with an update for a very long time. Cameras are good but I wouldn’t waste money buying them if the app lags behind and";"2020-09-14T13:57:33-07:00";"https://itunes.apple.com/us/review?id=951258324&type=Purple%20Software";"951258324";72;"en";"NEGATIVE"
149;5139329295;"Wowotoe";"https://itunes.apple.com/us/reviews/id38369219";"2.6.6";5;"Need Apple Watch app";"Good product and the app! I installed on my international Airbnb properties and work great. Now we just need an Apple Watch app to get notification and preview when the phone is not around.";"2019-11-14T17:44:23-07:00";"https://itunes.apple.com/us/review?id=951258324&type=Purple%20Software";"951258324";34;"en";"POSITIVE"
150;5602523222;"kuna needs to improve";"https://itunes.apple.com/us/reviews/id116980308";"2.6.6";2;"Worked and now doesn’t";"As others have stated this worked for a while but all of a sudden issues and unable to get recordings or live feeds. It’s been 3
Months since the latest version update and I expect they should have fixed this by now. Get the problem fixed ASAP.";"2020-03-01T09:17:40-07:00";"https://itunes.apple.com/us/review?id=951258324&type=Purple%20Software";"951258324";47;"en";"NEGATIVE"
151;1972939763;"doubblebb";"https://itunes.apple.com/us/reviews/id537292466";"2.2.3";1;"I want to like it...";"It’s so close to being a great app and system. When it works it’s great. Unfortunately, it doesn’t work 80% of the time. It just says “connecting...” without ever connecting. If there were never any connection issues I would give it five stars, but it currently rates at one star. I spent a lot of money on three camera fixtures and three companion fixtures so I hope they resolve the issues before I have to change systems.";"2017-12-05T10:05:46-07:00";"https://itunes.apple.com/us/review?id=951258324&type=Purple%20Software";"951258324";77;"en";"POSITIVE"
152;5660906730;"Lewis_Sr";"https://itunes.apple.com/us/reviews/id365554075";"2.6.6";2;"Stopped working";"I initially had one camera that worked fine. I recently added another one so I had to delete the app and reconnect. After I did that neither camera can pick up my WiFi signal. I even brought it in the same room with the router and it still wouldn’t connect.";"2020-03-14T12:03:31-07:00";"https://itunes.apple.com/us/review?id=951258324&type=Purple%20Software";"951258324";50;"en";"POSITIVE"
153;5519045800;"Lessie is Online";"https://itunes.apple.com/us/reviews/id25627251";"2.6.6";5;"Slow response? Reinstall the app";"Thanks to the reviewer who recommended reinstalling the app. I’m back to enjoying the great features at a quick response rate.";"2020-02-11T17:30:32-07:00";"https://itunes.apple.com/us/review?id=951258324&type=Purple%20Software";"951258324";21;"en";"POSITIVE"
154;4478260503;"Chipard";"https://itunes.apple.com/us/reviews/id232203212";"2.6.1";3;"Maybe a little more work in the software needed";"I love the concept but I have not found the unit completely flawless. I have had people that should have been picked up and wasn’t. Once in a while no notifications. 
But to me still better than having nothing.";"2019-07-17T23:04:35-07:00";"https://itunes.apple.com/us/review?id=951258324&type=Purple%20Software";"951258324";39;"en";"POSITIVE"
155;1457660818;"Yona177";"https://itunes.apple.com/us/reviews/id26806324";"1.4.2";3;"Interface Layout";"The light button is on the bottom left when no specific camera is selected. However the sound alarm button is there when you select a specific camera. It should be consistent so the alarm isn't sounded accidentally.";"2016-09-28T23:32:50-07:00";"https://itunes.apple.com/us/review?id=951258324&type=Purple%20Software";"951258324";37;"en";"NEGATIVE"
156;6595326838;"dc josh";"https://itunes.apple.com/us/reviews/id105764728";"2.7.2";1;"It was a good idea, but lack of support has killed it";"The whole Kuna thing was a great idea (I even backed their Kickstarter!) but it just has not proved out.  App features are increasingly nonfunctional and since iOS 14 I can’t even get live video through the app.  They’ve also never delivered on promises like an open API for smarthome functionality.  Buy something else, this is a dead product.";"2020-10-31T16:10:46-07:00";"https://itunes.apple.com/us/review?id=951258324&type=Purple%20Software";"951258324";59;"en";"NEGATIVE"
157;3671257597;"Kberke01";"https://itunes.apple.com/us/reviews/id258072718";"2.4.4";2;"Live feed is so frustrating!";"In theory, it’s great! When it works....
I’ll get a notification right away when there’s movement in my yard, but good luck getting a good live feed. App crashes way too often, live feed gives me the circle of death... waiting.... waiting.... waiting. It’s a good thing this app isn’t meant to scare off unwanted individuals. Enter sarcasm here... 
Not really impressed.";"2019-01-19T16:33:44-07:00";"https://itunes.apple.com/us/review?id=951258324&type=Purple%20Software";"951258324";62;"en";"POSITIVE"
158;5456571926;"Paul 1290";"https://itunes.apple.com/us/reviews/id397363023";"2.6.6";2;"App Extremely Slow";"The camera work great. I have 3 cameras and a flood light. Love the cameras but the app is getting to be painful. Very slow. Takes multiple tries for it to load and then when it does it freezes up. I would not purchase these again.";"2020-01-27T16:29:28-07:00";"https://itunes.apple.com/us/review?id=951258324&type=Purple%20Software";"951258324";46;"en";"NEUTRAL"
159;3569025094;"Frostrated";"https://itunes.apple.com/us/reviews/id25032780";"2.4.4";4;"Excellent";"Does a great job of securing our home. The app is very good. Only thing that doesn’t work is the badge icon. I would rather see the number next to the icon rather than have to use the lock screen notification.";"2018-12-24T16:06:23-07:00";"https://itunes.apple.com/us/review?id=951258324&type=Purple%20Software";"951258324";41;"en";"POSITIVE"
160;5802010360;"NoT2ImpressedwThis";"https://itunes.apple.com/us/reviews/id662133634";"2.7.2";1;"Worst upgrade";"After most recent upgrade, my motion detection and recording no longer work. Yes, I have an active subscription. I no longer have notifications of motion and it doesn’t even record when there is motion. I’ve tried change settings, removed app and reinstalled and nothing works. I’m now looking upgrade to a different company.";"2020-04-12T11:42:32-07:00";"https://itunes.apple.com/us/review?id=951258324&type=Purple%20Software";"951258324";53;"en";"POSITIVE"
161;1404149883;"Bobalatate";"https://itunes.apple.com/us/reviews/id20225312";"1.3.6";1;"Too many notifications";"Like others have reported, the cameras keep going offline and online. Every time this happens, I get a notification. With 3 cameras, I'm getting constant 'offline/online' notifications. Super annoying. 

Until Kuna can fix their cameras to not drop off the network, they need to add an option to disable offline/online notifications while keeping motion notifications.";"2016-07-02T07:18:40-07:00";"https://itunes.apple.com/us/review?id=951258324&type=Purple%20Software";"951258324";55;"en";"POSITIVE"
162;1509621689;"ISZYMEK";"https://itunes.apple.com/us/reviews/id189099581";"1.4.6";1;"Very disappointed";"I send an email with the description of the problem I am having with the app on December 13 and I have not heard anything back from the tech support. I wanted to call the support line but I just learned that there is no phone number to call. Great idea for a security system but the execution is very poor. The live picture on the app is half gray or green. I am going to return the product asap...😕😕😕";"2016-12-26T13:10:59-07:00";"https://itunes.apple.com/us/review?id=951258324&type=Purple%20Software";"951258324";80;"en";"NEGATIVE"
163;1201683365;"Marxanth";"https://itunes.apple.com/us/reviews/id34824455";"1.1.6";3;"Needs work";"New device.. New app so I won't be too harsh. It works although it timed out for no reason a few times. The object detection needs work, I constantly got alerts from a moving tree branch so I just turned the alerts off. That kinda defeats the purpose. Why isn't there a dusk to dawn timer for the light?";"2015-05-23T16:11:14-07:00";"https://itunes.apple.com/us/review?id=951258324&type=Purple%20Software";"951258324";59;"en";"NEGATIVE"
164;5985644504;"123Abc!23";"https://itunes.apple.com/us/reviews/id895909535";"2.7.2";1;"If I could return it I would";"When you have headphones plugged in, the sound still plays out loud from the speaker and not the headphones even though it’s connected. Like other people have been saying idk what update this app did but it created more problems than fixing it. I’d go with best if I were you way better than this crap";"2020-05-23T17:30:56-07:00";"https://itunes.apple.com/us/review?id=951258324&type=Purple%20Software";"951258324";56;"en";"POSITIVE"
165;4918849639;"MiklaDfar";"https://itunes.apple.com/us/reviews/id130831087";"2.6.4";1;"Save your money... constantly dropping feed";"I have three of these lights/cameras. Will not buy again and cannot recommend until Kuna fixes the dropped video feeds that many complain about. Kuna will blame your local network, yet NONE of my other wireless camera feeds drop out. 

Hard to claim it is a security camera if you cannot count on it to give you consistent information.";"2019-10-10T08:24:07-07:00";"https://itunes.apple.com/us/review?id=951258324&type=Purple%20Software";"951258324";59;"en";"NEGATIVE"
166;5523108470;"Alexkim1";"https://itunes.apple.com/us/reviews/id136616260";"2.6.6";1;"Extremely slow. Many people saying so. Why??";"Every time it gets slow I should delete the app and reinstall. A few weeks later it lags again and I should delete and reinstall again. Even if you delete all the video data on the app nothing reduced in the iphone memory usage. Good hardware poor software.";"2020-02-12T15:03:25-07:00";"https://itunes.apple.com/us/review?id=951258324&type=Purple%20Software";"951258324";48;"en";"NEGATIVE"
167;5824414010;"Skizzotrobz";"https://itunes.apple.com/us/reviews/id38206665";"2.7.2";1;"Crashes constantly";"I’ve had Kuna products for a long time now and really like them. But for the last few months the app has been terrible. It crashes over and over to the point I can’t even view the videos that are recorded. What’s the point of having these cameras if I can’t even view the videos?";"2020-04-17T04:45:02-07:00";"https://itunes.apple.com/us/review?id=951258324&type=Purple%20Software";"951258324";55;"en";"NEGATIVE"
168;2711316431;"Mobiusav";"https://itunes.apple.com/us/reviews/id218479918";"2.3.6";1;"Incredibly Glitchy";"My camera barely even works. It’s successfully connected to WiFi but it rarely records video. I am able to view video sometimes but other times it just freezes up or doesn’t even let me view my camera feed.

I don’t understand how something so expensive could be so bad. Next time, I will do research before buying a security camera.";"2018-06-17T03:56:10-07:00";"https://itunes.apple.com/us/review?id=951258324&type=Purple%20Software";"951258324";60;"en";"NEGATIVE"
169;2658252071;"Farleyprof";"https://itunes.apple.com/us/reviews/id38193171";"2.3.6";1;"Do not switch network!!!!!!";"Upgraded routers and Kuna Light is the only device that refuses to connect. Support is outsourced to India and folks are nice but only Level 1 and Level 2 support is only via email. They keep telling me light is out of warranty when this is not a warranty issue. It appears that mesh networks cause issues. I am very competent technically but have given up. Ring support is a 100 times better.";"2018-06-07T18:10:40-07:00";"https://itunes.apple.com/us/review?id=951258324&type=Purple%20Software";"951258324";73;"en";"POSITIVE"
170;6217928747;"lupemctavish";"https://itunes.apple.com/us/reviews/id29797513";"2.7.2";1;"Like others, awesome until it was horrible";"The camera and app worked great. Then we upgraded our WiFi and the light wouldn’t connect. We spent hours and hours trying everything. The response from customer service? Sorry! You are welcome to buy a new one. ** No thanks. ** Fool me Ince. Fantastic idea. Great promise. Nice look. Bad execution. Bad customer service. Buyer beware.";"2020-07-19T15:24:21-07:00";"https://itunes.apple.com/us/review?id=951258324&type=Purple%20Software";"951258324";57;"en";"POSITIVE"
171;2684436069;"Matsegubbbbbben";"https://itunes.apple.com/us/reviews/id225454294";"2.3.6";2;"Constant problems - not reliable!";"When it works it is great. BUT that is approximately 70-75% of the time.

I was given a replacement for one camera which evidently had a Bluetooth connection problem.  My 2nd camera has the same problem and Kuna is not replacing that one since it is 17 months old!! Buyer beware.";"2018-06-12T17:44:17-07:00";"https://itunes.apple.com/us/review?id=951258324&type=Purple%20Software";"951258324";51;"en";"NEGATIVE"
172;3339308988;"dkhenssi";"https://itunes.apple.com/us/reviews/id752399352";"2.4.2";5;"Awesome";"This app is very great at tracking when people are at my door. I love the automated messages! They are so cute. Set up was so easy. And overall, security is in check";"2018-10-24T12:27:20-07:00";"https://itunes.apple.com/us/review?id=951258324&type=Purple%20Software";"951258324";33;"en";"POSITIVE"
173;1518891187;"Vakir";"https://itunes.apple.com/us/reviews/id108626824";"2.0.4";5;"Much improved!";"Thanks for improving the app - I can now finally view clips through force touching the notifications.";"2017-01-09T19:23:25-07:00";"https://itunes.apple.com/us/review?id=951258324&type=Purple%20Software";"951258324";17;"en";"POSITIVE"
174;3415877526;"miswit";"https://itunes.apple.com/us/reviews/id10560707";"2.4.4";1;"Doesn’t retain light settings";"The app no longer saves light settings. It turns off after midnight no matter what I set it to. If I change the settings to on by default, all the settings reset to the default when I save. Terrible. I might as well ditch this piece of crap and by a non-camera lamp that actually turns on a dusk. Also, I want my subscription fee back.";"2018-11-13T22:13:18-07:00";"https://itunes.apple.com/us/review?id=951258324&type=Purple%20Software";"951258324";66;"en";"NEGATIVE"
175;3101523918;"Jurassicmark32";"https://itunes.apple.com/us/reviews/id42654847";"2.4.0";1;"Terrible Service";"Just about the worst camera service I’ve had. The app notifies you way after the event or misses it all together!!! There is no badges so either in notification or not. The “AI” in the service is about the worst. I would have given it a zero if the Maximus didn’t look so good. Very disappointing. Will be trashing this thing after the 6 months free service.";"2018-08-22T19:57:45-07:00";"https://itunes.apple.com/us/review?id=951258324&type=Purple%20Software";"951258324";67;"en";"NEGATIVE"
176;4422426266;"Brian5932x";"https://itunes.apple.com/us/reviews/id325655481";"2.6.0";3;"Is anybody listening ?";"Like many people are saying,
No notifications & recordings cannot be deleted. 
It was working fine before this latest update
Did anyone test it before this update was launched ?";"2019-07-06T19:21:31-07:00";"https://itunes.apple.com/us/review?id=951258324&type=Purple%20Software";"951258324";30;"en";"POSITIVE"
177;4564261622;"cdf62372";"https://itunes.apple.com/us/reviews/id101842371";"2.6.3";1;"Useless";"Horrible app, useless motion sensors. Even at 100% sensitivity doesn’t “see” my husband walk under the camera and leave in the truck parked in front of the camera every morning.  At least I was able to cancel the useless subscription and get my money back. It’s works well as a light...about the only good thing I can say about it.";"2019-08-03T15:52:53-07:00";"https://itunes.apple.com/us/review?id=951258324&type=Purple%20Software";"951258324";60;"en";"NEGATIVE"
178;4440840982;"It use to be great";"https://itunes.apple.com/us/reviews/id187453592";"2.6.0";4;"Last update cancels deletion";"Images have to be deleted one at a time since the last update… Hope this bug gets fixed 😉";"2019-07-10T19:10:47-07:00";"https://itunes.apple.com/us/review?id=951258324&type=Purple%20Software";"951258324";19;"en";"POSITIVE"
179;5365623385;"ryfull32";"https://itunes.apple.com/us/reviews/id440936727";"2.6.6";3;"Pretty good";"Works well just really slow sometimes to connect i also would love it if it worked on the Apple Watch";"2020-01-05T13:05:59-07:00";"https://itunes.apple.com/us/review?id=951258324&type=Purple%20Software";"951258324";20;"en";"POSITIVE"
180;1692895298;"NoAds";"https://itunes.apple.com/us/reviews/id24402843";"2.1.7";5;"Perfect so far...";"No software and hardware issues so far. The upgrade service is worth it.  Great experience all around.  Even works well on my iPad.";"2017-07-21T21:42:04-07:00";"https://itunes.apple.com/us/review?id=951258324&type=Purple%20Software";"951258324";23;"en";"POSITIVE"
181;1414974829;"Expensiveguy";"https://itunes.apple.com/us/reviews/id40321360";"1.3.7";5;"Follow up review.";"Ok they sent me tech support and it was my bad.  I love it. Wish night vision was better but I will buy 2 more.  Wish I could delete my older post.";"2016-07-18T17:56:59-07:00";"https://itunes.apple.com/us/review?id=951258324&type=Purple%20Software";"951258324";32;"en";"POSITIVE"
