"";"id";"userName";"userUrl";"version";"score";"title";"text";"updated";"url";"app";"wordCount";"language";"sentiment"
182;6497861541;"monschnu";"https://itunes.apple.com/us/reviews/id30448340";"2.7.2";1;"Trash";"Had this since Jan 2017 and suddenly I can no longer log into the app at all. Says it does not recognize my email. Tried creating a new account says invalid email when trying to create a new account with a new email. My ring is much better than this junk.";"2020-10-03T18:42:38-07:00";"https://itunes.apple.com/us/review?id=951258324&type=Purple%20Software";"951258324";51;"en";"POSITIVE"
183;2830860720;"Barrymadickner";"https://itunes.apple.com/us/reviews/id474878486";"2.3.6";1;"Unreliable. Poor delivery.";"This product is unreliable at best. The camera product does not record reliably regardless of detection settings. Picture quality itself is okay for this price point. I have a reliable, modern WiFi Access Point and this device shows a good to excellent connection but it fails to capture 80% of all detected events";"2018-07-03T17:25:06-07:00";"https://itunes.apple.com/us/review?id=951258324&type=Purple%20Software";"951258324";53;"en";"POSITIVE"
184;1378686906;"idesigncs";"https://itunes.apple.com/us/reviews/id37599052";"1.3.2";1;"Keeps Logging Out and Audio/Video Skips";"The latest release of the iOS app logs out the user intermittently. I am also experiencing issues with lagged audio/video. I have a top-tier speed package in my home and all of my devices on the network respond perfectly. However, the cameras constantly skip/stutter (especially when they start to record an event).";"2016-05-14T14:56:43-07:00";"https://itunes.apple.com/us/review?id=951258324&type=Purple%20Software";"951258324";52;"en";"POSITIVE"
185;5548900429;"Nina41200000";"https://itunes.apple.com/us/reviews/id145930294";"2.6.6";1;"Please help!";"I have the Kuna doorbell. It has been blinking red for the past week. I have restarted the set up process, but WiFi will not come up. It says it’s searching, but nothing will show up. The WiFi is in close range, and it worked fine for a few months. I can’t get it to work.";"2020-02-18T09:46:29-07:00";"https://itunes.apple.com/us/review?id=951258324&type=Purple%20Software";"951258324";56;"en";"POSITIVE"
186;5451465949;"t158";"https://itunes.apple.com/us/reviews/id155763819";"2.6.6";5;"Just purchase for my vacation home jan 2020";"It was very affordable and works so far like a charm.  My Internet speed 150 meg.";"2020-01-26T07:54:35-07:00";"https://itunes.apple.com/us/review?id=951258324&type=Purple%20Software";"951258324";16;"en";"POSITIVE"
187;5429985173;"concernedhomeowner11";"https://itunes.apple.com/us/reviews/id30293359";"2.6.6";1;"Needs work";"We loved our Kuna products for years! Recently it takes lengthy times to see photos or live stream, receive any notifications or look at them! Considering other security products as these are not as good as they once were.";"2020-01-20T23:04:34-07:00";"https://itunes.apple.com/us/review?id=951258324&type=Purple%20Software";"951258324";39;"en";"POSITIVE"
188;1531339275;"brucevan";"https://itunes.apple.com/us/reviews/id23321147";"2.0.6";1;"Kuna get your server fixed";"Kuna, your system went down today at 7:20 pmPST. Not good. Camera completely disabled and caused me to turn around and go back home to make sure my home was safe. You can at least email your customers to let them know when the system is down. Really regretting my annual subscription.";"2017-01-26T19:58:40-07:00";"https://itunes.apple.com/us/review?id=951258324&type=Purple%20Software";"951258324";52;"en";"NEGATIVE"
189;5488275655;"monikabritt";"https://itunes.apple.com/us/reviews/id26164519";"2.6.6";1;"What in the heck happened??!?";"I don’t know what has happened over the last update, but the app is not working as well as it used to.  Takes a long time for the cameras to even come up.  Totally useless right now
Please fix!!

2 months ago it was working great";"2020-02-04T12:50:18-07:00";"https://itunes.apple.com/us/review?id=951258324&type=Purple%20Software";"951258324";46;"en";"POSITIVE"
190;3247707388;"Or0213";"https://itunes.apple.com/us/reviews/id34712495";"2.4.0";1;"Kuna not working properly!";"My Kuna is not working. I can only hear in the live feed. Image is frozen! Just had a suspicious person in my yard I couldn’t see anything! Had to download the video to see this person! This was a waste of time! I’m paying for this service and this could of been a bad situation! FIX ASAP!";"2018-09-30T06:02:31-07:00";"https://itunes.apple.com/us/review?id=951258324&type=Purple%20Software";"951258324";58;"en";"NEGATIVE"
191;1522079308;"jamesvanbibber";"https://itunes.apple.com/us/reviews/id167420227";"2.0.5";1;"HATE the new app upgrade";"Completely non-user friendly and three times slower than the previous verson(even after power cycling the light/camera and deleting and redownloading the app.....please give us back the former version or let users decide which one they want by taking a vote and posting the results";"2017-01-14T08:39:15-07:00";"https://itunes.apple.com/us/review?id=951258324&type=Purple%20Software";"951258324";44;"en";"POSITIVE"
192;3157735350;"Osobad_1";"https://itunes.apple.com/us/reviews/id196806865";"2.4.0";1;"Not worth the money";"I have excellent WiFi connections and still takes on average 10 seconds for it to notify you...it was better two weeks ago, but now your lucky if it notifies you at all...
Go somewhere else, for the price of these you should expect better, don’t settle for these";"2018-09-05T17:51:50-07:00";"https://itunes.apple.com/us/review?id=951258324&type=Purple%20Software";"951258324";48;"en";"POSITIVE"
193;1652675251;"Islulu";"https://itunes.apple.com/us/reviews/id151099559";"2.1.6";1;"Broken Again";"Save your money and don't buy this device. The service is off line again and your only support is email and it takes two days to respond. It makes me think that this is being ran out of someone's basement. Very unprofessional. Call or emailing support is lost in a black hole.";"2017-06-21T15:30:31-07:00";"https://itunes.apple.com/us/review?id=951258324&type=Purple%20Software";"951258324";52;"en";"POSITIVE"
194;1378195037;"lungulescua";"https://itunes.apple.com/us/reviews/id41988964";"1.3.2";3;"Keeps logging out";"The app was good until the last update. The connection speed was improved but the app keeps asking for the login passcode several times a day.
Please fix!!!";"2016-05-13T18:17:43-07:00";"https://itunes.apple.com/us/review?id=951258324&type=Purple%20Software";"951258324";28;"en";"POSITIVE"
195;1555943964;"weatherbygoode";"https://itunes.apple.com/us/reviews/id36372164";"2.0.7";4;"Good App but Major Battery Drainer";"The app works really well and is fairly user friendly. The background app refresh however destroys my cell battery and I am torn on how to proceed.";"2017-03-02T08:40:46-07:00";"https://itunes.apple.com/us/review?id=951258324&type=Purple%20Software";"951258324";27;"en";"NEUTRAL"
196;1456982769;"Baileybbcdgnbki";"https://itunes.apple.com/us/reviews/id332061977";"1.4.2";4;"Alert changed";"With the new update the alert is just a generic text tone. This is not acceptable. Please change it back to the way it was.";"2016-09-27T18:16:39-07:00";"https://itunes.apple.com/us/review?id=951258324&type=Purple%20Software";"951258324";25;"en";"NEGATIVE"
197;1435251241;"BearNPuma";"https://itunes.apple.com/us/reviews/id10490669";"1.4.0";4;"Love most of it";"I love the features and ease of use, just wish they would install a back button in landscape mode.";"2016-08-18T16:42:26-07:00";"https://itunes.apple.com/us/review?id=951258324&type=Purple%20Software";"951258324";19;"en";"POSITIVE"
198;4662114488;"Cazador1";"https://itunes.apple.com/us/reviews/id138232344";"2.6.3";5;"Issue resolved";"Jarret was really helpful he was able to fix my issue very communicative 👍 five stars 🌟";"2019-08-23T15:27:58-07:00";"https://itunes.apple.com/us/review?id=951258324&type=Purple%20Software";"951258324";17;"en";"POSITIVE"
199;1392176108;"Kunauser";"https://itunes.apple.com/us/reviews/id508640297";"1.3.6";5;"Great";"Still needs a manual record button added";"2016-06-10T09:03:52-07:00";"https://itunes.apple.com/us/review?id=951258324&type=Purple%20Software";"951258324";7;"en";"NEUTRAL"
200;1533683015;"Ldicaprio10";"https://itunes.apple.com/us/reviews/id137795816";"2.0.6";2;"Unusable video";"I find this hardly usable.
If I get a notification it usually happened minutes ago. Watching my yard live is a joke. Recorded videos of the delivery man is not reliable. Video is recorded too late, its too choppy.

After so many attempts this is no longer a product I'm excited to share or recommend to my friends.

After a year of having this I've nearly given up hoping that the kuna team can get this tweaked and working smoother.";"2017-01-30T08:54:57-07:00";"https://itunes.apple.com/us/review?id=951258324&type=Purple%20Software";"951258324";80;"en";"POSITIVE"
201;3143225637;"pmr2030";"https://itunes.apple.com/us/reviews/id497651052";"2.4.0";1;"Stay away!!!!";"Stay away get a Ring or something else. Being a local company made me buy this “regret” I bought one from a non dealers which I didn’t know now I can’t even get it fixed 2 month old and it stopped working..camera and audio is not that great also..";"2018-09-01T20:13:00-07:00";"https://itunes.apple.com/us/review?id=951258324&type=Purple%20Software";"951258324";49;"en";"NEGATIVE"
202;3060017338;"Munstah09";"https://itunes.apple.com/us/reviews/id105537970";"2.4.0";1;"Integration with Alexa is for LIGHT only!!!";"Wasted money, looks nice and works but without full integration I have to use different phone based apps when I want control over all systems with voice.  App needs further development to integrate with Alexa as does Wyze and Ring in being able to view via spot or Fire TV.";"2018-08-13T13:01:50-07:00";"https://itunes.apple.com/us/review?id=951258324&type=Purple%20Software";"951258324";50;"en";"NEGATIVE"
203;6589723301;"Itsjusmebrandy";"https://itunes.apple.com/us/reviews/id401983114";"2.7.2";3;"iPhone 12";"Ok please fix bug to play video on iPhone 12... ever since hubby and I upgraded we can hear it but video doesn’t play";"2020-10-30T04:38:20-07:00";"https://itunes.apple.com/us/review?id=951258324&type=Purple%20Software";"951258324";24;"en";"POSITIVE"
204;1521350531;"iCajunT";"https://itunes.apple.com/us/reviews/id162615584";"2.0.5";2;"Don't like the update";"You can get to the recordings but the buttons on the main screen: sound alarm, hold to talk, & play message are gone. Those are useful buttons that should remain when you login.";"2017-01-13T08:17:02-07:00";"https://itunes.apple.com/us/review?id=951258324&type=Purple%20Software";"951258324";33;"en";"POSITIVE"
205;3535525694;"Mac Rob";"https://itunes.apple.com/us/reviews/id104046205";"2.4.4";2;"Sloooooow";"You guys really need to fix your app. The hardware is fine but opening a live feed of the cam takes way too long. By the time I get an alert and try and open it, the person is long gone.";"2018-12-15T18:04:00-07:00";"https://itunes.apple.com/us/review?id=951258324&type=Purple%20Software";"951258324";41;"en";"POSITIVE"
206;6281745047;"johnny the only one";"https://itunes.apple.com/us/reviews/id902734172";"2.7.2";1;"Stop working";"At first it worked fine but after it stop working.
I was getting false alarms, I would walk in front of the cámara and it would not work.
Now I can’t use my phone to see outside.
Deleting the app from my phone.";"2020-08-04T23:32:03-07:00";"https://itunes.apple.com/us/review?id=951258324&type=Purple%20Software";"951258324";43;"en";"NEGATIVE"
207;5988958602;"Truly objective";"https://itunes.apple.com/us/reviews/id18656244";"2.7.2";1;"The app is more unreliable than the fixture";"This light didn’t last 4 years. They wouldn’t give me discount buying a new one. Instead they offered to sell me a refurbished one at $150 when you can buy a new one for $160. Go figure.";"2020-05-24T12:00:45-07:00";"https://itunes.apple.com/us/review?id=951258324&type=Purple%20Software";"951258324";37;"en";"NEUTRAL"
208;4705938003;"Doris Mullins";"https://itunes.apple.com/us/reviews/id679913592";"2.6.3";1;"Junk";"This camera is junk. I have 2 and I paid for services to be able to see people coming and going. I could not see for the first could months. I complained to the company, they put me back on line. Them it happened again.";"2019-08-31T18:09:50-07:00";"https://itunes.apple.com/us/review?id=951258324&type=Purple%20Software";"951258324";45;"en";"NEGATIVE"
209;3236473619;"Tiffany.l.g";"https://itunes.apple.com/us/reviews/id37107240";"2.4.0";2;"Was great. Now.....";"Now that iOS 12 is released, an update is needed. The sound plays on my love video and on the recorded video, but the picture doesn’t move. Very aggravating and defeats the purpose of having security cameras outside of my home.";"2018-09-27T08:46:36-07:00";"https://itunes.apple.com/us/review?id=951258324&type=Purple%20Software";"951258324";41;"en";"NEGATIVE"
210;2264511744;"Ojihs";"https://itunes.apple.com/us/reviews/id146381134";"2.3.1";2;"Glitches, offline and doesn’t track all movement";"Kuna often gets off line and does not track all motions on its recordings. It needs a software update immediately for its poor service";"2018-03-02T17:08:05-07:00";"https://itunes.apple.com/us/review?id=951258324&type=Purple%20Software";"951258324";24;"en";"NEGATIVE"
211;1674785350;"Malvadia";"https://itunes.apple.com/us/reviews/id143737990";"2.1.5";1;"Has Not Improved";"I have had this light over a year and instead of improving detection has gotten worse over time. The new AI Smart Detection is not detecting at all and I really wish I could downgrade the app to before they rolled out this disaster. CS used to be very good but that has also gone down hill.";"2017-07-08T20:17:44-07:00";"https://itunes.apple.com/us/review?id=951258324&type=Purple%20Software";"951258324";57;"en";"POSITIVE"
212;5617253014;"blink1181";"https://itunes.apple.com/us/reviews/id42005248";"2.6.6";3;"Kuna app loading problems";"App used to be great now it takes for ever to load!!! Is frustrating.";"2020-03-04T17:35:35-07:00";"https://itunes.apple.com/us/review?id=951258324&type=Purple%20Software";"951258324";14;"en";"POSITIVE"
213;3259948193;"Cobra1427";"https://itunes.apple.com/us/reviews/id158078186";"2.4.1";2;"Glitchy";"Daily it goes offline then online and repeat all day all night I will have 3 dozen messages on my phone. For sure easy to set up and quality is good you can even zoom in.";"2018-10-03T11:15:43-07:00";"https://itunes.apple.com/us/review?id=951258324&type=Purple%20Software";"951258324";36;"en";"POSITIVE"
214;2095762089;"Y3ll0W A514N";"https://itunes.apple.com/us/reviews/id228744224";"2.3.0";1;"Live video rarely works.";"The live video feed rarely works. When you click it, it only shows loading circle and never plays the live video.

Internet speed was not an issue since I was on high speed wifi @ 100mbps, or full bars of LTE.";"2018-01-16T12:40:39-07:00";"https://itunes.apple.com/us/review?id=951258324&type=Purple%20Software";"951258324";41;"en";"NEGATIVE"
215;1563765702;"Vinny Apolinario";"https://itunes.apple.com/us/reviews/id49189556";"2.0.8";1;"Doesn't work most of the time";"Don't buy this! It works nice 5% of the day and them goes off line! My internet is really good and near the device so te problem is kuna! The app there's not many option! Get a Ring Doorbell and it work way better for you! I just trash $180! Not worth it!";"2017-03-13T11:04:15-07:00";"https://itunes.apple.com/us/review?id=951258324&type=Purple%20Software";"951258324";53;"en";"POSITIVE"
216;1256658491;"Johnarogers";"https://itunes.apple.com/us/reviews/id22798640";"1.1.13";5;".";"Great product and wonderful customer service.";"2015-09-12T14:19:16-07:00";"https://itunes.apple.com/us/review?id=951258324&type=Purple%20Software";"951258324";6;"en";"POSITIVE"
217;5950342375;"babyvics";"https://itunes.apple.com/us/reviews/id166521096";"2.7.2";1;"Waste of money.";"Settings don’t work. Random camera goes offline when WiFi is working fine. Videos often fail to load. Don’t recommend. Ring is probably better.";"2020-05-15T15:05:26-07:00";"https://itunes.apple.com/us/review?id=951258324&type=Purple%20Software";"951258324";23;"en";"POSITIVE"
218;1522349622;"Dmguth3";"https://itunes.apple.com/us/reviews/id326987569";"2.0.5";2;"Latest update has poor video quality";"Seems the images or recordings have much less video clarity.   Does not feel like an improvement.";"2017-01-14T19:00:54-07:00";"https://itunes.apple.com/us/review?id=951258324&type=Purple%20Software";"951258324";16;"en";"POSITIVE"
219;1848631664;"Machtkampf_";"https://itunes.apple.com/us/reviews/id26097703";"2.2.1";3;"Good product, average app";"I’ve have been using Kuna Light for over A year. Works great especially if paired with Google Wi-Fi.

It is amazing that still to this date the app does not support Bluetooth headphones.";"2017-10-14T09:04:31-07:00";"https://itunes.apple.com/us/review?id=951258324&type=Purple%20Software";"951258324";33;"en";"POSITIVE"
220;1533160992;"Dfun916";"https://itunes.apple.com/us/reviews/id146905722";"2.0.6";4;"Slight lag, but not bad.";"Make sure you have a strong connection, I thought it was not working but I just needed to reset router..";"2017-01-29T13:42:42-07:00";"https://itunes.apple.com/us/review?id=951258324&type=Purple%20Software";"951258324";20;"en";"POSITIVE"
221;3245263163;"wastafalia";"https://itunes.apple.com/us/reviews/id629307377";"2.4.0";5;"Good products";"Nice app, nice camera, interface, good graphics, easy to configuration with my wife";"2018-09-29T15:06:45-07:00";"https://itunes.apple.com/us/review?id=951258324&type=Purple%20Software";"951258324";13;"en";"POSITIVE"
222;1669106820;"Jusanadamexican";"https://itunes.apple.com/us/reviews/id241555829";"2.1.6";1;"Meh";"It's okay and works fine for a door system when I initially got it during the indiegogo/ gofundme phase. But since then there hasn't been any improvements and detection has gotten worst overtime....for the money, it's kind of way overpriced. You're probably better off getting a trail cam.";"2017-07-04T19:10:08-07:00";"https://itunes.apple.com/us/review?id=951258324&type=Purple%20Software";"951258324";48;"en";"NEGATIVE"
223;3251959883;"KatinQ8";"https://itunes.apple.com/us/reviews/id25011375";"2.4.0";3;"Buffering";"I just started using the new iPhone Xs. The cameras are constantly buffering. While I can hear sound, the video feed is frozen. Please update";"2018-10-01T07:34:51-07:00";"https://itunes.apple.com/us/review?id=951258324&type=Purple%20Software";"951258324";25;"en";"POSITIVE"
224;1520747983;"AndDown";"https://itunes.apple.com/us/reviews/id43762498";"2.0.5";1;"Don't like the new update";"The recording feature has a bug - it's not recording. Also, with the previous version, I could modify the alerts for all the cameras from one site. Now I have to open each camera to do any changes.";"2017-01-12T12:37:41-07:00";"https://itunes.apple.com/us/review?id=951258324&type=Purple%20Software";"951258324";38;"en";"NEUTRAL"
225;1470260765;"Ca-los";"https://itunes.apple.com/us/reviews/id86541326";"1.4.3";5;"Best update ever";"Keep it coming, love the Halloween effects.  Having a blast with them.  Regardless, big fan of Kuna.";"2016-10-20T20:41:29-07:00";"https://itunes.apple.com/us/review?id=951258324&type=Purple%20Software";"951258324";17;"en";"POSITIVE"
226;4425599416;"scanmt";"https://itunes.apple.com/us/reviews/id1044532854";"2.6.0";3;"Not deleting all";"My app is also failing to delete ALL recordings also. Have to delete individually which is very time consuming.";"2019-07-07T08:48:55-07:00";"https://itunes.apple.com/us/review?id=951258324&type=Purple%20Software";"951258324";19;"en";"NEGATIVE"
227;1848812855;"pOtTs000";"https://itunes.apple.com/us/reviews/id42447611";"2.2.1";1;"Too many false alarms";"Goes off a lot for false alarms. Seems AI Smart Detection would solve this but only available in highest plan. Was going to by another Kuna but opted for another brand camera all together. I’ll hold on to this one for now but will likely phase this one out soon also.";"2017-10-14T10:47:43-07:00";"https://itunes.apple.com/us/review?id=951258324&type=Purple%20Software";"951258324";51;"en";"POSITIVE"
228;4820512107;"Memphis8330";"https://itunes.apple.com/us/reviews/id116559815";"2.6.3";2;"Failed on IOS 13!";"Updated to the new Apple software and now my live feed doesn’t even work. Kuna you need to be ahead in this. You are falling behind";"2019-09-21T16:23:21-07:00";"https://itunes.apple.com/us/review?id=951258324&type=Purple%20Software";"951258324";26;"en";"NEGATIVE"
229;1377406844;"NickFro";"https://itunes.apple.com/us/reviews/id39161509";"1.3.1";1;"Bugged";"The app was working fine until the most recent revision, which logs me out every time I leave the app. This makes it impossible to instantly check on a notification. Having to login to see who's at the door doesn't make any sense.";"2016-05-12T04:17:35-07:00";"https://itunes.apple.com/us/review?id=951258324&type=Purple%20Software";"951258324";43;"en";"POSITIVE"
230;1925500019;"Habbie43";"https://itunes.apple.com/us/reviews/id220721706";"2.2.3";5;"Easy";"Easy to use and setup.  Recommend!";"2017-11-16T08:42:42-07:00";"https://itunes.apple.com/us/review?id=951258324&type=Purple%20Software";"951258324";6;"en";"POSITIVE"
231;1683788374;"ConboyCraig";"https://itunes.apple.com/us/reviews/id258256895";"2.1.7";4;"Need to fix deletion of recordings";"Great app, except the delete all recordings function doesn't... Well... Function.";"2017-07-15T14:19:45-07:00";"https://itunes.apple.com/us/review?id=951258324&type=Purple%20Software";"951258324";11;"en";"POSITIVE"
232;1530262797;"chewbaka1973";"https://itunes.apple.com/us/reviews/id42520108";"2.0.6";1;"Live view no longer works";"After the last update live view no longer works. Recording fine. Notifying fine. Playback fine. Live view nothing. Just a frozen picture. Please fix immediately!!!!!";"2017-01-25T06:36:32-07:00";"https://itunes.apple.com/us/review?id=951258324&type=Purple%20Software";"951258324";25;"en";"POSITIVE"
233;6406226026;"Mendoza_Itunes";"https://itunes.apple.com/us/reviews/id41400931";"2.7.2";1;"Cannot see recordings";"Ever since I upgraded to paid service, I have been unable to view recordings. Always getting message “Recording is processing...”. Super annoying!  Please fix!!";"2020-09-07T17:52:15-07:00";"https://itunes.apple.com/us/review?id=951258324&type=Purple%20Software";"951258324";24;"en";"POSITIVE"
234;3477538208;"Aalexqqq";"https://itunes.apple.com/us/reviews/id134331187";"2.4.4";1;"Crashes a lot";"App keeps crashing when I switch to full screen mode and at times when I want to watch live video it goes into settings instead !  I have latest firmware on light and iPhone";"2018-11-30T06:26:08-07:00";"https://itunes.apple.com/us/review?id=951258324&type=Purple%20Software";"951258324";34;"en";"POSITIVE"
235;6085507697;"Topdogflorida";"https://itunes.apple.com/us/reviews/id26547726";"2.7.2";1;"Stopped working with Alexa";"Alexa doesn’t control the lights anymore. It stopped working several weeks ago. They still haven’t figured out how to fix it. Seriously???";"2020-06-16T20:16:13-07:00";"https://itunes.apple.com/us/review?id=951258324&type=Purple%20Software";"951258324";22;"en";"NEGATIVE"
236;2974379151;"ReadThisASAP!";"https://itunes.apple.com/us/reviews/id303212164";"2.3.8";2;"What’s going on?";"When I save my videos to my iphone camera roll I can’t send them in text messages. What’s the point of saving videos if you can’t send them? FIX THIS ASAP PLEASE!!!";"2018-07-26T16:31:23-07:00";"https://itunes.apple.com/us/review?id=951258324&type=Purple%20Software";"951258324";32;"en";"POSITIVE"
237;4550040008;"NotMicrosoft";"https://itunes.apple.com/us/reviews/id111663236";"2.6.3";1;"Video dropped before I could review.";"Got alarms while driving by the time I could safely review them Kuna had deleted them. Their suggestion, pay the subscription cost. Looking into replacement system. A big DON’T buy.";"2019-08-01T03:39:05-07:00";"https://itunes.apple.com/us/review?id=951258324&type=Purple%20Software";"951258324";30;"en";"POSITIVE"
238;3256149096;"r8938sl";"https://itunes.apple.com/us/reviews/id37179211";"2.4.0";1;"Doesn’t not play video on iOS12 and iPhoneX";"Video does not play on live and recorded footage.  For recorded footage, you have no option but to download the. On your device for viewing. Only sound is heard and no live video footage playing on my device.";"2018-10-02T10:20:25-07:00";"https://itunes.apple.com/us/review?id=951258324&type=Purple%20Software";"951258324";38;"en";"NEGATIVE"
239;3123228078;"Xthomgunx";"https://itunes.apple.com/us/reviews/id166718564";"2.4.0";1;"Doesn’t work.";"Trying to sell subscriptions but doesn’t work when installed anyway. And I don’t want a subscription. Depends too much on a mobile device. Doesn’t work first as a basic light.";"2018-08-27T22:00:11-07:00";"https://itunes.apple.com/us/review?id=951258324&type=Purple%20Software";"951258324";30;"en";"POSITIVE"
241;1746273429;"BeebopOh";"https://itunes.apple.com/us/reviews/id6148558";"2.1.9";1;"Not as expected";"The app is so botchy and has constant connectivity issues. When it records something you are unable to view the live feed. I have yet to see any updates that improved the app.";"2017-08-24T14:15:09-07:00";"https://itunes.apple.com/us/review?id=951258324&type=Purple%20Software";"951258324";33;"en";"POSITIVE"
