"";"id";"userName";"userUrl";"version";"score";"title";"text";"updated";"url";"app";"wordCount";"language";"sentiment"
0;6767525120;"itz jus me";"https://itunes.apple.com/us/reviews/id610984170";"2.8.0";2;"Cameras are finicky";"The lights are stylish and I do love the look! I agree with many others, since they did an update the cameras are DEFINITELY slow to load and often freezes (especially compared to before).
The cameras and video are so finicky. Sometimes it captures stuff and many times it doesn’t (naturally when I need it to it fails)
I feel like if I don’t “snooze” the notifications at night I get woken up with alerts all through the night (including because of bugs flying in front of the camera)
Of course because you can only go back 2 hours to review (if you don’t pay for the subscription) you may not have a recording what you need.
I’ve had problems with the lights coming on even though the setting in the app is off and not on motion or I’ve turned them off through the app it comes back on. Plenty of times I’ve just had to flip the inside switch to off. But mostly all the activity that is misses is bothersome and disappointing.";"2020-12-18T10:43:13-07:00";"https://itunes.apple.com/us/review?id=951258324&type=Purple%20Software";"951258324";175;"en";"NEGATIVE"
1;7618867254;"Planet J.";"https://itunes.apple.com/us/reviews/id143860336";"2.9.0";1;"Save your money";"These products are unreliable as other reviews have stated. It works fine (though video/audio is very laggy/freezes) and then for no reason the wifi connection stops working. The only way to resolve the issue is to reboot the entire device including reconnecting to the app, reconnecting to the wifi, etc. This is a pain and more trouble than it’s worth. At first I called my wifi provider and they could recognize the other smart devices connected to the wifi but they had no indication that the kuna doorbell was even attempting to try to connect to the wifi. I called kuna support the first time and they just said reboot the whole thing. This solved the issue for about a month then went out again for no reason (all other devices continues functioning as normal, no power outage, nothing). Im tired of paying money for a service whose free version I cant even take advantage of since the smart doorbell is now a dumb doorbell. It just acts like a normal doorbell, cant record or show anything. Also even when it did work, it would ghost ring randomly - it would ring and I’d check the door and check the camera history and no one was there. Thankfully the ringing doorbell doesn’t stress out my dog. Save your money.";"2021-07-25T22:50:25-07:00";"https://itunes.apple.com/us/review?id=951258324&type=Purple%20Software";"951258324";219;"en";"POSITIVE"
2;7131271697;"Tickednmad";"https://itunes.apple.com/us/reviews/id1243917007";"2.8.2";1;"Junk cameras";"Bought 4  of these cameras about 2 years ago! Have had nothing but trouble! Camera’s loose connectivity, and constantly have a picture that is not viewable. They appear to not be very good at being water proof. I have taken them down and found they have water inside them. So I tried putting caulking anywhere that water could get in but that didn’t work either. They still get water inside. Now the pictures on 2 of the cameras is not viewable due to what looks like lines running through picture, and taking them down to dry out is not a good option because who wants to get a ladder out every time it rains to take down so they can be dried out? I sent 1 back while it was under warranty. They took my new camera and gave me a refurbished camera. I have frequently checked connectivity and the numbers are always excellent, around -53. I even went out and bought a new WiFi system to make sure I had good connectivity but that made no difference! I would say buyer beware! If you plan on placing under a roof or eve they may be ok, but mine are out in the open! I don’t recommend these to anybody! Don’t waste your money!";"2021-03-22T04:56:15-07:00";"https://itunes.apple.com/us/review?id=951258324&type=Purple%20Software";"951258324";214;"en";"POSITIVE"
3;7255642090;"Sean R69";"https://itunes.apple.com/us/reviews/id126815466";"2.8.2";2;"Never, and I mean never, works when needed";"If you want to look at nothing they’re great. But, whenever someone or something is moving around in the cameras area it never works. You get the previous image when it did work and a loading icon spinning in perpetuity. By the time the camera loads whatever was there is long gone with no video to save. 

The delay is excessive as well. It is like a full second and I understand the relay but it is significant. 

The image is clear, when it works, and the light is decorative and of good quality. Much to be desired camera wise though. It is not a substitute for an actual surveillance system.";"2021-04-23T11:27:18-07:00";"https://itunes.apple.com/us/review?id=951258324&type=Purple%20Software";"951258324";111;"en";"POSITIVE"
4;7476015934;"IM LP";"https://itunes.apple.com/us/reviews/id14974553";"2.9.0";1;"Kuna New Security Update iOS devices";"Was very disappointed to discover that important security updates did not load on my iOS device since Apple no longer supports updates on iPhone 6 + models. Now there is nothing wrong with my cellphone mechanically or cosmetically, looks like new. The disappointment is that Kuna is a software that is installed on my iPhone 6 it no longer can load new version updates from Apple so am unable to install Kuna important security update 2.9.0. Now I ask you Kuna, does this seem right to you. If Apple does not see the importance for the end-user to access Kuna important security updates then why does Kuna do something to bring this issue for discussion. Kuna, do you value your customers? Does the Kuna security brand have loyalty to its end-users? Then why has Kuna not considering the needs of its users when it come to security updates not being restricted by the decision of Apple. Please help give us a voice and help Apple to do the right thing.";"2021-06-17T13:21:45-07:00";"https://itunes.apple.com/us/review?id=951258324&type=Purple%20Software";"951258324";170;"en";"POSITIVE"
5;7140864082;"dgdw";"https://itunes.apple.com/us/reviews/id28450664";"2.8.2";4;"A good purchase";"We have three Kuna cameras that have been on our house for years now.  They’ve just worked, we get alerts as expected and no major issues.  
The only missing feature (and why I’m knocking off a star) is the development team opening this app up to Apple Silicon Macs as Blink has with their cameras (we also have several Blink cameras). One of my biggest complaints with both systems (and many other apps these days) was they’re only accessible from phones and tablets. This would fix that issue and, based on what I’m reading, doesn’t seem to be high effort unless they decide to also do optimizations which I don’t see as necessary";"2021-03-24T16:06:09-07:00";"https://itunes.apple.com/us/review?id=951258324&type=Purple%20Software";"951258324";113;"en";"NEGATIVE"
6;6840119490;"Marty84736268";"https://itunes.apple.com/us/reviews/id457466391";"2.8.0";2;"Used to work better. Camera do but support 5ghz";"App is now crashing consistently every other launch on my older iPhone 6s.  Will see if newer phone has same issue

One feature severely missing is dual band support.  These cameras only operate in 2.4 GHz frequency which is very crowded and will cause you camera to go offline frequently. This means missed recordings!  This was the car when my neighbors truck was stolen and my front door camera was offline at the time and missed the theft.

Very disappointed and I am now looking to replace my 4 cameras with hardwired ones from another vendor.";"2021-01-06T20:47:06-07:00";"https://itunes.apple.com/us/review?id=951258324&type=Purple%20Software";"951258324";96;"en";"NEGATIVE"
7;6641807671;"This gsme suckssss";"https://itunes.apple.com/us/reviews/id86474381";"2.8.0";2;"CRASHES SLOW LOAD";"When I first got KUNA it was so fast app never crashed cameras would load quick after opening the app.

Now... crashes allllll the time sometimes need to open close the app multiple times for it to finally stream. When it does open and I click on a live it takes forever to load... I have 4 channels it’s a real big headache. Luckily the preview before you open the app usually works so atleast I get an idea who’s here. 

Please fix the crashes and go back to the update of when the cameras would stream quick.";"2020-11-13T13:56:51-07:00";"https://itunes.apple.com/us/review?id=951258324&type=Purple%20Software";"951258324";98;"en";"POSITIVE"
8;7942652065;"Dissatisfied Gamer";"https://itunes.apple.com/us/reviews/id116654591";"2.9.1";1;"More expensive in the long run than competitors";"Kuna forces you to purchase a subscription plan for more than 2hrs of historic footage. Our neighborhood had thieves trying to steal from cars just after the initial free subscription ended (that we didn’t realize we had) so we were unable to check any footage from 3hrs earlier to determine if they had tried our vehicles. This basically means without the subscription plan, you cannot check what occurred in the night where your security camera is located. 
Many competitors offer local storage or free cloud storage for days - try one of those if you’re looking for home security";"2021-10-22T12:23:02-07:00";"https://itunes.apple.com/us/review?id=951258324&type=Purple%20Software";"951258324";99;"en";"POSITIVE"
9;7693751349;"Flygirlhp";"https://itunes.apple.com/us/reviews/id103355273";"2.9.0";1;"Cameras online/offline so often";"I’ve had a paid subscription for several years. It used to be awesome. Lately my notices are delayed so much that I can’t answer the door when the people first get there and my 3 cameras all go offline all the time. Sometimes they come back automatically but lately I have to keep rebooting the whole system. It seems they are offline every time I need them. At least 1 of the 3 is offline daily this past week. I have extremely fast WiFi and a satellite that I even moved into a window close to the cameras. Doesn’t help. Ready to rip them all out.";"2021-08-14T18:06:30-07:00";"https://itunes.apple.com/us/review?id=951258324&type=Purple%20Software";"951258324";106;"en";"POSITIVE"
10;7474770227;"The R Team";"https://itunes.apple.com/us/reviews/id109762175";"2.9.0";1;"Only keep recording 2 hrs??? Seriously?";"I’ve had this camera and app for a while now (over 2 years) and I’ve decided they’re not worth the time or space in my life anymore. My biggest complaint is unless you “upgrade” to a subscription you can not keep or view the recordings beyond 2 hours from when they happen.  What if something happens in the middle of the night ??? You would never know even if the camera saw it and recorded it. Basically it’s only good for seeing who’s at the door right when you look at it.  Forget about home security! It’s a glorified overpriced door peephole.";"2021-06-17T06:20:28-07:00";"https://itunes.apple.com/us/review?id=951258324&type=Purple%20Software";"951258324";102;"en";"POSITIVE"
11;7523786431;"MzzKitKatt";"https://itunes.apple.com/us/reviews/id1070773129";"2.9.0";2;"Need Upgrades";"I definitely agree with others. I’ve had these lights for years but I stopped using them. When I moved, I decided to reinstalled them in my new home I thought things would have changed/upgraded with Kuna app by now. I was wrong nothing had changed/upgraded since 2018 including delays with the recording or sometimes you won’t capture a recording, that’s not good. What’s going on with the developer? These would be great lights if Kuna would catch up with time and UPGRADE them so they will work, correctly.";"2021-06-30T09:51:19-07:00";"https://itunes.apple.com/us/review?id=951258324&type=Purple%20Software";"951258324";88;"en";"NEGATIVE"
12;7047841395;"Stinkfight";"https://itunes.apple.com/us/reviews/id26652337";"2.8.2";2;"Camera and App worked great!...Until....";"I’m not sure what has changed in the last month or so, but whatever it was made my floodlight nearly inoperable. It used to be wonderful. Now, it won’t stay connected to the wifi network, doesn't load the video to my  phone, and because it won’t stay connected, I can’t turn the light off when it now constantly comes on. It’s wildly irritating. The only change from my end was allowing the update from the app. Please resolve the weird issues.";"2021-02-27T23:23:35-07:00";"https://itunes.apple.com/us/review?id=951258324&type=Purple%20Software";"951258324";81;"en";"POSITIVE"
13;7904547111;"Chifffiibgergibfefvhh";"https://itunes.apple.com/us/reviews/id422555578";"2.9.1";2;"Poor quality software…";"Software is probably from the Mario bros era. Super slow images, freeze all the time, have to reset the app constantly, ohh and yes, they do look stylish, but… What does it matters most, style or reliability…?

For the price of each camera I shouldn’t have to compromise on anything, however here I am with 4 of this cameras around the property and does bug me that they cost $260 plus e/a and DON’T Work PROPERLY. 

They do deserves one star.";"2021-10-11T17:45:22-07:00";"https://itunes.apple.com/us/review?id=951258324&type=Purple%20Software";"951258324";81;"en";"POSITIVE"
14;7474449103;"Racer XD";"https://itunes.apple.com/us/reviews/id227612682";"2.9.0";5;"Best outdoor camera";"Don’t listen to the “so called bad review”. 
These people can’t screw in a light bulb without reading a how to book. Kuna works great, we’ve had no problems whatsoever. 
The app is very informative and I don’t subscribe to their service. It’s a door bell, Motion detector, security camera, and it’s well hidden. I installed it myself, very simple.";"2021-06-17T04:37:45-07:00";"https://itunes.apple.com/us/review?id=951258324&type=Purple%20Software";"951258324";60;"en";"POSITIVE"
15;7997312534;"Sith101";"https://itunes.apple.com/us/reviews/id25636614";"2.9.2";1;"Worthless as a Security Camera";"NO LIVE CAMERA FEED.! VIDEO DOWNLOAD HAS NO SOUND! AI will pick up no people so good luck getting a alert for a person at the door. Recordings never play back. Like it says in the title Worthless As A Security Camera. Trying to talk to a person Live with the speaker is a joke. They also do not respond to BBB complaints. Stay away from this worthless garbage. Going with another Camera instead when these die. I am also going to get a Ring Camera because like I said this is worthless as a security camera.";"2021-11-06T21:17:04-07:00";"https://itunes.apple.com/us/review?id=951258324&type=Purple%20Software";"951258324";97;"en";"NEGATIVE"
16;7272123053;"artlm2003";"https://itunes.apple.com/us/reviews/id18102732";"2.8.2";2;"Semi good";"Flakier than corn chips. App icon missing on my screen - have to go to Apps store and open from there. Can’t download app because it thinks it’s already there! Can’t delete and reinstall because desktop doesn’t know it’s there!! Sometimes saves videos, sometimes not. No detectable pattern. Customer service is very nice. They try to help. They don’t know wtfis wrong either.";"2021-04-27T20:35:13-07:00";"https://itunes.apple.com/us/review?id=951258324&type=Purple%20Software";"951258324";63;"en";"POSITIVE"
17;7564911743;"Moe112";"https://itunes.apple.com/us/reviews/id103688991";"2.9.0";1;"1 minute recordings only";"I been a paying user for years and still waiting for them to offer continuous recording. The worst part is you get 1 minute video and that’s it you can’t go back and play before the recording started and after as the person still in my front door and you don’t see if they leave or go to your back yard. I am switching for another service with continuous recording";"2021-07-11T09:27:31-07:00";"https://itunes.apple.com/us/review?id=951258324&type=Purple%20Software";"951258324";70;"en";"NEGATIVE"
18;6711607258;"GrampsTech";"https://itunes.apple.com/us/reviews/id484508323";"2.8.0";1;"Program crashed";"Dec 2, 2020.  We have 3 cameras running on the Kuna app.  They are all getting a good WiFi signal, but for the last couple of weeks, the feed frequently shows ""offline"" messages and requires a full off-on-reboot.  But wait, it gets worse.  Yesterday and continuing, the program loads, connects to the first camera, then crashes a few moments later.  No luck with any kind of fix so far.  So frustrating!";"2020-12-02T20:06:25-07:00";"https://itunes.apple.com/us/review?id=951258324&type=Purple%20Software";"951258324";71;"en";"NEGATIVE"
19;7861637160;"runner027";"https://itunes.apple.com/us/reviews/id6478369";"2.9.0";2;"iOS 15 video doesn’t load";"I just updated to iOS 15 and the video doesn’t load. I can hear street sounds but the camera is stuck on one frame. This is for both live and recorded video. Family members still on iOS 14 do not have this issue.";"2021-09-30T06:18:00-07:00";"https://itunes.apple.com/us/review?id=951258324&type=Purple%20Software";"951258324";43;"en";"NEGATIVE"
20;6923749574;"ghg Ohyou nowj OK";"https://itunes.apple.com/us/reviews/id143650015";"2.8.0";1;"Videos disappear or don’t happen";"I’ve had this app for a couple years and I’d say in the last 6-9 months it’s gone downhill! 

The cameras don't pick up videos that I know happened and like this morning I see several notifications of movement and I go to the videos and there’s not one there out of 8!

What good is security if it’s not working?";"2021-01-28T05:57:14-07:00";"https://itunes.apple.com/us/review?id=951258324&type=Purple%20Software";"951258324";61;"en";"POSITIVE"
21;6666167849;"deviLean23";"https://itunes.apple.com/us/reviews/id39173617";"2.8.0";2;"What happened";"Is there no support?  The cameras now keep going offline. Have reset, reconnected, turned off & back on.  There is a daily non connection.  Unfortunate because it was a good product when I first purchased so I purchased more.  Now, it’s constantly not working.";"2020-11-20T05:31:17-07:00";"https://itunes.apple.com/us/review?id=951258324&type=Purple%20Software";"951258324";44;"en";"NEGATIVE"
22;6972182892;"lawdogsouljah";"https://itunes.apple.com/us/reviews/id104330278";"2.8.0";2;"Loading problems";"Slow to load and mine just stopped working. Was great in the beginning but over time problems with motion detection and loading problems.";"2021-02-08T21:51:40-07:00";"https://itunes.apple.com/us/review?id=951258324&type=Purple%20Software";"951258324";23;"en";"NEGATIVE"
23;7886363222;"duncxxxxxxxxxxxx";"https://itunes.apple.com/us/reviews/id1304628632";"2.9.1";1;"New release does NOT WORK. LIGHT DOES NOT WORK";"release does NOT work.  Have had problems with constant on or off for no reason.  Now it will not come back ON AT ALL. I Want the OLD release back - how do i get it. At least that worked SOMETIME.  .   The light NEVER worked.   
Horrible performance - constAnt pic problems. 
It is NOT my high speed 200 wifi.   

Please advise. ASAP";"2021-10-06T18:59:18-07:00";"https://itunes.apple.com/us/review?id=951258324&type=Purple%20Software";"951258324";63;"en";"NEGATIVE"
24;7915442518;"Genyzme";"https://itunes.apple.com/us/reviews/id146845009";"2.9.1";1;"Worked for 3 years";"We have 2 of these cameras for 3 years and they’ve worked well. But two months ago one of them stopped working and now both of them have stopped working. Manufacture warranty is only for 1 year, so the tech support guy says there’s nothing else they can do .";"2021-10-14T17:42:47-07:00";"https://itunes.apple.com/us/review?id=951258324&type=Purple%20Software";"951258324";50;"en";"POSITIVE"
25;7270520844;"ThatZMoxy";"https://itunes.apple.com/us/reviews/id85054846";"2.8.2";1;"Subscription needed!";"I purchased one of these door light/camera from Costco a while back. I can’t rewind back to see any recordings without paying for premium subscription! I don’t need another subscription in my life. Just wanted a camera that I can see who was at the door yesterday.";"2021-04-27T10:06:30-07:00";"https://itunes.apple.com/us/review?id=951258324&type=Purple%20Software";"951258324";47;"en";"NEUTRAL"
26;7302027640;"pretrook";"https://itunes.apple.com/us/reviews/id24067032";"2.8.2";1;"Started good, horrible now";"App has never had features added. Syncing Companions never works anymore. Cameras have become less reliable over time. Cannot recommend this product. I’m $1000 in to Kuna lights and will eventually replace them all with something better that is HomeKit enabled.";"2021-05-05T11:52:25-07:00";"https://itunes.apple.com/us/review?id=951258324&type=Purple%20Software";"951258324";41;"en";"POSITIVE"
27;7714745921;"nan!!!!!!!'";"https://itunes.apple.com/us/reviews/id111073194";"2.9.0";1;"Needs an update";"Since ios14 cameras won’t connect, slow to load, and freeze up. I have contacted support numerous times and they tell me the cameras are too far from router. The cameras have been in the same place for years and so has the modem and router. This only started 12-18 months ago.";"2021-08-20T07:24:01-07:00";"https://itunes.apple.com/us/review?id=951258324&type=Purple%20Software";"951258324";51;"en";"POSITIVE"
28;8094612463;"I'veeliminatedallzejuice";"https://itunes.apple.com/us/reviews/id215451837";"2.9.4";1;"App Doesn’t even work anymore";"You guys are so despicable. Crappy customer service sounds like people working from home with parties going on in the background or TV, app doesn’t work, over priced, no support when camera stops working. Buy ANYTHING else other than this.";"2021-12-04T08:26:46-07:00";"https://itunes.apple.com/us/review?id=951258324&type=Purple%20Software";"951258324";40;"en";"NEGATIVE"
29;6937335084;"LiquideFeline";"https://itunes.apple.com/us/reviews/id37912558";"2.8.0";3;"Wifi unreliable on hardware makes app seem bugged";"Update to the fourth power: app is solid for me but camera wifi has significant issues. Wifi disconnects and reconnects to my network about once every 5 minutes. There is a chance this is due to my mesh network (but it’s the only way I can get reliable wifi to my smart home). This wifi bug is a long standing issue and I really hope they fix it as the hardware misses visits during this disconnect/reconnect. 

Update cubed: delete and reinstall app to fix the current set of bugs 🐛 

Another update: I have to power cycle these lights every few weeks or so else they become unreliable. In order to pick up night time activity, the AI sensitivity must be turned up extremely high. Clean spider webs 🕸 on a very regular basis else you’ll both miss alerts and get ghost alerts. 

Below is my old review. I’ve since added two more lights and have turned on AI for alerts which have changed the entire way these cameras sense people and cars. There is a lot of configuration available for the AI alerts and tweaking them all takes time!
The night sensitivity is distinctly less than daytime, but I’m still configuring AI so maybe I’ve yet to tune things in correctly. 
Kuna stopped alerting when holiday sounds have been added so I just have to keep checking the app to see if Halloween, Thanksgiving 🦃, or other holiday sounds have been added. 
Each camera style is slightly different in its night time lighting and glare. The original square camera probably has the worst glare of them all even with the additional glare blocks added, the best at lighting is probably the huge swooping light with glass that isn’t completely fogged. 
Overall great replacement for door lights!
—-
I installed the first one on the back door. Initially I received a lot of false alarms but it was pretty clear from the video that my trees were setting it off. I turned down the sensitivity to 75% and almost all false positives immediately disappeared.

The tiny camera shade had to be swapped out for one that was in the included plastic bag; this greatly decreased night glare and increased the night distance and color quality of the light. 

After a month with the back yard light I installed one on the front door and it’s performed perfectly. I may have to adjust sensitivity for blowing plants but haven’t had to yet!

The light isn’t perfect but I love it for what it is. As always these cameras require good WiFi -outdoors- where they’re installed. Most problem installs are probably related to people not understanding WiFi signal quality. A repeater near the light -might- fix most of these problems (depending on the house!)

There is a quirk with notifications: alerts appear but then quickly disappear. Often I will only see an alert if I’m using my phone at the same time it shows up.";"2021-01-31T10:40:58-07:00";"https://itunes.apple.com/us/review?id=951258324&type=Purple%20Software";"951258324";493;"en";"POSITIVE"
30;7280987418;"Wschneidj";"https://itunes.apple.com/us/reviews/id108994268";"2.8.2";1;"Unresponsive support";"I bought a new house that came with Kuna smart lights.  I was working with Support to get the lights transferred to my new Kuna account and they told me I needed to wait 72 hours.  After 72 hours I contacted Kuna support again and they were unresponsive and ghosted me.  Go with Ring.  Nest and Ring are much more reliable.";"2021-04-30T06:42:08-07:00";"https://itunes.apple.com/us/review?id=951258324&type=Purple%20Software";"951258324";61;"en";"POSITIVE"
31;7517073540;"Dugchek";"https://itunes.apple.com/us/reviews/id189078449";"2.9.0";1;"Doug";"It WAS a good setup for the past few years. Last few months (after software upgrades) it locks up, makes my iphone freeze. When phone turned sideways for full screen, does nothing.";"2021-06-28T15:50:34-07:00";"https://itunes.apple.com/us/review?id=951258324&type=Purple%20Software";"951258324";32;"en";"POSITIVE"
